conference,url,title,authors,abstract,citations
emnlp,https://aclanthology.org/D15-1305.pdf,Reinforcing the Topic of Embeddings with Theta Pure Dependence for Text Classification,"Ning Xing,Yuexian Hou,Peng Zhang,Wenjie Li,Dawei Song",None,0
emnlp,https://aclanthology.org/D15-1306.pdf,That’s So Annoying!!!: A Lexical and Frame-Semantic Embedding Based Data Augmentation Approach to Automatic Categorization of Annoying Behaviors using #petpeeve Tweets,"William Yang Wang,Diyi Yang",None,180
emnlp,https://aclanthology.org/D15-1307.pdf,Detection of Steganographic Techniques on Twitter,"Alex Wilson,Phil Blunsom,Andrew Ker",None,6
emnlp,https://aclanthology.org/D15-1308.pdf,#SupportTheCause: Identifying Motivations to Participate in Online Health Campaigns,"Dong Nguyen,Tijs van den Broek,Claudia Hauff,Djoerd Hiemstra,Michel Ehrenhard",None,0
emnlp,https://aclanthology.org/D15-1309.pdf,An Analysis of Domestic Abuse Discourse on Reddit,"Nicolas Schrading,Cecilia Ovesdotter Alm,Ray Ptucha,Christopher Homan",None,64
emnlp,https://aclanthology.org/D15-1310.pdf,Twitter-scale New Event Detection via K-term Hashing,"Dominik Wurzer,Victor Lavrenko,Miles Osborne",None,33
emnlp,https://aclanthology.org/D15-1311.pdf,Classifying Tweet Level Judgements of Rumours in Social Media,"Michal Lukasik,Trevor Cohn,Kalina Bontcheva",None,64
emnlp,https://aclanthology.org/D15-1312.pdf,Identification and Verification of Simple Claims about Statistical Properties,"Andreas Vlachos,Sebastian Riedel",None,42
