conference,url,title,authors,abstract,citations
aaai,https://www.aaai.org/ocs/index.php/AAAI/AAAI16/paper/view/12008/12099,Efficient Spatio-Temporal Tactile Object Recognition with Randomized Tiling Convolutional Networks in a Hierarchical Fusion Strategy,"Lele Cao, Ramamohanarao Kotagiri, Fuchun Sun, Hongbo Li, Wenbing Huang, Zay Maung Maung Aye","Robotic tactile recognition aims at identifying target objects or environments from tactile sensory readings. The advancement of unsupervised feature learning and biological tactile sensing inspire us proposing the model of 3T-RTCN that performs spatio-temporal feature representation and fusion for tactile recognition. It decomposes tactile data into spatial and temporal threads, and incorporates the strength of randomized tiling convolutional networks. Experimental evaluations show that it outperforms some state-of-the-art methods with a large margin regarding recognition accuracy, robustness, and fault-tolerance; we also achieve an order-of-magnitude speedup over equivalent networks with pretraining and finetuning. Practical suggestions and hints are summarized in the end for effectively handling the tactile data.",25
aaai,https://www.aaai.org/ocs/index.php/AAAI/AAAI16/paper/view/12435/12100,Continual Planning in Golog,"Till Hofmann, Tim Niemueller, Jens Claßen, Gerhard Lakemeyer","To solve ever more complex and longer tasks, mobile robots need to generate more elaborate plans and must handle dynamic environments and incomplete knowledge. We address this challenge by integrating two seemingly different approaches — PDDL-based planning for efficient plan generation and Golog for highly expressive behavior specification — in a coherent framework that supports continual planning. The latter allows to interleave plan generation and execution through assertions, which are placeholder actions that are dynamically expanded into conditional sub-plans (using classical planners) once a replanning condition is satisfied. We formalize and implement continual planning in Golog which was so far only supported in PDDL-based systems. This enables combining the execution of generated plans with regular Golog programs and execution monitoring. Experiments on autonomous mobile robots show that the approach supports expressive behavior specification combined with efficient sub-plan generation to handle dynamic environments and incomplete knowledge in a unified way.",26
aaai,https://www.aaai.org/ocs/index.php/AAAI/AAAI16/paper/view/12550/12101,Selectively Reactive Coordination for a Team of Robot Soccer Champions,"Juan Pablo Mendoza, Joydeep Biswas, Philip Cooksey, Richard Wang, Steven Klee, Danny Zhu, Manuela Veloso","CMDragons 2015 is the champion of the RoboCup Small Size League of autonomous robot soccer. The team won all of its six games, scoring a total of 48 goals and conceding 0. This unprecedented dominant performance is the result of various features, but we particularly credit our novel offense multi-robot coordination. This paper thus presents our Selectively Reactive Coordination (SRC) algorithm, consisting of two layers: A coordinated opponent-agnostic layer enables the team to create its own plans, setting the pace of the game in offense. An individual opponent-reactive action selection layer enables the robots to maintain reactivity to different opponents. We demonstrate the effectiveness of our coordination through results from RoboCup 2015, and through controlled experiments using a physics-based simulator and an automated referee.",42
aaai,https://www.aaai.org/ocs/index.php/AAAI/AAAI16/paper/view/12215/12102,Deep Tracking: Seeing Beyond Seeing Using Recurrent Neural Networks,"Peter Ondruska, Ingmar Posner","This paper presents to the best of our knowledge the first end-to-end object tracking approach which directly maps from raw sensor input to object tracks in sensor space without requiring any feature engineering or system identification in the form of plant or sensor models. Specifically, our system accepts a stream of raw sensor data at one end and, in real-time, produces an estimate of the entire environment state at the output including even occluded objects. We achieve this by framing the problem as a deep learning task and exploit sequence models in the form of recurrent neural networks to learn a mapping from sensor measurements to object tracks. In particular, we propose a learning method based on a form of input dropout which allows learning in an unsupervised manner, only based on raw, occluded sensor data without access to ground-truth annotations. We demonstrate our approach using a synthetic dataset designed to mimic the task of tracking objects in 2D laser data — as commonly encountered in robotics applications — and show that it learns to track many dynamic objects despite occlusions and the presence of sensor noise.",162
aaai,https://www.aaai.org/ocs/index.php/AAAI/AAAI16/paper/view/12542/12103,Component Caching in Hybrid Domains with Piecewise Polynomial Densities,"Vaishak Belle, Guy Van den Broeck, Andrea Passerini","Counting the models of a propositional formula is an important problem: for example, it serves as the backbone of probabilistic inference by weighted model counting. A key algorithmic insight is component caching (CC), in which disjoint components of a formula, generated dynamically during a DPLL search, are cached so that they only have to be solved once. In the recent years, driven by SMT technology and probabilistic inference in hybrid domains, there is an increasing interest in counting the models of linear arithmetic sentences. To date, however, solvers for these are block-clause implementations, which are nonviable on large problem instances. In this paper, as a first step in extending CC to hybrid domains, we show how propositional CC systems can be leveraged when limited to piecewise polynomial densities. Our experiments demonstrate a large gap in performance when compared to existing approaches based on a variety of block-clause strategies.",26
aaai,https://www.aaai.org/ocs/index.php/AAAI/AAAI16/paper/view/11766/12104,The Meta-Problem for Conservative Mal'tsev Constraints,Clement Carbonnel,"In the algebraic approach to CSP (Constraint Satisfaction Problem), the complexity of constraint languages is studied using closure operations called polymorphisms. Many of these operations are known to induce tractability of any language they preserve. We focus on the meta-problem: given a language G, decide if G has a polymorphism with nice properties. We design an algorithm that decides in polynomial-time if a constraint language has a conservative Mal'tsev polymorphism, and outputs one if one exists. As a corollary we obtain that the class of conservative Mal'tsev constraints is uniformly tractable, and we conjecture that this result remains true in the non-conservative case.",8
aaai,https://www.aaai.org/ocs/index.php/AAAI/AAAI16/paper/view/12124/12105,Steiner Tree Problems with Side Constraints Using Constraint Programming,"Diego de Uña, Graeme Gange, Peter Schachte, Peter J. Stuckey","The Steiner Tree Problem is a well know NP-complete problem that is well studied and for which fast algorithms are already available. Nonetheless, in the real world the Steiner Tree Problem is almost always accompanied by side constraints which means these approaches cannot be applied. For many problems with side constraints, only approximation algorithms are known. We introduce here a propagator for the tree constraint with explanations, as well as lower bounding techniques and a novel constraint programming approach for the Steiner Tree Problem and two of its variants. We find our propagators with explanations are highly advantageous when it comes to solving variants of this problem.",10
aaai,https://www.aaai.org/ocs/index.php/AAAI/AAAI16/paper/view/12079/12106,Alternative Filtering for the Weighted Circuit Constraint: Comparing Lower Bounds for the TSP and Solving TSPTW,"Sylvain Ducomman, Hadrien Cambazard, Bernard Penz","Many problems, and in particular routing problems, require to find one or many circuits in a weighted graph. The weights often express the distance or the travel time between vertices. We propose in this paper various filtering algorithms for the weighted circuit constraint which maintain a circuit in a weighted graph. The filtering algorithms are typical cost based filtering algorithms relying on relaxations of the Traveling Salesman Problem. We investigate three bounds and show that they are incomparable. In particular we design a filtering algorithm based on a lower bound introduced in 1981 by Christophides et al.. This bound can provide stronger filtering than the classical Held and Karp’s approach when additional information, such as the possible positions of the clients in the tour, is available. This is particularly suited for problems with side constraints such as time windows.",23
aaai,https://www.aaai.org/ocs/index.php/AAAI/AAAI16/paper/view/12495/12107,Using the Shapley Value to Analyze Algorithm Portfolios,"Alexandre Fréchette, Lars Kotthoff, Tomasz Michalak, Talal Rahwan, Holger H. Hoos, Kevin Leyton-Brown","Algorithms for NP-complete problems often have different strengths andweaknesses, and thus algorithm portfolios often outperform individualalgorithms. It is surprisingly difficult to quantify a component algorithm's contributionto such a portfolio. Reporting a component's standalone performance wronglyrewards near-clones while penalizing algorithms that have small but distinctareas of strength. Measuring a component's marginal contribution to an existingportfolio is better, but penalizes sets of strongly correlated algorithms,thereby obscuring situations in which it is essential to have at least onealgorithm from such a set. This paper argues for analyzing component algorithmcontributions via a measure drawn from coalitional game theory---the Shapleyvalue---and yields insight into a research community's progress over time. Weconclude with an application of the analysis we advocate to SAT competitions,yielding novel insights into the behaviour of algorithm portfolios, theircomponents, and the state of SAT solving technology.",30
aaai,https://www.aaai.org/ocs/index.php/AAAI/AAAI16/paper/view/11751/12108,On the Extraction of One Maximal Information Subset That Does Not Conflict with Multiple Contexts,"Éric Grégoire, Yacine Izza, Jean-Marie Lagniez","The efficient extraction of one maximal information subset that does not conflict with multiple contxts or additional information sources is a key basic issue in many A.I. domains, especially when these contexts or sources can be mutually conflicting. In this paper, this question is addressed from a computational point of view in clausal Boolean logic. A new approach is introduced that experimentally outperforms the currently most efficient technique.",5
aaai,https://www.aaai.org/ocs/index.php/AAAI/AAAI16/paper/view/12320/12109,Bidirectional Search That Is Guaranteed to Meet in the Middle,"Robert C. Holte, Ariel Felner, Guni Sharon, Nathan R. Sturtevant","We present MM, the first bidirectional heuristic search algorithm whose forward and backward searches are guaranteed to ''meet in the middle'', i.e. never expand a node beyond the solution midpoint. We also present a novel framework for comparing MM, A*, and brute-force search, and identify conditions favoring each algorithm. Finally, we present experimental results that support our theoretical analysis.",58
aaai,https://www.aaai.org/ocs/index.php/AAAI/AAAI16/paper/view/12360/12110,Breaking More Composition Symmetries Using Search Heuristics,"Jimmy H. M. Lee, Zichen Zhu","The pruning power of partial symmetry breaking depends on the given subset of symmetries to break as well as the interactions among symmetry breaking constraints. In the context of Partial Symmetry Breaking During Search (ParSBDS), the search order determines the set of symmetry breaking constraints to add and thus also makes an impact on node and solution pruning. In this paper, we give the first formal characterization of the pruning behavior of ParSBDS and its improved variants. Introducing the notion of Dominance-Completeness (DC-ness), we show that ParSBDS and variants eliminate the symmetry group of the given subset of symmetries if the resultant search tree is DC, and give an example scenario. Unfortunately, building a DC tree is not always possible. We propose two search heuristics with the aim of having more nodes dominated and thus also pruned during search. Extensive experimentation demonstrates how the proposed heuristics and their combination can drastically reduce the solution set size, search space and runtime when compared against the state-of-the-art static and dynamic symmetry breaking methods.",3
aaai,https://www.aaai.org/ocs/index.php/AAAI/AAAI16/paper/view/12357/12111,Increasing Nogoods in Restart-Based Search,"Jimmy H. M. Lee, Christian Schulte, Zichen Zhu","Restarts are an important technique to make search more robust. This paper is concerned with how to maintain and propagate nogoods recorded from restarts efficiently. It builds on reduced nld-nogoods introduced for restarts and increasing nogoods introduced for symmetry breaking. The paper shows that reduced nld-nogoods extracted from a single restart are in fact increasing, which can thus benefit from the efficient propagation algorithm of the incNGs global constraint. We present a lighter weight filtering algorithm for incNGs in the context of restart-based search using dynamic event sets (dynamic subscriptions). We show formally that the lightweight version enforces GAC on each nogood while reducing the number of subscribed decisions. The paper also introduces an efficient approximation to nogood minimization such that all shortened reduced nld-nogoods from the same restart are also increasing and can be propagated with the new filtering algorithm. Experimental results confirm that our lightweight filtering algorithm and approximated nogood minimization successfully trade a slight loss in pruning for considerably better efficiency, and hence compare favorably against existing state-of-the-art techniques.",15
aaai,https://www.aaai.org/ocs/index.php/AAAI/AAAI16/paper/view/12451/12112,Exponential Recency Weighted Average Branching Heuristic for SAT Solvers,"Jia Hui Liang, Vijay Ganesh, Pascal Poupart, Krzysztof Czarnecki","Modern conflict-driven clause-learning SAT solvers routinely solve large real-world instances with millions of clauses and variables in them. Their success crucially depends on effective branching heuristics. In this paper, we propose a new branching heuristic inspired by the exponential recency weighted average algorithm used to solve the bandit problem. The branching heuristic, we call CHB, learns online which variables to branch on by leveraging the feedback received from conflict analysis. We evaluated CHB on 1200 instances from the SAT Competition 2013 and 2014 instances, and showed that CHB solves significantly more instances than VSIDS, currently the most effective branching heuristic in widespread use. More precisely, we implemented CHB as part of the MiniSat and Glucose solvers, and performed an apple-to-apple comparison with their VSIDS-based variants. CHB-based MiniSat (resp. CHB-based Glucose) solved approximately 16.1% (resp. 5.6%) more instances than their VSIDS-based variants. Additionally, CHB-based solvers are much more efficient at constructing first preimage attacks on step-reduced SHA-1 and MD5 cryptographic hash functions, than their VSIDS-based counterparts. To the best of our knowledge, CHB is the first branching heuristic to solve significantly more instances than VSIDS on a large, diverse benchmark of real-world instances.",79
aaai,https://www.aaai.org/ocs/index.php/AAAI/AAAI16/paper/view/12065/12113,Counting-Based Search for Constraint Optimization Problems,Gilles Pesant,"Branching heuristics based on counting solutions in constraints have been quite good at guiding search  to solve constraint satisfaction problems. But do they perform as well for constraint optimization problems? We propose an adaptation of counting-based search for optimization, show how to modify solution density computation for some of the most frequently-occurring constraints, and empirically evaluate its performance on several benchmark problems.",22
aaai,https://www.aaai.org/ocs/index.php/AAAI/AAAI16/paper/view/12510/12114,Are Elephants Bigger than Butterflies? Reasoning about Sizes of Objects,"Hessam Bagherinezhad, Hannaneh Hajishirzi, Yejin Choi, Ali Farhadi","Human vision greatly benefits from the information about sizes of objects. The role of size in several visual reasoning tasks has been thoroughly explored in human perception and cognition. However, the impact of the information about sizes of objects is yet to be determined in AI. We postulate that this is mainly attributed to the lack of a comprehensive repository of size information. In this paper, we introduce a method to automatically infer object sizes, leveraging visual and textual information from web. By maximizing the joint likelihood of textual and visual observations, our method learns reliable relative size estimates, with no explicit human supervision. We introduce the relative size dataset and show that our method outperforms competitive textual and visual baselines in reasoning about size comparisons.",37
aaai,https://www.aaai.org/ocs/index.php/AAAI/AAAI16/paper/view/12040/12115,Deep Quantization Network for Efficient Image Retrieval,"Yue Cao, Mingsheng Long, Jianmin Wang, Han Zhu, Qingfu Wen","Hashing has been widely applied to approximate nearest neighbor search for large-scale multimedia retrieval. Supervised hashing improves the quality of hash coding by exploiting the semantic similarity on data pairs and has received increasing attention recently. For most existing supervised hashing methods for image retrieval, an image is first represented as a vector of hand-crafted or machine-learned features, then quantized by a separate quantization step that generates binary codes. However, suboptimal hash coding may be produced, since the quantization error is not statistically minimized and the feature representation is not optimally compatible with the hash coding. In this paper, we propose a novel Deep Quantization Network (DQN) architecture for supervised hashing, which learns image representation for hash coding and formally control the quantization error. The DQN model constitutes four key components: (1) a sub-network with multiple convolution-pooling layers to capture deep image representations; (2) a fully connected bottleneck layer to generate dimension-reduced representation optimal for hash coding; (3) a pairwise cosine loss layer for similarity-preserving learning; and (4) a product quantization loss for controlling hashing quality and the quantizability of bottleneck representation. Extensive experiments on standard image retrieval datasets show the proposed DQN model yields substantial boosts over latest state-of-the-art hashing methods.",0
aaai,https://www.aaai.org/ocs/index.php/AAAI/AAAI16/paper/view/12499/12116,Dynamic Concept Composition for Zero-Example Event Detection,"Xiaojun Chang, Yi Yang, Guodong Long, Chengqi Zhang, Alexander G. Hauptmann","In this paper, we focus on automatically detecting events in unconstrained videos without the use of any visual training exemplars. In principle, zero-shot learning makes it possible to train an event detection model based on the assumption that events (e.g. birthday party) can be described by multiple mid-level semantic concepts (e.g. ``blowing candle'', ``birthday cake''). Towards this goal, we first pre-train a bundle of concept classifiers using data from other sources. Then we evaluate the semantic correlation of each concept w.r.t. the event of interest and pick up the relevant concept classifiers, which are applied on all test videos to get multiple prediction score vectors. While most existing systems combine the predictions of the concept classifiers with fixed weights, we propose to learn the optimal weights of the concept classifiers for each testing video by exploring a set of online available videos with free-form text descriptions of their content. To validate the effectiveness of the proposed approach, we have conducted extensive experiments on the latest TRECVID MEDTest 2014, MEDTest 2013 and CCV dataset. The experimental results confirm the superiority of the proposed approach.",48
aaai,https://www.aaai.org/ocs/index.php/AAAI/AAAI16/paper/view/11893/12117,Face Video Retrieval via Deep Learning of Binary Hash Representations,"Zhen Dong, Su Jia, Tianfu Wu, Mingtao Pei","Retrieving faces from large mess of videos is an attractive research topic with wide range of applications. Its challenging problems are large intra-class variations, and tremendous time and space complexity. In this paper, we develop a new deep convolutional neural network (deep CNN) to learn discriminative and compact binary representations of faces for face video retrieval. The network integrates feature extraction and hash learning into a unified optimization framework for the optimal compatibility of feature extractor and hash functions. In order to better initialize the network, the low-rank discriminative binary hashing is proposed to pre-learn hash functions during the training procedure. Our method achieves excellent performances on two challenging TV-Series datasets.",39
aaai,https://www.aaai.org/ocs/index.php/AAAI/AAAI16/paper/view/12165/12118,Zero-Shot Event Detection by Multimodal Distributional Semantic Embedding of Videos,"Mohamed Elhoseiny, Jingen Liu, Hui Cheng, Harpreet Sawhney, Ahmed Elgammal","We propose a new zero-shot Event-Detection method by Multi-modal Distributional Semantic embedding of videos. Our model embeds object and action concepts as well as other available modalities from videos into a distributional semantic space. To our knowledge, this is the first Zero-Shot event detection model that is built on top of distributional semantics and extends it in the following directions: (a) semantic embedding of multimodal information in videos (with focus on the visual modalities), (b) semantic embedding of concepts definitions, and (c) retrieve videos by free text event query (e.g., ""changing a vehicle tire"") based on their content. We first embed the video into the multi-modal semantic space and then measure the similarity between videos with the event query in free text form. We validated our method on the large TRECVID MED (Multimedia Event Detection) challenge. Using only the event title as a query, our method outperformed the state-the-art that uses big descriptions from 12.6\% to 13.5\% with MAP metric and from 0.73 to 0.83 with ROC-AUC metric. It is also an order of magnitude faster.",22
aaai,https://www.aaai.org/ocs/index.php/AAAI/AAAI16/paper/view/12259/12119,Concepts Not Alone: Exploring Pairwise Relationships for Zero-Shot Video Activity Recognition,"Chuang Gan, Ming Lin, Yi Yang, Gerard de Melo, Alexander G. Hauptmann","Vast quantities of videos are now being captured at astonishing rates, but the majority of these are not labelled. To cope with such data, we consider the task of content-based activity recognition in videos without any manually labelled examples, also known as zero-shot video recognition. To achieve this, videos are represented in terms of detected visual concepts, which are then scored as relevant or irrelevant according to their similarity with a given textual query. In this paper, we propose a more robust approach for scoring concepts in order to alleviate many of the brittleness and low precision problems of previous work. Not only do we jointly consider semantic relatedness, visual reliability, and discriminative power. To handle noise and non-linearities in the ranking scores of the selected concepts, we propose a novel pairwise order matrix approach for score aggregation. Extensive experiments on the large-scale TRECVID Multimedia Event Detection data show the superiority of our approach.",69
aaai,https://www.aaai.org/ocs/index.php/AAAI/AAAI16/paper/view/11975/12120,Transductive Zero-Shot Recognition via Shared Model Space Learning,"Yuchen Guo, Guiguang Ding, Xiaoming Jin, Jianmin Wang","Zero-shot Recognition (ZSR) is to learn recognition models for novel classes without labeled data. It is a challenging task and has drawn considerable attention in recent years. The basic idea is to transfer knowledge from seen classes via the shared attributes. This paper focus on the transductive ZSR, i.e., we have unlabeled data for novel classes. Instead of learning models for seen and novel classes separately as in existing works, we put forward a novel joint learning approach which learns the shared model space (SMS) for models such that the knowledge can be effectively transferred between classes using the attributes. An effective algorithm is proposed for optimization. We conduct comprehensive experiments on three benchmark datasets for ZSR. The results demonstrates that the proposed SMS can significantly outperform the state-of-the-art related approaches which validates its efficacy for the ZSR task.",98
