conference,url,title,authors,abstract,citations
aaai,https://www.aaai.org/ocs/index.php/AAAI/AAAI16/paper/view/11931/11568,From Tweets to Wellness: Wellness Event Detection from Twitter Streams,"Mohammad Akbari, Xia Hu, Nie Liqiang, Tat-Seng Chua","Social media platforms have become the most popular means for users to share what is happening around them. The abundance and growing usage of social media has resulted in a large repository of users' social posts, which provides a stethoscope for inferring individuals' lifestyle and wellness. As users' social accounts implicitly reflect their habits, preferences, and feelings, it is feasible for us to monitor and understand the wellness of users by harvesting social media data towards a healthier lifestyle. As a first step towards accomplishing this goal, we propose to automatically extract wellness events from users' published social contents. Existing approaches for event extraction are not applicable to personal wellness events due to its domain nature characterized by plenty of noise and variety in data, insufficient samples, and inter-relation among events.To tackle these problems, we propose an optimization learning framework that utilizes the content information of microblogging messages as well as the relations between event categories. By imposing a sparse constraint on the learning model, we also tackle the problems arising from noise and variation in microblogging texts. Experimental results on a real-world dataset from Twitter have demonstrated the superior performance of our framework.",67
aaai,https://www.aaai.org/ocs/index.php/AAAI/AAAI16/paper/view/11807/11569,"""8 Amazing Secrets for Getting More Clicks"": Detecting Clickbaits in News Streams Using Article Informality","Prakhar Biyani, Kostas Tsioutsiouliklis, John Blackmer","Clickbaits are articles with misleading titles, exaggerating the content on the landing page. Their goal is to entice users to click on the title in order to monetize the landing page. The content on the landing page is usually of low quality. Their presence in user homepage stream of news aggregator sites (e.g., Yahoo news, Google news) may adversely impact user experience. Hence, it is important to identify and demote or block them on homepages. In this paper, we present a machine-learning model to detect clickbaits. We use a variety of features and show that the degree of informality of a webpage (as measured by different metrics) is a strong indicator of it being a clickbait. We conduct extensive experiments to evaluate our approach and analyze properties of clickbait and non-clickbait articles. Our model achieves high performance (74.9% F-1 score) in predicting clickbaits.",149
aaai,https://www.aaai.org/ocs/index.php/AAAI/AAAI16/paper/view/12217/11570,Business-Aware Visual Concept Discovery from Social Media for Multimodal Business Venue Recognition,"Bor-Chun Chen, Yan-Ying Chen, Francine Chen, Dhiraj Joshi","Image localization is important for marketing and recommendation of local business; however, the level of granularity is still a critical issue. Given a consumer photo and its rough GPS information, we are interested in extracting the fine-grained location information, i.e. business venues, of the image. To this end, we propose a novel framework for business venue recognition. The framework mainly contains three parts. First, business-aware visual concept discovery: we mine a set of concepts that are useful for business venue recognition based on three guidelines including business awareness, visually detectable, and discriminative power. We define concepts that satisfy all of these three criteria as business-aware visual concept. Second, business-aware concept detection by convolutional neural networks (BA-CNN): we propose a new network configuration that can incorporate semantic signals mined from business reviews for extracting semantic concept features from a query image. Third, multimodal business venue recognition: we extend visually detected concepts to multimodal feature representations that allow a test image to be associated with business reviews and images from social media for business venue recognition. The experiments results show the visual concepts detected by BA-CNN can achieve up to 22.5% relative improvement for business venue recognition compared to the state-of-the-art convolutional neural network features. Experiments also show that by leveraging multimodal information from social media we can further boost the performance, especially when the database images belonging to each business venue are scarce.",12
aaai,https://www.aaai.org/ocs/index.php/AAAI/AAAI16/paper/view/11994/11571,Capturing Semantic Correlation for Item Recommendation in Tagging Systems,"Chaochao Chen, Xiaolin Zheng, Yan Wang, Fuxing Hong, Deren Chen","The popularity of tagging systems provides a great opportunity to improve the performance of item recommendation. Although existing approaches use topic modeling to mine the semantic information of items by grouping the tags labelled for items, they overlook an important property that tags link users and items as a bridge. Thus these methods cannot deal with the data sparsity without commonly rated items (DS-WO-CRI) problem, limiting their recommendation performance. Towards solving this challenging problem, we propose a novel tag and rating based collaborative filtering (CF) model for item recommendation, which first uses topic modeling to mine the semantic information of tags for each user and for each item respectively, and then incorporates the semantic information into matrix factorization to factorize rating information and to capture the bridging feature of tags and ratings between users and items.As a result, our model captures the semantic correlation between users and items, and is able to greatly improve recommendation performance, especially in DS-WO-CRI situations.Experiments conducted on two popular real-world datasets demonstrate that our proposed model significantly outperforms the conventional CF approach, the state-of-the-art social relation based CF approach, and the state-of-the-art topic modeling based CF approaches in terms of both precision and recall, and it is an effective approach to the DS-WO-CRI problem.",31
aaai,https://www.aaai.org/ocs/index.php/AAAI/AAAI16/paper/view/11849/11572,Identifying Sentiment Words Using an Optimization Model with L1 Regularization,"Zhi-Hong Deng, Hongliang Yu, Yunlun Yang","Sentiment word identification is a fundamental work in numerous applications of sentiment analysis and opinion mining, such as review mining, opinion holder finding, and twitter classification. In this paper, we propose an optimization model with L1 regularization, called ISOMER, for identifying the sentiment words from the corpus. Our model can employ both seed words and documents with sentiment labels, different from most existing researches adopting seed words only. The L1 penalty in the objective function yields a sparse solution since most candidate words have no sentiment. The experiments on the real datasets show that ISOMER outperforms the classic approaches, and that the lexicon learned by ISOMER can be effectively adapted to document-level sentiment analysis.",8
aaai,https://www.aaai.org/ocs/index.php/AAAI/AAAI16/paper/view/11903/11573,Community-Based Question Answering via Heterogeneous Social Network Learning,"Hanyin Fang, Fei Wu, Zhou Zhao, Xinyu Duan, Yueting Zhuang, Martin Ester","Community-based question answering (cQA) sites have accumulated vast amount of questions and corresponding crowdsourced answers over time. How to efficiently share the underlying information and knowledge from reliable (usually highly-reputable) answerers has become an increasingly popular research topic. A major challenge in cQA tasks is the accurate matching of high-quality answers w.r.t given questions. Many of traditional approaches likely recommend corresponding answers merely depending on the content similarity between questions and answers, therefore suffer from the sparsity bottleneck of cQA data. In this paper, we propose a novel framework which encodes not only the contents of question-answer(Q-A) but also the social interaction cues in the community to boost the cQA tasks. More specifically, our framework collaboratively utilizes the rich interaction among questions, answers and answerers to learn the relative quality rank of different answers w.r.t a same question. Moreover, the information in heterogeneous social networks is comprehensively employed to enhance the quality of question-answering (QA) matching by our deep random walk learning framework. Extensive experiments on a large-scale dataset from a real world cQA site show that leveraging the heterogeneous social information indeed achieves better performance than other state-of-the-art cQA methods.",78
aaai,https://www.aaai.org/ocs/index.php/AAAI/AAAI16/paper/view/12324/11574,"College Towns, Vacation Spots, and Tech Hubs: Using Geo-Social Media to Model and Compare Locations","Hancheng Ge, James Caverlee","In this paper, we explore the potential of geo-social media to construct location-based interest profiles to uncover the hidden relationships among disparate locations. Through an investigation of millions of geo-tagged Tweets, we construct a per-city interest model based on fourteen high-level categories (e.g., technology, art, sports). These interest models support the discovery of related locations that are connected based on these categorical perspectives (e.g., college towns or vacation spots) but perhaps not on the individual tweet level. We then connect these city-based interest models to underlying demographic data. By building multivariate multiple linear regression (MMLR) and neural network (NN) models we show how a location's interest profile may be estimated based purely on its demographics features.",1
aaai,https://www.aaai.org/ocs/index.php/AAAI/AAAI16/paper/view/12361/11575,Inferring a Personalized Next Point-of-Interest Recommendation Model with Latent Behavior Patterns,"Jing He, Xin Li, Lejian Liao, Dandan Song, William K. Cheung","In this paper, we address the problem of personalized next Point-of-interest (POI) recommendation which has become an important and very challenging task in location-based social networks (LBSNs), but not well studied yet. With the conjecture that, under different contextual scenario, human exhibits distinct mobility patterns, we attempt here to jointly model the next POI recommendation under the influence of user's latent behavior pattern. We propose to adopt a third-rank tensor to model the successive check-in behaviors. By incorporating softmax function to fuse the personalized Markov chain with latent pattern, we furnish a Bayesian Personalized Ranking (BPR) approach and derive the optimization criterion accordingly. Expectation Maximization (EM) is then used to estimate the model parameters. Extensive experiments on two large-scale LBSNs datasets demonstrate the significant improvements of our model over several state-of-the-art methods.",152
aaai,https://www.aaai.org/ocs/index.php/AAAI/AAAI16/paper/view/11914/11576,VBPR: Visual Bayesian Personalized Ranking from Implicit Feedback,"Ruining He, Julian McAuley","Modern recommender systems model people and items by discovering or `teasing apart' the underlying dimensions that encode the properties of items and users' preferences toward them. Critically, such dimensions are uncovered based on user feedback, often in implicit form (such as purchase histories, browsing logs, etc.); in addition, some recommender systems make use of side information, such as product attributes, temporal information, or review text.However one important feature that is typically ignored by existing personalized recommendation and ranking methods is the visual appearance of the items being considered. In this paper we propose a scalable factorization model to incorporate visual signals into predictors of people's opinions, which we apply to a selection of large, real-world datasets. We make use of visual features extracted from product images using (pre-trained) deep networks, on top of which we learn an additional layer that uncovers the visual dimensions that best explain the variation in people's feedback. This not only leads to significantly more accurate personalized ranking methods, but also helps to alleviate cold start issues, and qualitatively to analyze the visual dimensions that influence people's opinions.",509
aaai,https://www.aaai.org/ocs/index.php/AAAI/AAAI16/paper/view/12189/11577,Improved Neural Machine Translation with SMT Features,"Wei He, Zhongjun He, Hua Wu, Haifeng Wang","Neural machine translation (NMT) conducts end-to-end translation with a source language encoder and a target language decoder, making promising translation performance. However, as a newly emerged approach, the method has some limitations. An NMT system usually has to apply a vocabulary of certain size to avoid the time-consuming training and decoding, thus it causes a serious out-of-vocabulary problem. Furthermore, the decoder lacks a mechanism to guarantee all the source words to be translated and usually favors short translations, resulting in fluent but inadequate translations. In order to solve the above problems, we incorporate statistical machine translation (SMT) features, such as a translation model and an n-gram language model, with the NMT model under the log-linear framework. Our experiments show that the proposed method significantly improves the translation quality of the state-ofthe-art NMT system on Chinese-to-English translation tasks. Our method produces a gain of up to 2.33 BLEU score on NIST open test sets.",116
aaai,https://www.aaai.org/ocs/index.php/AAAI/AAAI16/paper/view/12378/11578,A Scalable Framework to Choose Sellers in E-Marketplaces Using POMDPs,"Athirai A. Irissappane, Frans A. Oliehoek, Jie Zhang","In multiagent e-marketplaces, buying agents need to select good sellers by querying other buyers (called advisors). Partially Observable Markov Decision Processes (POMDPs) have shown to be an effective framework for optimally selecting sellers by selectively querying advisors. However, current solution methods do not scale to hundreds or even tens of agents operating in the e-market. In this paper, we propose the Mixture of POMDP Experts (MOPE) technique, which exploits the inherent structure of trust-based domains, such as the seller selection problem in e-markets, by aggregating the solutions of smaller sub-POMDPs. We propose a number of variants of the MOPE approach that we analyze theoretically and empirically. Experiments show that MOPE can scale up to a hundred agents thereby leveraging the presence of more advisors to significantly improve buyer satisfaction.",6
aaai,https://www.aaai.org/ocs/index.php/AAAI/AAAI16/paper/view/12229/11579,Fusing Social Networks with Deep Learning for Volunteerism Tendency Prediction,"Yongpo Jia, Xuemeng Song, Jingbo Zhou, Li Liu, Liqiang Nie, David S. Rosenblum","Social networks contain a wealth of useful information. In this paper, we study a challenging task for integrating users' information from multiple heterogeneous social networks to gain a comprehensive understanding of users' interests and behaviors. Although much effort has been dedicated to study this problem, most existing approaches adopt linear or shallow models to fuse information from multiple sources. Such approaches cannot properly capture the complex nature of and relationships among different social networks. Adopting deep learning approaches to learning a joint representation can better capture the complexity, but this neglects measuring the level of confidence in each source and the consistency among different sources. In this paper, we present a framework for multiple social network learning, whose core is a novel model that fuses social networks using deep learning with source confidence and consistency regularization. To evaluate the model, we apply it to predict individuals' tendency to volunteerism. With extensive experimental evaluations, we demonstrate the effectiveness of our model, which outperforms several state-of-the-art approaches in terms of precision, recall and F1-score.",24
aaai,https://www.aaai.org/ocs/index.php/AAAI/AAAI16/paper/view/12064/11580,Detect Overlapping Communities via Ranking Node Popularities,"Di Jin, Hongcui Wang, Jianwu Dang, Dongxiao He, Weixiong Zhang","Detection of overlapping communities has drawn much attention lately as they are essential properties of real complex networks. Despite its influence and popularity, the well studied and widely adopted stochastic model has not been made effective for finding overlapping communities. Here we extend the stochastic model method to detection of overlapping communities with the virtue of autonomous determination of the number of communities. Our approach hinges upon the idea of ranking node popularities within communities and using a Bayesian method to shrink communities to optimize an objective function based on the stochastic generative model. We evaluated the novel approach, showing its superior performance over five state-of-the-art methods, on large real networks and synthetic networks with ground-truths of overlapping communities.",24
aaai,https://www.aaai.org/ocs/index.php/AAAI/AAAI16/paper/view/11824/11581,Top-N Recommender System via Matrix Completion,"Zhao Kang, Chong Peng, Qiang Cheng","Top-N recommender systems have been investigated widely both in industry and academia. However, the recommendation quality is far from satisfactory. In this paper, we propose a simple yet promising algorithm. We fill the user-item matrix based on a low-rank assumption and simultaneously keep the original information. To do that, a nonconvex rank relaxation rather than the nuclear norm is adopted to provide a better rank approximation and an efficient optimization strategy is designed. A comprehensive set of experiments on real datasets demonstrates that our method pushes the accuracy of Top-N recommendation to a new level.",98
aaai,https://www.aaai.org/ocs/index.php/AAAI/AAAI16/paper/view/12445/11582,Robust Text Classification in the Presence of Confounding Bias,"Virgile Landeiro, Aron Culotta","As text classifiers become increasingly used in real-time applications, it is critical to consider not only their accuracy but also their robustness to changes in the data distribution. In this paper, we consider the case where there is a confounding variable Z that influences both the text features X and the class variable Y. For example, a classifier trained to predict the health status of a user based on their online communications may be confounded by socioeconomic variables. When the influence of Z changes from training to testing data, we find that classifier accuracy can degrade rapidly. Our approach, based on Pearl's back-door adjustment, estimates the underlying effect of a text variable on the class variable while controlling for the confounding variable. Although our goal is prediction, not causal inference, we find that such adjustments are essential to building text classifiers that are robust to confounding variables. On three diverse text classifications tasks, we find that covariate adjustment results in higher accuracy than competing baselines over a range of confounding relationships (e.g., in one setting, accuracy improves from 60% to 81%).",36
aaai,https://www.aaai.org/ocs/index.php/AAAI/AAAI16/paper/view/11900/11583,Predicting the Next Location: A Recurrent Model with Spatial and Temporal Contexts,"Qiang Liu, Shu Wu, Liang Wang, Tieniu Tan","Spatial and temporal contextual information plays a key role for analyzing user behaviors, and is helpful for predicting where he or she will go next. With the growing ability of collecting information, more and more temporal and spatial contextual information is collected in systems, and the location prediction problem becomes crucial and feasible. Some works have been proposed to address this problem, but they all have their limitations. Factorizing Personalized Markov Chain (FPMC) is constructed based on a strong independence assumption among different factors, which limits its performance. Tensor Factorization (TF) faces the cold start problem in predicting future actions. Recurrent Neural Networks (RNN) model shows promising performance comparing with PFMC and TF, but all these methods have problem in modeling continuous time interval and geographical distance. In this paper, we extend RNN and propose a novel method called Spatial Temporal Recurrent Neural Networks (ST-RNN). ST-RNN can model local temporal and spatial contexts in each layer with time-specific transition matrices for different time intervals and distance-specific transition matrices for different geographical distances. Experimental results show that the proposed ST-RNN model yields significant improvements over the competitive compared methods on two typical datasets, i.e., Global Terrorism Database (GTD) and Gowalla dataset.",583
aaai,https://www.aaai.org/ocs/index.php/AAAI/AAAI16/paper/view/11885/11584,Fortune Teller: Predicting Your Career Path,"Ye Liu, Luming Zhang, Liqiang Nie, Yan Yan, David S. Rosenblum","People go to fortune tellers in hopes of learning things about their future. A future career path is one of the topics most frequently discussed. But rather than rely on ""black arts"" to make predictions, in this work we scientifically and systematically study the feasibility of career path prediction from social network data. In particular, we seamlessly fuse information from multiple social networks to comprehensively describe a user and characterize progressive properties of his or her career path. This is accomplished via a multi-source learning framework with fused lasso penalty, which jointly regularizes the source and career-stage relatedness. Extensive experiments on real-world data confirm the accuracy of our model.",250
aaai,https://www.aaai.org/ocs/index.php/AAAI/AAAI16/paper/view/12289/11585,Predicting Online Protest Participation of Social Media Users,"Suhas Ranganath, Fred Morstatter, Xia Hu, Jiliang Tang, Suhang Wang, Huan Liu","Social media has emerged to be a popular platform for people to express their viewpoints on political protests like the Arab Spring. Millions of people use social media to communicate and mobilize their viewpoints on protests. Hence, it is a valuable tool for organizing social movements. However, the mechanisms by which protest affects the population is not known, making it difficult to estimate the number of protestors. In this paper, we are inspired by sociological theories of protest participation and propose a framework to predict from the user's past status messages and interactions whether the next post of the user will be a declaration of protest. Drawing concepts from these theories, we model the interplay between the user's status messages and messages interacting with him over time and predict whether the next post of the user will be a declaration of protest. We evaluate the framework using data from the social media platform Twitter on protests during the recent Nigerian elections and demonstrate that it can effectively predict whether the next post of a user is a declaration of protest.",16
aaai,https://www.aaai.org/ocs/index.php/AAAI/AAAI16/paper/view/11922/11586,Context-Sensitive Twitter Sentiment Classification Using Neural Network,"Yafeng Ren, Yue Zhang, Meishan Zhang, Donghong Ji","Sentiment classification on Twitter has attracted increasing research in recent years.Most existing work focuses on feature engineering according to the tweet content itself.In this paper, we propose a context-based neural network model for Twitter sentiment analysis, incorporating contextualized features from relevant Tweets into the model in the form of word embedding vectors.Experiments on both balanced and unbalanced datasets show that our proposed models outperform the current state-of-the-art.",158
aaai,https://www.aaai.org/ocs/index.php/AAAI/AAAI16/paper/view/12397/11587,ClaimEval: Integrated and Flexible Framework for Claim Evaluation Using Credibility of Sources,"Mehdi Samadi, Partha Talukdar, Manuela Veloso, Manuel Blum","The World Wide Web (WWW) has become a rapidly growing platform consisting of numerous sources which provide supporting or contradictory information about claims (e.g., ""Chicken meat is healthy""). In order to decide whether a claim is true or false, one needs to analyze content of different sources of information on the Web, measure credibility of information sources, and aggregate all these information. This is a tedious process and the Web search engines address only part of the overall problem, viz., producing only a list of relevant sources. In this paper, we present ClaimEval, a novel and integrated approach which given a set of claims to validate, extracts a set of pro and con arguments from the Web information sources, and jointly estimates credibility of sources and correctness of claims. ClaimEval uses Probabilistic Soft Logic (PSL), resulting in a flexible and principled framework which makes it easy to state and incorporate different forms of prior-knowledge. Through extensive experiments on real-world datasets, we demonstrate ClaimEval’s capability in determining validity of a set of claims, resulting in improved accuracy compared to state-of-the-art baselines.",43
