conference,url,title,authors,abstract,citations
aaai,https://www.aaai.org/ocs/index.php/AAAI/AAAI16/paper/view/12177/11731,Towards Optimal Binary Code Learning via Ordinal Embedding,"Hong Liu, Rongrong Ji, Yongjian Wu, Wei Liu","Binary code learning, a.k.a., hashing, has been recently popular due to its high efficiency in large-scale similarity search and recognition. It typically maps high-dimensional data points to binary codes, where data similarity can be efficiently computed via rapid Hamming distance. Most existing unsupervised hashing schemes pursue binary codes by reducing the quantization error from an original real-valued data space to a resulting Hamming space. On the other hand, most existing supervised hashing schemes constrain binary code learning to correlate with pairwise similarity labels. However, few methods consider ordinal relations in the binary code learning process, which serve as a very significant cue to learn the optimal binary codes for similarity search. In this paper, we propose a novel hashing scheme, dubbed Ordinal Embedding Hashing (OEH), which embeds given ordinal relations among data points to learn the ranking-preserving binary codes. The core idea is to construct a directed unweighted graph to capture the ordinal relations, and then train the hash functions using this ordinal graph to preserve the permutation relations in the Hamming space. To learn such hash functions effectively, we further relax the discrete constraints and design a stochastic gradient decent algorithm to obtain the optimal solution. Experimental results on two large-scale benchmark datasets demonstrate that the proposed OEH method can achieve superior performance over the state-of-the-arts approaches.At last, the evaluation on query by humming dataset demonstrates the OEH also has good performance for music retrieval by using user's humming or singing.",30
aaai,https://www.aaai.org/ocs/index.php/AAAI/AAAI16/paper/view/12021/11732,Recognizing Complex Activities by a Probabilistic Interval-Based Model,"Li Liu, Li Cheng, Ye Liu, Yongpo Jia, David S. Rosenblum","A key challenge in complex activity recognition is the fact that a complex activity can often be performed in several different ways, with each consisting of its own configuration of atomic actions and their temporal dependencies. This leads us to define an atomic activity-based probabilistic framework that employs Allen's interval relations to represent local temporal dependencies. The framework introduces a latent variable from the Chinese Restaurant Process to explicitly characterize these unique internal configurations of a particular complex activity as a variable number of tables.It can be analytically shown that the resulting interval network satisfies the transitivity property, and as a result, all local temporal dependencies can be retained and are globally consistent.Empirical evaluations on benchmark datasets suggest our approach significantly outperforms the state-of-the-art methods.",202
aaai,https://www.aaai.org/ocs/index.php/AAAI/AAAI16/paper/view/12471/11733,Learning Adaptive Forecasting Models from Irregularly Sampled Multivariate Clinical Data,"Zitao Liu, Milos Hauskrecht","Building accurate predictive models of clinical multivariate time series is crucial for understanding of the patient condition, the dynamics of a disease, and clinical decision making. A challenging aspect of this process is that the model should be flexible and adaptive to reflect well patient-specific temporal behaviors and this also in the case when the available patient-specific data are sparse and short span. To address this problem we propose and develop an adaptive two-stage forecasting approach for modeling multivariate, irregularly sampled clinical time series of varying lengths. The proposed model (1) learns the population trend from a collection of time series for past patients; (2) captures individual-specific short-term multivariate variability; and (3) adapts by automatically adjusting its predictions based on new observations. The proposed forecasting model is evaluated on a real-world clinical time series dataset. The results demonstrate that our approach is superior on the prediction tasks for multivariate, irregularly sampled clinical time series, and it outperforms both the population based and patient-specific time series prediction models in terms of prediction accuracy.",31
aaai,https://www.aaai.org/ocs/index.php/AAAI/AAAI16/paper/view/12274/11734,Deep Learning for Algorithm Portfolios,"Andrea Loreggia, Yuri Malitsky, Horst Samulowitz, Vijay Saraswat","It is well established that in many scenarios there is no single solver that will provide optimal performance across a wide range of problem instances. Taking advantage of this observation, research into algorithm selection is designed to help identify the best approach for each problem at hand. This segregation is usually based on carefully constructed features, designed to quickly present the overall structure of the instance as a constant size numeric vector. Based on these features, a plethora of machine learning techniques can be utilized to predict the appropriate solver to execute, leading to significant improvements over relying solely on any one solver. However, being manually constructed, the creation of good features is an arduous task requiring a great deal of knowledge of the problem domain of interest. To alleviate this costly yet crucial step, this paper presents an automated methodology for producing an informative set of features utilizing a deep neural network. We show that the presented approach completely automates the algorithm selection pipeline and is able to achieve significantly better performance than a single best solver across multiple problem domains.",54
aaai,https://www.aaai.org/ocs/index.php/AAAI/AAAI16/paper/view/11775/11735,Convolutional Neural Networks over Tree Structures for Programming Language Processing,"Lili Mou, Ge Li, Lu Zhang, Tao Wang, Zhi Jin","Programming language processing (similar to natural language processing) is a hot research topic in the field of software engineering; it has also aroused growing interest in the artificial intelligence community. However, different from a natural language sentence, a program contains rich, explicit, and complicated structural information. Hence, traditional NLP models may be inappropriate for programs. In this paper, we propose a novel tree-based convolutional neural network (TBCNN) for programming language processing, in which a convolution kernel is designed over programs' abstract syntax trees to capture structural information. TBCNN is a generic architecture for programming language processing; our experiments show its effectiveness in two different program analysis tasks: classifying programs according to functionality, and detecting code snippets of certain patterns. TBCNN outperforms baseline methods, including several neural models for NLP.",453
aaai,https://www.aaai.org/ocs/index.php/AAAI/AAAI16/paper/view/12350/11736,Learning Tractable Probabilistic Models for Fault Localization,"Aniruddh Nath, Pedro Domingos","In recent years, several probabilistic techniques have been applied to various debugging problems. However, most existing probabilistic debugging systems use relatively simple statistical models, and fail to generalize across multiple programs. In this work, we propose Tractable Fault Localization Models (TFLMs) that can be learned from data, and probabilistically infer the location of the bug. While most previous statistical debugging methods generalize over many executions of a single program, TFLMs are trained on a corpus of previously seen buggy programs, and learn to identify recurring patterns of bugs. Widely-used fault localization techniques such as TARANTULA evaluate the suspiciousness of each line in isolation; in contrast, a TFLM defines a joint probability distribution over buggy indicator variables for each line. Joint distributions with rich dependency structure are often computationally intractable; TFLMs avoid this by exploiting recent developments in tractable probabilistic models (specifically, Relational SPNs). Further, TFLMs can incorporate additional sources of information, including coverage-based features such as TARANTULA. We evaluate the fault localization performance of TFLMs that include TARANTULA scores as features in the probabilistic model. Our study shows that the learned TFLMs isolate bugs more effectively than previous statistical methods or using TARANTULA directly.",29
aaai,https://www.aaai.org/ocs/index.php/AAAI/AAAI16/paper/view/12180/11737,Unsupervised Feature Selection with Structured Graph Optimization,"Feiping Nie, Wei Zhu, Xuelong Li","Since amounts of unlabelled and high-dimensional data needed to be processed, unsupervised feature selection has become an important and challenging problem in machine learning. Conventional embedded unsupervised methods always need to construct the similarity matrix, which makes the selected features highly depend on the learned structure. However real world data always contain lots of noise samples and features that make the similarity matrix obtained by original data can't be fully relied. We propose an unsupervised feature selection approach which performs feature selection and local structure learning simultaneously, the similarity matrix thus can be determined adaptively. Moreover, we constrain the similarity matrix to make it contain more accurate information of data structure, thus the proposed approach can select more valuable features. An efficient and simple algorithm is derived to optimize the problem. Experiments on various benchmark data sets, including handwritten digit data, face image data and biomedical data, validate the effectiveness of the proposed approach.",218
aaai,https://www.aaai.org/ocs/index.php/AAAI/AAAI16/paper/view/12174/11738,Differential Privacy Preservation for Deep Auto-Encoders: an Application of Human Behavior Prediction,"NhatHai Phan, Yue Wang, Xintao Wu, Dejing Dou","In recent years, deep learning has spread beyond both academia and industry with many exciting real-world applications. The development of deep learning has presented obvious privacy issues. However, there has been lack of scientific study about privacy preservation in deep learning. In this paper, we concentrate on the auto-encoder, a fundamental component in deep learning, and propose the deep private auto-encoder (dPA). Our main idea is to enforce ε-differential privacy by perturbing the objective functions of the traditional deep auto-encoder, rather than its results. We apply the dPA to human behavior prediction in a health social network. Theoretical analysis and thorough experimental evaluations show that the dPA is highly effective and efficient, and it significantly outperforms existing solutions.",193
aaai,https://www.aaai.org/ocs/index.php/AAAI/AAAI16/paper/view/12232/11739,Privacy-CNH: A Framework to Detect Photo Privacy with Convolutional Neural Network using Hierarchical Features,"Lam Tran, Deguang Kong, Hongxia Jin, Ji Liu","Photo privacy is a very important problem in the digital age where photos are commonly shared on social networking sites and mobile devices. The main challenge in photo privacy detection is how to generate discriminant features to accurately detect privacy at risk photos. Existing photo privacy detection works, which rely on low-level vision features, are non-informative to the users regarding what privacy information is leaked from their photos. In this paper, we propose a new framework called Privacy-CNH that utilizes hierarchical features which include both object and convolutional features in a deep learning model to detect privacy at risk photos. The generation of object features enables our model to better inform the users about the reason why a photo has privacy risk. The combination of convolutional and object features provide a richer model to understand photo privacy from different aspects, thus improving photo privacy detection accuracy. Experimental results demonstrate that the proposed model outperforms the state-of-the-art work and the standard convolutional neural network (CNN) with low-level features on photo privacy detection tasks.",53
aaai,https://www.aaai.org/ocs/index.php/AAAI/AAAI16/paper/view/12322/11740,Drosophila Gene Expression Pattern Annotations via Multi-Instance Biological Relevance Learning,"Hua Wang, Cheng Deng, Hao Zhang, Xinbo Gao, Heng Huang","Recent developments in biologyhave produced a large number of gene expression patterns, many of which have been annotated textually with anatomical and developmental terms. These terms spatially correspond to local regions of the images, which are attached collectively to groups of images. Because one does not know which term is assigned to which region of which image in the group, the developmental stage classification and anatomical term annotation turn out to be a multi-instance learning (MIL) problem, which considers input as bags of instances and labels are assigned to the bags. Most existing MIL methods routinely use the Bag-to-Bag (B2B) distances, which, however, are often computationally expensive and may not truly reflect the similarities between the anatomical and developmental terms. In this paper, we approach the MIL problem from a new perspective using the Class-to-Bag (C2B) distances, which directly assesses the relations between annotation terms and image panels. Taking into account the two challenging properties of multi-instance gene expression data, high heterogeneity and weak label association, we computes the C2B distance by introducing class specific distance metrics and locally adaptive significance coefficients.We apply our new approach to automatic gene expression pattern classification and annotation on the Drosophila melanogaster species. Extensive experiments have demonstrated the effectiveness of our new method.",6
aaai,https://www.aaai.org/ocs/index.php/AAAI/AAAI16/paper/view/12071/11741,Recommending Groups to Users Using User-Group Engagement and Time-Dependent Matrix Factorization,"Xin Wang, Roger Donaldson, Christopher Nell, Peter Gorniak, Martin Ester, Jiajun Bu","Social networks often provide group features to help users with similar interests associate and consume content together. Recommending groups to users poses challenges due to their complex relationship: user-group affinity is typically measured implicitly and varies with time; similarly, group characteristics change as users join and leave. To tackle these challenges, we adapt existing matrix factorization techniques to learn user-group affinity based on two different implicit engagement metrics: (i) which group-provided content users consume; and (ii) which content users provide to groups. To capture the temporally extended nature of group engagement we implement a time-varying factorization. We test the assertion that latent preferences for groups and users are sparse in investigating elastic-net regularization. Experiments using data from DeviantArt indicate that the time-varying implicit engagement-based model provides the best top-K group recommendations, illustrating the benefit of the added model complexity.",47
aaai,https://www.aaai.org/ocs/index.php/AAAI/AAAI16/paper/view/12308/11742,Instilling Social to Physical: Co-Regularized Heterogeneous Transfer Learning,"Ying Wei, Yin Zhu, Cane Wing-ki Leung, Yangqiu Song, Qiang Yang","Ubiquitous computing tasks, such as human activity recognition (HAR), are enabling a wide spectrum of applications, ranging from healthcare to environment monitoring. The success of a ubiquitous computing task relies on sufﬁcient physical sensor data with groundtruth labels, which are always scarce due to the expensive annotating process. Meanwhile, social media platforms provide a lot of social or semantic context information. People share what they are doing and where they are frequently in the messages they post. This rich set of socially shared activities motivates us to transfer knowledge from social media to address the sparsity issue of labelled physical sensor data. In order to transfer the knowledge of social and semantic context, we propose a Co-Regularized Heterogeneous Transfer Learning (CoHTL) model, which builds a common semantic space derived from two heterogeneous domains. Our proposed method outperforms state-of-the-art methods on two ubiquitous computing tasks, namely human activity recognition and region function discovery.",20
aaai,https://www.aaai.org/ocs/index.php/AAAI/AAAI16/paper/view/11767/11743,Exploiting an Oracle That Reports AUC Scores in Machine Learning Contests,Jacob Whitehill,"In machine learning contests such as the ImageNet Large Scale Visual Recognition Challenge and the KDD Cup, contestants can submit candidate solutions and receive from an oracle (typically the organizers of the competition) the accuracy of their guesses compared to the ground-truth labels. One of the most commonly used accuracy metrics for binary classification tasks is the Area Under the Receiver Operating Characteristics Curve (AUC). In this paper we provide proofs-of-concept of how knowledge of the AUC of a set of guesses can be used, in two different kinds of attacks, to improve the accuracy of those guesses. On the other hand, we also demonstrate the intractability of one kind of AUC exploit by proving that the number of possible binary labelings of n examples for which a candidate solution obtains a AUC score of c grows exponentially in n, for every c in (0,1).",6
aaai,https://www.aaai.org/ocs/index.php/AAAI/AAAI16/paper/view/12485/11744,Efficient Nonparametric Subgraph Detection Using Tree Shaped Priors,"Nannan Wu, Feng Chen, Jianxin Li, Baojian Zhou, Naren Ramakrishnan","Non-parametric graph scan (NPGS) statistics are used to detect anomalous connected subgraphs on graphs, and have a wide variety of applications, such as disease outbreak detection, road traffic congestion detection, and event detection in social media. In contrast to traditional parametric scan statistics (e.g., the Kulldorff statistic), NPGS statistics are free of distributional assumptions and can be applied to heterogeneous graph data. In this paper, we make a number of contributions to the computational study of NPGS statistics. First, we present a novel reformulation of the problem as a sequence of Budget Price-Collecting Steiner Tree (B-PCST) sub-problems. Second, we show that this reformulated problem is NP-hard for a large class of nonparametric statistic functions. Third, we further develop efficient exact and approximate algorithms for a special category of graphs in which the anomalous subgraphs can be reformulated in a fixed tree topology. Finally, using extensive experiments we demonstrate the performance of our proposed algorithms in two real-world application domains (water pollution detection in water sensor networks and spatial event detection in social media networks) and contrast against state-of-the-art connected subgraph detection methods.",12
aaai,https://www.aaai.org/ocs/index.php/AAAI/AAAI16/paper/view/12455/11745,Factorization Ranking Model for Move Prediction in the Game of Go,"Chenjun Xiao, Martin Müller","In this paper, we investigate the move prediction problem in the game of Go by proposing a new ranking model named Factorization Bradley Terry (FBT) model. This new model considers the move prediction problem as group competitions while also taking the interaction between features into account. A FBT model is able to provide a probability distribution that expresses a preference over moves. Therefore it can be easily compiled into an evaluation function and applied in a modern Go program. We propose a Stochastic Gradient Decent (SGD) algorithm to train a FBT model using expert game records, and provide two methods for fast computation of the gradient in order to speed up the training process. Experimental results show that our FBT model outperforms the state-of-the-art move prediction system of Latent Factor Ranking (LFR).",8
aaai,https://www.aaai.org/ocs/index.php/AAAI/AAAI16/paper/view/11929/11746,Joint Multi-View Representation Learning and Image Tagging,"Zhe Xue, Guorong Li, Qingming Huang","Automatic image annotation is an important problem in several machine learning applications such as image search. Since there exists a semantic gap between low-level image features and high-level semantics, the description ability of image representation can largely affect annotation results. In fact, image representation learning and image tagging are two closely related tasks. A proper image representation can achieve better image annotation results, and image tags can be treated as guidance to learn more effective image representation. In this paper, we present an optimal predictive subspace learning method which jointly conducts multi-view representation learning and image tagging. The two tasks can promote each other and the annotation performance can be further improved. To make the subspace to be more compact and discriminative, both visual structure and semantic information are exploited during learning. Moreover, we introduce powerful predictors (SVM) for image tagging to achieve better annotation performance. Experiments on standard image annotation datasets demonstrate the advantages of our method over the existing image annotation methods.",14
aaai,https://www.aaai.org/ocs/index.php/AAAI/AAAI16/paper/view/11965/11747,Learning Deep Convolutional Neural Networks for X-Ray Protein Crystallization Image Analysis,"Margot Lisa-Jing Yann, Yichuan Tang","Obtaining a protein's 3D structure is crucial to the understanding of its functions and interactions with other proteins. It is critical to accelerate the protein crystallization process with improved accuracy for understanding cancer and designing drugs. Systematic high-throughput approaches in protein crystallization have been widely applied, generating a large number of protein crystallization-trial images. Therefore, an efficient and effective automatic analysis for these images is a top priority. In this paper, we present a novel system, CrystalNet, for automatically labeling outcomes of protein crystallization-trial images. CrystalNet is a deep convolutional neural network that automatically extracts features from X-ray protein crystallization images for classification. We show that (1) CrystalNet can provide real-time labels for crystallization images effectively, requiring approximately 2 seconds to provide labels for all 1536 images of crystallization microassay on each plate; (2) compared with the state-of-the-art classification systems in crystallization image analysis, our technique demonstrates an improvement of 8% in accuracy, and achieve 90.8% accuracy in classification. As a part of the high-throughput pipeline which generates millions of images a year, CrystalNet can lead to a substantial reduction of labor-intensive screening.",24
aaai,https://www.aaai.org/ocs/index.php/AAAI/AAAI16/paper/view/12005/11748,Linear Submodular Bandits with a Knapsack Constraint,"Baosheng Yu, Meng Fang, Dacheng Tao","Linear submodular bandits has been proven to be effective in solving the diversification and feature-based exploration problems in retrieval systems. Concurrently, many web-based applications, such as news article recommendation and online ad placement, can be modeled as budget-limited problems. However, the diversification problem under a budget constraint has not been considered. In this paper, we first introduce the budget constraint to linear submodular bandits as a new problem called the linear submodular bandits with a knapsack constraint. We then define an alpha-approximation unit-cost regret considering that submodular function maximization is NP-hard. To solve this problem, we propose two greedy algorithms based on a modified UCB rule. We then prove these two algorithms with different regret bounds and computational costs. We also conduct a number of experiments and the experimental results confirm our theoretical analyses.",17
aaai,https://www.aaai.org/ocs/index.php/AAAI/AAAI16/paper/view/11920/11749,Submodular Asymmetric Feature Selection in Cascade Object Detection,"Baosheng Yu, Meng Fang, Dacheng Tao, Jie Yin","A cascade classifier has turned out to be effective insliding-window based real-time object detection. In acascade classifier, node learning is the key process,which includes feature selection and classifier design. Previous algorithms fail to effectively tackle the asymmetry and intersection problems existing in cascade classification, thereby limiting the performance of object detection. In this paper, we improve current feature selection algorithm by addressing both asymmetry and intersection problems. We formulate asymmetric feature selection as a submodular function maximization problem. We then propose a new algorithm SAFS with formal performance guarantee to solve this problem.We use face detection as a case study and perform experiments on two real-world face detection datasets. The experimental results demonstrate that our algorithm SAFS outperforms the state-of-art feature selection algorithms in cascade object detection, such as FFS and LACBoost.",5
