conference,url,title,authors,abstract,citations
aaai,https://www.aaai.org/ocs/index.php/AAAI/AAAI16/paper/view/11946/11869,Analysis-Synthesis Dictionary Learning for Universality-Particularity Representation Based Classification,"Meng Yang, Weiyang Liu, Weixin Luo, Linlin Shen","Dictionary learning has played an important role in the success of sparse representation. Although synthesis dictionary learning for sparse representation has been well studied for universality representation (i.e., the dictionary is universal to all classes) and particularity representation (i.e., the dictionary is class-particular), jointly learning an analysis dictionary and a synthesis dictionary is still in its infant stage. Universality-particularity representation can well match the intrinsic characteristics of data (i.e., different classes share commonality and distinctness), while analysis-synthesis dictionary can give a more complete view of data representation (i.e., analysis dictionary is a dual-viewpoint of synthesis dictionary). In this paper, we proposed a novel model of analysis-synthesis dictionary learning for universality-particularity (ASDL-UP) representation based classification. The discrimination of universality and particularity representation is jointly exploited by simultaneously learning a pair of analysis dictionary and synthesis dictionary. More specifically, we impose a label preserving term to analysis coding coefficients for universality representation. Fisher-like regularizations for analysis coding coefficients and the subsequent synthesis representation are introduced to particularity representation. Compared with other state-of-the-art dictionary learning methods, ASDL-UP has shown better or competitive performance in various classification tasks.",31
aaai,https://www.aaai.org/ocs/index.php/AAAI/AAAI16/paper/view/12346/11870,Efficient Average Reward Reinforcement Learning Using Constant Shifting Values,"Shangdong Yang, Yang Gao, Bo An, Hao Wang, Xingguo Chen","There are two classes of average reward reinforcement learning (RL) algorithms: model-based ones that explicitly maintain MDP models and model-free ones that do not learn such models. Though model-free algorithms are known to be more efficient, they often cannot converge to optimal policies due to the perturbation of parameters. In this paper, a novel model-free algorithm is proposed, which makes use of constant shifting values (CSVs) estimated from prior knowledge. To encourage exploration during the learning process, the algorithm constantly subtracts the CSV from the rewards. A terminating condition is proposed to handle the unboundedness of Q-values caused by such substraction. The convergence of the proposed algorithm is proved under very mild assumptions. Furthermore, linear function approximation is investigated to generalize our method to handle large-scale tasks. Extensive experiments on representative MDPs and the popular game Tetris show that the proposed algorithms significantly outperform the state-of-the-art ones.",25
aaai,https://www.aaai.org/ocs/index.php/AAAI/AAAI16/paper/view/11955/11871,Learning Continuous-Time Bayesian Networks in Relational Domains: A Non-Parametric Approach,"Shuo Yang, Tushar Khot, Kristian Kersting, Sriraam Natarajan","Many real world applications in medicine, biology, communication networks, web mining, and economics, among others, involve modeling and learning structured stochastic processes that evolve over continuous time. Existing approaches, however, have focused on propositional domains only. Without extensive feature engineering, it is difficult-if not impossible-to apply them within relational domains where we may have varying number of objects and relations among them. We therefore develop the first relational representation called Relational Continuous-Time Bayesian Networks (RCTBNs) that can address this challenge. It features a nonparametric learning method that allows for efficiently learning the complex dependencies and their strengths simultaneously from sequence data. Our experimental results demonstrate that RCTBNs can learn as effectively as state-of-the-art approaches for propositional tasks while modeling relational tasks faithfully.",20
aaai,https://www.aaai.org/ocs/index.php/AAAI/AAAI16/paper/view/12175/11872,Instance Specific Metric Subspace Learning: A Bayesian Approach,"Han-Jia Ye, De-Chuan Zhan, Yuan Jiang","Instead of using a uniform metric, instance specific distance learning methods assign multiple metrics for different localities, which take data heterogeneity into consideration. Therefore, they may improve the performance of distance based classifiers, e.g., kNN. Existing methods obtain multiple metrics of test data by either transductively assigning metrics for unlabeled instances or designing distance functions manually, which are with limited generalization ability. In this paper, we propose isMets (Instance Specific METric Subspace) framework which can automatically span the whole metric space in a generative manner and is able to inductively learn a specific metric subspace for each instance via inferring the expectation over the metric bases in a Bayesian manner. The whole framework can be solved with Variational Bayes (VB). Experiment on synthetic data shows that the learned results are with good interpretability. Moreover, comprehensive results on real world datasets validate the effectiveness and robustness of isMets.",7
aaai,https://www.aaai.org/ocs/index.php/AAAI/AAAI16/paper/view/11792/11873,Scalable Completion of Nonnegative Matrix with Separable Structure,"Xiyu Yu, Wei Bian, Dacheng Tao","Matrix completion is to recover missing/unobserved values of a data matrix from very limited observations. Due to widely potential applications, it has received growing interests in fields from machine learning, data mining, to collaborative filtering and computer vision. To ensure the successful recovery of missing values, most existing matrix completion algorithms utilise the low-rank assumption, i.e., the fully observed data matrix has a low rank, or equivalently the columns of the matrix can be linearly represented by a few numbers of basis vectors. Although such low-rank assumption applies generally in practice, real-world data can process much richer structural information. In this paper, we present a new model for matrix completion, motivated by the separability assumption of nonnegative matrices from the recent literature of matrix factorisations: there exists a set of columns of the matrix such that the resting columns can be represented by their convex combinations. Given the separability property, which holds reasonably for many applications, our model provides a more accurate matrix completion than the low-rank based algorithms. Further, we derives a scalable algorithm to solve our matrix completion model, which utilises a randomised method to select the basis columns under the separability assumption and a coordinate gradient based method to automatically deal with the structural constraints in optimisation. Compared to the state-of-the-art algorithms, the proposed matrix completion model achieves competitive results on both synthetic and real datasets.",4
aaai,https://www.aaai.org/ocs/index.php/AAAI/AAAI16/paper/view/12367/11874,Derivative-Free Optimization via Classification,"Yang Yu, Hong Qian, Yi-Qi Hu","Many randomized heuristic derivative-free optimization methods share a framework that iteratively learns a model for promising search areas and samples solutions from the model. This paper studies a particular setting of such framework, where the model is implemented by a classification model discriminating good solutions from bad ones. This setting allows a general theoretical characterization, where critical factors to the optimization are discovered. We also prove that optimization problems with Local Lipschitz continuity can be solved in polynomial time by proper configurations of this framework. Following the critical factors, we propose the randomized coordinate shrinking classification algorithm to learn the model, forming the RACOS algorithm, for optimization in continuous and discrete domains. Experiments on the testing functions as well as on the machine learning tasks including spectral clustering and classification with Ramp loss demonstrate the effectiveness of RACOS.",66
aaai,https://www.aaai.org/ocs/index.php/AAAI/AAAI16/paper/view/12368/11875,On Order-Constrained Transitive Distance Clustering,"Zhiding Yu, Weiyang Liu, Wenbo Liu, Yingzhen Yang, Ming Li, B. V. K. Vijaya Kumar","We consider the problem of approximating order-constrained transitive distance (OCTD) and its clustering applications. Given any pairwise data, transitive distance (TD) is defined as the smallest possible ""gap"" on the set of paths connecting them. While such metric definition renders significant capability of addressing elongated clusters, it is sometimes also an over-simplified representation which loses necessary regularization on cluster structure and overfits to short links easily. As a result, conventional TD often suffers from degraded performance given clusters with ""thick"" structures. Our key intuition is that the maximum (path) order, which is the maximum number of nodes on a path, controls the level of flexibility. Reducing this order benefits the clustering performance by finding a trade-off between flexibility and regularization on cluster structure. Unlike TD, finding OCTD becomes an intractable problem even though the number of connecting paths is reduced. We therefore propose a fast approximation framework, using random samplings to generate multiple diversified TD matrices and a pooling to output the final approximated OCTD matrix. Comprehensive experiments on toy, image and speech datasets show the excellent performance of OCTD, surpassing TD with significant gains and giving state-of-the-art performance on several datasets.",3
aaai,https://www.aaai.org/ocs/index.php/AAAI/AAAI16/paper/view/11997/11876,A Proximal Alternating Direction Method for Semi-Definite Rank Minimization,"Ganzhao Yuan, Bernard Ghanem","Semi-definite rank minimization problems model a wide range of applications in both signal processing and machine learning fields. This class of problem is NP-hard in general. In this paper, we propose a proximal Alternating Direction Method (ADM) for the well-known semi-definite rank regularized minimization problem. Specifically, we first reformulate this NP-hard problem as an equivalent biconvex MPEC (Mathematical Program with Equilibrium Constraints), and then solve it using proximal ADM, which involves solving a sequence of structured convex semi-definite subproblems to find a desirable solution to the original rank regularized optimization problem. Moreover, based on the Kurdyka-Lojasiewicz inequality, we prove that the proposed method always converges to a KKT stationary point under mild conditions. We apply the proposed method to the widely studied and popular sensor network localization problem. Our extensive experiments demonstrate that the proposed algorithm outperforms state-of-the-art low-rank semi-definite minimization algorithms in terms of solution quality.",13
aaai,https://www.aaai.org/ocs/index.php/AAAI/AAAI16/paper/view/12317/11877,Learning Expected Hitting Time Distance,"De-Chuan Zhan, Peng Hu, Zui Chu, Zhi-Hua Zhou","Most distance metric learning (DML) approaches focus on learning a Mahalanobis metric for measuring distances between examples. However, for particular feature representations, e.g., histogram features like BOW and SPM, Mahalanobis metric could not model the correlations between these features well. In this work, we define a non-Mahalanobis distance for histogram features, via Expected Hitting Time (EHT) of Markov Chain, which implicitly considers the high-order feature relationships between different histogram features. The EHT based distance is parameterized by transition probabilities of Markov Chain, we consequently propose a novel type of distance learning approach (LED, Learning Expected hitting time Distance) to learn appropriate transition probabilities for EHT based distance. We validate the effectiveness of LED on a series of real-world datasets. Moreover, experiments show that the learned transition probabilities are with good comprehensibility.",2
aaai,https://www.aaai.org/ocs/index.php/AAAI/AAAI16/paper/view/12072/11878,Stochastic Optimization for Kernel PCA,"Lijun Zhang, Tianbao Yang, Jinfeng Yi, Rong Jin, Zhi-Hua Zhou","Kernel Principal Component Analysis (PCA) is a popular extension of PCA which is able to find nonlinear patterns from data. However, the application of kernel PCA to large-scale problems remains a big challenge, due to its quadratic space complexity and cubic time complexity in the number of examples. To address this limitation, we utilize techniques from stochastic optimization to solve kernel PCA with linear space and time complexities per iteration. Specifically, we formulate it as a stochastic composite optimization problem, where a nuclear norm regularizer is introduced to promote low-rankness, and then develop a simple algorithm based on stochastic proximal gradient descent. During the optimization process, the proposed algorithm always maintains a low-rank factorization of iterates that can be conveniently held in memory. Compared to previous iterative approaches, a remarkable property of our algorithm is that it is equipped with an explicit rate of convergence. Theoretical analysis shows that the solution of our algorithm converges to the optimal one at an O(1/T) rate, where T is the number of iterations.",20
aaai,https://www.aaai.org/ocs/index.php/AAAI/AAAI16/paper/view/12352/11879,Asynchronous Distributed Semi-Stochastic Gradient Optimization,"Ruiliang Zhang, Shuai Zheng, James T. Kwok","With the recent proliferation of large-scale learning problems, there have been a lot of interest on distributed machine learning algorithms, particularly those that are based on stochastic gradient descent (SGD) and its variants. However, existing algorithms either suffer from slow convergence due to the inherent variance of stochastic gradients, or have a fast linear convergence rate but at the expense of poorer solution quality. In this paper, we combine their merits by proposing a fast distributed asynchronous SGD-based algorithm with variance reduction. A constant learning rate can be used, and it is also guaranteed to converge linearly to the optimal solution. Experiments on the Google Cloud Computing Platform demonstrate that the proposed algorithm outperforms state-of-the-art distributed asynchronous algorithms in terms of both wall clock time and solution quality.",22
aaai,https://www.aaai.org/ocs/index.php/AAAI/AAAI16/paper/view/12122/11880,An Alternating Proximal Splitting Method with Global Convergence for Nonconvex Structured Sparsity Optimization,"Shubao Zhang, Hui Qian, Xiaojin Gong","In many learning tasks with structural properties, structured sparse modeling usually leads to better interpretability and higher generalization performance. While great efforts have focused on the convex regularization, recent studies show that nonconvex regularizers can outperform their convex counterparts in many situations. However, the resulting nonconvex optimization problems are still challenging, especially for the structured sparsity-inducing regularizers. In this paper, we propose a splitting method for solving nonconvex structured sparsity optimization problems. The proposed method alternates between a gradient step and an easily solvable proximal step, and thus enjoys low per-iteration computational complexity. We prove that the whole sequence generated by the proposed method converges to a critical point with at least sublinear convergence rate, relying on the Kurdyka-Łojasiewicz inequality. Experiments on both simulated and real-world data sets demonstrate the efficiency and efficacy of the proposed method.",13
aaai,https://www.aaai.org/ocs/index.php/AAAI/AAAI16/paper/view/12162/11881,Accelerated Sparse Linear Regression via Random Projection,"Weizhong Zhang, Lijun Zhang, Rong Jin, Deng Cai, Xiaofei He","In this paper, we present an accelerated numerical method based on random projection for sparse linear regression. Previous studies have shown that under appropriate conditions, gradient-based methods enjoy a geometric convergence rate when applied to this problem. However, the time complexity of evaluating the gradient is as large as $\mathcal{O}(nd)$, where $n$ is the number of data points and $d$ is the dimensionality, making those methods inefficient for large-scale and high-dimensional dataset. To address this limitation, we first utilize random projection to find a rank-$k$ approximator for the data matrix, and reduce the cost of gradient evaluation to $\mathcal{O}(nk+dk)$, a significant improvement when $k$ is much smaller than $d$ and $n$. Then, we solve the sparse linear regression problem via a proximal gradient method with a homotopy strategy to generate sparse intermediate solutions. Theoretical analysis shows that our method also achieves a global geometric convergence rate, and moreover the sparsity of all the intermediate solutions are well-bounded over the iterations. Finally, we conduct experiments to demonstrate the efficiency of the proposed method.",12
aaai,https://www.aaai.org/ocs/index.php/AAAI/AAAI16/paper/view/11943/11882,Large-Scale Graph-Based Semi-Supervised Learning via Tree Laplacian Solver,"Yan-Ming Zhang, Xu-Yao Zhang, Xiao-Tong Yuan, Cheng-Lin Liu","Graph-based Semi-Supervised learning is one of the most popular and successful semi-supervised learning methods. Typically, it predicts the labels of unlabeled data by minimizing a quadratic objective induced by the graph, which is unfortunately a procedure of polynomial complexity in the sample size $n$. In this paper, we address this scalability issue by proposing a method that approximately solves the quadratic objective in nearly linear time. The method consists of two steps: it first approximates a graph by a minimum spanning tree, and then solves the tree-induced quadratic objective function in O(n) time which is the main contribution of this work. Extensive experiments show the significant scalability improvement over existing scalable semi-supervised learning methods.",7
aaai,https://www.aaai.org/ocs/index.php/AAAI/AAAI16/paper/view/11879/11883,Near-Optimal Active Learning of Multi-Output Gaussian Processes,"Yehong Zhang, Trong Nghia Hoang, Kian Hsiang Low, Mohan Kankanhalli","This paper addresses the problem of active learning of a multi-output Gaussian process (MOGP) model representing multiple types of coexisting correlated environmental phenomena. In contrast to existing works, our active learning problem involves selecting not just the most informative sampling locations to be observed but also the types of measurements at each selected location for minimizing the predictive uncertainty (i.e., posterior joint entropy) of a target phenomenon of interest given a sampling budget. Unfortunately, such an entropy criterion scales poorly in the numbers of candidate sampling locations and selected observations when optimized. To resolve this issue, we first exploit a structure common to sparse MOGP models for deriving a novel active learning criterion. Then, we exploit a relaxed form of submodularity property of our new criterion for devising a polynomial-time approximation algorithm that guarantees a constant-factor approximation of that achieved by the optimal set of selected observations. Empirical evaluation on real-world datasets shows that our proposed approach outperforms existing algorithms for active learning of MOGP and single-output GP models.",31
aaai,https://www.aaai.org/ocs/index.php/AAAI/AAAI16/paper/view/12369/11884,Multi-Domain Active Learning for Recommendation,"Zihan Zhang, Xiaoming Jin, Lianghao Li, Guiguang Ding, Qiang Yang","Recently, active learning has been applied to recommendation to deal with data sparsity on a single domain. In this paper, we propose an active learning strategy for recommendation to alleviate the data sparsity in a multi-domain scenario. Specifically, our proposed active learning strategy simultaneously consider both specific and independent knowledge over all domains. We use the expected entropy to measure the generalization error of the domain-specific knowledge and propose a variance-based strategy to measure the generalization error of the domain-independent knowledge. The proposed active learning strategy use a unified function to effectively combine these two measurements. We compare our strategy with five state-of-the-art baselines on five different multi-domain recommendation tasks, which are constituted by three real-world data sets. The experimental results show that our strategy performs significantly better than all the baselines and reduces human labeling efforts by at least 5.6%, 8.3%, 11.8%, 12.5% and 15.4% on the five tasks, respectively.",42
aaai,https://www.aaai.org/ocs/index.php/AAAI/AAAI16/paper/view/12129/11885,On the Differential Privacy of Bayesian Inference,"Zuhe Zhang, Benjamin I. P. Rubinstein, Christos Dimitrakakis","We study how to communicate findings of Bayesian inference to third parties, while preserving the strong guarantee of differential privacy. Our main contributions are four different algorithms for private Bayesian inference on probabilistic graphical models. These include two mechanisms for adding noise to the Bayesian updates, either directly to the posterior parameters, or to their Fourier transform so as to preserve update consistency. We also utilise a recently introduced posterior sampling mechanism, for which we prove bounds for the specific but general case of discrete Bayesian networks; and we introduce a maximum-a-posteriori private mechanism. Our analysis includes utility and privacy bounds, with a novel focus on the influence of graph structure on privacy. Worked examples and experiments with Bayesian naive Bayes and Bayesian linear regression illustrate the application of our mechanisms.",74
aaai,https://www.aaai.org/ocs/index.php/AAAI/AAAI16/paper/view/11937/11886,A Scalable and Extensible Framework for Superposition-Structured Models,"Shenjian Zhao, Cong Xie, Zhihua Zhang","In many learning tasks, structural models usually lead to better interpretability and higher generalization performance. In recent years, however, the simple structural models such as lasso are frequently proved to be insufficient. Accordingly, there has been a lot of work on ""superposition-structured"" models where multiple structural constraints are imposed. To efficiently solve these ""superposition-structured"" statistical models, we develop a framework based on a proximal Newton-type method. Employing the smoothed conic dual approach with the LBFGS updating formula, we propose a scalable and extensible proximal quasi-Newton (SEP-QN) framework. Empirical analysis on various datasets shows that our framework is potentially powerful, and achieves super-linear convergence rate for optimizing some popular ""superposition-structured"" statistical models such as the fused sparse group lasso.",0
aaai,https://www.aaai.org/ocs/index.php/AAAI/AAAI16/paper/view/12442/11887,Fast Asynchronous Parallel Stochastic Gradient Descent: A Lock-Free Approach with Convergence Guarantee,"Shen-Yi Zhao, Wu-Jun Li","Stochastic gradient descent (SGD) and its variants have become more and more popular in machine learning due to their efficiency and effectiveness. To handle large-scale problems, researchers have recently proposed several parallel SGD methods for multicore systems. However, existing parallel SGD methods cannot achieve satisfactory performance in real applications. In this paper, we propose a fast asynchronous parallel SGD method, called AsySVRG, by designing an asynchronous strategy to parallelize the recently proposed SGD variant called stochastic variance reduced gradient (SVRG). AsySVRG adopts a lock-free strategy which is more efficient than other strategies with locks. Furthermore, we theoretically prove that AsySVRG is convergent with a linear convergence rate. Both theoretical and empirical results show that AsySVRG can outperform existing state-of-the-art parallel SGD methods like Hogwild! in terms of convergence rate and computation cost.",83
