conference,url,title,authors,abstract,citations,research_areas
aaai,https://www.aaai.org/ocs/index.php/AAAI/AAAI10/paper/view/1931/2229,Integrity Constraints in OWL,"Jiao Tao, Evren Sirin, Jie Bao, Deborah L. McGuinness","In many data-centric semantic web applications, it is desirable to use OWL to encode the Integrity Constraints (IC) that must be satisfied by instance data. However, challenges arise due to the Open World Assumption (OWA) and the lack of a Unique Name Assumption (UNA) in OWL’s standard semantics. In particular, conditions that trigger constraint violations in systems using the ClosedWorld Assumption (CWA), will generate new inferences in standard OWL-based reasoning applications. In this paper, we present an alternative IC semantics for OWL that allows applications to work with the CWA and the weak UNA. Ontology modelers can choose which OWL axioms to be interpreted with our IC semantics. Thus application developers are able to combine open world reasoning with closed world constraint validation in a flexible way. We also show that IC validation can be reduced to query answering under certain conditions. Finally, we describe our prototype implementation based on the OWL reasoner Pellet.",205,"{'AI': 2, 'Web': 2, 'Semantic Web': 6, 'Ontologies': 4, 'Artificial Intelligence': 6, 'Data Science': 2, 'Health Informatics': 2, 'Knowledge Representation': 4, 'Automated Theorem Proving': 2, 'Logic in Computer Science': 2, 'Description Logics': 2, 'Ontology Engineering': 2, 'Automated Reasoning': 2}"
aaai,https://www.aaai.org/ocs/index.php/AAAI/AAAI10/paper/view/1675/2230,News Recommendation in Forum-Based Social Media,"Jia Wang, Qing Li, Yuanzhu Peter Chen, Jiafen Liu, Chen Zhang, Zhangxi Lin","Self-publication of news on Web sites is becoming a common application platform to enable more engaging interaction among users. Discussion in the form of comments following news postings can be effectively facilitated if the service provider can recommend articles based on not only the original news itself but also the thread of changing comments. This turns the traditional news recommendation to a ""discussion moderator"" that can intelligently assist online forums. In this work, we present a framework to implement such adaptive news recommendation. In addition, to alleviate the problem of recommending essentially identical articles, the relationship (duplication, generalization or specialization) between suggested news articles and the original posting is investigated. Experiments indicate that our proposed solutions provide an enhanced news recommendation service in forum-based social media.",17,"{'MIS': 1, 'CS': 1, 'Finance': 1}"
aaai,https://www.aaai.org/ocs/index.php/AAAI/AAAI10/paper/view/1834/2232,Modeling Dynamic Multi-Topic Discussions in Online Forums,"Hao Wu, Jiajun Bu, Chun Chen, Can Wang, Guang Qiu, Lijun Zhang, Jianfeng Shen","In the form of topic discussions, users interact with each other to share knowledge and exchange information in online forums. Modeling the evolution of topic discussion reveals how information propagates on Internet and can thus help understand sociological phenomena and improve the performance of applications such as recommendation systems. In this paper, we argue that a user’s participation in topic discussions is motivated by either her friends or her own preferences. Inspired by the theory of information flow, we propose dynamic topic discussion models by mining influential relationships between users and individual preferences. Reply relations of users are exploited to construct the fundamental influential social network. The property of discussed topics and time lapse factor are also considered in our modeling. Furthermore, we propose a novel measure called ParticipationRank to rank users according to how important they are in the social network and to what extent they prefer to participate in the discussion of a certain topic. The experiments show our model can simulate the evolution of topic discussions well and predict the tendency of user’s participation accurately.",26,"{'Machine Learning': 1, 'Text Mining': 1, 'Social Network Analysis': 1, 'Recommender Systems': 1, 'Artificial Intelligence': 1, 'data mining': 1, 'machine learning': 1, 'information retrieval': 1}"
aaai,https://www.aaai.org/ocs/index.php/AAAI/AAAI10/paper/view/1792/2233,Keyword Extraction and Headline Generation Using Novel Word Features,"Songhua Xu, Shaohui Yang, Francis Lau","We introduce several novel word features for keyword extraction and headline generation. These new word features are derived according to the background knowledge of a document as supplied by Wikipedia. Given a document, to acquire its background knowledge from Wikipedia, we first generate a query for searching the Wikipedia corpus based on the key facts present in the document. We then use the query to find articles in the Wikipedia corpus that are closely related to the contents of the document. With the Wikipedia search result article set, we extract the inlink, outlink, category and infobox information in each article to derive a set of novel word features which reflect the document's background knowledge. These newly introduced word features offer valuable indications on individual words' importance in the input document. They serve as nice complements to the traditional word features derivable from explicit information of a document. In addition, we also introduce a word-document fitness feature to charcterize the influence of a document's genre on the keyword extraction and headline generation process. We study the effectiveness of these novel word features for keyword extraction and headline generation by experiments and have obtained very encouraging results.",67,"{'Computer Science': 1, 'Computer Systems': 1, 'Networks': 1}"
aaai,https://www.aaai.org/ocs/index.php/AAAI/AAAI10/paper/view/1939/2234,Fast Algorithms for Top-k Approximate String Matching,"Zhenglu Yang, Jianjun Yu, Masaru Kitsuregawa","Top-k approximate querying on string collections is an important data analysis tool for many applications, and it has been exhaustively studied. However, the scale of the problem has increased dramatically because of the prevalence of the Web. In this paper, we aim to explore the efficient top-k similar string matching problem. Several efficient strategies are introduced, such as length aware and adaptive q-gram selection. We present a general q-gram based framework and propose two efficient algorithms based on the strategies introduced. Our techniques are experimentally evaluated on three real data sets and show a superior performance.",60,"{'Artificial Intelligence': 1, 'Data Mining': 1, 'Natural Language Processing': 1, 'Web Systems': 1}"
aaai,https://www.aaai.org/ocs/index.php/AAAI/AAAI10/paper/view/1738/2235,Temporal and Social Context Based Burst Detection from Folksonomies,"Junjie Yao, Bin Cui, Yuxin Huang, Xin Jin","Burst detection is an important topic in temporal stream analysis. Usually, only the textual features are used in burst detection. In the theme extraction from current prevailing social media content, it is necessary to consider not only textual features but also the pervasive collaborative context, e.g., resource lifetime and user activity. This paper explores novel approaches to combine multiple sources of such indication for better burst extraction. We systematically investigate the characters of collaborative context, i.e., metadata frequency, topic coverage and user attractiveness. First, a robust state based model is utilized to detect bursts from individual streams. We then propose a learning method to combine these burst pulses. Experiments on a large real dataset demonstrate the remarkable improvements over the traditional methods.",44,"{'Database': 2, 'Data Mining': 2, 'Social Media': 1, 'Big Data analytics': 1, 'ML Systems': 1, 'Information Retrieval': 1}"
aaai,https://www.aaai.org/ocs/index.php/AAAI/AAAI10/paper/view/1715/2236,Commonsense Knowledge Mining from the Web,"Chi-Hsin Yu, Hsin-Hsi Chen","Good and generous knowledge sources, reliable and efficient induction patterns, and automatic and controllable quality assertion approaches are three critical issues to commonsense knowledge (CSK) acquisition. This paper employs Open Mind Common Sense (OMCS), a volunteers-contributed CSK database, to study the first and the third issues. For those stylized CSK, our result shows that over 40% of CSK for four predicate types in OMCS can be found in the web, which contradicts to the assumption that CSK is not communicated in texts. Moreover, we propose a commonsense knowledge classifier trained from OMCS, and achieve high precision in some predicate types, e.g., 82.6% in HasProperty. The promising results suggest new ways of analyzing and utilizing volunteer-contributed knowledge to design systems automatically mining commonsense knowledge from the web.",7,"{'Natural Language Processing': 1, 'Information Retrieval': 1, 'Information Extraction': 1, 'Web Mining': 1, 'Artificial Intelligence': 1}"
aaai,https://www.aaai.org/ocs/index.php/AAAI/AAAI10/paper/view/1927/2237,UserRec: A User Recommendation Framework in Social Tagging Systems,"Tom Chao Zhou, Hao Ma, Michael R. Lyu, Irwin King","Social tagging systems have emerged as an effective way for users to annotate and share objects on the Web. However, with the growth of social tagging systems, users are easily overwhelmed by the large amount of data and it is very difficult for users to dig out information that he/she is interested in. Though the tagging system has provided interest-based social network features to enable the user to keep track of other users' tagging activities, there is still no automatic and effective way for the user to discover other users with common interests. In this paper, we propose a User Recommendation (UserRec) framework for user interest modeling and interest-based user recommendation, aiming to boost information sharing among users with similar interests. Our work brings three major contributions to the research community: (1) we propose a tag-graph based community detection method to model the users' personal interests, which are further represented by discrete topic distributions; (2) the similarity values between users' topic distributions are measured by Kullback-Leibler divergence (KL-divergence), and the similarity values are further used to perform interest-based user recommendation; and (3) by analyzing users' roles in a tagging system, we find users' roles in a tagging system are similar to Web pages in the Internet. Experiments on tagging dataset of Web pages (Yahoo!~Delicious) show that UserRec outperforms other state-of-the-art recommender system approaches.",100,"{'Information Retrieval': 2, 'Machine Learning': 2, 'Data Mining': 1, 'Artificial Intelligence': 1, 'Natural Language Processing': 2, 'Recommender Systems': 1, 'Social Network Analysis': 1, 'software engineering': 1, 'software reliability': 1, 'fault tolerance': 1, 'machine learning': 2, 'distributed systems': 1, 'social computing': 1, 'data mining': 1, 'NLP': 1}"
aaai,https://www.aaai.org/ocs/index.php/AAAI/AAAI10/paper/view/1899/2239,Automated Modelling and Solving in Constraint Programming,Barry O'Sullivan,"Constraint programming can be divided very crudely into modeling and solving. Modeling defines the problem, in terms of variables that can take on different values, subject to restrictions (constraints) on which combinations of variables are allowed. Solving finds values for all the variables that simultaneously satisfy all the constraints. However, the impact of constraint programming has been constrained by a lack of ""user-friendliness''. Constraint programming has a major ""declarative"" aspect, in that a problem model can be handed off for solution to a variety of standard solving methods. These methods are embedded in algorithms, libraries, or specialized constraint programming languages. To fully exploit this declarative opportunity however, we must provide more assistance and automation in the modeling process, as well as in the design of application-specific problem solvers. Automated modelling and solving in constraint programming presents a major challenge for the artificial intelligence community. Artificial intelligence, and in particular machine learning, is a natural field in which to explore opportunities for moving more of the burden of constraint programming from the user to the machine. This paper presents technical challenges in the areas of constraint model acquisition, formulation and reformulation, synthesis of filtering algorithms for global constraints, and automated solving. We also present the metrics by which success and progress can be measured.",37,"{'Parameterized Complexity': 1, 'Constraint Satisfaction': 1, 'Artificial Intelligence': 1, 'Constraint Programming': 1}"
aaai,https://www.aaai.org/ocs/index.php/AAAI/AAAI10/paper/view/1804/2240,Hidden Market Design,"Sven Seuken, Kamal Jain, David C. Parkes","The next decade will see an abundance of new intelligent systems, many of which will be market-based. Soon, users will interact with many new markets, perhaps without even knowing it: when driving their car, when listening to a song, when backing up their files, or when surfing the web. We argue that these new systems can only be successful if a new approach is chosen towards designing them. In this paper we introduce the general problem of ""Hidden Market Design."" The design of a ""weakly hidden"" market involves reducing some of the market complexities and providing a user interface (UI) that makes the interaction seamless for the user. A ""strongly hidden market"" is one where some semantic aspect of a market is hidden altogether (e.g., budgets, prices, combinatorial constraints). We show that the intersection of UI design and market design is of particular importance for this research agenda. To illustrate hidden market design, we give a series of potential applications. We hope that the problem of hidden market design will inspire other researchers and lead to new research in this direction, paving the way for more successful market-based systems in the future.",28,"{'Market Design': 6, 'Algorithmic Game Theory': 2, 'Economics and Computation': 3, 'Mechanism Design': 2, 'Artificial Intelligence': 4, 'Multi-Agent Systems': 1, 'Mobile Computing': 1, 'Cryptocurrencies': 1, 'Distributed Ledgers': 1, 'Mobile Augmented Reality': 1, 'Resource Management': 1, 'Edge/Cloud Computing': 1, 'Performance Evaluation': 1, 'mobile cloud computing': 1, 'edge computing': 1, 'distributed systems': 1, 'device-to-device offloading': 1, 'pervasive computing': 1, 'Machine Learning': 2, 'Human-Computer Interaction': 2, 'Healthcare': 1, 'Psychology': 1, 'cognitive psychology': 1, 'Innovation': 1, 'manufacturing': 1, 'small business': 1, 'Political Economy': 2, 'Mathematical Economics': 2, 'Matching Theory': 2, 'Law and Economics': 2, 'Number Theory': 2, 'energy policy': 1, 'Operations Research': 1, 'Applied Probability': 1, 'Operations Management': 1, 'Production Control': 1, 'Energy Market Design': 1, 'Data Mining': 1, 'Stock Market forecasting': 1}"
aaai,https://www.aaai.org/ocs/index.php/AAAI/AAAI10/paper/view/1843/2242,Ad Hoc Autonomous Agent Teams: Collaboration without Pre-Coordination,"Peter Stone, Gal A. Kaminka, Sarit Kraus, Jeffrey S. Rosenschein","As autonomous agents proliferate in the real world, both in software and robotic settings, they will increasingly need to band together for cooperative activities with previously unfamiliar teammates. In such ad hoc team settings, team strategies cannot be developed a priori. Rather, an agent must be prepared to cooperate with many types of teammates: it must collaborate without pre-coordination. This paper challenges the AI community to develop theory and to implement prototypes of ad hoc team agents. It defines the concept of ad hoc team agents, specifies an evaluation paradigm, and provides examples of possible theoretical and empirical approaches to challenge. The goal is to encourage progress towards this ambitious, newly realistic, and increasingly important research goal.",300,"{'Artificial Intelligence': 2, 'Machine Learning': 1, 'Reinforcement Learning': 1, 'Multiagent Systems': 1, 'Robotics': 2, 'Molecular Robotics': 1, 'Multi-Agent and Multi-Robot Systems': 1, 'Plan and Goal Recognition': 1, 'Human agent interaction': 1, 'Multi-agent Systems': 1, 'multiagent systems': 1}"
aaai,https://www.aaai.org/ocs/index.php/AAAI/AAAI10/paper/view/1942/2244,Collusion Detection in Online Bridge,Jeff Yan,"Collusion is a major unsolved security problem in online bridge: by illicitly exchanging card information over the telephone, instant messenger or the like, cheaters can gain huge advantages over honest players. It is very hard if not impossible to prevent collusion from happening. Instead, we motivate an AI-based detection approach and discuss its challenges. We challenge the AI community to create automated methods for detecting collusive traces left in game records with an accuracy that can be achieved by human masters.",10,"{'Security': 5, 'Privacy': 5, 'Cybercrime': 4, 'Forensics': 4, 'Poker': 4, 'Dependability': 1, 'History of Digital Computers': 1, 'Machine Learning': 4, 'Computational biology': 2, 'Genomics': 2, 'Biostatistics': 2, 'Artificial Intelligence': 2, 'Multi-Agent Systems': 1, 'Robotics': 1, 'Game-Playing': 1, 'Game Theory': 1, 'Reinforcement Learning': 1, 'Computer Games': 1, 'Anonymous Communications': 1, 'Chip and PIN': 1, 'EMV': 1, 'Distributed Systems': 1, 'Fault Tolerance': 1, 'Consensus': 1, 'Failure Detectors': 1}"
aaai,https://www.aaai.org/ocs/index.php/AAAI/AAAI10/paper/view/1709/2245,Creating Dynamic Story Plots with Continual Multiagent Planning,Michael Brenner,"An AI system that is to create a story (autonomously or in interaction with human users) requires capabilities from many subfields of AI in order to create characters that themselves appear to act intelligently and believably in a coherent story world. Specifically, the system must be able to reason about the physical actions and verbal interactions of the characters as well as their perceptions of the world. Furthermore it must make the characters act believably--i.e. in a goal-directed yet emotionally plausible fashion. Finally, it must cope with (and embrace!) the dynamics of a multiagent environment where beliefs, sentiments, and goals may change during the course of a story and where plans are thwarted, adapted and dropped all the time.  In this paper, we describe a representational and algorithmic framework for modelling such dynamic story worlds, Continual Multiagent Planning. It combines continual planning (i.e. an integrated approach to planning and execution) with a rich description language for modelling epistemic and affective states, desires and intentions, sensing and communication. Analysing story examples generated by our implemented system we show the benefits of such an integrated approach for dynamic plot generation.",35,{}
aaai,https://www.aaai.org/ocs/index.php/AAAI/AAAI10/paper/view/1862/2246,An Integrated Systems Approach to Explanation-Based Conceptual Change,"Scott Friedman, Kenneth Forbus","Understanding conceptual change is an important problem in modeling human cognition and in making integrated AI systems that can learn autonomously. This paper describes a model of explanation-based conceptual change, integrating sketch understanding, analogical processing, qualitative models, truth-maintenance, and heuristic-based reasoning within the Companions cognitive architecture. Sketch understanding is used to automatically encode stimuli in the form of comic strips. Qualitative models and conceptual quantities are constructed for new phenomena via analogical reasoning and heuristics. Truth-maintenance is used to integrate conceptual and episodic knowledge into explanations, and heuristics are used to modify existing conceptual knowledge in order to produce better explanations. We simulate the learning and revision of the concept of force, testing the concepts learned via a questionnaire of sketches given to students, showing that our model follows a similar learning trajectory.",25,{'Artificial Intelligence': 2}
aaai,https://www.aaai.org/ocs/index.php/AAAI/AAAI10/paper/view/1859/2247,Learning Methods to Generate Good Plans: Integrating HTN Learning and Reinforcement Learning,"Chad Hogg, Ugur Kuter, Hector Munoz-Avila","We consider how to learn Hierarchical Task Networks (HTNs) for planning problems in which both the quality of solution plans generated by the HTNs and the speed at which those plans are found is important. We describe an integration of HTN Learning with Reinforcement Learning to both learn methods by analyzing semantic annotations on tasks and to produce estimates of the expected values of the learned methods by performing Monte Carlo updates. We performed an experiment in which plan quality was inversely related to plan length. In two planning domains, we evaluated the planning performance of the learned methods in comparison to two state-of-the-art satisficing classical planners, FastForward and SGPlan6, and one optimal planner, HSP*. The results demonstrate that a greedy HTN planner using the learned methods was able to generate higher quality solutions than SGPlan6 in both domains and FastForward in one. Our planner, FastForward, and SGPlan6 ran in similar time, while HSP* was exponentially slower.",45,"{'Artificial Intelligence': 1, 'integrated AI': 1, 'statistical machine learning': 1, 'planning and learning': 1, 'cognitive systems': 1, 'case-based reasoning': 1}"
aaai,https://www.aaai.org/ocs/index.php/AAAI/AAAI10/paper/view/1889/2248,Integrating Constraint Satisfaction and Spatial Reasoning,"Unmesh Kurup, Nicholas L. Cassimatis","Many problems in AI, including planning, logical reasoning and probabilistic inference, have been shown to reduce to (weighted) constraint satisfaction. While there are a number of approaches for solving such problems, the recent gains in efficiency of the satisfiability approach have made SAT solvers a popular choice. Modern propositional SAT solvers are efficient for a wide variety of problems. However, particularly in the case of spatial reasoning, conversion to propositional SAT can sometimes result in a large number of variables and/or clauses. Moreover, spatial reasoning problems can often be more efficiently solved if the agent is able to exploit the geometric nature of space to make better choices during search and backtracking. The result of these two drawbacks — larger problem sizes and inefficient search — is that even simple spatial constraint problems are often intractable in the SAT approach. In this paper we propose a spatial reasoning system that provides significant performance improvements in constraint satisfaction problems involving spatial predicates. The key to our approach is to integrate a diagrammatic representation with a DPLL-based backtracking algorithm that is specialized for spatial reasoning. The resulting integrated system can be applied to larger and more complex problems than current approaches and can be adopted to improve performance in a variety of problems ranging from planning to probabilistic inference",8,"{'AI': 1, 'Machine Learning': 1, 'Data Science': 1, 'Cognitive Architectures': 1, 'Spatial/Diagrammatic Reasoning': 1}"
aaai,https://www.aaai.org/ocs/index.php/AAAI/AAAI10/paper/view/1864/2249,Supporting Wilderness Search and Rescue with Integrated Intelligence: Autonomy and Information at the Right Time and the Right Place,"Lanny Lin, Michael Roscheck, Michael A. Goodrich, Bryan S. Morse","Current practice in Wilderness Search and Rescue (WiSAR) is analogous to an intelligent system designed to gather and analyze information to find missing persons in remote areas. The system consists of multiple parts - various tools for information management (maps, GPS, etc) distributed across personnel with different skills and responsibilities. Introducing a camera-equipped mini-UAV into this task requires autonomy and information technology that itself is an integrated intelligent system to be used by a sub-team that must be integrated into the overall intelligent system. In this paper, we identify key elements of the integration challenges along two dimensions: (a) attributes of intelligent system and (b) scale, meaning individual or group. We then present component technology that offload or supplement many responsibilities to autonomous systems, and finally describe how autonomy and information are integrated into user interfaces to better support distributed search across time and space. The integrated system was demoed for Utah County Search and Rescue personnel. A real searcher flew the UAV after minimal training and successfully located the simulated missing person in a wilderness area.",38,"{'Artificial Intelligence': 1, 'Machine Learning': 1, 'Robotics': 1, 'Human-robot interaction': 1, 'multi-agent learning': 1, 'artificial intelligence': 1, 'human machine interaction': 1, 'computer vision': 1, 'computer graphics': 1}"
