conference,url,title,authors,abstract,citations,research_areas
aaai,https://www.aaai.org/ocs/index.php/AAAI/AAAI10/paper/view/1701/2112,Urban Security: Game-Theoretic Resource Allocation in Networked Domains,"Jason Tsai, Zhengyu Yin, Jun-young Kwak, David Kempe, Christopher Kiekintveld, Milind Tambe","Law enforcement agencies frequently must allocate limited resources to protect targets embedded in a network, such as important buildings in a city road network. Since intelligent attackers may observe and exploit patterns in the allocation, it is crucial that the allocations be randomized. We cast this problem as an attacker-defender Stackelberg game: the defender’s goal is to obtain an optimal mixed strategy for allocating resources. The defender’s strategy space is exponential in the number of resources, and the attacker’s exponential in the network size. Existing algorithms are therefore useless for all but the smallest networks. We present a solution approach based on two key ideas: (i) A polynomial-sized game model obtained via an approximation of the strategy space, solved efficiently using a linear program; (ii) Two efficient techniques that map solutions from the approximate game to the original, with proofs of correctness under certain assumptions. We present in-depth experimental results, including an evaluation on part of the Mumbai road network.",95,"{'Artificial Intelligence': 4, 'multiagent system': 1, 'game theory': 1, 'Big Data': 1, 'Machine Leaning': 1, 'Multiagent Systems': 1, 'Robotics': 1, 'Computational Game Theory': 1, 'Multi-Agent Systems': 1}"
aaai,https://www.aaai.org/ocs/index.php/AAAI/AAAI10/paper/view/1905/2113,Automated Channel Abstraction for Advertising Auctions,"William E. Walsh, Craig Boutilier, Tuomas Sandholm, Rob Shields, George Nemhauser, David C. Parkes","The use of simple auction mechanisms like the GSP in online advertising can lead to significant loss of efficiency and revenue when advertisers have rich preferences — even simple forms of expressiveness like budget constraints can lead to suboptimal outcomes. While the optimal allocation of inventory can provide greater efficiency and revenue, natural formulations of the underlying optimization problems grow exponentially in the number of features of interest, presenting a key practical challenge. To address this problem, we propose a means for automatically partitioning inventory into abstract channels so that the least relevant features are ignored. Our approach, based on LP/MIP column and constraint generation, dramatically reduces the size of the problem, thus rendering optimization computationally feasible at practical scales. Our algorithms allow for principled tradeoffs between tractability and solution quality. Numerical experiments demonstrate the computational practicality of our approach as well as the quality of the resulting abstractions.",34,"{'Artificial Intelligence': 2, 'Decision Theory': 2, 'Recommender Systems': 2, 'Computational Economics': 2, 'Reinforcement Learning': 2, 'Economics and Computation': 1, 'Multi-Agent Systems': 1, 'Artificial intelligence': 1, 'auctions': 1, 'market design': 1, 'game theory': 1, 'mechanism design': 1}"
aaai,https://www.aaai.org/ocs/index.php/AAAI/AAAI10/paper/view/1726/2114,Fixing a Tournament,Virginia Vassilevska Williams,"We consider a very natural problem concerned with game manipulation. Let G be a directed graph where the nodes represent players of a game, and an edge from u to v means that u can beat v in the game. (If an edge (u, v) is not present, one cannot match u and v.) Given G and a ""favorite"" node A, is it possible to set up the bracket of a balanced single-elimination tournament so that A is guaranteed to win, if matches occur as predicted by G? We show that the problem is NP-complete for general graphs. For the case when G is a tournament graph we give several interesting conditions on the desired winner A for which there exists a balanced single-elimination tournament which A wins, and it can be found in polynomial time.",51,"{'Theoretical computer science': 3, 'Fine-grained complexity': 3, 'Algorithms and data structures': 3, 'Graph algorithms': 3, 'Complexity Theory': 3, 'computational social choice': 2, 'multiagent systems': 2, 'matching': 2, 'market design': 2, 'Algorithms': 4, 'Exponential Time Algorithms': 2, 'Parameterized Complexity': 3, 'Computational Complexity': 2, 'TCS': 1, 'AI': 1, 'Artificial Intelligence': 2, 'Computational Social Choice': 4, 'Preferences': 2, 'Decision Making': 2, 'Algorithmic Game Theory': 1, 'Mechanism Design': 1, 'Parameteried Complexity': 2, 'Graph Algorithms': 3}"
aaai,https://www.aaai.org/ocs/index.php/AAAI/AAAI10/paper/view/1946/2116,Beyond Equilibrium: Predicting Human Behavior in Normal-Form Games,"James R. Wright, Kevin Leyton-Brown","It is standard in multiagent settings to assume that agents will adopt Nash equilibrium strategies. However, studies in experimental economics demonstrate that Nash equilibrium is a poor description of human players' initial behavior in normal-form games. In this paper, we consider a wide range of widely-studied models from behavioral game theory. For what we believe is the first time, we evaluate each of these models in a meta-analysis, taking as our data set large-scale and publicly-available experimental data from the literature. We then propose modifications to the best-performing model that we believe make it more suitable for practical prediction of initial play by humans in normal-form games.",174,"{'Machine Learning': 1, 'Artificial Intelligence': 1, 'Behavioral Game Theory': 1, 'Algorithmic Game Theory': 1, 'artificial intelligence': 2, 'machine learning': 2, 'game theory': 2, 'algorithms': 2, 'market design': 2}"
aaai,https://www.aaai.org/ocs/index.php/AAAI/AAAI10/paper/view/1725/2117,Trial-Based Dynamic Programming for Multi-Agent Planning,"Feng Wu, Shlomo Zilberstein, Xiaoping Chen","Trial-based approaches offer an efficient way to solve single-agent MDPs and POMDPs. These approaches allow agents to focus their computations on regions of the environment they encounter during the trials, leading to significant computational savings. We present a novel trial-based dynamic programming (TBDP) algorithm for DEC-POMDPs that extends these benefits to multi-agent settings. The algorithm uses trial-based methods for both belief generation and policy evaluation. Policy improvement is implemented efficiently using linear programming and a sub-policy reuse technique that helps bound the amount of memory. The results show that TBDP can produce significant value improvements and is much faster than the best existing planning algorithms.",17,"{'Artificial Intelligence': 2, 'Multiagent Systems': 2, 'Planning': 1, 'Robotics': 1, 'Automated Planning': 1, 'Autonomous Agents': 1, 'Bounded Rationality': 1}"
aaai,https://www.aaai.org/ocs/index.php/AAAI/AAAI10/paper/view/1789/2118,Compilation Complexity of Common Voting Rules,"Lirong Xia, Vincent Conitzer","In computational social choice, one important problem is to take the votes of a subelectorate (subset of the voters), and summarize them using a small number of bits. This needs to be done in such a way that, if all that we know is the summary, as well as the votes of voters outside the subelectorate, we can conclude which of the m alternatives wins. This corresponds to the notion of compilation complexity, the minimum number of bits required to summarize the votes for a particular rule, which was introduced by Chevaleyre et al. [IJCAI-09]. We study three different types of compilation complexity. The first, studied by Chevaleyre et al., depends on the size of the subelectorate but not on the size of the complement (the voters outside the subelectorate). The second depends on the size of the complement but not on the size of the subelectorate. The third depends on both. We first investigate the relations among the three types of compilation complexity. Then, we give upper and lower bounds on all three types of compilation complexity for the most prominent voting rules. We show that for l-approval (when l ≤ m/2), Borda, and Bucklin, the bounds for all three types are asymptotically tight, up to a multiplicative constant; for l-approval (when l > m/2), plurality with runoff, all Condorcet consistent rules that are based on unweighted majority graphs (including Copeland and voting trees), and all Condorcet consistent rules that are based on the order of pairwise elections (including ranked pairs and maximin), the bounds for all three types are asymptotically tight up to a multiplicative constant when the sizes of the subelectorate and its complement are both larger than m1+ε for some ε > 0.",23,"{'Artificial intelligence': 1, 'Algorithm design': 1, 'Social choice (voting) theory': 1, 'Game theory': 1, 'Mechanism design': 1, 'computer science': 1, 'economics': 1, 'artificial intelligence': 1, 'game theory': 1, 'social choice and mechanism design': 1}"
aaai,https://www.aaai.org/ocs/index.php/AAAI/AAAI10/paper/view/1788/2119,Stackelberg Voting Games: Computational Aspects and Paradoxes,"Lirong Xia, Vincent Conitzer","We consider settings in which voters vote in sequence, each voter knows the votes of the earlier voters and the preferences of the later voters, and voters are strategic. This can be modeled as an extensive-form game of perfect information, which we call a Stackelberg voting game. We first propose a dynamic-programming algorithm for finding the backward-induction outcome for any Stackelberg voting game when the rule is anonymous; this algorithm is efficient if the number of alternatives is no more than a constant. We show how to use compilation functions to further reduce the time and space requirements. Our main theoretical results are paradoxes for the backward-induction outcomes of Stackelberg voting games. We show that for any n ≥ 5 and any voting rule that satisfies nonimposition and with a low domination index, there exists a profile consisting of n voters, such that the backward-induction outcome is ranked somewhere in the bottom two positions in almost every voter’s preferences. Moreover, this outcome loses all but one of its pairwise elections. Furthermore, we show that many common voting rules have a very low (= 1) domination index, including all majority-consistent voting rules. For the plurality and nomination rules, we show even stronger paradoxes. Finally, using our dynamic-programming algorithm, we run simulations to compare the backward-induction outcome of the Stackelberg voting game to the winner when voters vote truthfully, for the plurality and veto rules. Surprisingly, our experimental results suggest that on average, more voters prefer the backward-induction outcome.",69,"{'Artificial intelligence': 1, 'Algorithm design': 1, 'Social choice (voting) theory': 1, 'Game theory': 1, 'Mechanism design': 1, 'computer science': 1, 'economics': 1, 'artificial intelligence': 1, 'game theory': 1, 'social choice and mechanism design': 1}"
aaai,https://www.aaai.org/ocs/index.php/AAAI/AAAI10/paper/view/1885/2120,Multi-Agent Learning with Policy Prediction,"Chongjie Zhang, Victor Lesser","Due to the non-stationary environment, learning in multi-agent systems is a challenging problem. This paper first introduces a new gradient-based learning algorithm, augmenting the basic gradient ascent approach with policy prediction. We prove that this augmentation results in a stronger notion of convergence than the basic gradient ascent, that is, strategies converge to a Nash equilibrium within a restricted class of iterated games. Motivated by this augmentation, we then propose a new practical multi-agent reinforcement learning (MARL) algorithm exploiting approximate policy prediction. Empirical results show that it converges faster and in a wider variety of situations than state-of-the-art MARL algorithms.",121,"{'Reinforcement Learning': 1, 'Multi-Agent Systems': 2, 'Deep Learning': 1, 'AI': 1}"
aaai,https://www.aaai.org/ocs/index.php/AAAI/AAAI10/paper/view/1841/2121,Dynamic Auction: A Tractable Auction Procedure,"Dongmo Zhang, Laurent Perrussel","Dynamic auctions are trading mechanisms for discovering market-clearing prices and efficient allocations based on price adjustment processes. This paper studies the computational issues of dynamic auctions for selling multiple indivisible items. Although the decision problem of efficient allocations in a dynamic auction in general is intractable, it can be solved in polynomial time if the economy under consideration satisfies the condition of Gross Substitutes and Complements, which is known as the most general condition that guarantees the existence of Walrasian equilibrium. We propose a polynomial algorithm that can be used to find efficient allocations and introduce a double-direction auction procedure to discover a Walrasian equilibrium in polynomial time.",6,"{'Computer Science': 1, 'Artificial Intelligence': 1, 'Knowledge Representation': 1, 'Multi-Agent Systems': 1, 'BDI agents': 1}"
aaai,https://www.aaai.org/ocs/index.php/AAAI/AAAI10/paper/view/1922/2122,Sequential Incremental-Value Auctions,"Xiaoming Zheng, Sven Koenig","We study the distributed allocation of tasks to cooperating robots in real time, where each task has to be assigned to exactly one robot so that the sum of the latencies of all tasks is as small as possible. We propose a new auction-like algorithm, called Sequential Incremental-Value (SIV) auction, which assigns tasks to robots in multiple rounds. The idea behind SIV auctions is to assign as many tasks per round to robots as possible as long as their individual costs for performing these tasks are at most a given bound, which increases exponentially from round to round. Our theoretical results show that the team costs of SIV auctions are at most a constant factor larger than minimal.",7,"{'Heuristic Search': 2, 'Automated Planning': 2, 'Autonomous Systems': 2, 'Intelligent Agents': 2, 'Artificial Intelligence': 3, 'Algorithmic Game Theory': 1, 'Mechanism Design': 1, 'Social Networks': 1, 'Algorithms: Algorithmic Economics': 2, 'Network Design': 2, 'Discrete Mathematics': 2, 'Algorithms': 1, 'Computational Social Choice': 1, 'Optimization': 1, 'Biology': 1, 'Voting': 1, 'Robotics': 1, 'Robot Networks': 1, 'Motion Planning': 1, 'Machine Learning': 1, 'Market design': 1, 'auctions': 1, 'bargaining': 1, 'game theory': 1, 'industrial organization': 1}"
aaai,https://www.aaai.org/ocs/index.php/AAAI/AAAI10/paper/view/1816/2123,Tolerable Manipulability in Dynamic Assignment without Money,"James Zou, Sujit Gujar, David Parkes","We study a problem of dynamic allocation without money. Agents have arrivals and departures and strict preferences over items. Strategyproofness requires the use of an arrival-priority serial-dictatorship (APSD) mechanism, which is ex post Pareto efficient but has poor ex ante efficiency as measured through average rank efficiency. We introduce the scoring-rule (SR) mechanism, which biases in favor of allocating items that an agent values above the population consensus. The SR mechanism is not strategyproof but has tolerable manipulability in the sense that: (i) if every agent optimally manipulates, it reduces to APSD, and (ii) it significantly outperforms APSD for rank efficiency when only a fraction of agents are strategic. The performance of SR is also robust to mistakes by agents that manipulate on the basis of inaccurate information about the popularity of items.",18,"{'Machine learning': 1, 'computational biology': 1, 'computational health': 1, 'statistics': 1, 'biotech': 1, 'Game Theory and Mechanism Design': 1, 'Algorithmic Mechanism Design': 1, 'Machine Learning and Mechanism Design': 1, 'Crowdsourcing': 1, 'Economics and Computation': 1, 'Multi-Agent Systems': 1}"
aaai,https://www.aaai.org/ocs/index.php/AAAI/AAAI10/paper/view/1892/2124,Learning Simulation Control in General Game-Playing Agents,"Hilmar Finnsson, Yngvi Björnsson","The aim of General Game Playing (GGP) is to create intelligent agents that can automatically learn how to play many different games at an expert level without any human intervention. One of the main challenges such agents face is to automatically learn knowledge-based heuristics in real-time, whether for evaluating game positions or for search guidance. In recent years, GGP agents that use Monte-Carlo simulations to reason about their actions have become increasingly more popular. For competitive play such an approach requires an effective search-control mechanism for guiding the simulation playouts. In here we introduce several schemes for automatically learning search guidance based on both statistical and reinforcement learning techniques. We compare the different schemes empirically on a variety of games and show that they improve significantly upon the current state-of-the-art in simulation-control in GGP. For example, in the chess-like game Skirmish, which has proved a particularly challenging game for simulation-based GGP agents, an agent employing one of the proposed schemes achieves 97% winning rate against an unmodified agent.",88,"{'Artificial Intelligence': 2, 'General Game Playing': 2, 'Monte-Carlo Tree Search': 1, 'Heuristic Search': 1, 'Computer Games': 1}"
aaai,https://www.aaai.org/ocs/index.php/AAAI/AAAI10/paper/view/1686/2126,User-Specific Learning for Recognizing a Singer's Intended Pitch,"Andrew Guillory, Sumit Basu, Dan Morris","We consider the problem of automatic vocal melody transcription: translating an audio recording of a sung melody into a musical score. While previous work has focused on finding the closest notes to the singer's tracked pitch, we instead seek to recover the melody the singer intended to sing. Often, the melody a singer intended to sing differs from what they actually sang; our hypothesis is that this occurs in a singer-specific way. For example, a given singer may often be flat in certain parts of her range, or another may have difficulty with certain intervals. We thus pursue methods for singer-specific training which use learning to combine different methods for pitch prediction. In our experiments with human subjects, we show that via a short training procedure we can learn a singer-specific pitch predictor and significantly improve transcription of intended pitch over other methods. For an average user, our method gives a 20 to 30 percent reduction in pitch classification errors with respect to a baseline method which is comparable to commercial voice transcription tools. For some users, we achieve even more dramatic reductions. Our best results come from a combination of singer-specific-learning with non-singer-specific feature selection. We also discuss the implications of our work for training more general control signals. We make our experimental data available to allow others to replicate or extend our results.",1,"{'Machine Learning': 1, 'Physiological signal processing': 1, 'Human-Computer Interaction': 1, 'Data-Driven Education': 1, 'Auditory Analysis': 1, 'Computational Sustainability': 1, 'Conservation': 1, 'HCI': 1, 'Computer Music': 1, 'Medical Devices': 1}"
aaai,https://www.aaai.org/ocs/index.php/AAAI/AAAI10/paper/view/1831/2127,A Computational Model for Saliency Maps by Using Local Entropy,"Yuewei Lin, Bin Fang, Yuanyan Tang","This paper presents a computational framework for saliency maps. It employs the Earth Mover's Distance based on weighted-Histogram (EMD-wH) to measure the center-surround difference, instead of the Difference-of-Gaussian (DoG) filter used by traditional models. In addition, the model employs not only the traditional features such as colors, intensity and orientation but also the local entropy which expresses the local complexity. The major advantage of combining the local entropy map is that it can detect the salient regions which are not complex regions. Also, it uses a general framework to integrate the feature dimensions instead of summing the features directly. This model considers both local and global salient information, in contrast to the existing models that consider only one or the other. Furthermore, the ""large scale bias"" and ""central bias"" hypotheses are used in this model to select the fixation locations in the saliency map of different scales. The performance of this model is assessed by comparing their saliency maps and human fixation density. The results from this model are finally compared to those from other bottom-up models for reference.",46,"{'Computer vision': 1, 'Machine learning': 1, 'Pattern recognition': 1, 'Image processing': 1}"
aaai,https://www.aaai.org/ocs/index.php/AAAI/AAAI10/paper/view/1888/2128,Grouping Strokes into Shapes in Hand-Drawn Diagrams,"Eric Jeffrey Peterson, Thomas F. Stahovich, Eric Doi, Christine Alvarado","Objects in freely-drawn sketches often have no spatial or temporal separation, making object recognition difficult. We present a two-step stroke-grouping algorithm that first classifies individual strokes according to the type of object to which they belong, then groups strokes with like classifications into clusters representing individual objects. The first step facilitates clustering by naturally separating the strokes, and both steps fluidly integrate spatial and temporal information. Our approach to grouping is unique in its formulation as an efficient classification task rather than, for example, an expensive search task. Our single-stroke classifier performs at least as well as existing single-stroke classifiers on text vs. nontext classification, and we present the first three-way single-stroke classification results. Our stroke grouping results are the first reported of their kind; our grouping algorithm correctly groups between 86% and 91% of the ink in diagrams from two domains, with between 69% and 79% of shapes being perfectly clustered.",45,"{'Natural user interfaces': 1, 'sketch understanding': 1, 'engineering education research': 1}"
aaai,https://www.aaai.org/ocs/index.php/AAAI/AAAI10/paper/view/1836/2129,Symmetry Detection in General Game Playing,Stephan Schiffel,"We develop a method for detecting symmetries in arbitrary games and exploiting these symmetries when using tree search to play the game. Games in the General Game Playing domain are given as a set of logic based rules defining legal moves, their effects and goals of the players. The presented method transforms the rules of a game into a vertex-labeled graph such that automorphisms of the graph correspond with symmetries of the game. The algorithm detects many kinds of symmetries that often occur in games, e.g., rotation and reflection symmetries of boards, interchangeable objects, and symmetric roles. A transposition table is used to efficiently exploit the symmetries in many games.",27,"{'Artificial Intelligence': 15, 'General Game Playing': 8, 'Heuristics': 2, 'Machine Learning': 6, 'Knowledge Representation': 2, 'Uncertainty in AI': 1, 'Computer Games': 2, 'Game AI': 4, 'Constraint Programming': 4, 'Constraints': 1, 'CSP': 1, 'Bimetrics': 1, 'Image Processing': 1, 'Game Playing': 1, 'Video Games': 3, 'Procedural Content Generation': 3, 'Reinforcement Learning Agents': 3, 'Traditional Board Games': 3, 'Reinforcement Learning': 1, 'Search': 1, 'Planning': 1, 'Monte-Carlo Tree Search': 1, 'Heuristic Search': 1}"
aaai,https://www.aaai.org/ocs/index.php/AAAI/AAAI10/paper/view/1951/2132,Generalized Task Markets for Human and Machine Computation,"Dafna Shahaf, Eric Horvitz","We discuss challenges and opportunities for developing generalized task markets where human and machine intelligence are enlisted to solve problems, based on a consideration of the competencies, availabilities, and pricing of different problem-solving resources. The approach couples human computation with machine learning and planning, and is aimed at optimizing the flow of subtasks to people and to computational problem solvers. We illustrate key ideas in the context of Lingua Mechanica, a project focused on harnessing human and machine translation skills to perform translation among languages. We present infrastructure and methods for enlisting and guiding human and machine computation for language translation, including details about the hardness of generating plans for assigning tasks to solvers. Finally, we discuss studies performed with machine and human solvers, focusing on components of a Lingua Mechanica prototype.",94,"{'Data science': 1, 'text mining': 1, 'analogy': 1, 'computational creativity computational humanness': 1, 'Machine intelligence': 1, 'decision theory': 1, 'decisions under uncertainty': 1, 'information retrieval': 1, 'bounded rationality': 1}"
aaai,https://www.aaai.org/ocs/index.php/AAAI/AAAI10/paper/view/1727/2134,A General Game Description Language for Incomplete Information Games,Michael Thielscher,"A General Game Player is a system that can play previously unknown games given nothing but their rules. The Game Description Language (GDL) has been developed as a high-level knowledge representation formalism for axiomatising the rules of any game, and a basic requirement of a General Game Player is the ability to reason logically about a given game description. In this paper, we address the fundamental limitation of existing GDL to be confined to deterministic games with complete information about the game state. To this end, we develop an extension of GDL that is both simple and elegant yet expressive enough to allow to formalise the rules of arbitrary (discrete and finite) n-player games with randomness and incomplete state knowledge. We also show that this extension suffices to provide players with all information they need to reason about their own knowledge as well as that of the other players up front and during game play.",165,{}
