conference,url,title,authors,abstract,citations,research_areas
aaai,https://www.aaai.org/ocs/index.php/AAAI/AAAI10/paper/view/1872/2020,A Topic Model for Linked Documents and Update Rules for its Estimation,"Zhen Guo, Shenghuo Zhu, Zhongfei Zhang, Yun Chi, Yihong Gong","The latent topic model plays an important role in the unsupervised learning from a corpus, which provides a probabilistic interpretation of the corpus in terms of the latent topic space. An underpinning assumption which most of the topic models are based on is that the documents are assumed to be independent of each other. However, this assumption does not hold true in reality and the relations among the documents are available in different ways, such as the citation relations among the research papers. To address this limitation, in this paper we present a Bernoulli Process Topic (BPT) model, where the interdependence among the documents is modeled by a random Bernoulli process. In the BPT model a document is modeled as a distribution over topics that is a mixture of the distributions associated with the related documents. Although BPT aims at obtaining a better document modeling by incorporating the relations among the documents, it could also be applied to many applications including detecting the topics from corpora and clustering the documents. We apply the BPT model to several document collections and the experimental comparisons against several state-of-the-art approaches demonstrate the promising performance.",4,"{'Machine Learning': 2, 'Optimization': 1, 'Information Retrieval': 1, 'Data Mining and Knowledge Discover': 1, 'Multimedia Information Indexing and Retrieval': 1, 'Computer Vision': 1, 'Pattern Re': 1, 'Multimedia content analysis': 1, 'Machine learning': 1, 'Pattern recognition': 1}"
aaai,https://www.aaai.org/ocs/index.php/AAAI/AAAI10/paper/view/1903/2021,Multi-Task Sparse Discriminant Analysis (MtSDA) with Overlapping Categories,"Yahong Han, Fei Wu, Jinzhu Jia, Yueting Zhuang, Bin Yu","Multi-task learning aims at combining information across tasks to boost prediction performance, especially when the number of training samples is small and the number of predictors is very large. In this paper, we first extend the Sparse Discriminate Analysis (SDA) of Clemmensen et al.. We call this Multi-task Sparse Discriminate Analysis (MtSDA). MtSDA formulates multi-label prediction as a quadratic optimization problem whereas SDA obtains single labels via a nearest class mean rule. Second, we propose a class of equicorrelation matrices to use in MtSDA which includes the identity matrix. MtSDA with both matrices are compared with singletask learning (SVM and LDA+SVM) and multi-task learning (HSML). The comparisons are made on real data sets in terms of AUC and F-measure. The data results show that MtSDA outperforms other methods substantially almost all the time and in some cases MtSDA with the equicorrelation matrix substantially outperforms MtSDA with identity matrix.",39,"{'Multimedia': 1, 'Multimedia Retrieval': 2, 'Sparse Representation': 1, 'Machine Learning': 2, 'Knowledge Graph': 1, 'Artificial Intelligence': 1, 'Computer Animation': 1, 'Digital Library': 1, 'Statistics': 1, 'Neuroscience': 1, 'Genomics': 1, 'Remote Sensing': 1}"
aaai,https://www.aaai.org/ocs/index.php/AAAI/AAAI10/paper/view/1596/2022,Two-Stage Sparse Representation for Robust Recognition on Large-Scale Database,"Ran He, BaoGang Hu, Wei-Shi Zheng, YanQing Guo","This paper proposes a novel robust sparse representation method, called the two-stage sparse representation (TSR), for robust recognition on a large-scale database. Based on the divide and conquer strategy, TSR divides the procedure of robust recognition into outlier detection stage and recognition stage. In the first stage, a weighted linear regression is used to learn a metric in which noise and outliers in image pixels are detected. In the second stage, based on the learnt metric, the large-scale dataset is firstly filtered into a small set according to the nearest neighbor criterion. Then a sparse representation is computed by the non-negative least squares technique. The sparse solution is unique and can be optimized efficiently. The extensive numerical experiments on several public databases demonstrate that the proposed TSR approach generally obtains better classification accuracy than the state of the art Sparse Representation Classification (SRC). At the same time, by using the TSR, a significant reduction of computational cost is reached by over fifty times in comparison with the SRC, which enables the TSR to be deployed more suitably for large-scale dataset.",67,"{'Computer vision': 1, 'Machine learning': 2, 'Biometric recognition': 1, 'intelligent systems': 1, 'plant growth modeling': 1, 'Computer Vision': 1, 'Pattern Recognition': 1, 'Machine Learning': 1}"
aaai,https://www.aaai.org/ocs/index.php/AAAI/AAAI10/paper/view/1882/2023,Reinforcement Learning Via Practice and Critique Advice,"Kshitij Judah, Saikat Roy, Alan Fern, Thomas G. Dietterich","We consider the problem of incorporating end-user advice into reinforcement learning (RL). In our setting, the learner alternates between practicing, where learning is based on actual world experience, and end-user critique sessions where advice is gathered. During each critique session the end-user is allowed to analyze a trajectory of the current policy and then label an arbitrary subset of the available actions as good or bad. Our main contribution is an approach for integrating all of the information gathered during practice and critiques in order to effectively optimize a parametric policy. The approach optimizes a loss function that linearly combines losses measured against the world experience and the critique data. We evaluate our approach using a prototype system for teaching tactical battle behavior in a real-time strategy game engine. Results are given for a significant evaluation involving ten end-users showing the promise of this approach and also highlighting challenges involved in inserting end-users into the RL loop.",89,"{'Machine Learning': 4, 'Artificial Intelligence and Data Science': 1, 'Artificial Intelligence': 3, 'Software Engineering': 1, 'Automated Planning': 1, 'Computational Sustainability': 1, 'Reinforcement Learning': 1}"
aaai,https://www.aaai.org/ocs/index.php/AAAI/AAAI10/paper/view/1867/2024,Structure Learning for Markov Logic Networks with Many Descriptive Attributes,"Hassan Khosravi, Oliver Schulte, Tong Man, Xiaoyuan Xu, Bahareh Bina","Many machine learning applications that involve relational databases incorporate first-order logic and probability. Markov Logic Networks (MLNs) are a prominent statistical relational model that consist of weighted first order clauses. Many of the current state-of-the-art algorithms for learning MLNs have focused on relatively small datasets with few descriptive attributes, where predicates are mostly binary and the main task is usually prediction of links between entities. This paper addresses what is in a sense a complementary problem: learning the structure of an MLN that models the distribution of discrete descriptive attributes on medium to large datasets, given the links between entities in a relational database. Descriptive attributes are usually nonbinary and can be very informative, but they increase the search space of possible candidate clauses. We present an efficient new algorithm for learning a directed relational model (parametrized Bayes net), which produces an MLN structure via a standard moralization procedure for converting directed models to undirected models. Learning MLN structure in this way is 200-1000 times faster and scores substantially higher in predictive accuracy than benchmark algorithms on three relational databases.",48,"{'Learning Analytics': 1, 'Learning Technologies': 1, 'Artificial Intelligence in Education': 1}"
aaai,https://www.aaai.org/ocs/index.php/AAAI/AAAI10/paper/view/1785/2025,The Genetic Algorithm as a General Diffusion Model for Social Networks,"Mayank Lahiri, Manuel Cebrian","Diffusion processes taking place in social networks are used to model a number of phenomena, such as the spread of human or computer viruses, and the adoption of products in viral marketing campaigns. It is generally difficult to obtain accurate information about how such spreads actually occur, so a variety of stochastic diffusion models are used to simulate spreading processes in networks instead. We show that a canonical genetic algorithm with a spatially distributed population, when paired with specific forms of Holland's synthetic hyperplane-defined objective functions, can simulate a large and rich class of diffusion models for social networks. These include standard diffusion models, such as the Independent Cascade and Competing Processes models. In addition, our Genetic Algorithm Diffusion Model (GADM) can also model complex phenomena such as information diffusion. We demonstrate an application of the GADM to modeling information flow in a large, dynamic social network derived from e-mail headers.",79,"{'Machine learning': 1, 'data mining': 1, 'graph theory': 1, 'Computational Social Science': 1, 'Network Science': 1, 'Crowdsourcing': 1}"
aaai,https://www.aaai.org/ocs/index.php/AAAI/AAAI10/paper/view/1689/2026,Cost-Sensitive Semi-Supervised Support Vector Machine,"Yu-Feng Li, James T. Kwok, Zhi-Hua Zhou","In this paper, we study cost-sensitive semi-supervised learning where many of the training examples are unlabeled and different misclassification errors are associated with unequal costs. This scenario occurs in many real-world applications. For example, in some disease diagnosis, the cost of erroneously diagnosing a patient as healthy is much higher than that of diagnosing a healthy person as a patient. Also, the acquisition of labeled data requires medical diagnosis which is expensive, while the collection of unlabeled data such as basic health information is much cheaper. We propose the CS4VM (Cost-Sensitive Semi-Supervised Support Vector Machine) to address this problem. We show that the CS4VM, when given the label means of the unlabeled data, closely approximates the supervised cost-sensitive SVM that has access to the ground-truth labels of all the unlabeled data. This observation leads to an efficient algorithm which first estimates the label means and then trains the CS4VM with the plug-in label means by an efficient SVM solver. Experiments on a broad range of data sets show that the proposed method is capable of reducing the total cost and is computationally efficient.",104,"{'Machine Learning': 2, 'Machine learning': 1, 'Artificial Intelligence': 1, 'Data Mining': 1}"
aaai,https://www.aaai.org/ocs/index.php/AAAI/AAAI10/paper/view/1820/2027,Non-Negative Matrix Factorization with Constraints,"Haifeng Liu, Zhaohui Wu","Non-negative matrix factorization (NMF), as a useful decomposition method for multivariate data, has been widely used in pattern recognition, information retrieval and computer vision. NMF is an effective algorithm to find the latent structure of the data and leads to a parts-based representation. However, NMF is essentially an unsupervised method and can not make use of label information. In this paper, we propose a novel semi-supervised matrix decomposition method, called Constrained Non-negative Matrix Factorization, which takes the label information as additional constraints. Specifically, we require that the data points sharing the same label have the same coordinate in the new representation space. This way, the learned representations can have more discriminating power. We demonstrate the effectiveness of this novel algorithm through a set of evaluations on real world applications.",60,"{'Machine Learning': 1, 'Data Management': 1, 'Informaiton Retrieval': 1}"
aaai,https://www.aaai.org/ocs/index.php/AAAI/AAAI10/paper/view/1671/2028,Gaussian Mixture Model with Local Consistency,"Jialu Liu, Deng Cai, Xiaofei He","Gaussian Mixture Model (GMM) is one of the most popular data clustering methods which can be viewed as a linear combination of different Gaussian components. In GMM, each cluster obeys Gaussian distribution and the task of clustering is to group observations into different components through estimating each cluster's own parameters. The Expectation-Maximization algorithm is always involved in such estimation problem. However, many previous studies have shown naturally occurring data may reside on or close to an underlying submanifold. In this paper, we consider the case where the probability distribution is supported on a submanifold of the ambient space. We take into account the smoothness of the conditional probability distribution along the geodesics of data manifold. That is, if two observations are close in intrinsic geometry, their distributions over different Gaussian components are similar. Simply speaking, we introduce a novel method based on manifold structure for data clustering, called Locally Consistent Gaussian Mixture Model (LCGMM). Specifically, we construct a nearest neighbor graph and adopt Kullback-Leibler Divergence as the distance measurement to regularize the objective function of GMM. Experiments on several data sets demonstrate the effectiveness of such regularization.",63,"{'Data Mining': 1, 'Text Mining': 1, 'Machine Learning': 1, 'Machine learning': 1, 'Computer vision': 1, 'Data mining': 1, 'Information retrieval': 1, 'machine learning': 1, 'computer vision': 1, 'data mining': 1}"
aaai,https://www.aaai.org/ocs/index.php/AAAI/AAAI10/paper/view/1950/2029,Constrained Metric Learning Via Distance Gap Maximization,"Wei Liu, Xinmei Tian, Dacheng Tao, Jianzhuang Liu","Vectored data frequently occur in a variety of fields, which are easy to handle since they can be mathematically abstracted as points residing in a Euclidean space. An appropriate distance metric in the data space is quite demanding for a great number of applications. In this paper, we pose robust and tractable metric learning under pairwise constraints that are expressed as similarity judgements between data pairs. The major features of our approach include: 1) it maximizes the gap between the average squared distance among dissimilar pairs and the average squared distance among similar pairs; 2) it is capable of propagating similar constraints to all data pairs; and 3) it is easy to implement in contrast to the existing approaches using expensive optimization such as semidefinite programming. Our constrained metric learning approach has widespread applicability without being limited to particular backgrounds. Quantitative experiments are performed for classification and retrieval tasks, uncovering the effectiveness of the proposed approach.",32,"{'Machine Learning': 2, 'Computer Vision': 2, 'Pattern Recognition': 1, 'Information Retrieval': 1, 'Artificial Intelligence': 1, 'Multimedia Information Retrieval': 1, 'artificial intelligence': 1, 'machine learning': 1, 'computer vision': 1, 'image processing': 1, 'data mining': 1, 'AI': 1}"
aaai,https://www.aaai.org/ocs/index.php/AAAI/AAAI10/paper/view/1790/2030,Multilinear Maximum Distance Embedding Via L1-Norm Optimization,"Yang Liu, Yan Liu, Keith C. C. Chan","Dimensionality reduction plays an important role in many machine learning and pattern recognition tasks. In this paper, we present a novel dimensionality reduction algorithm called multilinear maximum distance embedding (M2DE), which includes three key components. To preserve the local geometry and discriminant information in the embedded space, M2DE utilizes a new objective function, which aims to maximize the distances between some particular pairs of data points, such as the distances between nearby points and the distances between data points from different classes. To make the mapping of new data points straightforward, and more importantly, to keep the natural tensor structure of high-order data, M2DE integrates multilinear techniques to learn the transformation matrices sequentially. To provide reasonable and stable embedding results, M2DE employs the L1-norm, which is more robust to outliers, to measure the dissimilarity between data points. Experiments on various datasets demonstrate that M2DE achieves good embedding results of high-order data for classification tasks.",7,"{'Machine Learning': 1, 'Data Analytics': 1, 'Bioinformatics': 1, 'Fuzzy Systems': 1, 'Evolutionary Computation': 1}"
aaai,https://www.aaai.org/ocs/index.php/AAAI/AAAI10/paper/view/1919/2031,Learning Causal Models of Relational Domains,"Marc Maier, Brian Taylor, Huseyin Oktay, David Jensen","Methods for discovering causal knowledge from observational data have been a persistent topic of AI research for several decades. Essentially all of this work focuses on knowledge representations for propositional domains. In this paper, we present several key algorithmic and theoretical innovations that extend causal discovery to relational domains. We provide strong evidence that effective learning of causal models is enhanced by relational representations. We present an algorithm, relational PC, that learns causal dependencies in a state-of-the-art relational representation, and we identify the key representational and algorithmic innovations that make the algorithm possible. Finally, we prove the algorithm's theoretical correctness and demonstrate its effectiveness on synthetic and real data sets.",42,"{'Causal Discovery': 3, 'Statistical Relational Learning': 2, 'Survival Modeling': 1, 'Fairness and Transparency in Machine Learning': 1, 'Machine Learning': 2, 'Knowledge Discovery': 1, 'Machine learning': 1, 'causal inference': 1, 'Causation': 1, 'Computational Social Science': 1}"
aaai,https://www.aaai.org/ocs/index.php/AAAI/AAAI10/paper/view/1839/2032,Non-Metric Locality-Sensitive Hashing,"Yadong Mu, Shuicheng Yan","Non-metric distances are often more reasonable compared with metric ones in terms of consistency with human perceptions. However, existing locality-sensitive hashing (LSH) algorithms can only support data which are gauged with metrics. In this paper we propose a novel locality-sensitive hashing algorithm targeting such non-metric data. Data in original feature space are embedded into an implicit reproducing kernel Krein space and then hashed to obtain binary bits. Here we utilize the norm-keeping property of p-stable functions to ensure that two data's collision probability reflects their non-metric distance in original feature space. We investigate various concrete examples to validate the proposed algorithm. Extensive empirical evaluations well illustrate its effectiveness in terms of accuracy and retrieval speedup.",80,"{'Computer Vision': 2, 'Machine Learning': 2, 'Multimedia': 1, 'Fashion Recommendation': 1}"
aaai,https://www.aaai.org/ocs/index.php/AAAI/AAAI10/paper/view/1730/2034,A Two-Dimensional Topic-Aspect Model for Discovering Multi-Faceted Topics,"Michael Paul, Roxana Girju","This paper presents the Topic-Aspect Model (TAM), a Bayesian mixture model which jointly discovers topics and aspects. We broadly define an aspect of a document as a characteristic that spans the document, such as an underlying theme or perspective. Unlike previous models which cluster words by topic or aspect, our model can generate token assignments in both of these dimensions, rather than assuming words come from only one of two orthogonal models. We present two applications of the model. First, we model a corpus of computational linguistics abstracts, and find that the scientific topics identified in the data tend to include both a computational aspect and a linguistic aspect. For example, the computational aspect of GRAMMAR emphasizes parsing, whereas the linguistic aspect focuses on formal languages. Secondly, we show that the model can capture different viewpoints on a variety of topics in a corpus of editorials about the Israeli-Palestinian conflict. We show both qualitative and quantitative improvements in TAM over two other state-of-the-art topic models.",157,"{'Natural Language Processing': 1, 'Machine Learning': 1, 'Health Informatics': 1, 'semantics': 1, 'pragmatics': 1, 'discourse analysis': 1, 'human-human/machine communication': 1}"
aaai,https://www.aaai.org/ocs/index.php/AAAI/AAAI10/paper/view/1556/2036,Non-I.I.D. Multi-Instance Dimensionality Reduction by Learning a Maximum Bag Margin Subspace,"Wei Ping, Ye Xu, Kexin Ren, Chi-Hung Chi, Furao Shen","Multi-instance learning, as other machine learning tasks, also suffers from the curse of dimensionality. Although dimensionality reduction methods have been investigated for many years, multi-instance dimensionality reduction methods remain untouched. On the other hand, most algorithms in multi- instance framework treat instances in each bag as independently and identically distributed samples, which fails to utilize the structure information conveyed by instances in a bag. In this paper, we propose a multi-instance dimensionality reduction method, which treats instances in each bag as non-i.i.d. samples. We regard every bag as a whole entity and define a bag margin objective function. By maximizing the margin of positive and negative bags, we learn a subspace to obtain more salient representation of original data. Experiments demonstrate the effectiveness of the proposed method.",20,"{'machine learning': 1, 'speech processing': 1, 'natural language processing': 1, 'generative models': 1, 'Machine learning': 1, 'Search': 1, 'Behavior informatics': 1, 'big data and analytics': 1, 'service science and engineering': 1, 'cloud computing': 1, 'social computing': 1, 'Neural Networks': 1, 'Robotic Intelligence': 1}"
aaai,https://www.aaai.org/ocs/index.php/AAAI/AAAI10/paper/view/1779/2037,Conformal Mapping by Computationally Efficient Methods,"Stefan Pintilie, Ali Ghodsi","Dimensionality reduction is the process by which a set of data points in a higher dimensional space are mapped to a lower dimension while maintaining certain properties of these points relative to each other. One important property is the preservation of the three angles formed by a triangle consisting of three neighboring points in the high dimensional space. If this property is maintained for those same points in the lower dimensional embedding then the result is a conformal map. However, many of the commonly used nonlinear dimensionality reduction techniques, such as Locally Linear Embedding (LLE) or Laplacian Eigenmaps (LEM), do not produce conformal maps. Post-processing techniques formulated as instances of semi-definite programming (SDP) problems can be applied to the output of either LLE or LEM to produce a conformal map. However, the effectiveness of this approach is limited by the computational complexity of SDP solvers. This paper will propose an alternative post-processing algorithm that produces a conformal map but does not require a solution to a SDP problem and so is more computationally efficient thus allowing it to be applied to a wider selection of datasets. Using this alternative solution, the paper will also propose a new algorithm for 3D object classification. An interesting feature of the 3D classification algorithm is that it is invariant to the scale and the orientation of the surface.",5,"{'Machine Learning': 1, 'Deep Learning': 1, 'NLP': 1}"
aaai,https://www.aaai.org/ocs/index.php/AAAI/AAAI10/paper/view/1871/2039,Bayesian Matrix Factorization with Side Information and Dirichlet Process Mixtures,"Ian Porteous, Arthur Asuncion, Max Welling","Matrix factorization is a fundamental technique in machine learning that is applicable to collaborative filtering, information retrieval and many other areas. In collaborative filtering and many other tasks, the objective is to fill in missing elements of a sparse data matrix. One of the biggest challenges in this case is filling in a column or row of the matrix with very few observations. In this paper we introduce a Bayesian matrix factorization model that performs regression against side information known about the data in addition to the observations. The side information helps by adding observed entries to the factored matrices. We also introduce a nonparametric mixture model for the prior of the rows and columns of the factored matrices that gives a different regularization for each latent class. Besides providing a richer prior, the posterior distribution of mixture assignments reveals the latent classes. Using Gibbs sampling for inference, we apply our model to the Netflix Prize problem of predicting movie ratings given an incomplete user-movie ratings matrix. Incorporating rating information with gathered metadata information, our Bayesian approach outperforms other matrix factorization techniques even when using fewer dimensions.",169,"{'Machine Learning': 1, 'Artificial Intelligence': 1, 'Statistics': 1}"
