conference,url,title,authors,abstract
www,https://dl.acm.org/doi/pdf/10.1145/2488388.2488437,Exploiting annotations for the rapid development of collaborative web applications,"Matthias Heinrich, Franz Josef Grüneberger, ","Web application frameworks are a proven means to accelerate the development of interactive web applications. However, implementing collaborative real-time applications like Google Docs requires specific concurrency control services (i.e. document synchronization and conflict resolution) that are not included in prevalent general-purpose frameworks like jQuery or Knockout. Hence, developers have to get familiar with specific collaboration frameworks (e.g. ShareJS) which substantially increases the development effort. To ease the development of collaborative web applications, we propose a set of source code annotations representing a lightweight mechanism to introduce concurrency control services into mature web frameworks. Those annotations are interpreted at runtime by a dedicated collaboration engine to sync documents and resolve conflicts. We enhanced the general-purpose framework Knockout with a collaboration engine and conducted a developer study comparing our approach to a traditional concurrency control library. The evaluation results show that the effort to incorporate collaboration capabilities into a web application can be reduced by up to 40 percent using the annotation-based solution."
www,https://dl.acm.org/doi/pdf/10.1145/2488388.2488438,Web usage mining with semantic analysis,"Laura Hollink, Peter Mika, Roi Blanco, ","Web usage mining has traditionally focused on the individual queries or query words leading to a web site or web page visit, mining patterns in such data. In our work, we aim to characterize websites in terms of the semantics of the queries that lead to them by linking queries to large knowledge bases on the Web. We demonstrate how to exploit such links for more effective pattern mining on query log data. We also show how such patterns can be used to qualitatively describe the differences between competing websites in the same domain and to quantitatively predict website abandonment."
www,https://dl.acm.org/doi/pdf/10.1145/2488388.2488439,Organizational overlap on social networks and its applications,"Cho-Jui Hsieh, Mitul Tiwari, Deepak Agarwal, Xinyi (Lisa) Huang, ","Online social networks have become important for networking, communication, sharing, and discovery. A considerable challenge these networks face is the fact that an online social network is partially observed because two individuals might know each other, but may not have established a connection on the site. Therefore, link prediction and recommendations are important tasks for any online social network. In this paper, we address the problem of computing edge affinity between two users on a social network, based on the users belonging to organizations such as companies, schools, and online groups. We present experimental insights from social network data on organizational overlap, a novel mathematical model to compute the probability of connection between two people based on organizational overlap, and experimental validation of this model based on real social network data. We also present novel ways in which the organization overlap model can be applied to link prediction and community detection, which in itself could be useful for recommending entities to follow and generating personalized news feed."
www,https://dl.acm.org/doi/pdf/10.1145/2488388.2488440,Space-efficient data structures for Top-k completion,"Bo-June (Paul) Hsu, Giuseppe Ottaviano, ","Virtually every modern search application, either desktop, web, or mobile, features some kind of query auto-completion. In its basic form, the problem consists in retrieving from a string set a small number of completions, i.e. strings beginning with a given prefix, that have the highest scores according to some static ranking. In this paper, we focus on the case where the string set is so large that compression is needed to fit the data structure in memory. This is a compelling case for web search engines and social networks, where it is necessary to index hundreds of millions of distinct queries to guarantee a reasonable coverage; and for mobile devices, where the amount of memory is limited."
www,https://dl.acm.org/doi/pdf/10.1145/2488388.2488441,Personalized recommendation via cross-domain triadic factorization,"Liang Hu, Jian Cao, Guandong Xu, Longbing Cao, Zhiping Gu, Can Zhu, ","Collaborative filtering (CF) is a major technique in recommender systems to help users find their potentially desired items. Since the data sparsity problem is quite commonly encountered in real-world scenarios, Cross-Domain Collaborative Filtering (CDCF) hence is becoming an emerging research topic in recent years. However, due to the lack of sufficient dense explicit feedbacks and even no feedback available in users' uninvolved domains, current CDCF approaches may not perform satisfactorily in user preference prediction. In this paper, we propose a generalized Cross Domain Triadic Factorization (CDTF) model over the triadic relation user-item-domain, which can better capture the interactions between domain-specific user factors and item factors. In particular, we devise two CDTF algorithms to leverage user explicit and implicit feedbacks respectively, along with a genetic algorithm based weight parameters tuning algorithm to trade off influence among domains optimally. Finally, we conduct experiments to evaluate our models and compare with other state-of-the-art models by using two real world datasets. The results show the superiority of our models against other comparative models."
www,https://dl.acm.org/doi/pdf/10.1145/2488388.2488442,Unsupervised sentiment analysis with emotional signals,"Xia Hu, Jiliang Tang, Huiji Gao, Huan Liu, ","The explosion of social media services presents a great opportunity to understand the sentiment of the public via analyzing its large-scale and opinion-rich data. In social media, it is easy to amass vast quantities of unlabeled data, but very costly to obtain sentiment labels, which makes unsupervised sentiment analysis essential for various applications. It is challenging for traditional lexicon-based unsupervised methods due to the fact that expressions in social media are unstructured, informal, and fast-evolving. Emoticons and product ratings are examples of emotional signals that are associated with sentiments expressed in posts or words. Inspired by the wide availability of emotional signals in social media, we propose to study the problem of unsupervised sentiment analysis with emotional signals. In particular, we investigate whether the signals can potentially help sentiment analysis by providing a unified way to model two main categories of emotional signals, i.e., emotion indication and emotion correlation. We further incorporate the signals into an unsupervised learning framework for sentiment analysis. In the experiment, we compare the proposed framework with the state-of-the-art methods on two Twitter datasets and empirically evaluate our proposed framework to gain a deep understanding of the effects of emotional signals."
www,https://dl.acm.org/doi/pdf/10.1145/2488388.2488443,An analysis of socware cascades in online social networks,"Ting-Kai Huang, Md Sazzadur Rahman, Harsha V. Madhyastha, Michalis Faloutsos, ","Online social networks (OSNs) have become a popular new vector for distributing malware and spam, which we refer to as socware. Unlike email spam, which is sent by spammers directly to intended victims, socware cascades through OSNs as compromised users spread it to their friends. In this paper, we analyze data from the walls of roughly 3 million Facebook users over five months, with the goal of developing a better understanding of socware cascades."
www,https://dl.acm.org/doi/pdf/10.1145/2488388.2488444,Measurement and analysis of child pornography trafficking on P2P networks,"Ryan Hurley, Swagatika Prusty, Hamed Soroush, Robert J. Walls, ","Peer-to-peer networks are the most popular mechanism for the criminal acquisition and distribution of child pornography (CP). In this paper, we examine observations of peers sharing known CP on the eMule and Gnutella networks, which were collected by law enforcement using forensic tools that we developed. We characterize a year's worth of network activity and evaluate different strategies for prioritizing investigators' limited resources. The highest impact research in criminal forensics works within, and is evaluated under, the constraints and goals of investigations. We follow that principle, rather than presenting a set of isolated, exploratory characterizations of users."
www,https://dl.acm.org/doi/pdf/10.1145/2488388.2488445,HeteroMF: recommendation in heterogeneous information networks using context dependent factor models,"Mohsen Jamali, Laks Lakshmanan, ","With the growing amount of information available online, recommender systems are starting to provide a viable alternative and complement to search engines, in helping users to find objects of interest. Methods based on Matrix Factorization (MF) models are the state-of-the-art in recommender systems. The input to MF is user feedback, in the form of a rating matrix. However, users can be engaged in interactions with multiple types of entities across different contexts, leading to multiple rating matrices. In other words, users can have interactions in a heterogeneous information network. Generally, in a heterogeneous network, entities from any two entity types can have interactions with a weight (rating) indicating the level of endorsement. Collective Matrix Factorization (CMF) has been proposed to address the recommendation problem in heterogeneous networks. However, a main issue with CMF is that entities share the same latent factor across different contexts. This is particularly problematic in two cases: Latent factors for entities that are cold-start in a context will be learnt mainly based on the data from other contexts where these entities are not cold-start, and therefore the factors are not properly learned for the cold-start context. Also, if a context has more data compared to another context, then the dominant context will dominate the learning process for the latent factors for entities shared in these two contexts. In this paper, we propose a context-dependent matrix factorization model, HeteroMF, that considers a general latent factor for entities of every entity type and context-dependent latent factors for every context in which the entities are involved. We learn a general latent factor for every entity and transfer matrices for every context to convert the general latent factors into a context-dependent latent factor. Experiments on two real life datasets from Epinions and Flixster demonstrate that HeteroMF substantially outperforms CMF, particularly for cold-start entities and for contexts where interactions in one contexts are dominated by other contexts."
www,https://dl.acm.org/doi/pdf/10.1145/2488388.2488446,Interactive exploratory search for multi page search results,"Xiaoran Jin, Marc Sloan, Jun Wang, ","Modern information retrieval interfaces typically involve multiple pages of search results, and users who are recall minded or engaging in exploratory search using ad hoc queries are likely to access more than one page. Document rankings for such queries can be improved by allowing additional context to the query to be provided by the user herself using explicit ratings or implicit actions such as clickthroughs. Existing methods using this information usually involved detrimental UI changes that can lower user satisfaction. Instead, we propose a new feedback scheme that makes use of existing UIs and does not alter user's browsing behaviour; to maximise retrieval performance over multiple result pages, we propose a novel retrieval optimisation framework and show that the optimal ranking policy should choose a diverse, exploratory ranking to display on the first page. Then, a personalised re-ranking of the next pages can be generated based on the user's feedback from the first page. We show that document correlations used in result diversification have a significant impact on relevance feedback and its effectiveness over a search session. TREC evaluations demonstrate that our optimal rank strategy (including approximative Monte Carlo Sampling) can naturally optimise the trade-off between exploration and exploitation and maximise the overall user's satisfaction over time against a number of similar baselines."
www,https://dl.acm.org/doi/pdf/10.1145/2488388.2488447,Spatio-temporal dynamics of online memes: a study of geo-tagged tweets,"Krishna Y. Kamath, James Caverlee, Kyumin Lee, Zhiyuan Cheng, ","We conduct a study of the spatio-temporal dynamics of Twitter hashtags through a sample of 2 billion geo-tagged tweets. In our analysis, we (i) examine the impact of location, time, and distance on the adoption of hashtags, which is important for understanding meme diffusion and information propagation; (ii) examine the spatial propagation of hashtags through their focus, entropy, and spread; and (iii) present two methods that leverage the spatio-temporal propagation of hashtags to characterize locations. Based on this study, we find that although hashtags are a global phenomenon, the physical distance between locations is a strong constraint on the adoption of hashtags, both in terms of the hashtags shared between locations and in the timing of when these hashtags are adopted. We find both spatial and temporal locality as most hashtags spread over small geographical areas but at high speeds. We also find that hashtags are mostly a local phenomenon with long-tailed life spans. These (and other) findings have important implications for a variety of systems and applications, including targeted advertising, location-based services, social media search, and content delivery networks."
www,https://dl.acm.org/doi/pdf/10.1145/2488388.2488448,Accountable key infrastructure (AKI): a proposal for a public-key validation infrastructure,"Tiffany Hyun-Jin Kim, Lin-Shung Huang, Adrian Perrig, ","Recent trends in public-key infrastructure research explore the tradeoff between decreased trust in Certificate Authorities (CAs), resilience against attacks, communication overhead (bandwidth and latency) for setting up an SSL/TLS connection, and availability with respect to verifiability of public key information. In this paper, we propose AKI as a new public-key validation infrastructure, to reduce the level of trust in CAs. AKI integrates an architecture for key revocation of all entities (e.g., CAs, domains) with an architecture for accountability of all infrastructure parties through checks-and-balances. AKI efficiently handles common certification operations, and gracefully handles catastrophic events such as domain key loss or compromise. We propose AKI to make progress towards a public-key validation infrastructure with key revocation that reduces trust in any single entity."
www,https://dl.acm.org/doi/pdf/10.1145/2488388.2488449,DIGTOBI: a recommendation system for Digg articles using probabilistic modeling,"Younghoon Kim, Yoonjae Park, Kyuseok Shim, ","Digg is a social news website that lets people submit articles to share their favorite web pages (e.g. blog postings or news articles) and vote the articles posted by others. Digg service currently lists the articles in the front page by popularity without considering each user's preference to the topics in the articles. Helping users to find the most interesting Digg articles tailored to each user's own interests will be very useful, but it is not an easy task to classify the articles according to their topics in order to recommend the articles differently to each user."
www,https://dl.acm.org/doi/pdf/10.1145/2488388.2488450,Understanding latency variations of black box services,"Darja Krushevskaja, Mark Sandler, ","Data centers run many services that impact millions of users daily. In reality, the latency of each service varies from one request to another. Existing tools allow to monitor services for performance glitches or service disruptions, but typically they do not help understanding the variations in latency."
www,https://dl.acm.org/doi/pdf/10.1145/2488388.2488451,"Diversified recommendation on graphs: pitfalls, measures, and algorithms","Onur Küçüktunç, Erik Saule, Kamer Kaya, Ümit V. Çatalyürek, ","Result diversification has gained a lot of attention as a way to answer ambiguous queries and to tackle the redundancy problem in the results. In the last decade, diversification has been applied on or integrated into the process of PageRank- or eigenvector-based methods that run on various graphs, including social networks, collaboration networks in academia, web and product co-purchasing graphs. For these applications, the diversification problem is usually addressed as a bicriteria objective optimization problem of relevance and diversity. However, such an approach is questionable since a query-oblivious diversification algorithm that recommends most of its results without even considering the query may perform the best on these commonly used measures. In this paper, we show the deficiencies of popular evaluation techniques of diversification methods, and investigate multiple relevance and diversity measures to understand whether they have any correlations. Next, we propose a novel measure called expanded relevance which combines both relevance and diversity into a single function in order to measure the coverage of the relevant part of the graph. We also present a new greedy diversification algorithm called BestCoverage, which optimizes the expanded relevance of the result set with (1-1/e)-approximation. With a rigorous experimentation on graphs from various applications, we show that the proposed method is efficient and effective for many use cases."
www,https://dl.acm.org/doi/pdf/10.1145/2488388.2488452,What is the added value of negative links in online social networks?,"Jérôme Kunegis, Julia Preusse, Felix Schwagereit, ","We investigate the ""negative link"" feature of social networks that allows users to tag other users as foes or as distrusted in addition to the usual friend and trusted links. To answer the question whether negative links have an added value for an online social network, we investigate the machine learning problem of predicting the negative links of such a network using only the positive links as a basis, with the idea that if this problem can be solved with high accuracy, then the ""negative link"" feature is redundant. In doing so, we also present a general methodology for assessing the added value of any new link type in online social networks. Our evaluation is performed on two social networks that allow negative links: The technology news website Slashdot and the product review site Epinions. In experiments with these two datasets, we come to the conclusion that a combination of centrality-based and proximity-based link prediction functions can be used to predict the negative edges in the networks we analyse. We explain this result by an application of the models of preferential attachment and balance theory to our learning problem, and show that the ""negative link"" feature has a small but measurable added value for these social networks."
www,https://dl.acm.org/doi/pdf/10.1145/2488388.2488453,Voices of victory: a computational focus group framework for tracking opinion shift in real time,"Yu-Ru Lin, Drew Margolin, Brian Keegan, David Lazer, ","Social media have been employed to assess public opinions on events, markets, and policies. Most current work focuses on either developing aggregated measures or opinion extraction methods like sentiment analysis. These approaches suffer from unpredictable turnover in the participants and the information they react to, making it difficult to distinguish meaningful shifts from those that follow from known information. We propose a novel approach to tame these sources of uncertainty through the introduction of ""computational focus groups"" to track opinion shifts in social media streams. Our approach uses prior user behaviors to detect users' biases, then groups users with similar biases together. We track the behavior streams from these like-minded sub-groups and present time-dependent collective measures of their opinions. These measures control for the response rate and base attitudes of the users, making shifts in opinion both easier to detect and easier to interpret. We test the effectiveness of our system by tracking groups' Twitter responses to a common stimulus set: the 2012 U.S. presidential election debates. While our groups' behavior is consistent with their biases, there are numerous moments and topics on which they behave ""out of character,"" suggesting precise targets for follow-up inquiry. We also demonstrate that tracking elite users with well-established biases does not yield such insights, as they are insensitive to the stimulus and simply reproduce expected patterns. The effectiveness of our system suggests a new direction both for researchers and data-driven journalists interested in identifying opinion shifting processes in real-time."
www,https://dl.acm.org/doi/pdf/10.1145/2488388.2488454,Rethinking the web as a personal archive,"Siân E. Lindley, Catherine C. Marshall, Richard Banks, Abigail Sellen, Tim Regan, ","In recent years the Web has evolved substantially, transforming from a place where we primarily find information to a place where we also leave, share and keep it. This presents a fresh set of challenges for the management of personal information, which include how to underpin greater awareness and more control over digital belongings and other personally meaningful content that is hosted online. In the study reported here, we follow up on research that suggests a sense of ownership and control can be reinforced by federating online content as a virtual, single store; we do this by conducting interviews with 14 individuals about their Web-based content. Participants were asked to give the researchers a tour of online content that is personally meaningful to them; to perform a search for themselves in order to uncover additional content; and to respond to a series of design envisionments. We examine whether there is any value in an integrated personal archive that would automatically update and serve firstly, as a source of information regarding the content within it (e.g. where it is stored, who has the rights to it), and secondly, as a resource for crafting personal artefacts such as scrapbooks, CVs and gifts for others. Our analysis leads us to reject the concept of a single archive. Instead, we present a framework of five different types of online content, each of which has separate implications for personal information management."
www,https://dl.acm.org/doi/pdf/10.1145/2488388.2488455,Expressive languages for selecting groups from graph-structured data,"Vitaliy Liptchinsky, Benjamin Satzger, Rostyslav Zabolotnyi, Schahram Dustdar, ","Many query languages for graph-structured data are based on regular path expressions, which describe relations among pairs of nodes. We propose an extension that allows to retrieve groups of nodes based on group structural characteristics and relations to other nodes or groups. It allows to express group selection queries in a concise and natural style, and can be integrated into any query language based on regular path queries. We present an efficient algorithm for evaluating group queries in polynomial time from an input data graph. Evaluations using real-world social networks demonstrate the practical feasibility of our approach."
www,https://dl.acm.org/doi/pdf/10.1145/2488388.2488456,Modeling/predicting the evolution trend of osn-based applications,"Han Liu, Atif Nazir, Jinoo Joung, Chen-Nee Chuah, ","While various models have been proposed for generating social/friendship network graphs, the dynamics of user interactions through online social network (OSN) based applications remain largely unexplored. We previously developed a growth model to capture static weekly snapshots of user activity graphs (UAGs) using data from popular Facebook gifting applications. This paper presents a new continuous graph evolution model aimed to capture microscopic user-level behaviors that govern the growth of the UAG and collectively define the overall graph structure. We demonstrate the utility of our model by applying it to forecast the number of active users over time as the application transitions from initial growth to peak/mature and decline/fatique phase. Using empirical evaluations, we show that our model can accurately reproduce the evolution trend of active user population for gifting applications, or other OSN applications that employ similar growth mechanisms. We also demonstrate that the predictions from our model can guide the generation of synthetic graphs that accurately represent empirical UAG snapshots sampled at different evolution stages."
