conference,url,title,authors,abstract
www,https://dl.acm.org/doi/pdf/10.1145/2488388.2488457,SoCo: a social network aided context-aware recommender system,"Xin Liu, Karl Aberer, ","Contexts and social network information have been proven to be valuable information for building accurate recommender system. However, to the best of our knowledge, no existing works systematically combine diverse types of such information to further improve recommendation quality. In this paper, we propose SoCo, a novel context-aware recommender system incorporating elaborately processed social network information. We handle contextual information by applying random decision trees to partition the original user-item-rating matrix such that the ratings with similar contexts are grouped. Matrix factorization is then employed to predict missing preference of a user for an item using the partitioned matrix. In order to incorporate social network information, we introduce an additional social regularization term to the matrix factorization objective function to infer a user's preference for an item by learning opinions from his/her friends who are expected to share similar tastes. A context-aware version of Pearson Correlation Coefficient is proposed to measure user similarity. Real datasets based experiments show that SoCo improves the performance (in terms of root mean square error) of the state-of-the-art context-aware recommender system and social recommendation model by 15.7% and 12.2% respectively."
www,https://dl.acm.org/doi/pdf/10.1145/2488388.2488458,Using stranger as sensors: temporal and geo-sensitive question answering via social media,"Yefeng Liu, Todorka Alexandrova, Tatsuo Nakajima, ","MoboQ is a location-based real-time social question answering service deployed in the field in China. Using MoboQ, people can ask temporal and geo-sensitive questions, such as how long is the line at a popular business right now, and then receive answers that crowdsourced from other users in a timely fashion. To obtain answers for questions, the system analyzes the live stream from public microblogging service Sina Weibo to identify people who are likely to currently be at the place that is associated with a question and sends them the unsolicited question through the microblogging service from which they were identified. MoboQ was deployed in China at the beginning of 2012, until October of the same year, it was used to ask 15,224 questions by 35,214 registered users, and it gathered 29,491 answers; 74.6% of the questions received at least one answer, 28% received a first response within 10 minutes, and 51% of the questions got first answer within 20 minutes. In total, 91% of the questions successfully found at least one answer candidate, and they were sent to 162,954 microblogging service users. We analyze the usage patterns and behaviors of the real-world end-users, discuss the lessons learned, and outline the future directions and possible applications that could be built on top of MoboQ."
www,https://dl.acm.org/doi/pdf/10.1145/2488388.2488459,Imagen: runtime migration of browser sessions for javascript web applications,"James Teng Kin Lo, Eric Wohlstadter, Ali Mesbah, ","Due to the increasing complexity of web applications and emerging HTML5 standards, a large amount of runtime state is created and managed in the user's browser. While such complexity is desirable for user experience, it makes it hard for developers to implement mechanisms that provide users ubiquitous access to the data they create during application use. This paper presents our research into browser session migration for JavaScript-based web applications. Session migration is the act of transferring a session between browsers at runtime. Without burden to developers, our system allows users to create a snapshot image that captures all runtime state needed to resume the session elsewhere. Our system works completely in the JavaScript layer and thus snapshots can be transfered between different browser vendors and hardware devices. We report on performance metrics of the system using five applications, four different browsers, and three different devices."
www,https://dl.acm.org/doi/pdf/10.1145/2488388.2488460,Gender swapping and user behaviors in online social games,"Jing-Kai Lou, Kunwoo Park, Meeyoung Cha, Juyong Park, ","Modern Massively Multiplayer Online Role-Playing Games (MMORPGs) provide lifelike virtual environments in which players can conduct a variety of activities including combat, trade, and chat with other players. While the game world and the available actions therein are inspired by their offline counterparts, the games' popularity and dedicated fan base are testaments to the allure of novel social interactions granted to people by allowing them an alternative life as a new character and persona. In this paper we investigate the phenomenon of ""gender swapping,"" which refers to players choosing avatars of genders opposite to their natural ones. We report the behavioral patterns observed in players of Fairyland Online, a globally serviced MMORPG, during social interactions when playing as in-game avatars of their own real gender or gender-swapped. We also discuss the effect of gender role and self-image in virtual social situations and the potential of our study for improving MMORPG quality and detecting online identity frauds."
www,https://dl.acm.org/doi/pdf/10.1145/2488388.2488461,Mining structural hole spanners through information diffusion in social networks,"Tiancheng Lou, Jie Tang, ","The theory of structural holes suggests that individuals would benefit from filling the ""holes"" (called as structural hole spanners) between people or groups that are otherwise disconnected. A few empirical studies have verified that structural hole spanners play a key role in the information diffusion. However, there is still lack of a principled methodology to detect structural hole spanners from a given social network."
www,https://dl.acm.org/doi/pdf/10.1145/2488388.2488462,On the evolution of the internet economic ecosystem,"Richard T.B. Ma, John C.S. Lui, Vishal Misra, ","The evolution of the Internet has manifested itself in many ways: the traffic characteristics, the interconnection topologies and the business relationships among the autonomous components. It is important to understand why (and how) this evolution came about, and how the interplay of these dynamics may affect future evolution and services. We propose a network aware, macroscopic model that captures the characteristics and interactions of the application and network providers, and show how it leads to a market equilibrium of the ecosystem. By analyzing the driving forces and the dynamics of the market equilibrium, we obtain some fundamental understandings of the cause and effect of the Internet evolution, which explain why some historical and recent evolutions have happened. Furthermore, by projecting the likely future evolutions, our model can help application and network providers to make informed business decisions so as to succeed in this competitive ecosystem."
www,https://dl.acm.org/doi/pdf/10.1145/2488388.2488463,Two years of short URLs internet measurement: security threats and countermeasures,"Federico Maggi, Alessandro Frossi, Stefano Zanero, Gianluca Stringhini, ","URL shortening services have become extremely popular. However, it is still unclear whether they are an effective and reliable tool that can be leveraged to hide malicious URLs, and to what extent these abuses can impact the end users. With these questions in mind, we first analyzed existing countermeasures adopted by popular shortening services. Surprisingly, we found such countermeasures to be ineffective and trivial to bypass. This first measurement motivated us to proceed further with a large-scale collection of the HTTP interactions that originate when web users access live pages that contain short URLs. To this end, we monitored 622 distinct URL shortening services between March 2010 and April 2012, and collected 24,953,881 distinct short URLs. With this large dataset, we studied the abuse of short URLs. Despite short URLs are a significant, new security risk, in accordance with the reports resulting from the observation of the overall phishing and spamming activity, we found that only a relatively small fraction of users ever encountered malicious short URLs. Interestingly, during the second year of measurement, we noticed an increased percentage of short URLs being abused for drive-by download campaigns and a decreased percentage of short URLs being abused for spam campaigns. In addition to these security-related findings, our unique monitoring infrastructure and large dataset allowed us to complement previous research on short URLs and analyze these web services from the user's perspective."
www,https://dl.acm.org/doi/pdf/10.1145/2488388.2488464,Know your personalization: learning topic level personalization in online services,"Anirban Majumder, Nisheeth Shrivastava, ","Online service platforms (OSPs), such as search engines, news-websites, ad-providers, etc., serve highly personalized content to the user, based on the profile extracted from her history with the OSP. In this paper, we capture OSP's personalization for an user in a new data structure called the personalization vector (?), which is a weighted vector over a set of topics, and present efficient algorithms to learn it."
www,https://dl.acm.org/doi/pdf/10.1145/2488388.2488465,"Saving, reusing, and remixing web video: using attitudes and practices to reveal social norms","Catherine C. Marshall, Frank M. Shipman, ","The growth of online videos has spurred a concomitant increase in the storage, reuse, and remix of this content. As we gain more experience with video content, social norms about ownership have evolved accordingly, spelling out what people think is appropriate use of content that is not necessarily their own. We use a series of three studies, each centering on a different genre of recordings, to probe 634 participants' attitudes toward video storage, reuse, and remix; we also question participants about their own experiences with online video. The results allow us to characterize current practice and emerging social norms and to establish the relationship between the two. Hypotheticals borrowed from legal research are used as the primary vehicle for testing attitudes, and for identifying boundaries between socially acceptable and unacceptable behavior."
www,https://dl.acm.org/doi/pdf/10.1145/2488388.2488466,From amateurs to connoisseurs: modeling the evolution of user expertise through online reviews,"Julian John McAuley, Jure Leskovec, ","Recommending products to consumers means not only understanding their tastes, but also understanding their level of experience. For example, it would be a mistake to recommend the iconic film Seven Samurai simply because a user enjoys other action movies; rather, we might conclude that they will eventually enjoy it---once they are ready. The same is true for beers, wines, gourmet foods---or any products where users have acquired tastes: the `best' products may not be the most 'accessible'. Thus our goal in this paper is to recommend products that a user will enjoy now, while acknowledging that their tastes may have changed over time, and may change again in the future. We model how tastes change due to the very act of consuming more products---in other words, as users become more experienced. We develop a latent factor recommendation system that explicitly accounts for each user's level of experience. We find that such a model not only leads to better recommendations, but also allows us to study the role of user experience and expertise on a novel dataset of fifteen million beer, wine, food, and movie reviews."
www,https://dl.acm.org/doi/pdf/10.1145/2488388.2488467,The FLDA model for aspect-based opinion mining: addressing the cold start problem,"Samaneh Moghaddam, Martin Ester, ","Aspect-based opinion mining from online reviews has attracted a lot of attention recently. The main goal of all of the proposed methods is extracting aspects and/or estimating aspect ratings. Recent works, which are often based on Latent Dirichlet Allocation (LDA), consider both tasks simultaneously. These models are normally trained at the item level, i.e., a model is learned for each item separately. Learning a model per item is fine when the item has been reviewed extensively and has enough training data. However, in real-life data sets such as those from Epinions.com and Amazon.com more than 90% of items have less than 10 reviews, so-called cold start items. State-of-the-art LDA models for aspect-based opinion mining are trained at the item level and therefore perform poorly for cold start items due to the lack of sufficient training data. In this paper, we propose a probabilistic graphical model based on LDA, called Factorized LDA (FLDA), to address the cold start problem. The underlying assumption of FLDA is that aspects and ratings of a review are influenced not only by the item but also by the reviewer. It further assumes that both items and reviewers can be modeled by a set of latent factors which represent their aspect and rating distributions. Different from state-of-the-art LDA models, FLDA is trained at the category level and learns the latent factors using the reviews of all the items of a category, in particular the non cold start items, and uses them as prior for cold start items. Our experiments on three real-life data sets demonstrate the improved effectiveness of the FLDA model in terms of likelihood of the held-out test set. We also evaluate the accuracy of FLDA based on two application-oriented measures."
www,https://dl.acm.org/doi/pdf/10.1145/2488388.2488468,Iolaus: securing online content rating systems,"Arash Molavi Kakhki, Chloe Kliman-Silver, Alan Mislove, ","Online content ratings services allow users to find and share content ranging from news articles (Digg) to videos (YouTube) to businesses (Yelp). Generally, these sites allow users to create accounts, declare friendships, upload and rate content, and locate new content by leveraging the aggregated ratings of others. These services are becoming increasingly popular; Yelp alone has over 33 million reviews. Unfortunately, this popularity is leading to increasing levels of malicious activity, including multiple identity (Sybil) attacks and the ""buying"" of ratings from users."
www,https://dl.acm.org/doi/pdf/10.1145/2488388.2488469,"On cognition, emotion, and interaction aspects of search tasks with different search intentions","Yashar Moshfeghi, Joemon M. Jose, ","The complex and dynamic nature of search processes surrounding information seeking have been exhaustively studied. Recent studies have highlighted search processes with different intentions, such as those for entertainment purposes or re-finding a visited information object, are fundamentally different in nature to typical information seeking intentions. Despite the popularity of such search processes on the Web, they have not yet been thoroughly explored. Using a video retrieval system as a use case, we study the characteristics of four different search task types: seeking information, re-finding a particular information object, and two different entertainment intentions (i.e. entertainment by adjusting arousal level, and entertainment by adjusting mood). In particular, we looked at the cognition, emotion and action aspects of these search tasks at different phases of a search process. This follows the common assumption in the information seeking and retrieval community that a complex search process can be broken down into a relatively small number of activity phases. Our experimental results show significant differences in the characteristics of studied search tasks. Furthermore, we investigate whether we can predict these search tasks given user's interaction with the system. Results show that we can learn a model that predicts the search task types with reasonable accuracy. Overall, these findings may help to steer search engines to better satisfy searchers' needs beyond typically assumed information seeking processes."
www,https://dl.acm.org/doi/pdf/10.1145/2488388.2488470,Ad impression forecasting for sponsored search,"Abhirup Nath, Shibnath Mukherjee, Prateek Jain, Navin Goyal, Srivatsan Laxman, ","A typical problem for a search engine (hosting sponsored search service) is to provide the advertisers with a forecast of the number of impressions his/her ad is likely to obtain for a given bid. Accurate forecasts have high business value, since they enable advertisers to select bids that lead to better returns on their investment. They also play an important role in services such as automatic campaign optimization. Despite its importance the problem has remained relatively unexplored in literature. Existing methods typically overfit to the training data, leading to inconsistent performance. Furthermore, some of the existing methods cannot provide predictions for new ads, i.e., for ads that are not present in the logs. In this paper, we develop a generative model based approach that addresses these drawbacks. We design a Bayes net to capture inter-dependencies between the query traffic features and the competitors in an auction. Furthermore, we account for variability in the volume of query traffic by using a dynamic linear model. Finally, we implement our approach on a production grade MapReduce framework and conduct extensive large scale experiments on substantial volumes of sponsored search data from Bing. Our experimental results demonstrate significant advantages over existing methods as measured using several accuracy/error criteria, improved ability to provide estimates for new ads and more consistent performance with smaller variance in accuracies. Our method can also be adapted to several other related forecasting problems such as predicting average position of ads or the number of clicks under budget constraints."
www,https://dl.acm.org/doi/pdf/10.1145/2488388.2488471,Measurement and modeling of eye-mouse behavior in the presence of nonlinear page layouts,"Vidhya Navalpakkam, LaDawn Jentzsch, Rory Sayres, Sujith Ravi, Amr Ahmed, ","As search pages are becoming increasingly complex, with images and nonlinear page layouts, understanding how users examine the page is important. We present a lab study on the effect of a rich informational panel to the right of the search result column, on eye and mouse behavior. Using eye and mouse data, we show that the flow of user attention on nonlinear page layouts is different from the widely believed top-down linear examination order of search results. We further demonstrate that the mouse, like the eye, is sensitive to two key attributes of page elements -- their position (layout), and their relevance to the user's task. We identify mouse measures that are strongly correlated with eye movements, and develop models to predict user attention (eye gaze) from mouse activity. These findings show that mouse tracking can be used to infer user attention and information flow patterns on search pages. Potential applications include ranking, search page optimization, and UI evaluation."
www,https://dl.acm.org/doi/pdf/10.1145/2488388.2488472,Understanding and decreasing the network footprint of catch-up tv,"Gianfranco Nencioni, Nishanth Sastry, Jigna Chandaria, Jon Crowcroft, ","""Catch-up"", or on-demand access of previously broadcast TV content over the public Internet, constitutes a significant fraction of peak time network traffic. This paper analyses consumption patterns of nearly 6 million users of a nationwide deployment of a catch-up TV service, to understand the network support required. We find that catch-up has certain natural scaling properties compared to traditional TV: The on-demand nature spreads load over time, and users have much higher completion rates for content streams than previously reported. Users exhibit strong preferences for serialised content, and for specific genres."
www,https://dl.acm.org/doi/pdf/10.1145/2488388.2488473,"Sorry, i don't speak SPARQL: translating SPARQL queries into natural language","Axel-Cyrille Ngonga Ngomo, Lorenz Bühmann, Christina Unger, ","Over the past years, Semantic Web and Linked Data technologies have reached the backend of a considerable number of applications. Consequently, large amounts of RDF data are constantly being made available across the planet. While experts can easily gather information from this wealth of data by using the W3C standard query language SPARQL, most lay users lack the expertise necessary to proficiently interact with these applications. Consequently, non-expert users usually have to rely on forms, query builders, question answering or keyword search tools to access RDF data. However, these tools have so far been unable to explicate the queries they generate to lay users, making it difficult for these users to i) assess the correctness of the query generated out of their input, and ii) to adapt their queries or iii) to choose in an informed manner between possible interpretations of their input. This paper addresses this drawback by presenting SPARQL2NL, a generic approach that allows verbalizing SPARQL queries, i.e., converting them into natural language. Our framework can be integrated into applications where lay users are required to understand SPARQL or to generate SPARQL queries in a direct (forms, query builders) or an indirect (keyword search, question answering) manner. We evaluate our approach on the DBpedia question set provided by QALD-2 within a survey setting with both SPARQL experts and lay users. The results of the 115 filled surveys show that SPARQL2NL can generate complete and easily understandable natural language descriptions. In addition, our results suggest that even SPARQL experts can process the natural language representation of SPARQL queries computed by our approach more efficiently than the corresponding SPARQL queries. Moreover, non-experts are enabled to reliably understand the content of SPARQL queries."
www,https://dl.acm.org/doi/pdf/10.1145/2488388.2488474,"Bitsquatting: exploiting bit-flips for fun, or profit?","Nick Nikiforakis, Steven Van Acker, Wannes Meert, Lieven Desmet, ","Over the last fifteen years, several types of attacks against domain names and the companies relying on them have been observed. The well-known cybersquatting of domain names gave way to typosquatting, the abuse of a user's mistakes when typing a URL in her browser's address bar. Recently, a new attack against domain names surfaced, namely bitsquatting. In bitsquatting, an attacker leverages random bit-errors occurring in the memory of commodity computers and smartphones, to redirect Internet traffic to attacker-controlled domains."
www,https://dl.acm.org/doi/pdf/10.1145/2488388.2488475,One-class collaborative filtering with random graphs,"Ulrich Paquet, Noam Koenigstein, ","The bane of one-class collaborative filtering is interpreting and modelling the latent signal from the missing class. In this paper we present a novel Bayesian generative model for implicit collaborative filtering. It forms a core component of the Xbox Live architecture, and unlike previous approaches, delineates the odds of a user disliking an item from simply being unaware of it. The latent signal is treated as an unobserved random graph connecting users with items they might have encountered. We demonstrate how large-scale distributed learning can be achieved through a combination of stochastic gradient descent and mean field variational inference over random graph samples. A fine-grained comparison is done against a state of the art baseline on real world data."
www,https://dl.acm.org/doi/pdf/10.1145/2488388.2488476,Latent credibility analysis,"Jeff Pasternack, Dan Roth, ","A frequent problem when dealing with data gathered from multiple sources on the web (ranging from booksellers to Wikipedia pages to stock analyst predictions) is that these sources disagree, and we must decide which of their (often mutually exclusive) claims we should accept. Current state-of-the-art information credibility algorithms known as ""fact-finders"" are transitive voting systems with rules specifying how votes iteratively flow from sources to claims and then back to sources. While this is quite tractable and often effective, fact-finders also suffer from substantial limitations; in particular, a lack of transparency obfuscates their credibility decisions and makes them difficult to adapt and analyze: knowing the mechanics of how votes are calculated does not readily tell us what those votes mean, and finding, for example, that a source has a score of 6 is not informative. We introduce a new approach to information credibility, Latent Credibility Analysis (LCA), constructing strongly principled, probabilistic models where the truth of each claim is a latent variable and the credibility of a source is captured by a set of model parameters. This gives LCA models clear semantics and modularity that make extending them to capture additional observed and latent credibility factors straightforward. Experiments over four real-world datasets demonstrate that LCA models can outperform the best fact-finders in both unsupervised and semi-supervised settings."
