conference,url,title,authors,abstract
www,https://dl.acm.org/doi/pdf/10.1145/2488388.2488477,Predicting group stability in online social networks,"Akshay Patil, Juan Liu, Jie Gao, ","Social groups often exhibit a high degree of dynamism. Some groups thrive, while many others die over time. Modeling group stability dynamics and understanding whether/when a group will remain stable or shrink over time can be important in a number of social domains. In this paper, we study two different types of social networks as exemplar platforms for modeling and predicting group stability dynamics. We build models to predict if a group is going to remain stable or is likely to shrink over a period of time. We observe that both the level of member diversity and social activities are critical in maintaining the stability of groups. We also find that certain 'prolific' members play a more important role in maintaining the group stability. Our study shows that group stability can be predicted with high accuracy, and feature diversity is critical to prediction performance."
www,https://dl.acm.org/doi/pdf/10.1145/2488388.2488478,Predictive web automation assistant for people with vision impairments,"Yury Puzis, Yevgen Borodin, Rami Puzis, I.V. Ramakrishnan, ","The Web is far less usable and accessible for people with vision impairments than it is for sighted people. Web automation, a process of automating browsing actions on behalf of the user, has the potential to bridge the divide between the ways sighted and people with vision impairment access the Web; specifically, it can enable the latter to breeze through web browsing tasks that beforehand were slow, hard, or even impossible to accomplish. Typical web automation requires that the user record a macro, a sequence of browsing steps, so that these steps can be automated in the future by replaying the macro. However, for people with vision impairment, automation with macros is not usable."
www,https://dl.acm.org/doi/pdf/10.1145/2488388.2488479,Mining collective intelligence in diverse groups,"Guo-Jun Qi, Charu C. Aggarwal, Jiawei Han, Thomas Huang, ","Collective intelligence, which aggregates the shared information from large crowds, is often negatively impacted by unreliable information sources with the low quality data. This becomes a barrier to the effective use of collective intelligence in a variety of applications. In order to address this issue, we propose a probabilistic model to jointly assess the reliability of sources and find the true data. We observe that different sources are often not independent of each other. Instead, sources are prone to be mutually influenced, which makes them dependent when sharing information with each other. High dependency between sources makes collective intelligence vulnerable to the overuse of redundant (and possibly incorrect) information from the dependent sources. Thus, we reveal the latent group structure among dependent sources, and aggregate the information at the group level rather than from individual sources directly. This can prevent the collective intelligence from being inappropriately dominated by dependent sources. We will also explicitly reveal the reliability of groups, and minimize the negative impacts of unreliable groups. Experimental results on real-world data sets show the effectiveness of the proposed approach with respect to existing algorithms."
www,https://dl.acm.org/doi/pdf/10.1145/2488388.2488480,Trade area analysis using user generated mobile location data,"Yan Qu, Jun Zhang, ","In this paper, we illustrate how User Generated Mobile Location Data (UGMLD) like Foursquare check-ins can be used in Trade Area Analysis (TAA) by introducing a new framework and corresponding analytic methods. Three key processes were created: identifying the activity center of a mobile user, profiling users based on their location history, and modeling users' preference probability. Extensions to traditional TAA are introduced, including customer-centric distance decay analysis and check-in sequence analysis. Adopting the rich content and context of UGMLD, these methods introduce new dimensions to modeling and delineating trade areas. Analyzing customers' visits to a business in the context of their daily life sheds new light on the nature and performance of the venue. This work has important business implications in the field of mobile computing."
www,https://dl.acm.org/doi/pdf/10.1145/2488388.2488481,Psychological maps 2.0: a web engagement enterprise starting in London,"Daniele Quercia, Joao Paulo Pesce, Virgilio Almeida, Jon Crowcroft, ","Planners and social psychologists have suggested that the recognizability of the urban environment is linked to people's socio-economic well-being. We build a web game that puts the recognizability of London's streets to the test. It follows as closely as possible one experiment done by Stanley Milgram in 1972. The game picks up random locations from Google Street View and tests users to see if they can judge the location in terms of closest subway station, borough, or region. Each participant dedicates only few minutes to the task (as opposed to 90 minutes in Milgram's). We collect data from 2,255 participants (one order of magnitude a larger sample) and build a recognizability map of London based on their responses. We find that some boroughs have little cognitive representation; that recognizability of an area is explained partly by its exposure to Flickr and Foursquare users and mostly by its exposure to subway passengers; and that areas with low recognizability do not fare any worse on the economic indicators of income, education, and employment, but they do significantly suffer from social problems of housing deprivation, poor living conditions, and crime. These results could not have been produced without analyzing life off- and online: that is, without considering the interactions between urban places in the physical world and their virtual presence on platforms such as Flickr and Foursquare. This line of work is at the crossroad of two emerging themes in computing research - a crossroad where ""web science"" meets the ""smart city"" agenda."
www,https://dl.acm.org/doi/pdf/10.1145/2488388.2488482,Towards realistic team formation in social networks based on densest subgraphs,"Syama Sundar Rangapuram, Thomas Bühler, Matthias Hein, ","Given a task T, a set of experts V with multiple skills and a social network G(V, W) reflecting the compatibility among the experts, team formation is the problem of identifying a team C ? V that is both competent in performing the task T and compatible in working together. Existing methods for this problem make too restrictive assumptions and thus cannot model practical scenarios. The goal of this paper is to consider the team formation problem in a realistic setting and present a novel formulation based on densest subgraphs. Our formulation allows modeling of many natural requirements such as (i) inclusion of a designated team leader and/or a group of given experts, (ii) restriction of the size or more generally cost of the team (iii) enforcing locality of the team, e.g., in a geographical sense or social sense, etc. The proposed formulation leads to a generalized version of the classical densest subgraph problem with cardinality constraints (DSP), which is an NP hard problem and has many applications in social network analysis. In this paper, we present a new method for (approximately) solving the generalized DSP (GDSP). Our method, FORTE, is based on solving an equivalent continuous relaxation of GDSP. The solution found by our method has a quality guarantee and always satisfies the constraints of GDSP. Experiments show that the proposed formulation (GDSP) is useful in modeling a broader range of team formation problems and that our method produces more coherent and compact teams of high quality. We also show, with the help of an LP relaxation of GDSP, that our method gives close to optimal solutions to GDSP."
www,https://dl.acm.org/doi/pdf/10.1145/2488388.2488483,Efficient community detection in large networks using content and links,"Yiye Ruan, David Fuhry, Srinivasan Parthasarathy, ","In this paper we discuss a very simple approach of combining content and link information in graph structures for the purpose of community discovery, a fundamental task in network analysis. Our approach hinges on the basic intuition that many networks contain noise in the link structure and that content information can help strengthen the community signal. This enables ones to eliminate the impact of noise (false positives and false negatives), which is particularly prevalent in online social networks and Web-scale information networks."
www,https://dl.acm.org/doi/pdf/10.1145/2488388.2488484,Learning joint query interpretation and response ranking,"Uma Sawant, Soumen Chakrabarti, ","Thanks to information extraction and semantic Web efforts, search on unstructured text is increasingly refined using semantic annotations and structured knowledge bases. However, most users cannot become familiar with the schema of knowledge bases and ask structured queries. Interpreting free-format queries into a more structured representation is of much current interest. The dominant paradigm is to segment or partition query tokens by purpose (references to types, entities, attribute names, attribute values, relations) and then launch the interpreted query on structured knowledge bases. Given that structured knowledge extraction is never complete, here we choose a less trodden path: a data representation that retains the unstructured text corpus, along with structured annotations (mentions of entities and relationships) on it. We propose two new, natural formulations for joint query interpretation and response ranking that exploit bidirectional flow of information between the knowledge base and the corpus. One, inspired by probabilistic language models, computes expected response scores over the uncertainties of query interpretation. The other is based on max-margin discriminative learning, with latent variables representing those uncertainties. In the context of typed entity search, both formulations bridge a considerable part of the accuracy gap between a generic query that does not constrain the type at all, and the upper bound where the ""perfect"" target entity type of each query is provided by humans. Our formulations are also superior to a two-stage approach of first choosing a target type using recent query type prediction techniques, and then launching a type-restricted entity search query."
www,https://dl.acm.org/doi/pdf/10.1145/2488388.2488485,A model for green design of online news media services,"Daniel Schien, Paul Shabajee, Stephen G. Wood, Chris Preist, ","The use of information and communication technology and the web-based products it provides is responsible for significant emissions of greenhouse gases. In order to enable the reduction of emissions during the design of such products, it is necessary to estimate as accurately as possible their carbon impact over the entire product system. In this work we describe a new method which combines models of energy consumption during the use of digital media with models of the behavior of the audience. We apply this method to conduct an assessment of the annual carbon emissions for the product suite of a major international news organization. We then demonstrate its use for green design by evaluating the impacts of five different interventions on the product suite. We find that carbon footprint of the online newspaper amounts to approximately 7700 tCO2e per year, of which 75% are caused by the user devices. Among the evaluated scenarios a significant uptake of eReaders in favor of PCs has the greatest reduction potential. Our results also show that even a significant reduction of data volume on a web page would only result in small overall energy savings."
www,https://dl.acm.org/doi/pdf/10.1145/2488388.2488486,"Potential networks, contagious communities, and understanding social network structure","Grant Schoenebeck, ","In this paper we study how the network of agents adopting a particular technology relates to the structure of the underlying network over which the technology adoption spreads. We develop a model and show that the network of agents adopting a particular technology may have characteristics that differ significantly from the social network of agents over which the technology spreads. For example, the network induced by a cascade may have a heavy-tailed degree distribution even if the original network does not."
www,https://dl.acm.org/doi/pdf/10.1145/2488388.2488487,Do social explanations work?: studying and modeling the effects of social explanations in recommender systems,"Amit Sharma, Dan Cosley, ","Recommender systems associated with social networks often use social explanations (e.g. ""X, Y and 2 friends like this"") to support the recommendations. We present a study of the effects of these social explanations in a music recommendation context. We start with an experiment with 237 users, in which we show explanations with varying levels of social information and analyze their effect on users' decisions. We distinguish between two key decisions: the likelihood of checking out the recommended artist, and the actual rating of the artist based on listening to several songs. We find that while the explanations do have some influence on the likelihood, there is little correlation between the likelihood and actual (listening) rating for the same artist. Based on these insights, we present a generative probabilistic model that explains the interplay between explanations and background information on music preferences, and how that leads to a final likelihood rating for an artist. Acknowledging the impact of explanations, we discuss a general recommendation framework that models external informational elements in the recommendation interface, in addition to inherent preferences of users."
www,https://dl.acm.org/doi/pdf/10.1145/2488388.2488488,Question answering on interlinked data,"Saeedeh Shekarpour, Axel-Cyrille Ngonga Ngomo, Sören Auer, ","The Data Web contains a wealth of knowledge on a large number of domains. Question answering over interlinked data sources is challenging due to two inherent characteristics. First, different datasets employ heterogeneous schemas and each one may only contain a part of the answer for a certain question. Second, constructing a federated formal query across different datasets requires exploiting links between the different datasets on both the schema and instance levels. We present a question answering system, which transforms user supplied queries (i.e. natural language sentences or keywords) into conjunctive SPARQL queries over a set of interlinked data sources. The contribution of this paper is two-fold: Firstly, we introduce a novel approach for determining the most suitable resources for a user-supplied query from different datasets (disambiguation). We employ a hidden Markov model, whose parameters were bootstrapped with different distribution functions. Secondly, we present a novel method for constructing a federated formal queries using the disambiguated resources and leveraging the linking structure of the underlying datasets. This approach essentially relies on a combination of domain and range inference as well as a link traversal method for constructing a connected graph which ultimately renders a corresponding SPARQL query. The results of our evaluation with three life-science datasets and 25 benchmark queries demonstrate the effectiveness of our approach."
www,https://dl.acm.org/doi/pdf/10.1145/2488388.2488489,Pricing mechanisms for crowdsourcing markets,"Yaron Singer, Manas Mittal, ","Every day millions of crowdsourcing tasks are performed in exchange for payments. Despite the important role pricing plays in crowdsourcing campaigns and the complexity of the market, most platforms do not provide requesters appropriate tools for effective pricing and allocation of tasks."
www,https://dl.acm.org/doi/pdf/10.1145/2488388.2488490,Truthful incentives in crowdsourcing tasks using regret minimization mechanisms,"Adish Singla, Andreas Krause, ","What price should be offered to a worker for a task in an online labor market? How can one enable workers to express the amount they desire to receive for the task completion? Designing optimal pricing policies and determining the right monetary incentives is central to maximizing requester's utility and workers' profits. Yet, current crowdsourcing platforms only offer a limited capability to the requester in designing the pricing policies and often rules of thumb are used to price tasks. This limitation could result in inefficient use of the requester's budget or workers becoming disinterested in the task."
www,https://dl.acm.org/doi/pdf/10.1145/2488388.2488491,A predictive model for advertiser value-per-click in sponsored search,"Eric Sodomka, Sébastien Lahaie, Dustin Hillard, ","Sponsored search is a form of online advertising where advertisers bid for placement next to search engine results for specific keywords. As search engines compete for the growing share of online ad spend, it becomes important for them to understand what keywords advertisers value most, and what characteristics of keywords drive value. In this paper we propose an approach to keyword value prediction that draws on advertiser bidding behavior across the terms and campaigns in an account. We provide original insights into the structure of sponsored search accounts that motivate the use of a hierarchical modeling strategy. We propose an economically meaningful loss function which allows us to implicitly fit a linear model for values given observables such as bids and click-through rates. The model draws on demographic and textual features of keywords and takes advantage of the hierarchical structure of sponsored search accounts. Its predictive quality is evaluated on several high-revenue and high-exposure advertising accounts on a major search engine. Besides the general evaluation of advertiser welfare, our approach has potential applications to keyword and bid suggestion."
www,https://dl.acm.org/doi/pdf/10.1145/2488388.2488492,I know the shortened URLs you clicked on Twitter: inference attack using public click analytics and Twitter metadata,"Jonghyuk Song, Sangho Lee, Jong Kim, ","Twitter is a popular social network service for sharing messages among friends. Because Twitter restricts the length of messages, many Twitter users use URL shortening services, such as bit.ly and goo.gl, to share long URLs with friends. Some URL shortening services also provide click analytics of the shortened URLs, including the number of clicks, countries, platforms, browsers and referrers. To protect visitors' privacy, they do not reveal identifying information about individual visitors. In this paper, we propose a practical attack technique that can infer who clicks what shortened URLs on Twitter. Unlike the conventional browser history stealing attacks, our attack methods only need publicly available information provided by URL shortening services and Twitter. Evaluation results show that our attack technique can compromise Twitter users' privacy with high accuracy."
www,https://dl.acm.org/doi/pdf/10.1145/2488388.2488493,Exploring and exploiting user search behavior on mobile and tablet devices to improve search relevance,"Yang Song, Hao Ma, Hongning Wang, Kuansan Wang, ","In this paper, we present a log-based study on user search behavior comparisons on three different platforms: desktop, mobile and tablet. We use three-month search logs in 2012 from a commercial search engine for our study. Our objective is to better understand how and to what extent mobile and tablet searchers behave differently than desktop users. Our study spans a variety of aspects including query categorization, query length, search time distribution, search location distribution, user click patterns and so on. From our data set, we reveal that there are significant differences between user search patterns in these three platforms, and therefore use the same ranking system is not an optimal solution for all of them. Consequently, we propose a framework that leverages a set of domain-specific features, along with the training data from desktop search, to further improve the search relevance for mobile and tablet platforms. Experimental results demonstrate that by transferring knowledge from desktop search, search relevance on mobile and tablet can be greatly improved."
www,https://dl.acm.org/doi/pdf/10.1145/2488388.2488494,Evaluating and predicting user engagement change with degraded search relevance,"Yang Song, Xiaolin Shi, Xin Fu, ","User engagement in search refers to the frequency for users (re-)using the search engine to accomplish their tasks. Among factors that affected users' visit frequency, relevance of search results is believed to play a pivotal role. While multiple work in the past has demonstrated the correlation between search success and user engagement based on longitudinal analysis, we examine this problem from a different perspective in this work. Specifically, we carefully designed a large-scale controlled experiment on users of a large commercial Web search engine, in which users were separated into control and treatment groups, where users in treatment group were presented with search results which are deliberate degraded in relevance. We studied users' responses to the relevance degradation through tracking several behavioral metrics (such as query per user, click per session) over an extended period of time both during and following the experiment. By quantifying the relationship between user engagement and search relevance, we observe significant differences between user's short-term search behavior and long-term engagement change. By leveraging some of the key findings from the experiment, we developed a machine learning model to predict the long term impact of relevance degradation on user engagement. Overall, our model achieves over 67% of accuracy in predicting user engagement drop. Besides, our model is also capable of predicting engagement change for low-frequency users with very few user signals. We believe that insights from this study can be leveraged by search engine companies to detect and intervene search relevance degradation and to prevent long term user engagement drop."
www,https://dl.acm.org/doi/pdf/10.1145/2488388.2488495,Data-Fu: a language and an interpreter for interaction with read/write linked data,"Steffen Stadtmüller, Sebastian Speiser, Andreas Harth, Rudi Studer, ","An increasing amount of applications build their functionality on the utilisation and manipulation of web resources. Consequently REST gains popularity with a resource-centric interaction architecture that draws its flexibility from links between resources. Linked Data offers a uniform data model for REST with self-descriptive resources that can be leveraged to avoid a manual ad-hoc development of web-based applications. For declaratively specifying interactions between web resources we introduce Data-Fu, a lightweight declarative rule language with state transition systems as formal grounding. Data-Fu enables the development of data-driven applications that facilitate the RESTful manipulation of read/write Linked Data resources. Furthermore, we describe an interpreter for Data-Fu as a general purpose engine that allows to perform described interactions with web resources by orders of magnitude faster than a comparable Linked Data processor."
www,https://dl.acm.org/doi/pdf/10.1145/2488388.2488496,NIFTY: a system for large scale information flow tracking and clustering,"Caroline Suen, Sandy Huang, Chantat Eksombatchai, Rok Sosic, ","The real-time information on news sites, blogs and social networking sites changes dynamically and spreads rapidly through the Web. Developing methods for handling such information at a massive scale requires that we think about how information content varies over time, how it is transmitted, and how it mutates as it spreads."
www,https://dl.acm.org/doi/pdf/10.1145/2488388.2488497,When relevance is not enough: promoting diversity and freshness in personalized question recommendation,"Idan Szpektor, Yoelle Maarek, Dan Pelleg, ","What makes a good question recommendation system for community question-answering sites? First, to maintain the health of the ecosystem, it needs to be designed around answerers, rather than exclusively for askers. Next, it needs to scale to many questions and users, and be fast enough to route a newly-posted question to potential answerers within the few minutes before the asker's patience runs out. It also needs to show each answerer questions that are relevant to his or her interests. We have designed and built such a system for Yahoo! Answers, but realized, when testing it with live users, that it was not enough."
