conference,url,title,authors,abstract
www,https://dl.acm.org/doi/pdf/10.1145/2488388.2488390,Real-time recommendation of diverse related articles,"Sofiane Abbar, Sihem Amer-Yahia, Piotr Indyk, Sepideh Mahabadi, ","News articles typically drive a lot of traffic in the form of comments posted by users on a news site. Such user-generated content tends to carry additional information such as entities and sentiment. In general, when articles are recommended to users, only popularity (e.g., most shared and most commented), recency, and sometimes (manual) editors' picks (based on daily hot topics), are considered. We formalize a novel recommendation problem where the goal is to find the closest most diverse articles to the one the user is currently browsing. Our diversity measure incorporates entities and sentiment extracted from comments. Given the real-time nature of our recommendations, we explore the applicability of nearest neighbor algorithms to solve the problem. Our user study on real opinion articles from aljazeera.net and reuters.com validates the use of entities and sentiment extracted from articles and their comments to achieve news diversity when compared to content-based diversity. Finally, our performance experiments show the real-time feasibility of our solution."
www,https://dl.acm.org/doi/pdf/10.1145/2488388.2488391,Multi-label learning with millions of labels: recommending advertiser bid phrases for web pages,"Rahul Agrawal, Archit Gupta, Yashoteja Prabhu, Manik Varma, ","Recommending phrases from web pages for advertisers to bid on against search engine queries is an important research problem with direct commercial impact. Most approaches have found it infeasible to determine the relevance of all possible queries to a given ad landing page and have focussed on making recommendations from a small set of phrases extracted (and expanded) from the page using NLP and ranking based techniques. In this paper, we eschew this paradigm, and demonstrate that it is possible to efficiently predict the relevant subset of queries from a large set of monetizable ones by posing the problem as a multi-label learning task with each query being represented by a separate label."
www,https://dl.acm.org/doi/pdf/10.1145/2488388.2488392,Hierarchical geographical modeling of user locations from social media posts,"Amr Ahmed, Liangjie Hong, Alexander J. Smola, ","With the availability of cheap location sensors, geotagging of messages in online social networks is proliferating. For instance, Twitter, Facebook, Foursquare, and Google+ provide these services both explicitly by letting users choose their location or implicitly via a sensor. This paper presents an integrated generative model of location and message content. That is, we provide a model for combining distributions over locations, topics, and over user characteristics, both in terms of location and in terms of their content preferences. Unlike previous work which modeled data in a flat pre-defined representation, our model automatically infers both the hierarchical structure over content and over the size and position of geographical locations. This affords significantly higher accuracy --- location uncertainty is reduced by 40% relative to the best previous results [21] achieved on location estimation from Tweets."
www,https://dl.acm.org/doi/pdf/10.1145/2488388.2488393,Distributed large-scale natural graph factorization,"Amr Ahmed, Nino Shervashidze, Shravan Narayanamurthy, ","Natural graphs, such as social networks, email graphs, or instant messaging patterns, have become pervasive through the internet. These graphs are massive, often containing hundreds of millions of nodes and billions of edges. While some theoretical models have been proposed to study such graphs, their analysis is still difficult due to the scale and nature of the data."
www,https://dl.acm.org/doi/pdf/10.1145/2488388.2488394,A CRM system for social media: challenges and experiences,"Jitendra Ajmera, Hyung-iL Ahn, Meena Nagarajan, Ashish Verma, ","The social Customer Relationship Management (CRM) landscape is attracting significant attention from customers and enterprises alike as a sustainable channel for tracking, managing and improving customer relations. Enterprises are taking a hard look at this open, unmediated platform because the community effect generated on this channel can have a telling effect on their brand image, potential market opportunity and customer loyalty. In this work we present our experiences in building a system that mines conversations on social platforms to identify and prioritize those posts and messages that are relevant to enterprises. The system presented in this work aims to empower an agent or a representative in an enterprise to monitor, track and respond to customer communication while also encouraging community participation."
www,https://dl.acm.org/doi/pdf/10.1145/2488388.2488395,"Here's my cert, so trust me, maybe?: understanding TLS errors on the web","Devdatta Akhawe, Johanna Amann, Matthias Vallentin, Robin Sommer, ","When browsers report TLS errors, they cannot distinguish between attacks and harmless server misconfigurations; hence they leave it to the user to decide whether continuing is safe. However, actual attacks remain rare. As a result, users quickly become used to ""false positives"" that deplete their attention span, making it unlikely that they will pay sufficient scrutiny when a real attack comes along. Consequently, browser vendors should aim to minimize the number of low-risk warnings they report. To guide that process, we perform a large-scale measurement study of common TLS warnings. Using a set of passive network monitors located at different sites, we identify the prevalence of warnings for a total population of about 300,000 users over a nine-month period. We identify low-risk scenarios that consume a large chunk of the user attention budget and make concrete recommendations to browser vendors that will help maintain user attention in high-risk situations. We study the impact on end users with a data set much larger in scale than the data sets used in previous TLS measurement studies. A key novelty of our approach involves the use of internal browser code instead of generic TLS libraries for analysis, providing more accurate and representative results."
www,https://dl.acm.org/doi/pdf/10.1145/2488388.2488396,Towards a robust modeling of temporal interest change patterns for behavioral targeting,"Mohamed Aly, Sandeep Pandey, Vanja Josifovski, Kunal Punera, ","Modern web-scale behavioral targeting platforms leverage historical activity of billions of users to predict user interests and inclinations, and consequently future activities. Future activities of particular interest involve purchases or transactions, and are referred to as conversions. Unlike ad-clicks, conversions directly translate to advertiser's revenue, and thus provide a very concrete metric for return on advertising investment. A typical behavioral targeting system faces two main challenges: the web-scale amounts of user histories to process on a daily basis, and the relative sparsity of conversions (compared to clicks in a traditional setting). These challenges call for generation of effective and efficient user profiles. Most existing works use the historical intensity of a user's interest in various topics to model future interest. In this paper we explore how the change in user behavior can be used to predict future actions and show how it complements the traditional models of decaying interest and action recency to build a complete picture about the user interests and better predict conversions. Our evaluation over a real-world set of campaigns indicates that the combination of change of interest, decaying intensity, and action recency helps in: 1) scoring significant improvements in optimizing for conversions over traditional baselines, 2) substantially improving the targeting efficiency for campaigns with highly sparse conversions, and 3) highly reducing the overall history sizes used in targeting. Furthermore, our techniques have been deployed to production and scored a substantial improvement in targeting performance while imposing a negligible overhead in terms of overall platform running time."
www,https://dl.acm.org/doi/pdf/10.1145/2488388.2488397,The anatomy of LDNS clusters: findings and implications for web content delivery,"Hussein A. Alzoubi, Michael Rabinovich, Oliver Spatscheck, ","We present a large-scale measurement of clusters of hosts sharing the same local DNS servers. We analyze properties of these ""LDNS clusters"" from the perspective of content delivery networks, which commonly use DNS for load distribution. We found that not only LDNS clusters differ widely in terms of their size and geographical compactness but that the largest clusters are actually extremely compact. This suggests potential benefits of a load distribution strategy with nuanced treatment of different LDNS clusters based on the combination of their size and compactness. We further observed interesting variations in LDNS setups including a wide use of ""LDNS pools"" (which as we explain in the paper are different from setups where end-hosts simply utilize multiple resolvers)."
www,https://dl.acm.org/doi/pdf/10.1145/2488388.2488398,Steering user behavior with badges,"Ashton Anderson, Daniel Huttenlocher, Jon Kleinberg, Jure Leskovec, ","An increasingly common feature of online communities and social media sites is a mechanism for rewarding user achievements based on a system of badges. Badges are given to users for particular contributions to a site, such as performing a certain number of actions of a given type. They have been employed in many domains, including news sites like the Huffington Post, educational sites like Khan Academy, and knowledge-creation sites like Wikipedia and Stack Overflow. At the most basic level, badges serve as a summary of a user's key accomplishments; however, experience with these sites also shows that users will put in non-trivial amounts of work to achieve particular badges, and as such, badges can act as powerful incentives. Thus far, however, the incentive structures created by badges have not been well understood, making it difficult to deploy badges with an eye toward the incentives they are likely to create."
www,https://dl.acm.org/doi/pdf/10.1145/2488388.2488399,Cascading tree sheets and recombinant HTML: better encapsulation and retargeting of web content,"Edward O. Benson, David R. Karger, ","Cascading Style Sheets (CSS) took a valuable step towards separating web content from presentation. But HTML pages still contain large amounts of ""design scaffolding"" needed to hierarchically layer content for proper presentation. This paper presents Cascading Tree Sheets (CTS), a CSS-like language for separating this presentational HTML from real content. With CTS, authors can use standard CSS selectors to describe how to graft presentational scaffolding onto their pure-content HTML. This improved separation of content from presentation enables even naive authors to incorporate rich layouts (including interactive Javascript) into their own pages simply by linking to a tree sheet and adding some class names to their HTML."
www,https://dl.acm.org/doi/pdf/10.1145/2488388.2488400,CopyCatch: stopping group attacks by spotting lockstep behavior in social networks,"Alex Beutel, Wanhong Xu, Venkatesan Guruswami, ","How can web services that depend on user generated content discern fraudulent input by spammers from legitimate input? In this paper we focus on the social network Facebook and the problem of discerning ill-gotten Page Likes, made by spammers hoping to turn a profit, from legitimate Page Likes. Our method, which we refer to as CopyCatch, detects lockstep Page Like patterns on Facebook by analyzing only the social graph between users and Pages and the times at which the edges in the graph (the Likes) were created. We offer the following contributions: (1) We give a novel problem formulation, with a simple concrete definition of suspicious behavior in terms of graph structure and edge constraints. (2) We offer two algorithms to find such suspicious lockstep behavior - one provably-convergent iterative algorithm and one approximate, scalable MapReduce implementation. (3) We show that our method severely limits ""greedy attacks"" and analyze the bounds from the application of the Zarankiewicz problem to our setting. Finally, we demonstrate and discuss the effectiveness of CopyCatch at Facebook and on synthetic data, as well as potential extensions to anomaly detection problems in other domains. CopyCatch is actively in use at Facebook, searching for attacks on Facebook's social graph of over a billion users, many millions of Pages, and billions of Page Likes."
www,https://dl.acm.org/doi/pdf/10.1145/2488388.2488401,Inferring the demographics of search users: social data meets search queries,"Bin Bi, Milad Shokouhi, Michal Kosinski, Thore Graepel, ","Knowing users' views and demographic traits offers a great potential for personalizing web search results or related services such as query suggestion and query completion. Such signals however are often only available for a small fraction of search users, namely those who log in with their social network account and allow its use for personalization of search results. In this paper, we offer a solution to this problem by showing how user demographic traits such as age and gender, and even political and religious views can be efficiently and accurately inferred based on their search query histories. This is accomplished in two steps; we first train predictive models based on the publically available myPersonality dataset containing users' Facebook Likes and their demographic information. We then match Facebook Likes with search queries using Open Directory Project categories. Finally, we apply the model trained on Facebook Likes to large-scale query logs of a commercial search engine while explicitly taking into account the difference between the traits distribution in both datasets. We find that the accuracy of classifying age and gender, expressed by the area under the ROC curve (AUC), are 77% and 84% respectively for predictions based on Facebook Likes, and only degrade to 74% and 80% when based on search queries. On a US state-by-state basis we find a Pearson correlation of 0.72 for political views between the predicted scores and Gallup data, and 0.54 for affiliation with Judaism between predicted scores and data from the US Religious Landscape Survey. We conclude that it is indeed feasible to infer important demographic data of users from their query history based on labelled Likes data and believe that this approach could provide valuable information for personalization and monetization even in the absence of demographic data."
www,https://dl.acm.org/doi/pdf/10.1145/2488388.2488402,Strategyproof mechanisms for competitive influence in networks,"Allan Borodin, Mark Braverman, Brendan Lucier, Joel Oren, ","Motivated by applications to word-of-mouth advertising, we consider a game-theoretic scenario in which competing advertisers want to target initial adopters in a social network. Each advertiser wishes to maximize the resulting cascade of influence, modeled by a general network diffusion process. However, competition between products may adversely impact the rate of adoption for any given firm. The resulting framework gives rise to complex preferences that depend on the specifics of the stochastic diffusion model and the network topology."
www,https://dl.acm.org/doi/pdf/10.1145/2488388.2488403,Reactive crowdsourcing,"Alessandro Bozzon, Marco Brambilla, Stefano Ceri, Andrea Mauri, ","An essential aspect for building effective crowdsourcing com- putations is the ability of ""controlling the crowd"", i.e. of dynamically adapting the behaviour of the crowdsourcing systems as response to the quantity and quality of completed tasks or to the availability and reliability of performers. Most crowdsourcing systems only provide limited and predefined controls; in contrast, we present an approach to crowdsourcing which provides fine-level, powerful and flexible controls. We model each crowdsourcing application as composition of elementary task types and we progressively transform these high level specifications into the features of a reactive execution environment that supports task planning, assignment and completion as well as performer monitoring and exclusion. Controls are specified as active rules on top of data structures which are derived from the model of the application; rules can be added, dropped or modified, thus guaranteeing maximal flexibility with limited effort."
www,https://dl.acm.org/doi/pdf/10.1145/2488388.2488404,On participation in group chats on Twitter,"Ceren Budak, Rakesh Agrawal, ","The success of a group depends on continued participation of its members through time. We study the factors that affect continued user participation in the context of educational Twitter chats. To predict whether a user that attended her first session in a particular Twitter chat group will return to the group, we build 5F Model that captures five different factors: individual initiative, group characteristics, perceived receptivity, linguistic affinity and geographical proximity. Through statistical data analysis of thirty Twitter chats over a two year period as well as a survey study, our work provides many insights about group dynamics in Twitter chats. We show similarities between Twitter chats and traditional groups such as the importance of social inclusion and linguistic similarity while also identifying important distinctions such as the insignificance of geographical proximity. We also show that informational support is more important than emotional support in educational Twitter chats, but this does not reduce the sense of community as suggested in earlier studies."
www,https://dl.acm.org/doi/pdf/10.1145/2488388.2488405,The role of web hosting providers in detecting compromised websites,"Davide Canali, Davide Balzarotti, Aurélien Francillon, ","Compromised websites are often used by attackers to deliver malicious content or to host phishing pages designed to steal private information from their victims. Unfortunately, most of the targeted websites are managed by users with little security background - often unable to detect this kind of threats or to afford an external professional security service."
www,https://dl.acm.org/doi/pdf/10.1145/2488388.2488406,Your browsing behavior for a big mac: economics of personal information online,"Juan Pablo Carrascal, Christopher Riederer, Vijay Erramilli, ","Most online service providers offer free services to users and in part, these services collect and monetize personally identifiable information (PII), primarily via targeted advertisements. Against this backdrop of economic exploitation of PII, it is vital to understand the value that users put to their own PII. Although studies have tried to discover how users value their privacy, little is known about how users value their PII while browsing, or the exploitation of their PII. Extracting valuations of PII from users is non-trivial - surveys cannot be relied on as they do not gather information of the context where PII is being released, thus reducing validity of answers. In this work, we rely on refined Experience Sampling - a data collection method that probes users to valuate their PII at the time and place where it was generated in order to minimize retrospective recall and hence increase measurement validity. For obtaining an honest valuation of PII, we use a reverse second price auction. We developed a web browser plugin and had 168 users - living in Spain - install and use this plugin for 2 weeks in order to extract valuations of PII in different contexts."
www,https://dl.acm.org/doi/pdf/10.1145/2488388.2488407,Is this app safe for children?: a comparison study of maturity ratings on Android and iOS applications,"Ying Chen, Heng Xu, Yilu Zhou, Sencun Zhu, ","There is a rising concern among parents who have experienced unreliable content maturity ratings for mobile applications (apps) that result in inappropriate risk exposure for their children and adolescents. In reality, there is no consistent maturity rating policy for mobile applications. The maturity ratings of Android apps are provided purely by developers' self-disclosure and are rarely verified. While Apple's iOS app ratings are considered to be more accurate, they can also be inconsistent with Apple's published policies. To address these issues, this research aims to systematically uncover the extent and severity of unreliable maturity ratings for mobile apps. Specifically, we develop mechanisms to verify the maturity ratings of mobile apps and investigate possible reasons behind the incorrect ratings. We believe that our findings have important implications for platform providers (e.g., Google or Apple) as well as for regulatory bodies and application developers."
www,https://dl.acm.org/doi/pdf/10.1145/2488388.2488408,Traveling the silk road: a measurement analysis of a large anonymous online marketplace,"Nicolas Christin, ","We perform a comprehensive measurement analysis of Silk Road, an anonymous, international online marketplace that operates as a Tor hidden service and uses Bitcoin as its exchange currency. We gather and analyze data over eight months between the end of 2011 and 2012, including daily crawls of the marketplace for nearly six months in 2012. We obtain a detailed picture of the type of goods sold on Silk Road, and of the revenues made both by sellers and Silk Road operators. Through examining over 24,400 separate items sold on the site, we show that Silk Road is overwhelmingly used as a market for controlled substances and narcotics, and that most items sold are available for less than three weeks. The majority of sellers disappears within roughly three months of their arrival, but a core of 112 sellers has been present throughout our measurement interval. We evaluate the total revenue made by all sellers, from public listings, to slightly over USD 1.2 million per month; this corresponds to about USD 92,000 per month in commissions for the Silk Road operators. We further show that the marketplace has been operating steadily, with daily sales and number of sellers overall increasing over our measurement interval. We discuss economic and policy implications of our analysis and results, including ethical considerations for future research in this area."
www,https://dl.acm.org/doi/pdf/10.1145/2488388.2488409,Group chats on Twitter,"James Cook, Krishnaram Kenthapadi, Nina Mishra, ","We report on a new kind of group conversation on Twitter that we call a group chat. These chats are periodic, synchronized group conversations focused on specific topics and they exist at a massive scale. The groups and the members of these groups are not explicitly known. Rather, members agree on a hashtag and a meeting time (e.g, 3pm Pacific Time every Wednesday) to discuss a subject of interest. Topics of these chats are numerous and varied. Some are support groups, for example, post-partum depression and mood disorder groups. Others are about a passionate interest: topics include skiing, photography, movies, wine and foodie communities. We develop a definition of a group that is inspired by how sociologists define groups and present an algorithm for discovering groups. We prove that our algorithms find all groups under certain assumptions. While these groups are of course known to the people who participate in the discussions, what we do not believe is known is the scale and variety of groups. We provide some insight into the nature of these groups based on over two years of tweets. Finally, we show that group chats are a growing phenomenon on Twitter and hope that reporting their existence propels their growth even further."
www,https://dl.acm.org/doi/pdf/10.1145/2488388.2488410,How to grow more pairs: suggesting review targets for comparison-friendly review ecosystems,"James Cook, Alex Fabrikant, Avinatan Hassidim, ","We consider the algorithmic challenges behind a novel interface that simplifies consumer research of online reviews by surfacing relevant comparable review bundles: reviews for two or more of the items being researched, all generated in similar enough circumstances to provide for easy comparison. This can be reviews by the same reviewer, or by the same demographic category of reviewer, or reviews focusing on the same aspect of the items. But such an interface will work only if the review ecosystem often has comparable review bundles for common research tasks."
www,https://dl.acm.org/doi/pdf/10.1145/2488388.2488411,A framework for benchmarking entity-annotation systems,"Marco Cornolti, Paolo Ferragina, Massimiliano Ciaramita, ","In this paper we design and implement a benchmarking framework for fair and exhaustive comparison of entity-annotation systems. The framework is based upon the definition of a set of problems related to the entity-annotation task, a set of measures to evaluate systems performance, and a systematic comparative evaluation involving all publicly available datasets, containing texts of various types such as news, tweets and Web pages. Our framework is easily-extensible with novel entity annotators, datasets and evaluation measures for comparing systems, and it has been released to the public as open source. We use this framework to perform the first extensive comparison among all available entity annotators over all available datasets, and draw many interesting conclusions upon their efficiency and effectiveness. We also draw conclusions between academic versus commercial annotators."
