conference,url,title,authors,abstract
icra,None,Design of four-arm four-crawler disaster response robot OCTOPUS,"Mitsuhiro Kamezaki,Hiroyuki Ishii,Tatsuzo Ishida,Masatoshi Seki,,,,,,,,,","We developed a four-arm four-crawler advanced disaster response robot called OCTOPUS. Disaster response robots are expected to be capable of both mobility, e.g., entering narrow spaces over very rough unstable ground, and workability, e.g., conducting complex debris-demolition work. However, conventional disaster response robots are specialized in either mobility or workability. Moreover, strategies to independently enhance the capability of crawlers for mobility and arms for workability will increase the robot size and weight. To balance environmental applicability with the mobility and workability, OCTOPUS is equipped with a mutual complementary strategy between its arms and crawlers. The four arms conduct complex tasks while ensuring stabilization when climbing steps. The four crawlers translate rough terrain while avoiding toppling over when conducting demolition work. OCTOPUS is hydraulic driven and teleoperated by two operators. To evaluate the performance of OCTOPUS, we conducted preliminary experiments involving climbing high steps and removing attached objects by using the four arms. The results showed that OCTOPUS completed the two tasks by adequately coordinating its four arms and four crawlers and improvement in operability needs."
icra,None,Motion control of a compliant wheel-leg robot for rough terrain crossing,"Arthur Bouton,Christophe Grand,Faïz Benamar,","In this paper, we propose the use of compliant elements in the actuation of a wheel-legged robot in order to improve its locomotion properties on unknown and irregular terrains. Detection of the obstacles is achieved by a synergistic use of the structural compliances. The robot's capabilities to surmount steep obstacles is thus improved thanks to the inertia of the chassis and flexibility in postural control. In the proposed robot's kinematics, the four wheels are attached to the main body through vertical series elastic actuators (SEA) and with a passive horizontal compliant mechanism subject to a specific wheel speed control. The overall control relies on postural servoing and a local reactive loop which adapts the vertical forces applied by the SEA on each wheel according to the detected obstacle and the stability margin. The resulting system is evaluated with physical simulations for two case studies: a canonical steep obstacle on one wheel at a time and multiple random rough terrains."
icra,None,Autonomous repositioning and localization of an in situ fabricator,"Timothy Sandy,Markus Giftthaler,Kathrin Dörfler,Matthias Kohler,,","Despite the prevalent use of robotic technologies in industrial manufacturing, their use on building construction sites is still very limited. This is mainly due to the unstructured nature of construction sites and the fact that the structures built must be larger than the machines which build them. This paper addresses these difficulties by presenting a repositioning and localization system which, using purely on-board sensing, allows a mobile robot to maintain a high degree of end-effector positioning accuracy while moving among numerous building positions during a building task. We introduce a newly developed machine, called the In situ Fabricator (IF), whose goal is to bring digital fabrication to the construction site. The capabilities of the repositioning and localization system is demonstrated through the construction of a vertical stack of bricks, in which the IF repositions itself after placing each brick. With this experiment, we demonstrate that the IF can build with sub-centimeter accuracy over long building sequences."
icra,None,Low dimensional human preference tracking for motion optimization,"Stephen G. McGill,Seung-Joon Yi,Daniel D. Lee,","Motion planning for high degree of freedom (DOF) robots is not an easy task, and often requires optimization in a high dimensional space. Still, a generic motion planner using a single cost function for optimization may not be optimal over a number of different tasks with various task specific constraints. In this paper, we present a motion planning system that utilizes both easy to communicate human preferences and dimensionality reduction to handle these issues. Joint trajectories with human preference costs are projected into the null space of the task space, which helps make the resulting optimization simpler and more reliable. In addition, we apply the dimensionality reduction for the optimization, which significantly lowers the computational load. The suggested controller has been successfully used in the DARPA Robotics Challenge (DRC) Finals to handle a number of manipulation tasks."
icra,None,Laban head-motions convey robot state: A call for robot body language,"Heather Knight,Reid Simmons,","Functional robots are an increasing presence in shared human-machine environments. Humans efficiently parse motion expressions, gaining an immediate impression of an agent's current action and state. Past work has shown that motion can effectively reveal a robot's current task objective to bystanders and collaborators, however, the layering of expression on pre-existing robot task motions has yet to be explored. Rather than showing us what the robot is doing, these layered motion characteristics leverage the how of the task motions to convey additional robot attitudes, e.g., confidence, adherence to deadline or flexibility of attention. To lay the foundations for this objective, we adapt the Laban Efforts, a system from dance and acting training in use for over 50 years. We operationalize features representing the four Laban Efforts (Time, Space, Weight, and Flow) to the movements of a 2-DOF Nao head and a 4-DOF Keepon robot during simple dance and look-for-someone behaviors. Using online survey, we collect 1028 motion ratings for 72 robot motion videos depicting contrasting Effort motion examples. We achieve statistically significant legibility results for all four Effort implementations. Even without human degrees of freedom, we find that robot motion patterns can convey complex expressions to people."
icra,None,Learning socially normative robot navigation behaviors with Bayesian inverse reinforcement learning,"Billy Okal,Kai O. Arras,","Mobile robots that navigate in populated environments require the capacity to move efficiently, safely and in human-friendly ways. In this paper, we address this task using a learning approach that enables a mobile robot to acquire navigation behaviors from demonstrations of socially normative human behavior. In the past, such approaches have been typically used to learn only simple behaviors under relatively controlled conditions using rigid representations or with methods that scale poorly to large domains. We thus develop a flexible graph-based representation able to capture relevant task structure and extend Bayesian inverse reinforcement learning to use sampled trajectories from this representation. In experiments with a real robot and a large-scale pedestrian simulator, we are able to show that the approach enables a robot to learn complex navigation behaviors of varying degrees of social normativeness using the same set of simple features."
icra,None,Autonomous indoor robot navigation using a sketch interface for drawing maps and routes,"Federico Boniardi,Abhinav Valada,Wolfram Burgard,Gian Diego Tipaldi,","Hand-Drawn sketches are natural means by which abstract descriptions of environments can be provided. They represent weak prior information about the scene, thereby enabling a robot to perform autonomous navigation and exploration when a full metrical description of the environment is not available beforehand. In this paper, we present an extensive evaluation of our navigation system that uses a sketch interface to allow the operator of a robot to draw a rough map of an indoor environment as well as a desired trajectory for the robot to follow. We employ a theoretical framework for sketch interpretation, in which associations between the sketch and the real world are modeled as local deformations of a suitable metric manifold. We investigate the effectiveness of our system and present empirical results from a set of experiments in real-world scenarios, focusing both on the navigation capabilities and the usability of the interface."
icra,None,"Singing minstrel robots, a means for improving social behaviors","Igor Rodriguez,Aitzol Astigarraga,Txelo Ruiz,Elena Lazkano,","Bertsolaritza, Basque improvised contest poetry, offers another sphere to develop robot body language and robot communication capabilities, that shares some similarities with theatrical performances. It is also a new area to work on social robotics. The work presented in this paper makes some steps forward in designing and implementing the set of behaviors the robots need to show in the stage to increase, on the one hand robot autonomy and on the other hand, credibility and sociability."
icra,None,transHumUs: A poetic experience in mobile robotics,"Guilhem Saurel,Michel Taïx,Jean-Paul Laumond,","transHumUs is an artistic work recently exhibited at the 56th Venice Biennale. The work aims at freeing trees from their roots. How to translate this poetic ambition into technological terms? This paper reports on the setup and the implementation of the project. It shows how state of the art mobile robotics technology can contribute to contemporary art development. The challenge has been to design original mobile platforms carrying charges of three tones, while moving noiseless according to tree metabolism, in operational spaces populated by visitors."
icra,None,Enhancing human-robot interaction by interpreting uncertain information in navigational commands based on experience and environment,"M. A. Viraj J. Muthugala,A. G. Buddhika P. Jayasekara,","Assistive robots can support activities of elderly people to uplift the living standard. The assistive robots should possess the ability to interact with the human peers in a human friendly manner because those systems are intended to be used by non-experts. Humans prefer to use voice instructions that include uncertain information and lexical symbols. Hence, the ability to understand uncertain information is mandatory for developing natural interaction capabilities in robots. This paper proposes a method to understand uncertain information such as “close”, “near” and “far” in navigational user commands based on the current environment and the experience of the robot. A robot experience model (REM) has been introduced to understand the lexical representations in user commands and to adapt the perception of the robot on uncertain information in heterogeneous domestic environments. The user commands are not bounded by a strict grammar model and this enables the users to operate the robot in a more natural way. The proposed method has been implemented on the assistive robot platform. The experiments have been carried out in an artificially created domestic environment and the results have been analyzed to identify the behaviors of the proposed concept."
icra,None,A smartphone-based laser distance sensor for outdoor environments,"Jason H. Gao,Li-Shiuan Peh,","Laser distance sensors such as LIDAR are useful for many outdoor robotic vehicles, but their high cost and complexity precludes their use in low-cost applications, while other low-cost depth sensing technologies are not suitable for outdoor use. We present a low-cost, smartphone-based planar laser distance sensor design for outdoor use with 6 cm accuracy at 5 meters, 30 Hz scan rate, and 0.1 degree resolution over the field of view. The cost of the hardware additions to the off-the-shelf smartphone used in our prototype is under $50."
icra,None,Non-linear model-free control of flapping wing flying robot using iPID,"Aneesh N. Chand,Michihiro Kawanishi,Tatsuo Narikiyo,","Due to ill-defined and poorly understood dynamics of flapping wing flying robots, acquiring high-fidelity aero dynamical and control models for such aerial robots are challenging and often infeasible. In this work, we propose using a non-linear, model-free approach that eliminates errors arising from the mis-modeling or under-modeling of flapping dynamics. These procedures require no prior knowledge or model of any of the dynamical aspects of the flying robot and assume zero statistical knowledge about noise affecting sensor measurements. Intelligent PID (iPID) controllers are used to provide an abstracted treatment of all unknowns and uncertainties in the robot by encapsulating them together into a single term. The problem then devolves into the estimation of this term by either direct or indirect means which is more practical than obtaining high-fidelity models. For indirect estimation, numerical differentiation is required and we propose using a Haar-wavelet differentiator that is capable of smoothing and differentiating signals irrespective of the multivariate noise corrupting the signal. The direct estimation method uses an algebraic and non-asymptotic method. Pitch control and altitude control experiments are successfully performed on a real, bird-like flapping wing flying robot using all different approaches; results obtained reveal that indirect estimation using the Haar-wavelet differentiator provides slightly better performance."
icra,None,Application of an approximate model predictive control scheme on an unmanned aerial vehicle,"Matthias Hofer,Michael Muehlebach,Raffaello D'Andrea,",An approximate model predictive control approach is applied on an unmanned aerial vehicle with limited computational resources. A novel method using a continuous time parametrization of the state and input trajectory is used to derive a compact description of the optimal control problem. Different first order methods for the online optimization are discussed in terms of memory requirements and execution time. The generalized fast dual gradient method is implemented on the aerial vehicle. The approximate model predictive control algorithm runs on an embedded platform with a STM32 Cortex M4 processor. Simulation studies show that the model predictive controller outperforms a linear quadratic regulator in aggressive maneuvers. The model predictive control approach is evaluated in practice and shown to yield satisfactory flight behavior.
icra,None,Trajectory generation for quadrotor based systems using numerical optimal control,"Mathieu Geisert,Nicolas Mansard,","The recent work on quadrotor have focused on more and more challenging tasks with increasingly complex systems. Systems are often augmented with slung loads, inverted pendulums or arms, and accomplish complex tasks such as going through a window, grasping, throwing and catching. Usually, controllers are designed to accomplish a specific task on a specific system using analytic solutions, so each application needs long preparations. On the other hand, the direct multiple shooting approach is able to solve complex problems without any analytic development, by using off-the-shelf optimization solver. In this paper, we show that this approach is able to solve a wide range of problems relevant to quadrotor systems, from on-line trajectory generation for quadrotors to going through a window for a quadrotor-and-pendulum system, through manipulation tasks for a aerial manipulator."
icra,None,From tracking to robust maneuver regulation: An easy-to-design approach for VTOL aerial robots,"Sara Spedicato,Antonio Franchi,Giuseppe Notarstefano,","In this paper we present a maneuver regulation scheme for Vertical Take-Off and Landing (VTOL) micro aerial vehicles (MAV). Differently from standard trajectory tracking, maneuver regulation has an intrinsic robustness due to the fact that the vehicle is not required to chase a virtual target, but just to stay on a (properly designed) desired path with a given velocity profile. In this paper we show how a robust maneuver regulation controller can be easily designed by converting an existing tracking scheme. The resulting maneuvering controller has three main appealing features, namely it: (i) inherits the robustness properties of the tracking controller, (ii) gains the appealing features of maneuver regulation, and (iii) does not need any additional tuning with respect to the tracking controller. We prove the correctness of the proposed scheme and show its effectiveness in experiments on a nano-quadrotor. In particular, we show on a nontrivial maneuver how external disturbances acting on the quadrotor cause instabilities in the standard tracking, while marginally affect the maneuver regulation scheme."
icra,None,Adaptive Super Twisting Controller for a quadrotor UAV,"Sujit Rajappa,Carlo Masone,Heinrich H. Bülthoff,Paolo Stegagno,","In this paper we present a robust quadrotor controller for tracking a reference trajectory in presence of uncertainties and disturbances. A Super Twisting controller is implemented using the recently proposed gain adaptation law [1], [2], which has the advantage of not requiring the knowledge of the upper bound of the lumped uncertainties. The controller design is based on the regular form of the quadrotor dynamics, without separation in two nested control loops for position and attitude. The controller is further extended by a feedforward dynamic inversion control that reduces the effort of the sliding mode controller. The higher order quadrotor dynamic model and proposed controller are validated using a SimMechanics physical simulation with initial error, parameter uncertainties, noisy measurements and external perturbations."
icra,None,Sensors model based data fusion using complementary filters for attitude estimation and stabilization,"A. El Hadri,L. Benziane,A. Seba,A. Benallegue,","This paper proposes simple and efficient algorithms for implementation of attitude estimation and control based on data fusion using complementary filters taking into account sensors dynamics. First of all, we propose a passive form of the filter by fusing the measured inertial vectors and the gyro measurements in order to reconstruct real inertial vectors which can be used with any algebraic algorithm (TRIAD, QUEST, etc.) that leads to globally asymptotic attitude estimation. Thereafter, the same principle of data fusion is used to address the problem of attitude stabilization. Then, instead of using direct raw measurements in control law we propose a new solution that leads to accurate estimation of inertial vectors by using complementary filters based on sensors dynamics. The stability analysis of the error dynamics based on Lyapunov method proved that almost all trajectories converge asymptotically to the desired equilibrium point. Simulation results show the effectiveness and the performance of the proposed solutions."
icra,None,"Obstacle detection, tracking and avoidance for a teleoperated UAV","Marcin Odelga,Paolo Stegagno,Heinrich H. Bülthoff,","In this paper, we present a collision-free indoor navigation algorithm for teleoperated multirotor Unmanned Aerial Vehicles (UAVs). Assuming an obstacle rich environment, the algorithm keeps track of detected obstacles in the local surroundings of the robot. The detection part of the algorithm is based on measurements from an RGB-D camera and a Bin-Occupancy filter capable of tracking an unspecified number of targets. We use the estimate of the robot's velocity to update the obstacles state when they leave the direct field of view of the sensor. The avoidance part of the algorithm is based on the Model Predictive Control approach. By predicting the possible future obstacles states, it filters the operator commands to prevent collisions. The method is validated on a platform equipped with its own computational unit, which makes it self-sufficient in terms of external CPUs."
icra,None,Prop-hanging control of a thrust vector vehicle with hybrid Nonlinear Dynamic Inversion method,"Yang Jiali,Zhu Jihong,","The prop-hanging control of the fixed-wing aircraft can enable the vehicle to improve the cruise performance and hover ability. The prop-hanging control of the thrust vector vehicle would be a challenging problem, for the reason that it is a system with properties of inherent instability, coupling, non-linearity and non-minimum phase characteristics. To deal with these complex problems, a hybrid Nonlinear Dynamic Inversion (NDI) method is proposed in this paper. Inspired by NDI, Incremental NDI and angular acceleration feedback control methods, the hybrid NDI method includes three parts: feedforward control, proportional control and logical integral control, which can enable the system to have a rapid response in the transient phase and a satisfactory performance in the steady state. A numerical simulation is conducted to test the performance and the robustness of the proposed control method, and a Hardware-in-the-loop simulation is also conducted to check the practicability and effectiveness in the actual application. Simulation results show that the proposed control method can effectively improve system robustness and is practical."
icra,None,Full Attitude Control of a VTOL tailsitter UAV,"S. Verling,B. Weibel,M. Boosfeld,K. Alexis,M. Burri,R. Siegwart,","This paper addresses the challenges of the design, development and control of a new convertible VTOL tailsitter unmanned aerial vehicle that combines the advantages of both fixed wing and rotary wing systems. Wind tunnel measurements are used to get an understanding of the control allocation and to model the static forces and moments acting on the system. Based on the derived model, a novel controller that operates in SO(3) and handles the dynamics of the vehicle at any attitude configuration, including the rotorcraft and fixed-wing regimes as well as their transitions, is presented. This unified controller allows the autonomous transition of the system without discontinuities of switching, as well as its overall high performance flight control. The capabilities and flying qualities of the platform and the controller are demonstrated and evaluated by means of extensive experimental studies."
icra,None,On-line coaching of robots through visual and physical interaction: Analysis of effectiveness of human-robot interaction strategies,"Andrej Gams,Aleš Ude,","Continuous and on-line adaptation of robotic trajectories is one of the key properties of robotic control policies that make robots useful in unstructured environments, where the conditions of the external world are not predefined or stationary. Modification of robotic trajectories through human intervention, in order to make them more suitable to the user, is often termed as robotic coaching. In the manner of a tutor, the user shows to the robot which part of the motion to change and how. Predefined gestures acquired with visual systems and direct physical interaction are two possibilities to realize robotic coaching. In this paper we study what are the desired user features and which of the three tested coaching methods is deemed most favorable by a group of 7 subjects. The three methods we explore all build on on-line coaching of dynamic motion primitives, but are based on different feedback signals, i. e., visual or force feedback, and different low-level robot control approaches, i. e., a stiff or a compliant robot. The experiment required coaching of a KUKA LWR-4 robot arm while wiping a flat surface, so that it followed two simple patterns. The survey presented in this paper aims at providing the designers of human-robot coaching interfaces with answers on the feasibility, advantages and drawbacks of the three methods for on-line coaching analyzed in this paper: 1. visual feedback, 2. force feedback with a stiff robot, and 3. position feedback with a compliant robot."
icra,None,An ISO10218-compliant adaptive damping controller for safe physical human-robot interaction,"Benjamin Navarro,Andrea Cherubini,Aïcha Fonte,Robin Passama,,,","In human-robot interaction, the robot must behave safely, especially when an operator is present in its workspace. Even higher safety levels must be attained when physical contact occurs between the two. To this end, standards such as the ISO10218 define the requirements for a robot to be considered safe for interaction with human operators in an industrial environment. In this paper, we propose an adaptive damping controller that fulfills the ISO10218 requirements by limiting the tool velocity, power and contact force online (and only when needed). The controller is experimentally validated on a hand-arm robotic system, in a mock-up collaborative application. For the hand, safe interaction is enhanced by using tactile sensing, both to regulate grasp forces and to provide an intuitive interface for the operator."
