conference,url,title,authors,abstract
icra,None,3D dynamic walking with underactuated humanoid robots: A direct collocation framework for optimizing hybrid zero dynamics,"Ayonga Hereid,Eric A. Cousineau,Christian M. Hubicki,Aaron D. Ames,","Hybrid zero dynamics (HZD) has emerged as a popular framework for dynamic and underactuated bipedal walking, but has significant implementation difficulties when applied to the high degrees of freedom present in humanoid robots. The primary impediment is the process of gait design-it is difficult for optimizers to converge on a viable set of virtual constraints defining a gait. This paper presents a methodology that allows for the fast and reliable generation of efficient multi-contact robotic walking gaits through the framework of HZD, even in the presence of underactuation. To achieve this goal, we unify methods from trajectory optimization with the control framework of multi-domain hybrid zero dynamics. By formulating a novel optimization problem in the context of direct collocation and generating analytic Jacobians for the constraints, solving the resulting nonlinear program becomes tractable for large-scale nonlinear programming solvers, even for systems as high-dimensional as humanoid robots. We experimentally validated our methodology on the spring-legged prototype humanoid, DURUS, showing that the optimization approach yields dynamic and stable 3D walking gaits."
icra,None,Optimized and trusted collision avoidance for unmanned aerial vehicles using approximate dynamic programming,"Zachary N. Sunberg,Mykel J. Kochenderfer,Marco Pavone,","Safely integrating unmanned aerial vehicles into civil airspace is contingent upon development of a trustworthy collision avoidance system. This paper proposes an approach whereby a parameterized resolution logic that is considered trusted for a given range of its parameters is adaptively tuned online. Specifically, to address the potential conservatism of the resolution logic with static parameters, we present a dynamic programming approach for adapting the parameters dynamically based on the encounter state. We compute the adaptation policy offline using a simulation-based approximate dynamic programming method that accommodates the high dimensionality of the problem. Numerical experiments show that this approach improves safety and operational performance compared to the baseline resolution logic, while retaining trustworthiness."
icra,None,"Receding Horizon ""Next-Best-View"" Planner for 3D Exploration","Andreas Bircher,Mina Kamel,Kostas Alexis,Helen Oleynikova,Roland Siegwart,","This paper presents a novel path planning algorithm for the autonomous exploration of unknown space using aerial robotic platforms. The proposed planner employs a receding horizon “next-best-view” scheme: In an online computed random tree it finds the best branch, the quality of which is determined by the amount of unmapped space that can be explored. Only the first edge of this branch is executed at every planning step, while repetition of this procedure leads to complete exploration results. The proposed planner is capable of running online, onboard a robot with limited resources. Its high performance is evaluated in detailed simulation studies as well as in a challenging real world experiment using a rotorcraft micro aerial vehicle. Analysis on the computational complexity of the algorithm is provided and its good scaling properties enable the handling of large scale and complex problem setups."
icra,None,Aggressive quadrotor flight through cluttered environments using mixed integer programming,"Benoit Landry,Robin Deits,Peter R. Florence,Russ Tedrake,","Quadrotor flight has typically been limited to sparse environments due to numerical complications that arise when dealing with large numbers of obstacles. We hypothesized that it would be possible to plan and robustly execute trajectories in obstacle-dense environments using the novel Iterative Regional Inflation by Semidefinite programming algorithm (IRIS), mixed-integer semidefinite programs (MISDP), and model-based control. Unlike sampling-based approaches, the planning algorithm first introduced by Deits theoretically guarantees non-penetration of the trajectories even with small obstacles such as strings. We present experimental validation of this claim by aggressively flying a small quadrotor (34g, 92mm rotor to rotor) in a series of indoor environments including a cubic meter volume containing 20 interwoven strings, and present the control architecture we developed to do so."
icra,None,Online generation of collision-free trajectories for quadrotor flight in unknown cluttered environments,"Jing Chen,Tianbo Liu,Shaojie Shen,","We present an online method for generating collision-free trajectories for autonomous quadrotor flight through cluttered environments. We consider the real-world scenario that the quadrotor aerial robot is equipped with limited sensing and operates in initially unknown environments. During flight, an octree-based environment representation is incrementally built using onboard sensors. Utilizing efficient operations in the octree data structure, we are able to generate free-space flight corridors consisting of large overlapping 3-D grids in an online fashion. A novel optimization-based method then generates smooth trajectories that both are bounded entirely within the safe flight corridor and satisfy higher order dynamical constraints. Our method computes valid trajectories within fractions of a second on a moderately fast computer, thus permitting online re-generation of trajectories for reaction to new obstacles. We build a complete quadrotor testbed with onboard sensing, state estimation, mapping, and control, and integrate the proposed method to show online navigation through complex unknown environments."
icra,None,High speed navigation for quadrotors with limited onboard sensing,"Sikang Liu,Michael Watterson,Sarah Tang,Vijay Kumar,","We address the problem of high speed autonomous navigation of quadrotor micro aerial vehicles with limited onboard sensing and computation. In particular, we propose a dual range planning horizon method to safely and quickly navigate quadrotors to specified goal locations in previously unknown and unstructured environments. In each planning epoch, a short-range planner uses a local map to generate a new trajectory. At the same time, a safe stopping policy is found. This allows the robot to come to an emergency halt when necessary. Our algorithm guarantees collision avoidance and demonstrates important advances in real-time planning. First, our novel short range planning method allows us to generate and re-plan trajectories that are dynamically feasible, comply with state and input constraints, and avoid obstacles in real-time. Further, previous planning algorithms abstract away the obstacle detection problem by assuming the instantaneous availability of geometric information about the environment. In contrast, our method addresses the challenge of using the raw sensor data to form a map and navigate in real-time. Finally, in addition to simulation examples, we provide physical experiments that demonstrate the entire algorithmic pipeline from obstacle detection to trajectory execution."
icra,None,Minimum-energy path generation for a quadrotor UAV,"Fabio Morbidi,Roel Cano,David Lara,","A major limitation of existing battery-powered quadrotor UAVs is their reduced flight endurance. To address this issue, by leveraging the electrical model of a brushless DC motor, we explicitly determine minimum-energy paths between a predefined initial and final configuration of a quadrotor by solving an optimal control problem with respect to the angular accelerations of the four propellers. As a variation on this problem, if the total energy consumption between two boundary states is fixed, minimum-time and/or minimum-control-effort trajectories are computed for the aerial vehicle. The theory is illustrated for the DJI Phantom 2 quadrotor in three realistic scenarios."
icra,None,Aggressive quadrotor flight using dense visual-inertial fusion,"Yonggen Ling,Tianbo Liu,Shaojie Shen,","In this work, we address the problem of aggressive flight of a quadrotor aerial vehicle using cameras and IMUs as the only sensing modalities. We present a fully integrated quadrotor system and demonstrate through online experiment the capability of autonomous flight with linear velocities up to 4.2 m/s, linear accelerations up to 9.6 m/s2, and angular velocities up to 245.1 degree/s. Central to our approach is a dense visual-inertial state estimator for reliable tracking of aggressive motions. An uncertainty-aware direct dense visual tracking module provides camera pose tracking that takes inverse depth uncertainty into account and is resistant to motion blur. Measurements from IMU pre-integration and multi-constrained dense visual tracking are fused probabilistically using an optimization-based sensor fusion framework. Extensive statistical analysis and comparison are presented to verify the performance of the proposed approach. We also release our code as open-source ROS packages."
icra,None,An analysis of wind field estimation and exploitation for quadrotor flight in the urban canopy layer,"John Ware,Nicholas Roy,","Although unmanned air vehicles' increasing agility and autonomy may soon allow for flight in urban environments, the impact of complex urban wind fields on vehicle flight performance remains unclear. Unlike synoptic winds at high altitudes, urban wind fields are subject to turbulence generated by the buildings and terrain. The resulting spatial and temporal variation makes inference about the global wind field based on local wind measurements difficult and prevents the use of most simple wind models. Fortunately, the structure of the urban environment provides exploitable predictability given a suitable computational fluid dynamics solver, a representative 3D model of the environment, and an estimate of the expected prevailing wind speed and heading. The prevailing wind speed and direction at altitude and computational fluid dynamics solver can generate the corresponding wind field estimate over the map. By generating wind fields in this way, this work investigates a quadrotor's ability to exploit them for improved flight performance. Along with the wind field estimate, an empirically derived power consumption model is used to find minimum-energy trajectories with a planner both aware of and naive to the wind field. When compared to minimum-energy trajectories that do not incorporate wind conditions, the wind-aware trajectories demonstrate reduced flight times, total energy expenditures, and failures due to excess air speed for trajectories across MIT campus."
icra,None,Fast radiation mapping and multiple source localization using topographic contour map and incremental density estimation,"Abdullah Al Redwan Newaz,Sungmoon Jeong,Hosun Lee,Hyejeong Ryu,,,","Toward a global picture of the radiation exposure of an area, particularly for fast emergency response, a UAV based exploration method is proposed. Without a priori knowledge of the radiation field, it is difficult to select the region of interest (ROI) which includes all radiation sources. For the case of a single radiation source, a greedy algorithm may localize the source by finding the maximum radiation value. However, when multiple sources generate a hotspot in a cumulative manner, the hotspot position does not coincide with one of the source positions. Therefore, we propose an efficient exploration method to quickly localize the radiation sources using the following procedures: (1) ROI selection using topographic maps with specific radiation level selection methods and (2) source localization estimating the number of sources and their positions with incremental variational Bayes inference of Gaussian mixtures. Under three different conditions according to the number of sources and their positions, we have shown that the proposed model can reduce the ROI and significantly improve the estimation accuracy than existing methods."
icra,None,Informative soaring with drifting thermals,"Joseph L. Nguyen,Nicholas R. J. Lawrance,Robert Fitch,Salah Sukkarieh,","The informative soaring (IFS) problem involves a gliding unmanned aerial vehicle (UAV) exploiting energy from thermals to extend its information gathering capability. In this paper, we address the realistic situation of detecting new thermals drifting with the wind in the search environment. We consider complex target-search scenarios characterised by information clusters and propose a new set of algorithms designed to both explore for and exploit high-value thermals to maximise information gain. Our algorithms: 1) compute a thermal exploration map to detect useful thermals that eventually intercept clusters, 2) solve a boundary value problem for inter-thermal path segment (ITP) generation with moving thermals, 3) compute thermal time windows to gather information from clusters and form a cluster service schedule, and 4) use branch and bound (BnB) tree search for global planning, considering high-utility-rate ITPs to maximise information gain. Our solution is compared against a greedy method that neither considers the thermal exploration map nor cluster schedule and a full knowledge method that has access to all thermals. Numerical simulations show that on average, our solution outperforms the greedy method in one-third of 2400 Monte Carlo trials, and achieves similar performance to the full knowledge method when environmental conditions are favourable."
icra,None,"Fast, on-board, model-aided visual-inertial odometry system for quadrotor micro aerial vehicles","Dinuka Abeywardena,Shoudong Huang,Ben Barnes,Gamini Dissanayake,,","The main contribution of this paper is a high frequency, low-complexity, on-board visual-inertial odometry system for quadrotor micro air vehicles. The system consists of an extended Kalman filter (EKF) based state estimation algorithm that fuses information from a low cost MEMS inertial measurement unit acquired at 200Hz and VGA resolution images from a monocular camera at 50Hz. The dynamic model describing the quadrotor motion is employed in the estimation algorithm as a third source of information. Visual information is incorporated into the EKF by enforcing the epipolar constraint on features tracked between image pairs, avoiding the need to explicitly estimate the location of the tracked environmental features. Combined use of the dynamic model and epipolar constraints makes it possible to obtain drift free velocity and attitude estimates in the presence of both accelerometer and gyroscope biases. A strategy to deal with the unobservability that arises when the quadrotor is in hover is also provided. Experimental data from a real-time implementation of the system on a 50 gram embedded computer are presented in addition to the simulations to demonstrate the efficacy of the proposed system."
icra,None,Velocity aided attitude estimation for aerial robotic vehicles using latent rotation scaling,"Guillaume Allibert,Robert Mahony,Moses Bangura,","Flight performance of aerial robotic vehicles is critically dependent on the quality of the state estimates provided by onboard sensor systems. The attitude estimation problem has been extensively studied over the last ten years and the development of low complexity, high performance, robust non-linear observers for attitude has been one of the enabling technologies fueling the growth of small scale aerial robotic systems. The velocity aided attitude estimation problem, that is simultaneous estimation of attitude and linear velocity of an aerial platform, has only been tackled using the non-linear observer approach in the last few years. Prior contributions have lead to non-linear observers for which either there is no stability analysis or for which the analysis is extremely complex. In this paper, we propose a simple relaxation of the state space, allowing scaled rotation matrices R ∈ ℝ 3×3 such that RX T = uI where X = uR̂ and u > 0 is a positive scalar, along with additional observer dynamics to force u → 1 asymptotically. With this simple augmentation of the observer state space, we propose a non-linear observer with a straightforward Lyapunov stability analysis that demonstrates almost global asymptotic convergence along with local exponential convergence. Simulations as well as experimental results are provided to demonstrate the performance of the proposed observer."
icra,None,Visual inertial odometry for quadrotors on SE(3),"Giuseppe Loianno,Michael Watterson,Vijay Kumar,","The combination of on-board sensors measurements with different statistical characteristics can be employed in robotics for localization and control, especially in GPS-denied environments. In particular, most aerial vehicles are packaged with low cost sensors, important for aerial robotics, such as camera, a gyroscope, and an accelerometer. In this work, we develop a visual inertial odometry system based on the Unscented Kalman Filter (UKF) acting on the Lie group SE(3), such to obtain an unique, singularity-free representation of a rigid body pose. We model this pose with the Lie group SE(3) and model the noise on the corresponding Lie algebra. Moreover, we extend the concepts used in the standard UKF formulation, such as state uncertainty and modeling, to correctly incorporate elements that do not belong to an Euclidean space such as the Lie group members. In this analysis, we use the parallel transport, which requires us to explicitly consider SE(3) as representing rigid bodies though the use of the affine connection. We present experimental results to show the effectiveness of the proposed approach for state estimation of a quadrotor platform."
icra,None,Work those arms: Toward dynamic and stable humanoid walking that optimizes full-body motion,"Christian M. Hubicki,Ayonga Hereid,Michael X. Grey,Andrea L. Thomaz,,","Humanoid robots are designed with dozens of actuated joints to suit a variety of tasks, but walking controllers rarely make the best use of all of this freedom. We present a framework for maximizing the use of the full humanoid body for the purpose of stable dynamic locomotion, which requires no restriction to a planning template (e.g. LIPM). Using a hybrid zero dynamics (HZD) framework, this approach optimizes a set of outputs which provides requirements for the motion for all actuated links, including arms. These output equations are then rapidly solved by a whole-body inverse-kinematic (IK) solver, providing a set of joint trajectories to the robot. We apply this procedure to a simulation of the humanoid robot, DRC-HUBO, which has over 27 actuators. As a consequence, the resulting gaits swing their arms, not by a user defining swinging motions a priori or superimposing them on gaits post hoc, but as an emergent behavior from optimizing the dynamic gait. We also present preliminary dynamic walking experiments with DRC-HUBO in hardware, thereby building a case that hybrid zero dynamics as augmented by inverse kinematics (HZD+IK) is becoming a viable approach for controlling the full complexity of humanoid locomotion."
icra,None,Synthesis of full-body 3-D human gait using optimal control methods,"Martin L. Felis,Katja Mombaur,",In this paper we present a method that uses optimal control for offline human gait synthesis that does not depend on motion capture data or task-specific controllers. Our method is based on efficient simulation of rigid multibody systems and a direct multiple-shooting method to solve the underlying space-time optimization problem. We formulated different optimization criteria and synthesized gaits for a fullbody 3-D human model with 34 degrees of freedom and compared the resulting movements with human data. By combining different criteria we are able to improve the similarity of the synthesized motions with respect to recorded human motioncapture motions.
icra,None,Off-line controller design for reliable walking of ranger,"Matthew Kelly,Matthew Sheen,Andy Ruina,","We present a method for designing a walking controller for the walking robot Cornell Ranger. Our goal is a controller that can be designed using model-based optimization, and then transferred directly to the robot without the need for after-the-fact hand-tuning. The structure of the controller is hierarchical, with a high-level balance controller that plans step-to-step motions, and a lower-level joint controller that coordinates the individual joint motors to achieve the desired limb motions. The balance controller is designed through optimization, with the explicit goals of a) achieving a desired walking speed while b) minimizing energy use and c) avoiding falls due to disturbances. We demonstrate this walking controller on the Cornell Ranger, and find that the resulting gait is comparable to that of a previous (hand-tuned) controller, with regard to energy use, speed regulation, and fall prevention."
icra,None,Walking pattern generators designed for physical collaboration,"Don Joven Agravante,Alexander Sherikov,Pierre-Brice Wieber,Andrea Cherubini,,","This paper is about the design of humanoid walking pattern generators to be used for physical collaboration. A particular use case is a humanoid robot helping a human to carry large and/or heavy objects. To do this, we construct a reduced model which takes into account physical interaction. This is used in a model predictive control framework to generate separate behaviors for being a follower or a leader. The approach is then validated both on simulation and on the HRP-4 humanoid robot."
icra,None,Focused online visual-motor coordination for a dual-arm robot manipulator,"Seongyong Koo,Sven Behnke,","Coordination between visual sensors and robot manipulators is necessary for successful manipulation. This paper proposes a novel visual-motor coordination method that performs online parameter estimation of an RGB-D camera mounted in a robot head without any external markers. Through self-observation of a dual-arm robot manipulator, the method updates parameters to reduce the discrepancy between observed point cloud data and 3D mesh models of the current robot con guration. With the estimated parameters at each time step, visual data is adjusted to the focused workspace of the 14DOF dual-arm robot manipulator. The online and realtime algorithm was developed by using a GPU-based particle filtering method. Experimental results show that our method outperforms state-of-the-art offline registration methods in terms of accuracy and computation time. We also analyzed the dependence of the results on prior parameters to demonstrate the online capability of our method."
icra,None,Robot-human balance state transfer during full-body humanoid teleoperation using Divergent Component of Motion dynamics,"Joao Ramos,Albert Wang,Sangbae Kim,","This paper presents the ongoing work towards enabling humanoid robots to achieve dynamic behaviors comparable to humans. By using the concept of Divergent Component of Motion (DCM) first in introduced in [1], the present paper permits operator and robot balance synchronization using the mutual dynamics of the Center of Mass (CoM) and Center of Pressure (CoP). The Linear Inverted Pendulum Model (LIPM) with a reaction mass [2] is utilized to capture the humanoid behavior which interacts with the human operator under the Equilibrium Point (EP) [3] control assumption. Remarkable similarities between the physical system behavior and simulated results suggest the feasibility of the strategy. Experiments conducted with the MIT HERMES humanoid robot further show the performance of the proposed method."
icra,None,Fast algorithms to test robust static equilibrium for legged robots,"Andrea Del Prete,Steve Tonneau,Nicolas Mansard,","Maintaining equilibrium is of primary importance for legged systems. It is not surprising then that static equilibrium is at the core of most control/planning algorithms for legged robots. Being able to check whether a system is in static equilibrium is thus important, and doing it efficiently is crucial. While this is straightforward for a system in contact with a flat ground only, it is not the case for arbitrary contact geometries. In this paper we propose two new techniques to test static equilibrium and we show that they are computationally faster than all other existing methods. Moreover, we address the issue of robustness to errors in the contact-force tracking, which could lead to slippage or rotation at the contacts. We extend all the discussed techniques to test for robust static equilibrium, that is the ability to maintain equilibrium while avoiding to lose contacts despite bounded force-tracking errors. Accounting for robustness does not affect the computation time of the equilibrium tests, while it qualitatively improves the contact postures generated by our reachability-based multicontact planner."
icra,None,Parametrization of Catmull-Clark subdivision surfaces for posture generation,"Adrien Escande,Stanislas Brossette,Abderrahmane Kheddar,","In this paper we propose a method to build a smooth and non-singular map from the unit sphere to a Catmull-Clark subdivision surface. We use a tailored ray-casting algorithm to associate a point of the surface to each point of the sphere. This allows us to have smooth approximate representations for a large variety of (possibly non-convex) meshes that we can use to write numerically well-behaved constraints in gradient-based optimization. In particular, we address the writing of contact constraints between a robot and objects of its environment. We first detail our algorithm, taking care of speed and robustness, then show several use-cases for posture generations with a humanoid robot or a hand."
