conference,url,title,authors,abstract
icra,https://ieeexplore.ieee.org/stamp/stamp.jsp?tp=&arnumber=7487631,Unsupervised calibration of wheeled mobile platforms,"Maurilio Di Cicco,Bartolomeo Della Corte,Giorgio Grisetti,",This paper describes an unsupervised approach to retrieve the kinematic parameters of a wheeled mobile robot. The robot chooses which action to take in order to minimize the uncertainty in the parameter estimate and to fully explore the parameter space.
icra,https://ieeexplore.ieee.org/stamp/stamp.jsp?tp=&arnumber=7487632,Instance selection for efficient and reliable camera calibration,"Humphrey Hu,George Kantor,","The popularity of cameras for perception is enabled in part by powerful intrinsic calibration routines, commonly requiring a user to manually collect images of a known calibration target. The manual nature of this process produces training data that is unevenly spread in the camera relative pose space. If we desire camera parameters that perform well on average over the entire relative pose space, training on such a dataset results in poor performance. To address this, we show that reasoning about the training data distribution to select a more uniformly-spread subset of images produces more accurate and stable calibrations with fewer images. Our approach can be used easily with most camera calibration algorithms. We demonstrate in large-scale physical experiments the effect of non-uniform training data and show that our approach outperforms baselines in reprojection error and parameter variance."
icra,https://ieeexplore.ieee.org/stamp/stamp.jsp?tp=&arnumber=7487633,Geometry based exhaustive line correspondence determination,"Bhat K K Srikrishna,Utpala Musti,Janne Heikkilä,","In this paper we propose a purely geometric approach to establish correspondence between 3D line segments in a given model and 2D line segments detected in an image. Contrary to the existing methods which use strong assumptions on camera pose, we perform exhaustive search in order to compute maximum number of geometrically permitted correspondences between a 3D model and 2D lines. We present a novel theoretical framework in which we sample the space of camera axis direction (which is bounded and hence can be densely sampled unlike the unbounded space of camera position) and show that geometric constraints arising from it reduce rest of the computation to simple operations of finding camera position as the intersection of 3 planes. These geometric constraints can be represented using indexed arrays which accelerate it further. The algorithm returns all sets of correspondences and associated camera poses having high geometric consensus. The obtained experimental results show that our method has better asymptotic behavior than conventional approach. We also show that with the inclusion of additional sensor information our method can be used to initialize pose in just few seconds in many practical situations."
icra,https://ieeexplore.ieee.org/stamp/stamp.jsp?tp=&arnumber=7487634,Choosing a time and place for calibration of lidar-camera systems,"Terry Scott,Akshay A. Morye,Pedro Piniés,Lina M. Paz,Ingmar Posner,,","We propose a calibration method that automatically estimates the extrinsic calibration between a sensor pose-graph from natural scenes. The sensor pose-graph represents a system of sensors comprising of lidars and cameras, without sensor co-visibility constraints. The method addresses the fact that each scene contributes differently to the calibration problem by introducing a diligent scene selection scheme. The algorithm searches over all scenes to extract a subset of exemplars, whose joint optimisation yields progressively better calibration estimates. This non-parametric method requires no knowledge of the physical world, and continuously finds scenes that better constrain the optimisation parameters. We explain the theory, implement the method, and provide detailed performance analyses with experiments on real-world data."
icra,https://ieeexplore.ieee.org/stamp/stamp.jsp?tp=&arnumber=7487635,New probabilistic approaches to the AX = XB hand-eye calibration without correspondence,"Qianli Ma,Haiyuan Li,Gregory S. Chirikjian,","The hand-eye calibration problem was first formulated decades ago and is widely applied in robotics, image guided therapy, etc. It is usually cast as the “AX = XB” problem where the matrices A, B, and X are rigid body transformations in SE(3). Many solvers have been proposed to recover X given data streams {A i } and {B i } with correspondence. However, exact correspondence might not be accessible in the real world due to the asynchronous sensors and missing data, etc. A probabilistic approach named “Batch method” was introduced in previous research of our lab, which doesn't require a prior knowledge of the correspondence between the two data streams {A i } and {B j }. Analogous to non-probabilistic approaches which require data selection to filter out ill-conditioned data pairs, the Batch method has restrictions on the data set {A i } and {B j } that can be used. We propose two new probabilistic approaches built on top of the Batch method by giving new definitions of the mean on SE(3), which alleviate the restrictions on the data set and significantly improve the calibration accuracy of X."
icra,https://ieeexplore.ieee.org/stamp/stamp.jsp?tp=&arnumber=7487636,Calibration of industry robots with consideration of loading effects using Product-Of-Exponential (POE) and Gaussian Process (GP),"Wei Jing,Pey Yuen Tao,Guilin Yang,Kenji Shimada,",Robot calibration is critical for industrial robot applications that require high accuracy. This paper presents a novel calibration method that utilizes Product-Of-Exponential (POE) and Gaussian Process (GP) regression to compensate for both geometric and non-geometric errors within the robot manipulator. Effects of a payload at the end-effector is also considered in the GP regression model in order to further improve robot positioning accuracy in the task space. Simulation and experimental results demonstrate the effectiveness of the proposed method. The experimental results show that the proposed method reduces norm pose error by 65.5% and 50.2% on average compared to conventional base-tool calibration and POE calibration respectively.
icra,https://ieeexplore.ieee.org/stamp/stamp.jsp?tp=&arnumber=7487637,Visual tracking of biopsy needles in 2D ultrasound images,"Mert Kaya,Enes Senel,Awais Ahmad,Ozkan Bebek,","Ultrasound (US) is one the most commonly used medical imaging techniques in percutaneous needle procedures. However, US images are inherently noisy and contain excessive number of artifacts. Hence, it is not easy to track the needle tip in the US images during the needle insertions. At this point, image based visual tracking techniques can be used for needle tip tracking. This paper presents a method for visual tracking of biopsy needles in 2D US images using sum of squared differences and sum of conditional variances. Second order Gauss-Newton optimization is used to decrease processing time and make the tracking more robust. The needle template images used in the method are updated with a strategy to prevent needle loss and detection failures during tracking. The paper also explains how to identify needle losses during tracking and how to recover the needle position without using a needle localization algorithm. We demonstrate the precision of the visual needle tip tracking method with experiments under challenging tracking conditions."
icra,https://ieeexplore.ieee.org/stamp/stamp.jsp?tp=&arnumber=7487638,Magnetic needle guidance for neurosurgery: Initial design and proof of concept,"Andrew J. Petruska,Fabio Ruetz,Ayoung Hong,Luca Regli,Oguzkan Sürücü,,,","A magnetic-tip steerable needle is presented with application to aiding deep brain stimulation electrode placement. The magnetic needle is 1.3mm in diameter at the tip with a 0.7mm diameter shaft, which is selected to match the size of a deep brain stimulation electrode. The tip orientation is controlled by applying torques to the embedded neodymium-iron-boron permanent magnets with a clinically-sized magnetic-manipulation system. The prototype design is capable of following trajectories under human-in-the-loop control with minimum bend radii of 100mm without inducing tissue damage and down to 30mm if some tissue damage is tolerable. The device can be retracted and redirected to reach multiple targets with a single insertion point."
icra,https://ieeexplore.ieee.org/stamp/stamp.jsp?tp=&arnumber=7487639,Snap-on robotic wrist module for enhanced dexterity in endoscopic surgery,"Joshua Gafford,Tommaso Ranzani,Sheila Russo,Hiroyuki Aihara,,,,","Burgeoning transendoscopic procedures, such as endoscopic submucosal dissection (ESD), provide a promising means of treating early-stage gastric neoplasia in a minimally-invasive way. However, the remote locations of these lesions, coupled with their origination in the submucosal layers of the gastrointestinal tract, often lead to extreme technical, cognitive and ergonomic challenges which combat the widespread applicability and adoption of these techniques. Among these challenges is achieving the in vivo dexterity required to retract and dissect tissue. By leveraging workspace and force data obtained through clinical studies, we developed a modular, disposable, distally-mounted actuator (an `active endcap') that can augment an endoscopist's distal dexterity in ways that are not achievable with the endoscope's built-in degrees-of-freedom. The device consists of a flexible articulating `exoskeleton' manufactured via printed-circuit MEMS (PCMEMS) which engages and deflects electrosurgical tools that are passed through the endoscopic working channel. Embedded proprioceptive sensing is implemented on-board using distributed LED/phototransistor pairs and the principle of light intensity modulation (LIM). The distal degree-of-freedom is actuated using shape memory alloy (SMA) technology, and the actuation transmission system is fully contained within a 1-inch-long end cap that can be mounted on the distal end of the endoscope, thereby obviating the need for a mechanical connection to a proximal source. Proof-of-concept tests demonstrate that the actuator adds over 50 degrees of distal articulation to existing tools and can generate 450 mN of lateral force which has been clinically determined to be sufficient for performing circumferential incisions in ESD."
icra,https://ieeexplore.ieee.org/stamp/stamp.jsp?tp=&arnumber=7487640,Automate surgical tasks for a flexible Serpentine Manipulator via learning actuation space trajectory from demonstration,"Wenjun Xu,Jie Chen,Henry Y. K. Lau,Hongliang Ren,","Surgical robotic systems with miniaturized flexible Tendon-driven Serpentine Manipulators (TSM) have enjoyed increasing popularities among surgeons and researchers for their advantages of working in constrained and torturous human lumen such as oral cavity and upper GI tract. However, they suffer from sufficient nonlinearities and model uncertainties due to friction, tension varying, tendon slacking, etc. Model based control is insufficient to overcome such uncertainties and automate challenging surgical related tasks. The objective of this work is to automate certain clinical tasks to alleviate surgeon fatigue and promote task efficiency in kinematics free and sensor free circumstances. We present a data-driven approach based on Learning from Demonstration (LfD), which utilizes statistical machine learning models to encode system underlying dynamics and generalize smooth motor trajectories by direct actuation space learning. Motion segmentation is enabled with soft margin Support Vector Machine (soft-SVM) in complicated tasks. We also make attempts to retrieve task-specific properties by Locally Weighted Regression (LWR). We evaluated the approach on two surgical related tasks: compliant insertion and simplified Endoscopic Submucosal Dissection (ESD). The flexible TSM successfully reproduced both tasks and demonstrated superior trajectory performance. A video is available at: https://youtu.be/rLQo6xKtyMI."
icra,https://ieeexplore.ieee.org/stamp/stamp.jsp?tp=&arnumber=7487641,Catadioptric stereo tracking for three dimensional shape measurement of MRI guided catheters,"Russell C. Jackson,Taoming Liu,M. Cenk Çavuşoğlu,","The recent introduction of Magnetic Resonance Imaging (MRI)-actuated steerable catheters lays the ground work for increasing the efficacy of cardiac catheter procedures. The MRI, while capable of imaging the catheter for tracking and control, does not fulfill all of the needs required to identify and develop a complete catheter model. Specifially, the frequency response of the catheter must be identified to ensure stable control of the catheter system. This requires a higher frequency imaging than the MRI can achieve. This work uses a catadioptric stereo camera system consisting of a mirror and a single camera in order to track a MRI actuated catheter inside a MRI machine. The catadioptric system works in parallel to the MRI and is capable of recording the catheter at 60 fps for post processing. The accuracy of the catadioptric system is verified in imaging conditions that would be found inside the MRI. The stereo camera is then used to track a catheter as it is actuated inside the MRI."
icra,https://ieeexplore.ieee.org/stamp/stamp.jsp?tp=&arnumber=7487642,Progress toward robotic surgery of the lateral skull base: Integration of a dexterous continuum manipulator and flexible ring curette,"Anzhu Gao,John P. Carey,Ryan J. Murphy,Iulian Iordachita,Russell H. Taylor,,","Lesions of the lateral skull base in the petrous apex present unique surgical challenges because of the proximity of critical structures, including the inner ear, carotid artery, jugular bulb, facial nerve, lower cranial nerves, dura and brain. Currently, there are few appropriate surgical devices that can reach and remove these lesions, each with their own disadvantages. Here we investigate the feasibility of a dexterous continuum manipulator (DCM) capable of C-& S-shaped bends enabling dissection with remote center of motion (RCM) deep to the intact inner ear. A dedicated borescope channel provides the necessary visualization, while a flexible ring curette pre-shaped with a nitinol strip is designed to work through the instrument lumen for curettage of a cystic lesion. The kinematics of the DCM with the ring curette subject to an RCM constraint are investigated to explore the boundaries of a typical cyst cavity. Experiments in the planar phantom are carried out to validate feasibility, and results show that the proposed solution is practicable, accomplishing 80% and 83% removal of cysts for two kinds of boundaries."
icra,https://ieeexplore.ieee.org/stamp/stamp.jsp?tp=&arnumber=7487643,Compensation for unconstrained catheter shaft motion in cardiac catheters,"Alperen Degirmenci,Paul M. Loschak,Cory M. Tschabrunn,Elad Anter,,","Cardiac catheterization with ultrasound (US) imaging catheters provides real time US imaging from within the heart, but manually navigating a four degree of freedom (DOF) imaging catheter is difficult and requires extensive training. Existing work has demonstrated robotic catheter steering in constrained bench top environments. Closed-loop control in an unconstrained setting, such as patient vasculature, remains a significant challenge due to friction, backlash, and physiological disturbances. In this paper we present a new method for closed-loop control of the catheter tip that can accurately and robustly steer 4-DOF cardiac catheters and other flexible manipulators despite these effects. The performance of the system is demonstrated in a vasculature phantom and an in vivo porcine animal model. During bench top studies the robotic system converged to the desired US imager pose with sub-millimeter and sub-degree-level accuracy. During animal trials the system achieved 2.0 mm and 0.65° accuracy. Accurate and robust robotic navigation of flexible manipulators will enable enhanced visualization and treatment during procedures."
icra,https://ieeexplore.ieee.org/stamp/stamp.jsp?tp=&arnumber=7487644,Steering an actuated-tip needle in biological tissue: Fusing FBG-sensor data and ultrasound images,"Navid Shahriari,Roy J. Roesthuis,Nick J. van de Berg,John J. van den Dobbelsteen,,","Needle insertion procedures are commonly performed in current clinical practice for diagnostic and therapeutic purposes. Although prevailing technology allows accurate localization of lesions, they cannot yet be precisely targeted. Needle steering is a promising technique to overcome this challenge. In this paper, we describe the development of a novel steering system for an actuated-tip flexible needle. Strain measurements from an array of Fiber Bragg Grating (FBG) sensors are used for online reconstruction of the needle shape in 3D-space. FBG-sensor data is then fused with ultrasound images obtained from a clinically-approved Automated Breast Volume Scanner (ABVS) using an unscented Kalman filter. A new ultrasound-based tracking algorithm is developed for the robust tracking of the needle in biological tissue. Two experimental cases are presented to evaluate the proposed steering system. In the first case, the needle shape is reconstructed using the tracked tip position in ultrasound images and FBG-sensor measurements, separately. The reconstructed shape is then compared with the actual 3D needle shape obtained from the ABVS. In the second case, two steering experiments are performed to evaluate the overall system by fusing the FBG-sensor data and ultrasound images. Average targeting errors are 1.29±0.41 mm and 1.42±0.72 mm in gelatin phantom and biological tissue, respectively."
icra,None,Needle steering fusing direct base manipulation and tip-based control,"Jason Chevrie,Alexandre Krupa,Marie Babel,","Works on robotic needle steering often consider either tip-based control of flexible beveled tip needles or control of the bending of symmetric tip needles. In this paper a control law for needle steering which uses both direct manipulation of the needle base and the control of the tip deflection, is proposed. A 3D model of a beveled tip needle is used to determine the base motion that is needed to obtain the desired tip motion. The needle-tissue interaction model uses local virtual springs placed along the needle shaft and takes into account the interaction forces at the bevel. Online estimation and update of this model parameters is performed via visual feedback. The low level controller uses the task function framework to allow control of the tip velocity. Additionally duty cycling method is used if a reduction of the natural deflection of the needle tip is needed. Finally an experimental targeting task in a gelatin phantom is presented for preliminary validation of the framework. The method provided sub-millimeter accuracy on a target that would be unreachable using only tip-based control."
icra,None,"On the inseparable nature of sensor selection, sensor placement, and state estimation for continuum robots or “where to put your sensors and how to use them”","Arthur W. Mahoney,Trevor L. Bruns,Philip J. Swaney,Robert J. Webster,","When designing continuum robots for applications that require sensing, designers are faced with the problems of deciding what sensors to use, where they should be placed, and how best to use the information they provide. In this paper, we describe how a differential representation of a continuum robot's kinematic equations that govern its states (e.g., shape) can be used to simultaneously address these problems under the guidance of statistical state estimation. We identify how state estimation and sensing-system design (i.e., sensor selection and placement) are inherently coupled problems, which leads us to formulate sensing-system design as an optimization problem governed by the results of statistical estimation. As a case-study, the methods described herein are used to design a magnetic sensing system for concentric-tube robots."
icra,None,Planar odometry from a radial laser scanner. A range flow-based approach,"Mariano Jaimez,Javier G. Monroy,Javier Gonzalez-Jimenez,","In this paper we present a fast and precise method to estimate the planar motion of a lidar from consecutive range scans. For every scanned point we formulate the range flow constraint equation in terms of the sensor velocity, and minimize a robust function of the resulting geometric constraints to obtain the motion estimate. Conversely to traditional approaches, this method does not search for correspondences but performs dense scan alignment based on the scan gradients, in the fashion of dense 3D visual odometry. The minimization problem is solved in a coarse-to-fine scheme to cope with large displacements, and a smooth filter based on the covariance of the estimate is employed to handle uncertainty in unconstraint scenarios (e.g. corridors). Simulated and real experiments have been performed to compare our approach with two prominent scan matchers and with wheel odometry. Quantitative and qualitative results demonstrate the superior performance of our approach which, along with its very low computational cost (0.9 milliseconds on a single CPU core), makes it suitable for those robotic applications that require planar odometry. For this purpose, we also provide the code so that the robotics community can benefit from it."
icra,None,Collar Line Segments for fast odometry estimation from Velodyne point clouds,"Martin Velas,Michal Spanel,Adam Herout,","We present a novel way of odometry estimation from Velodyne LiDAR point cloud scans. The aim of our work is to overcome the most painful issues of Velodyne data - the sparsity and the quantity of data points - in an efficient way, enabling more precise registration. Alignment of the point clouds which yields the final odometry is based on random sampling of the clouds using Collar Line Segments (CLS). The closest line segment pairs are identified in two sets of line segments obtained from two consequent Velodyne scans. From each pair of correspondences, a transformation aligning the matched line segments into a 3D plane is estimated. By this, significant planes (ground, walls, ...) are preserved among aligned point clouds. Evaluation using the KITTI dataset shows that our method outperforms publicly available and commonly used state-of-the-art method GICP for point cloud registration in both accuracy and speed, especially in cases where the scene lacks significant landmarks or in typical urban elements. For such environments, the registration error of our method is reduced by 75% compared to the original GICP error."
icra,None,Motion-based detection and tracking in 3D LiDAR scans,"Ayush Dewan,Tim Caselitz,Gian Diego Tipaldi,Wolfram Burgard,","Robots are expected to operate autonomously in increasingly complex scenarios such as crowded streets or heavy traffic situations. Perceiving the dynamics of moving objects in the environment is crucial for safe and smart navigation and therefore a key enabler for autonomous driving. In this paper we present a novel model-free approach for detecting and tracking dynamic objects in 3D LiDAR scans obtained by a moving sensor. Our method only relies on motion cues and does not require any prior information about the objects. We sequentially detect multiple motions in the scene and segment objects using a Bayesian approach. For robustly tracking objects, we utilize their estimated motion models. We present extensive quantitative results based on publicly available datasets and show that our approach outperforms the state of the art."
icra,None,Hierarchical spatial model for 2D range data based room categorization,"Peter Uršič,Aleš Leonardis,Danijel Skočaj,Matej Kristan,","The next generation service robots are expected to co-exist with humans in their homes. Such a mobile robot requires an efficient representation of space, which should be compact and expressive, for effective operation in real-world environments. In this paper we present a novel approach for 2D ground-plan-like laser-range-data-based room categorization that builds on a compositional hierarchical representation of space, and show how an additional abstraction layer, whose parts are formed by merging partial views of the environment followed by graph extraction, can achieve improved categorization performance. A new algorithm is presented that finds a dictionary of exemplar elements from a multi-category set, based on the affinity measure defined among pairs of elements. This algorithm is used for part selection in new layer construction. Room categorization experiments have been performed on a challenging publicly available dataset, which has been extended in this work. State-of-the-art results were obtained by achieving the most balanced performance over all categories."
