conference,url,title,authors,abstract
icra,https://ieeexplore.ieee.org/stamp/stamp.jsp?tp=&arnumber=7487090,Exact robot navigation using power diagrams,"Omur Arslan,Daniel E. Koditschek,","We reconsider the problem of reactive navigation in sphere worlds, i.e., the construction of a vector field over a compact, convex Euclidean subset punctured by Euclidean disks, whose flow brings a Euclidean disk robot from all but a zero measure set of initial conditions to a designated point destination, with the guarantee of no collisions along the way. We use power diagrams, generalized Voronoi diagrams with additive weights, to identify the robot's collision free convex neighborhood, and to generate the value of our proposed candidate solution vector field at any free configuration via evaluation of an associated convex optimization problem. We prove that this scheme generates a continuous flow with the specified properties. We also propose its practical extension to the nonholonomically constrained kinematics of the standard differential drive vehicle."
icra,https://ieeexplore.ieee.org/stamp/stamp.jsp?tp=&arnumber=7487091,Gaussian Process Motion planning,"Mustafa Mukadam,Xinyan Yan,Byron Boots,","Motion planning is a fundamental tool in robotics, used to generate collision-free, smooth, trajectories, while satisfying task-dependent constraints. In this paper, we present a novel approach to motion planning using Gaussian processes. In contrast to most existing trajectory optimization algorithms, which rely on a discrete state parameterization in practice, we represent the continuous-time trajectory as a sample from a Gaussian process (GP) generated by a linear time-varying stochastic differential equation. We then provide a gradient-based optimization technique that optimizes continuous-time trajectories with respect to a cost functional. By exploiting GP interpolation, we develop the Gaussian Process Motion Planner (GPMP), that finds optimal trajectories parameterized by a small number of states. We benchmark our algorithm against recent trajectory optimization algorithms by solving 7-DOF robotic arm planning problems in simulation and validate our approach on a real 7-DOF WAM arm."
icra,https://ieeexplore.ieee.org/stamp/stamp.jsp?tp=&arnumber=7487092,Topological trajectory clustering with relative persistent homology,"Florian T. Pokorny,Ken Goldberg,Danica Kragic,","Cloud Robotics techniques based on Learning from Demonstrations suggest promising alternatives to manual programming of robots and autonomous vehicles. One challenge is that demonstrated trajectories may vary dramatically: it can be very difficult, if not impossible, for a system to learn control policies unless the trajectories are clustered into meaningful consistent subsets. Metric clustering methods, based on a distance measure, require quadratic time to compute a pairwise distance matrix and do not naturally distinguish topologically distinct trajectories. This paper presents an algorithm for topological clustering based on relative persistent homology, which, for a fixed underlying simplicial representation and discretization of trajectories, requires only linear time in the number of trajectories. The algorithm incorporates global constraints formalized in terms of the topology of sublevel or superlevel sets of a function and can be extended to incorporate probabilistic motion models. In experiments with real automobile and ship GPS trajectories as well as pedestrian trajectories extracted from video, the algorithm clusters trajectories into meaningful consistent subsets and, as we show in an experiment with ship trajectories, results in a faster and more efficient clustering than a metric clustering by Fréchet distance."
icra,https://ieeexplore.ieee.org/stamp/stamp.jsp?tp=&arnumber=7487113,High-dimensional Winding-Augmented Motion Planning with 2D topological task projections and persistent homology,"Florian T. Pokorny,Danica Kragic,Lydia E. Kavraki,Ken Goldberg,","Recent progress in motion planning has made it possible to determine homotopy inequivalent trajectories between an initial and terminal configuration in a robot configuration space. Current approaches have however either assumed the knowledge of differential one-forms related to a skeletonization of the collision space, or have relied on a simplicial representation of the free space. Both of these approaches are currently however not yet practical for higher dimensional configuration spaces. We propose 2D topological task projections (TTPs): mappings from the configuration space to 2-dimensional spaces where simplicial complex filtrations and persistent homology can identify topological properties of the high-dimensional free configuration space. Our approach only requires the availability of collision free samples to identify winding centers that can be used to determine homotopy inequivalent trajectories. We propose the Winding Augmented RRT and RRT* (WA-RRT/RRT*) algorithms using which homotopy inequivalent trajectories can be found. We evaluate our approach in experiments with configuration spaces of planar linkages with 2-10 degrees of freedom. Results indicate that our approach can reliably identify suitable topological task projections and our proposed WA-RRT and WA-RRT* algorithms were able to identify a collection of homotopy inequivalent trajectories in each considered configuration space dimension."
icra,https://ieeexplore.ieee.org/stamp/stamp.jsp?tp=&arnumber=7487114,Resource-aware motion planning,"Manfred Kröhnert,Raphael Grimm,Nikolaus Vahrenkamp,Tamim Asfour,","We address the question of how resource-aware concepts can be utilized in motion planning algorithms. Resource-awareness facilitate better resource allocation on global system level, e.g. when a humanoid robot needs to distribute and schedule a wide variety of concurrent algorithms. We present a motion planning approach that employs self-monitoring concepts in order to identify the difficulty of the planning problem. Resources are requested dynamically and adapted based on problem difficulty and current planning progress. We show how dynamic adaptation of resource allocation on algorithmic level can reduce the system workload as compared to static resource allocation while meeting Quality of Service (QoS) measures such as average workload or efficiency. We evaluate our approach both in several synthetic setups with varying difficulty and with the humanoid robot ARMAR-4."
icra,https://ieeexplore.ieee.org/stamp/stamp.jsp?tp=&arnumber=7487115,An MDP-based approximation method for goal constrained multi-MAV planning under action uncertainty,"Lantao Liu,Nathan Michael,","This paper presents a fast approximate multi-agent decision theoretic planning method extended from the well-known Markov Decision Process (MDP). Our objective is to plan motions for a team of homogeneous micro air vehicles (MAVs) toward a set of goals, such that each MAV at any state at any moment follows an action policy toward a unique goal, while considering action uncertainty. We pursue an efficient formulation by first considering a deterministic abstraction of the stochastic system based on approximate initial paths. These deterministic and decoupled sub-problems are converted to the stochastic domain and improved by individual agents or a subset of agents. The resulting decoupled formulation requires processing of a partial state space and enables online operation given applications with emerging tasks."
icra,https://ieeexplore.ieee.org/stamp/stamp.jsp?tp=&arnumber=7487116,Learning high-dimensional Mixture Models for fast collision detection in Rapidly-Exploring Random Trees,"Jinwook Huh,Daniel D. Lee,","This paper presents a new approach for fast collision detection in high dimensional configuration spaces for Rapidly-exploring Random Trees (RRT) motion planning. The proposed method is based upon Gaussian Mixture Models (GMM) that are learned using an incremental Expectation Maximization clustering algorithm trained online using exemplars provided by a slow, conventional kinematic-based collision detection routine. The number of collision checks needed can be drastically reduced using a biased random sampling from the learned GMM distribution, and the learned models are continually refined and improved as the RRT planning algorithm proceeds. Our proposed method is demonstrated on several example applications and experimental results show marked improvement in computational efficiency over previous approaches."
icra,https://ieeexplore.ieee.org/stamp/stamp.jsp?tp=&arnumber=7487117,Burs of free C-space: A novel structure for path planning,"Bakir Lacevic,Dinko Osmankovic,Adnan Ademovic,","This paper presents a new approach to C-space exploration and path planning for robotic manipulators using the structure named bur of free C-space. This structure builds upon the so-called bubble, which is a local volume of free C-space, easily computed using the distance information in the workspace. We show how the same distance information can be used to compute the bur that can reach substantially beyond the boundary of the bubble. It is shown how burs can be used to form a rapidly exploring bur tree (RBT): a space-filling tree that resembles RRT. Such a structure can easily be used within a suitably tailored path planning algorithm. Simulation study shows how the RBT-based algorithm outperforms the classical RRT-based method."
icra,https://ieeexplore.ieee.org/stamp/stamp.jsp?tp=&arnumber=7487118,Path planning for robotic manipulators using expanded bubbles of free C-space,"Adnan Ademovic,Bakir Lacevic,","This paper presents a novel method for using volumetric information in the C-space for generating collision-free paths for robotic manipulators in the presence of obstacles. The method is based on the RRT paradigm, i.e., incrementally building trees in C-space in order to connect the initial configuration to the final one. Bubbles of free C-space are used within a carefully modified extend procedure to add lengthy edges to the tree. In particular, we propose an expanded version of the bubble, which enables even more efficient exploration. The method is validated and compared to other planning algorithms within a simulation study that includes several types of manipulators and obstacle scenarios."
icra,https://ieeexplore.ieee.org/stamp/stamp.jsp?tp=&arnumber=7487119,Reduced complexity multi-scale path-planning on probabilistic maps,"Florian Hauer,Panagiotis Tsiotras,","We present several modifications to the previously proposed MSPP algorithm that can speed-up its execution considerably. The MSPP algorithm leverages a multi-scale representation of the environment in n dimensions encoded in tree structure constructed by recursive dyadic partitioning of the search space. We first present a new method to compute the graph neighbors in order to reduce the complexity of each iteration, from O(|V|2) to O(|V| log |V|). We then show how to delay expensive intermediate computations until we know that new information will be required, hence saving time by not operating on information that is never used during the search. Finally, we present a way to remove the very expensive need to calculate a full multi-scale map with the use of sampling and derive an upper bound on the probability of failure as a function of the number of samples."
icra,https://ieeexplore.ieee.org/stamp/stamp.jsp?tp=&arnumber=7487120,Hierarchical rejection sampling for informed kinodynamic planning in high-dimensional spaces,"Tobias Kunz,Andrea Thomaz,Henrik Christensen,","We present hierarchical rejection sampling (HRS) to improve the efficiency of asymptotically optimal sampling-based planners for high-dimensional problems with differential constraints. Pruning nodes and rejecting samples that cannot improve the currently best solution have been shown to improve performance for certain problems. We show that in high-dimensional domains this improvement can be so large that rejecting samples becomes the bottleneck of the algorithm because almost all samples are rejected. This contradicts general wisdom that collision checking is always the bottleneck of sampling-based planners. Only samples in the informed subset of the state space can potentially improve the current solution. For systems without differential constraints the informed subset forms an ellipsoid, which can be parameterized and sampled directly. For systems with differential constraints the informed subset is more complicated and no such direct sampling methods exist. HRS improves the efficiency of finding samples within the informed subset without parameterizing it explicitly. Thus, it can also be applied to systems with differential constraints for which a steering method is available. In our experiments we demonstrate efficiency improvements of an RRT* planner of up to two orders of magnitude."
icra,https://ieeexplore.ieee.org/stamp/stamp.jsp?tp=&arnumber=7487121,A highly sensitive dual mode tactile and proximity sensor using Carbon Microcoils for robotic applications,"Hyo Seung Han,Junwoo Park,Tien Dat Nguyen,Uikyum Kim,Canh Toan Nguyen,,,","This paper presents a highly sensitive dual mode tactile and proximity sensor for robotic applications that uses Carbon Microcoils (CMCs). The sensor consists of multiple electrode layers printed on a Flexible Printed Circuit Board (FPCB) and a dielectric substrate into which the CMCs are dispersed. The dielectric layer is simply put on the top of the FPCB. Thus, the sensor provides ease of fabrication and robustness against repetitive external contacts because the dielectric layer protects the electrodes. The electrical properties of the sensor are changed when an object approaches or touches the sensor. The sensor uses a capacitive sensing mode for tactile sensing and an inductive sensing mode for proximity sensing. CMCs amplify the change of the sensor signal because of electrical impedance formed by the CMCs, and thus, the sensitivity of the sensor increases. We fabricate the prptotype sensor with the dimensions of 30 × 30 × 0.6 mm3, and with 3 mm spatial-resolution. The sensor detects the applied pressure up to 330 kPa and the distance of an object as much as 150 mm away."
icra,https://ieeexplore.ieee.org/stamp/stamp.jsp?tp=&arnumber=7487122,Nanoforce sensing with magnetic springs using a differential approach to compensate external mechanical disturbances,"Margot Billot,Emmanuel Piat,Joël Abadie,Joël Agnus,Philippe Stempflé,","Nanoforce sensors using passive magnetic springs associated to a macroscopic seismic mass are known to be a possible alternative to force sensors based on elastic microstructures like Atomic Force Microscopes if the nanoforces that have to be measured are characterized by a bandwidth limited to a few Hertz. The estimation of the unknown force applied to the seismic mass is based on the deconvolution of the noisy measurement of the mass displacement which has an under-damped dynamic. Despite their high performances in terms of linearity, resolution and measurement range, such force sensors are extremely sensitive to low frequency environmental mechanical disturbances. They are also sensitive to the temperature evolution of the ambient air. The evaluation, modeling and compensation of such environmental disturbances have to be specifically studied in the context of magnetic springs associated to a macroscopic seismic mass. This article presents an estimation and a passive compensation strategy of the low frequency and non-stationary mechanical disturbances that is based on a differential principle. This approach is applied to a nanoforce sensor based on diamagnetic levitation developed in the last decade and gives an uncertainty below the nanonewton level."
icra,https://ieeexplore.ieee.org/stamp/stamp.jsp?tp=&arnumber=7487123,Improved normal and shear tactile force sensor performance via Least Squares Artificial Neural Network (LSANN),"Meng Yee Chuah,Sangbae Kim,","This paper presents a new approach to the characterization of tactile array sensors that aims to reduce the computational time needed for convergence to obtain a useful estimator for normal and shear forces. This is achieved by breaking up the sensor characterization into two parts: a linear regression portion using multivariate least squares regression, and a nonlinear regression portion using a neural network as a multi-input, multi-output function approximator. This procedure has been termed Least Squares Artificial Neural Network (LSANN). By applying LSANN on the 2nd generation MIT Cheetah footpad, the convergence speed for the estimator of the normal and shear forces is improved by 59.2% compared to using only the neural network alone. The normalized root mean squared error between the two methods are nearly identical at 1.17% in the normal direction, and 8.30% and 10.14% in the shear directions. This approach could have broader implications in greatly reducing the amount of time needed to train a contact force estimator for a large number of tactile sensor arrays (i.e. in robotic hands and skin)."
icra,https://ieeexplore.ieee.org/stamp/stamp.jsp?tp=&arnumber=7487124,Tactile manipulation with biomimetic active touch,"Luke Cramphorn,Benjamin Ward-Cherrier,Nathan F. Lepora,","Tactile manipulation is the ability to control objects in real-time using the sense of touch. Here we examine tactile manipulation from the perspective of active touch with a biomimetic tactile sensor, which combines tactile perception with control of sensor location. Experiments are performed with the tactile fingertip mounted as end effector to a robot arm, to manipulate (roll) a cylinder in contact with the fingertip. Performance is validated with offline (cross-validation) and online (real-time operation) assessments. Location perception is finer than the sensor resolution, leading to superresolved tactile manipulation along a complex trajectory. However, the original methods were non-robust to large unknown disturbances of object location, necessitating modification of the perceptual process to diminish prior beliefs relative to past posterior beliefs. In consequence robust and accurate tactile manipulation was attained. In general, it appears there is a trade-off between the responsiveness to unknown change and manipulation accuracy, which must be set appropriately for each task."
icra,https://ieeexplore.ieee.org/stamp/stamp.jsp?tp=&arnumber=7487125,Narrow passage sampling in the observation of robotic assembly tasks,"Korbinian Nottensteiner,Mikel Sagardia,Andreas Stemmer,Christoph Borst,","The observation of robotic assembly tasks is required as feedback for decisions and adaption of the task execution on the current situation. A sequential Monte Carlo observation algorithm is proposed, which uses a fast and accurate collision detection algorithm as a reference model for the contacts between complex shaped parts. The main contribution of the paper is the extension of the classic random motion model in the propagation step with sampling methods known from the domain of probabilistic roadmap planning in order to increase the sample density in narrow passages of the configuration space. As a result, the observation performance can be improved and a risk of sample impoverishment reduced. Experimental validation is provided for a peg-in-hole task executed by a lightweight-robot arm equipped with joint torque sensors."
icra,https://ieeexplore.ieee.org/stamp/stamp.jsp?tp=&arnumber=7487126,Robotic grasp control with high-resolution combined tactile and proximity sensing,"Kazuhiro Shimonomura,Hiroto Nakashima,Kentaro Nozu,","We have proposed a multimodal sensing with optical device and its application to robotic grasp control. The proposed device provides both tactile and proximity information with high spatial resolution on the same scale of coordinates, that is necessary while grasping small and complicated-shaped objects using a robotic hand. In our proposed device, tactile information is obtained as infrared image through a light conductive plate, which allows the capture of a tactile image of high spatial resolution using a camera. Proximity information is detected based on stereo matching of a pair of images obtained by two cameras. By using a compound-eye camera, we constructed a compact device so that the sensor can be mounted on the robotic hand. Through experiments with 6 DoF robotic arm and robotic hand equipped with the proposed sensing device, we show that the robotic motion for searching, approaching and grasping can be controlled based on sensor information obtained from only the proposed device. In addition, our combined sensing approach enables an adaptive grasping motion of the robotic hand."
icra,https://ieeexplore.ieee.org/stamp/stamp.jsp?tp=&arnumber=7487127,Experience-based torque estimation for an industrial robot,"Erik Berger,Steve Grehl,David Vogt,Bernhard Jung,Heni Ben Amor,","Robotic manipulation tasks often require the control of forces and torques exerted on external objects. This paper presents a machine learning approach for estimating forces when no force sensors are present on the robot platform. In the training phase, the robot executes the desired manipulation tasks under controlled conditions with systematically varied parameter sets. All internal sensor data, in the presented case from more than 100 sensors, as well as the force exerted by the robot are recorded. Using Transfer Entropy, a statistical model is learned that identifies the subset of sensors relevant for torque estimation in the given task. At runtime, the model is used to accurately estimate the torques exerted during manipulations of the demonstrated kind. The feasibility of the approach is shown in a setting where a robotic manipulator operates a torque wrench to fasten a screw nut. Torque estimates with an accuracy of well below ±1Nm are achieved. A strength of the presented model is that no prior knowledge of the robot's kinematics, mass distribution or sensor instrumentation is required."
icra,https://ieeexplore.ieee.org/stamp/stamp.jsp?tp=&arnumber=7487128,Compressed sensing for tactile skins,"Brayden Hollis,Stacy Patterson,Jeff Trinkle,","Whole body tactile perception via tactile skins offers large benefits for robots in unstructured environments. To fully realize this benefit, tactile systems must support real-time data acquisition over a massive number of tactile sensor elements. We present a novel approach for scalable tactile data acquisition using compressed sensing. We first demonstrate that the tactile data is amenable to compressed sensing techniques. We then develop a solution for fast data sampling, compression, and reconstruction that is suited for tactile system hardware and has potential for reducing the wiring complexity. Finally, we evaluate the performance of our technique on simulated tactile sensor networks. Our evaluations show that compressed sensing, with a compression ratio of 3 to 1, can achieve higher signal acquisition accuracy than full data acquisition of noisy sensor data."
icra,https://ieeexplore.ieee.org/stamp/stamp.jsp?tp=&arnumber=7487129,Variability and predictability in tactile sensing during grasping,"Qian Wan,Ryan P. Adams,Robert D. Howe,","Robotic manipulation in unstructured environments requires grasping a wide range of objects. Tactile sensing is presumed to provide essential information in this context, but there has been little work examining the tactile sensor signals produced during realistic manipulation tasks. This paper presents tactile sensor data from grasping a generic object in thousands of trials. Position error between the hand and object was varied to model the uncertainty in real-world grasping, and a grasp outcome prediction was done using only tactile sensors. Results show that tactile signals are highly variable despite good repeatability in grasping conditions. The observed variability appears to be intrinsic to the grasping process, due to the mechanical coupling between fingers as they contact the object in parallel, as well as numerous factors such as frictional effects and inaccuracies in the robot hand. Using a simple machine learning algorithm, grasp outcome prediction based purely on tactile sensors is not reliable enough for real-world responsibilities. These results have implications for improved tactile sensor system and controller design, as well as signal processing and machine learning methods."
icra,https://ieeexplore.ieee.org/stamp/stamp.jsp?tp=&arnumber=7487130,Analytic grasp success prediction with tactile feedback,"Robert Krug,Achim J. Lilienthal,Danica Kragic,Yasemin Bekiroglu,","Predicting grasp success is useful for avoiding failures in many robotic applications. Based on reasoning in wrench space, we address the question of how well analytic grasp success prediction works if tactile feedback is incorporated. Tactile information can alleviate contact placement uncertainties and facilitates contact modeling. We introduce a wrench-based classifier and evaluate it on a large set of real grasps. The key finding of this work is that exploiting tactile information allows wrench-based reasoning to perform on a level with existing methods based on learning or simulation. Different from these methods, the suggested approach has no need for training data, requires little modeling effort and is computationally efficient. Furthermore, our method affords task generalization by considering the capabilities of the grasping device and expected disturbance forces/moments in a physically meaningful way."
