conference,url,title,authors,abstract
www,https://dl.acm.org/doi/pdf/10.1145/2736277.2741648,Optimizing Display Advertising in Online Social Networks,"Zeinab Abbassi, Aditya Bhaskara, Vishal Misra, ","Advertising is a significant source of revenue for most online social networks. Conventional online advertising methods need to be customized for online social networks in order to address their distinct characteristics. Recent experimental studies have shown that providing social cues along with ads, e.g. information about friends liking the ad or clicking on an ad, leads to higher click rates. In other words, the probability of a user clicking an ad is a function of the set of friends that have clicked the ad. In this work, we propose formal probabilistic models to capture this phenomenon, and study the algorithmic problem that then arises. Our work is in the context of display advertising where a contract is signed to show an ad to a pre-determined number of users. The problem we study is the following: given a certain number of impressions, what is the optimal display strategy, i.e. the optimal order and the subset of users to show the ad to, so as to maximize the expected number of clicks? Unlike previous models of influence maximization, we show that this optimization problem is hard to approximate in general, and that it is related to finding dense subgraphs of a given size. In light of the hardness result, we propose several heuristic algorithms including a two-stage algorithm inspired by influence-and-exploit strategies in viral marketing. We evaluate the performance of these heuristics on real data sets, and observe that our two-stage heuristic significantly outperforms the natural baselines."
www,https://dl.acm.org/doi/pdf/10.1145/2736277.2741137,Frankenplace: Interactive Thematic Mapping for Ad Hoc Exploratory Search,"Benjamin Adams, Grant McKenzie, Mark Gahegan, ","Ad hoc keyword search engines built using modern information retrieval methods do a good job of handling fine-grained queries. However, they perform poorly at facilitating spatial and spatially-embedded thematic exploration of the results, despite the fact that many queries, e.g. ""civil war,"" refer to different documents and topics in different places. This is not for lack of data: geographic information, such as place names, events, and coordinates are common in unstructured document collections on the web. The associations between geographic and thematic contents in these documents can provide a rich groundwork to organize information for exploratory research. In this paper we describe the architecture of an interactive thematic map search engine, Frankenplace, designed to facilitate document exploration at the intersection of theme and place. The map interface enables a user to zoom the geographic context of their query in and out, and quickly explore through thousands of search results in a meaningful way. And by combining topic models with geographically contextualized search results, users can discover related topics based on geographic context. Frankenplace utilizes a novel indexing method called geoboost for boosting terms associated with cells on a discrete global grid. The resulting index factors in the geographic scale of the place or feature mentioned in related text, the relative textual scope of the place reference, and the overall importance of the containing document in the document network. The system is currently indexed with over 5 million documents from the web, including the English Wikipedia and online travel blog entries. We demonstrate that Frankenplace can support four distinct types of exploratory search tasks while being adaptive to scale and location of interest."
www,https://dl.acm.org/doi/pdf/10.1145/2736277.2741636,Towards Reconciling SPARQL and Certain Answers,"Shqiponja Ahmetaj, Wolfgang Fischl, Reinhard Pichler, Mantas Šimkus, ","SPARQL entailment regimes are strongly influenced by the big body of works on ontology-based query answering, notably in the area of Description Logics (DLs). However, the semantics of query answering under SPARQL entailment regimes is defined in a more naive and much less expressive way than the certain answer semantics usually adopted in DLs. The goal of this work is to introduce an intuitive certain answer semantics also for SPARQL and to show the feasibility of this approach. For OWL 2 QL entailment, we present algorithms for the evaluation of an interesting fragment of SPARQL (the so-called well-designed SPARQL). Moreover, we show that the complexity of the most fundamental query analysis tasks (such as query containment and equivalence testing) is not negatively affected by the presence of OWL 2 QL entailment under the proposed semantics."
www,https://dl.acm.org/doi/pdf/10.1145/2736277.2741120,Donor Retention in Online Crowdfunding Communities: A Case Study of DonorsChoose.org,"Tim Althoff, Jure Leskovec, ","Online crowdfunding platforms like DonorsChoose.org and Kickstarter allow specific projects to get funded by targeted contributions from a large number of people. Critical for the success of crowdfunding communities is recruitment and continued engagement of donors. With donor attrition rates above 70%, a significant challenge for online crowdfunding platforms as well as traditional offline non-profit organizations is the problem of donor retention. We present a large-scale study of millions of donors and donations on DonorsChoose.org, a crowdfunding platform for education projects. Studying an online crowdfunding platform allows for an unprecedented detailed view of how people direct their donations. We explore various factors impacting donor retention which allows us to identify different groups of donors and quantify their propensity to return for subsequent donations. We find that donors are more likely to return if they had a positive interaction with the receiver of the donation. We also show that this includes appropriate and timely recognition of their support as well as detailed communication of their impact. Finally, we discuss how our findings could inform steps to improve donor retention in crowdfunding communities and non-profit organizations."
www,https://dl.acm.org/doi/pdf/10.1145/2736277.2741109,Budget-Constrained Item Cold-Start Handling in Collaborative Filtering Recommenders via Optimal Design,"Oren Anava, Shahar Golan, Nadav Golbandi, Zohar Karnin, ","It is well known that collaborative filtering (CF) based recommender systems provide better modeling of users and items associated with considerable rating history. The lack of historical ratings results in the user and the item cold-start problems. The latter is the main focus of this work. Most of the current literature addresses this problem by integrating content-based recommendation techniques to model the new item. However, in many cases such content is not available, and the question arises is whether this problem can be mitigated using CF techniques only. We formalize this problem as an optimization problem: given a new item, a pool of available users, and a budget constraint, select which users to assign with the task of rating the new item in order to minimize the prediction error of our model. We show that the objective function is monotone-supermodular, and propose efficient optimal design based algorithms that attain an approximation to its optimum. Our findings are verified by an empirical study using the Netflix dataset, where the proposed algorithms outperform several baselines for the problem at hand."
www,https://dl.acm.org/doi/pdf/10.1145/2736277.2741629,Improved Theoretical and Practical Guarantees for Chromatic Correlation Clustering,"Yael Anava, Noa Avigdor-Elgrabli, Iftah Gamzu, ","We study a natural generalization of the correlation clustering problem to graphs in which the pairwise relations between objects are categorical instead of binary. This problem was recently introduced by Bonchi et al. under the name of chromatic correlation clustering, and is motivated by many real-world applications in data-mining and social networks, including community detection, link classification, and entity de-duplication. Our main contribution is a fast and easy-to-implement constant approximation framework for the problem, which builds on a novel reduction of the problem to that of correlation clustering. This result significantly progresses the current state of knowledge for the problem, improving on a previous result that only guaranteed linear approximation in the input size. We complement the above result by developing a linear programming-based algorithm that achieves an improved approximation ratio of 4. Although this algorithm cannot be considered to be practical, it further extends our theoretical understanding of chromatic correlation clustering. We also present a fast heuristic algorithm that is motivated by real-life scenarios in which there is a ground-truth clustering that is obscured by noisy observations. We test our algorithms on both synthetic and real datasets, like social networks data. Our experiments reinforce the theoretical findings by demonstrating that our algorithms generally outperform previous approaches, both in terms of solution cost and reconstruction of an underlying ground-truth clustering."
www,https://dl.acm.org/doi/pdf/10.1145/2736277.2741672,"Global Diffusion via Cascading Invitations: Structure, Growth, and Homophily","Ashton Anderson, Daniel Huttenlocher, Jon Kleinberg, Jure Leskovec, Mitul Tiwari, ","Many of the world's most popular websites catalyze their growth through invitations from existing members. New members can then in turn issue invitations, and so on, creating cascades of member signups that can spread on a global scale. Although these diffusive invitation processes are critical to the popularity and growth of many websites, they have rarely been studied, and their properties remain elusive. For instance, it is not known how viral these cascades structures are, how cascades grow over time, or how diffusive growth affects the resulting distribution of member characteristics present on the site. In this paper, we study the diffusion of LinkedIn, an online professional network comprising over 332 million members, a large fraction of whom joined the site as part of a signup cascade. First we analyze the structural patterns of these signup cascades, and find them to be qualitatively different from previously studied information diffusion cascades. We also examine how signup cascades grow over time, and observe that diffusion via invitations on LinkedIn occurs over much longer timescales than are typically associated with other types of online diffusion. Finally, we connect the cascade structures with rich individual-level attribute data to investigate the interplay between the two. Using novel techniques to study the role of homophily in diffusion, we find striking differences between the local, edge-wise homophily and the global, cascade-level homophily we observe in our data, suggesting that signup cascades form surprisingly coherent groups of members."
www,https://dl.acm.org/doi/pdf/10.1145/2736277.2741680,Recommendation Subgraphs for Web Discovery,"Arda Antikacioglu, R. Ravi, Srinath Sridhar, ","Recommendations are central to the utility of many popular e-commerce websites. Such sites typically contain a set of recommendations on every product page that enables visitors and crawlers to easily navigate the website. These recommendations are essentially universally present on all e-commerce websites. Choosing an appropriate set of recommendations at each page is a critical task performed by dedicated backend software systems. We formalize the concept of recommendations used for discovery as a natural graph optimization problem on a bipartite graph and propose three methods for solving the problem in increasing order of sophistication: a local random sampling algorithm, a greedy algorithm and a more involved partitioning based algorithm. We first theoretically analyze the performance of these three methods on random graph models and characterize when each method will yield a solution of sufficient quality and the parameter ranges when more sophistication is needed. We complement this by roviding an empirical analysis of these algorithms on simulated and real-world production data from a retail website. Our results confirm that it is not always necessary to implement complicated algorithms in the real-world, and demonstrate that very good practical results can be obtained by using simple heuristics that are backed by the confidence of concrete theoretical guarantees."
www,https://dl.acm.org/doi/pdf/10.1145/2736277.2741690,Is Sniping A Problem For Online Auction Markets?,"Matt Backus, Thomas Blake, Dimitriy V. Masterov, Steven Tadelis, ","A common complaint about online auctions for consumer goods is the presence of ``snipers,'' who place bids in the final seconds of sequential ascending auctions with predetermined ending times. The literature conjectures that snipers are best-responding to the existence of ``incremental"" bidders that bid up to their valuation only as they are outbid. Snipers aim to catch these incremental bidders at a price below their reserve, with no time to respond. As a consequence, these incremental bidders may experience regret when they are outbid at the last moment at a price below their reservation value. We measure the effect of this experience on a new buyer's propensity to participate in future auctions. We show the effect to be causal using a carefully selected subset of auctions from eBay.com and instrumental variables estimation strategy. Bidders respond to sniping quite strongly and are between 4 and 18 percent less likely to return to the platform."
www,https://dl.acm.org/doi/pdf/10.1145/2736277.2741100,Essential Web Pages Are Easy to Find,"Ricardo Baeza-Yates, Paolo Boldi, Flavio Chierichetti, ","In this paper we address the problem of estimating the index size needed by web search engines to answer as many queries as possible by exploiting the marked difference between query and click frequencies. We provide a possible formal definition for the notion of essential web pages as those that cover a large fraction of distinct queries --- i.e., we look at the problem as a version of MaxCover. Although in general MaxCover is approximable to within a factor of 1-1/e ~0.632 from the optimum, we provide a condition under which the greedy algorithm does find the actual best cover (or remains at a known bounded factor from it). The extra check for optimality (or for bounding the ratio from the optimum) comes at a negligible algorithmic cost. Moreover, in most practical instances of this problem, the algorithm is able to provide solutions that are provably optimal, or close to optimal. We relate this observed phenomenon to some properties of the queries' click graph. Our experimental results confirm that a small number of web pages can respond to a large fraction of the queries (e.g., 0.4% of the pages answers 20% of the queries). Our approach can be used in several related search applications, and has in fact an even more general appeal --- as a first example, our preliminary experimental study confirms that our algorithm has extremely good performances on other (social network based) MaxCover instances."
www,https://dl.acm.org/doi/pdf/10.1145/2736277.2741082,Design and Analysis of Benchmarking Experiments for Distributed Internet Services,"Eytan Bakshy, Eitan Frachtenberg, ","The successful development and deployment of large-scale Internet services depends critically on performance. Even small regressions in processing time can translate directly into significant energy and user experience costs. Despite the widespread use of distributed server infrastructure (e.g., in cloud computing and Web services), there is little research on how to benchmark such systems to obtain valid and precise inferences with minimal data collection costs. Correctly A/B testing distributed Internet services can be surprisingly difficult because interdependencies between user requests (e.g., for search results, social media streams, photos) and host servers violate assumptions required by standard statistical tests. We develop statistical models of distributed Internet service performance based on data from Perflab, a production system used at Facebook which vets thousands of changes to the company's codebase each day. We show how these models can be used to understand the tradeoffs between different benchmarking routines, and what factors must be taken into account when performing statistical tests. Using simulations and empirical data from Perflab, we validate our theoretical results, and provide easy-to-implement guidelines for designing and analyzing such benchmarks."
www,https://dl.acm.org/doi/pdf/10.1145/2736277.2741091,ACCAMS: Additive Co-Clustering to Approximate Matrices Succinctly,"Alex Beutel, Amr Ahmed, Alexander J. Smola, ","Matrix completion and approximation are popular tools to capture a user's preferences for recommendation and to approximate missing data. Instead of using low-rank factorization we take a drastically different approach, based on the simple insight that an additive model of co-clusterings allows one to approximate matrices efficiently. This allows us to build a concise model that, per bit of model learned, significantly beats all factorization approaches in matrix completion. Even more surprisingly, we find that summing over small co-clusterings is more effective in modeling matrices than classic co-clustering, which uses just one large partitioning of the matrix. Following Occam's razor principle, the fact that our model is more concise and yet just as accurate as more complex models suggests that it better captures the latent preferences and decision making processes present in the real world. We provide an iterative minimization algorithm, a collapsed Gibbs sampler, theoretical guarantees for matrix approximation, and excellent empirical evidence for the efficacy of our approach. We achieve state-of-the-art results for matrix completion on Netflix at a fraction of the model complexity."
www,https://dl.acm.org/doi/pdf/10.1145/2736277.2741077,"Who, What, When, and Where: Multi-Dimensional Collaborative Recommendations Using Tensor Factorization on Sparse User-Generated Data","Preeti Bhargava, Thomas Phan, Jiayu Zhou, Juhan Lee, ","Given the abundance of online information available to mobile users, particularly tourists and weekend travelers, recommender systems that effectively filter this information and suggest interesting participatory opportunities will become increasingly important. Previous work has explored recommending interesting locations; however, users would also benefit from recommendations for activities in which to participate at those locations along with suitable times and days. Thus, systems that provide collaborative recommendations involving multiple dimensions such as location, activities and time would enhance the overall experience of users.The relationship among these dimensions can be modeled by higher-order matrices called tensors which are then solved by tensor factorization. However, these tensors can be extremely sparse. In this paper, we present a system and an approach for performing multi-dimensional collaborative recommendations for Who (User), What (Activity), When (Time) and Where (Location), using tensor factorization on sparse user-generated data. We formulate an objective function which simultaneously factorizes coupled tensors and matrices constructed from heterogeneous data sources. We evaluate our system and approach on large-scale real world data sets consisting of 588,000 Flickr photos collected from three major metro regions in USA. We compare our approach with several state-of-the-art baselines and demonstrate that it outperforms all of them."
www,https://dl.acm.org/doi/pdf/10.1145/2736277.2741691,"Secrets, Lies, and Account Recovery: Lessons from the Use of Personal Knowledge Questions at Google","Joseph Bonneau, Elie Bursztein, Ilan Caron, Rob Jackson, Mike Williamson, ","We examine the first large real-world data set on personal knowledge question's security and memorability from their deployment at Google. Our analysis confirms that secret questions generally offer a security level that is far lower than user-chosen passwords. It turns out to be even lower than proxies such as the real distribution of surnames in the population would indicate. Surprisingly, we found that a significant cause of this insecurity is that users often don't answer truthfully. A user survey we conducted revealed that a significant fraction of users (37%) who admitted to providing fake answers did so in an attempt to make them ""harder to guess"" although on aggregate this behavior had the opposite effect as people ""harden"" their answers in the same and predictable way. On the usability side, we show that secret answers have surprisingly poor memorability despite the assumption that their reliability motivates their continued deployment. From millions of account recovery attempts we observed a significant fraction of users (e.g 40% of our English-speaking US users) were unable to recall their answers when needed. This is lower than the success rate of alternative recovery mechanisms such as SMS reset codes (over 80%). Comparing question strength and memorability reveals that the questions that are potentially the most secure (e.g what is your first phone number) are also the ones with the worst memorability. We conclude that it appears next to impossible to find secret questions that are both secure and memorable. Secret questions continue have some use when combined with other signals, but they should not be used alone and best practice should favor more reliable alternatives."
www,https://dl.acm.org/doi/pdf/10.1145/2736277.2741654,Supporting Ethical Web Research: A New Research Ethics Review,"Anne Bowser, Janice Y. Tsai, ","Research ethics is an important and timely topic. In academia, federally regulated Institutional Review Boards (IRBs) protect participants of human subjects research, and offer researchers a mechanism to assess the ethical implications of their work. Industry research labs are not subject to the same requirements, and may lack processes for research ethics review. We describe the creation of a new ethics framework and a research ethics submission system (RESS) within Microsoft Research (MSR). This RESS is customized to the needs of web researchers. We describe our iterative development process, including our assessment of the current state of web research, developing a framework of methods based on a survey of 358 research papers; build and evaluate our system with 14 users to identify the benefits and pitfalls of full deployment; evaluate how our system matches with existing federal regulations; and, suggest next steps for supporting ethical web research."
www,https://dl.acm.org/doi/pdf/10.1145/2736277.2741665,Sequential Hypothesis Tests for Adaptive Locality Sensitive Hashing,"Aniket Chakrabarti, Srinivasan Parthasarathy, ","All pairs similarity search is a problem where a set of data objects is given and the task is to find all pairs of objects that have similarity above a certain threshold for a given similarity measure-of-interest. When the number of points or dimensionality is high, standard solutions fail to scale gracefully. Approximate solutions such as Locality Sensitive Hashing (LSH) and its Bayesian variants (BayesLSH and BayesLSHLite) alleviate the problem to some extent and provide substantial speedup over traditional index based approaches. BayesLSH is used for pruning the candidate space and computation of approximate similarity, whereas BayesLSHLite can only prune the candidates, but similarity needs to be computed exactly on the original data. Thus where ever the explicit data representation is available and exact similarity computation is not too expensive, BayesLSHLite can be used to aggressively prune candidates and provide substantial speedup without losing too much on quality. However, the loss in quality is higher in the BayesLSH variant, where explicit data representation is not available, rather only a hash sketch is available and similarity has to be estimated approximately. In this work we revisit the LSH problem from a Frequentist setting and formulate sequential tests for composite hypothesis (similarity greater than or less than threshold) that can be leveraged by such LSH algorithms for adaptively pruning candidates aggressively. We propose a vanilla sequential probability ratio test (SPRT) approach based on this idea and two novel variants. We extend these variants to the case where approximate similarity needs to be computed using fixed-width sequential confidence interval generation technique. We compare these novel variants with the SPRT variant and BayesLSH/Bayes-LSHLite variants and show that they can provide tighter qualitative guarantees over BayesLSH/BayesLSHLite -- a state-of-the-art approach -- while being upto 2.1x faster than a traditional SPRT and 8.8x faster than AllPairs."
