conference,url,title,authors,abstract
www,https://dl.acm.org/doi/pdf/10.1145/2736277.2741124,Children Seen But Not Heard: When Parents Compromise Children's Online Privacy,"Tehila Minkus, Kelvin Liu, Keith W. Ross, ","Children's online privacy has garnered much attention in media, legislation, and industry. Adults are concerned that children may not adequately protect themselves online. However, relatively little discussion has focused on the privacy breaches that may occur to children at the hands of others, namely, their parents and relatives. When adults post information online, they may reveal personal information about their children to other people, online services, data brokers, or surveillant authorities. This information can be gathered in an automated fashion and then linked with other online and offline sources, creating detailed profiles which can be continually enhanced throughout the children's lives."
www,https://dl.acm.org/doi/pdf/10.1145/2736277.2741655,TrueView: Harnessing the Power of Multiple Review Sites,"Amanda J. Minnich, Nikan Chavoshi, Abdullah Mueen, Shuang Luan, ","Online reviews on products and services can be very useful for customers, but they need to be protected from manipulation. So far, most studies have focused on analyzing online reviews from a single hosting site. How could one leverage information from multiple review hosting sites? This is the key question in our work. In response, we develop a systematic methodology to merge, compare, and evaluate reviews from multiple hosting sites. We focus on hotel reviews and use more than 15 million reviews from more than 3.5 million users spanning three prominent travel sites. Our work consists of three thrusts: (a) we develop novel features capable of identifying cross-site discrepancies effectively, (b) we conduct arguably the first extensive study of cross-site variations using real data, and develop a hotel identity-matching method with 93% accuracy, (c) we introduce the TrueView score, as a proof of concept that cross-site analysis can better inform the end user. Our results show that: (1) we detect 7 times more suspicious hotels by using multiple sites compared to using the three sites in isolation, and (2) we find that 20% of all hotels appearing in all three sites seem to have low trustworthiness score. Our work is an early effort that explores the advantages and the challenges in using multiple reviewing sites towards more informed decision making."
www,https://dl.acm.org/doi/pdf/10.1145/2736277.2741688,QUOTUS: The Structure of Political Media Coverage as Revealed by Quoting Patterns,"Vlad Niculae, Caroline Suen, Justine Zhang, ","Given the extremely large pool of events and stories available, media outlets need to focus on a subset of issues and aspects to convey to their audience. Outlets are often accused of exhibiting a systematic bias in this selection process, with different outlets portraying different versions of reality. However, in the absence of objective measures and empirical evidence, the direction and extent of systematicity remains widely disputed. In this paper we propose a framework based on quoting patterns for quantifying and characterizing the degree to which media outlets exhibit systematic bias. We apply this framework to a massive dataset of news articles spanning the six years of Obama's presidency and all of his speeches, and reveal that a systematic pattern does indeed emerge from the outlet's quoting behavior. Moreover, we show that this pattern can be successfully exploited in an unsupervised prediction setting, to determine which new quotes an outlet will select to broadcast. By encoding bias patterns in a low-rank space we provide an analysis of the structure of political media coverage. This reveals a latent media bias space that aligns surprisingly well with political ideology and outlet type. A linguistic analysis exposes striking differences across these latent dimensions, showing how the different types of media outlets portray different realities even when reporting on the same events. For example, outlets mapped to the mainstream conservative side of the latent space focus on quotes that portray a presidential persona disproportionately characterized by negativity."
www,https://dl.acm.org/doi/pdf/10.1145/2736277.2741635,Energy and Performance of Smartphone Radio Bundling in Outdoor Environments,"Ana Nika, Yibo Zhu, Ning Ding, Abhilash Jindal, Y. Charlie Hu, ","Most of today's mobile devices come equipped with both cellular LTE and WiFi wireless radios, making radio bundling (simultaneous data transfers over multiple interfaces) both appealing and practical. Despite recent studies documenting the benefits of radio bundling with MPTCP, many fundamental questions remain about potential gains from radio bundling, or the relationship between performance and energy consumption in these scenarios. In this study, we seek to answer these questions using extensive measurements to empirically characterize both energy and performance for radio bundling approaches. In doing so, we quantify potential gains of bundling using MPTCP versus an ideal protocol. We study the links between traffic partitioning and bundling performance, and use a novel componentized energy model to quantify the energy consumed by CPUs (and radios) during traffic management. Our results show that MPTCP achieves only a fraction of the total performance gain possible, and that its energy-agnostic design leads to considerable power consumption by the CPU. We conclude that not only there is room for improved bundling performance, but an energy-aware bundling protocol is likely to achieve a much better tradeoff between performance and power consumption."
www,https://dl.acm.org/doi/pdf/10.1145/2736277.2741090,PriVaricator: Deceiving Fingerprinters with Little White Lies,"Nick Nikiforakis, Wouter Joosen, Benjamin Livshits, ","Researchers have shown that, in recent years, unwanted web tracking is on the rise, with browser-based fingerprinting being adopted by more and more websites as a viable alternative to third-party cookies. In this paper we propose PriVaricator, a solution to the problem of browser-based fingerprinting. A key insight is that when it comes to web tracking, the real problem with fingerprinting is not uniqueness of a fingerprint, it is linkability, i.e., the ability to connect the same fingerprint across multiple visits. Thus, making fingerprints non-deterministic also makes them hard to link across browsing sessions. In PriVaricator we use the power of randomization to ""break"" linkability by exploring a space of parameterized randomization policies. We evaluate our techniques in terms of being able to prevent fingerprinting and not breaking existing (benign) sites. The best of our randomization policies renders all the fingerprinters we tested ineffective, while causing minimal damage on a set of 1000 Alexa sites on which we tested, with no noticeable performance overhead."
www,https://dl.acm.org/doi/pdf/10.1145/2736277.2741662,"Diagnoses, Decisions, and Outcomes: Web Search as Decision Support for Cancer","Michael J. Paul, Ryen W. White, Eric Horvitz, ","People diagnosed with a serious illness often turn to the Web for their rising information needs, especially when decisions are required. We analyze the search and browsing behavior of searchers who show a surge of interest in prostate cancer. Prostate cancer is the most common serious cancer in men and is a leading cause of cancer-related death. Diagnoses of prostate cancer typically involve reflection and decision making about treatment based on assessments of preferences and outcomes. We annotated timelines of treatment-related queries from nearly 300 searchers with tags indicating different phases of treatment, including decision making, preparation, and recovery. Using this corpus, we present a variety of analyses toward the goal of understanding search and decision making about treatments. We characterize search queries and the content of accessed pages for different treatment phases, model search behavior during the decision-making phase, and create an aggregate alignment of treatment timelines illustrated with a variety of visualizations. The experiments provide insights about how people who are engaged in intensive searches about prostate cancer over an extended period of time pursue and access information from the Web."
www,https://dl.acm.org/doi/pdf/10.1145/2736277.2741641,PocketTrend: Timely Identification and Delivery of Trending Search Content to Mobile Users,"Gennady Pekhimenko, Dimitrios Lymberopoulos, Oriana Riva, ","Trending search topics cause unpredictable query load spikes that hurt the end-user search experience, particularly the mobile one, by introducing longer delays. To understand how trending search topics are formed and evolve over time, we analyze 21 million queries submitted during periods where popular events caused search query volume spikes. Based on our findings, we design and evaluate PocketTrend, a system that automatically detects trending topics in real time, identifies the search content associated to the topics, and then intelligently pushes this content to users in a timely manner. In that way, PocketTrend enables a client-side search engine that can instantly answer user queries related to trending events, while at the same time reducing the impact of these trends on the datacenter workload. Our results, using real mobile search logs, show that in the presence of a trending event, up to 13-17% of the overall search traffic can be eliminated from the datacenter, with as many as 19% of all users benefiting from PocketTrend."
www,https://dl.acm.org/doi/pdf/10.1145/2736277.2741668,Overcoming Relational Learning Biases to Accurately Predict Preferences in Large Scale Networks,"Joseph J. Pfeiffer, Jennifer Neville, Paul N. Bennett, ","Many individuals on social networking sites provide traits about themselves, such as interests or demographics. Social networking sites can use this information to provide better content to match their users' interests, such as recommending scheduled events or various relevant products. These tasks require accurate probability estimates to determine the correct answer to return. Relational machine learning (RML) is an excellent framework for these problems as it jointly models the user labels given their attributes and the relational structure. Further, semi-supervised learning methods could enable RML methods to exploit the large amount of unlabeled data in networks."
www,https://dl.acm.org/doi/pdf/10.1145/2736277.2741121,Deriving an Emergent Relational Schema from RDF Data,"Minh-Duc Pham, Linnea Passing, Orri Erling, Peter Boncz, ","We motivate and describe techniques that allow to detect an ""emergent"" relational schema from RDF data. We show that on a wide variety of datasets, the found structure explains well over 90% of the RDF triples. Further, we also describe technical solutions to the semantic challenge to give short names that humans find logical to these emergent tables, columns and relationships between tables. Our techniques can be exploited in many ways, e.g., to improve the efficiency of SPARQL systems, or to use existing SQL-based applications on top of any RDF dataset using a RDBMS."
www,https://dl.acm.org/doi/pdf/10.1145/2736277.2741631,The Digital Life of Walkable Streets,"Daniele Quercia, Luca Maria Aiello, Rossano Schifanella, Adam Davies, ","Walkability has many health, environmental, and economic benefits. That is why web and mobile services have been offering ways of computing walkability scores of individual street segments. Those scores are generally computed from survey data and manual counting (of even trees). However, that is costly, owing to the high time, effort, and financial costs. To partly automate the computation of those scores, we explore the possibility of using the social media data of Flickr and Foursquare to automatically identify safe and walkable streets. We find that unsafe streets tend to be photographed during the day, while walkable streets are tagged with walkability-related keywords. These results open up practical opportunities (for, e.g., room booking services, urban route recommenders, and real-estate sites) and have theoretical implications for researchers who might resort to the use social media data to tackle previously unanswered questions in the area of walkability."
www,https://dl.acm.org/doi/pdf/10.1145/2736277.2741677,Beyond Models: Forecasting Complex Network Processes Directly from Data,"Bruno Ribeiro, Minh X. Hoang, Ambuj K. Singh, ","Complex network phenomena -- such as information cascades in online social networks -- are hard to fully observe, model, and forecast. In forecasting, a recent trend has been to forgo the use of parsimonious models in favor of models with increasingly large degrees of freedom that are trained to learn the behavior of a process from historical data. Extrapolating this trend into the future, eventually we would renounce models all together. But is it possible to forecast the evolution of a complex stochastic process directly from the data without a model? In this work we show that model-free forecasting is possible. We present SED, an algorithm that forecasts process statistics based on relationships of statistical equivalence using two general axioms and historical data. To the best of our knowledge, SED is the first method that can perform axiomatic, model-free forecasts of complex stochastic processes. Our simulations using simple and complex evolving processes and tests performed on a large real-world dataset show promising results."
www,https://dl.acm.org/doi/pdf/10.1145/2736277.2741083,Weakly Supervised Extraction of Computer Security Events from Twitter,"Alan Ritter, Evan Wright, William Casey, Tom Mitchell, ","Twitter contains a wealth of timely information, however staying on top of breaking events requires that an information analyst constantly scan many sources, leading to information overload. For example, a user might wish to be made aware whenever an infectious disease outbreak takes place, when a new smartphone is announced or when a distributed Denial of Service (DoS) attack might affect an organization's network connectivity. There are many possible event categories an analyst may wish to track, making it impossible to anticipate all those of interest in advance. We therefore propose a weakly supervised approach, in which extractors for new categories of events are easy to define and train, by specifying a small number of seed examples. We cast seed-based event extraction as a learning problem where only positive and unlabeled data is available. Rather than assuming unlabeled instances are negative, as is common in previous work, we propose a learning objective which regularizes the label distribution towards a user-provided expectation. Our approach greatly outperforms heuristic negatives, used in most previous work, in experiments on real-world data. Significant performance gains are also demonstrated over two novel and competitive baselines: semi-supervised EM and one-class support-vector machines. We investigate three security-related events breaking on Twitter: DoS attacks, data breaches and account hijacking. A demonstration of security events extracted by our system is available at: http://kb1.cse.ohio-state.edu:8123/events/hacked"
www,https://dl.acm.org/doi/pdf/10.1145/2736277.2741097,Groupsourcing: Team Competition Designs for Crowdsourcing,"Markus Rokicki, Sergej Zerr, Stefan Siersdorfer, ","Many data processing tasks such as semantic annotation of images, translation of texts in foreign languages, and labeling of training data for machine learning models require human input, and, on a large scale, can only be accurately solved using crowd based online work. Recent work shows that frameworks where crowd workers compete against each other can drastically reduce crowdsourcing costs, and outperform conventional reward schemes where the payment of online workers is proportional to the number of accomplished tasks (""pay-per-task""). In this paper, we investigate how team mechanisms can be leveraged to further improve the cost efficiency of crowdsourcing competitions. To this end, we introduce strategies for team based crowdsourcing, ranging from team formation processes where workers are randomly assigned to competing teams, over strategies involving self-organization where workers actively participate in team building, to combinations of team and individual competitions. Our large-scale experimental evaluation with more than 1,100 participants and overall 5,400 hours of work spent by crowd workers demonstrates that our team based crowdsourcing mechanisms are well accepted by online workers and lead to substantial performance boosts."
www,https://dl.acm.org/doi/pdf/10.1145/2736277.2741683,Authentication Melee: A Usability Analysis of Seven Web Authentication Systems,"Scott Ruoti, Brent Roberts, Kent Seamons, ","Passwords continue to dominate the authentication landscape in spite of numerous proposals to replace them. Even though usability is a key factor in replacing passwords, very few alternatives have been subjected to formal usability studies, and even fewer have been analyzed using a standard metric. We report the results of four within-subjects usability studies for seven web authentication systems. These systems span federated, smartphone, paper tokens, and email-based approaches. Our results indicate that participants prefer single sign-on systems. We report several insightful findings based on participants' qualitative responses: (1) transparency increases usability but also leads to confusion and a lack of trust, (2) participants prefer single sign-on but wish to augment it with site-specific low-entropy passwords, and (3) participants are intrigued by biometrics and phone-based authentication. We utilize the Systems Usability Scale (SUS) as a standard metric for empirical analysis and find that it produces reliable, replicable results. SUS proves to be an accurate measure of baseline usability. We recommend that new authentication systems be formally evaluated for usability using SUS, and should meet a minimum acceptable SUS score before receiving serious consideration."
www,https://dl.acm.org/doi/pdf/10.1145/2736277.2741640,Finding the Hierarchy of Dense Subgraphs using Nucleus Decompositions,"Ahmet Erdem Sariyuce, C. Seshadhri, Ali Pinar, Umit V. Catalyurek, ","Finding dense substructures in a graph is a fundamental graph mining operation, with applications in bioinformatics, social networks, and visualization to name a few. Yet most standard formulations of this problem (like clique, quasiclique, k-densest subgraph) are NP-hard. Furthermore, the goal is rarely to find the ""true optimum"", but to identify many (if not all) dense substructures, understand their distribution in the graph, and ideally determine relationships among them. Current dense subgraph finding algorithms usually optimize some objective, and only find a few such subgraphs without providing any structural relations. We define the nucleus decomposition of a graph, which represents the graph as a forest of nuclei. Each nucleus is a subgraph where smaller cliques are present in many larger cliques. The forest of nuclei is a hierarchy by containment, where the edge density increases as we proceed towards leaf nuclei. Sibling nuclei can have limited intersections, which enables discovering overlapping dense subgraphs. With the right parameters, the nucleus decomposition generalizes the classic notions of k-cores and k-truss decompositions. We give provably efficient algorithms for nucleus decompositions, and empirically evaluate their behavior in a variety of real graphs. The tree of nuclei consistently gives a global, hierarchical snapshot of dense substructures, and outputs dense subgraphs of higher quality than other state-of-the-art solutions. Our algorithm can process graphs with tens of millions of edges in less than an hour."
www,https://dl.acm.org/doi/pdf/10.1145/2736277.2741686,Bringing CUPID Indoor Positioning System to Practice,"Souvik Sen, Dongho Kim, Stephane Laroche, Kyu-Han Kim, ","WiFi based indoor positioning has recently gained more attention due to the advent of the IEEE 802.11v standard, requirements by the FCC for E911 calls, and increased interest in location-based services. While there exist several indoor localization techniques, we find that these techniques tradeoff either accuracy, scalability, pervasiveness or cost -- all of which are important requirements for a truly deployable positioning solution. Wireless signal-strength based approaches suffer from location errors, whereas time-of-flight (ToF) based solutions provide good accuracy but are not scalable. Recent solutions address these issues by augmenting WiFi with either smartphone sensing or mobile crowdsourcing. However, they require tight coupling between WiFi infrastructure and a client device, or they can determine the client's location only if it is mobile. In this paper, we present CUPID2.0 which improved our previously proposed CUPID indoor positioning system to overcome these limitations. We achieve this by addressing the fundamental limitations in Time-of-Flight based localization and combining ToF with signal strength to address scalability. Experiments from $6$ cities using $40$ different mobile devices, comprising of more than $2.5$ million location fixes demonstrate feasibility. CUPID2.0 is currently under production, and we expect CUPID2.0 to ignite the wide adoption of WLAN-based positioning systems and their services."
www,https://dl.acm.org/doi/pdf/10.1145/2736277.2741084,Early Detection of Spam Mobile Apps,"Suranga Seneviratne, Aruna Seneviratne, Mohamed Ali Kaafar, ","Increased popularity of smartphones has attracted a large number of developers to various smartphone platforms. As a result, app markets are also populated with spam apps, which reduce the users' quality of experience and increase the workload of app market operators. Apps can be ""spammy"" in multiple ways including not having a specific functionality, unrelated app description or unrelated keywords and publishing similar apps several times and across diverse categories. Market operators maintain anti-spam policies and apps are removed through continuous human intervention. Through a systematic crawl of a popular app market and by identifying a set of removed apps, we propose a method to detect spam apps solely using app metadata available at the time of publication. We first propose a methodology to manually label a sample of removed apps, according to a set of checkpoint heuristics that reveal the reasons behind removal. This analysis suggests that approximately 35% of the apps being removed are very likely to be spam apps. We then map the identified heuristics to several quantifiable features and show how distinguishing these features are for spam apps. Finally, we build an Adaptive Boost classifier for early identification of spam apps using only the metadata of the apps. Our classifier achieves an accuracy over 95% with precision varying between 85%-95% and recall varying between 38%-98%. By applying the classifier on a set of apps present at the app market during our crawl, we estimate that at least 2.7% of them are spam apps."
www,https://dl.acm.org/doi/pdf/10.1145/2736277.2741628,N-gram IDF: A Global Term Weighting Scheme Based on Information Distance,"Masumi Shirakawa, Takahiro Hara, Shojiro Nishio, ","This paper first reveals the relationship between Inverse Document Frequency (IDF), a global term weighting scheme, and information distance, a universal metric defined by Kolmogorov complexity. We concretely give a theoretical explanation that the IDF of a term is equal to the distance between the term and the empty string in the space of information distance in which the Kolmogorov complexity is approximated using Web documents and the Shannon-Fano coding. Based on our findings, we propose N-gram IDF, a theoretical extension of IDF for handling words and phrases of any length. By comparing weights among N-grams of any N, N-gram IDF enables us to determine dominant N-grams among overlapping ones and extract key terms of any length from texts without using any NLP techniques. To efficiently compute the weight for all possible N-grams, we adopt two string processing techniques, i.e., maximal substring extraction using enhanced suffix array and document listing using wavelet tree. We conducted experiments on key term extraction and Web search query segmentation, and found that N-gram IDF was competitive with state-of-the-art methods that were designed for each application using additional resources and efforts. The results exemplified the potential of N-gram IDF."
www,https://dl.acm.org/doi/pdf/10.1145/2736277.2741646,Query Suggestion and Data Fusion in Contextual Disambiguation,"Milad Shokouhi, Marc Sloan, Paul N. Bennett, Kevyn Collins-Thompson, ","Queries issued to a search engine are often under-specified or ambiguous. The user's search context or background may provide information that disambiguates their information need in order to automatically predict and issue a more effective query. The disambiguation can take place at different stages of the retrieval process. For instance, contextual query suggestions may be computed and recommended to users on the result page when appropriate, an approach that does not require modifying the original query's results. Alternatively, the search engine can attempt to provide efficient access to new relevant documents by injecting these documents directly into search results based on the user's context."
