conference,url,title,authors,abstract
www,https://dl.acm.org/doi/pdf/10.1145/2736277.2741285,Asymmetric Minwise Hashing for Indexing Binary Inner Products and Set Containment,"Anshumali Shrivastava, Ping Li, ","Minwise hashing (Minhash) is a widely popular indexing scheme in practice. Minhash is designed for estimating set resemblance and is known to be suboptimal in many applications where the desired measure is set overlap (i.e., inner product between binary vectors) or set containment. Minhash has inherent bias towards smaller sets, which adversely affects its performance in applications where such a penalization is not desirable. In this paper, we propose asymmetric minwise hashing ({\em MH-ALSH}), to provide a solution to this well-known problem. The new scheme utilizes asymmetric transformations to cancel the bias of traditional minhash towards smaller sets, making the final ``collision probability'' monotonic in the inner product. Our theoretical comparisons show that, for the task of retrieving with binary inner products, asymmetric minhash is provably better than traditional minhash and other recently proposed hashing algorithms for general inner products. Thus, we obtain an algorithmic improvement over existing approaches in the literature. Experimental evaluations on four publicly available high-dimensional datasets validate our claims. The proposed scheme outperforms, often significantly, other hashing algorithms on the task of near neighbor retrieval with set containment. Our proposal is simple and easy to implement in practice."
www,https://dl.acm.org/doi/pdf/10.1145/2736277.2741689,Language Understanding in the Wild: Combining Crowdsourcing and Machine Learning,"Edwin D. Simpson, Matteo Venanzi, Steven Reece, Pushmeet Kohli, ","Social media has led to the democratisation of opinion sharing. A wealth of information about public opinions, current events, and authors' insights into specific topics can be gained by understanding the text written by users. However, there is a wide variation in the language used by different authors in different contexts on the web. This diversity in language makes interpretation an extremely challenging task. Crowdsourcing presents an opportunity to interpret the sentiment, or topic, of free-text. However, the subjectivity and bias of human interpreters raise challenges in inferring the semantics expressed by the text. To overcome this problem, we present a novel Bayesian approach to language understanding that relies on aggregated crowdsourced judgements. Our model encodes the relationships between labels and text features in documents, such as tweets, web articles, and blog posts, accounting for the varying reliability of human labellers. It allows inference of annotations that scales to arbitrarily large pools of documents. Our evaluation using two challenging crowdsourcing datasets shows that by efficiently exploiting language models learnt from aggregated crowdsourced labels, we can provide up to 25% improved classifications when only a small portion, less than 4% of documents has been labelled. Compared to the six state-of-the-art methods, we reduce by up to 67% the number of crowd responses required to achieve comparable accuracy. Our method was a joint winner of the CrowdFlower - CrowdScale 2013 Shared Task challenge at the conference on Human Computation and Crowdsourcing (HCOMP 2013)."
www,https://dl.acm.org/doi/pdf/10.1145/2736277.2741080,HypTrails: A Bayesian Approach for Comparing Hypotheses About Human Trails on the Web,"Philipp Singer, Denis Helic, Andreas Hotho, Markus Strohmaier, ","When users interact with the Web today, they leave sequential digital trails on a massive scale. Examples of such human trails include Web navigation, sequences of online restaurant reviews, or online music play lists. Understanding the factors that drive the production of these trails can be useful for e.g., improving underlying network structures, predicting user clicks or enhancing recommendations. In this work, we present a general approach called HypTrails for comparing a set of hypotheses about human trails on the Web, where hypotheses represent beliefs about transitions between states. Our approach utilizes Markov chain models with Bayesian inference. The main idea is to incorporate hypotheses as informative Dirichlet priors and to leverage the sensitivity of Bayes factors on the prior for comparing hypotheses with each other. For eliciting Dirichlet priors from hypotheses, we present an adaption of the so-called (trial) roulette method. We demonstrate the general mechanics and applicability of HypTrails by performing experiments with (i) synthetic trails for which we control the mechanisms that have produced them and (ii) empirical trails stemming from different domains including website navigation, business reviews and online music played. Our work expands the repertoire of methods available for studying human trails on the Web."
www,https://dl.acm.org/doi/pdf/10.1145/2736277.2741107,Exploiting Collective Hidden Structures in Webpage Titles for Open Domain Entity Extraction,"Wei Song, Shiqi Zhao, Chao Zhang, Hua Wu, Haifeng Wang, Lizhen Liu, ","We present a novel method for open domain named entity extraction by exploiting the collective hidden structures in webpage titles. Our method uncovers the hidden textual structures shared by sets of webpage titles based on generalized URL patterns and a multiple sequence alignment technique. The highlights of our method include: 1) The boundaries of entities can be identified automatically in a collective way without any manually designed pattern, seed or class name. 2) The connections between entities are also discovered naturally based on the hidden structures, which makes it easy to incorporate distant or weak supervision. The experiments show that our method can harvest large scale of open domain entities with high precision. A large ratio of the extracted entities are long-tailed and complex and cover diverse topics. Given the extracted entities and their connections, we further show the effectiveness of our method in a weakly supervised setting. Our method can produce better domain specific entities in both precision and recall compared with the state-of-the-art approaches."
www,https://dl.acm.org/doi/pdf/10.1145/2736277.2741642,ROCKER: A Refinement Operator for Key Discovery,"Tommaso Soru, Edgard Marx, Axel-Cyrille Ngonga Ngomo, ","The Linked Data principles provide a decentral approach for publishing structured data in the RDF format on the Web. In contrast to structured data published in relational databases where a key is often provided explicitly, finding a set of properties that allows identifying a resource uniquely is a non-trivial task. Still, finding keys is of central importance for manifold applications such as resource deduplication, link discovery, logical data compression and data integration. In this paper, we address this research gap by specifying a refinement operator, dubbed ROCKER, which we prove to be finite, proper and non-redundant. We combine the theoretical characteristics of this operator with two monotonicities of keys to obtain a time-efficient approach for detecting keys, i.e., sets of properties that describe resources uniquely. We then utilize a hash index to compute the discriminability score efficiently. Therewith, we ensure that our approach can scale to very large knowledge bases. Results show that ROCKER yields more accurate results, has a comparable runtime, and consumes less memory w.r.t. existing state-of-the-art techniques."
www,https://dl.acm.org/doi/pdf/10.1145/2736277.2741687,Random Walk TripleRush: Asynchronous Graph Querying and Sampling,"Philip Stutz, Bibek Paudel, Mihaela Verman, Abraham Bernstein, ","Most Semantic Web applications rely on querying graphs, typically by using SPARQL with a triple store. Increasingly, applications also analyze properties of the graph structure to compute statistical inferences. The current Semantic Web infrastructure, however, does not efficiently support such operations. This forces developers to extract the relevant data for external statistical post-processing. In this paper we propose to rethink query execution in a triple store as a highly parallelized asynchronous graph exploration on an active index data structure. This approach also allows to integrate SPARQL-querying with the sampling of graph properties."
www,https://dl.acm.org/doi/pdf/10.1145/2736277.2741651,Open Domain Question Answering via Semantic Enrichment,"Huan Sun, Hao Ma, Wen-tau Yih, Chen-Tse Tsai, Jingjing Liu, Ming-Wei Chang, ","Most recent question answering (QA) systems query large-scale knowledge bases (KBs) to answer a question, after parsing and transforming natural language questions to KBs-executable forms (e.g., logical forms). As a well-known fact, KBs are far from complete, so that information required to answer questions may not always exist in KBs. In this paper, we develop a new QA system that mines answers directly from the Web, and meanwhile employs KBs as a significant auxiliary to further boost the QA performance. Specifically, to the best of our knowledge, we make the first attempt to link answer candidates to entities in Freebase, during answer candidate generation. Several remarkable advantages follow: (1) Redundancy among answer candidates is automatically reduced. (2) The types of an answer candidate can be effortlessly determined by those of its corresponding entity in Freebase. (3) Capitalizing on the rich information about entities in Freebase, we can develop semantic features for each answer candidate after linking them to Freebase. Particularly, we construct answer-type related features with two novel probabilistic models, which directly evaluate the appropriateness of an answer candidate's types under a given question. Overall, such semantic features turn out to play significant roles in determining the true answers from the large answer candidate pool. The experimental results show that across two testing datasets, our QA system achieves an 18%~54% improvement under F_1 metric, compared with various existing QA systems."
www,https://dl.acm.org/doi/pdf/10.1145/2736277.2741661,All Who Wander: On the Prevalence and Characteristics of Multi-community Engagement,"Chenhao Tan, Lillian Lee, ","Although analyzing user behavior within individual communities is an active and rich research domain, people usually interact with multiple communities both on- and off-line. How do users act in such multi-community environments? Although there are a host of intriguing aspects to this question, it has received much less attention in the research community in comparison to the intra-community case. In this paper, we examine three aspects of multi-community engagement: the sequence of communities that users post to, the language that users employ in those communities, and the feedback that users receive, using longitudinal posting behavior on Reddit as our main data source, and DBLP for auxiliary experiments. We also demonstrate the effectiveness of features drawn from these aspects in predicting users' future level of activity. One might expect that a user's trajectory mimics the ""settling-down"" process in real life: an initial exploration of sub-communities before settling down into a few niches. However, we find that the users in our data continually post in new communities; moreover, as time goes on, they post increasingly evenly among a more diverse set of smaller communities. Interestingly, it seems that users that eventually leave the community are ""destined"" to do so from the very beginning, in the sense of showing significantly different ""wandering"" patterns very early on in their trajectories; this finding has potentially important design implications for community maintainers. Our multi-community perspective also allows us to investigate the ""situation vs. personality"" debate from language usage across different communities."
www,https://dl.acm.org/doi/pdf/10.1145/2736277.2741093,LINE: Large-scale Information Network Embedding,"Jian Tang, Meng Qu, Mingzhe Wang, Ming Zhang, Jun Yan, ","This paper studies the problem of embedding very large information networks into low-dimensional vector spaces, which is useful in many tasks such as visualization, node classification, and link prediction. Most existing graph embedding methods do not scale for real world information networks which usually contain millions of nodes. In this paper, we propose a novel network embedding method called the ``LINE,'' which is suitable for arbitrary types of information networks: undirected, directed, and/or weighted. The method optimizes a carefully designed objective function that preserves both the local and global network structures. An edge-sampling algorithm is proposed that addresses the limitation of the classical stochastic gradient descent and improves both the effectiveness and the efficiency of the inference. Empirical experiments prove the effectiveness of the LINE on a variety of real-world information networks, including language networks, social networks, and citation networks. The algorithm is very efficient, which is able to learn the embedding of a network with millions of vertices and billions of edges in a few hours on a typical single machine. The source code of the LINE is available online\footnote{\url{https://github.com/tangjianpku/LINE}}."
www,https://dl.acm.org/doi/pdf/10.1145/2736277.2741670,Leveraging Pattern Semantics for Extracting Entities in Enterprises,"Fangbo Tao, Bo Zhao, Ariel Fuxman, Yang Li, Jiawei Han, ","Entity Extraction is a process of identifying meaningful entities from text documents. In enterprises, extracting entities improves enterprise efficiency by facilitating numerous applications, including search, recommendation, etc. However, the problem is particularly challenging on enterprise domains due to several reasons. First, the lack of redundancy of enterprise entities makes previous web-based systems like NELL and OpenIE not effective, since using only high-precision/low-recall patterns like those systems would miss the majority of sparse enterprise entities, while using more low-precision patterns in sparse setting also introduces noise drastically. Second, semantic drift is common in enterprises (""Blue"" refers to ""Windows Blue""), such that public signals from the web cannot be directly applied on entities. Moreover, many internal entities never appear on the web. Sparse internal signals are the only source for discovering them. To address these challenges, we propose an end-to-end framework for extracting entities in enterprises, taking the input of enterprise corpus and limited seeds to generate a high-quality entity collection as output. We introduce the novel concept of Semantic Pattern Graph to leverage public signals to understand the underlying semantics of lexical patterns, reinforce pattern evaluation using mined semantics, and yield more accurate and complete entities. Experiments on Microsoft enterprise data show the effectiveness of our approach."
www,https://dl.acm.org/doi/pdf/10.1145/2736277.2741119,Density-friendly Graph Decomposition,"Nikolaj Tatti, Aristides Gionis, ","Decomposing a graph into a hierarchical structure via k-core analysis is a standard operation in any modern graph-mining toolkit. k-core decomposition is a simple and efficient method that allows to analyze a graph beyond its mere degree distribution. More specifically, it is used to identify areas in the graph of increasing centrality and connectedness, and it allows to reveal the structural organization of the graph."
www,https://dl.acm.org/doi/pdf/10.1145/2736277.2741136,Crowd Fraud Detection in Internet Advertising,"Tian Tian, Jun Zhu, Fen Xia, Xin Zhuang, Tong Zhang, ","The rise of crowdsourcing brings new types of malpractices in Internet advertising. One can easily hire web workers through malicious crowdsourcing platforms to attack other advertisers. Such human generated crowd frauds are hard to detect by conventional fraud detection methods. In this paper, we carefully examine the characteristics of the group behaviors of crowd fraud and identify three persistent patterns, which are moderateness, synchronicity and dispersivity. Then we propose an effective crowd fraud detection method for search engine advertising based on these patterns, which consists of a constructing stage, a clustering stage and a filtering stage. At the constructing stage, we remove irrelevant data and reorganize the click logs into a surfer-advertiser inverted list; At the clustering stage, we define the sync-similarity between surfers' click histories and transform the coalition detection to a clustering problem, solved by a nonparametric algorithm; and finally we build a dispersity filter to remove false alarm clusters. The nonparametric nature of our method ensures that we can find an unbounded number of coalitions with nearly no human interaction. We also provide a parallel solution to make the method scalable to Web data and conduct extensive experiments. The empirical results demonstrate that our method is accurate and scalable."
www,https://dl.acm.org/doi/pdf/10.1145/2736277.2741128,Provably Fast Inference of Latent Features from Networks: with Applications to Learning Social Circles and Multilabel Classification,"Charalampos Tsourakakis, ","A well known phenomenon in social networks is homophily, the tendency of agents to connect with similar agents. A derivative of this phenomenon is the emergence of communities. Another phenomenon observed in numerous networks is the existence of certain agents that belong simultaneously to multiple communities. An understanding of these phenomena constitutes a central research topic of network science."
www,https://dl.acm.org/doi/pdf/10.1145/2736277.2741098,The K-clique Densest Subgraph Problem,"Charalampos Tsourakakis, ","Numerous graph mining applications rely on detecting subgraphs which are large near-cliques. Since formulations that are geared towards finding large near-cliques are hard and frequently inapproximable due to connections with the Maximum Clique problem, the poly-time solvable densest subgraph problem which maximizes the average degree over all possible subgraphs ""lies at the core of large scale data mining"" [10]. However, frequently the densest subgraph problem fails in detecting large near-cliques in networks."
www,https://dl.acm.org/doi/pdf/10.1145/2736277.2741626,GERBIL: General Entity Annotator Benchmarking Framework,"Ricardo Usbeck, Michael Röder, Axel-Cyrille Ngonga Ngomo, Ciro Baron, ","We present GERBIL, an evaluation framework for semantic entity annotation. The rationale behind our framework is to provide developers, end users and researchers with easy-to-use interfaces that allow for the agile, fine-grained and uniform evaluation of annotation tools on multiple datasets. By these means, we aim to ensure that both tool developers and end users can derive meaningful insights pertaining to the extension, integration and use of annotation applications. In particular, GERBIL provides comparable results to tool developers so as to allow them to easily discover the strengths and weaknesses of their implementations with respect to the state of the art. With the permanent experiment URIs provided by our framework, we ensure the reproducibility and archiving of evaluation results. Moreover, the framework generates data in machine-processable format, allowing for the efficient querying and post-processing of evaluation results. Finally, the tool diagnostics provided by GERBIL allows deriving insights pertaining to the areas in which tools should be further refined, thus allowing developers to create an informed agenda for extensions and end users to detect the right tools for their purposes. GERBIL aims to become a focal point for the state of the art, driving the research agenda of the community by presenting comparable objective evaluation results."
www,https://dl.acm.org/doi/pdf/10.1145/2736277.2741105,An Optimization Framework for Weighting Implicit Relevance Labels for Personalized Web Search,"Yury Ustinovskiy, Gleb Gusev, Pavel Serdyukov, ","Implicit feedback from users of a web search engine is an essential source providing consistent personal relevance labels from the actual population of users. However, previous studies on personalized search employ this source in a rather straightforward manner. Basically, documents that were clicked on get maximal gain, and the rest of the documents are assigned the zero gain. As we demonstrate in our paper, a ranking algorithm trained using these gains directly as the ground truth relevance labels leads to a suboptimal personalized ranking."
www,https://dl.acm.org/doi/pdf/10.1145/2736277.2741645,A First Look at Tribal Web Traffic,"Morgan Vigil, Matthew Rantanen, Elizabeth Belding, ","With broadband penetration rates of less than 10% per capita, Tribal areas in the U.S. represent some of the most underserved communities in terms of Internet access. Although numerous sources have identified this digital divide, there have been no empirical measurements of the performance and usage of services that do exist in these areas. In this paper, we present the characterization of the Tribal Digital Village (TDV) network, a multi-hop wireless network currently connecting 13 reservations in San Diego county. This work represents the first traffic analysis of broadband usage in Tribal lands. After identifying some of the unique purposes of broadband connectivity in indigenous communities, such as language revitalization and cultural development, we focus on the performance of popular applications that enable such activities, including Youtube and Instagram. Though only a fraction of the bandwidth capacity is actually used, 30% of Youtube uploads and 24% of Instagram uploads fail due to packet loss on the relay and access links that connect the reservations to the TDV backbone. Although failure rates are prohibitive to the contribution of locally generated media (particularly videos), our analysis of Instagram media interactions and engagement in the TDV network reveals a high locality of interest. Residents engage with locally created media 8.2 times more than media created by outside sources. Furthermore, locally created media circulates through the network two days longer than non-local media. The results of our analysis point to new directions for increasing content availability on reservations."
www,https://dl.acm.org/doi/pdf/10.1145/2736277.2741088,A Weighted Correlation Index for Rankings with Ties,"Sebastiano Vigna, ","Understanding the correlation between two different scores for the same set of items is a common problem in graph analysis and information retrieval. The most commonly used statistics that quantifies this correlation is Kendall's tau; however, the standard definition fails to capture that discordances between items with high rank are more important than those between items with low rank. Recently, a new measure of correlation based on average precision has been proposed to solve this problem, but like many alternative proposals in the literature it assumes that there are no ties in the scores. This is a major deficiency in a number of contexts, and in particular when comparing centrality scores on large graphs, as the obvious baseline, indegree, has a very large number of ties in social networks and web graphs. We propose to extend Kendall's definition in a natural way to take into account weights in the presence of ties. We prove a number of interesting mathematical properties of our generalization and describe an O(n\log n) algorithm for its computation. We also validate the usefulness of our weighted measure of correlation using experimental data on social networks and web graphs."
www,https://dl.acm.org/doi/pdf/10.1145/2736277.2741104,Gathering Additional Feedback on Search Results by Multi-Armed Bandits with Respect to Production Ranking,"Aleksandr Vorobev, Damien Lefortier, Gleb Gusev, Pavel Serdyukov, ","Given a repeatedly issued query and a document with a not-yet-confirmed potential to satisfy the users' needs, a search system should place this document on a high position in order to gather user feedback and obtain a more confident estimate of the document utility. On the other hand, the main objective of the search system is to maximize expected user satisfaction over a rather long period, what requires showing more relevant documents on average. The state-of-the-art approaches to solving this exploration-exploitation dilemma rely on strongly simplified settings making these approaches infeasible in practice. We improve the most flexible and pragmatic of them to handle some actual practical issues. The first one is utilizing prior information about queries and documents, the second is combining bandit-based learning approaches with a default production ranking algorithm. We show experimentally that our framework enables to significantly improve the ranking of a leading commercial search engine."
