conference,url,title,authors,abstract
www,https://dl.acm.org/doi/pdf/10.1145/2736277.2741138,MobInsight: On Improving The Performance of Mobile Apps in Cellular Networks,"Vijay Gabale, Dilip Krishnaswamy, ","It is well-known that the performance of Web-browsing as well as mobile applications (or apps) suffers on today's cellular networks. In this work, we perform a systematic measurement study of more than 50 popular apps and 2 cellular networks, and discover that while cellular networks have predictable latency, it is the path between exit points of cellular networks (e.g., GGSN) and cloud-servers that degrades apps performance. High latency and unpredictability over this path affects browsing and activity completion times of apps, worsening the performance by several magnitudes. Furthermore, we find that as the number of apps on mobile devices increases, cellular networks in turn suffer due to large number of active connections, primarily used for push notifications, experiencing heavy signaling overhead in the network. Towards accelerating the performance of apps and improving their operational efficiency, we envision an easy to deploy operator-managed platform, and study two architectural optimizations that sit at vantage points inside cellular networks: virtual app-server (vApp) and network-assisted, virtual push-notification server (vPNS). vApps improve apps' browsing experience while vPNSs take the burden of carrying periodic message off cellular networks. Using trace-driven simulations, we find that vApps can improve activity completion times by more than 3-fold, whereas vPNS can reduce the signaling load by a factor of 6 in cellular networks and reduce energy consumption by a factor of 2 on mobile devices."
www,https://dl.acm.org/doi/pdf/10.1145/2736277.2741663,Rethinking Security of Web-Based System Applications,"Martin Georgiev, Suman Jana, Vitaly Shmatikov, ","Many modern desktop and mobile platforms, including Ubuntu, Google Chrome, Windows, and Firefox OS, support so called Web-based system applications that run outside the Web browser and enjoy direct access to native objects such as files, camera, and geolocation. We show that the access-control models of these platforms are (a) incompatible and (b) prone to unintended delegation of native-access rights: when applications request native access for their own code, they unintentionally enable it for untrusted third-party code, too. This enables malicious ads and other third-party content to steal users' OAuth authentication credentials, access camera on their devices, etc."
www,https://dl.acm.org/doi/pdf/10.1145/2736277.2741652,Cardinal Contests,"Arpita Ghosh, Patrick Hummel, ","Contests are widely used as a means for effort elicitation in settings ranging from government R&D contests to online crowdsourcing contests on platforms such as Kaggle, Innocentive, or TopCoder. Such rank-order mechanisms---where agents' rewards depend only on the relative ranking of their submissions' qualities---are natural mechanisms for incentivizing effort when it is easier to obtain ordinal, rather than cardinal, information about agents' outputs, or where absolute measures of quality are unverifiable. An increasing number of online contests, however, rank entries according to some numerical evaluation of their absolute quality---for instance, the performance of an algorithm on a test dataset, or the performance of an intervention in a randomized trial. Can the contest designer incentivize higher effort by making the rewards in an ordinal rank-order mechanism contingent on such cardinal information? We model and analyze cardinal contests, where a principal running a rank-order tournament has access to an absolute measure of the qualities of agents' submissions in addition to their relative rankings, and ask how modifying the rank-order tournament to incorporate cardinal information can improve incentives for effort. Our main result is that a simple threshold mechanism---a mechanism that awards the prize for a rank if and only if the absolute quality of the agent at that rank exceeds a certain threshold---is optimal amongst all mixed cardinal-ordinal mechanisms where the fraction of the jth prize awarded to the jth-ranked agent is any arbitrary non-decreasing function of her submission's quality. Further, the optimal threshold mechanism uses exactly the same threshold for each rank. We study what contest parameters determine the extent of the benefit from incorporating such cardinal information into an ordinal rank-order contest, and investigate the extent of improvement in equilibrium effort via numerical simulations."
www,https://dl.acm.org/doi/pdf/10.1145/2736277.2741660,Accessible On-Line Floor Plans,"Cagatay Goncu, Anuradha Madugalla, Simone Marinai, Kim Marriott, ","Better access to on-line information graphics is a pressing need for people who are blind or have severe vision impairment. We present a new model for accessible presentation of on-line information graphics and demonstrate its use for presenting floor plans. While floor plans are increasingly provided on-line, people who are blind are at best provided with only a high-level textual description. This makes it difficult for them to understand the spatial arrangement of the objects on the floor plan. Our new approach provides users with significantly better access to such plans. The users can automatically generate an accessible version of a floor plan from an on-line floor plan image quickly and independently by using a web service. This generates a simplified graphic showing the rooms, walls, doors and windows in the original floor plan as well as a textual overview. The accessible floor plan is presented on an iPad using audio feedback. As the users touch graphic elements on the screen, the element they are touching is described by speech and non-speech audio in order to help them navigate the graphic."
www,https://dl.acm.org/doi/pdf/10.1145/2736277.2741081,Network A/B Testing: From Sampling to Estimation,"Huan Gui, Ya Xu, Anmol Bhasin, Jiawei Han, ","A/B testing, also known as bucket testing, split testing, or controlled experiment, is a standard way to evaluate user engagement or satisfaction from a new service, feature, or product. It is widely used in online websites, including social network sites such as Facebook, LinkedIn, and Twitter to make data-driven decisions. The goal of A/B testing is to estimate the treatment effect of a new change, which becomes intricate when users are interacting, i.e., the treatment effect of a user may spill over to other users via underlying social connections.When conducting these online controlled experiments, it is a common practice to make the Stable Unit Treatment Value Assumption (SUTVA) that each individual's response is affected by their own treatment only. Though this assumption simplifies the estimation of treatment effect, it does not hold when network interference is present, and may even lead to wrong conclusion."
www,https://dl.acm.org/doi/pdf/10.1145/2736277.2741117,User Session Identification Based on Strong Regularities in Inter-activity Time,"Aaron Halfaker, Os Keyes, Daniel Kluver, Jacob Thebault-Spieker, ","Session identification is a common strategy used to develop metrics for web analytics and perform behavioral analyses of user-facing systems. Past work has argued that session identification strategies based on an inactivity threshold is inherently arbitrary or has advocated that thresholds be set at about 30 minutes. In this work, we demonstrate a strong regularity in the temporal rhythms of user initiated events across several different domains of online activity (incl. video gaming, search, page views and volunteer contributions). We describe a methodology for identifying clusters of user activity and argue that the regularity with which these activity clusters appear implies a good rule-of-thumb inactivity threshold of about 1 hour. We conclude with implications that these temporal rhythms may have for system design based on our observations and theories of goal-directed human activity."
www,https://dl.acm.org/doi/pdf/10.1145/2736277.2741102,Incentivizing High Quality Crowdwork,"Chien-Ju Ho, Aleksandrs Slivkins, Siddharth Suri, Jennifer Wortman Vaughan, ","We study the causal effects of financial incentives on the quality of crowdwork. We focus on performance-based payments (PBPs), bonus payments awarded to workers for producing high quality work. We design and run randomized behavioral experiments on the popular crowdsourcing platform Amazon Mechanical Turk with the goal of understanding when, where, and why PBPs help, identifying properties of the payment, payment structure, and the task itself that make them most effective. We provide examples of tasks for which PBPs do improve quality. For such tasks, the effectiveness of PBPs is not too sensitive to the threshold for quality required to receive the bonus, while the magnitude of the bonus must be large enough to make the reward salient. We also present examples of tasks for which PBPs do not improve quality. Our results suggest that for PBPs to improve quality, the task must be effort-responsive: the task must allow workers to produce higher quality work by exerting more effort. We also give a simple method to determine if a task is effort-responsive a priori. Furthermore, our experiments suggest that all payments on Mechanical Turk are, to some degree, implicitly performance-based in that workers believe their work may be rejected if their performance is sufficiently poor. Finally, we propose a new model of worker behavior that extends the standard principal-agent model from economics to include a worker's subjective beliefs about his likelihood of being paid, and show that the predictions of this model are in line with our experimental findings. This model may be useful as a foundation for theoretical studies of incentives in crowdsourcing markets."
www,https://dl.acm.org/doi/pdf/10.1145/2736277.2741653,Skolemising Blank Nodes while Preserving Isomorphism,"Aidan Hogan, ","In this paper, we propose and evaluate a scheme to produce canonical labels for blank nodes in RDF graphs. These labels can be used as the basis for a Skolemisation scheme that gets rid of the blank nodes in an RDF graph by mapping them to globally canonical IRIs. Assuming no hash collisions, the scheme guarantees that two Skolemised graphs will be equal if and only if the two input graphs are isomorphic. Although the proposed scheme is exponential in the worst case, we claim that such cases are unlikely to be encountered in practice. To support these claims, we present the results of applying our Skolemisation scheme over a diverse collection of 43.5 million real-world RDF graphs (BTC-2014); we also provide results for some nasty synthetic cases."
www,https://dl.acm.org/doi/pdf/10.1145/2736277.2741127,Scalable Methods for Adaptively Seeding a Social Network,"Thibaut Horel, Yaron Singer, ","In recent years, social networking platforms have developed into extraordinary channels for spreading and consuming information. Along with the rise of such infrastructure, there is continuous progress on techniques for spreading information effectively through influential users. In many applications, one is restricted to select influencers from a set of users who engaged with the topic being promoted, and due to the structure of social networks, these users often rank low in terms of their influence potential. An alternative approach one can consider is an adaptive method which selects users in a manner which targets their influential neighbors. The advantage of such an approach is that it leverages the friendship paradox in social networks: while users are often not influential, they often know someone who is. Despite the various complexities in such optimization problems, we show that scalable adaptive seeding is achievable. In particular, we develop algorithms for linear influence models with provable approximation guarantees that can be gracefully parallelized. To show the effectiveness of our methods we collected data from various verticals social network users follow. For each vertical, we collected data on the users who responded to a certain post as well as their neighbors, and applied our methods on this data. Our experiments show that adaptive seeding is scalable, and importantly, that it obtains dramatic improvements over standard approaches of information dissemination."
www,https://dl.acm.org/doi/pdf/10.1145/2736277.2741141,User Review Sites as a Resource for Large-Scale Sociolinguistic Studies,"Dirk Hovy, Anders Johannsen, Anders Søgaard, ","Sociolinguistic studies investigate the relation between language and extra-linguistic variables. This requires both representative text data and the associated socio-economic meta-data of the subjects. Traditionally, sociolinguistic studies use small samples of hand-curated data and meta-data. This can lead to exaggerated or false conclusions. Using social media data offers a large-scale source of language data, but usually lacks reliable socio-economic meta-data. Our research aims to remedy both problems by exploring a large new data source, international review websites with user profiles. They provide more text data than manually collected studies, and more meta-data than most available social media text. We describe the data and present various pilot studies, illustrating the usefulness of this resource for sociolinguistic studies. Our approach can help generate new research hypotheses based on data-driven findings across several countries and languages."
www,https://dl.acm.org/doi/pdf/10.1145/2736277.2741079,When Does Improved Targeting Increase Revenue?,"Patrick Hummel, R. Preston McAfee, ","In second price auctions with symmetric bidders, we find that improved targeting via enhanced information disclosure decreases revenue when there are two bidders and increases revenue if there are at least four bidders. With asymmetries, improved targeting increases revenue if the most frequent winner wins less than 30.4% of the time, but can decrease revenue otherwise. We derive analogous results for position auctions. Finally, we show that revenue can vary non-monotonically with the number of bidders who are able to take advantage of improved targeting."
www,https://dl.acm.org/doi/pdf/10.1145/2736277.2741664,Social Status and Badge Design,"Nicole Immorlica, Greg Stoddard, Vasilis Syrgkanis, ","Many websites encourage user participation via the use of virtual rewards like badges. While badges typically have no explicit value, they act as symbols of social status within a community. In this paper, we study how to design virtual incentive mechanisms that maximize total contributions to a website when users are motivated by social status. We consider a game-theoretic model where users exert costly effort to make contributions and, in return, are awarded with badges. The value of a badge is determined endogenously by the number of users who earn an equal or higher badge; as more users earn a particular badge, the value of that badge diminishes for all users. We show that among all possible mechanisms for assigning status-driven rewards, the optimal mechanism is a leaderboard with a cutoff: users that contribute less than a certain threshold receive nothing while the remaining are ranked by contribution. We next study the necessary features of approximately optimal mechanisms and find that approximate optimality is influenced by the the convexity of status valuations. When status valuations are concave, any approximately optimal mechanism must contain a coarse status partition, i.e. a partition of users into status classes whose size will grow as the population grows. Conversely when status valuations are convex, we prove that fine partitioning, that is a partition of users into status classes whose size stays constant as the population grows, is necessary for approximate optimality."
www,https://dl.acm.org/doi/pdf/10.1145/2736277.2741632,Mapping Temporal Horizons: Analysis of Collective Future and Past related Attention in Twitter,"Adam Jatowt, Émilien Antoine, Yukiko Kawai, Toyokazu Akiyama, ","Microblogging platforms such as Twitter have recently received much attention as great sources for live web sensing, real-time event detection and opinion analysis. Previous works usually assumed that tweets mainly describe ""what's happening now"". However, a large portion of tweets contains time expressions that refer to time frames within the past or the future. Such messages often reflect expectations or memories of social media users. In this work we investigate how microblogging users collectively refer to time. In particular, we analyze half a year long portion of Japanese and four months long collection of US tweets and we quantify collective temporal attention of users as well as other related temporal characteristics. This kind of knowledge is helpful in the context of growing interest for detection and prediction of important events within social media. The exploratory analysis we perform is possible thanks to the development of visual analytics framework for robust overview and easy detection of various regularities in the past and future-oriented thinking of Twitter users. We believe that the visualizations we provide and the findings we outline can be also valuable for sociologists and computer scientists to test and refine their models about time in natural language."
www,https://dl.acm.org/doi/pdf/10.1145/2736277.2741101,Path Sampling: A Fast and Provable Method for Estimating 4-Vertex Subgraph Counts,"Madhav Jha, C. Seshadhri, Ali Pinar, ","Counting the frequency of small subgraphs is a fundamental technique in network analysis across various domains, most notably in bioinformatics and social networks. The special case of triangle counting has received much attention. Getting results for 4-vertex patterns is highly challenging, and there are few practical results known that can scale to massive sizes. Indeed, even a highly tuned enumeration code takes more than a day on a graph with millions of edges. Most previous work that runs for truly massive graphs employ clusters and massive parallelization."
www,https://dl.acm.org/doi/pdf/10.1145/2736277.2741669,Automatic Online Evaluation of Intelligent Assistants,"Jiepu Jiang, Ahmed Hassan Awadallah, Rosie Jones, Umut Ozertem, ","Voice-activated intelligent assistants, such as Siri, Google Now, and Cortana, are prevalent on mobile devices. However, it is challenging to evaluate them due to the varied and evolving number of tasks supported, e.g., voice command, web search, and chat. Since each task may have its own procedure and a unique form of correct answers, it is expensive to evaluate each task individually. This paper is the first attempt to solve this challenge. We develop consistent and automatic approaches that can evaluate different tasks in voice-activated intelligent assistants. We use implicit feedback from users to predict whether users are satisfied with the intelligent assistant as well as its components, i.e., speech recognition and intent classification. Using this approach, we can potentially evaluate and compare different tasks within and across intelligent assistants ac-cording to the predicted user satisfaction rates. Our approach is characterized by an automatic scheme of categorizing user-system interaction into task-independent dialog actions, e.g., the user is commanding, selecting, or confirming an action. We use the action sequence in a session to predict user satisfaction and the quality of speech recognition and intent classification. We also incorporate other features to further improve our approach, including features derived from previous work on web search satisfaction prediction, and those utilizing acoustic characteristics of voice requests. We evaluate our approach using data collected from a user study. Results show our approach can accurately identify satisfactory and unsatisfactory sessions."
www,https://dl.acm.org/doi/pdf/10.1145/2736277.2741135,Incorporating Social Context and Domain Knowledge for Entity Recognition,"Jie Tang, Zhanpeng Fang, Jimeng Sun, ","Recognizing entity instances in documents according to a knowledge base is a fundamental problem in many data mining applications. The problem is extremely challenging for short documents in complex domains such as social media and biomedical domains. Large concept spaces and instance ambiguity are key issues that need to be addressed. Most of the documents are created in a social context by common authors via social interactions, such as reply and citations. Such social contexts are largely ignored in the instance-recognition literature. How can users' interactions help entity instance recognition? How can the social context be modeled so as to resolve the ambiguity of different instances?"
www,https://dl.acm.org/doi/pdf/10.1145/2736277.2741131,Querying Web-Scale Information Networks Through Bounding Matching Scores,"Jiahui Jin, Samamon Khemmarat, Lixin Gao, Junzhou Luo, ","Web-scale information networks containing billions of entities are common nowadays. Querying these networks can be modeled as a subgraph matching problem. Since information networks are incomplete and noisy in nature, it is important to discover answers that match exactly as well as answers that are similar to queries. Existing graph matching algorithms usually use graph indices to improve the efficiency of query processing. For web-scale information networks, it may not be feasible to build the graph indices due to the amount of work and the memory/storage required. In this paper, we propose an efficient algorithm for finding the best k answers for a given query without precomputing graph indices. The quality of an answer is measured by a matching score that is computed online. To speed up query processing, we propose a novel technique for bounding the matching scores during the computation. By using bounds, we can efficiently prune the answers that have low qualities without having to evaluate all possible answers. The bounding technique can be implemented in a distributed environment, allowing our approach to efficiently answer the queries on web-scale information networks. We demonstrate the effectiveness and the efficiency of our approach through a series of experiments on real-world information networks. The result shows that our bounding technique can reduce the running time up to two orders of magnitude comparing to an approach that does not use bounds."
www,https://dl.acm.org/doi/pdf/10.1145/2736277.2741633,LN-Annote: An Alternative Approach to Information Extraction from Emails using Locally-Customized Named-Entity Recognition,"YoungHoon Jung, Karl Stratos, Luca P. Carloni, ","Personal mobile devices offer a growing variety of personalized services that enrich considerably the user experience. This is made possible by increased access to personal information, which to a large extent is extracted from user email messages and archives. There are, however, two main issues. First, currently these services can be offered only by large web-service companies that can also deploy email services. Second, keeping a large amount of structured personal information on the cloud raises privacy concerns. To address these problems, we propose LN-Annote, a new method to extract personal information from the email that is locally available on mobile devices (without remote access to the cloud). LN-Annote enables third-party service providers to build a question-answering system on top of the local personal information without having to own the user data. In addition, LN-Annote mitigates the privacy concerns by keeping the structured personal information directly on the personal device. Our method is based on a named-entity recognizer trained in two separate steps: first using a common dataset on the cloud and then using a personal dataset in the mobile device at hand. Our contributions include also the optimization of the implementation of LN-Annote: in particular, we implemented an OpenCL version of the custom-training algorithm to leverage the Graphic Processing Unit (GPU) available on the mobile device. We present an extensive set of experiment results: beside proving the feasibility of our approach, they demonstrate its efficiency in terms of the named-entity extraction performance as well as the execution speed and the energy consumption spent in mobile devices."
