conference,url,title,authors,abstract
www,https://dl.acm.org/doi/pdf/10.1145/1963405.1963436,Prophiler: a fast filter for the large-scale detection of malicious web pages,"Davide Canali, Marco Cova, Giovanni Vigna, Christopher Kruegel, ","Malicious web pages that host drive-by-download exploits have become a popular means for compromising hosts on the Internet and, subsequently, for creating large-scale botnets. In a drive-by-download exploit, an attacker embeds a malicious script (typically written in JavaScript) into a web page. When a victim visits this page, the script is executed and attempts to compromise the browser or one of its plugins. To detect drive-by-download exploits, researchers have developed a number of systems that analyze web pages for the presence of malicious code. Most of these systems use dynamic analysis. That is, they run the scripts associated with a web page either directly in a real browser (running in a virtualized environment) or in an emulated browser, and they monitor the scripts' executions for malicious activity. While the tools are quite precise, the analysis process is costly, often requiring in the order of tens of seconds for a single page. Therefore, performing this analysis on a large set of web pages containing hundreds of millions of samples can be prohibitive."
www,https://dl.acm.org/doi/pdf/10.1145/1963405.1963437,Heat-seeking honeypots: design and experience,"John P. John, Fang Yu, Yinglian Xie, Arvind Krishnamurthy, Martín Abadi, ","Many malicious activities on the Web today make use of compromised Web servers, because these servers often have high pageranks and provide free resources. Attackers are therefore constantly searching for vulnerable servers. In this work, we aim to understand how attackers find, compromise, and misuse vulnerable servers. Specifically, we present heat-seeking honeypots that actively attract attackers, dynamically generate and deploy honeypot pages, then analyze logs to identify attack patterns."
www,https://dl.acm.org/doi/pdf/10.1145/1963405.1963439,Semi-supervised truth discovery,"Xiaoxin Yin, Wenzhao Tan, ","Accessing online information from various data sources has become a necessary part of our everyday life. Unfortunately such information is not always trustworthy, as different sources are of very different qualities and often provide inaccurate and conflicting information. Existing approaches attack this problem using unsupervised learning methods, and try to infer the confidence of the data value and trustworthiness of each source from each other by assuming values provided by more sources are more accurate. However, because false values can be widespread through copying among different sources and out-of-date data often overwhelm up-to-date data, such bootstrapping methods are often ineffective."
www,https://dl.acm.org/doi/pdf/10.1145/1963405.1963440,SourceRank: relevance and trust assessment for deep web sources based on inter-source agreement,"Raju Balakrishnan, Subbarao Kambhampati, ","One immediate challenge in searching the deep web databases is source selection - i.e. selecting the most relevant web databases for answering a given query. The existing database selection methods (both text and relational) assess the source quality based on the query-similarity-based relevance assessment. When applied to the deep web these methods have two deficiencies. First is that the methods are agnostic to the correctness (trustworthiness) of the sources. Secondly, the query based relevance does not consider the importance of the results. These two considerations are essential for the open collections like the deep web. Since a number of sources provide answers to any query, we conjuncture that the agreements between these answers are likely to be helpful in assessing the importance and the trustworthiness of the sources. We compute the agreement between the sources as the agreement of the answers returned. While computing the agreement, we also measure and compensate for possible collusion between the sources. This adjusted agreement is modeled as a graph with sources at the vertices. On this agreement graph, a quality score of a source that we call SourceRank, is calculated as the stationary visit probability of a random walk. We evaluate SourceRank in multiple domains, including sources in Google Base, with sizes up to 675 sources. We demonstrate that the SourceRank tracks source corruption. Further, our relevance evaluations show that SourceRank improves precision by 22-60% over the Google Base and the other baseline methods. SourceRank has been implemented in a system called Factal."
www,https://dl.acm.org/doi/pdf/10.1145/1963405.1963441,Search result diversity for informational queries,"Michael J. Welch, Junghoo Cho, Christopher Olston, ","Ambiguous queries constitute a significant fraction of search instances and pose real challenges to web search engines. With current approaches the top results for these queries tend to be homogeneous, making it difficult for users interested in less popular aspects to find relevant documents. While existing research in search diversification offers several solutions for introducing variety into the results, the majority of such work is predicated, implicitly or otherwise, on the assumption that a single relevant document will fulfill a user's information need, making them inadequate for many informational queries. In this paper we present a search-diversification algorithm particularly suitable for informational queries by explicitly modeling that the user may need more than one page to satisfy their need. This modeling enables our algorithm to make a well-informed tradeoff between a user's desire for multiple relevant documents, probabilistic information about an average user's interest in the subtopics of a multifaceted query, and uncertainty in classifying documents into those subtopics. We evaluate the effectiveness of our algorithm against commercial search engine results and other modern ranking strategies, demonstrating notable improvement in multiple document scenarios."
www,https://dl.acm.org/doi/pdf/10.1145/1963405.1963443,Geographical topic discovery and comparison,"Zhijun Yin, Liangliang Cao, Jiawei Han, Chengxiang Zhai, Thomas Huang, ","This paper studies the problem of discovering and comparing geographical topics from GPS-associated documents. GPS-associated documents become popular with the pervasiveness of location-acquisition technologies. For example, in Flickr, the geo-tagged photos are associated with tags and GPS locations. In Twitter, the locations of the tweets can be identified by the GPS locations from smart phones. Many interesting concepts, including cultures, scenes, and product sales, correspond to specialized geographical distributions. In this paper, we are interested in two questions: (1) how to discover different topics of interests that are coherent in geographical regions? (2) how to compare several topics across different geographical locations? To answer these questions, this paper proposes and compares three ways of modeling geographical topics: location-driven model, text-driven model, and a novel joint model called LGTA (Latent Geographical Topic Analysis) that combines location and text. To make a fair comparison, we collect several representative datasets from Flickr website including Landscape, Activity, Manhattan, National park, Festival, Car, and Food. The results show that the first two methods work in some datasets but fail in others. LGTA works well in all these datasets at not only finding regions of interests but also providing effective comparisons of the topics across different locations. The results confirm our hypothesis that the geographical distributions can help modeling topics, while topics provide important cues to group different geographical regions."
www,https://dl.acm.org/doi/pdf/10.1145/1963405.1963444,The web of topics: discovering the topology of topic evolution in a corpus,"Yookyung Jo, John E. Hopcroft, Carl Lagoze, ","In this paper we study how to discover the evolution of topics over time in a time-stamped document collection. Our approach is uniquely designed to capture the rich topology of topic evolution inherent in the corpus. Instead of characterizing the evolving topics at fixed time points, we conceptually define a topic as a quantized unit of evolutionary change in content and discover topics with the time of their appearance in the corpus. Discovered topics are then connected to form a topic evolution graph using a measure derived from the underlying document network. Our approach allows inhomogeneous distribution of topics over time and does not impose any topological restriction in topic evolution graphs. We evaluate our algorithm on the ACM corpus."
www,https://dl.acm.org/doi/pdf/10.1145/1963405.1963445,Unified analysis of streaming news,"Amr Ahmed, Qirong Ho, Jacob Eisenstein, Eric Xing, ","News clustering, categorization and analysis are key components of any news portal. They require algorithms capable of dealing with dynamic data to cluster, interpret and to temporally aggregate news articles. These three tasks are often solved separately. In this paper we present a unified framework to group incoming news articles into temporary but tightly-focused storylines, to identify prevalent topics and key entities within these stories, and to reveal the temporal structure of stories as they evolve. We achieve this by building a hybrid clustering and topic model. To deal with the available wealth of data we build an efficient parallel inference algorithm by sequential Monte Carlo estimation. Time and memory costs are nearly constant in the length of the history, and the approach scales to hundreds of thousands of documents. We demonstrate the efficiency and accuracy on the publicly available TDT dataset and data of a major internet news site."
www,https://dl.acm.org/doi/pdf/10.1145/1963405.1963447,Learning to re-rank: query-dependent image re-ranking using click data,"Vidit Jain, Manik Varma, ","Our objective is to improve the performance of keyword based image search engines by re-ranking their original results. To this end, we address three limitations of existing search engines in this paper. First, there is no straight-forward, fully automated way of going from textual queries to visual features. Image search engines therefore primarily rely on static and textual features for ranking. Visual features are mainly used for secondary tasks such as finding similar images. Second, image rankers are trained on query-image pairs labeled with relevance judgments determined by human experts. Such labels are well known to be noisy due to various factors including ambiguous queries, unknown user intent and subjectivity in human judgments. This leads to learning a sub-optimal ranker. Finally, a static ranker is typically built to handle disparate user queries. The ranker is therefore unable to adapt its parameters to suit the query at hand which again leads to sub-optimal results. We demonstrate that all of these problems can be mitigated by employing a re-ranking algorithm that leverages aggregate user click data."
www,https://dl.acm.org/doi/pdf/10.1145/1963405.1963448,Video summarization via transferrable structured learning,"Liangda Li, Ke Zhou, Gui-Rong Xue, Hongyuan Zha, Yong Yu, ","It is well-known that textual information such as video transcripts and video reviews can significantly enhance the performance of video summarization algorithms. Unfortunately, many videos on the Web such as those from the popular video sharing site YouTube do not have useful textual information. The goal of this paper is to propose a transfer learning framework for video summarization: in the training process both the video features and textual features are exploited to train a summarization algorithm while for summarizing a new video only its video features are utilized. The basic idea is to explore the transferability between videos and their corresponding textual information. Based on the assumption that video features and textual features are highly correlated with each other, we can transfer textual information into knowledge on summarization using video information only. In particular, we formulate the video summarization problem as that of learning a mapping from a set of shots of a video to a subset of the shots using the general framework of SVM-based structured learning. Textual information is transferred by encoding them into a set of constraints used in the structured learning process which tend to provide a more detailed and accurate characterization of the different subsets of shots. Experimental results show significant performance improvement of our approach and demonstrate the utility of textual information for enhancing video summarization."
www,https://dl.acm.org/doi/pdf/10.1145/1963405.1963449,Towards semantic knowledge propagation from text corpus to web images,"Guo-Jun Qi, Charu Aggarwal, Thomas Huang, ","In this paper, we study the problem of transfer learning from text to images in the context of network data in which link based bridges are available to transfer the knowledge between the different domains. The problem of classification of image data is often much more challenging than text data because of the following two reasons: (a) Labeled text data is very widely available for classification purposes. On the other hand, this is often not the case for image data, in which a lot of images are available from many sources, but many of them are often not labeled. (b) The image features are not directly related to semantic concepts inherent in class labels. On the other hand, since text data tends to have natural semantic interpretability (because of their human origins), they are often more directly related to class labels. Therefore, the relationships between the images and text features also provide additional hints for the classification process in terms of the image feature transformations which provide the most effective results."
www,https://dl.acm.org/doi/pdf/10.1145/1963405.1963451,Pay as you browse: microcomputations as micropayments in web-based services,"Ghassan O. Karame, Aurélien Francillon, Srdjan Čapkun, ","Currently, several online businesses deem that advertising revenues alone are not sufficient to generate profits and are therefore set to charge for online content. In this paper, we explore a complement to the current advertisement model; more specifically, we propose a micropayment model for non-specialized commodity web-services based on microcomputations. In our model, a user that wishes to access online content offered by a website does not need to register or pay to access the website; instead, he will accept to run microcomputations on behalf of the website in exchange for access to the content. These microcomputations can, for example, support ongoing computing projects that have clear social benefits (e.g., projects relating to HIV, dengue, cancer, etc.) or can contribute towards commercial computing projects. We argue that this micropayment model is economically and technically viable and that it can be integrated in existing distributed computing frameworks (e.g., the BOINC platform). We implement a preliminary prototype of a system based on our model through which we evaluate its performance and usability. Finally, we analyze the security and privacy of our proposal and we show that it ensures payment for the content while preserving the privacy of users."
www,https://dl.acm.org/doi/pdf/10.1145/1963405.1963452,Consideration set generation in commerce search,"Sayan Bhattacharya, Sreenivas Gollapudi, Kamesh Munagala, ","In commerce search, the set of products returned by a search engine often forms the basis for all user interactions leading up to a potential transaction on the web. Such a set of products is known as the consideration set. In this study, we consider the problem of generating consideration set of products in commerce search so as to maximize user satisfaction. One of the key features of commerce search that we exploit in our study is the association of a set of important attributes with the products and a set of specified attributes with the user queries. Those important attributes not used in the query are treated as unspecified. The attribute space admits a natural definition of user satisfaction via user preferences on the attributes and their values, viz. require that the surfaced products be close to the specified attribute values in the query, and diverse with respect to the unspecified attributes. We model this as a general Max-Sum Dispersion problem wherein we are given a set of n nodes in a metric space and the objective is to select a subset of nodes with total cost at most a given budget, and maximize the sum of the pairwise distances between the selected nodes. In our setting, each node denotes a product, the cost of a node being inversely proportional to its relevance with respect to specified attributes. The distance between two nodes quantifies the diversity with respect to the unspecified attributes. The problem is NP-hard and a 2-approximation was previously known only when all the nodes have unit cost."
www,https://dl.acm.org/doi/pdf/10.1145/1963405.1963453,Towards a theory model for product search,"Beibei Li, Anindya Ghose, Panagiotis G. Ipeirotis, ","With the growing pervasiveness of the Internet, online search for products and services is constantly increasing. Most product search engines are based on adaptations of theoretical models devised for information retrieval. However, the decision mechanism that underlies the process of buying a product is different than the process of locating relevant documents or objects."
www,https://dl.acm.org/doi/pdf/10.1145/1963405.1963455,A word at a time: computing word relatedness using temporal semantic analysis,"Kira Radinsky, Eugene Agichtein, Evgeniy Gabrilovich, Shaul Markovitch, ","Computing the degree of semantic relatedness of words is a key functionality of many language applications such as search, clustering, and disambiguation. Previous approaches to computing semantic relatedness mostly used static language resources, while essentially ignoring their temporal aspects. We believe that a considerable amount of relatedness information can also be found in studying patterns of word usage over time. Consider, for instance, a newspaper archive spanning many years. Two words such as ""war"" and ""peace"" might rarely co-occur in the same articles, yet their patterns of use over time might be similar. In this paper, we propose a new semantic relatedness model, Temporal Semantic Analysis (TSA), which captures this temporal information. The previous state of the art method, Explicit Semantic Analysis (ESA), represented word semantics as a vector of concepts. TSA uses a more refined representation, where each concept is no longer scalar, but is instead represented as time series over a corpus of temporally-ordered documents. To the best of our knowledge, this is the first attempt to incorporate temporal evidence into models of semantic relatedness. Empirical evaluation shows that TSA provides consistent improvements over the state of the art ESA results on multiple benchmarks."
www,https://dl.acm.org/doi/pdf/10.1145/1963405.1963456,Automatic construction of a context-aware sentiment lexicon: an optimization approach,"Yue Lu, Malu Castellanos, Umeshwar Dayal, ChengXiang Zhai, ","The explosion of Web opinion data has made essential the need for automatic tools to analyze and understand people's sentiments toward different topics. In most sentiment analysis applications, the sentiment lexicon plays a central role. However, it is well known that there is no universally optimal sentiment lexicon since the polarity of words is sensitive to the topic domain. Even worse, in the same domain the same word may indicate different polarities with respect to different aspects. For example, in a laptop review, ""large"" is negative for the battery aspect while being positive for the screen aspect. In this paper, we focus on the problem of learning a sentiment lexicon that is not only domain specific but also dependent on the aspect in context given an unlabeled opinionated text collection. We propose a novel optimization framework that provides a unified and principled way to combine different sources of information for learning such a context-dependent sentiment lexicon. Experiments on two data sets (hotel reviews and customer feedback surveys on printers) show that our approach can not only identify new sentiment words specific to the given domain but also determine the different polarities of a word depending on the aspect in context. In further quantitative evaluation, our method is proved to be effective in constructing a high quality lexicon by comparing with a human annotated gold standard. In addition, using the learned context-dependent sentiment lexicon improved the accuracy in an aspect-level sentiment classification task."
www,https://dl.acm.org/doi/pdf/10.1145/1963405.1963457,Web scale NLP: a case study on url word breaking,"Kuansan Wang, Christopher Thrasher, Bo-June Paul Hsu, ","This paper uses the URL word breaking task as an example to elaborate what we identify as crucial in designing statistical natural language processing (NLP) algorithms for Web scale applications: (1) rudimentary multilingual capabilities to cope with the global nature of the Web, (2) multi-style modeling to handle diverse language styles seen in the Web contents, (3) fast adaptation to keep pace with the dynamic changes of the Web, (4) minimal heuristic assumptions for generalizability and robustness, and (5) possibilities of efficient implementations and minimal manual efforts for processing massive amount of data at a reasonable cost. We first show that the state-of-the-art word breaking techniques can be unified and generalized under the Bayesian minimum risk (BMR) framework that, using a Web scale N-gram, can meet the first three requirements. We discuss how the existing techniques can be viewed as introducing additional assumptions to the basic BMR framework, and describe a generic yet efficient implementation called word synchronous beam search. Testing the framework and its implementation on a series of large scale experiments reveals the following. First, the language style used to build the model plays a critical role in the word breaking task, and the most suitable for the URL word breaking task appears to be that of the document title where the best performance is obtained. Models created from other language styles, such as from document body, anchor text, and even queries, exhibit varying degrees of mismatch. Although all styles benefit from increasing modeling power which, in our experiments, corresponds to the use of a higher order N-gram, the gain is most recognizable for the title model. The heuristics proposed by the prior arts do contribute to the word breaking performance for mismatched or less powerful models, but are less effective and, in many cases, lead to poorer performance than the matched model with minimal assumptions. For the matched model based on document titles, an accuracy rate of 97.18% can already be achieved using simple trigram without any heuristics."
www,https://dl.acm.org/doi/pdf/10.1145/1963405.1963459,Learning to rank with multiple objective functions,"Krysta M. Svore, Maksims N. Volkovs, Christopher J.C. Burges, ","We investigate the problem of learning to rank with document retrieval from the perspective of learning for multiple objective functions. We present solutions to two open problems in learning to rank: first, we show how multiple measures can be combined into a single graded measure that can be learned. This solves the problem of learning from a 'scorecard' of measures by making such scorecards comparable, and we show results where a standard web relevance measure (NDCG) is used for the top-tier measure, and a relevance measure derived from click data is used for the second-tier measure; the second-tier measure is shown to significantly improve while leaving the top-tier measure largely unchanged. Second, we note that the learning-to-rank problem can itself be viewed as changing as the ranking model learns: for example, early in learning, adjusting the rank of all documents can be advantageous, but later during training, it becomes more desirable to concentrate on correcting the top few documents for each query. We show how an analysis of these problems leads to an improved, iteration-dependent cost function that interpolates between a cost function that is more appropriate for early learning, with one that is more appropriate for late-stage learning. The approach results in a significant improvement in accuracy with the same size models. We investigate these ideas using LambdaMART, a state-of-the-art ranking algorithm."
