conference,url,title,authors,abstract
www,https://dl.acm.org/doi/pdf/10.1145/3178876.3186031,Creating Crowdsourced Research Talks at Scale,"Rajan Vaish, Shirish Goyal, Amin Saberi, Sharad Goel, ","There has been a marked shift towards learning and consuming information through video. Most academic research, however, is still distributed only in text form, as researchers often have limited time, resources, and incentives to create video versions of their work. To address this gap, we propose, deploy, and evaluate a scalable, end-to-end system for crowdsourcing the creation of short, 5-minute research videos based on academic papers. Doing so requires solving complex coordination and collaborative video production problems. To assist coordination, we designed a structured workflow that enables efficient delegation of tasks, while also motivating the crowd through a collaborative learning environment. To facilitate video production, we developed an online tool with which groups can make micro-audio recordings that are automatically stitched together to create a complete talk. We tested this approach with a group of volunteers recruited from 52 countries through an open call. This distributed crowd produced over 100 video talks in 12 languages based on papers from top-tier computer science conferences. The produced talks consistently received high ratings from a diverse group of non-experts and experts, including the authors of the original papers. These results indicate that our crowdsourcing approach is a promising method for producing high-quality research talks at scale, increasing the distribution and accessibility of scientific knowledge."
www,https://dl.acm.org/doi/pdf/10.1145/3178876.3186032,Attack under Disguise: An Intelligent Data Poisoning Attack Mechanism in Crowdsourcing,"Chenglin Miao, Qi Li, Lu Su, Mengdi Huai, Wenjun Jiang, Jing Gao, ","As an effective way to solicit useful information from the crowd, crowdsourcing has emerged as a popular paradigm to solve challenging tasks. However, the data provided by the participating workers are not always trustworthy. In real world, there may exist malicious workers in crowdsourcing systems who conduct the data poisoning attacks for the purpose of sabotage or financial rewards. Although data aggregation methods such as majority voting are conducted on workers» labels in order to improve data quality, they are vulnerable to such attacks as they treat all the workers equally. In order to capture the variety in the reliability of workers, the Dawid-Skene model, a sophisticated data aggregation method, has been widely adopted in practice. By conducting maximum likelihood estimation (MLE) using the expectation maximization (EM) algorithm, the Dawid-Skene model can jointly estimate each worker»s reliability and conduct weighted aggregation, and thus can tolerate the data poisoning attacks to some degree. However, the Dawid-Skene model still has weakness. In this paper, we study the data poisoning attacks against such crowdsourcing systems with the Dawid-Skene model empowered. We design an intelligent attack mechanism, based on which the attacker can not only achieve maximum attack utility but also disguise the attacking behaviors. Extensive experiments based on real-world crowdsourcing datasets are conducted to verify the desirable properties of the proposed mechanism."
www,https://dl.acm.org/doi/pdf/10.1145/3178876.3186033,Leveraging Crowdsourcing Data for Deep Active Learning An Application: Learning Intents in Alexa,"Jie Yang, Thomas Drake, Andreas Damianou, Yoelle Maarek, ","This paper presents a generic Bayesian framework that enables any deep learning model to actively learn from targeted crowds. Our framework inherits from recent advances in Bayesian deep learning, and extends existing work by considering the targeted crowdsourcing approach, where multiple annotators with unknown expertise contribute an uncontrolled amount (often limited) of annotations. Our framework leverages the low-rank structure in annotations to learn individual annotator expertise, which then helps to infer the true labels from noisy and sparse annotations. It provides a unified Bayesian model to simultaneously infer the true labels and train the deep learning model in order to reach an optimal learning efficacy. Finally, our framework exploits the uncertainty of the deep learning model during prediction as well as the annotators» estimated expertise to minimize the number of required annotations and annotators for optimally training the deep learning model. We evaluate the effectiveness of our framework for intent classification in Alexa (Amazon»s personal assistant), using both synthetic and real-world datasets. Experiments show that our framework can accurately learn annotator expertise, infer true labels, and effectively reduce the amount of annotations in model training as compared to state-of-the-art approaches. We further discuss the potential of our proposed framework in bridging machine learning and crowdsourcing towards improved human-in-the-loop systems."
www,https://dl.acm.org/doi/pdf/10.1145/3178876.3186034,Web-Based VR Experiments Powered by the Crowd,"Xiao Ma, Megan Cackett, Leslie Park, Eric Chien, Mor Naaman, ","We build on the increasing availability of Virtual Reality (VR) devices and Web technologies to conduct behavioral experiments in VR using crowdsourcing techniques. A new recruiting and validation method allows us to create a panel of eligible experiment participants recruited from Amazon Mechanical Turk. Using this panel, we ran three different crowdsourced VR experiments, each reproducing one of three VR illusions: place illusion, embodiment illusion, and plausibility illusion. Our experience and worker feedback on these experiments show that conducting Web-based VR experiments using crowdsourcing is already feasible, though some challenges---including scale---remain. Such crowdsourced VR experiments on the Web have the potential to finally support replicable VR experiments with diverse populations at a low cost."
www,https://dl.acm.org/doi/pdf/10.1145/3178876.3186035,CHIMP: Crowdsourcing Human Inputs for Mobile Phones,"Mario Almeida, Muhammad Bilal, Alessandro Finamore, Ilias Leontiadis, ","While developing mobile apps is becoming easier, testing and characterizing their behavior is still hard. On the one hand, the de facto testing tool, called ""Monkey,"" scales well due to being based on random inputs, but fails to gather inputs useful in understanding things like user engagement and attention. On the other hand, gathering inputs and data from real users requires distributing instrumented apps, or even phones with pre-installed apps, an expensive and inherently unscaleable task. To address these limitations we present CHIMP, a system that integrates automated tools and large-scale crowdsourced inputs. CHIMP is different from previous approaches in that it runs apps in a virtualized mobile environment that thousands of users all over the world can access via a standard Web browser. CHIMP is thus able to gather the full range of real-user inputs, detailed run-time traces of apps, and network traffic. We thus describe CHIMP»s design and demonstrate the efficiency of our approach by testing thousands of apps via thousands of crowdsourced users. We calibrate CHIMP with a large-scale campaign to understand how users approach app testing tasks. Finally, we show how CHIMP can be used to improve both traditional app testing tasks, as well as more novel tasks such as building a traffic classifier on encrypted network flows."
www,https://dl.acm.org/doi/pdf/10.1145/3178876.3186036,Crowd-based Multi-Predicate Screening of Papers in Literature Reviews,"Evgeny Krivosheev, Fabio Casati, Boualem Benatallah, ","Systematic literature reviews (SLRs) are one of the most common and useful form of scientific research and publication. Tens of thousands of SLRs are published each year, and this rate is growing across all fields of science. Performing an accurate, complete and unbiased SLR is however a difficult and expensive endeavor. This is true in general for all phases of a literature review, and in particular for the paper screening phase, where authors filter a set of potentially in-scope papers based on a number of exclusion criteria. To address the problem, in recent years the research community has began to explore the use of the crowd to allow for a faster, accurate, cheaper and unbiased screening of papers. Initial results show that crowdsourcing can be effective, even for relatively complex reviews."
www,https://dl.acm.org/doi/pdf/10.1145/3178876.3186037,The Size Conundrum: Why Online Knowledge Markets Can Fail at Scale,"Himel Dev, Chase Geigle, Qingtao Hu, Jiahui Zheng, Hari Sundaram, ","In this paper, we interpret the community question answering websites on the StackExchange platform as knowledge markets, and analyze how and why these markets can fail at scale. A knowledge market framing allows site operators to reason about market failures, and to design policies to prevent them. Our goal is to provide insights on large-scale knowledge market failures through an interpretable model. We explore a set of interpretable economic production models on a large empirical dataset to analyze the dynamics of content generation in knowledge markets. Amongst these, the Cobb-Douglas model best explains empirical data and provides an intuitive explanation for content generation through the concepts of elasticity and diminishing returns. Content generation depends on user participation and also on how specific types of content (e.g. answers) depends on other types (e.g. questions). We show that these factors of content generation have constant elasticity and a percentage increase in any of the inputs leads to a constant percentage increase in the output. Furthermore, markets exhibit diminishing returns-the marginal output decreases as the input is incrementally increased. Knowledge markets also vary on their returns to scale-the increase in output resulting from a proportionate increase in all inputs. Importantly, many knowledge markets exhibit diseconomies of scale-measures of market health (e.g., the percentage of questions with an accepted answer) decrease as a function of the number of participants. The implications of our work are two-fold: site operators ought to design incentives as a function of system size (number of participants); the market lens should shed insight into complex dependencies amongst different content types and participant actions in general social networks."
www,https://dl.acm.org/doi/pdf/10.1145/3178876.3186049,A Fast Deep Learning Model for Textual Relevance in Biomedical Information Retrieval,"Sunil Mohan, Nicolas Fiorini, Sun Kim, Zhiyong Lu, ","Publications in the life sciences are characterized by a large technical vocabulary, with many lexical and semantic variations for expressing the same concept. Towards addressing the problem of relevance in biomedical literature search, we introduce a deep learning model for the relevance of a document's text to a keyword style query. Limited by a relatively small amount of training data, the model uses pre-trained word embeddings. With these, the model first computes a variable-length Delta matrix between the query and document, representing a difference between the two texts, which is then passed through a deep convolution stage followed by a deep feed-forward network to compute a relevance score. This results in a fast model suitable for use in an online search engine. The model is robust and outperforms comparable state-of-the-art deep learning approaches."
www,https://dl.acm.org/doi/pdf/10.1145/3178876.3186050,Multi-Task Learning Improves Disease Models from Web Search,"Bin Zou, Vasileios Lampos, Ingemar Cox, ","We investigate the utility of multi-task learning to disease surveillance using Web search data. Our motivation is two-fold. Firstly, we assess whether concurrently training models for various geographies - inside a country or across different countries - can improve accuracy. We also test the ability of such models to assist health systems that are producing sporadic disease surveillance reports that reduce the quantity of available training data. We explore both linear and nonlinear models, specifically a multi-task expansion of elastic net and a multi-task Gaussian Process, and compare them to their respective single task formulations. We use influenza-like illness as a case study and conduct experiments on the United States (US) as well as England, where both health and Google search data were obtained. Our empirical results indicate that multi-task learning improves regional as well as national models for the US. The percentage of improvement on mean absolute error increases up to 14.8% as the historical training data is reduced from 5 to 1 year(s), illustrating that accurate models can be obtained, even by training on relatively short time intervals. Furthermore, in simulated scenarios, where only a few health reports (training data) are available, we show that multi-task learning helps to maintain a stable performance across all the affected locations. Finally, we present results from a cross-country experiment, where data from the US improves the estimates for England. As the historical training data for England is reduced, the benefits of multi-task learning increase, reducing mean absolute error by up to 40%."
www,https://dl.acm.org/doi/pdf/10.1145/3178876.3186051,Multi-instance Domain Adaptation for Vaccine Adverse Event Detection,"Junxiang Wang, Liang Zhao, ","Detection of vaccine adverse events is crucial to the discovery and improvement of problematic vaccines. To achieve it, traditionally formal reporting systems like VAERS support accurate but delayed surveillance, while recently social media have been mined for timely but noisy observations. Utilizing the complementary strengths of these two domains to boost the detection performance looks good but cannot be effectively achieved by existing methods due to significant differences between their data characteristics, including: 1) formal language v.s. informal language, 2) single-message per user v.s. multi-messages per user, and 3) one class v.s. binary class. In this paper, we propose a novel generic framework named Multi-instance Domain Adaptation (MIDA) to maximize the synergy between these two domains in the vaccine adverse event detection task for social media users. Specifically, we propose a generalized Maximum Mean Discrepancy (MMD) criterion to measure the semantic distances between the heterogeneous messages from these two domains in their shared latent semantic space. Then these message-level generalized MMD distances are synthesized by newly proposed mixed instance kernels to user-level distances. We finally minimize the distances between the samples of the partially-matched classes from these two domains. In order to solve the non-convex optimization problem, an efficient Alternating Direction Method of Multipliers (ADMM) based algorithm combined with the Convex-Concave Procedure (CCP) is developed to optimize parameters accurately. Extensive experiments demonstrated that our model outperformed the baselines by a large margin under six metrics. Case studies showed that formal reports and extracted adverse-relevant tweets by MIDA shared a similarity of keyword and description patterns."
www,https://dl.acm.org/doi/pdf/10.1145/3178876.3186052,Modeling Individual Cyclic Variation in Human Behavior,"Emma Pierson, Tim Althoff, Jure Leskovec, ","Cycles are fundamental to human health and behavior. Examples include mood cycles, circadian rhythms, and the menstrual cycle. However, modeling cycles in time series data is challenging because in most cases the cycles are not labeled or directly observed and need to be inferred from multidimensional measurements taken over time. Here, we present Cyclic Hidden Markov Models (CyHMMs) for detecting and modeling cycles in a collection of multidimensional heterogeneous time series data. In contrast to previous cycle modeling methods, CyHMMs deal with a number of challenges encountered in modeling real-world cycles: they can model multivariate data with both discrete and continuous dimensions; they explicitly model and are robust to missing data; and they can share information across individuals to accommodate variation both within and between individual time series. Experiments on synthetic and real-world health-tracking data demonstrate that CyHMMs infer cycle lengths more accurately than existing methods, with 58% lower error on simulated data and 63% lower error on real-world data compared to the best-performing baseline. CyHMMs can also perform functions which baselines cannot: they can model the progression of individual features/symptoms over the course of the cycle, identify the most variable features, and cluster individual time series into groups with distinct characteristics. Applying CyHMMs to two real-world health-tracking datasets -- of human menstrual cycle symptoms and physical activity tracking data -- yields important insights including which symptoms to expect at each point during the cycle. We also find that people fall into several groups with distinct cycle patterns, and that these groups differ along dimensions not provided to the model. For example, by modeling missing data in the menstrual cycles dataset, we are able to discover a medically relevant group of birth control users even though information on birth control is not given to the model."
www,https://dl.acm.org/doi/pdf/10.1145/3178876.3186053,Multi-Task Pharmacovigilance Mining from Social Media Posts,"Shaika Chowdhury, Chenwei Zhang, Philip S. Yu, ","Social media has grown to be a crucial information source for pharmacovigilance studies where an increasing number of people post adverse reactions to medical drugs that are previously unreported. Aiming to effectively monitor various aspects of Adverse Drug Reactions (ADRs) from diversely expressed social medical posts, we propose a multi-task neural network framework that learns several tasks associated with ADR monitoring with different levels of supervisions collectively. Besides being able to correctly classify ADR posts and accurately extract ADR mentions from online posts, the proposed framework is also able to further understand reasons for which the drug is being taken, known as »indications», from the given social media post. A coverage-based attention mechanism is adopted in our framework to help the model properly identify »phrasal» ADRs and Indications that are attentive to multiple words in a post. Our framework is applicable in situations where limited parallel data for different pharmacovigilance tasks are available. We evaluate the proposed framework on real-world Twitter datasets, where the proposed model outperforms the state-of-the-art alternatives of each individual task consistently."
www,https://dl.acm.org/doi/pdf/10.1145/3178876.3186055,Did You Really Just Have a Heart Attack?: Towards Robust Detection of Personal Health Mentions in Social Media,"Payam Karisani, Eugene Agichtein, ","Millions of users share their experiences on social media sites, such as Twitter, which in turn generate valuable data for public health monitoring, digital epidemiology, and other analyses of population health at global scale. The first, critical, task for these applications is classifying whether a personal health event was mentioned, which we call the (PHM) problem. This task is challenging for many reasons, including typically short length of social media posts, inventive spelling and lexicons, and figurative language, including hyperbole using diseases like ""heart attack»» or ""cancer»» for emphasis, and not as a health self-report. This problem is even more challenging for rarely reported, or frequent but ambiguously expressed conditions, such as ""stroke»». To address this problem, we propose a general, robust method for detecting PHMs in social media, which we call WESPAD, that combines lexical, syntactic, word embedding-based, and context-based features. WESPAD is able to generalize from few examples by automatically distorting the word embedding space to most effectively detect the true health mentions. Unlike previously proposed state-of-the-art supervised and deep-learning techniques, WESPAD requires relatively little training data, which makes it possible to adapt, with minimal effort, to each new disease and condition. We evaluate WESPAD on both an established publicly available Flu detection benchmark, and on a new dataset that we have constructed with mentions of multiple health conditions. Our experiments show that WESPAD outperforms the baselines and state-of-the-art methods, especially in cases when the number and proportion of true health mentions in the training data is small."
www,https://dl.acm.org/doi/pdf/10.1145/3178876.3185992,Detecting Absurd Conversations from Intelligent Assistant Logs by Exploiting User Feedback Utterances,"Chikara Hashimoto, Manabu Sassano, ","Intelligent assistants, such as Siri, are expected to converse comprehensibly with users. To facilitate improvement of their conversational ability, we have developed a method that detects absurd conversations recorded in intelligent assistant logs by identifying user feedback utterances that indicate users' favorable and unfavorable evaluations of intelligent assistant responses; e.g., ""great!"" is favorable, whereas ""what are you talking about?"" is unfavorable. Assuming that absurd/comprehensible conversations tend to be followed by unfavorable/favorable utterances, our method extracts some absurd/comprehensible conversations from the log to train a conversation classifier that sorts all the conversations recorded in the log as either absurd or not. The challenge is that user feedback utterances are often ambiguous; e.g., a user may give an unfavorable utterance (e.g., ""don't be silly!"") to a comprehensible conversation in which the intelligent assistant was attempting to make a joke. An utterance classifier is thus used to score the feedback utterances in accordance with how unambiguously they indicate absurdity. Experiments showed that our method significantly outperformed methods that lacked a conversation and/or utterance classifier, indicating the effectiveness of the two classifiers. Our method only requires user feedback utterances, which would be independent of domains. Experiments focused on chitchat, web search, and weather domains indicated that our method is likely domain-independent."
www,https://dl.acm.org/doi/pdf/10.1145/3178876.3185993,ROSC: Robust Spectral Clustering on Multi-scale Data,"Xiang Li, Ben Kao, Siqiang Luo, Martin Ester, ","We investigate the effectiveness of spectral methods in clustering multi-scale data, which is data whose clusters are of various sizes and densities. We review existing spectral methods that are designed to handle multi-scale data and propose an alternative approach that is orthogonal to existing methods. We put forward the algorithm ROSC, which computes an affinity matrix that takes into account both objects' feature similarity and reachability similarity. We perform extensive experiments comparing ROSC against 9 other methods on both real and synthetic datasets. Our results show that ROSC performs very well against the competitors. In particular, it is very robust in that it consistently performs well over all the datasets tested. Also, it outperforms others by wide margins for datasets that are highly multi-scale."
www,https://dl.acm.org/doi/pdf/10.1145/3178876.3185994,DRN: A Deep Reinforcement Learning Framework for News Recommendation,"Guanjie Zheng, Fuzheng Zhang, Zihan Zheng, Yang Xiang, ","In this paper, we propose a novel Deep Reinforcement Learning framework for news recommendation. Online personalized news recommendation is a highly challenging problem due to the dynamic nature of news features and user preferences. Although some online recommendation models have been proposed to address the dynamic nature of news recommendation, these methods have three major issues. First, they only try to model current reward (e.g., Click Through Rate). Second, very few studies consider to use user feedback other than click / no click labels (e.g., how frequent user returns) to help improve recommendation. Third, these methods tend to keep recommending similar news to users, which may cause users to get bored. Therefore, to address the aforementioned challenges, we propose a Deep Q-Learning based recommendation framework, which can model future reward explicitly. We further consider user return pattern as a supplement to click / no click label in order to capture more user feedback information. In addition, an effective exploration strategy is incorporated to find new attractive news for users. Extensive experiments are conducted on the offline dataset and online production environment of a commercial news recommendation application and have shown the superior performance of our methods."
