conference,url,title,authors,abstract
www,https://dl.acm.org/doi/pdf/10.1145/3178876.3186000,HighLife: Higher-arity Fact Harvesting,"Patrick Ernst, Amy Siu, Gerhard Weikum, ","Text-based knowledge extraction methods for populating knowledge bases have focused on binary facts: relationships between two entities. However, in advanced domains such as health, it is often crucial to consider ternary and higher-arity relations. An example is to capture which drug is used for which disease at which dosage (e.g. 2.5 mg/day) for which kinds of patients (e.g., children vs. adults). In this work, we present an approach to harvest higher-arity facts from textual sources. Our method is distantly supervised by seed facts, and uses the fact-pattern duality principle to gather fact candidates with high recall. For high precision, we devise a constraint-based reasoning method to eliminate false candidates. A major novelty is in coping with the difficulty that higher-arity facts are often expressed only partially in texts and strewn across multiple sources. For example, one sentence may refer to a drug, a disease and a group of patients, whereas another sentence talks about the drug, its dosage and the target group without mentioning the disease. Our methods cope well with such partially observed facts, at both pattern-learning and constraint-reasoning stages. Experiments with health-related documents and with news articles demonstrate the viability of our method."
www,https://dl.acm.org/doi/pdf/10.1145/3178876.3186001,Content Attention Model for Aspect Based Sentiment Analysis,"Qiao Liu, Haibin Zhang, Yifu Zeng, Ziqi Huang, Zufeng Wu, ","Aspect based sentiment classification is a crucial task for sentiment analysis. Recent advances in neural attention models demonstrate that they can be helpful in aspect based sentiment classification tasks, which can help identify the focus words in human. However, according to our empirical study, prevalent content attention mechanisms proposed for aspect based sentiment classification mostly focus on identifying the sentiment words or shifters, without considering the relevance of such words with respect to the given aspects in the sentence. Therefore, they are usually insufficient for dealing with multi-aspect sentences and the syntactically complex sentence structures. To solve this problem, we propose a novel content attention based aspect based sentiment classification model, with two attention enhancing mechanisms: sentence-level content attention mechanism is capable of capturing the important information about given aspects from a global perspective, whiles the context attention mechanism is responsible for simultaneously taking the order of the words and their correlations into account, by embedding them into a series of customized memories. Experimental results demonstrate that our model outperforms the state-of-the-art, in which the proposed mechanisms play a key role."
www,https://dl.acm.org/doi/pdf/10.1145/3178876.3186002,Financing the Web of Data with Delayed-Answer Auctions,"Tobias Grubenmann, Abraham Bernstein, Dmitry Moor, ","The World Wide Web is a massive network of interlinked documents. One of the reasons the World Wide Web is so successful is the fact that most content is available free of any charge. Inspired by the success of the World Wide Web, the Web of Data applies the same strategy of interlinking to data. To this point, most of data in the Web of Data is also free of charge. The fact that the data is freely available raises the question of financing these services, however. As we will discuss in this paper, advertisement and donations cannot easily be applied to this new setting. To create incentives to subsidize data providers, we propose that sponsors should pay the providers to promote sponsored data. In return, sponsored data will be privileged over non-sponsored data. Since it is not possible to enforce a certain ordering on the data the user will receive, we propose to split up the data into different batches and deliver these batches with different delays. In this way, we can privilege sponsored data without withholding any non-sponsored data from the user. In this paper, we introduce a new concept of a delayed-answer auction, where sponsors can pay to prioritize their data. We introduce a new model which captures the particular situation when a user access data in the Web of Data. We show how the weighted Vickrey-Clarke-Groves auction mechanism can be applied to our scenario and we discuss how certain parameters can influence the nature of our auction. With our new concept, we build a first step to a free yet financial sustainable Web of Data."
www,https://dl.acm.org/doi/pdf/10.1145/3178876.3186003,Estimating the Cardinality of Conjunctive Queries over RDF Data Using Graph Summarisation,"Giorgio Stefanoni, Boris Motik, Egor V. Kostylev, ","Estimating the cardinality (i.e., the number of answers) of conjunctive queries is particularly difficult in RDF systems: queries over RDF data are navigational and thus tend to involve many joins. We present a new, principled cardinality estimation technique based on graph summarisation. We interpret a summary of an RDF graph using a possible world semantics and formalise the estimation problem as computing the expected cardinality over all RDF graphs represented by the summary, and we present a closed-form formula for computing the expectation of arbitrary queries. We also discuss approaches to RDF graph summarisation. Finally, we show empirically that our cardinality technique is more accurate and more consistent, often by orders of magnitude, than the state of the art."
www,https://dl.acm.org/doi/pdf/10.1145/3178876.3186004,Never-Ending Learning for Open-Domain Question Answering over Knowledge Bases,"Abdalghani Abujabal, Rishiraj Saha Roy, Mohamed Yahya, Gerhard Weikum, ","Translating natural language questions to semantic representations such as SPARQL is a core challenge in open-domain question answering over knowledge bases (KB-QA). Existing methods rely on a clear separation between an offline training phase, where a model is learned, and an online phase where this model is deployed. Two major shortcomings of such methods are that (i) they require access to a large annotated training set that is not always readily available and (ii) they fail on questions from before-unseen domains. To overcome these limitations, this paper presents NEQA, a continuous learning paradigm for KB-QA. Offline, NEQA automatically learns templates mapping syntactic structures to semantic ones from a small number of training question-answer pairs. Once deployed, continuous learning is triggered on cases where templates are insufficient. Using a semantic similarity function between questions and by judicious invocation of non-expert user feedback, NEQA learns new templates that capture previously-unseen syntactic structures. This way, NEQA gradually extends its template repository. NEQA periodically re-trains its underlying models, allowing it to adapt to the language used after deployment. Our experiments demonstrate NEQA's viability, with steady improvement in answering quality over time, and the ability to answer questions from new domains."
www,https://dl.acm.org/doi/pdf/10.1145/3178876.3186005,Large-Scale Hierarchical Text Classification with Recursively Regularized Deep Graph-CNN,"Hao Peng, Jianxin Li, Yu He, Yaopeng Liu, Mengjiao Bao, ","Text classification to a hierarchical taxonomy of topics is a common and practical problem. Traditional approaches simply use bag-of-words and have achieved good results. However, when there are a lot of labels with different topical granularities, bag-of-words representation may not be enough. Deep learning models have been proven to be effective to automatically learn different levels of representations for image data. It is interesting to study what is the best way to represent texts. In this paper, we propose a graph-CNN based deep learning model to first convert texts to graph-of-words, and then use graph convolution operations to convolve the word graph. Graph-of-words representation of texts has the advantage of capturing non-consecutive and long-distance semantics. CNN models have the advantage of learning different level of semantics. To further leverage the hierarchy of labels, we regularize the deep architecture with the dependency among labels. Our results on both RCV1 and NYTimes datasets show that we can significantly improve large-scale hierarchical text classification over traditional hierarchical text classification and existing deep models."
www,https://dl.acm.org/doi/pdf/10.1145/3178876.3186006,Estimating Rule Quality for Knowledge Base Completion with the Relationship between Coverage Assumption,"Kaja Zupanc, Jesse Davis, ","Currently, there are many large, automatically constructed knowledge bases (KBs). One interesting task is learning from a knowledge base to generate new knowledge either in the form of inferred facts or rules that define regularities. One challenge for learning is that KBs are necessarily open world: we cannot assume anything about the truth values of tuples not included in the KB. When a KB only contains facts (i.e., true statements), which is typically the case, we lack negative examples, which are often needed by learning algorithms. To address this problem, we propose a novel score function for evaluating the quality of a first-order rule learned from a KB. Our metric attempts to include information about the tuples not in the KB when evaluating the quality of a potential rule. Empirically, we find that our metric results in more precise predictions than previous approaches."
www,https://dl.acm.org/doi/pdf/10.1145/3178876.3186007,Improving Word Embedding Compositionality using Lexicographic Definitions,"Thijs Scheepers, Evangelos Kanoulas, Efstratios Gavves, ","We present an in-depth analysis of four popular word embeddings (Word2Vec, GloVe, fastText and Paragram) in terms of their semantic compositionality. In addition, we propose a method to tune these embeddings towards better compositionality. We find that training the existing embeddings to compose lexicographic definitions improves their performance in this task significantly, while also getting similar or better performance in both word similarity and sentence embedding evaluations. Our method tunes word embeddings using a simple neural network architecture with definitions and lemmas from WordNet. Since dictionary definitions are semantically similar to their associated lemmas, they are the ideal candidate for our tuning method, as well as evaluating for compositionality. Our architecture allows for the embeddings to be composed using simple arithmetic operations, which makes these embeddings specifically suitable for production applications such as web search and data mining. We also explore more elaborate and involved compositional models. In our analysis, we evaluate original embeddings, as well as tuned embeddings, using existing word similarity and sentence embedding evaluation methods. Aside from these evaluation methods used in related work, we also evaluate embeddings using a ranking method which tests composed vectors using the lexicographic definitions already mentioned. In contrast to other evaluation methods, ours is not invariant to the magnitude of the embedding vector, which we show is important for composition. We consider this new evaluation method, called CompVecEval, to be a key contribution."
www,https://dl.acm.org/doi/pdf/10.1145/3178876.3186008,Browserless Web Data Extraction: Challenges and Opportunities,"Ruslan R. Fayzrakhmanov, Emanuel Sallinger, Ben Spencer, ","Most modern web scrapers use an embedded browser to render web pages and to simulate user actions. Such scrapers (or wrappers) are therefore expensive to execute, in terms of time and network traffic. In contrast, it is magnitudes more resource-efficient to use a ""browserless"" wrapper which directly accesses a web server through HTTP requests, and takes the desired data directly from the raw replies. However, creating and maintaining browserless wrappers of high precision requires specialists, and is prohibitively labor-intensive at scale. In this paper, we demonstrate the principal feasibility of automatically translating browser-based wrappers into ""browserless"" wrappers. We present the first algorithm and system performing such an automated translation on suitably restricted types of web sites. This system works in the vast majority of test cases and produces very fast and extremely resource-efficient wrappers. We discuss research challenges for extending our approach to a general method applicable to a yet larger number of cases."
www,https://dl.acm.org/doi/pdf/10.1145/3178876.3186009,Short-Text Topic Modeling via Non-negative Matrix Factorization Enriched with Local Word-Context Correlations,"Tian Shi, Kyeongpil Kang, Jaegul Choo, Chandan K. Reddy, ","Being a prevalent form of social communications on the Internet, billions of short texts are generated everyday. Discovering knowledge from them has gained a lot of interest from both industry and academia. The short texts have a limited contextual information, and they are sparse, noisy and ambiguous, and hence, automatically learning topics from them remains an important challenge. To tackle this problem, in this paper, we propose a semantics-assisted non-negative matrix factorization (SeaNMF) model to discover topics for the short texts. It effectively incorporates the word-context semantic correlations into the model, where the semantic relationships between the words and their contexts are learned from the skip-gram view of the corpus. The SeaNMF model is solved using a block coordinate descent algorithm. We also develop a sparse variant of the SeaNMF model which can achieve a better model interpretability. Extensive quantitative evaluations on various real-world short text datasets demonstrate the superior performance of the proposed models over several other state-of-the-art methods in terms of topic coherence and classification accuracy. The qualitative semantic analysis demonstrates the interpretability of our models by discovering meaningful and consistent topics. With a simple formulation and the superior performance, SeaNMF can be an effective standard topic model for short texts."
www,https://dl.acm.org/doi/pdf/10.1145/3178876.3186010,Are All People Married?: Determining Obligatory Attributes in Knowledge Bases,"Jonathan Lajus, Fabian M. Suchanek, ","An attribute is obligatory for a class in a Knowledge Base (KB), if all instances of the class have the attribute in the real world. For example, has­Birth­Date is an obligatory attribute for the class Person, while has ­ Spouse is not. In this paper, we propose a new way to model incompleteness in KBs. From this model, we derive a method to automatically determine obligatory attributes -- using only the data from the KB. Our algorithm can detect such attributes with a precision of up to 90%."
www,https://dl.acm.org/doi/pdf/10.1145/3178876.3186011,Socioeconomic Dependencies of Linguistic Patterns in Twitter: a Multivariate Analysis,"Jacob Levy Abitbol, Márton Karsai, Jean-Philippe Magué, ","Our usage of language is not solely reliant on cognition but is arguably determined by myriad external factors leading to a global variability of linguistic patterns. This issue, which lies at the core of sociolinguistics and is backed by many small-scale studies on face-to-face communication, is addressed here by constructing a dataset combining the largest French Twitter corpus to date with detailed socioeconomic maps obtained from national census in France. We show how key linguistic variables measured in individual Twitter streams depend on factors like socioeconomic status, location, time, and the social network of individuals. We found that (i) people of higher socioeconomic status, active to a greater degree during the daytime, use a more standard language; (ii) the southern part of the country is more prone to use more standard language than the northern one, while locally the used variety or dialect is determined by the spatial distribution of socioeconomic status; and (iii) individuals connected in the social network are closer linguistically than disconnected ones, even after the effects of status homophily have been removed. Our results inform sociolinguistic theory and may inspire novel learning methods for the inference of socioeconomic status of people from the way they tweet."
www,https://dl.acm.org/doi/pdf/10.1145/3178876.3186012,An Attention Factor Graph Model for Tweet Entity Linking,"Chenwei Ran, Wei Shen, Jianyong Wang, ","The rapid expansion of Twitter has attracted worldwide attention. With more than 500 million tweets posted per day, Twitter becomes an invaluable information and knowledge source. Many Twitter related tasks have been studied, such as event extraction, hashtag recommendation, and topic detection. A critical step in understanding and mining information from Twitter is to disambiguate entities in tweets, i.e., tweet entity linking. It is a challenging task because tweets are short, noisy, and fresh. Many tweet-specific signals have been found to solve the tweet entity linking problem, such as user interest, temporal popularity, location information and so on. However, two common weaknesses exist in previous work. First, most proposed models are not flexible and extendable to fit new signals. Second, their scalability is not good enough to handle the large-scale social network like Twitter. In this work, we formalize the tweet entity linking problem into a factor graph model which has shown its effectiveness and efficiency in many other applications. We also propose selective attention over entities to increase the scalability of our model, which brings linear complexity. To adopt the attention mechanism in the factor graph, we propose a new type of nodes called pseudo-variable nodes to solve the asymmetry attention problem caused by the undirected characteristic of the factor graph. We evaluated our model on two different manually annotated tweet datasets. The experimental results show that our model achieves better performance in terms of both effectiveness and efficiency compared with the state-of-the-art approaches."
www,https://dl.acm.org/doi/pdf/10.1145/3178876.3186013,Find the Conversation Killers: A Predictive Study of Thread-ending Posts,"Yunhao Jiao, Cheng Li, Fei Wu, Qiaozhu Mei, ","How to improve the quality of conversations in online communities has attracted considerable attention recently. Having engaged, civil, and reactive online conversations has a critical effect on the social life of Internet users. In this study, we are particularly interested in identifying a post in a multi-party conversation that is unlikely to be further replied to, which therefore kills that thread of the conversation. For this purpose, we propose a deep learning model called the ConverNet. ConverNet is attractive due to its capability of modeling the internal structure of a long conversation and its appropriate encoding of the contextual information of the conversation, through effective integration of attention mechanisms. Empirical experiments on real-world datasets demonstrate the effectiveness of the proposed model. For the widely concerned topic, our analysis also offers implications for how to improve the quality and user experience of online conversations, or how to engage users in a conversation with a chatbot."
www,https://dl.acm.org/doi/pdf/10.1145/3178876.3186014,Semantics and Complexity of GraphQL,"Olaf Hartig, Jorge Pérez, ","GraphQL is a recently proposed, and increasingly adopted, conceptual framework for providing a new type of data access interface on the Web. The framework includes a new graph query language whose semantics has been specified informally only. This has prevented the formal study of the main properties of the language. We embark on the formalization and study of GraphQL. To this end, we first formalize the semantics of GraphQL queries based on a labeled-graph data model. Thereafter, we analyze the language and show that it admits really efficient evaluation methods. In particular, we prove that the complexity of the GraphQL evaluation problem is NL-complete. Moreover, we show that the enumeration problem can be solved with constant delay. This implies that a server can answer a GraphQL query and send the response byte-by-byte while spending just a constant amount of time between every byte sent. Despite these positive results, we prove that the size of a GraphQL response might be prohibitively large for an internet scenario. We present experiments showing that current practical implementations suffer from this issue. We provide a solution to cope with this problem by showing that the total size of a GraphQL response can be computed in polynomial time. Our results on polynomial-time size computation plus the constant-delay enumeration can help developers to provide more robust GraphQL interfaces on the Web."
www,https://dl.acm.org/doi/pdf/10.1145/3178876.3186015,Sentiment Analysis by Capsules,"Yequan Wang, Aixin Sun, Jialong Han, Ying Liu, Xiaoyan Zhu, ","In this paper, we propose RNN-Capsule, a capsule model based on Recurrent Neural Network (RNN) for sentiment analysis. For a given problem, one capsule is built for each sentiment category e.g., 'positive' and 'negative'. Each capsule has an attribute, a state, and three modules: representation module, probability module, and reconstruction module. The attribute of a capsule is the assigned sentiment category. Given an instance encoded in hidden vectors by a typical RNN, the representation module builds capsule representation by the attention mechanism. Based on capsule representation, the probability module computes the capsule's state probability. A capsule's state is active if its state probability is the largest among all capsules for the given instance, and inactive otherwise. On two benchmark datasets (i.e., Movie Review and Stanford Sentiment Treebank) and one proprietary dataset (i.e., Hospital Feedback), we show that RNN-Capsule achieves state-of-the-art performance on sentiment classification. More importantly, without using any linguistic knowledge, RNN-Capsule is capable of outputting words with sentiment tendencies reflecting capsules' attributes. The words well reflect the domain specificity of the dataset."
www,https://dl.acm.org/doi/pdf/10.1145/3178876.3186016,Modelling Dynamics in Semantic Web Knowledge Graphs with Formal Concept Analysis,"Larry González, Aidan Hogan, ","In this paper, we propose a novel data-driven schema for large-scale heterogeneous knowledge graphs inspired by Formal Concept Analysis (FCA). We first extract the sets of properties associated with individual entities; these property sets (aka. characteristic sets) are annotated with cardinalities and used to induce a lattice based on set-containment relations, forming a natural hierarchical structure describing the knowledge graph. We then propose an algebra over such schema lattices, which allows to compute diffs between lattices (for example, to summarise the changes from one version of a knowledge graph to another), to add lattices (for example, to project future changes), and so forth. While we argue that this lattice structure (and associated algebra) may have various applications, we currently focus on the use-case of modelling and predicting the dynamic behaviour of knowledge graphs. Along those lines, we instantiate and evaluate our methods for analysing how versions of the Wikidata knowledge graph have changed over a period of 11 weeks. We propose algorithms for constructing the lattice-based schema from Wikidata, and evaluate their efficiency and scalability. We then evaluate use of the resulting schema(ta) for predicting how the knowledge graph will evolve in future versions."
www,https://dl.acm.org/doi/pdf/10.1145/3178876.3186017,Scalable Instance Reconstruction in Knowledge Bases via Relatedness Affiliated Embedding,"Richong Zhang, Junpeng Li, Jiajie Mei, Yongyi Mao, ","The knowledge base (KB) completion problem is usually formulated as a link prediction problem. Such formulation is incapable of capturing certain application scenarios when the KB contains multi-fold relations. In this paper, we present a new formulation of KB completion, called instance reconstruction. Unlike its link-prediction counterpart, which has linear complexity in the size of the KB, this problem has its complexity behave as a high-degree polynomial. This presents a significant challenge in developing scalable instance reconstruction algorithms. In this paper, we present a novel knowledge embedding model (RAE) and build on it an instance reconstruction algorithm (SIR). The SIR algorithm utilizes schema-based filtering as well as ""relatedness"" filtering for complexity reduction. Here relatedness refers to the likelihood that two entities co-participate in a common instance, and the relatedness metric is learned from the RAE model. We show experimentally that SIR significantly reduces computation complexity without sacrificing reconstruction performance. The complexity reduction corresponds to reducing the KB size by 100 to 1000 folds."
