conference,url,title,authors,abstract
www,https://dl.acm.org/doi/pdf/10.1145/1963405.1963460,A stochastic learning-to-rank algorithm and its application to contextual advertising,"Maryam Karimzadehgan, Wei Li, Ruofei Zhang, Jianchang Mao, ","This paper is concerned with the problem of learning a model to rank objects (Web pages, ads and etc.). We propose a framework where the ranking model is both optimized and evaluated using the same information retrieval measures such as Normalized Discounted Cumulative Gain (NDCG) and Mean Average Precision (MAP). The main difficulty in direct optimization of NDCG and MAP is that these measures depend on the rank of objects and are not differentiable. Most learning-to-rank methods that attempt to optimize NDCG or MAP approximate such measures so that they can be differentiable. In this paper, we propose a simple yet effective stochastic optimization algorithm to directly minimize any loss function, which can be defined on NDCG or MAP for the learning-to-rank problem. The algorithm employs Simulated Annealing along with Simplex method for its parameter search and finds the global optimal parameters. Experiment results using NDCG-Annealing algorithm, an instance of the proposed algorithm, on LETOR benchmark data sets show that the proposed algorithm is both effective and stable when compared to the baselines provided in LETOR 3.0. In addition, we applied the algorithm for ranking ads in contextual advertising. Our method has shown to significantly improve relevance in offline evaluation and business metrics in online tests in a real large-scale advertising serving system. To scale our computations, we parallelize the algorithm in a MapReduce framework running on Hadoop."
www,https://dl.acm.org/doi/pdf/10.1145/1963405.1963461,Parallel boosted regression trees for web search ranking,"Stephen Tyree, Kilian Q. Weinberger, Kunal Agrawal, Jennifer Paykin, ","Gradient Boosted Regression Trees (GBRT) are the current state-of-the-art learning paradigm for machine learned web-search ranking - a domain notorious for very large data sets. In this paper, we propose a novel method for parallelizing the training of GBRT. Our technique parallelizes the construction of the individual regression trees and operates using the master-worker paradigm as follows. The data are partitioned among the workers. At each iteration, the worker summarizes its data-partition using histograms. The master processor uses these to build one layer of a regression tree, and then sends this layer to the workers, allowing the workers to build histograms for the next layer. Our algorithm carefully orchestrates overlap between communication and computation to achieve good performance."
www,https://dl.acm.org/doi/pdf/10.1145/1963405.1963463,Evaluating new search engine configurations with pre-existing judgments and clicks,"Umut Ozertem, Rosie Jones, Benoit Dumoulin, ","We provide a novel method of evaluating search results, which allows us to combine existing editorial judgments with the relevance estimates generated by click-based user browsing models. There are evaluation methods in the literature that use clicks and editorial judgments together, but our approach is novel in the sense that it allows us to predict the impact of unseen search models without online tests to collect clicks and without requesting new editorial data, since we are only re-using existing editorial data, and clicks observed for previous result set configurations. Since the user browsing model and the pre-existing editorial data cannot provide relevance estimates for all documents for the selected set of queries, one important challenge is to obtain this performance estimation where there are a lot of ranked documents with missing relevance values. We introduce a query and rank based smoothing to overcome this problem. We show that a hybrid of these smoothing techniques performs better than both query and position based smoothing, and despite the high percentage of missing judgments, the resulting method is significantly correlated (0.74) with DCG values evaluated using fully judged datasets, and approaches inter-annotator agreement. We show that previously published techniques, applicable to frequent queries, degrade when applied to a random sample of queries, with a correlation of only 0.29. While our experiments focus on evaluation using DCG, our method is also applicable to other commonly used metrics."
www,https://dl.acm.org/doi/pdf/10.1145/1963405.1963464,On the informativeness of cascade and intent-aware effectiveness measures,"Azin Ashkan, Charles L.A. Clarke, ","The Maximum Entropy Method provides one technique for validating search engine effectiveness measures. Under this method, the value of an effectiveness measure is used as a constraint to estimate the most likely distribution of relevant documents under a maximum entropy assumption. This inferred distribution may then be compared to the actual distribution to quantify the ""informativeness"" of the measure. The inferred distribution may also be used to estimate values for other effectiveness measures. Previous work focused on traditional effectiveness measures, such as average precision. In this paper, we extend the Maximum Entropy Method to the newer cascade and intent-aware effectiveness measures by considering the dependency of the documents ranked in a results list. These measures are intended to reflect the novelty and diversity of search results in addition to the traditional relevance. Our results indicate that intent-aware measures based on the cascade model are informative in terms of both inferring actual distribution and predicting the values of other retrieval measures."
www,https://dl.acm.org/doi/pdf/10.1145/1963405.1963465,Pragmatic evaluation of folksonomies,"Denis Helic, Markus Strohmaier, Christoph Trattner, Markus Muhr, ","Recently, a number of algorithms have been proposed to obtain hierarchical structures - so-called folksonomies - from social tagging data. Work on these algorithms is in part driven by a belief that folksonomies are useful for tasks such as: (a) Navigating social tagging systems and (b) Acquiring semantic relationships between tags. While the promises and pitfalls of the latter have been studied to some extent, we know very little about the extent to which folksonomies are pragmatically useful for navigating social tagging systems. This paper sets out to address this gap by presenting and applying a pragmatic framework for evaluating folksonomies. We model exploratory navigation of a tagging system as decentralized search on a network of tags. Evaluation is based on the fact that the performance of a decentralized search algorithm depends on the quality of the background knowledge used. The key idea of our approach is to use hierarchical structures learned by folksonomy algorithm as background knowledge for decentralized search. Utilizing decentralized search on tag networks in combination with different folksonomies as hierarchical background knowledge allows us to evaluate navigational tasks in social tagging systems. Our experiments with four state-of-the-art folksonomy algorithms on five different social tagging datasets reveal that existing folksonomy algorithms exhibit significant, previously undiscovered, differences with regard to their utility for navigation. Our results are relevant for engineers aiming to improve navigability of social tagging systems and for scientists aiming to evaluate different folksonomy algorithms from a pragmatic perspective."
www,https://dl.acm.org/doi/pdf/10.1145/1963405.1963467,SEISA: set expansion by iterative similarity aggregation,"Yeye He, Dong Xin, ","In this paper, we study the problem of expanding a set of given seed entities into a more complete set by discovering other entities that also belong to the same concept set. A typical example is to use ""Canon"" and ""Nikon"" as seed entities, and derive other entities (e.g., ""Olympus"") in the same concept set of camera brands. In order to discover such relevant entities, we exploit several web data sources, including lists extracted from web pages and user queries from a web search engine. While these web data are highly diverse with rich information that usually cover a wide range of the domains of interest, they tend to be very noisy. We observe that previously proposed random walk based approaches do not perform very well on these noisy data sources. Accordingly, we propose a new general framework based on iterative similarity aggregation, and present detailed experimental results to show that, when using general-purpose web data for set expansion, our approach outperforms previous techniques in terms of both precision and recall."
www,https://dl.acm.org/doi/pdf/10.1145/1963405.1963468,Highly efficient algorithms for structural clustering of large websites,"Lorenzo Blanco, Nilesh Dalvi, Ashwin Machanavajjhala, ","In this paper, we present a highly scalable algorithm for structurally clustering webpages for extraction. We show that, using only the URLs of the webpages and simple content features, it is possible to cluster webpages effectively and efficiently. At the heart of our techniques is a principled framework, based on the principles of information theory, that allows us to effectively leverage the URLs, and combine them with content and structural properties. Using an extensive evaluation over several large full websites, we demonstrate the effectiveness of our techniques, at a scale unattainable by previous techniques."
www,https://dl.acm.org/doi/pdf/10.1145/1963405.1963469,SCAD: collective discovery of attribute values,"Anton Bakalov, Ariel Fuxman, Partha Pratim Talukdar, Soumen Chakrabarti, ","Search engines today offer a rich user experience, no longer restricted to ""ten blue links"". For example, the query ""Canon EOS Digital Camera"" returns a photo of the digital camera, and a list of suitable merchants and prices. Similar results are offered in other domains like food, entertainment, travel, etc. All these experiences are fueled by the availability of structured data about the entities of interest."
www,https://dl.acm.org/doi/pdf/10.1145/1963405.1963471,"Track globally, deliver locally: improving content delivery networks by tracking geographic social cascades","Salvatore Scellato, Cecilia Mascolo, Mirco Musolesi, Jon Crowcroft, ","Providers such as YouTube offer easy access to multimedia content to millions, generating high bandwidth and storage demand on the Content Delivery Networks they rely upon. More and more, the diffusion of this content happens on online social networks such as Facebook and Twitter, where social cascades can be observed when users increasingly repost links they have received from others."
www,https://dl.acm.org/doi/pdf/10.1145/1963405.1963472,Measuring a commercial content delivery network,"Sipat Triukose, Zhihua Wen, Michael Rabinovich, ","Content delivery networks (CDNs) have become a crucial part of the modern Web infrastructure. This paper studies the performance of the leading content delivery provider - Akamai. It measures the performance of the current Akamai platform and considers a key architectural question faced by both CDN designers and their prospective customers: whether the co-location approach to CDN platforms adopted by Akamai, which tries to deploy servers in numerous Internet locations, brings inherent performance benefits over a more consolidated data center approach pursued by other influential CDNs such as Limelight. We believe the methodology we developed for this study will be useful for other researchers in the CDN arena."
www,https://dl.acm.org/doi/pdf/10.1145/1963405.1963473,Turkalytics: analytics for human computation,"Paul Heymann, Hector Garcia-Molina, ","We present ""Turkalytics,"" a novel analytics tool for human computation systems. Turkalytics processes and reports logging events from workers in real-time and has been shown to scale to over one hundred thousand logging events per day. We present a state model for worker interaction that covers the Mechanical Turk (the SCRAP model) and a data model that demonstrates the diversity of data collected by Turkalytics. We show that Turkalytics is effective at data collection, in spite of it being unobtrusive. Lastly, we describe worker locations, browser environments, activity information, and other examples of data collected by our tool."
www,https://dl.acm.org/doi/pdf/10.1145/1963405.1963475,Inverted index compression via online document routing,"Gal Lavee, Ronny Lempel, Edo Liberty, Oren Somekh, ","Modern search engines are expected to make documents searchable shortly after they appear on the ever changing Web. To satisfy this requirement, the Web is frequently crawled. Due to the sheer size of their indexes, search engines distribute the crawled documents among thousands of servers in a scheme called local index-partitioning, such that each server indexes only several million pages. To ensure documents from the same host (e.g., www.nytimes.com) are distributed uniformly over the servers, for load balancing purposes, random routing of documents to servers is common. To expedite the time documents become searchable after being crawled, documents may be simply appended to the existing index partitions. However, indexing by merely appending documents, results in larger index sizes since document reordering for index compactness is no longer performed. This, in turn, degrades search query processing performance which depends heavily on index sizes."
www,https://dl.acm.org/doi/pdf/10.1145/1963405.1963476,Efficiently evaluating graph constraints in content-based publish/subscribe,"Andrei Broder, Shirshanka Das, Marcus Fontoura, Bhaskar Ghosh, ","We introduce the problem of evaluating graph constraints in content-based publish/subscribe (pub/sub) systems. This problem formulation extends traditional content-based pub/sub systems in the following manner: publishers and subscribers are connected via a (logical) directed graph G with node and edge constraints, which limits the set of valid paths between them. Such graph constraints can be used to model a Web advertising exchange (where there may be restrictions on how advertising networks can connect advertisers and publishers) and content delivery problems in social networks (where there may be restrictions on how information can be shared via the social graph). In this context, we develop efficient algorithms for evaluating graph constraints over arbitrary directed graphs G. We also present experimental results that demonstrate the effectiveness and scalability of the proposed algorithms using a realistic dataset from Yahoo!'s Web advertising exchange."
www,https://dl.acm.org/doi/pdf/10.1145/1963405.1963477,FACTO: a fact lookup engine based on web tables,"Xiaoxin Yin, Wenzhao Tan, Chao Liu, ","Recently answers for fact lookup queries have appeared on major search engines. For example, for the query Barack Obama date of birth Google directly shows ""4 August 1961"" above its regular results. In this paper, we describe FACTO, an end-to-end system for answering fact lookup queries for web search. FACTO extracts structured data from tables on the web, aggregates and cleans such data and stores them in a database. Given a web search query, FACTO will decide if it asks for facts in this database, and provides the most confident answer when possible. FACTO achieves higher precision and comparable coverage comparing with the fact lookup engines by Google and Ask.com, although FACTO is developed by a very small team. We present the challenges and our solutions in developing every component of FACTO. Some solutions are based on existing technologies, and many others are novel approaches proposed by us."
www,https://dl.acm.org/doi/pdf/10.1145/1963405.1963479,We know who you followed last summer: inferring social link creation times in twitter,"Brendan Meeder, Brian Karrer, Amin Sayedi, R. Ravi, Christian Borgs, ","Understanding a network's temporal evolution appears to require multiple observations of the graph over time. These often expensive repeated crawls are only able to answer questions about what happened from observation to observation, and not what happened before or between network snapshots. Contrary to this picture, we propose a method for Twitter's social network that takes a single static snapshot of network edges and user account creation times to accurately infer when these edges were formed. This method can be exact in theory, and we demonstrate empirically for a large subset of Twitter relationships that it is accurate to within a few hours in practice."
www,https://dl.acm.org/doi/pdf/10.1145/1963405.1963480,Modeling the temporal dynamics of social rating networks using bidirectional effects of social relations and rating patterns,"Mohsen Jamali, Gholamreza Haffari, Martin Ester, ","A social rating network (SRN) is a social network in which edges represent social relationships and users (nodes) express ratings on some of the given items. Such networks play an increasingly important role in reviewing websites such as Epinions.com or online sharing websites like Flickr.com. In this paper, we first observe and analyze the temporal behavior of users in a social rating network, who express ratings and create social relations. Then, we model the temporal dynamics of an SRN based on our observations, using the bidirectional effects of ratings and social relations. While existing models for other types of social networks have captured some of the effects, our model is the first one to represent all four effects, i.e. social relations-on-ratings (social influence), social relations-on-social relations (transitivity), ratings-on-social relations (selection), and ratings-on-ratings (correlational influence). Existing works consider these effects as static and constant throughout the evolution of an SRN, however our observations reveal that these effects are actually dynamic. We propose a probabilistic generative model for SRNs, which models the strength and dynamics of each effect throughout the network evolution. This model can serve for the prediction of future links, ratings or community structures. Due to the sensitive nature of SRNs, another motivation for our work is the generation of synthetic SRN data sets for research purposes. Our experimental studies on two real life datasets (Epinions and Flickr) demonstrate that the proposed model produces social rating networks that agree with real world data on a comprehensive set of evaluation criteria."
www,https://dl.acm.org/doi/pdf/10.1145/1963405.1963481,Like like alike: joint friendship and interest propagation in social networks,"Shuang-Hong Yang, Bo Long, Alex Smola, Narayanan Sadagopan, ","Targeting interest to match a user with services (e.g. news, products, games, advertisements) and predicting friendship to build connections among users are two fundamental tasks for social network systems. In this paper, we show that the information contained in interest networks (i.e. user-service interactions) and friendship networks (i.e. user-user connections) is highly correlated and mutually helpful. We propose a framework that exploits homophily to establish an integrated network linking a user to interested services and connecting different users with common interests, upon which both friendship and interests could be efficiently propagated. The proposed friendship-interest propagation (FIP) framework devises a factor-based random walk model to explain friendship connections, and simultaneously it uses a coupled latent factor model to uncover interest interactions. We discuss the flexibility of the framework in the choices of loss objectives and regularization penalties and benchmark different variants on the Yahoo! Pulse social networking system. Experiments demonstrate that by coupling friendship with interest, FIP achieves much higher performance on both interest targeting and friendship prediction than systems using only one source of information."
www,https://dl.acm.org/doi/pdf/10.1145/1963405.1963483,Dynamics of bidding in a P2P lending service: effects of herding and predicting loan success,"Simla Ceyhan, Xiaolin Shi, Jure Leskovec, ","Online peer-to-peer (P2P) lending services are a new type of social platform that enables individuals borrow and lend money directly from one to another. In this paper, we study the dynamics of bidding behavior in a P2P loan auction website, Prosper.com. We investigate the change of various attributes of loan requesting listings over time, such as the interest rate and the number of bids. We observe that there is herding behavior during bidding, and for most of the listings, the numbers of bids they receive reach spikes at very similar time points. We explain these phenomena by showing that there are economic and social factors that lenders take into account when deciding to bid on a listing. We also observe that the profits the lenders make are tied with their bidding preferences. Finally, we build a model based on the temporal progression of the bidding, that reliably predicts the success of a loan request listing, as well as whether a loan will be paid back or not."
www,https://dl.acm.org/doi/pdf/10.1145/1963405.1963484,Finding hierarchy in directed online social networks,"Mangesh Gupte, Pravin Shankar, Jing Li, S. Muthukrishnan, Liviu Iftode, ","Social hierarchy and stratification among humans is a well studied concept in sociology. The popularity of online social networks presents an opportunity to study social hierarchy for different types of networks and at different scales. We adopt the premise that people form connections in a social network based on their perceived social hierarchy; as a result, the edge directions in directed social networks can be leveraged to infer hierarchy. In this paper, we define a measure of hierarchy in a directed online social network, and present an efficient algorithm to compute this measure. We validate our measure using ground truth including Wikipedia notability score. We use this measure to study hierarchy in several directed online social networks including Twitter, Delicious, YouTube, Flickr, LiveJournal, and curated lists of several categories of people based on different occupations, and different organizations. Our experiments on different online social networks show how hierarchy emerges as we increase the size of the network. This is in contrast to random graphs, where the hierarchy decreases as the network size increases. Further, we show that the degree of stratification in a network increases very slowly as we increase the size of the graph."
www,https://dl.acm.org/doi/pdf/10.1145/1963405.1963485,Finding the bias and prestige of nodes in networks based on trust scores,"Abhinav Mishra, Arnab Bhattacharya, ","Many real-life graphs such as social networks and peer-to-peer networks capture the relationships among the nodes by using trust scores to label the edges. Important usage of such networks includes trust prediction, finding the most reliable or trusted node in a local subgraph, etc. For many of these applications, it is crucial to assess the prestige and bias of a node. The bias of a node denotes its propensity to trust/mistrust its neighbours and is closely related to truthfulness. If a node trusts all its neighbours, its recommendation of another node as trustworthy is less reliable. It is based on the idea that the recommendation of a highly biased node should weigh less. In this paper, we propose an algorithm to compute the bias and prestige of nodes in networks where the edge weight denotes the trust score. Unlike most other graph-based algorithms, our method works even when the edge weights are not necessarily positive. The algorithm is iterative and runs in O(km) time where k is the number of iterations and m is the total number of edges in the network. The algorithm exhibits several other desirable properties. It converges to a unique value very quickly. Also, the error in bias and prestige values at any particular iteration is bounded. Further, experiments show that our model conforms well to social theories such as the balance theory (enemy of a friend is an enemy, etc.)."
www,https://dl.acm.org/doi/pdf/10.1145/1963405.1963487,Efficient k-nearest neighbor graph construction for generic similarity measures,"Wei Dong, Charikar Moses, Kai Li, ","K-Nearest Neighbor Graph (K-NNG) construction is an important operation with many web related applications, including collaborative filtering, similarity search, and many others in data mining and machine learning. Existing methods for K-NNG construction either do not scale, or are specific to certain similarity measures. We present NN-Descent, a simple yet efficient algorithm for approximate K-NNG construction with arbitrary similarity measures. Our method is based on local search, has minimal space overhead and does not rely on any shared global index. Hence, it is especially suitable for large-scale applications where data structures need to be distributed over the network. We have shown with a variety of datasets and similarity measures that the proposed method typically converges to above 90% recall with each point comparing only to several percent of the whole dataset on average."
