conference,url,title,authors,abstract
www,https://dl.acm.org/doi/pdf/10.1145/3178876.3186043,Incentive-Compatible Diffusion,"Yakov Babichenko, Oren Dean, Moshe Tennenholtz, ","Our work bridges the literature on incentive-compatible mechanism design and the literature on diffusion algorithms. We introduce the study of finding an incentive-compatible (strategy-proof) mechanism for selecting an influential vertex in a directed graph (e.g. Twitter»s network). The goal is to devise a mechanism with a bounded ratio between the maximal influence and the influence of the selected user, and in which no user can improve its probability of being selected by following or unfollowing other users. We introduce the Two Path mechanism which is based on the idea of selecting the vertex that is the first intersection of two independent random walks in the network. The Two Path mechanism is incentive compatible on directed acyclic graphs (DAGs), and has a finite approximation ratio on natural subfamilies of DAGs. Simulations indicate that this mechanism is suitable for practical uses."
www,https://dl.acm.org/doi/pdf/10.1145/3178876.3186044,A Short-term Intervention for Long-term Fairness in the Labor Market,"Lily Hu, Yiling Chen, ","The persistence of racial inequality in the U.S. labor market against a general backdrop of formal equality of opportunity is a troubling phenomenon that has significant ramifications on the design of hiring policies. In this paper, we show that current group disparate outcomes may be immovable even when hiring decisions are bound by an input-output notion of ""individual fairness."" Instead, we construct a dynamic reputational model of the labor market that illustrates the reinforcing nature of asymmetric outcomes resulting from groups» divergent accesses to resources and as a result, investment choices. To address these disparities, we adopt a dual labor market composed of a Temporary Labor Market (TLM), in which firms» hiring strategies are constrained to ensure statistical parity of workers granted entry into the pipeline, and a Permanent Labor Market (PLM), in which firms hire top performers as desired. Individual worker reputations produce externalities for their group; the corresponding feedback loop raises the collective reputation of the initially disadvantaged group via a TLM fairness intervention that need not be permanent. We show that such a restriction on hiring practices induces an equilibrium that, under particular market conditions, Pareto-dominates those arising from strategies that statistically discriminate or employ a ""group-blind"" criterion. The enduring nature of equilibria that are both inequitable and Pareto suboptimal suggests that fairness interventions beyond procedural checks of hiring decisions will be of critical importance in a world where machines play a greater role in the employment process."
www,https://dl.acm.org/doi/pdf/10.1145/3178876.3186045,Optimizing Ad Refresh In Mobile App Advertising,"Florin Constantin, Christopher Harris, Samuel Ieong, Aranyak Mehta, Xi Tan, ","In-app advertising is a complex market worth billions of dollars per year, yet it has been studied significantly less than traditional web display ads. In this paper we study an important but often overlooked feature of ads in mobile apps (mostly absent in traditional web ads), that of ad refreshes : A user is shown a stream of banner ads during the app session, in which each ad is displayed in the ad slot for a certain amount of time (the refresh rate) before the ad-slot is refreshed to the next ad. Data analysis on our large-scale experiments that vary refresh rates reveals a surprising result, that cannot be explained by existing user click models: Varying ads» refresh almost preserves total number of clicks. We propose a new, natural, ""two-phase"" click model for this setting that explains this independence, as well as our measurements of the click-through rate as a function of the impression»s time-on-screen and of ad-repeat counts. The new click model leads to a clean formulation of the problem of auctioning the entire user-session: i.e., determining online, both the sequence of winning ads as well as the amount of time to display each one. We complement the theoretical auction design with results from a live-traffic experiment with its implementation. Our experiments and analysis provide the theoretical foundation for AdMob»s ""Google-optimized refresh rate"" feature, used by many mobile apps for better monetization of ads shown to millions of users."
www,https://dl.acm.org/doi/pdf/10.1145/3178876.3186046,Detecting Ponzi Schemes on Ethereum: Towards Healthier Blockchain Technology,"Weili Chen, Zibin Zheng, Jiahui Cui, Edith Ngai, Peilin Zheng, Yuren Zhou, ","Blockchain technology becomes increasingly popular. It also attracts scams, for example, Ponzi scheme, a classic fraud, has been found making a notable amount of money on Blockchain, which has a very negative impact. To help dealing with this issue, this paper proposes an approach to detect Ponzi schemes on blockchain by using data mining and machine learning methods. By verifying smart contracts on Ethereum, we first extract features from user accounts and operation codes of the smart contracts and then build a classification model to detect latent Ponzi schemes implemented as smart contracts. The experimental results show that the proposed approach can achieve high accuracy for practical use. More importantly, the approach can be used to detect Ponzi schemes even at the moment of its creation. By using the proposed approach, we estimate that there are more than 400 Ponzi schemes running on Ethereum. Based on these results, we propose to build a uniform platform to evaluate and monitor every created smart contract for early warning of scams."
www,https://dl.acm.org/doi/pdf/10.1145/3178876.3186047,Testing Incentive Compatibility in Display Ad Auctions,"Sébastien Lahaie, Andrés Munoz Medina, ","Consider a buyer participating in a repeated auction, such as those prevalent in display advertising. How would she test whether the auction is incentive compatible? To bid effectively, she is interested in whether the auction is single-shot incentive compatible---a pure second-price auction, with fixed reserve price---and also dynamically incentive compatible---her bids are not used to set future reserve prices. In this work we develop tests based on simple bid perturbations that a buyer can use to answer these questions, with a focus on dynamic incentive compatibility. There are many potential A/B testing setups that one could use, but we find that many natural experimental designs are, in fact, flawed. For instance, we show that additive perturbations can lead to paradoxical results, where higher bids lead to lower optimal reserve prices. We precisely characterize this phenomenon and show that reserve prices are only guaranteed to be monotone for distributions satisfying the Monotone Hazard Rate (MHR) property. The experimenter must also decide how to split traffic to apply systematic perturbations. It is tempting to have this split be randomized, but we demonstrate empirically that unless the perturbations are aligned with the partitions used by the seller to compute reserve prices, the results are guaranteed to be inconclusive. We validate our results with experiments on real display auction data and show that a buyer can quantify both single-shot and dynamic incentive compatibility even under realistic conditions where only the cost of the impression is observed (as opposed to the exact reserve price). We analyze the cost of running such experiments, exposing trade-offs between test accuracy, cost, and underlying market dynamics."
www,https://dl.acm.org/doi/pdf/10.1145/3178876.3186048,Simple vs Optimal Contests with Convex Costs,"Amy Greenwald, Takehiro Oyakawa, Vasilis Syrgkanis, ","We study an optimal contest design problem where contributors abilities are private, their costs are convex as a function of their effort, and the designer seeks to maximize their total productivity. We address the design of approximately-optimal mechanisms that are robust, in that they are independent of the ability distribution and the precise form of the cost function. We show that a very simple all-pay contest where the prize is distributed equally among the top quartile of contributors is a constant-factor approximation to the optimal, for a large class of convex cost functions, when the number of contributors is larger than some constant. This result stands in contrast to contests with linear costs, where awarding a prize to a single top contributor (""winner-takes-all»») is approximately-optimal; when costs are convex, winner-takes-all is far from optimal. We validate the performance of our approximately-optimal contest designs via simulation experiments, which uncover much better empirical performance than the worst-case guarantees. Our results are enabled by novel results in the space of optimal mechanism design with convex costs, which could be of independent interest."
www,https://dl.acm.org/doi/pdf/10.1145/3178876.3186056,Arrays of (locality-sensitive) Count Estimators (ACE): Anomaly Detection on the Edge,"Chen Luo, Anshumali Shrivastava, ","Anomaly detection is one of the frequent and important subroutines deployed in large-scale data processing applications. Even being a well-studied topic, existing techniques for unsupervised anomaly detection require storing significant amounts of data, which is prohibitive from memory, latency and privacy perspectives, especially for small mobile devices which has ultra-low memory budget and limited computational power. In this paper, we propose ACE (Arrays of (locality-sensitive) Count Estimators) algorithm that can be 60x faster than most state-of-the-art unsupervised anomaly detection algorithms. In addition, ACE has appealing privacy properties. Our experiments show that ACE algorithm has significantly smaller memory footprints (∠ 4MB in our experiments) which can exploit Level 3 cache of any modern processor. At the core of the ACE algorithm, there is a novel statistical estimator which is derived from the sampling view of Locality Sensitive Hashing (LSH). This view is significantly different and efficient than the widely popular view of LSH for near-neighbor search. We show the superiority of ACE algorithm over 11 popular baselines on 3 benchmark datasets, including the KDD-Cup99 data which is the largest available public benchmark comprising of more than half a million entries with ground truth anomaly labels."
www,https://dl.acm.org/doi/pdf/10.1145/3178876.3186057,Mile High WiFi: A First Look At In-Flight Internet Connectivity,"John P. Rula, James Newman, Fabián E. Bustamante, ","In-Flight Communication (IFC), available on a growing number of commercial flights, is often received by consumers with both awe for its mere availability and harsh criticism for its poor performance. Indeed, IFC provides Internet connectivity in some of the most challenging conditions with aircraft traveling at speeds in excess of 500 mph at 30,000 feet above the ground. Yet, while existing services do provide basic Internet \em accessibility, anecdotal reports rank their quality of service as, at best, poor. In this paper, we present the first characterization of deployed IFC systems. Using over 45 flight-hours of measurements, we profile the performance of IFC across the two dominant access technologies -- direct air-to-ground communication (DA2GC) and mobile satellite service (MSS). We show that IFC QoS is in large part determined by the high latencies inherent to DA2GC and MSS, with RTTs averaging 200ms and 750ms, respectively, and that these high latencies directly impact the performance of common applications such as web browsing. While each IFC technology is based on well studied wireless communication technologies, our findings reveal that IFC links experience further degraded link performance than their technological antecedents. We find median loss rates of 7%, and nearly 40% loss at the 90th percentile for MSS, 6.8x larger than recent characterizations of residential satellite networks. We extend our IFC study exploring the potential of the newly released HTTP/2 and QUIC protocols in an emulated IFC environment, finding that QUIC is able to improve page load times by as much as 7.9 times. In addition, we find that HTTP/2»s use of multiplexing multiple requests onto a single TCP connection performs up to 4.8x \em worse than HTTP/1.1 when faced with large numbers of objects. We use network emulation to explore proposed technological improvements to existing IFC systems finding that high link losses, and not bandwidth, account for the largest factor of performance degradation with applications such as web browsing."
www,https://dl.acm.org/doi/pdf/10.1145/3178876.3186058,DeepMove: Predicting Human Mobility with Attentional Recurrent Networks,"Jie Feng, Yong Li, Chao Zhang, Funing Sun, Fanchao Meng, Ang Guo, ","Human mobility prediction is of great importance for a wide spectrum of location-based applications. However, predicting mobility is not trivial because of three challenges: 1) the complex sequential transition regularities exhibited with time-dependent and high-order nature; 2) the multi-level periodicity of human mobility; and 3) the heterogeneity and sparsity of the collected trajectory data. In this paper, we propose DeepMove, an attentional recurrent network for mobility prediction from lengthy and sparse trajectories. In DeepMove, we first design a multi-modal embedding recurrent neural network to capture the complicated sequential transitions by jointly embedding the multiple factors that govern the human mobility. Then, we propose a historical attention model with two mechanisms to capture the multi-level periodicity in a principle way, which effectively utilizes the periodicity nature to augment the recurrent neural network for mobility prediction. We perform experiments on three representative real-life mobility datasets, and extensive evaluation results demonstrate that our model outperforms the state-of-the-art models by more than 10%. Moreover, compared with the state-of-the-art neural network models, DeepMove provides intuitive explanations into the prediction and sheds light on interpretable mobility prediction."
www,https://dl.acm.org/doi/pdf/10.1145/3178876.3186059,Aladdin: Automating Release of Deep-Link APIs on Android,"Yun Ma, Ziniu Hu, Yunxin Liu, Tao Xie, Xuanzhe Liu, ","Compared to the Web where each web page has a global URL for external access, a specific 'page' inside a mobile app cannot be easily accessed unless the user performs several steps from the landing page of this app. Recently, the concept of 'deep link' is expected to be a promising solution and has been advocated by major service providers to enable targeting and opening a specific page of an app externally with an accessible uniform resource identifier. In this paper, we present a large-scale empirical study to investigate how deep links are really adopted, over 25,000 Android apps. To our surprise, we find that deep links have quite low coverage, e.g., more than 70% and 90% of the apps do not have deep links on app stores Wandoujia and Google Play, respectively. One underlying reason is the mandatory and non-trivial manual efforts of app developers to provide APIs for deep links. We then propose the Aladdin approach along with its supporting tool to help developers practically automate the release of deep-link APIs to access locations inside their apps. Aladdin includes a novel cooperative framework by synthesizing the static analysis and the dynamic analysis while minimally engaging developers» inputs and configurations, without requiring any coding efforts or additional deployment efforts. We evaluate Aladdin with 579 popular apps and demonstrate its effectiveness and performance."
www,https://dl.acm.org/doi/pdf/10.1145/3178876.3186060,The Cost of Digital Advertisement: Comparing User and Advertiser Views,"Panagiotis Papadopoulos, Nicolas Kourtellis, Evangelos P. Markatos, ","Digital advertisements are delivered in the form of static images, animations or videos, with the goal to promote a product, a service or an idea to desktop or mobile users. Thus, the advertiser pays a monetary cost to buy ad-space in a content provider»s medium (e.g., website) to place their advertisement in the consumer»s display. However, is it only the advertiser who pays for the ad delivery? Unlike traditional advertisements in mediums such as newspapers, TV or radio, in the digital world, the end-users are also paying a cost for the advertisement delivery. Whilst the cost on the advertiser»s side is clearly monetary, on the end-user, it includes both quantifiable costs, such as network requests and transferred bytes, and qualitative costs such as privacy loss to the ad ecosystem. In this study, we aim to increase user awareness regarding the hidden costs of digital advertisement in mobile devices, and compare the user and advertiser views. Specifically, we built OpenDAMP, a transparency tool that passively analyzes users» web traffic and estimates the costs in both sides. We use a year-long dataset of 1270 real mobile users and by juxtaposing the costs of both sides, we identify a clear imbalance: the advertisers pay several times less to deliver ads, than the cost paid by the users to download them. In addition, the majority of users experience a significant privacy loss, through the personalized ad delivery mechanics."
www,https://dl.acm.org/doi/pdf/10.1145/3178876.3186061,Facebook (A)Live?: Are Live Social Broadcasts Really Broadcasts?,"Aravindh Raman, Gareth Tyson, Nishanth Sastry, ","The era of live-broadcast is back but with two major changes. First, unlike traditional TV broadcasts, content is now streamed over the Internet enabling it to reach a wider audience. Second, due to various user-generated content platforms it has become possible for anyone to get involved, streaming their own content to the world. This emerging trend of going live usually happens via social platforms, where users perform live social broadcasts predominantly from their mobile devices, allowing their friends (and the general public) to engage with the stream in real-time. With the growing popularity of such platforms, the burden on the current Internet infrastructure is therefore expected to multiply. With this in mind, we explore one such prominent platform - Facebook Live. We gather 3TB of data, representing one month of global activity and explore the characteristics of live social broadcast. From this, we derive simple yet effective principles which can decrease the network burden. We then dissect global and hyper-local properties of the video while on-air, by capturing the geography of the broadcasters or the users who produce the video and the viewers or the users who interact with it. Finally, we study the social engagement while the video is live and distinguish the key aspects when the same video goes on-demand. A common theme throughout the paper is that, despite its name, many attributes of Facebook Live deviate from both the concepts of live and broadcast."
www,https://dl.acm.org/doi/pdf/10.1145/3178876.3186062,I'll Be Back: On the Multiple Lives of Users of a Mobile Activity Tracking Application,"Zhiyuan Lin, Tim Althoff, Jure Leskovec, ","Mobile health applications that track activities, such as exercise, sleep, and diet, are becoming widely used. While these activity tracking applications have the potential to improve our health, user engagement and retention are critical factors for their success. However, long-term user engagement patterns in real-world activity tracking applications are not yet well understood. Here we study user engagement patterns within a mobile physical activity tracking application consisting of 115 million logged activities taken by over a million users over 31 months. Specifically, we show that over 75% of users return and re-engage with the application after prolonged periods of inactivity, no matter the duration of the inactivity. We find a surprising result that the re-engagement usage patterns resemble those of the start of the initial engagement period, rather than being a simple continuation of the end of the initial engagement period. This evidence points to a conceptual model of multiple lives of user engagement, extending the prevalent single life view of user activity. We demonstrate that these multiple lives occur because the users have a variety of different primary intents or goals for using the app. These primary intents are associated with how long each life lasts and how likely the user is to re-engage for a new life. We find evidence for users being more likely to stop using the app once they achieved their primary intent or goal (e.g., weight loss). However, these users might return once their original intent resurfaces (e.g., wanting to lose newly gained weight). We discuss implications of the multiple life paradigm and propose a novel prediction task of predicting the number of lives of a user. Based on insights developed in this work, including a marker of improved primary intent performance, our prediction models achieve 71% ROC AUC. Overall, our research has implications for modeling user re-engagement in health activity tracking applications and has consequences for how notifications, recommendations as well as gamification can be used to increase engagement."
www,https://dl.acm.org/doi/pdf/10.1145/3178876.3186063,Joint User- and Event- Driven Stable Social Event Organization,"Xin Wang, Wenwu Zhu, Chun Chen, Martin Ester, ","The problem of social event organization (SEO) rises with the advent of online web services and plays an important role in helping users discover new offline events. Existing work on SEO only assumes that different users have different preferences towards different events, ignoring the fact that each event (its organizer) may have a separate preference towards every user. In this paper, we investigate joint user- and event- driven SEO by simultaneously considering user preferences (towards events) and event preferences (towards users). A risen challenging problem is that this joint consideration may suffer instabilities between users and events which are NP-hard to handle in SEO. Stability is a desired property that needs to be maintained in SEO, otherwise participants will incline towards changing to other events and trust less the organizer."
www,https://dl.acm.org/doi/pdf/10.1145/3178876.3186064,Learning on Partial-Order Hypergraphs,"Fuli Feng, Xiangnan He, Yiqun Liu, Liqiang Nie, Tat-Seng Chua, ","Graph-based learning methods explicitly consider the relations between two entities (i.e., vertices) for learning the prediction function. They have been widely used in semi-supervised learning, manifold ranking, and clustering, among other tasks. Enhancing the expressiveness of simple graphs, hypergraphs formulate an edge as a link to multiple vertices, so as to model the higher-order relations among entities. For example, hyperedges in a hypergraph can be used to encode the similarity among vertices."
www,https://dl.acm.org/doi/pdf/10.1145/3178876.3186065,"""Satisfaction with Failure"" or ""Unsatisfied Success"": Investigating the Relationship between Search Success and User Satisfaction","Mengyang Liu, Yiqun Liu, Jiaxin Mao, Cheng Luo, Min Zhang, ","User satisfaction has been paid much attention to in recent Web search evaluation studies. Although satisfaction is often considered as an important symbol of search success, it doesn»t guarantee success in many cases, especially for complex search task scenarios. In this study, we investigate the differences between user satisfaction and search success, and try to adopt the findings to predict search success in complex search tasks. To achieve these research goals, we conduct a laboratory study in which search success and user satisfaction are annotated by domain expert assessors and search users, respectively. We find that both ""Satisfaction with Failure"" and ""Unsatisfied Success"" cases happen in these search tasks and together they account for as many as 40.3% of all search sessions. The factors (e.g. document readability and credibility) that lead to the inconsistency of search success and user satisfaction are also investigated and adopted to predict whether one search task is successful. Experimental results show that our proposed prediction method is effective in predicting search success."
www,https://dl.acm.org/doi/pdf/10.1145/3178876.3186066,TEM: Tree-enhanced Embedding Model for Explainable Recommendation,"Xiang Wang, Xiangnan He, Fuli Feng, Liqiang Nie, Tat-Seng Chua, ","While collaborative filtering is the dominant technique in personalized recommendation, it models user-item interactions only and cannot provide concrete reasons for a recommendation. Meanwhile, the rich side information affiliated with user-item interactions (e.g., user demographics and item attributes), which provide valuable evidence that why a recommendation is suitable for a user, has not been fully explored in providing explanations."
