conference,url,title,authors,abstract
www,https://dl.acm.org/doi/pdf/10.1145/1963405.1963488,Layered label propagation: a multiresolution coordinate-free ordering for compressing social networks,"Paolo Boldi, Marco Rosa, Massimo Santini, Sebastiano Vigna, ","We continue the line of research on graph compression started with WebGraph, but we move our focus to the compression of social networks in a proper sense (e.g., LiveJournal): the approaches that have been used for a long time to compress web graphs rely on a specific ordering of the nodes (lexicographical URL ordering) whose extension to general social networks is not trivial. In this paper, we propose a solution that mixes clusterings and orders, and devise a new algorithm, called Layered Label Propagation, that builds on previous work on scalable clustering and can be used to reorder very large graphs (billions of nodes). Our implementation uses task decomposition to perform aggressively on multi-core architecture, making it possible to reorder graphs of more than 600 millions nodes in a few hours."
www,https://dl.acm.org/doi/pdf/10.1145/1963405.1963489,Estimating sizes of social networks via biased sampling,"Liran Katzir, Edo Liberty, Oren Somekh, ","Online social networks have become very popular in recent years and their number of users is already measured in many hundreds of millions. For various commercial and sociological purposes, an independent estimate of their sizes is important. In this work, algorithms for estimating the number of users in such networks are considered. The proposed schemes are also applicable for estimating the sizes of networks' sub-populations. The suggested algorithms interact with the social networks via their public APIs only, and rely on no other external information. Due to obvious traffic and privacy concerns, the number of such interactions is severely limited. We therefore focus on minimizing the number of API interactions needed for producing good size estimates. We adopt the abstraction of social networks as undirected graphs and use random node sampling. By counting the number of collisions or non-unique nodes in the sample, we produce a size estimate. Then, we show analytically that the estimate error vanishes with high probability for smaller number of samples than those required by prior-art algorithms. Moreover, although our algorithms are provably correct for any graph, they excel when applied to social network-like graphs. The proposed algorithms were evaluated on synthetic as well real social networks such as Facebook, IMDB, and DBLP. Our experiments corroborated the theoretical results, and demonstrated the effectiveness of the algorithms."
www,https://dl.acm.org/doi/pdf/10.1145/1963405.1963491,Counting triangles and the curse of the last reducer,"Siddharth Suri, Sergei Vassilvitskii, ","The clustering coefficient of a node in a social network is a fundamental measure that quantifies how tightly-knit the community is around the node. Its computation can be reduced to counting the number of triangles incident on the particular node in the network. In case the graph is too big to fit into memory, this is a non-trivial task, and previous researchers showed how to estimate the clustering coefficient in this scenario. A different avenue of research is to to perform the computation in parallel, spreading it across many machines. In recent years MapReduce has emerged as a de facto programming paradigm for parallel computation on massive data sets. The main focus of this work is to give MapReduce algorithms for counting triangles which we use to compute clustering coefficients."
www,https://dl.acm.org/doi/pdf/10.1145/1963405.1963492,Network bucket testing,"Lars Backstrom, Jon Kleinberg, ","Bucket testing, also known as A/B testing, is a practice that is widely used by on-line sites with large audiences: in a simple version of the methodology, one evaluates a new feature on the site by exposing it to a very small fraction of the total user population and measuring its effect on this exposed group. For traditional uses of this technique, uniform independent sampling of the population is often enough to produce an exposed group that can serve as a statistical proxy for the full population."
www,https://dl.acm.org/doi/pdf/10.1145/1963405.1963493,HyperANF: approximating the neighbourhood function of very large graphs on a budget,"Paolo Boldi, Marco Rosa, Sebastiano Vigna, ","The neighbourhood function NG(t) of a graph G gives, for each t ∈ N, the number of pairs of nodes x, y such that y is reachable from x in less that t hops. The neighbourhood function provides a wealth of information about the graph [10] (e.g., it easily allows one to compute its diameter), but it is very expensive to compute it exactly. Recently, the ANF algorithm [10] (approximate neighbourhood function) has been proposed with the purpose of approximating NG(t) on large graphs. We describe a breakthrough improvement over ANF in terms of speed and scalability. Our algorithm, called HyperANF, uses the new HyperLogLog counters [5] and combines them efficiently through broadword programming [8]; our implementation uses talk decomposition to exploit multi-core parallelism. With HyperANF, for the first time we can compute in a few hours the neighbourhood function of graphs with billions of nodes with a small error and good confidence using a standard workstation."
www,https://dl.acm.org/doi/pdf/10.1145/1963405.1963495,EP-SPARQL: a unified language for event processing and stream reasoning,"Darko Anicic, Paul Fodor, Sebastian Rudolph, Nenad Stojanovic, ","Streams of events appear increasingly today in various Web applications such as blogs, feeds, sensor data streams, geospatial information, on-line financial data, etc. Event Processing (EP) is concerned with timely detection of compound events within streams of simple events. State-of-the-art EP provides on-the-fly analysis of event streams, but cannot combine streams with background knowledge and cannot perform reasoning tasks. On the other hand, semantic tools can effectively handle background knowledge and perform reasoning thereon, but cannot deal with rapidly changing data provided by event streams."
www,https://dl.acm.org/doi/pdf/10.1145/1963405.1963496,A better uncle for OWL: nominal schemas for integrating rules and ontologies,"Markus Krötzsch, Frederick Maier, Adila Krisnadhi, Pascal Hitzler, ","We propose a description-logic style extension of OWL 2 with nominal schemas which can be used like ""variable nominal classes"" within axioms. This feature allows ontology languages to express arbitrary DL-safe rules (as expressible in SWRL or RIF) in their native syntax. We show that adding nominal schemas to OWL 2 does not increase the worst-case reasoning complexity, and we identify a novel tractable language SROELV3(∩, x) that is versatile enough to capture the lightweight languages OWL EL and OWL RL."
www,https://dl.acm.org/doi/pdf/10.1145/1963405.1963497,Rewriting queries on SPARQL views,"Wangchao Le, Songyun Duan, Anastasios Kementsietsidis, Feifei Li, ","The problem of answering SPARQL queries over virtual SPARQL views is commonly encountered in a number of settings, including while enforcing security policies to access RDF data, or when integrating RDF data from disparate sources. We approach this problem by rewriting SPARQL queries over the views to equivalent queries over the underlying RDF data, thus avoiding the costs entailed by view materialization and maintenance. We show that SPARQL query rewriting combines the most challenging aspects of rewriting for the relational and XML cases: like the relational case, SPARQL query rewriting requires synthesizing multiple views; like the XML case, the size of the rewritten query is exponential to the size of the query and the views. In this paper, we present the first native query rewriting algorithm for SPARQL. For an input SPARQL query over a set of virtual SPARQL views, the rewritten query resembles a union of conjunctive queries and can be of exponential size. We propose optimizations over the basic rewriting algorithm to (i) minimize each conjunctive query in the union; (ii) eliminate conjunctive queries with empty results from evaluation; and (iii) efficiently prune out big portions of the search space of empty rewritings. The experiments, performed on two RDF stores, show that our algorithms are scalable and independent of the underlying RDF stores. Furthermore, our optimizations have order of magnitude improvements over the basic rewriting algorithm in both the rewriting size and evaluation time."
www,https://dl.acm.org/doi/pdf/10.1145/1963405.1963499,Limiting the spread of misinformation in social networks,"Ceren Budak, Divyakant Agrawal, Amr El Abbadi, ","In this work, we study the notion of competing campaigns in a social network and address the problem of influence limitation where a ""bad"" campaign starts propagating from a certain node in the network and use the notion of limiting campaigns to counteract the effect of misinformation. The problem can be summarized as identifying a subset of individuals that need to be convinced to adopt the competing (or ""good"") campaign so as to minimize the number of people that adopt the ""bad"" campaign at the end of both propagation processes. We show that this optimization problem is NP-hard and provide approximation guarantees for a greedy solution for various definitions of this problem by proving that they are submodular. We experimentally compare the performance of the greedy method to various heuristics. The experiments reveal that in most cases inexpensive heuristics such as degree centrality compare well with the greedy approach. We also study the influence limitation problem in the presence of missing data where the current states of nodes in the network are only known with a certain probability and show that prediction in this setting is a supermodular problem. We propose a prediction algorithm that is based on generating random spanning trees and evaluate the performance of this approach. The experiments reveal that using the prediction algorithm, we are able to tolerate about 90% missing data before the performance of the algorithm starts degrading and even with large amounts of missing data the performance degrades only to 75% of the performance that would be achieved with complete data."
www,https://dl.acm.org/doi/pdf/10.1145/1963405.1963500,Information credibility on twitter,"Carlos Castillo, Marcelo Mendoza, Barbara Poblete, ","We analyze the information credibility of news propagated through Twitter, a popular microblogging service. Previous research has shown that most of the messages posted on Twitter are truthful, but the service is also used to spread misinformation and false rumors, often unintentionally."
www,https://dl.acm.org/doi/pdf/10.1145/1963405.1963501,SafeVchat: detecting obscene content and misbehaving users in online video chat services,"Xinyu Xing, Yu-Li Liang, Hanqiang Cheng, Jianxun Dang, ","Online video chat services such as Chatroulette, Omegle, and vChatter that randomly match pairs of users in video chat sessions are fast becoming very popular, with over a million users per month in the case of Chatroulette. A key problem encountered in such systems is the presence of flashers and obscene content. This problem is especially acute given the presence of underage minors in such systems. This paper presents SafeVchat, a novel solution to the problem of flasher detection that employs an array of image detection algorithms. A key contribution of the paper concerns how the results of the individual detectors are fused together into an overall decision classifying the user as misbehaving or not, based on Dempster-Shafer Theory. The paper introduces a novel, motion-based skin detection method that achieves significantly higher recall and better precision. The proposed methods have been evaluated over real-world data and image traces obtained from Chatroulette.com."
www,https://dl.acm.org/doi/pdf/10.1145/1963405.1963503,"Differences in the mechanics of information diffusion across topics: idioms, political hashtags, and complex contagion on twitter","Daniel M. Romero, Brendan Meeder, Jon Kleinberg, ","There is a widespread intuitive sense that different kinds of information spread differently on-line, but it has been difficult to evaluate this question quantitatively since it requires a setting where many different kinds of information spread in a shared environment. Here we study this issue on Twitter, analyzing the ways in which tokens known as hashtags spread on a network defined by the interactions among Twitter users. We find significant variation in the ways that widely-used hashtags on different topics spread."
www,https://dl.acm.org/doi/pdf/10.1145/1963405.1963504,Who says what to whom on twitter,"Shaomei Wu, Jake M. Hofman, Winter A. Mason, Duncan J. Watts, ","We study several longstanding questions in media communications research, in the context of the microblogging service Twitter, regarding the production, flow, and consumption of information. To do so, we exploit a recently introduced feature of Twitter known as ""lists"" to distinguish between elite users - by which we mean celebrities, bloggers, and representatives of media outlets and other formal organizations - and ordinary users. Based on this classification, we find a striking concentration of attention on Twitter, in that roughly 50% of URLs consumed are generated by just 20K elite users, where the media produces the most information, but celebrities are the most followed. We also find significant homophily within categories: celebrities listen to celebrities, while bloggers listen to bloggers etc; however, bloggers in general rebroadcast more information than the other categories. Next we re-examine the classical ""two-step flow"" theory of communications, finding considerable support for it on Twitter. Third, we find that URLs broadcast by different categories of users or containing different types of content exhibit systematically different lifespans. And finally, we examine the attention paid by the different user categories to different news topics."
www,https://dl.acm.org/doi/pdf/10.1145/1963405.1963505,we.b: the web of short urls,"Demetris Antoniades, Iasonas Polakis, Georgios Kontaxis, Elias Athanasopoulos, ","Short URLs have become ubiquitous. Especially popular within social networking services, short URLs have seen a significant increase in their usage over the past years, mostly due to Twitter's restriction of message length to 140 characters. In this paper, we provide a first characterization on the usage of short URLs. Specifically, our goal is to examine the content short URLs point to, how they are published, their popularity and activity over time, as well as their potential impact on the performance of the web."
www,https://dl.acm.org/doi/pdf/10.1145/1963405.1963507,Milgram-routing in social networks,"Silvio Lattanzi, Alessandro Panconesi, D. Sivakumar, ","We demonstrate how a recent model of social networks (""Affiliation Networks"", [21]) offers powerful cues in local routing within social networks, a theme made famous by sociologist Milgram's ""six degrees of separation"" experiments. This model posits the existence of an ""interest space"" that underlies a social network; we prove that in networks produced by this model, not only do short paths exist among all pairs of nodes but natural local routing algorithms can discover them effectively. Specifically, we show that local routing can discover paths of length O(log2 n) to targets chosen uniformly at random, and paths of length O(1) to targets chosen with probability proportional to their degrees. Experiments on the co-authorship graph derived from DBLP data confirm our theoretical results, and shed light into the power of one step of lookahead in routing algorithms for social networks."
www,https://dl.acm.org/doi/pdf/10.1145/1963405.1963508,Information spreading in context,"Dashun Wang, Zhen Wen, Hanghang Tong, Ching-Yung Lin, ","Information spreading processes are central to human interactions. Despite recent studies in online domains, little is known about factors that could affect the dissemination of a single piece of information. In this paper, we address this challenge by combining two related but distinct datasets, collected from a large scale privacy-preserving distributed social sensor system. We find that the social and organizational context significantly impacts to whom and how fast people forward information. Yet the structures within spreading processes can be well captured by a simple stochastic branching model, indicating surprising independence of context. Our results build the foundation of future predictive models of information flow and provide significant insights towards design of communication platforms."
www,https://dl.acm.org/doi/pdf/10.1145/1963405.1963509,Mark my words!: linguistic style accommodation in social media,"Cristian Danescu-Niculescu-Mizil, Michael Gamon, Susan Dumais, ","The psycholinguistic theory of communication accommodation accounts for the general observation that participants in conversations tend to converge to one another's communicative behavior: they coordinate in a variety of dimensions including choice of words, syntax, utterance length, pitch and gestures. In its almost forty years of existence, this theory has been empirically supported exclusively through small-scale or controlled laboratory studies. Here we address this phenomenon in the context of Twitter conversations. Undoubtedly, this setting is unlike any other in which accommodation was observed and, thus, challenging to the theory. Its novelty comes not only from its size, but also from the non real-time nature of conversations, from the 140 character length restriction, from the wide variety of social relation types, and from a design that was initially not geared towards conversation at all. Given such constraints, it is not clear a priori whether accommodation is robust enough to occur given the constraints of this new environment. To investigate this, we develop a probabilistic framework that can model accommodation and measure its effects. We apply it to a large Twitter conversational dataset specifically developed for this task. This is the first time the hypothesis of linguistic style accommodation has been examined (and verified) in a large scale, real world setting."
www,https://dl.acm.org/doi/pdf/10.1145/1963405.1963511,Supporting synchronous social q&a throughout the question lifecycle,"Matthew Richardson, Ryen W. White, ","Synchronous social Q&A systems exist on the Web and in the enterprise to connect people with questions to people with answers in real-time. In such systems, askers' desire for quick answers is in tension with costs associated with interrupting numerous candidate answerers per question. Supporting users of synchronous social Q&A systems at various points in the question lifecycle (from conception to answer) helps askers make informed decisions about the likelihood of question success and helps answerers face fewer interruptions. For example, predicting that a question will not be well answered may lead the asker to rephrase or retract the question. Similarly, predicting that an answer is not forthcoming during the dialog can prompt system behaviors such as finding other answerers to join the conversation. As another example, predictions of asker satisfaction can be assigned to completed conversations and used for later retrieval."
www,https://dl.acm.org/doi/pdf/10.1145/1963405.1963512,The design and usage of tentative events for time-based social coordination in the enterprise,"Mikhil Masli, Werner Geyer, Casey Dugan, Beth Brownholtz, ","Existing enterprise calendaring systems have suffered from problems like rigidity, lack of transparency, and poor integration with social networks. We present the system design and rationale for a novel social coordination mechanism, called ""Suggestions,"" that addresses these issues. Our system integrates ideas drawn from designs of lightweight polling systems and one's social network into an open calendar tool, providing a space for users to coordinate, socialize around, or negotiate the ""what"" and the ""when"" of their events. Suggestions was released inside a large enterprise setting, where initial interviews revealed users' thoughts on transparent scheduling, reaching wider audiences and task appropriateness, and suggested ways to improve our design."
www,https://dl.acm.org/doi/pdf/10.1145/1963405.1963513,A case for query by image and text content: searching computer help using screenshots and keywords,"Tom Yeh, Brandyn White, Jose San Pedro, Boriz Katz, Larry S. Davis, ","The multimedia information retrieval community has dedicated extensive research effort to the problem of content-based image retrieval (CBIR). However, these systems find their main limitation in the difficulty of creating pictorial queries. As a result, few systems offer the option of querying by visual examples, and rely on automatic concept detection and tagging techniques to provide support for searching visual content using textual queries."
www,https://dl.acm.org/doi/pdf/10.1145/1963405.1963515,A distributed framework for reliable and efficient service choreographies,"Young Yoon, Chunyang Ye, Hans-Arno Jacobsen, ","In service-oriented architectures (SOA), independently developed Web services can be dynamically composed. However, the composition is prone to producing semantically conflicting interactions among the services. For example, in an interdepartmental business collaboration through Web services, the decision by the marketing department to clear out the inventory might be inconsistent with the decision by the operations department to increase production. Resolving semantic conflicts is challenging especially when services are loosely coupled and their interactions are not carefully governed. To address this problem, we propose a novel distributed service choreography framework. We deploy safety constraints to prevent conflicting behavior and enforce reliable and efficient service interactions via federated publish/subscribe messaging, along with strategic placement of distributed choreography agents and coordinators to minimize runtime overhead. Experimental results show that our framework prevents semantic conflicts with negligible overhead and scales better than a centralized approach by up to 60%."
www,https://dl.acm.org/doi/pdf/10.1145/1963405.1963516,Choreography conformance via synchronizability,"Samik Basu, Tevfik Bultan, ","Choreography analysis has been a crucial problem in service oriented computing. Interactions among services involve message exchanges across organizational boundaries in a distributed computing environment, and in order to build such systems in a reliable manner, it is necessary to develop techniques for analyzing such interactions. Choreography conformance involves verifying that a set of services behave according to a given choreography specification that characterizes their interactions. Unfortunately this is an undecidable problem when services interact with asynchronous communication. In this paper we present techniques that identify if the interaction behavior for a set of services remain the same when asynchronous communication is replaced with synchronous communication. This is called the synchronizability problem and determining the synchronizability of a set of services has been an open problem for several years. We solve this problem in this paper. Our results can be used to identify synchronizable services for which choreography conformance can be checked efficiently. Our results on synchronizability are applicable to any software infrastructure that supports message-based interactions."
www,https://dl.acm.org/doi/pdf/10.1145/1963405.1963517,Statically locating web application bugs caused by asynchronous calls,"Yunhui Zheng, Tao Bao, Xiangyu Zhang, ","Ajax becomes more and more important for web applications that care about client side user experience. It allows sending requests asynchronously, without blocking clients from continuing execution. Callback functions are only executed upon receiving the responses. While such mechanism makes browsing a smooth experience, it may cause severe problems in the presence of unexpected network latency, due to the non-determinism of asynchronism. In this paper, we demonstrate the possible problems caused by the asynchronism and propose a static program analysis to automatically detect such bugs in web applications. As client side Ajax code is often wrapped in server-side scripts, we also develop a technique that extracts client-side JavaScript code from server-side scripts. We evaluate our technique on a number of real-world web applications. Our results show that it can effectively identify real bugs. We also discuss possible ways to avoid such bugs."
