conference,url,title,authors,abstract
www,https://dl.acm.org/doi/pdf/10.1145/1963405.1963407,How can scientists help to spread the web to all sections of the society,"A.P.J. Abdul Kalam, ",No abstract available.
www,https://dl.acm.org/doi/pdf/10.1145/1963405.1963408,Designing the web for an open society,"Sir Tim Berners-Lee, ","How can we best design Web technology to support the features we would like of our society such as: openness, justice, transparency, accountability, participation, innovation, science and democracy?"
www,https://dl.acm.org/doi/pdf/10.1145/1963405.1963409,"Games, algorithms, and the Internet","Christos H. Papadimitriou, ","The advent of the Internet brought parallel paradigm shifts to both Economics and Computer Science. Computer scientists realized that large-scale performing systems can emerge from the interaction of selfish agents and that incentives are a quintessential part of a good system design. And economists saw that the default platforms of economic transactions are computational and interconnected. Algorithmic Game Theory is a subdiscipline that emerged from this turmoil, revisiting some of the most important problems in Economics and Game Theory from a computational and network perspective. This talk will survey some of the major themes, results and challenges in this field."
www,https://dl.acm.org/doi/pdf/10.1145/1963405.1963411,Sparse hidden-dynamics conditional random fields for user intent understanding,"Yelong Shen, Jun Yan, Shuicheng Yan, Lei Ji, Ning Liu, ","Understanding user intent from her sequential search behaviors, i.e. predicting the intent of each user query in a search session, is crucial for modern Web search engines. However, due to the huge number of user behavior variables and coarse level intent labels defined by human editors, it is very difficult to directly model user behavioral dynamics or user intent dynamics in user search sessions. In this paper, we propose a novel Sparse Hidden-Dynamic Conditional Random Fields (SHDCRF) model for user intent learning from their search sessions. Through incorporating the proposed hidden state variables, SHDCRF aims to learn a substructure, i.e. a set of related hidden variables, for each intent label and they are used to model the intermediate dynamics between user intent labels and user behavioral variables. In addition, SHDCRF learns a sparse relation between the hidden variables and intent labels to make the hidden state variables explainable. Extensive experiment results, on real user search sessions from a popular commercial search engine show that the proposed SHDCRF model significantly outperforms in terms of intent prediction results that those classical solutions such as Support Vector Machine (SVM), Conditional Random Field (CRF) and Latnet-Dynamic Conditional Random Field (LDCRF)."
www,https://dl.acm.org/doi/pdf/10.1145/1963405.1963412,Characterizing search intent diversity into click models,"Botao Hu, Yuchen Zhang, Weizhu Chen, Gang Wang, Qiang Yang, ","Modeling a user's click-through behavior in click logs is a challenging task due to the well-known position bias problem. Recent advances in click models have adopted the examination hypothesis which distinguishes document relevance from position bias. In this paper, we revisit the examination hypothesis and observe that user clicks cannot be completely explained by relevance and position bias. Specifically, users with different search intents may submit the same query to the search engine but expect different search results. Thus, there might be a bias between user search intent and the query formulated by the user, which can lead to the diversity in user clicks. This bias has not been considered in previous works such as UBM, DBN and CCM. In this paper, we propose a new intent hypothesis as a complement to the examination hypothesis. This hypothesis is used to characterize the bias between the user search intent and the query in each search session. This hypothesis is very general and can be applied to most of the existing click models to improve their capacities in learning unbiased relevance. Experimental results demonstrate that after adopting the intent hypothesis, click models can better interpret user clicks and achieve a significant NDCG improvement."
www,https://dl.acm.org/doi/pdf/10.1145/1963405.1963413,Addressing people's information needs directly in a web search result page,"Lydia B. Chilton, Jaime Teevan, ","Web search engines have historically focused on connecting people with information resources. For example, if a person wanted to know when their flight to Hyderabad was leaving, a search engine might connect them with the airline where they could find flight status information. However, search engines have recently begun to try to meet people's search needs directly, providing, for example, flight status information in response to queries that include an airline and a flight number. In this paper, we use large scale query log analysis to explore the challenges a search engine faces when trying to meet an information need directly in the search result page. We look at how people's interaction behavior changes when inline content is returned, finding that such content can cannibalize clicks from the algorithmic results. We see that in the absence of interaction behavior, an individual's repeat search behavior can be useful in understanding the content's value. We also discuss some of the ways user behavior can be used to provide insight into when inline answers might better trigger and what types of additional information might be included in the results."
www,https://dl.acm.org/doi/pdf/10.1145/1963405.1963415,A unified framework for recommending diverse and relevant queries,"Xiaofei Zhu, Jiafeng Guo, Xueqi Cheng, Pan Du, Hua-Wei Shen, ","Query recommendation has been considered as an effective way to help search users in their information seeking activities. Traditional approaches mainly focused on recommending alternative queries with close search intent to the original query. However, to only take relevance into account may generate redundant recommendations to users. It is better to provide diverse as well as relevant query recommendations, so that we can cover multiple potential search intents of users and minimize the risk that users will not be satisfied. Besides, previous query recommendation approaches mostly relied on measuring the relevance or similarity between queries in the Euclidean space. However, there is no convincing evidence that the query space is Euclidean. It is more natural and reasonable to assume that the query space is a manifold. In this paper, therefore, we aim to recommend diverse and relevant queries based on the intrinsic query manifold. We propose a unified model, named manifold ranking with stop points, for query recommendation. By turning ranked queries into stop points on the query manifold, our approach can generate query recommendations by simultaneously considering both diversity and relevance in a unified way. Empirical experimental results on a large scale query log of a commercial search engine show that our approach can effectively generate highly diverse as well as closely related query recommendations."
www,https://dl.acm.org/doi/pdf/10.1145/1963405.1963416,Improving recommendation for long-tail queries via templates,"Idan Szpektor, Aristides Gionis, Yoelle Maarek, ","The ability to aggregate huge volumes of queries over a large population of users allows search engines to build precise models for a variety of query-assistance features such as query recommendation, correction, etc. Yet, no matter how much data is aggregated, the long-tail distribution implies that a large fraction of queries are rare. As a result, most query assistance services perform poorly or are not even triggered on long-tail queries. We propose a method to extend the reach of query assistance techniques (and in particular query recommendation) to long-tail queries by reasoning about rules between query templates rather than individual query transitions, as currently done in query-flow graph models. As a simple example, if we recognize that 'Montezuma' is a city in the rare query ""Montezuma surf"" and if the rule 'city surf → beach has been observed, we are able to offer ""Montezuma beach"" as a recommendation, even if the two queries were never observed in a same session. We conducted experiments to validate our hypothesis, first via traditional small-scale editorial assessments but more interestingly via a novel automated large scale evaluation methodology. Our experiments show that general coverage can be relatively increased by 24% using templates without penalizing quality. Furthermore, for 36% of the 95M queries in our query flow graph, which have no out edges and thus could not be served recommendations, we can now offer at least one recommendation in 98% of the cases."
www,https://dl.acm.org/doi/pdf/10.1145/1963405.1963417,Learning to model relatedness for news recommendation,"Yuanhua Lv, Taesup Moon, Pranam Kolari, Zhaohui Zheng, ","With the explosive growth of online news readership, recommending interesting news articles to users has become extremely important. While existing Web services such as Yahoo! and Digg attract users' initial clicks by leveraging various kinds of signals, how to engage such users algorithmically after their initial visit is largely under-explored. In this paper, we study the problem of post-click news recommendation. Given that a user has perused a current news article, our idea is to automatically identify ""related"" news articles which the user would like to read afterwards. Specifically, we propose to characterize relatedness between news articles across four aspects: relevance, novelty, connection clarity, and transition smoothness. Motivated by this understanding, we define a set of features to capture each of these aspects and put forward a learning approach to model relatedness. In order to quantitatively evaluate our proposed measures and learn a unified relatedness function, we construct a large test collection based on a four-month commercial news corpus with editorial judgments. The experimental results show that the proposed heuristics can indeed capture relatedness, and that the learned unified relatedness function works quite effectively."
www,https://dl.acm.org/doi/pdf/10.1145/1963405.1963419,Model characterization curves for federated search using click-logs: predicting user engagement metrics for the span of feasible operating points,"Ashok Kumar Ponnuswami, Kumaresh Pattabiraman, Desmond Brand, ","Modern day federated search engines aggregate heterogeneous types of results from multiple vertical search engines and compose a single search engine result page (SERP). The search engine aggregates the results and produces one ranked list, constraining the vertical results to specific slots on the SERP."
www,https://dl.acm.org/doi/pdf/10.1145/1963405.1963420,Generalized link suggestions via web site clustering,"Jangwon Seo, Fernando Diaz, Evgeniy Gabrilovich, Vanja Josifovski, Bo Pang, ","Proactive link suggestion leads to improved user experience by allowing users to reach relevant information with fewer clicks, fewer pages to read, or simply faster because the right pages are prefetched just in time. In this paper we tackle two new scenarios for link suggestion, which were not covered in prior work owing to scarcity of historical browsing data. In the web search scenario, we propose a method for generating quick links - additional entry points into Web sites, which are shown for top search results for navigational queries - for tail sites, for which little browsing statistics is available. Beyond Web search, we also propose a method for link suggestion in general web browsing, effectively anticipating the next link to be followed by the user. Our approach performs clustering of Web sites in order to aggregate information across multiple sites, and enables relevant link suggestion for virtually any site, including tail sites and brand new sites for which little historical data is available. Empirical evaluation confirms the validity of our method using editorially labeled data as well as real-life search and browsing data from a major US search engine."
www,https://dl.acm.org/doi/pdf/10.1145/1963405.1963421,A self-training approach for resolving object coreference on the semantic web,"Wei Hu, Jianfeng Chen, Yuzhong Qu, ","An object on the Semantic Web is likely to be denoted with multiple URIs by different parties. Object coreference resolution is to identify ""equivalent"" URIs that denote the same object. Driven by the Linking Open Data (LOD) initiative, millions of URIs have been explicitly linked with owl:sameAs statements, but potentially coreferent ones are still considerable. Existing approaches address the problem mainly from two directions: one is based upon equivalence inference mandated by OWL semantics, which finds semantically coreferent URIs but probably omits many potential ones; the other is via similarity computation between property-value pairs, which is not always accurate enough. In this paper, we propose a self-training approach for object coreference resolution on the Semantic Web, which leverages the two classes of approaches to bridge the gap between semantically coreferent URIs and potential candidates. For an object URI, we firstly establish a kernel that consists of semantically coreferent URIs based on owl:sameAs, (inverse) functional properties and (max-)cardinalities, and then extend such kernel iteratively in terms of discriminative property-value pairs in the descriptions of URIs. In particular, the discriminability is learnt with a statistical measurement, which not only exploits key characteristics for representing an object, but also takes into account the matchability between properties from pragmatics. In addition, frequent property combinations are mined to improve the accuracy of the resolution. We implement a scalable system and demonstrate that our approach achieves good precision and recall for resolving object coreference, on both benchmark and large-scale datasets."
www,https://dl.acm.org/doi/pdf/10.1145/1963405.1963423,Query segmentation revisited,"Matthias Hagen, Martin Potthast, Benno Stein, Christof Bräutigam, ","We address the problem of query segmentation: given a keyword query, the task is to group the keywords into phrases, if possible. Previous approaches to the problem achieve reasonable segmentation performance but are tested only against a small corpus of manually segmented queries. In addition, many of the previous approaches are fairly intricate as they use expensive features and are difficult to be reimplemented."
www,https://dl.acm.org/doi/pdf/10.1145/1963405.1963424,Context-sensitive query auto-completion,"Ziv Bar-Yossef, Naama Kraus, ","Query auto completion is known to provide poor predictions of the user's query when her input prefix is very short (e.g., one or two characters). In this paper we show that context, such as the user's recent queries, can be used to improve the prediction quality considerably even for such short prefixes. We propose a context-sensitive query auto completion algorithm, NearestCompletion, which outputs the completions of the user's input that are most similar to the context queries. To measure similarity, we represent queries and contexts as high-dimensional term-weighted vectors and resort to cosine similarity. The mapping from queries to vectors is done through a new query expansion technique that we introduce, which expands a query by traversing the query recommendation tree rooted at the query."
www,https://dl.acm.org/doi/pdf/10.1145/1963405.1963425,Online spelling correction for query completion,"Huizhong Duan, Bo-June (Paul) Hsu, ","In this paper, we study the problem of online spelling correction for query completions. Misspelling is a common phenomenon among search engines queries. In order to help users effectively express their information needs, mechanisms for automatically correcting misspelled queries are required. Online spelling correction aims to provide spell corrected completion suggestions as a query is incrementally entered. As latency is crucial to the utility of the suggestions, such an algorithm needs to be not only accurate, but also efficient."
www,https://dl.acm.org/doi/pdf/10.1145/1963405.1963427,An expressive mechanism for auctions on the web,"Paul Dütting, Monika Henzinger, Ingmar Weber, ","Auctions are widely used on the Web. Applications range from internet advertising to platforms such as eBay. In most of these applications the auctions in use are single/multi-item auctions with unit demand. The main drawback of standard mechanisms for this type of auctions, such as VCG and GSP, is the limited expressiveness that they offer to the bidders. The General Auction Mechanism (GAM) of [1] is taking a first step towards addressing the problem of limited expressiveness by computing a bidder optimal, envy free outcome for linear utility functions with identical slopes and a single discontinuity per bidder-item pair. We show that in many practical situations this does not suffice to adequately model the preferences of the bidders, and we overcome this problem by presenting the first mechanism for piece-wise linear utility functions with non-identical slopes and multiple discontinuities. Our mechanism runs in polynomial time. Like GAM it is incentive compatible for inputs that fulfill a certain non-degeneracy requirement, but our requirement is more general than the requirement of GAM. For discontinuous utility functions that are non-degenerate as well as for continuous utility functions the outcome of our mechanism is a competitive equilibrium. We also show how our mechanism can be used to compute approximately bidder optimal, envy free outcomes for a general class of continuous utility functions via piece-wise linear approximation. Finally, we prove hardness results for even more expressive settings."
www,https://dl.acm.org/doi/pdf/10.1145/1963405.1963428,Incentivizing high-quality user-generated content,"Arpita Ghosh, Preston McAfee, ","We model the economics of incentivizing high-quality user generated content (UGC), motivated by settings such as online review forums, question-answer sites, and comments on news articles and blogs. We provide a game-theoretic model within which to study the problem of incentivizing high quality UGC, in which contributors are strategic and motivated by exposure. Our model has the feature that both the quality of contributions as well as the extent of participation is determined endogenously in a free-entry Nash equilibrium."
www,https://dl.acm.org/doi/pdf/10.1145/1963405.1963429,Buy-it-now or take-a-chance: a simple sequential screening mechanism,"L. Elisa Celis, Gregory Lewis, Markus M. Mobius, Hamid Nazerzadeh, ","We present a simple auction mechanism which extends the second-price auction with reserve and is truthful in expectation. This mechanism is particularly effective in private value environments where the distribution of valuations are irregular. Bidders can ""buy-it-now"", or alternatively ""take-a-chance"" where the top d bidders are equally likely to win. The randomized take-a-chance allocation incentivizes high valuation bidders to buy-it-now. We show that for a large class of valuations, this mechanism achieves similar allocations and revenues as Myerson's optimal mechanism, and outperforms the second-price auction with reserve."
www,https://dl.acm.org/doi/pdf/10.1145/1963405.1963431,"Here, there, and everywhere: correlated online behaviors can lead to overestimates of the effects of advertising","Randall A. Lewis, Justin M. Rao, David H. Reiley, ","Measuring the causal effects of online advertising (adfx) on user behavior is important to the health of the WWW publishing industry. In this paper, using three controlled experiments, we show that observational data frequently lead to incorrect estimates of adfx. The reason, which we label ""activity bias,"" comes from the surprising amount of time-based correlation between the myriad activities that users undertake online. In Experiment 1, users who are exposed to an ad on a given day are much more likely to engage in brand-relevant search queries as compared to their recent history for reasons that had nothing do with the advertisement. In Experiment 2, we show that activity bias occurs for page views across diverse websites. In Experiment 3, we track account sign-ups at a competitor's (of the advertiser) website and find that many more people sign-up on the day they saw an advertisement than on other days, but that the true ""competitive effect"" was minimal. In all three experiments, exposure to a campaign signals doing ""more of everything"" in given period of time, making it difficult to find a suitable ""matched control"" using prior behavior. In such cases, the ""match"" is fundamentally different from the exposed group, and we show how and why observational methods lead to a massive overestimate of adfx in such circumstances."
www,https://dl.acm.org/doi/pdf/10.1145/1963405.1963432,Adaptive policies for selecting groupon style chunked reward ads in a stochastic knapsack framework,"Michael Grabchak, Narayan Bhamidipati, Rushi Bhatt, ","Stochastic knapsack problems deal with selecting items with potentially random sizes and rewards so as to maximize the total reward while satisfying certain capacity constraints. A novel variant of this problem, where items are worthless unless collected in bundles, is introduced here. This setup is similar to the Groupon model, where a deal is off unless a minimum number of users sign up for it. Since the optimal algorithm to solve this problem is not practical, several adaptive greedy approaches with reasonable time and memory requirements are studied in detail - theoretically, as well as, experimentally. Worst case performance guarantees are provided for some of these greedy algorithms, while results of experimental evaluation demonstrate that they are much closer to optimal than what the theoretical bounds suggest. Applications include optimizing for online advertising pricing models where advertisers pay only when certain goals, in terms of clicks or conversions, are met. We perform extensive experiments for the situation where there are between two and five ads. For typical ad conversion rates, the greedy policy of selecting items having the highest individual expected reward obtains a value within 5% of optimal over 95% of the time for a wide selection of parameters."
www,https://dl.acm.org/doi/pdf/10.1145/1963405.1963433,A game theoretic formulation of the service provisioning problem in cloud systems,"Danilo Ardagna, Barbara Panicucci, Mauro Passacantando, ","Cloud computing is an emerging paradigm which allows the on-demand delivering of software, hardware, and data as services. As cloud-based services are more numerous and dynamic, the development of efficient service provisioning policies become increasingly challenging. Game theoretic approaches have shown to gain a thorough analytical understanding of the service provisioning problem."
www,https://dl.acm.org/doi/pdf/10.1145/1963405.1963435,ARROW: GenerAting SignatuRes to Detect DRive-By DOWnloads,"Junjie Zhang, Christian Seifert, Jack W. Stokes, Wenke Lee, ","A drive-by download attack occurs when a user visits a webpage which attempts to automatically download malware without the user's consent. Attackers sometimes use a malware distribution network (MDN) to manage a large number of malicious webpages, exploits, and malware executables. In this paper, we provide a new method to determine these MDNs from the secondary URLs and redirect chains recorded by a high-interaction client honeypot. In addition, we propose a novel drive-by download detection method. Instead of depending on the malicious content used by previous methods, our algorithm first identifies and then leverages the URLs of the MDN's central servers, where a central server is a common server shared by a large percentage of the drive-by download attacks in the same MDN. A set of regular expression-based signatures are then generated based on the URLs of each central server. This method allows additional malicious webpages to be identified which launched but failed to execute a successful drive-by download attack. The new drive-by detection system named ARROW has been implemented, and we provide a large-scale evaluation on the output of a production drive-by detection system. The experimental results demonstrate the effectiveness of our method, where the detection coverage has been boosted by 96% with an extremely low false positive rate."
