conference,url,title,authors,abstract
kdd,https://dl.acm.org/doi/pdf/10.1145/3447548.3467446,A Color-blind 3-Approximation for Chromatic Correlation Clustering and Improved Heuristics,"Nicolas Klodt, Lars Seifert, Arthur Zahn, Katrin Casel, Davis Issac, ","Chromatic Correlation Clustering (CCC) models clustering of objects with categorical pairwise relationships. The model can be viewed as clustering the vertices of a graph with edge-labels (colors). Bonchi et al. [KDD 2012] introduced it as a natural generalization of the well studied problem Correlation Clustering (CC), motivated by real-world applications from data-mining, social networks and bioinformatics. We give theoretical as well as practical contributions to the study of CCC. Our main theoretical contribution is an alternative analysis of the famous Pivot algorithm for CC. We show that, when simply run color-blind, Pivot is also a linear time 3-approximation for CCC. The previous best theoretical results for CCC were a 4-approximation with a high-degree polynomial runtime and a linear time 11-approximation, both by Anava et al. [WWW 2015]. While this theoretical result justifies Pivot as a baseline comparison for other heuristics, its blunt color-blindness performs poorly in practice. We develop a color-sensitive, practical heuristic we call Greedy Expansion that empirically outperforms all heuristics proposed for CCC so far, both on real-world and synthetic instances. Further, we propose a novel generalization of CCC allowing for multi-labelled edges. We argue that it is more suitable for many of the real-world applications and extend our results to this model."
kdd,https://dl.acm.org/doi/pdf/10.1145/3447548.3467316,Dip-based Deep Embedded Clustering with k-Estimation,"Collin Leiber, Lena G. M. Bauer, Benjamin Schelling, Christian Böhm, ","The combination of clustering with Deep Learning has gained much attention in recent years. Unsupervised neural networks like autoencoders can autonomously learn the essential structures in a data set. This idea can be combined with clustering objectives to learn relevant features automatically. Unfortunately, they are often based on a k-means framework, from which they inherit various assumptions, like spherical-shaped clusters. Another assumption, also found in approaches outside the k-means-family, is knowing the number of clusters a-priori. In this paper, we present the novel clustering algorithm DipDECK, which can estimate the number of clusters simultaneously to improving a Deep Learning-based clustering objective. Additionally, we can cluster complex data sets without assuming only spherically shaped clusters. Our algorithm works by heavily overestimating the number of clusters in the embedded space of an autoencoder and, based on Hartigan's Dip-test - a statistical test for unimodality - analyses the resulting micro-clusters to determine which to merge. We show in extensive experiments the various benefits of our method: (1) we achieve competitive results while learning the clustering-friendly representation and number of clusters simultaneously; (2) our method is robust regarding parameters, stable in performance, and allows for more flexibility in the cluster shape; (3) we outperform relevant competitors in the estimation of the number of clusters."
kdd,https://dl.acm.org/doi/pdf/10.1145/3447548.3467213,What Do You See?: Evaluation of Explainable Artificial Intelligence (XAI) Interpretability through Neural Backdoors,"Yi-Shan Lin, Wen-Chuan Lee, Z. Berkay Celik, ","EXplainable AI (XAI) methods have been proposed to interpret how a deep neural network predicts inputs through model saliency explanations that highlight the input parts deemed important to arrive at a decision for a specific target. However, it remains challenging to quantify the correctness of their interpretability as current evaluation approaches either require subjective input from humans or incur high computation cost with automated evaluation. In this paper, we propose backdoor trigger patterns--hidden malicious functionalities that cause misclassification--to automate the evaluation of saliency explanations. Our key observation is that triggers provide ground truth for inputs to evaluate whether the regions identified by an XAI method are truly relevant to its output. Since backdoor triggers are the most important features that cause deliberate misclassification, a robust XAI method should reveal their presence at inference time. We introduce three complementary metrics for the systematic evaluation of explanations that an XAI method generates. We evaluate seven state-of-the-art model-free and model-specific post-hoc methods through 36 models trojaned with specifically crafted triggers using color, shape, texture, location, and size. We found six methods that use local explanation and feature relevance fail to completely highlight trigger regions, and only a model-free approach can uncover the entire trigger region. We made our code available at https://github.com/yslin013/evalxai."
kdd,https://dl.acm.org/doi/pdf/10.1145/3447548.3467392,NewsEmbed: Modeling News through Pre-trained Document Representations,"Jialu Liu, Tianqi Liu, Cong Yu, ","Effectively modeling text-rich fresh content such as news articles at document-level is a challenging problem. To ensure a content-based model generalize well to a broad range of applications, it is critical to have a training dataset that is large beyond the scale of human labels while achieving desired quality. In this work, we address those two challenges by proposing a novel approach to mine semantically-relevant fresh documents, and their topic labels, with little human supervision. Meanwhile, we design a multitask model called NewsEmbed that alternatively trains a contrastive learning with a multi-label classification to derive a universal document encoder. We show that the proposed approach can provide billions of high quality organic training examples and can be naturally extended to multilingual setting where texts in different languages are encoded in the same semantic space. We experimentally demonstrate NewsEmbed's competitive performance across multiple natural language understanding tasks, both supervised and unsupervised."
kdd,https://dl.acm.org/doi/pdf/10.1145/3447548.3467371,Cross-Node Federated Graph Neural Network for Spatio-Temporal Data Modeling,"Chuizheng Meng, Sirisha Rambhatla, Yan Liu, ","Vast amount of data generated from networks of sensors, wearables, and the Internet of Things (IoT) devices underscores the need for advanced modeling techniques that leverage the spatio-temporal structure of decentralized data due to the need for edge computation and licensing (data access) issues. While federated learning (FL) has emerged as a framework for model training without requiring direct data sharing and exchange, effectively modeling the complex spatio-temporal dependencies to improve forecasting capabilities still remains an open problem. On the other hand, state-of-the-art spatio-temporal forecasting models assume unfettered access to the data, neglecting constraints on data sharing. To bridge this gap, we propose a federated spatio-temporal model -- Cross-Node Federated Graph Neural Network (CNFGNN) -- which explicitly encodes the underlying graph structure using graph neural network (GNN)-based architecture under the constraint of cross-node federated learning, which requires that data in a network of nodes is generated locally on each node and remains decentralized. CNFGNN operates by disentangling the temporal dynamics modeling on devices and spatial dynamics on the server, utilizing alternating optimization to reduce the communication cost, facilitating computations on the edge devices. Experiments on the traffic flow forecasting task show that CNFGNN achieves the best forecasting performance in both transductive and inductive learning settings with no extra computation cost on edge devices, while incurring modest communication cost."
kdd,https://dl.acm.org/doi/pdf/10.1145/3447548.3467404,Scalable Hierarchical Agglomerative Clustering,"Nicholas Monath, Kumar Avinava Dubey, Guru Guruganesh, ","The applicability of agglomerative clustering, for inferring both hierarchical and flat clustering, is limited by its scalability. Existing scalable hierarchical clustering methods sacrifice quality for speed and often lead to over-merging of clusters. In this paper, we present a scalable, agglomerative method for hierarchical clustering that does not sacrifice quality and scales to billions of data points. We perform a detailed theoretical analysis, showing that under mild separability conditions our algorithm can not only recover the optimal flat partition but also provide a two-approximation to non-parametric DP-Means objective. This introduces a novel application of hierarchical clustering as an approximation algorithm for the non-parametric clustering objective. We additionally relate our algorithm to the classic hierarchical agglomerative clustering method. We perform extensive empirical experiments in both hierarchical and flat clustering settings and show that our proposed approach achieves state-of-the-art results on publicly available clustering benchmarks. Finally, we demonstrate our method's scalability by applying it to a dataset of 30 billion queries. Human evaluation of the discovered clusters show that our method finds better quality of clusters than the current state-of-the-art."
kdd,https://dl.acm.org/doi/pdf/10.1145/3447548.3467442,Filtration Curves for Graph Representation,"Leslie O'Bray, Bastian Rieck, Karsten Borgwardt, ","The two predominant approaches to graph comparison in recent years are based on (i) enumerating matching subgraphs or (ii) comparing neighborhoods of nodes. In this work, we complement these two perspectives with a third way of representing graphs: using filtration curves from topological data analysis that capture both edge weight information and global graph structure. Filtration curves are highly efficient to compute and lead to expressive representations of graphs, which we demonstrate on graph classification benchmark datasets. Our work opens the door to a new form of graph representation in data mining."
kdd,https://dl.acm.org/doi/pdf/10.1145/3447548.3467374,"Faster and Generalized Temporal Triangle Counting, via Degeneracy Ordering","Noujan Pashanasangi, C. Seshadhri, ","Triangle counting is a fundamental technique in network analysis, that has received much attention in various input models. The vast majority of triangle counting algorithms are targeted to static graphs. Yet, many real-world graphs are directed and temporal, where edges come with timestamps. Temporal triangles yield much more information, since they account for both the graph topology and the timestamps."
kdd,https://dl.acm.org/doi/pdf/10.1145/3447548.3467245,ProtoPShare: Prototypical Parts Sharing for Similarity Discovery in Interpretable Image Classification,"Dawid Rymarczyk, Łukasz Struski, Jacek Tabor, Bartosz Zieliński, ","In this work, we introduce an extension to ProtoPNet called ProtoPShare which shares prototypical parts between classes. To obtain prototype sharing we prune prototypical parts using a novel data-dependent similarity. Our approach substantially reduces the number of prototypes needed to preserve baseline accuracy and finds prototypical similarities between classes. We show the effectiveness of ProtoPShare on the CUB-200-2011 and the Stanford Cars datasets and confirm the semantic consistency of its prototypical parts in user-study."
kdd,https://dl.acm.org/doi/pdf/10.1145/3447548.3467381,Spectral Clustering of Attributed Multi-relational Graphs,"Ylli Sadikaj, Yllka Velaj, Sahar Behzadi, Claudia Plant, ","Graph clustering aims at discovering a natural grouping of the nodes such that similar nodes are assigned to a common cluster. Many different algorithms have been proposed in the literature: for simple graphs, for graphs with attributes associated to nodes, and for graphs where edges represent different types of relations among nodes. However, complex data in many domains can be represented as both attributed and multi-relational networks."
kdd,https://dl.acm.org/doi/pdf/10.1145/3447548.3467391,Identifying Coordinated Accounts on Social Media through Hidden Influence and Group Behaviours,"Karishma Sharma, Yizhou Zhang, Emilio Ferrara, Yan Liu, ","Disinformation campaigns on social media, involving coordinated activities from malicious accounts towards manipulating public opinion, have become increasingly prevalent. Existing approaches to detect coordinated accounts either make very strict assumptions about coordinated behaviours, or require part of the malicious accounts in the coordinated group to be revealed in order to detect the rest. To address these drawbacks, we propose a generative model, AMDN-HAGE (Attentive Mixture Density Network with Hidden Account Group Estimation) which jointly models account activities and hidden group behaviours based on Temporal Point Processes (TPP) and Gaussian Mixture Model (GMM), to capture inherent characteristics of coordination which is, accounts that coordinate must strongly influence each other's activities, and collectively appear anomalous from normal accounts. To address the challenges of optimizing the proposed model, we provide a bilevel optimization algorithm with theoretical guarantee on convergence. We verified the effectiveness of the proposed method and training algorithm on real-world social network data collected from Twitter related to coordinated campaigns from Russia's Internet Research Agency targeting the 2016 U.S. Presidential Elections, and to identify coordinated campaigns related to the COVID-19 pandemic. Leveraging the learned model, we find that the average influence between coordinated account pairs is the highest. On COVID-19, we found coordinated group spreading anti-vaccination, anti-masks conspiracies that suggest the pandemic is a hoax and political scam."
kdd,https://dl.acm.org/doi/pdf/10.1145/3447548.3467373,Breaking the Limit of Graph Neural Networks by Improving the Assortativity of Graphs with Local Mixing Patterns,"Susheel Suresh, Vinith Budde, Jennifer Neville, Pan Li, Jianzhu Ma, ","Graph neural networks (GNNs) have achieved tremendous success on multiple graph-based learning tasks by fusing network structure and node features. Modern GNN models are built upon iterative aggregation of neighbor's/proximity features by message passing. Its prediction performance has been shown to be strongly bounded by assortative mixing in the graph, a key property wherein nodes with similar attributes mix/connect with each other. We observe that real world networks exhibit heterogeneous or diverse mixing patterns and the conventional global measurement of assortativity, such as global assortativity coefficient, may not be a representative statistic in quantifying this mixing. We adopt a generalized concept, node-level assortativity, one that is based at the node level to better represent the diverse patterns and accurately quantify the learnability of GNNs. We find that the prediction performance of a wide range of GNN models is highly correlated with the node level assortativity. To break this limit, in this work, we focus on transforming the input graph into a computation graph which contains both proximity and structural information as distinct type of edges. The resulted multi-relational graph has an enhanced level of assortativity and, more importantly, preserves rich information from the original graph. We then propose to run GNNs on this computation graph and show that adaptively choosing between structure and proximity leads to improved performance under diverse mixing. Empirically, we show the benefits of adopting our transformation framework for semi-supervised node classification task on a variety of real world graph learning benchmarks."
kdd,https://dl.acm.org/doi/pdf/10.1145/3447548.3467324,Environment Agnostic Invariant Risk Minimization for Classification of Sequential Datasets,"Praveen Venkateswaran, Vinod Muthusamy, Vatche Isahagian, ","The generalization of predictive models that follow the standard risk minimization paradigm of machine learning can be hindered by the presence of spurious correlations in the data. Identifying invariant predictors while training on data from multiple environments can influence models to focus on features that have an invariant causal relationship with the target, while reducing the effect of spurious features. Such invariant risk minimization approaches heavily rely on clearly defined environments and data being perfectly segmented into these environments for training. However, in real-world settings, perfect segmentation is challenging to achieve and these environment-aware approaches prove to be sensitive to segmentation errors. In this work, we present an environment-agnostic approach to develop generalizable models for classification tasks in sequential datasets without needing prior knowledge of environments. We show that our approach results in models that can generalize to out-of-distribution data and are not influenced by spurious correlations. We evaluate our approach on real-world sequential datasets from various domains."
kdd,https://dl.acm.org/doi/pdf/10.1145/3447548.3467322,Alphacore: Data Depth based Core Decomposition,"Friedhelm Victor, Cuneyt G. Akcora, Yulia R. Gel, Murat Kantarcioglu, ","Core decomposition in networks has proven useful for evaluating the importance of nodes and communities in a variety of application domains, ranging from biology to social networks and finance. However, existing core decomposition algorithms have limitations in simultaneously handling multiple node and edge attributes."
kdd,https://dl.acm.org/doi/pdf/10.1145/3447548.3467273,Privacy-Preserving Representation Learning on Graphs: A Mutual Information Perspective,"Binghui Wang, Jiayi Guo, Ang Li, Yiran Chen, Hai Li, ","Learning with graphs has attracted significant attention recently. Existing representation learning methods on graphs have achieved state-of-the-art performance on various graph-related tasks such as node classification, link prediction, etc. However, we observe that these methods could leak serious private information. For instance, one can accurately infer the links (or node identity) in a graph from a node classifier (or link predictor) trained on the learnt node representations by existing methods. To address the issue, we propose a privacy-preserving representation learning framework on graphs from the mutual information perspective. Specifically, our framework includes a primary learning task and a privacy protection task, and we consider node classification and link prediction as the two tasks of interest. Our goal is to learn node representations such that they can be used to achieve high performance for the primary learning task, while obtaining performance for the privacy protection task close to random guessing. We formally formulate our goal via mutual information objectives. However, it is intractable to compute mutual information in practice. Then, we derive tractable variational bounds for the mutual information terms, where each bound can be parameterized via a neural network. Next, we train these parameterized neural networks to approximate the true mutual information and learn privacy-preserving node representations. We finally evaluate our framework on various graph datasets."
kdd,https://dl.acm.org/doi/pdf/10.1145/3447548.3467249,Deconfounded Recommendation for Alleviating Bias Amplification,"Wenjie Wang, Fuli Feng, Xiangnan He, Xiang Wang, Tat-Seng Chua, ","Recommender systems usually amplify the biases in the data. The model learned from historical interactions with imbalanced item distribution will amplify the imbalance by over-recommending items from the majority groups. Addressing this issue is essential for a healthy ecosystem of recommendation in the long run. Existing work applies bias control to the ranking targets (e.g., calibration, fairness, and diversity), but ignores the true reason for bias amplification and trades off the recommendation accuracy."
kdd,https://dl.acm.org/doi/pdf/10.1145/3447548.3467235,Meta Self-training for Few-shot Neural Sequence Labeling,"Yaqing Wang, Subhabrata Mukherjee, Haoda Chu, Yuancheng Tu, Ming Wu, ","Neural sequence labeling is widely adopted for many Natural Language Processing (NLP) tasks, such as Named Entity Recognition (NER) and slot tagging for dialog systems and semantic parsing. Recent advances with large-scale pre-trained language models have shown remarkable success in these tasks when fine-tuned on large amounts of task-specific labeled data. However, obtaining such large-scale labeled training data is not only costly, but also may not be feasible in many sensitive user applications due to data access and privacy constraints. This is exacerbated for sequence labeling tasks requiring such annotations at token-level. In this work, we develop techniques to address the label scarcity challenge for neural sequence labeling models. Specifically, we propose a meta self-training framework which leverages very few manually annotated labels for training neural sequence models. While self-training serves as an effective mechanism to learn from large amounts of unlabeled data via iterative knowledge exchange -- meta-learning helps in adaptive sample re-weighting to mitigate error propagation from noisy pseudo-labels. Extensive experiments on six benchmark datasets including two for massive multilingual NER and four slot tagging datasets for task-oriented dialog systems demonstrate the effectiveness of our method. With only 10 labeled examples for each class in each task, the proposed method achieves 10% improvement over state-of-the-art methods demonstrating its effectiveness for limited training labels regime."
kdd,https://dl.acm.org/doi/pdf/10.1145/3447548.3467326,Understanding and Improving Fairness-Accuracy Trade-offs in Multi-Task Learning,"Yuyan Wang, Xuezhi Wang, Alex Beutel, Flavien Prost, Jilin Chen, ","As multi-task models gain popularity in a wider range of machine learning applications, it is becoming increasingly important for practitioners to understand the fairness implications associated with those models. Most existing fairness literature focuses on learning a single task more fairly, while how ML fairness interacts with multiple tasks in the joint learning setting is largely under-explored. In this paper, we are concerned with how group fairness (e.g., equal opportunity, equalized odds) as an ML fairness concept plays out in the multi-task scenario. In multi-task learning, several tasks are learned jointly to exploit task correlations for a more efficient inductive transfer. This presents a multi-dimensional Pareto frontier on (1) the trade-off between group fairness and accuracy with respect to each task, as well as (2) the trade-offs across multiple tasks. We aim to provide a deeper understanding on how group fairness interacts with accuracy in multi-task learning, and we show that traditional approaches that mainly focus on optimizing the Pareto frontier of multi-task accuracy might not perform well on fairness goals. We propose a new set of metrics to better capture the multi-dimensional Pareto frontier of fairness-accuracy trade-offs uniquely presented in a multi-task learning setting. We further propose a Multi-Task-Aware Fairness (MTA-F) approach to improve fairness in multi-task learning. Experiments on several real-world datasets demonstrate the effectiveness of our proposed approach."
kdd,https://dl.acm.org/doi/pdf/10.1145/3447548.3467291,Enhancing SVMs with Problem Context Aware Pipeline,"Zeyi Wen, Zhishang Zhou, Hanfeng Liu, Bingsheng He, Xia Li, ","In recent years, many data mining practitioners have treated deep neural networks (DNNs) as a standard recipe of creating the state-of-the-art solutions. As a result, models like Support Vector Machines (SVMs) have been overlooked. While the results from DNNs are encouraging, DNNs also come with their huge number of parameters in the model and overheads in long training/inference time. SVMs have excellent properties such as convexity, good generality and efficiency. In this paper, we propose techniques to enhance SVMs with an automatic pipeline which exploits the context of the learning problem. The pipeline consists of several components including data aware subproblem construction, feature customization, data balancing among subproblems with augmentation, and kernel hyper-parameter tuner. Comprehensive experiments show that our proposed solution is more efficient, while producing better results than the other SVM based approaches. Additionally, we conduct a case study of our proposed solution on a popular sentiment analysis problem---the aspect term sentiment analysis (ATSA) task. The study shows that our SVM based solution can achieve competitive predictive accuracy to DNN (and even majority of the BERT) based approaches. Furthermore, our solution is about 40 times faster in inference and has 100 times fewer parameters than the models using BERT. Our findings can encourage more research work on conventional machine learning techniques which may be a good alternative for smaller model size and faster training/inference."
