conference,url,title,authors,abstract
kdd,https://dl.acm.org/doi/pdf/10.1145/2939672.2949031,The Evolving Meaning of Information Security,"Whitfield Diffie, ","When you are developing security systems, new penetration techniques seem to appear as responses to new security measures but in general the flow is the other way around: security exists and evolves because of the evolution of threats. Beginning with the rise of radio in the 20th Century attacks on communication networks have shown two forms: those that go for the big kill --- such as the breaking of Enigma --- and those that assemble small seemingly innocuous leaks of information into a comprehensive understanding of the target's behavior. We will analyze the way in which these trends interact with others to create a situation in which what is possible in security and even the meaning of security in communication networks needs reexamination."
kdd,https://dl.acm.org/doi/pdf/10.1145/2939672.2939694,Aircraft Trajectory Prediction Made Easy with Predictive Analytics,"Samet Ayhan, Hanan Samet, ","At the heart of Air Traffic Management (ATM) lies the Decision Support Systems (DST) that rely upon accurate trajectory prediction to determine how the airspace will look like in the future to make better decisions and advisories. Dealing with airspace that is prone to congestion due to environmental factors still remains the challenge especially when a deterministic approach is used in the trajectory prediction process. In this paper, we describe a novel stochastic trajectory prediction approach for ATM that can be used for more efficient and realistic flight planning and to assist airspace flow management, potentially resulting in higher safety, capacity, and efficiency commensurate with fuel savings thereby reducing emissions for a better environment. Our approach considers airspace as a 3D grid network, where each grid point is a location of a weather observation. We hypothetically build cubes around these grid points, so the entire airspace can be considered as a set of cubes. Each cube is defined by its centroid, the original grid point, and associated weather parameters that remain homogeneous within the cube during a period of time. Then, we align raw trajectories to a set of cube centroids which are basically fixed 3D positions independent of trajectory data. This creates a new form of trajectories which are 4D joint cubes, where each cube is a segment that is associated with not only spatio-temporal attributes but also with weather parameters. Next, we exploit machine learning techniques to train inference models from historical data and apply a stochastic model, a Hidden Markov Model (HMM), to predict trajectories taking environmental uncertainties into account. During the process, we apply time series clustering to generate input observations from an excessive set of weather parameters to feed into the Viterbi algorithm. Our experiments use a real trajectory dataset with pertaining weather observations and demonstrate the effectiveness of our approach to the trajectory prediction process for ATM."
kdd,https://dl.acm.org/doi/pdf/10.1145/2939672.2939695,Developing a Data-Driven Player Ranking in Soccer Using Predictive Model Weights,"Joel Brooks, Matthew Kerr, John Guttag, ","Quantitative evaluation of the ability of soccer players to contribute to team offensive performance is typically based on goals scored, assists made, and shots taken. In this paper, we describe a novel player ranking system based entirely on the value of passes completed. This value is derived based on the relationship of pass locations in a possession and shot opportunities generated. This relationship is learned by applying a supervised machine learning model to pass locations in event data from the 2012-2013 La Liga season. Interestingly, though this metric is based entirely on passes, the derived player rankings are largely consistent with general perceptions of offensive ability, e.g., Messi and Ronaldo are near the top. Additionally, when used to rank midfielders, it separates the more offensively-minded players from others."
kdd,https://dl.acm.org/doi/pdf/10.1145/2939672.2939682,Firebird: Predicting Fire Risk and Prioritizing Fire Inspections in Atlanta,"Michael Madaio, Shang-Tse Chen, Oliver L. Haimson, Wenwen Zhang, ","The Atlanta Fire Rescue Department (AFRD), like many municipal fire departments, actively works to reduce fire risk by inspecting commercial properties for potential hazards and fire code violations. However, AFRD's fire inspection practices relied on tradition and intuition, with no existing data-driven process for prioritizing fire inspections or identifying new properties requiring inspection. In collaboration with AFRD, we developed the Firebird framework to help municipal fire departments identify and prioritize commercial property fire inspections, using machine learning, geocoding, and information visualization. Firebird computes fire risk scores for over 5,000 buildings in the city, with true positive rates of up to 71% in predicting fires. It has identified 6,096 new potential commercial properties to inspect, based on AFRD's criteria for inspection. Furthermore, through an interactive map, Firebird integrates and visualizes fire incidents, property information and risk scores to help AFRD make informed decisions about fire inspections. Firebird has already begun to make positive impact at both local and national levels. It is improving AFRD's inspection processes and Atlanta residents' safety, and was highlighted by National Fire Protection Association (NFPA) as a best practice for using data to inform fire inspections."
kdd,https://dl.acm.org/doi/pdf/10.1145/2939672.2939685,Dynamic and Robust Wildfire Risk Prediction System: An Unsupervised Approach,"Mahsa Salehi, Laura Irina Rusu, Timothy Lynar, Anna Phan, ","Ability to predict the risk of damaging events (e.g. wildfires) is crucial in helping emergency services in their decision making processes, to mitigate and reduce the impact of such events. Today, wildfire rating systems have been in operation extensively in many countries around the world to estimate the danger of wildfires. In this paper we propose a data-driven approach to predict wildfire risk using weather data. We show how we address the inherent challenge arising due to the temporal dynamicity of weather data. Weather observations naturally change in time, with finer-scale variation (e.g. stationary day or night) or large variations (nonstationary day or night), and this determines a temporal variation of the predicted wildfire danger. We show how our dynamic wildfire danger prediction model addresses the aforementioned challenge using context-based anomaly detection techniques. We call our predictive model a Context-Based Fire Risk (CBFR) model. The advantage of our model is that it maintains multiple historical models for different temporal variations (e.g. day versus night), and uses ensemble learning techniques to predict wildfire risk with high accuracy. In addition, it is completely unsupervised and does not rely on expert knowledge, which makes it flexible and easily applied to any region of interest. Our CBFR model is also scalable and can potentially be parallelised to speed up computation. We have considered multiple wildfire locations in the Blue Mountains, Australia as a case study, and compared the results of our system with the existing well-established Australian wildfire rating system. The experimental results show that our predictive model has a substantially higher accuracy in predicting wildfire risk, which makes it an effective model to supplement the operational Australian wildfire rating system."
kdd,https://dl.acm.org/doi/pdf/10.1145/2939672.2939705,A Non-parametric Approach to Detect Epileptogenic Lesions using Restricted Boltzmann Machines,"Yijun Zhao, Bilal Ahmed, Thomas Thesen, Karen E. Blackmon, ","Visual detection of lesional areas on a cortical surface is critical in rendering a successful surgical operation for Treatment Resistant Epilepsy (TRE) patients. Unfortunately, 45% of Focal Cortical Dysplasia (FCD, the most common kind of TRE) patients have no visual abnormalities in their brains' 3D-MRI images. We collaborate with doctors from NYU Langone's Comprehensive Epilepsy Center and apply machine learning methodologies to identify the resective zones for these {MRI-negative} FCD patients. Our task is particularly challenging because MRI images can only provide a limited number of features. Furthermore, data from different patients often exhibit inter-patient variabilities due to age, gender, left/right handedness, etc. In this paper, we introduce a new approach which combines the restricted Boltzmann machines and a Bayesian non-parametric mixture model to address these issues. We demonstrate the efficacy of our model by applying it to a retrospective dataset of MRI-negative FCD patients who are seizure free after surgery."
kdd,https://dl.acm.org/doi/pdf/10.1145/2939672.2939715,Computational Drug Repositioning Using Continuous Self-Controlled Case Series,"Zhaobin Kuang, James Thomson, Michael Caldwell, Peggy Peissig, ","Computational Drug Repositioning (CDR) is the task of discovering potential new indications for existing drugs by mining large-scale heterogeneous drug-related data sources. Leveraging the patient-level temporal ordering information between numeric physiological measurements and various drug prescriptions provided in Electronic Health Records (EHRs), we propose a Continuous Self-controlled Case Series (CSCCS) model for CDR. As an initial evaluation, we look for drugs that can control Fasting Blood Glucose (FBG) level in our experiments. Applying CSCCS to the Marshfield Clinic EHR, well-known drugs that are indicated for controlling blood glucose level are rediscovered. Furthermore, some drugs with recent literature support for the potential effect of blood glucose level control are also identified."
kdd,https://dl.acm.org/doi/pdf/10.1145/2939672.2939730,Scalable Fast Rank-1 Dictionary Learning for fMRI Big Data Analysis,"Xiang Li, Milad Makkie, Binbin Lin, Mojtaba Sedigh Fazli, Ian Davidson, ","It has been shown from various functional neuroimaging studies that sparsity-regularized dictionary learning could achieve superior performance in decomposing comprehensive and neuroscientifically meaningful functional networks from massive fMRI signals. However, the computational cost for solving the dictionary learning problem has been known to be very demanding, especially when dealing with large-scale data sets. Thus in this work, we propose a novel distributed rank-1 dictionary learning (D-r1DL) model and apply it for fMRI big data analysis. The model estimates one rank-1 basis vector with sparsity constraint on its loading coefficient from the input data at each learning step through alternating least squares updates. By iteratively learning the rank-1 basis and deflating the input data at each step, the model is then capable of decomposing the whole set of functional networks. We implement and parallelize the rank-1 dictionary learning algorithm using Spark engine and deployed the resilient distributed dataset (RDDs) abstracts for the data distribution and operations. Experimental results from applying the model on the Human Connectome Project (HCP) data show that the proposed D-r1DL model is efficient and scalable towards fMRI big data analytics, thus enabling data-driven neuroscientific discovery from massive fMRI big data in the future."
kdd,https://dl.acm.org/doi/pdf/10.1145/2939672.2939734,When Recommendation Goes Wrong: Anomalous Link Discovery in Recommendation Networks,"Bryan Perozzi, Michael Schueppert, Jack Saalweachter, Mayur Thakur, ","We present a secondary ranking system to find and remove erroneous suggestions from a geospatial recommendation system. We discover such anomalous links by ""double checking"" the recommendation system's output to ensure that it is both structurally cohesive, and semantically consistent."
kdd,https://dl.acm.org/doi/pdf/10.1145/2939672.2939731,Deploying Analytics with the Portable Format for Analytics (PFA),"Jim Pivarski, Collin Bennett, Robert L. Grossman, ","We introduce a new language for deploying analytic models into products, services and operational systems called the Portable Format for Analytics (PFA). PFA is an example of what is sometimes called a model interchange format, a language for describing analytic models that is independent of specific tools, applications or systems. Model interchange formats allow one application (the model producer) to export models and another application (the model consumer or scoring engine) to import models. The core idea behind PFA is to support the safe execution of statistical functions, mathematical functions, and machine learning algorithms and their compositions within a safe execution environment. With this approach, the common analytic models used in data science can be implemented, as well as the data transformations and data aggregations required for pre- and post-processing data. PFA compliant scoring engines can be extended by adding new user defined functions described in PFA. We describe the design of PFA. A Data Mining Group (DMG) Working Group is developing the PFA standard. The current version is 0.8.1 and contains many of the commonly used statistical and machine learning models, including regression, clustering, support vector machines, neural networks, etc. We also describe two implementations of Hadrian, one in Scala and one in Python. We discuss four case studies that use PFA and Hadrian to specify analytic models, including two that are deployed in operations at client sites."
kdd,https://dl.acm.org/doi/pdf/10.1145/2939672.2939736,Crime Rate Inference with Big Data,"Hongjian Wang, Daniel Kifer, Corina Graif, Zhenhui Li, ","Crime is one of the most important social problems in the country, affecting public safety, children development, and adult socioeconomic status. Understanding what factors cause higher crime is critical for policy makers in their efforts to reduce crime and increase citizens' life quality. We tackle a fundamental problem in our paper: crime rate inference at the neighborhood level. Traditional approaches have used demographics and geographical influences to estimate crime rates in a region. With the fast development of positioning technology and prevalence of mobile devices, a large amount of modern urban data have been collected and such big data can provide new perspectives for understanding crime. In this paper, we used large-scale Point-Of-Interest data and taxi flow data in the city of Chicago, IL in the USA. We observed significantly improved performance in crime rate inference compared to using traditional features. Such an improvement is consistent over multiple years. We also show that these new features are significant in the feature importance analysis."
kdd,https://dl.acm.org/doi/pdf/10.1145/2939672.2939733,Improving the Sensitivity of Online Controlled Experiments: Case Studies at Netflix,"Huizhi Xie, Juliette Aurisset, ","Controlled experiments are widely regarded as the most scientific way to establish a true causal relationship between product changes and their impact on business metrics. Many technology companies rely on such experiments as their main data-driven decision-making tool. The sensitivity of a controlled experiment refers to its ability to detect differences in business metrics due to product changes. At Netflix, with tens of millions of users, increasing the sensitivity of controlled experiments is critical as failure to detect a small effect, either positive or negative, can have a substantial revenue impact. This paper focuses on methods to increase sensitivity by reducing the sampling variance of business metrics. We define Netflix business metrics and share context around the critical need for improved sensitivity. We review popular variance reduction techniques that are broadly applicable to any type of controlled experiment and metric. We describe an innovative implementation of stratified sampling at Netflix where users are assigned to experiments in real time and discuss some surprising challenges with the implementation. We conduct case studies to compare these variance reduction techniques on a few Netflix datasets. Based on the empirical results, we recommend to use post-assignment variance reduction techniques such as post stratification and CUPED instead of at-assignment variance reduction techniques such as stratified sampling in large-scale controlled experiments."
kdd,https://dl.acm.org/doi/pdf/10.1145/2939672.2939796,Communication Efficient Distributed Kernel Principal Component Analysis,"Maria Florina Balcan, Yingyu Liang, Le Song, David Woodruff, Bo Xie, ","Kernel Principal Component Analysis (KPCA) is a key machine learning algorithm for extracting nonlinear features from data. In the presence of a large volume of high dimensional data collected in a distributed fashion, it becomes very costly to communicate all of this data to a single data center and then perform kernel PCA. Can we perform kernel PCA on the entire dataset in a distributed and communication efficient fashion while maintaining provable and strong guarantees in solution quality?"
kdd,https://dl.acm.org/doi/pdf/10.1145/2939672.2939797,"The Limits of Popularity-Based Recommendations, and the Role of Social Ties","Marco Bressan, Stefano Leucci, Alessandro Panconesi, ","In this paper we introduce a mathematical model that captures some of the salient features of recommender systems that are based on popularity and that try to exploit social ties among the users. We show that, under very general conditions, the market always converges to a steady state, for which we are able to give an explicit form. Thanks to this we can tell rather precisely how much a market is altered by a recommendation system, and determine the power of users to influence others. Our theoretical results are complemented by experiments with real world social networks showing that social graphs prevent large market distortions in spite of the presence of highly influential users."
kdd,https://dl.acm.org/doi/pdf/10.1145/2939672.2939784,FASCINATE: Fast Cross-Layer Dependency Inference on Multi-layered Networks,"Chen Chen, Hanghang Tong, Lei Xie, Lei Ying, Qing He, ","Multi-layered networks have recently emerged as a new network model, which naturally finds itself in many high-impact application domains, ranging from critical inter-dependent infrastructure networks, biological systems, organization-level collaborations, to cross-platform e-commerce, etc. Cross-layer dependency, which describes the dependencies or the associations between nodes across different layers/networks, often plays a central role in many data mining tasks on such multi-layered networks. Yet, it remains a daunting task to accurately know the cross-layer dependency a prior. In this paper, we address the problem of inferring the missing cross-layer dependencies on multi-layered networks. The key idea behind our method is to view it as a collective collaborative filtering problem. By formulating the problem into a regularized optimization model, we propose an effective algorithm to find the local optima with linear complexity. Furthermore, we derive an online algorithm to accommodate newly arrived nodes, whose complexity is just linear wrt the size of the neighborhood of the new node. We perform extensive empirical evaluations to demonstrate the effectiveness and the efficiency of the proposed methods."
kdd,https://dl.acm.org/doi/pdf/10.1145/2939672.2939764,Predicting Matchups and Preferences in Context,"Shuo Chen, Thorsten Joachims, ","We present a general probabilistic framework for predicting the outcome of pairwise matchups (e.g. two-player sport matches) and pairwise preferences (e.g. product preferences), both of which have widespread applications ranging from matchmaking in computer games to recommendation in e-commerce. Unlike existing models for these tasks, our model not only learns representations of the items in a more expressive latent vector space, but also models how context modifies matchup and preference outcomes. For example, the context ""weather"" may alter the winning probability in a tennis match, or the fact that the user is on a mobile device may alter his preferences among restaurants. More generally, the model is capable of handling any symmetric game/comparison problem that can be described by vectorized player/item and game/context features. We provide a comprehensive evaluation of its predictive performance with real datasets from both domains to show its ability to predict preference and game outcomes more accurately than existing models. Furthermore, we demonstrate on synthetic datasets the expressiveness of the model when compared against theoretical limits."
kdd,https://dl.acm.org/doi/pdf/10.1145/2939672.2939785,XGBoost: A Scalable Tree Boosting System,"Tianqi Chen, Carlos Guestrin, ","Tree boosting is a highly effective and widely used machine learning method. In this paper, we describe a scalable end-to-end tree boosting system called XGBoost, which is used widely by data scientists to achieve state-of-the-art results on many machine learning challenges. We propose a novel sparsity-aware algorithm for sparse data and weighted quantile sketch for approximate tree learning. More importantly, we provide insights on cache access patterns, data compression and sharding to build a scalable tree boosting system. By combining these insights, XGBoost scales beyond billions of examples using far fewer resources than existing systems."
kdd,https://dl.acm.org/doi/pdf/10.1145/2939672.2939765,Ranking Causal Anomalies via Temporal and Dynamical Analysis on Vanishing Correlations,"Wei Cheng, Kai Zhang, Haifeng Chen, Guofei Jiang, ","Modern world has witnessed a dramatic increase in our ability to collect, transmit and distribute real-time monitoring and surveillance data from large-scale information systems and cyber-physical systems. Detecting system anomalies thus attracts significant amount of interest in many fields such as security, fault management, and industrial optimization. Recently, invariant network has shown to be a powerful way in characterizing complex system behaviours. In the invariant network, a node represents a system component and an edge indicates a stable, significant interaction between two components. Structures and evolutions of the invariance network, in particular the vanishing correlations, can shed important light on locating causal anomalies and performing diagnosis. However, existing approaches to detect causal anomalies with the invariant network often use the percentage of vanishing correlations to rank possible casual components, which have several limitations: 1) fault propagation in the network is ignored; 2) the root casual anomalies may not always be the nodes with a high-percentage of vanishing correlations; 3) temporal patterns of vanishing correlations are not exploited for robust detection. To address these limitations, in this paper we propose a network diffusion based framework to identify significant causal anomalies and rank them. Our approach can effectively model fault propagation over the entire invariant network, and can perform joint inference on both the structural, and the time-evolving broken invariance patterns. As a result, it can locate high-confidence anomalies that are truly responsible for the vanishing correlations, and can compensate for unstructured measurement noise in the system. Extensive experiments on synthetic datasets, bank information system datasets, and coal plant cyber-physical system datasets demonstrate the effectiveness of our approach."
kdd,https://dl.acm.org/doi/pdf/10.1145/2939672.2939771,TRIÈST: Counting Local and Global Triangles in Fully-Dynamic Streams with Fixed Memory Size,"Lorenzo De Stefani, Alessandro Epasto, Matteo Riondato, Eli Upfal, ","We present TRIEST, a suite of one-pass streaming algorithms to compute unbiased, low-variance, high-quality approximations of the global and local (i.e., incident to each vertex) number of triangles in a fully-dynamic graph represented as an adversarial stream of edge insertions and deletions."
kdd,https://dl.acm.org/doi/pdf/10.1145/2939672.2939800,Efficient Frequent Directions Algorithm for Sparse Matrices,"Mina Ghashami, Edo Liberty, Jeff M. Phillips, ","This paper describes Sparse Frequent Directions, a variant of Frequent Directions for sketching sparse matrices. It resembles the original algorithm in many ways: both receive the rows of an input matrix An x d one by one in the streaming setting and compute a small sketch B ∈ Rl x d. Both share the same strong (provably optimal) asymptotic guarantees with respect to the space-accuracy tradeoff in the streaming setting. However, unlike Frequent Directions which runs in O(ndl) time regardless of the sparsity of the input matrix A, Sparse Frequent Directions runs in Õ(nnz(A)l + nl2) time. Our analysis loosens the dependence on computing the Singular Value Decomposition (SVD) as a black box within the Frequent Directions algorithm. Our bounds require recent results on the properties of fast approximate SVD computations. Finally, we empirically demonstrate that these asymptotic improvements are practical and significant on real and synthetic data."
