conference,url,title,authors,abstract
kdd,https://dl.acm.org/doi/pdf/10.1145/3447548.3467402,Fine-Grained System Identification of Nonlinear Neural Circuits,"Dawna Bagherian, James Gornet, Jeremy Bernstein, Yu-Li Ni, ","We study the problem of sparse nonlinear model recovery of high dimensional compositional functions. Our study is motivated by emerging opportunities in neuroscience to recover fine-grained models of biological neural circuits using collected measurement data. Guided by available domain knowledge in neuroscience, we explore conditions under which one can recover the underlying biological circuit that generated the training data. Our results suggest insights of both theoretical and practical interests. Most notably, we find that a sign constraint on the weights is a necessary condition for system recovery, which we establish both theoretically with an identifiability guarantee and empirically on simulated biological circuits. We conclude with a case study on retinal ganglion cell circuits using data collected from mouse retina, showcasing the practical potential of this approach."
kdd,https://dl.acm.org/doi/pdf/10.1145/3447548.3467365,On Breaking Truss-Based Communities,"Huiping Chen, Alessio Conte, Roberto Grossi, Grigorios Loukides, ","A k-truss is a graph such that each edge is contained in at least k-2 triangles. This notion has attracted much attention, because it models meaningful cohesive subgraphs of a graph. We introduce the problem of identifying a smallest edge subset of a given graph whose removal makes the graph k-truss-free. We also introduce a problem variant where the identified subset contains only edges incident to a given set of nodes and ensures that these nodes are not contained in any k-truss. These problems are directly applicable in communication networks: the identified edges correspond to vital network connections; or in social networks: the identified edges can be hidden by users or sanitized from the output graph. We show that these problems are NP-hard. We thus develop exact exponential-time algorithms to solve them. To process large networks, we also develop heuristics sped up by an efficient data structure for updating the truss decomposition under edge deletions. We complement our heuristics with a lower bound on the size of an optimal solution to rigorously evaluate their effectiveness. Extensive experiments on 10 real-world graphs show that our heuristics are effective (close to the optimal or to the lower bound) and also efficient (up to two orders of magnitude faster than a natural baseline)."
kdd,https://dl.acm.org/doi/pdf/10.1145/3447548.3467346,Interpreting Internal Activation Patterns in Deep Temporal Neural Networks by Finding Prototypes,"Sohee Cho, Wonjoon Chang, Ginkyeng Lee, Jaesik Choi, ","Deep neural networks have demonstrated competitive performance in classification tasks for sequential data. However, it remains difficult to understand which temporal patterns the internal channels of deep neural networks capture for decision-making in sequential data. To address this issue, we propose a new framework with which to visualize temporal representations learned in deep neural networks without hand-crafted segmentation labels. Given input data, our framework extracts highly activated temporal regions that contribute to activating internal nodes and characterizes such regions by prototype selection method based on Maximum Mean Discrepancy. Representative temporal patterns referred to here as Prototypes of Temporally Activated Patterns (PTAP) provide core examples of subsequences in the sequential data for interpretability. We also analyze the role of each channel by Value-LRP plots using representative prototypes and the distribution of the input attribution. Input attribution plots give visual information to recognize the shapes focused on by the channel for decision-making."
kdd,https://dl.acm.org/doi/pdf/10.1145/3447548.3467257,Graph Similarity Description: How Are These Graphs Similar?,"Corinna Coupette, Jilles Vreeken, ","How do social networks differ across platforms? How do information networks change over time? Answering questions like these requires us to compare two or more graphs. This task is commonly treated as a measurement problem, but numerical answers give limited insight. Here, we argue that if the goal is to gain understanding, we should treat graph similarity assessment as a description problem instead. We formalize this problem as a model selection task using the Minimum Description Length principle, capturing the similarity of the input graphs in a common model and the differences between them in transformations to individual models. To discover good models, we propose Momo, which breaks the problem into two parts and introduces efficient algorithms for each. Through an extensive set of experiments on a wide range of synthetic and real-world graphs, we confirm that Momo works well in practice."
kdd,https://dl.acm.org/doi/pdf/10.1145/3447548.3467437,Global Neighbor Sampling for Mixed CPU-GPU Training on Giant Graphs,"Jialin Dong, Da Zheng, Lin F. Yang, George Karypis, ","Graph neural networks (GNNs) are powerful tools for learning from graph data and are widely used in various applications such as social network recommendation, fraud detection, and graph search. The graphs in these applications are typically large, usually containing hundreds of millions of nodes. Training GNN models on such large graphs efficiently remains a big challenge. Despite a number of sampling-based methods have been proposed to enable mini-batch training on large graphs, these methods have not been proved to work on truly industry-scale graphs, which require GPUs or mixed CPU-GPU training. The state-of-the-art sampling-based methods are usually not optimized for these real-world hardware setups, in which data movement between CPUs and GPUs is a bottleneck. To address this issue, we propose Global Neighborhood Sampling that aims at training GNNs on giant graphs specifically for mixed CPU-GPU training. The algorithm samples a global cache of nodes periodically for all mini-batches and stores them in GPUs. This global cache allows in-GPU importance sampling of mini-batches, which drastically reduces the number of nodes in a mini-batch, especially in the input layer, to reduce data copy between CPU and GPU and mini-batch computation without compromising the training convergence rate or model accuracy. We provide a highly efficient implementation of this method and show that our implementation outperforms an efficient node-wise neighbor sampling baseline by a factor of 2× ~ 4× on giant graphs. It outperforms an efficient implementation of LADIES with small layers by a factor of 2× ~ 14× while achieving much higher accuracy than LADIES. We also theoretically analyze the proposed algorithm and show that with cached node data of a proper size, it enjoys a comparable convergence rate as the underlying node-wise sampling method."
kdd,https://dl.acm.org/doi/pdf/10.1145/3447548.3467348,Differentiable Pattern Set Mining,"Jonas Fischer, Jilles Vreeken, ","Pattern set mining has been successful in discovering small sets of highly informative and useful patterns from data. To find good models, existing methods heuristically explore the twice-exponential search space over all possible pattern sets in a combinatorial way, by which they are limited to data over at most hundreds of features, as well as likely to get stuck in local minima. Here, we propose a gradient based optimization approach that allows us to efficiently discover high-quality pattern sets from data of millions of rows and hundreds of thousands of features."
kdd,https://dl.acm.org/doi/pdf/10.1145/3447548.3467286,Probabilistic and Dynamic Molecule-Disease Interaction Modeling for Drug Discovery,"Tianfan Fu, Cao Xiao, Cheng Qian, Lucas M. Glass, Jimeng Sun, ","Drug discovery aims at finding promising drug molecules for treating target diseases. Existing computational drug discovery methods mainly depend on molecule databases, ignoring valuable data collected from clinical trials. In this work, we propose PRIME to leverage high-quality drug molecules and drug-disease relations in historical clinical trials to narrow down the molecular search space in drug discovery. PRIME also introduces time dependency constraints to model evolving drug-disease relations using a probabilistic deep learning model that can quantify model uncertainty. We evaluated PRIME against leading models on both de novo design and drug repurposing tasks. Results show that compared with the best baselines, PRIME achieves 25.9% relative improvement (i.e., reduction) in average hit-ranking on drug repurposing and 47.6% relative improvement in success rate on de novo design."
kdd,https://dl.acm.org/doi/pdf/10.1145/3447548.3467454,Boosted Second Price Auctions: Revenue Optimization for Heterogeneous Bidders,"Negin Golrezaei, Max Lin, Vahab Mirrokni, Hamid Nazerzadeh, ","The second price auction has been the prevalent auction format used by advertising exchanges because of its simplicity and desirable incentive properties. However, even with an optimized choice of reserve prices, this auction is not revenue optimal when the bidders are heterogeneous and their valuation distributions differ significantly. In order to optimize the revenue of advertising exchanges, we propose an auction format called the boosted second price auction, which assigns a boost value to each bidder. The auction favors bidders with higher boost values and allocates the item to the bidder with the highest boosted bid. We propose a data-driven approach to optimize boost values using the previous bids of the bidders. Our analysis of auction data from Google's online advertising exchange shows that the boosted second price auction with data-optimized boost values outperforms the second price auction and empirical Myerson auction by up to 6% and 3%, respectively."
kdd,https://dl.acm.org/doi/pdf/10.1145/3447548.3467397,UCPhrase: Unsupervised Context-aware Quality Phrase Tagging,"Xiaotao Gu, Zihan Wang, Zhenyu Bi, Yu Meng, Liyuan Liu, ","Identifying and understanding quality phrases from context is a fundamental task in text mining. The most challenging part of this task arguably lies in uncommon, emerging, and domain-specific phrases. The infrequent nature of these phrases significantly hurts the performance of phrase mining methods that rely on sufficient phrase occurrences in the input corpus. Context-aware tagging models, though not restricted by frequency, heavily rely on domain experts for either massive sentence-level gold labels or handcrafted gazetteers. In this work, we propose UCPhrase, a novel unsupervised context-aware quality phrase tagger. Specifically, we induce high-quality phrase spans as silver labels from consistently co-occurring word sequences within each document. Compared with typical context-agnostic distant supervision based on existing knowledge bases (KBs), our silver labels root deeply in the input domain and context, thus having unique advantages in preserving contextual completeness and capturing emerging, out-of-KB phrases. Training a conventional neural tagger based on silver labels usually faces the risk of overfitting phrase surface names. Alternatively, we observe that the contextualized attention maps generated from a transformer-based neural language model effectively reveal the connections between words in a surface-agnostic way. Therefore, we pair such attention maps with the silver labels to train a lightweight span prediction model, which can be applied to new input to recognize (unseen) quality phrases regardless of their surface names or frequency. Thorough experiments on various tasks and datasets, including corpus-level phrase ranking, document-level keyphrase extraction, and sentence-level phrase tagging, demonstrate the superiority of our design over state-of-the-art pre-trained, unsupervised, and distantly supervised methods."
kdd,https://dl.acm.org/doi/pdf/10.1145/3447548.3467337,A Graph-based Approach for Trajectory Similarity Computation in Spatial Networks,"Peng Han, Jin Wang, Di Yao, Shuo Shang, Xiangliang Zhang, ","Trajectory similarity computation is an essential operation in many applications of spatial data analysis. In this paper, we study the problem of trajectory similarity computation over spatial network, where the real distances between objects are reflected by the network distance. Unlike previous studies which learn the representation of trajectories in Euclidean space, it requires to capture not only the sequence information of the trajectory but also the structure of spatial network. To this end, we propose GTS, a brand new framework that can jointly learn both factors so as to accurately compute the similarity. It first learns the representation of each point-of-interest (POI) in the road network along with the trajectory information. This is realized by incorporating the distances between POIs and trajectory in the random walk over the spatial network as well as the loss function. Then the trajectory representation is learned by a Graph Neural Network model to identify neighboring POIs within the same trajectory, together with an LSTM model to capture the sequence information in the trajectory. We conduct comprehensive evaluation on several real world datasets. The experimental results demonstrate that our model substantially outperforms all existing approaches."
kdd,https://dl.acm.org/doi/pdf/10.1145/3447548.3467450,Adaptive Transfer Learning on Graph Neural Networks,"Xueting Han, Zhenhuan Huang, Bang An, Jing Bai, ","Graph neural networks (GNNs) is widely used to learn a powerful representation of graph-structured data. Recent work demonstrates that transferring knowledge from self-supervised tasks to downstream tasks could further improve graph representation. However, there is an inherent gap between self-supervised tasks and downstream tasks in terms of optimization objective and training data. Conventional pre-training methods may be not effective enough on knowledge transfer since they do not make any adaptation for downstream tasks. To solve such problems, we propose a new transfer learning paradigm on GNNs which could effectively leverage self-supervised tasks as auxiliary tasks to help the target task. Our methods would adaptively select and combine different auxiliary tasks with the target task in the fine-tuning stage. We design an adaptive auxiliary loss weighting model to learn the weights of auxiliary tasks by quantifying the consistency between auxiliary tasks and the target task. In addition, we learn the weighting model through meta-learning. Our methods can be applied to various transfer learning approaches, it performs well not only in multi-task learning but also in pre-training and fine-tuning. Comprehensive experiments on multiple downstream tasks demonstrate that the proposed methods can effectively combine auxiliary tasks with the target task and significantly improve the performance compared to state-of-the-art methods."
kdd,https://dl.acm.org/doi/pdf/10.1145/3447548.3467414,PcDGAN: A Continuous Conditional Diverse Generative Adversarial Network For Inverse Design,"Amin Heyrani Nobari, Wei Chen, Faez Ahmed, ","Engineering design tasks often require synthesizing new designs that meet desired performance requirements. The conventional design process, which requires iterative optimization and performance evaluation, is slow and dependent on initial designs. Past work has used conditional generative adversarial networks (cGANs) to enable direct design synthesis for given target performances. However, most existing cGANs are restricted to categorical conditions. Recent work on Continuous conditional GAN (CcGAN) tries to address this problem, but still faces two challenges: 1) it performs poorly on non-uniform performance distributions, and 2) the generated designs may not cover the entire design space. We propose a new model, named Performance Conditioned Diverse Generative Adversarial Network (PcDGAN), which introduces a singular vicinal loss combined with a Determinantal Point Processes (DPP) based loss function to enhance diversity. PcDGAN uses a new self-reinforcing score called the Lambert Log Exponential Transition Score (LLETS) for improved conditioning. Experiments on synthetic problems and a real-world airfoil design problem demonstrate that PcDGAN outperforms state-of-the-art GAN models and improves the conditioning likelihood by 69% in an airfoil generation task and up to 78% in synthetic conditional generation tasks and achieves greater design space coverage. The proposed method enables efficient design synthesis and design space exploration with applications ranging from CAD model generation to metamaterial selection."
kdd,https://dl.acm.org/doi/pdf/10.1145/3447548.3467382,Uncertainty-Aware Reliable Text Classification,"Yibo Hu, Latifur Khan, ","Deep neural networks have significantly contributed to the success in predictive accuracy for classification tasks. However, they tend to make over-confident predictions in real-world settings, where domain shifting and out-of-distribution (OOD) examples exist. Most research on uncertainty estimation focuses on computer vision because it provides visual validation on uncertainty quality. However, few have been presented in the natural language process domain. Unlike Bayesian methods that indirectly infer uncertainty through weight uncertainties, current evidential uncertainty-based methods explicitly model the uncertainty of class probabilities through subjective opinions. They further consider inherent uncertainty in data with different root causes, vacuity (i.e., uncertainty due to a lack of evidence) and dissonance (i.e., uncertainty due to conflicting evidence). In our paper, we firstly apply evidential uncertainty in OOD detection for text classification tasks. We propose an inexpensive framework that adopts both auxiliary outliers and pseudo off-manifold samples to train the model with prior knowledge of a certain class, which has high vacuity for OOD samples. Extensive empirical experiments demonstrate that our model based on evidential uncertainty outperforms other counterparts for detecting OOD examples. Our approach can be easily deployed to traditional recurrent neural networks and fine-tuned pre-trained transformers."
kdd,https://dl.acm.org/doi/pdf/10.1145/3447548.3467300,A Broader Picture of Random-walk Based Graph Embedding,"Zexi Huang, Arlei Silva, Ambuj Singh, ","Graph embedding based on random-walks supports effective solutions for many graph-related downstream tasks. However, the abundance of embedding literature has made it increasingly difficult to compare existing methods and to identify opportunities to advance the state-of-the-art. Meanwhile, existing work has left several fundamental questions---such as how embeddings capture different structural scales and how they should be applied for effective link prediction---unanswered. This paper addresses these challenges with an analytical framework for random-walk based graph embedding that consists of three components: a random-walk process, a similarity function, and an embedding algorithm. Our framework not only categorizes many existing approaches but naturally motivates new ones. With it, we illustrate novel ways to incorporate embeddings at multiple scales to improve downstream task performance. We also show that embeddings based on autocovariance similarity, when paired with dot product ranking for link prediction, outperform state-of-the-art methods based on Pointwise Mutual Information similarity by up to 100%."
kdd,https://dl.acm.org/doi/pdf/10.1145/3447548.3467385,Coupled Graph ODE for Learning Interacting System Dynamics,"Zijie Huang, Yizhou Sun, Wei Wang, ","Many real-world systems such as social networks and moving planets are dynamic in nature, where a set of coupled objects are connected via the interaction graph and exhibit complex behavior along the time. For example, the COVID-19 pandemic can be considered as a dynamical system, where objects represent geographical locations (e.g., states) whose daily confirmed cases of infection evolve over time. Outbreak at one location may influence another location as people travel between these locations, forming a graph. Thus, how to model and predict the complex dynamics for these systems becomes a critical research problem. Existing work on modeling graph-structured data mostly assumes a static setting. How to handle dynamic graphs remains to be further explored. On one hand, features of objects change over time, influenced by the linked objects in the interaction graph. On the other hand, the graph itself can also evolve, where new interactions (links) may form and existing links may drop, which may in turn be affected by the dynamic features of objects. In this paper, we propose coupled graph ODE: a novel latent ordinary differential equation (ODE) generative model that learns the coupled dynamics of nodes and edges with a graph neural network (GNN) based ODE in a continuous manner. Our model consists of two coupled ODE functions for modeling the dynamics of edges and nodes based on their latent representations respectively. It employs a novel encoder parameterized by a GNN for inferring the initial states from historical data, which serves as the starting point of the predicted latent trajectories. Experiment results on the COVID-19 dataset and the simulated social network dataset demonstrate the effectiveness of our proposed method."
kdd,https://dl.acm.org/doi/pdf/10.1145/3447548.3467298,Preference Amplification in Recommender Systems,"Dimitris Kalimeris, Smriti Bhagat, Shankar Kalyanaraman, Udi Weinsberg, ","Recommender systems have become increasingly accurate in suggesting content to users, resulting in users primarily consuming content through recommendations. This can cause the user's interest to narrow toward the recommended content, something we refer to as preference amplification. While this can contribute to increased engagement, it can also lead to negative experiences such as lack of diversity and echo chambers. We propose a theoretical framework for studying such amplification in a matrix factorization based recommender system. We model the dynamics of the system, where users interact with the recommender systems and gradually ""drift'' toward the recommended content, with the recommender system adapting, based on user feedback, to the updated preferences. We study the conditions under which preference amplification manifests, and validate our results with simulations. Finally, we evaluate mitigation strategies that prevent the adverse effects of preference amplification and present experimental results using a real-world large-scale video recommender system showing that by reducing exposure to potentially objectionable content we can increase user engagement by up to 2%."
kdd,https://dl.acm.org/doi/pdf/10.1145/3447548.3467304,Learning to Embed Categorical Features without Embedding Tables for Recommendation,"Wang-Cheng Kang, Derek Zhiyuan Cheng, Tiansheng Yao, ","Embedding learning of categorical features (e.g. user/item IDs) is at the core of various recommendation models. The standard approach creates an embedding table where each row represents a dedicated embedding vector for every unique feature value. However, this method fails to efficiently handle high-cardinality features and unseen feature values (e.g. new video ID) that are prevalent in real-world recommendation systems. In this paper, we propose an alternative embedding framework Deep Hash Embedding (DHE), replacing embedding tables by a deep embedding network to compute embeddings on the fly. DHE first encodes the feature value to a unique identifier vector with multiple hashing functions and transformations, and then applies a DNN to convert the identifier vector to an embedding. The encoding module is deterministic, non-learnable, and free of storage, while the embedding network is updated during the training time to learn embedding generation. Empirical results show that DHE achieves comparable AUC against the standard one-hot full embedding, with smaller model sizes. Our work sheds light on the design of DNN-based alternative embedding schemes for categorical features without using embedding table lookup."
