conference,url,title,authors,abstract
kdd,https://dl.acm.org/doi/pdf/10.1145/2939672.2939879,Optimally Discriminative Choice Sets in Discrete Choice Models: Application to Data-Driven Test Design,"Igor Labutov, Frans Schalekamp, Kelvin Luu, Hod Lipson, Christoph Studer, ","Difficult multiple-choice (MC) questions can be made easy by providing a set of answer options of which most are obviously wrong. In the education literature, a plethora of instructional guides exist for crafting a suitable set of wrong choices (distractors) that enable the assessment of the students' understanding. The art of MC question design thus hinges on the question-maker's experience and knowledge of the potential misconceptions. In contrast, we advocate a data-driven approach, where correct and incorrect options are assembled directly from the students' own past submissions. Large-scale online classroom settings, such as massively open online courses (MOOCs), provide an opportunity to design optimal and adaptive multiple-choice questions that are maximally informative about the students' level of understanding of the material. In this work, we (i) develop a multinomial-logit discrete choice model for the setting of MC testing, (ii) derive an optimization objective for selecting optimally discriminative option sets, (iii) propose an algorithm for finding a globally-optimal solution, and (iv) demonstrate the effectiveness of our approach via synthetic experiments and a user study. We finally showcase an application of our approach to crowd-sourcing tests from technical online forums."
kdd,https://dl.acm.org/doi/pdf/10.1145/2939672.2939857,A Multi-Task Learning Formulation for Survival Analysis,"Yan Li, Jie Wang, Jieping Ye, Chandan K. Reddy, ","Predicting the occurrence of a particular event of interest at future time points is the primary goal of survival analysis. The presence of incomplete observations due to time limitations or loss of data traces is known as censoring which brings unique challenges in this domain and differentiates survival analysis from other standard regression methods. The popularly used survival analysis methods such as Cox proportional hazard model and parametric survival regression suffer from some strict assumptions and hypotheses that are not realistic in most of the real-world applications. To overcome the weaknesses of these two types of methods, in this paper, we reformulate the survival analysis problem as a multi-task learning problem and propose a new multi-task learning based formulation to predict the survival time by estimating the survival status at each time interval during the study duration. We propose an indicator matrix to enable the multi-task learning algorithm to handle censored instances and incorporate some of the important characteristics of survival problems such as non-negative non-increasing list structure into our model through max-heap projection. We employ the L2,1-norm penalty which enables the model to learn a shared representation across related tasks and hence select important features and alleviate over-fitting in high-dimensional feature spaces; thus, reducing the prediction error of each task. To efficiently handle the two non-smooth constraints, in this paper, we propose an optimization method which employs Alternating Direction Method of Multipliers (ADMM) algorithm to solve the proposed multi-task learning problem. We demonstrate the performance of the proposed method using real-world microarray gene expression high-dimensional benchmark datasets and show that our method outperforms state-of-the-art methods."
kdd,https://dl.acm.org/doi/pdf/10.1145/2939672.2939834,Multi-Task Feature Interaction Learning,"Kaixiang Lin, Jianpeng Xu, Inci M. Baytas, Shuiwang Ji, Jiayu Zhou, ","One major limitation of linear models is the lack of capability to capture predictive information from interactions between features. While introducing high-order feature interaction terms can overcome this limitation, this approach tremendously increases the model complexity and imposes significant challenges in the learning against overfitting. In this paper, we proposed a novel Multi-Task feature Interaction Learning~(MTIL) framework to exploit the task relatedness from high-order feature interactions, which provides better generalization performance by inductive transfer among tasks via shared representations of feature interactions. We formulate two concrete approaches under this framework and provide efficient algorithms: the shared interaction approach and the embedded interaction approach. The former assumes tasks share the same set of interactions, and the latter assumes feature interactions from multiple tasks come from a shared subspace. We have provided efficient algorithms for solving the two approaches. Extensive empirical studies on both synthetic and real datasets have demonstrated the effectiveness of the proposed framework."
kdd,https://dl.acm.org/doi/pdf/10.1145/2939672.2939856,Scalable Pattern Matching over Compressed Graphs via Dedensification,"Antonio Maccioni, Daniel J. Abadi, ","One of the most common operations on graph databases is graph pattern matching (e.g., graph isomorphism and more general types of ""subgraph pattern matching""). In fact, in some graph query languages every single query is expressed as a graph matching operation. Consequently, there has been a significant amount of research effort in optimizing graph matching operations in graph database systems. As graph databases have scaled in recent years, so too has recent work on scaling graph matching operations. However, the performance of recent proposals for scaling graph pattern matching is limited by the presence of high-degree nodes. These high-degree nodes result in an explosion of intermediate result sizes during query execution, and therefore significant performance bottlenecks. In this paper we present a dedensification technique that losslessly compresses the neighborhood around high-degree nodes. Furthermore, we introduce a query processing technique that enables direct operation of graph query processing operations over the compressed data, without ever having to decompress the data. For pattern matching operations, we show how this technique can be implemented as a layer above existing graph database systems, so that the end-user can benefit from this technique without requiring modifications to the core graph database engine code. Our technique reduces the size of the intermediate result sets during query processing, and thereby improves query performance."
kdd,https://dl.acm.org/doi/pdf/10.1145/2939672.2939869,Scalable Betweenness Centrality Maximization via Sampling,"Ahmad Mahmoody, Charalampos E. Tsourakakis, Eli Upfal, ","Betweenness centrality (BWC) is a fundamental centrality measure in social network analysis. Given a large-scale network, how can we find the most central nodes? This question is of great importance to many key applications that rely on BWC, including community detection and understanding graph vulnerability. Despite the large amount of work on scalable approximation algorithm design for BWC, estimating BWC on large-scale networks remains a computational challenge."
kdd,https://dl.acm.org/doi/pdf/10.1145/2939672.2939844,Safe Pattern Pruning: An Efficient Approach for Predictive Pattern Mining,"Kazuya Nakagawa, Shinya Suzumura, Masayuki Karasuyama, Koji Tsuda, ","In this paper we study predictive pattern mining problems where the goal is to construct a predictive model based on a subset of predictive patterns in the database. Our main contribution is to introduce a novel method called safe pattern pruning (SPP) for a class of predictive pattern mining problems. The SPP method allows us to efficiently find a superset of all the predictive patterns in the database that are needed for the optimal predictive model. The advantage of the SPP method over existing boosting-type method is that the former can find the superset by a single search over the database, while the latter requires multiple searches. The SPP method is inspired by recent development of safe feature screening. In order to extend the idea of safe feature screening into predictive pattern mining, we derive a novel pruning rule called safe pattern pruning (SPP) rule that can be used for searching over the tree defined among patterns in the database. The SPP rule has a property that, if a node corresponding to a pattern in the database is pruned out by the SPP rule, then it is guaranteed that all the patterns corresponding to its descendant nodes are never needed for the optimal predictive model. We apply the SPP method to graph mining and item-set mining problems, and demonstrate its computational advantage."
kdd,https://dl.acm.org/doi/pdf/10.1145/2939672.2939870,Predict Risk of Relapse for Patients with Multiple Stages of Treatment of Depression,"Zhi Nie, Pinghua Gong, Jieping Ye, ","Depression is a serious mood disorder afflicting millions of people around the globe. Medications of different types and with different effects on neural activity have been developed for its treatments during the past few decades. Due to the heterogeneity of the disorder, many patients cannot achieve symptomatic remission from a single clinical trial. Instead they need multiple clinical trials to achieve remission, resulting in a multiple stage treatment pattern. Furthermore those who indeed achieve symptom remission are still faced with substantial risk of relapse. One promising approach to predicting the risk of relapse is censored regression. Traditional censored regression typically applies only to situations in which the exact time of event of interest is known. However, follow-up studies that track the patients' relapse status can only provide an interval of time during which relapse occurs. The exact time of relapse is usually unknown. In this paper, we present a censored regression approach with a truncated $l_1$ loss function that can handle the uncertainty of relapse time. Based on this general loss function, we develop a gradient boosting algorithm and a stochastic dual coordinate ascent algorithm when the hypothesis in the loss function is represented as (1) an ensemble of decision trees and (2) a linear combination of covariates, respectively. As an extension of our linear model, a multi-stage linear approach is further proposed to harness the data collected from multiple stages of treatment. We evaluate the proposed algorithms using a real-world clinical trial dataset. Results show that our methods outperform the well-known Cox proportional hazard model. In addition, the risk factors identified by our multi-stage linear model not only corroborate findings from recent research but also yield some new insights into how to develop effective measures for prevention of relapse among patients after their initial remission from the acute treatment stage."
kdd,https://dl.acm.org/doi/pdf/10.1145/2939672.2939850,Unbounded Human Learning: Optimal Scheduling for Spaced Repetition,"Siddharth Reddy, Igor Labutov, Siddhartha Banerjee, Thorsten Joachims, ","In the study of human learning, there is broad evidence that our ability to retain information improves with repeated exposure and decays with delay since last exposure. This plays a crucial role in the design of educational software, leading to a trade-off between teaching new material and reviewing what has already been taught. A common way to balance this trade-off is spaced repetition, which uses periodic review of content to improve long-term retention. Though spaced repetition is widely used in practice, e.g., in electronic flashcard software, there is little formal understanding of the design of these systems. Our paper addresses this gap in three ways. First, we mine log data from spaced repetition software to establish the functional dependence of retention on reinforcement and delay. Second, we use this memory model to develop a stochastic model for spaced repetition systems. We propose a queueing network model of the Leitner system for reviewing flashcards, along with a heuristic approximation that admits a tractable optimization problem for review scheduling. Finally, we empirically evaluate our queueing model through a Mechanical Turk experiment, verifying a key qualitative prediction of our model: the existence of a sharp phase transition in learning outcomes upon increasing the rate of new item introductions."
kdd,https://dl.acm.org/doi/pdf/10.1145/2939672.2939865,Reconstructing an Epidemic Over Time,"Polina Rozenshtein, Aristides Gionis, B. Aditya Prakash, Jilles Vreeken, ","We consider the problem of reconstructing an epidemic over time, or, more general, reconstructing the propagation of an activity in a network. Our input consists of a temporal network, which contains information about when two nodes interacted, and a sample of nodes that have been reported as infected. The goal is to recover the flow of the spread, including discovering the starting nodes, and identifying other likely-infected nodes that are not reported. The problem we consider has multiple applications, from public health to social media and viral marketing purposes."
kdd,https://dl.acm.org/doi/pdf/10.1145/2939672.2939876,Improving Survey Aggregation with Sparsely Represented Signals,"Tianlin Shi, Forest Agostinelli, Matthew Staib, David Wipf, ","In this paper, we develop a new aggregation technique to reduce the cost of surveying. Our method aims to jointly estimate a vector of target quantities such as public opinion or voter intent across time and maintain good estimates when using only a fraction of the data. Inspired by the James-Stein estimator, we resolve this challenge by shrinking the estimates to a global mean which is assumed to have a sparse representation in some known basis. This assumption has lead to two different methods for estimating the global mean: orthogonal matching pursuit and deep learning. Both of which significantly reduce the number of samples needed to achieve good estimates of the true means of the data and, in the case of presidential elections, can estimate the outcome of the 2012 United States elections while saving hundreds of thousands of samples and maintaining accuracy."
kdd,https://dl.acm.org/doi/pdf/10.1145/2939672.2939864,Scalable Partial Least Squares Regression on Grammar-Compressed Data Matrices,"Yasuo Tabei, Hiroto Saigo, Yoshihiro Yamanishi, Simon J. Puglisi, ","With massive high-dimensional data now commonplace in research and industry, there is a strong and growing demand for more scalable computational techniques for data analysis and knowledge discovery. Key to turning these data into knowledge is the ability to learn statistical models with high interpretability. Current methods for learning statistical models either produce models that are not interpretable or have prohibitive computational costs when applied to massive data. In this paper we address this need by presenting a scalable algorithm for partial least squares regression (PLS), which we call compression-based PLS (cPLS), to learn predictive linear models with a high interpretability from massive high-dimensional data. We propose a novel grammar-compressed representation of data matrices that supports fast row and column access while the data matrix is in a compressed form. The original data matrix is grammar-compressed and then the linear model in PLS is learned on the compressed data matrix, which results in a significant reduction in working space, greatly improving scalability. We experimentally test cPLS on its ability to learn linear models for classification, regression and feature extraction with various massive high-dimensional data, and show that cPLS performs superiorly in terms of prediction accuracy, computational efficiency, and interpretability."
kdd,https://dl.acm.org/doi/pdf/10.1145/2939672.2939837,From Truth Discovery to Trustworthy Opinion Discovery: An Uncertainty-Aware Quantitative Modeling Approach,"Mengting Wan, Xiangyu Chen, Lance Kaplan, Jiawei Han, Jing Gao, ","In this era of information explosion, conflicts are often encountered when information is provided by multiple sources. Traditional truth discovery task aims to identify the truth the most trustworthy information, from conflicting sources in different scenarios. In this kind of tasks, truth is regarded as a fixed value or a set of fixed values. However, in a number of real-world cases, objective truth existence cannot be ensured and we can only identify single or multiple reliable facts from opinions. Different from traditional truth discovery task, we address this uncertainty and introduce the concept of trustworthy opinion of an entity, treat it as a random variable, and use its distribution to describe consistency or controversy, which is particularly difficult for data which can be numerically measured, i.e. quantitative information. In this study, we focus on the quantitative opinion, propose an uncertainty-aware approach called Kernel Density Estimation from Multiple Sources (KDEm) to estimate its probability distribution, and summarize trustworthy information based on this distribution. Experiments indicate that KDEm not only has outstanding performance on the classical numeric truth discovery task, but also shows good performance on multi-modality detection and anomaly detection in the uncertain-opinion setting."
kdd,https://dl.acm.org/doi/pdf/10.1145/2939672.2939816,A Truth Discovery Approach with Theoretical Guarantee,"Houping Xiao, Jing Gao, Zhaoran Wang, Shiyu Wang, Lu Su, ","In the information age, people can easily collect information about the same set of entities from multiple sources, among which conflicts are inevitable. This leads to an important task, truth discovery, i.e., to identify true facts (truths) via iteratively updating truths and source reliability. However, the convergence to the truths is never discussed in existing work, and thus there is no theoretical guarantee in the results of these truth discovery approaches. In contrast, in this paper we propose a truth discovery approach with theoretical guarantee. We propose a randomized gaussian mixture model (RGMM) to represent multi-source data, where truths are model parameters. We incorporate source bias which captures its reliability degree into RGMM formulation. The truth discovery task is then modeled as seeking the maximum likelihood estimate (MLE) of the truths. Based on expectation-maximization (EM) techniques, we propose population-based (i.e., on the limit of infinite data) and sample-based (i.e., on a finite set of samples) solutions for the MLE. Theoretically, we prove that both solutions are contractive to an ε-ball around the MLE, under certain conditions. Experimentally, we evaluate our method on both simulated and real-world datasets. Experimental results show that our method achieves high accuracy in identifying truths with convergence guarantee."
kdd,https://dl.acm.org/doi/pdf/10.1145/2939672.2939831,Towards Confidence in the Truth: A Bootstrapping based Truth Discovery Approach,"Houping Xiao, Jing Gao, Qi Li, Fenglong Ma, Lu Su, Yunlong Feng, ","The demand for automatic extraction of true information (i.e., truths) from conflicting multi-source data has soared recently. A variety of truth discovery methods have witnessed great successes via jointly estimating source reliability and truths. All existing truth discovery methods focus on providing a point estimator for each object's truth, but in many real-world applications, confidence interval estimation of truths is more desirable, since confidence interval contains richer information. To address this challenge, in this paper, we propose a novel truth discovery method (ETCIBoot) to construct confidence interval estimates as well as identify truths, where the bootstrapping techniques are nicely integrated into the truth discovery procedure. Due to the properties of bootstrapping, the estimators obtained by ETCIBoot are more accurate and robust compared with the state-of-the-art truth discovery approaches. Theoretically, we prove the asymptotical consistency of the confidence interval obtained by ETCIBoot. Experimentally, we demonstrate that ETCIBoot is not only effective in constructing confidence intervals but also able to obtain better truth estimates."
kdd,https://dl.acm.org/doi/pdf/10.1145/2939672.2939881,Online Feature Selection: A Limited-Memory Substitution Algorithm and Its Asynchronous Parallel Variation,"Haichuan Yang, Ryohei Fujimaki, Yukitaka Kusumura, Ji Liu, ","This paper considers the feature selection scenario where only a few features are accessible at any time point. For example, features are generated sequentially and visible one by one. Therefore, one has to make an online decision to identify key features after all features are only scanned once or twice. The optimization based approach is a powerful tool for the online feature selection."
kdd,https://dl.acm.org/doi/pdf/10.1145/2939672.2939827,Absolute Fused Lasso and Its Application to Genome-Wide Association Studies,"Tao Yang, Jun Liu, Pinghua Gong, Ruiwen Zhang, Xiaotong Shen, Jieping Ye, ","In many real-world applications, the samples/features acquired are in spatial or temporal order. In such cases, the magnitudes of adjacent samples/features are typically close to each other. Meanwhile, in the high-dimensional scenario, identifying the most relevant samples/features is also desired. In this paper, we consider a regularized model which can simultaneously identify important features and group similar features together. The model is based on a penalty called Absolute Fused Lasso (AFL). The AFL penalty encourages sparsity in the coefficients as well as their successive differences of absolute values' i.e., local constancy of the coefficient components in absolute values. Due to the non-convexity of AFL, it is challenging to develop efficient algorithms to solve the optimization problem. To this end, we employ the Difference of Convex functions (DC) programming to optimize the proposed non-convex problem. At each DC iteration, we adopt the proximal algorithm to solve a convex regularized sub-problem. One of the major contributions of this paper is to develop a highly efficient algorithm to compute the proximal operator. Empirical studies on both synthetic and real-world data sets from Genome-Wide Association Studies demonstrate the efficiency and effectiveness of the proposed approach in simultaneous identifying important features and grouping similar features."
kdd,https://dl.acm.org/doi/pdf/10.1145/2939672.2939878,Online Context-Aware Recommendation with Time Varying Multi-Armed Bandit,"Chunqiu Zeng, Qing Wang, Shekoofeh Mokhtari, Tao Li, ","Contextual multi-armed bandit problems have gained increasing popularity and attention in recent years due to their capability of leveraging contextual information to deliver online personalized recommendation services (e.g., online advertising and news article selection). To predict the reward of each arm given a particular context, existing relevant research studies for contextual multi-armed bandit problems often assume the existence of a fixed yet unknown reward mapping function. However, this assumption rarely holds in practice, since real-world problems often involve underlying processes that are dynamically evolving over time."
kdd,https://dl.acm.org/doi/pdf/10.1145/2939672.2939811,Collaborative Multi-View Denoising,"Lei Zhang, Shupeng Wang, Xiaoyu Zhang, Yong Wang, Binbin Li, ","In multi-view learning applications, like multimedia analysis and information retrieval, we often encounter the corrupted view problem in which the data are corrupted by two different types of noises, i.e., the intra- and inter-view noises. The noises may affect these applications that commonly acquire complementary representations from different views. Therefore, how to denoise corrupted views from multi-view data is of great importance for applications that integrate and analyze representations from different views. However, the heterogeneity among multi-view representations brings a significant challenge on denoising corrupted views. To address this challenge, we propose a general framework to jointly denoise corrupted views in this paper. Specifically, aiming at capturing the semantic complementarity and distributional similarity among different views, a novel Heterogeneous Linear Metric Learning (HLML) model with low-rank regularization, leave-one-out validation, and pseudo-metric constraints is proposed. Our method linearly maps multi-view data to a high-dimensional feature-homogeneous space that embeds the complementary information from different views. Furthermore, to remove the intra- and inter-view noises, we present a new Multi-view Semi-supervised Collaborative Denoising (MSCD) method with elementary transformation constraints and gradient energy competition to establish the complementary relationship among the heterogeneous representations. Experimental results demonstrate that our proposed methods are effective and efficient."
