conference,url,title,authors,abstract
kdd,https://dl.acm.org/doi/pdf/10.1145/2939672.2939786,Generalized Hierarchical Sparse Model for Arbitrary-Order Interactive Antigenic Sites Identification in Flu Virus Data,"Lei Han, Yu Zhang, Xiu-Feng Wan, Tong Zhang, ","Recent statistical evidence has shown that a regression model by incorporating the interactions among the original covariates (features) can significantly improve the interpretability for biological data. One major challenge is the exponentially expanded feature space when adding high-order feature interactions to the model. To tackle the huge dimensionality, Hierarchical Sparse Models (HSM) are developed by enforcing sparsity under heredity structures in the interactions among the covariates. However, existing methods only consider pairwise interactions, making the discovery of important high-order interactions a non-trivial open problem. In this paper, we propose a Generalized Hierarchical Sparse Model (GHSM) as a generalization of the HSM models to learn arbitrary-order interactions. The GHSM applies the l1 penalty to all the model coefficients under a constraint that given any covariate, if none of its associated kth-order interactions contribute to the regression model, then neither do its associated higher-order interactions. The resulting objective function is non-convex with a challenge lying in the coupled variables appearing in the arbitrary-order hierarchical constraints and we devise an efficient optimization algorithm to directly solve it. Specifically, we decouple the variables in the constraints via both the GIST and ADMM methods into three subproblems, each of which is proved to admit an efficiently analytical solution. We evaluate the GHSM method in both synthetic problem and the antigenic sites identification problem for the flu virus data, where we expand the feature space up to the 5th-order interactions. Empirical results demonstrate the effectiveness and efficiency of the proposed method and the learned high-order interactions have meaningful synergistic covariate patterns in the virus antigenicity."
kdd,https://dl.acm.org/doi/pdf/10.1145/2939672.2939807,Joint Community and Structural Hole Spanner Detection via Harmonic Modularity,"Lifang He, Chun-Ta Lu, Jiaqi Ma, Jianping Cao, Linlin Shen, Philip S. Yu, ","Detecting communities (or modular structures) and structural hole spanners, the nodes bridging different communities in a network, are two essential tasks in the realm of network analytics. Due to the topological nature of communities and structural hole spanners, these two tasks are naturally tangled with each other, while there has been little synergy between them. In this paper, we propose a novel harmonic modularity method to tackle both tasks simultaneously. Specifically, we apply a harmonic function to measure the smoothness of community structure and to obtain the community indicator. We then investigate the sparsity level of the interactions between communities, with particular emphasis on the nodes connecting to multiple communities, to discriminate the indicator of SH spanners and assist the community guidance. Extensive experiments on real-world networks demonstrate that our proposed method outperforms several state-of-the-art methods in the community detection task and also in the SH spanner identification task (even the methods that require the supervised community information). Furthermore, by removing the SH spanners spotted by our method, we show that the quality of other community detection methods can be further improved."
kdd,https://dl.acm.org/doi/pdf/10.1145/2939672.2939760,Robust Influence Maximization,"Xinran He, David Kempe, ","Uncertainty about models and data is ubiquitous in the computational social sciences, and it creates a need for robust social network algorithms, which can simultaneously provide guarantees across a spectrum of models and parameter settings. We begin an investigation into this broad domain by studying robust algorithms for the Influence Maximization problem, in which the goal is to identify a set of k nodes in a social network whose joint influence on the network is maximized. We define a Robust Influence Maximization framework wherein an algorithm is presented with a set of influence functions, typically derived from different influence models or different parameter settings for the same model. The different parameter settings could be derived from observed cascades on different topics, under different conditions, or at different times. The algorithm's goal is to identify a set of k nodes who are simultaneously influential for all influence functions, compared to the (function-specific) optimum solutions."
kdd,https://dl.acm.org/doi/pdf/10.1145/2939672.2939747,FRAUDAR: Bounding Graph Fraud in the Face of Camouflage,"Bryan Hooi, Hyun Ah Song, Alex Beutel, Neil Shah, Kijung Shin, ","Given a bipartite graph of users and the products that they review, or followers and followees, how can we detect fake reviews or follows? Existing fraud detection methods (spectral, etc.) try to identify dense subgraphs of nodes that are sparsely connected to the remaining graph. Fraudsters can evade these methods using camouflage, by adding reviews or follows with honest targets so that they look ""normal"". Even worse, some fraudsters use hijacked accounts from honest users, and then the camouflage is indeed organic. Our focus is to spot fraudsters in the presence of camouflage or hijacked accounts. We propose FRAUDAR, an algorithm that (a) is camouflage-resistant, (b) provides upper bounds on the effectiveness of fraudsters, and (c) is effective in real-world data. Experimental results under various attacks show that FRAUDAR outperforms the top competitor in accuracy of detecting both camouflaged and non-camouflaged fraud. Additionally, in real-world experiments with a Twitter follower-followee graph of 1.47 billion edges, FRAUDAR successfully detected a subgraph of more than 4000 detected accounts, of which a majority had tweets showing that they used follower-buying services."
kdd,https://dl.acm.org/doi/pdf/10.1145/2939672.2939749,CatchTartan: Representing and Summarizing Dynamic Multicontextual Behaviors,"Meng Jiang, Christos Faloutsos, Jiawei Han, ","Representing and summarizing human behaviors with rich contexts facilitates behavioral sciences and user-oriented services. Traditional behavioral modeling represents a behavior as a tuple in which each element is one contextual factor of one type, and the tensor-based summaries look for high-order dense blocks by clustering the values (including timestamps) in each dimension. However, the human behaviors are multicontextual and dynamic: (1) each behavior takes place within multiple contexts in a few dimensions, which requires the representation to enable non-value and set-values for each dimension; (2) many behavior collections, such as tweets or papers, evolve over time. In this paper, we represent the behavioral data as a two-level matrix (temporal-behaviors by dimensional-values) and propose a novel representation for behavioral summary called Tartan that includes a set of dimensions, the values in each dimension, a list of consecutive time slices and the behaviors in each slice. We further develop a propagation method CatchTartan to catch the dynamic multicontextual patterns from the temporal multidimensional data in a principled and scalable way: it determines the meaningfulness of updating every element in the Tartan by minimizing the encoding cost in a compression manner. CatchTartan outperforms the baselines on both the accuracy and speed. We apply CatchTartan to four Twitter datasets up to 10 million tweets and the DBLP data, providing comprehensive summaries for the events, human life and scientific development."
kdd,https://dl.acm.org/doi/pdf/10.1145/2939672.2939801,Smart Reply: Automated Response Suggestion for Email,"Anjuli Kannan, Karol Kurach, Sujith Ravi, Tobias Kaufmann, ","In this paper we propose and investigate a novel end-to-end method for automatically generating short email responses, called Smart Reply. It generates semantically diverse suggestions that can be used as complete email responses with just one tap on mobile. The system is currently used in Inbox by Gmail and is responsible for assisting with 10% of all mobile responses. It is designed to work at very high throughput and process hundreds of millions of messages daily. The system exploits state-of-the-art, large-scale deep learning."
kdd,https://dl.acm.org/doi/pdf/10.1145/2939672.2939768,QUINT: On Query-Specific Optimal Networks,"Liangyue Li, Yuan Yao, Jie Tang, Wei Fan, Hanghang Tong, ","Measuring node proximity on large scale networks is a fundamental building block in many application domains, ranging from computer vision, e-commerce, social networks, software engineering, disaster management to biology and epidemiology. The state of the art (e.g., random walk based methods) typically assumes the input network is given a priori, with the known network topology and the associated edge weights. A few recent works aim to further infer the optimal edge weights based on the side information. This paper generalizes the challenge in multiple dimensions, aiming to learn optimal networks for node proximity measures. First (optimization scope), our proposed formulation explores a much larger parameter space, so that it is able to simultaneously infer the optimal network topology and the associated edge weights. This is important as a noisy or missing edge could greatly mislead the network node proximity measures. Second (optimization granularity), while all the existing works assume one common optimal network, be it given as the input or learned by the algorithms, exists for all queries, our method performs optimization at a much finer granularity, essentially being able to infer an optimal network that is specific to a given query. Third (optimization efficiency), we carefully design our algorithms with a linear complexity wrt the neighborhood size of the user preference set. We perform extensive empirical evaluations on a diverse set of 10+ real networks, which show that the proposed algorithms (1) consistently outperform the existing methods on all six commonly used metrics; (2) empirically scale sub-linearly to billion-scale networks and (3) respond in a fraction of a second."
kdd,https://dl.acm.org/doi/pdf/10.1145/2939672.2939783,Fast Memory-efficient Anomaly Detection in Streaming Heterogeneous Graphs,"Emaad Manzoor, Sadegh M. Milajerdi, Leman Akoglu, ","Given a stream of heterogeneous graphs containing different types of nodes and edges, how can we spot anomalous ones in real-time while consuming bounded memory? This problem is motivated by and generalizes from its application in security to host-level advanced persistent threat (APT) detection. We propose StreamSpot, a clustering based anomaly detection approach that addresses challenges in two key fronts: (1) heterogeneity, and (2) streaming nature. We introduce a new similarity function for heterogeneous graphs that compares two graphs based on their relative frequency of local substructures, represented as short strings. This function lends itself to a vector representation of a graph, which is (a) fast to compute, and (b) amenable to a sketched version with bounded size that preserves similarity."
kdd,https://dl.acm.org/doi/pdf/10.1145/2939672.2939789,Semi-Markov Switching Vector Autoregressive Model-Based Anomaly Detection in Aviation Systems,"Igor Melnyk, Arindam Banerjee, Bryan Matthews, Nikunj Oza, ","In this work we consider the problem of anomaly detection in heterogeneous, multivariate, variable-length time series datasets. Our focus is on the aviation safety domain, where data objects are flights and time series are sensor readings and pilot switches. In this context the goal is to detect anomalous flight segments, due to mechanical, environmental, or human factors in order to identifying operationally significant events and highlight potential safety risks. For this purpose, we propose a framework which represents each flight using a semi-Markov switching vector autoregressive (SMS-VAR) model. Detection of anomalies is then based on measuring dissimilarities between the model's prediction and data observation. The framework is scalable, due to the inherent parallel nature of most computations, and can be used to perform online anomaly detection. Extensive experimental results on simulated and real datasets illustrate that the framework can detect various types of anomalies along with the key parameters involved."
kdd,https://dl.acm.org/doi/pdf/10.1145/2939672.2939790,Robust Large-Scale Machine Learning in the Cloud,"Steffen Rendle, Dennis Fetterly, Eugene J. Shekita, Bor-yiing Su, ","The convergence behavior of many distributed machine learning (ML) algorithms can be sensitive to the number of machines being used or to changes in the computing environment. As a result, scaling to a large number of machines can be challenging. In this paper, we describe a new scalable coordinate descent (SCD) algorithm for generalized linear models whose convergence behavior is always the same, regardless of how much SCD is scaled out and regardless of the computing environment. This makes SCD highly robust and enables it to scale to massive datasets on low-cost commodity servers. Experimental results on a real advertising dataset in Google are used to demonstrate SCD's cost effectiveness and scalability. Using Google's internal cloud, we show that SCD can provide near linear scaling using thousands of cores for 1 trillion training examples on a petabyte of compressed data. This represents 10,000x more training examples than the 'large-scale' Netflix prize dataset. We also show that SCD can learn a model for 20 billion training examples in two hours for about $10."
kdd,https://dl.acm.org/doi/pdf/10.1145/2939672.2939770,ABRA: Approximating Betweenness Centrality in Static and Dynamic Graphs with Rademacher Averages,"Matteo Riondato, Eli Upfal, ","We present ABRA, a suite of algorithms to compute and maintain probabilistically-guaranteed, high-quality, approximations of the betweenness centrality of all nodes (or edges) on both static and fully dynamic graphs. Our algorithms use progressive random sampling and their analysis rely on Rademacher averages and pseudodimension, fundamental concepts from statistical learning theory. To our knowledge, this is the first application of these concepts to the field of graph analysis. Our experimental results show that ABRA is much faster than exact methods, and vastly outperforms, in both runtime and number of samples, state-of-the-art algorithms with the same quality guarantees."
kdd,https://dl.acm.org/doi/pdf/10.1145/2939672.2939808,Sampling of Attributed Networks from Hierarchical Generative Models,"Pablo Robles, Sebastian Moreno, Jennifer Neville, ","Network sampling is a widely used procedure in social network analysis where a random network is sampled from a generative network model (GNM). Recently proposed GNMs, allow generation of networks with more realistic structural characteristics than earlier ones. This facilitates tasks such as hypothesis testing and sensitivity analysis. However, sampling of networks with correlated vertex attributes remains a challenging problem. While the recent work of \cite{Pfeiffer:14} has provided a promising approach for attributed-network sampling, the approach was developed for use with relatively simple GNMs and does not work well with more complex hierarchical GNMs (which can model the range of characteristics and variation observed in real world networks more accurately). In contrast to simple GNMs where the probability mass is spread throughout the space of edges more evenly, hierarchical GNMs concentrate the mass to smaller regions of the space to reflect dependencies among edges in the network---this produces more realistic network characteristics, but also makes it more difficult to identify candidate networks from the sampling space."
kdd,https://dl.acm.org/doi/pdf/10.1145/2939672.2939809,Goal-Directed Inductive Matrix Completion,"Si Si, Kai-Yang Chiang, Cho-Jui Hsieh, Nikhil Rao, Inderjit S. Dhillon, ","Matrix completion (MC) with additional information has found wide applicability in several machine learning applications. Among algorithms for solving such problems, Inductive Matrix Completion(IMC) has drawn a considerable amount of attention, not only for its well established theoretical guarantees but also for its superior performance in various real-world applications. However, IMC based methods usually place very strong constraints on the quality of the features(side information) to ensure accurate recovery, which might not be met in practice. In this paper, we propose Goal-directed Inductive Matrix Completion(GIMC) to learn a nonlinear mapping of the features so that they satisfy the required properties. A key distinction between GIMC and IMC is that the feature mapping is learnt in a supervised manner, deviating from the traditional approach of unsupervised feature learning followed by model training. We establish the superiority of our method on several popular machine learning applications including multi-label learning, multi-class classification, and semi-supervised clustering."
kdd,https://dl.acm.org/doi/pdf/10.1145/2939672.2939741,Lexis: An Optimization Framework for Discovering the Hierarchical Structure of Sequential Data,"Payam Siyari, Bistra Dilkina, Constantine Dovrolis, ","Data represented as strings abounds in biology, linguistics, document mining, web search and many other fields. Such data often have a hierarchical structure, either because they were artificially designed and composed in a hierarchical manner or because there is an underlying evolutionary process that creates repeatedly more complex strings from simpler substrings. We propose a framework, referred to as Lexis, that produces an optimized hierarchical representation of a given set of ""target"" strings. The resulting hierarchy, ""Lexis-DAG"", shows how to construct each target through the concatenation of intermediate substrings, minimizing the total number of such concatenations or DAG edges. The Lexis optimization problem is related to the smallest grammar problem. After we prove its NP-hardness for two cost formulations, we propose an efficient greedy algorithm for the construction of Lexis-DAGs. We also consider the problem of identifying the set of intermediate nodes (substrings) that collectively form the ""core"" of a Lexis-DAG, which is important in the analysis of Lexis-DAGs. We show that the Lexis framework can be applied in diverse applications such as optimized synthesis of DNA fragments in genomic libraries, hierarchical structure discovery in protein sequences, dictionary-based text compression, and feature extraction from a set of documents."
kdd,https://dl.acm.org/doi/pdf/10.1145/2939672.2939743,Targeted Topic Modeling for Focused Analysis,"Shuai Wang, Zhiyuan Chen, Geli Fei, Bing Liu, Sherry Emery, ","One of the overarching tasks of document analysis is to find what topics people talk about. One of the main techniques for this purpose is topic modeling. So far many models have been proposed. However, the existing models typically perform full analysis on the whole data to find all topics. This is certainly useful, but in practice we found that the user almost always also wants to perform more detailed analyses on some specific aspects, which we refer to as targets (or targeted aspects). Current full-analysis models are not suitable for such analyses as their generated topics are often too coarse and may not even be on target. For example, given a set of tweets about e-cigarette, one may want to find out what topics under discussion are specifically related to children. Likewise, given a collection of online reviews about a camera, a consumer or camera manufacturer may be interested in finding out all topics about the camera's screen, the targeted aspect. As we will see in our experiments, current full topic models are ineffective for such targeted analyses. This paper studies this problem and proposes a novel targeted topic model (TTM) to enable focused analyses on any specific aspect of interest. Our experimental results demonstrate the effectiveness of the TTM."
kdd,https://dl.acm.org/doi/pdf/10.1145/2939672.2939805,Structured Doubly Stochastic Matrix for Graph Based Clustering: Structured Doubly Stochastic Matrix,"Xiaoqian Wang, Feiping Nie, Heng Huang, ","As one of the most significant machine learning topics, clustering has been extensively employed in various kinds of area. Its prevalent application in scientific research as well as industrial practice has drawn high attention in this day and age. A multitude of clustering methods have been developed, among which the graph based clustering method using the affinity matrix has been laid great emphasis on. Recent research work used the doubly stochastic matrix to normalize the input affinity matrix and enhance the graph based clustering models. Although the doubly stochastic matrix can improve the clustering performance, the clustering structure in the doubly stochastic matrix is not clear as expected. Thus, post processing step is required to extract the final clustering results, which may not be optimal. To address this problem, in this paper, we propose a novel convex model to learn the structured doubly stochastic matrix by imposing low-rank constraint on the graph Laplacian matrix. Our new structured doubly stochastic matrix can explicitly uncover the clustering structure and encode the probabilities of pair-wise data points to be connected, such that the clustering results are enhanced. An efficient optimization algorithm is derived to solve our new objective. Also, we provide theoretical discussions that when the input differs, our method possesses interesting connections with K-means and spectral graph cut models respectively. We conduct experiments on both synthetic and benchmark datasets to validate the performance of our proposed method. The empirical results demonstrate that our model provides an approach to better solving the K-mean clustering problem. By using the cluster indicator provided by our model as initialization, K-means converges to a smaller objective function value with better clustering performance. Moreover, we compare the clustering performance of our model with spectral clustering and related double stochastic model. On all datasets, our method performs equally or better than the related methods."
kdd,https://dl.acm.org/doi/pdf/10.1145/2939672.2939794,Revisiting Random Binning Features: Fast Convergence and Strong Parallelizability,"Lingfei Wu, Ian E.H. Yen, Jie Chen, Rui Yan, ","Kernel method has been developed as one of the standard approaches for nonlinear learning, which however, does not scale to large data set due to its quadratic complexity in the number of samples. A number of kernel approximation methods have thus been proposed in the recent years, among which the random features method gains much popularity due to its simplicity and direct reduction of nonlinear problem to a linear one. Different random feature functions have since been proposed to approximate a variety of kernel functions. Among them the Random Binning (RB) feature, proposed in the first random-feature paper [21], has drawn much less attention than the Random Fourier (RF) feature proposed also in [21]. In this work, we observe that the RB features, with right choice of optimization solver, could be orders-of-magnitude more efficient than other random features and kernel approximation methods under the same requirement of accuracy. We thus propose the first analysis of RB from the perspective of optimization, which by interpreting RB as a Randomized Block Coordinate Descent in the infinite-dimensional space, gives a faster convergence rate compared to that of other random features. In particular, we show that by drawing R random grids with at least κ number of non-empty bins per grid in expectation, RB method achieves a convergence rate of O(1/κ R)), which not only sharpens its O(1/√R) rate from Monte Carlo analysis, but also shows a κ times speedup over other random features under the same analysis framework. In addition, we demonstrate another advantage of RB in the L1-regularized setting, where unlike other random features, a RB-based Coordinate Descent solver can be parallelized with guaranteed speedup proportional to κ. Our extensive experiments demonstrate the superior performance of the RB features over other random features and kernel approximation methods."
