conference,url,title,authors,abstract
kdd,None,Medicine in the age of electronic health records,"Nigam Shah, ","In the era of EHRs, it is possible to examine the outcomes of decisions made by doctors during clinical practice to identify patterns of care---generating evidence based on the collective practice of experts. We will discuss methods that use unstructured patient data to monitor for adverse drug events, profile specific drugs, identify off-label drug usage, uncover 'natural experiments' and generate practice-based evidence for difficult-to-test clinical hypotheses. We will describe how to detect associations among drugs and their adverse events several years before an alert is issued as well as compute the true rate of drug-drug interactions. We will present approaches to identify novel off-label uses of drugs using the patient feature matrix along with prior knowledge about drugs, diseases, and known usage. We will review a natural experiment--where a subset of congestive heart failure patients who were prescribed Cilostazol despite its black box warning--and profile its safety. We will discuss the testing of a clinical hypothesis about an association between allergic conditions and chronic uveitis in patients with juvenile idiopathic arthritis."
kdd,None,Algorithms for interpretable machine learning,"Cynthia Rudin, ","It is extremely important in many application domains to have transparency in predictive modeling. Domain experts do not tend to prefer ""black box"" predictive model models. They would like to understand how predictions are made, and possibly, prefer models that emulate the way a human expert might make a decision, with a few important variables, and a clear convincing reason to make a particular prediction."
kdd,None,Data science through the lens of social science,"Drew Conway, ","In this talk, Drew will examine data science through the lens of the social scientist. He will discuss how the various skills and disciplines combine into data science. Drew will also present a motivating example directly from his work as a senior advisor to NYC's Mayor's Office of Analytics."
kdd,None,Information environment security,"Rand Waltzman, ","The US Department of Defense Dictionary of Military terms defines the Information Environment as 'the aggregate of individuals, organizations, and systems that collect, process, disseminate, or act on information.' The decisions and actions we take both as individuals and collectively simultaneously shape and are shaped by the information environment in which we live. The nature of our interaction with the information environment is rapidly evolving and old models are becoming irrelevant faster than we can develop new ones. This results in uncertainties that leave us exposed to dangerous influences without proper defenses. The purpose of this talk is to help frame a new science of Information Environment Security (IES) whose goal is to create and apply the tools needed to discover and maintain fundamental models of our ever-changing information environment and to defend us in that environment, both as individuals and collectively, against intentional as well as unintentional attempts to deceive, misinform and otherwise manipulate us. IES is an interdisciplinary science that will require bringing together experts working in areas such as cognitive science, computer science, social science, security, marketing, political campaigning, public policy, and psychology to develop a theoretical as well as an applied engineering methodology for managing the full spectrum of information environment security issues."
kdd,None,Big data for social good,"Nathan Eagle, ","Petabytes of data about human movements, transactions and communication patterns are being generated by everyday technologies such as mobile phones & credit cards. This unprecedented volume of information facilitates a novel set of research questions applicable to a wide range of development issues. In collaboration involving 237 mobile phone operators across 102 countries, Jana's mobile technology platform can instantly poll and compensate 3.48 billion active mobile subscriptions. This talk will discuss how insights gained from living in Kenya became the genesis of a technology company currently working with global clients in over 50 countries, including P&G, Google, Unilever, Danone, General Mills, Nestle, Johnson & Johnson, Microsoft, the World Bank, and the United Nations. After providing an overview of the mobile and social media landscapes in emerging markets, we discuss a system that implements polls & mobile subscription compensation. The presentation will conclude by emphasizing the value of consumer data in underserved and understudied regions of the world."
kdd,None,Bringing data science to the speakers of every language,"Robert Munro, ","Speakers of more than 5,000 languages have access to internet and communication technologies. The majority of phones, tablets and computers now ship with language-enabled capabilities like speech-recognition and intelligent auto-correction, and people increasingly interact with data-intensive cloud-based language technologies like search-engines and spam-filters. For both personal and large-scale technologies, the service quality drops or disappears entirely outside of a handful of languages. Speakers of low-resource languages correlate with lower access to healthcare, education and higher vulnerability to disasters. Serving the broadest possible range of languages is crucial to ensuring equitable participation in the global information economy."
kdd,None,Guilt by association: large scale malware detection by mining file-relation graphs,"Acar Tamersoy, Kevin Roundy, Duen Horng Chau, ","The increasing sophistication of malicious software calls for new defensive techniques that are harder to evade, and are capable of protecting users against novel threats. We present AESOP, a scalable algorithm that identifies malicious executable files by applying Aesop's moral that ""a man is known by the company he keeps."" We use a large dataset voluntarily contributed by the members of Norton Community Watch, consisting of partial lists of the files that exist on their machines, to identify close relationships between files that often appear together on machines. AESOP leverages locality-sensitive hashing to measure the strength of these inter-file relationships to construct a graph, on which it performs large scale inference by propagating information from the labeled files (as benign or malicious) to the preponderance of unlabeled files. AESOP attained early labeling of 99% of benign files and 79% of malicious files, over a week before they are labeled by the state-of-the-art techniques, with a 0.9961 true positive rate at flagging malware, at 0.0001 false positive rate."
kdd,None,Mining text snippets for images on the web,"Anitha Kannan, Simon Baker, Krishnan Ramnath, Juliet Fiss, ","Images are often used to convey many different concepts or illustrate many different stories. We propose an algorithm to mine multiple diverse, relevant, and interesting text snippets for images on the web. Our algorithm scales to all images on the web. For each image, all webpages that contain it are considered. The top-K text snippet selection problem is posed as combinatorial subset selection with the goal of choosing an optimal set of snippets that maximizes a combination of relevancy, interestingness, and diversity. The relevancy and interestingness are scored by machine learned models. Our algorithm is run at scale on the entire image index of a major search engine resulting in the construction of a database of images with their corresponding text snippets. We validate the quality of the database through a large-scale comparative study. We showcase the utility of the database through two web-scale applications: (a) augmentation of images on the web as webpages are browsed and (b)~an image browsing experience (similar in spirit to web browsing) that is enabled by interconnecting semantically related images (which may not be visually related) through shared concepts in their corresponding text snippets."
kdd,None,Predicting student risks through longitudinal analysis,"Ashay Tamhane, Shajith Ikbal, Bikram Sengupta, Mayuri Duggirala, ","Poor academic performance in K-12 is often a precursor to unsatisfactory educational outcomes such as dropout, which are associated with significant personal and social costs. Hence, it is important to be able to predict students at risk of poor performance, so that the right personalized intervention plans can be initiated. In this paper, we report on a large-scale study to identify students at risk of not meeting acceptable levels of performance in one state-level and one national standardized assessment in Grade 8 of a major US school district. An important highlight of our study is its scale - both in terms of the number of students included, the number of years and the number of features, which provide a very solid grounding to the research. We report on our experience with handling the scale and complexity of data, and on the relative performance of various machine learning techniques we used for building predictive models. Our results demonstrate that it is possible to predict students at-risk of poor assessment performance with a high degree of accuracy, and to do so well in advance. These insights can be used to pro-actively initiate personalized intervention programs and improve the chances of student success."
kdd,None,Novel geospatial interpolation analytics for general meteorological measurements,"Bingsheng Wang, Jinjun Xiong, ","This paper addresses geospatial interpolation for meteorological measurements in which we estimate the values of climatic metrics at unsampled sites with existing observations. Providing climatological and meteorological conditions covering a large region is potentially useful in many applications, such as smart grid. However, existing research works on interpolation either cause a large number of complex calculations or are lack of high accuracy. We propose a Bayesian compressed sensing based non-parametric statistical model to efficiently perform the spatial interpolation task. Student-t priors are employed to model the sparsity of unknown signals' coefficients, and the Approximated Variational Inference (AVI) method is provided for effective and fast learning. The presented model has been deployed at IBM, targeting for aiding the intelligent management of smart grid. The evaluations on two real world datasets demonstrate that our algorithm achieves state-of-the-art performance in both effectiveness and efficiency."
kdd,None,Targeting direct cash transfers to the extremely poor,"Brian Abelson, Kush R. Varshney, Joy Sun, ","Unconditional cash transfers to the extreme poor via mobile telephony represent a radical, new approach to giving. GiveDirectly is a non-governmental organization (NGO) at the vanguard of delivering this proven and effective approach to reducing poverty. In this work, we streamline an important step in the operations of the NGO by developing and deploying a data-driven system for locating villages with extreme poverty in Kenya and Uganda. Using the type of roof of a home, thatched or metal, as a proxy for poverty, we develop a new remote sensing approach for selecting extremely poor villages to target for cash transfers. We develop an analytics algorithm that estimates housing quality and density in patches of publicly-available satellite imagery by learning a predictive model with sieves of template matching results combined with color histograms as features. We develop and deploy a crowdsourcing interface to obtain labeled training data. We deploy the predictive model to construct a fine-scale heat map of poverty and integrate this discovered knowledge into the processes of GiveDirectly's operations. Aggregating estimates at the village level, we produce a ranked list from which top villages are included in GiveDirectly's planned distribution of cash transfers. The automated approach increases village selection efficiency significantly."
kdd,None,Scalable hands-free transfer learning for online advertising,"Brian Dalessandro, Daizhuo Chen, Troy Raeder, Claudia Perlich, ","Internet display advertising is a critical revenue source for publishers and online content providers, and is supported by massive amounts of user and publisher data. Targeting display ads can be improved substantially with machine learning methods, but building many models on massive data becomes prohibitively expensive computationally. This paper presents a combination of strategies, deployed by the online advertising firm Dstillery, for learning many models from extremely high-dimensional data efficiently and without human intervention. This combination includes: (i)~A method for simple-yet-effective transfer learning where a model learned from data that is relatively abundant and cheap is taken as a prior for Bayesian logistic regression trained with stochastic gradient descent (SGD) from the more expensive target data. (ii)~A new update rule for automatic learning rate adaptation, to support learning from sparse, high-dimensional data, as well as the integration with adaptive regularization. We present an experimental analysis across 100 different ad campaigns, showing that the transfer learning indeed improves performance across a large number of them, especially at the start of the campaigns. The combined ""hands-free"" method needs no fiddling with the SGD learning rate, and we show that it is just as effective as using expensive grid search to set the regularization parameter for each campaign."
kdd,None,Correlating events with time series for incident diagnosis,"Chen Luo, Jian-Guang Lou, Qingwei Lin, Qiang Fu, Rui Ding, ","As online services have more and more popular, incident diagnosis has emerged as a critical task in minimizing the service downtime and ensuring high quality of the services provided. For most online services, incident diagnosis is mainly conducted by analyzing a large amount of telemetry data collected from the services at runtime. Time series data and event sequence data are two major types of telemetry data. Techniques of correlation analysis are important tools that are widely used by engineers for data-driven incident diagnosis. Despite their importance, there has been little previous work addressing the correlation between two types of heterogeneous data for incident diagnosis: continuous time series data and temporal event data. In this paper, we propose an approach to evaluate the correlation between time series data and event data. Our approach is capable of discovering three important aspects of event-timeseries correlation in the context of incident diagnosis: existence of correlation, temporal order, and monotonic effect. Our experimental results on simulation data sets and two real data sets demonstrate the effectiveness of the algorithm."
kdd,None,Proactive workflow modeling by stochastic processes with application to healthcare operation and management,"Chuanren Liu, Yong Ge, Hui Xiong, Keli Xiao, Wei Geng, Matt Perkins, ","Advances in real-time location system (RTLS) solutions have enabled us to collect massive amounts of fine-grained semantically rich location traces, which provide unparalleled opportunities for understanding human activities and discovering useful knowledge. This, in turn, delivers intelligence for real-time decision making in various fields, such as workflow management. Indeed, it is a new paradigm for workflow modeling by the knowledge discovery in location traces. To that end, in this paper, we provide a focused study of workflow modeling by the integrated analysis of indoor location traces in the hospital environment. In comparison with conventional workflow modeling based on passive workflow logs, one salient feature of our approach is that it can proactively unravel the workflow patterns hidden in the location traces, by automatically constructing the workflow states and estimating parameters describing the transition patterns of moving objects. Specifically, to determine a meaningful granularity for the model, the workflow states are first constructed as regions associated with specific healthcare activities. Then, we transform the original indoor location traces to the sequences of workflow states and model the workflow transition patterns by finite state machines. Furthermore, we leverage the correlations in the location traces between related types of medical devices to reinforce the modeling performance and enable more applications. The results show that the proposed framework can not only model the workflow patterns effectively, but also have managerial applications in workflow monitoring, auditing, and inspection of workflow compliance, which are critical in the healthcare industry."
kdd,None,Activity ranking in LinkedIn feed,"Deepak Agarwal, Bee-Chung Chen, Rupesh Gupta, Joshua Hartman, ","Users on an online social network site generate a large number of heterogeneous activities, ranging from connecting with other users, to sharing content, to updating their profiles. The set of activities within a user's network neighborhood forms a stream of updates for the user's consumption. In this paper, we report our experience with the problem of ranking activities in the LinkedIn homepage feed. In particular, we provide a taxonomy of social network activities, describe a system architecture (with a number of key components open-sourced) that supports fast iteration in model development, demonstrate a number of key factors for effective ranking, and report experimental results from extensive online bucket tests."
kdd,None,Budget pacing for targeted online advertisements at LinkedIn,"Deepak Agarwal, Souvik Ghosh, Kai Wei, Siyu You, ",Targeted online advertising is a prime source of revenue for many Internet companies. It is a common industry practice to use a generalized second price auction mechanism to rank advertisements at every opportunity of an impression. This greedy algorithm is suboptimal for both advertisers and publishers when advertisers have a finite budget. In a greedy mechanism high performing advertisers tend to drop out of the auction marketplace fast and that adversely affects both the advertiser experience and the publisher revenue. We describe a method for improving such ad serving systems by including a budget pacing component that serves ads by being aware of global supply patterns. Such a system is beneficial for both advertisers and publishers. We demonstrate the benefits of this component using experiments we conducted on advertising at LinkedIn.
kdd,None,Large scale predictive modeling for micro-simulation of 3G air interface load,"Dejan Radosavljevik, Peter van der Putten, ","This paper outlines the approach developed together with the Radio Network Strategy & Design Department of a large European telecom operator in order to forecast the Air-Interface load in their 3G network, which is used for planning network upgrades and budgeting purposes. It is based on large scale intelligent data analysis and modeling at the level of thousands of individual radio cells resulting in 30,000 models per day. It has been embedded into a scenario simulation framework that is used by end users not experienced in data mining for studying and simulating the behavior of this complex networked system, as an example of a systematic approach to the deployment step in the KDD process. This system is already in use for two years in the country where it was developed and it is a part of a standard business process. In the last six months this national operator became a competence center for predictive modeling for micro-simulation of 3G air interface load for four other operators of the same parent company."
kdd,None,Unveiling clusters of events for alert and incident management in large-scale enterprise it,"Derek Lin, Rashmi Raghu, Vivek Ramamurthy, Jin Yu, ","Large enterprise IT (Information Technology) infrastructure components generate large volumes of alerts and incident tickets. These are manually screened, but it is otherwise difficult to extract information automatically from them to gain insights in order to improve operational efficiency. We propose a framework to cluster alerts and incident tickets based on the text in them, using unsupervised machine learning. This would be a step towards eliminating manual classification of the alerts and incidents, which is very labor intense and costly. Our framework can handle the semi-structured text in alerts generated by IT infrastructure components such as storage devices, network devices, servers etc., as well as the unstructured text in incident tickets created manually by operations support personnel. After text pre-processing and application of appropriate distance metrics, we apply different graph-theoretic approaches to cluster the alerts and incident tickets, based on their semi-structured and unstructured text respectively. For automated interpretation and read-ability on semi-structured text clusters, we propose a method to visualize clusters that preserves the structure and human-readability of the text data as compared to traditional word clouds where the text structure is not preserved; for unstructured text clusters, we find a simple way to define prototypes of clusters for easy interpretation. This framework for clustering and visualization will enable enterprises to prioritize the issues in their IT infrastructure and improve the reliability and availability of their services."
kdd,None,Style in the long tail: discovering unique interests with latent variable models in large scale social E-commerce,"Diane J. Hu, Rob Hall, Josh Attenberg, ","Purchasing decisions in many product categories are heavily influenced by the shopper's aesthetic preferences. It's insufficient to simply match a shopper with popular items from the category in question; a successful shopping experience also identifies products that match those aesthetics. The challenge of capturing shoppers' styles becomes more difficult as the size and diversity of the marketplace increases. At Etsy, an online marketplace for handmade and vintage goods with over 30 million diverse listings, the problem of capturing taste is particularly important -- users come to the site specifically to find items that match their eclectic styles."
kdd,None,Corporate residence fraud detection,"Enric Junqu챕 de Fortuny, Marija Stankova, Julie Moeyersoms, ","With the globalisation of the world's economies and ever-evolving financial structures, fraud has become one of the main dissipaters of government wealth and perhaps even a major contributor in the slowing down of economies in general. Although corporate residence fraud is known to be a major factor, data availability and high sensitivity have caused this domain to be largely untouched by academia. The current Belgian government has pledged to tackle this issue at large by using a variety of in-house approaches and cooperations with institutions such as academia, the ultimate goal being a fair and efficient taxation system. This is the first data mining application specifically aimed at finding corporate residence fraud, where we show the predictive value of using both structured and fine-grained invoicing data. We further describe the problems involved in building such a fraud detection system, which are mainly data-related (e.g. data asymmetry, quality, volume, variety and velocity) and deployment-related (e.g. the need for explanations of the predictions made)."
kdd,None,Modeling mass protest adoption in social network communities using geometric brownian motion,"Fang Jin, Rupinder Paul Khandpur, Nathan Self, Edward Dougherty, ","Modeling the movement of information within social media outlets, like Twitter, is key to understanding to how ideas spread but quantifying such movement runs into several difficulties. Two specific areas that elude a clear characterization are (i) the intrinsic random nature of individuals to potentially adopt and subsequently broadcast a Twitter topic, and (ii) the dissemination of information via non-Twitter sources, such as news outlets and word of mouth, and its impact on Twitter propagation. These distinct yet inter-connected areas must be incorporated to generate a comprehensive model of information diffusion. We propose a bispace model to capture propagation in the union of (exclusively) Twitter and non-Twitter environments. To quantify the stochastic nature of Twitter topic propagation, we combine principles of geometric Brownian motion and traditional network graph theory. We apply Poisson process functions to model information diffusion outside of the Twitter mentions network. We discuss techniques to unify the two sub-models to accurately model information dissemination. We demonstrate the novel application of these techniques on real Twitter datasets related to mass protest adoption in social communities."
kdd,None,Shallow semantic parsing of product offering titles (for better automatic hyperlink insertion),"Gabor Melli, ","With billions of database-generated pages on the Web where consumers can readily add priced product offerings to their virtual shopping cart, several opportunities will become possible once we can automatically recognize what exactly is being offered for sale on each page. We present a case study of a deployed data-driven system that first chunks individual titles into semantically classified sub-segments, and then uses this information to improve a hyperlink insertion service."
