conference,url,title,authors,abstract
kdd,https://dl.acm.org/doi/pdf/10.1145/2939672.2939793,GMove: Group-Level Mobility Modeling Using Geo-Tagged Social Media,"Chao Zhang, Keyang Zhang, Quan Yuan, Luming Zhang, ","Understanding human mobility is of great importance to various applications, such as urban planning, traffic scheduling, and location prediction. While there has been fruitful research on modeling human mobility using tracking data (e.g., GPS traces), the recent growth of geo-tagged social media (GeoSM) brings new opportunities to this task because of its sheer size and multi-dimensional nature. Nevertheless, how to obtain quality mobility models from the highly sparse and complex GeoSM data remains a challenge that cannot be readily addressed by existing techniques. We propose GMove, a group-level mobility modeling method using GeoSM data. Our insight is that the GeoSM data usually contains multiple user groups, where the users within the same group share significant movement regularity. Meanwhile, user grouping and mobility modeling are two intertwined tasks: (1) better user grouping offers better within-group data consistency and thus leads to more reliable mobility models; and (2) better mobility models serve as useful guidance that helps infer the group a user belongs to. GMove thus alternates between user grouping and mobility modeling, and generates an ensemble of Hidden Markov Models (HMMs) to characterize group-level movement regularity. Furthermore, to reduce text sparsity of GeoSM data, GMove also features a text augmenter. The augmenter computes keyword correlations by examining their spatiotemporal distributions. With such correlations as auxiliary knowledge, it performs sampling-based augmentation to alleviate text sparsity and produce high-quality HMMs."
kdd,https://dl.acm.org/doi/pdf/10.1145/2939672.2939804,Approximate Personalized PageRank on Dynamic Graphs,"Hongyang Zhang, Peter Lofgren, Ashish Goel, ","We propose and analyze two algorithms for maintaining approximate Personalized PageRank (PPR) vectors on a dynamic graph, where edges are added or deleted. Our algorithms are natural dynamic versions of two known local variations of power iteration. One, Forward Push, propagates probability mass forwards along edges from a source node, while the other, Reverse Push, propagates local changes backwards along edges from a target. In both variations, we maintain an invariant between two vectors, and when an edge is updated, our algorithm first modifies the vectors to restore the invariant, then performs any needed local push operations to restore accuracy."
kdd,https://dl.acm.org/doi/pdf/10.1145/2939672.2939766,FINAL: Fast Attributed Network Alignment,"Si Zhang, Hanghang Tong, ","Multiple networks naturally appear in numerous high-impact applications. Network alignment (i.e., finding the node correspondence across different networks) is often the very first step for many data mining tasks. Most, if not all, of the existing alignment methods are solely based on the topology of the underlying networks. Nonetheless, many real networks often have rich attribute information on nodes and/or edges. In this paper, we propose a family of algorithms FINAL to align attributed networks. The key idea is to leverage the node/edge attribute information to guide (topology-based) alignment process. We formulate this problem from an optimization perspective based on the alignment consistency principle, and develop effective and scalable algorithms to solve it. Our experiments on real networks show that (1) by leveraging the attribute information, our algorithms can significantly improve the alignment accuracy (i.e., up to a 30% improvement over the existing methods); (2) compared with the exact solution, our proposed fast alignment algorithm leads to a more than 10 times speed-up, while preserving a 95% accuracy; and (3) our on-query alignment method scales linearly, with an around 90% ranking accuracy compared with our exact full alignment method and a near real-time response time."
kdd,https://dl.acm.org/doi/pdf/10.1145/2939672.2939795,Come-and-Go Patterns of Group Evolution: A Dynamic Model,"Tianyang Zhang, Peng Cui, Christos Faloutsos, Yunfei Lu, Hao Ye, ","How do social groups, such as Facebook groups and Wechat groups, dynamically evolve over time? How do people join the social groups, uniformly or with burst? What is the pattern of people quitting from groups? Is there a simple universal model to depict the come-and-go patterns of various groups?"
kdd,https://dl.acm.org/doi/pdf/10.1145/2939672.2939871,From Prediction to Action: A Closed-Loop Approach for Data-Guided Network Resource Allocation,"Yanan Bao, Huasen Wu, Xin Liu, ","Machine learning methods have been widely used in modeling and predicting network user experience. In this paper, moving beyond user experience prediction, we propose a closed-loop approach that uses data-generated prediction models to explicitly guide resource allocation for user experience improvement. The closed-loop approach leverages and verifies the causal relation that often exists between certain feature values (e.g., bandwidth) and user experience in computer networks. The approach consists of three components: we train a neural network classifier to predict user experience, utilize the trained neural network classifier as the objective function to allocate network resource, and then evaluate user experience with allocated resource to (in)validate and adjust the original model. Specifically, we propose a dual decomposition algorithm to solve the neural network-based resource optimization problem, which is complex and non-convex. We further develop an iterative mechanism for classifier optimization. Numerical results show that the dual algorithm reduces the expected number of unsatisfied users by up to 2x compared with the baseline, and the optimized classifier further improves the performance by 50%."
kdd,https://dl.acm.org/doi/pdf/10.1145/2939672.2939872,Towards Robust and Versatile Causal Discovery for Business Applications,"Giorgos Borboudakis, Ioannis Tsamardinos, ","Causal discovery algorithms can induce some of the causal relations from the data, commonly in the form of a causal network such as a causal Bayesian network. Arguably however, all such algorithms lack far behind what is necessary for a true business application. We develop an initial version of a new, general causal discovery algorithm called ETIO with many features suitable for business applications. These include (a) ability to accept prior causal knowledge (e.g., taking senior driving courses improves driving skills), (b) admitting the presence of latent confounding factors, (c) admitting the possibility of (a certain type of) selection bias in the data (e.g., clients sampled mostly from a given region), (d) ability to analyze data with missing-by-design (i.e., not planned to measure) values (e.g., if two companies merge and their databases measure different attributes), and (e) ability to analyze data from different interventions (e.g., prior and posterior to an advertisement campaign). ETIO is an instance of the logical approach to integrative causal discovery that has been relatively recently introduced and enables the solution of complex reverse-engineering problems in causal discovery. ETIO is compared against the state-of-the-art and is shown to be more effective in terms of speed, with only a slight degradation in terms of learning accuracy, while incorporating all the features above. The code is available on the mensxmachina.org website."
kdd,https://dl.acm.org/doi/pdf/10.1145/2939672.2939812,Deep Visual-Semantic Hashing for Cross-Modal Retrieval,"Yue Cao, Mingsheng Long, Jianmin Wang, Qiang Yang, Philip S. Yu, ","Due to the storage and retrieval efficiency, hashing has been widely applied to approximate nearest neighbor search for large-scale multimedia retrieval. Cross-modal hashing, which enables efficient retrieval of images in response to text queries or vice versa, has received increasing attention recently. Most existing work on cross-modal hashing does not capture the spatial dependency of images and temporal dynamics of text sentences for learning powerful feature representations and cross-modal embeddings that mitigate the heterogeneity of different modalities. This paper presents a new Deep Visual-Semantic Hashing (DVSH) model that generates compact hash codes of images and sentences in an end-to-end deep learning architecture, which capture the intrinsic cross-modal correspondences between visual data and natural language. DVSH is a hybrid deep architecture that constitutes a visual-semantic fusion network for learning joint embedding space of images and text sentences, and two modality-specific hashing networks for learning hash functions to generate compact binary codes. Our architecture effectively unifies joint multimodal embedding and cross-modal hashing, which is based on a novel combination of Convolutional Neural Networks over images, Recurrent Neural Networks over sentences, and a structured max-margin objective that integrates all things together to enable learning of similarity-preserving and high-quality hash codes. Extensive empirical evidence shows that our DVSH approach yields state of the art results in cross-modal retrieval experiments on image-sentences datasets, i.e. standard IAPR TC-12 and large-scale Microsoft COCO."
kdd,https://dl.acm.org/doi/pdf/10.1145/2939672.2939833,City-Scale Map Creation and Updating using GPS Collections,"Chen Chen, Cewu Lu, Qixing Huang, Qiang Yang, ","Applications such as autonomous driving or real-time route recommendations require up-to-date and accurate digital maps. However, manually creating and updating such maps is too costly to meet the rising demands. As large collections of GPS trajectories become widely available, constructing and updating maps using such trajectory collections can greatly reduce the cost of such maps. Unfortunately, due to GPS noise and varying trajectory sampling rates, inferring maps from GPS trajectories can be very challenging. In this paper, we present a framework to create up-to-date maps with rich knowledge from GPS trajectory collections. Starting from an unstructured GPS point cloud, we discover road segments using novel graph-based clustering techniques with prior knowledge on road design. Based on road segments, we develop a scale- and orientation-invariant traj-SIFT feature to localize and recognize junctions using a supervised learning framework. Maps with rich knowledge are created based on discovered road segments and junctions. Compared to state-of-the-art methods, our approach can efficiently construct high-quality maps at city scales from large collections of GPS trajectories."
kdd,https://dl.acm.org/doi/pdf/10.1145/2939672.2939839,Compressing Convolutional Neural Networks in the Frequency Domain,"Wenlin Chen, James Wilson, Stephen Tyree, Kilian Q. Weinberger, ","Convolutional neural networks (CNN) are increasingly used in many areas of computer vision. They are particularly attractive because of their ability to ""absorb"" great quantities of labeled data through millions of parameters. However, as model sizes increase, so do the storage and memory requirements of the classifiers, hindering many applications such as image and speech recognition on mobile phones and other devices. In this paper, we present a novel net- work architecture, Frequency-Sensitive Hashed Nets (FreshNets), which exploits inherent redundancy in both convolutional layers and fully-connected layers of a deep learning model, leading to dramatic savings in memory and storage consumption. Based on the key observation that the weights of learned convolutional filters are typically smooth and low-frequency, we first convert filter weights to the frequency domain with a discrete cosine transform (DCT) and use a low-cost hash function to randomly group frequency parameters into hash buckets. All parameters assigned the same hash bucket share a single value learned with standard back-propagation. To further reduce model size, we allocate fewer hash buckets to high-frequency components, which are generally less important. We evaluate FreshNets on eight data sets, and show that it leads to better compressed performance than several relevant baselines."
kdd,https://dl.acm.org/doi/pdf/10.1145/2939672.2939823,Multi-layer Representation Learning for Medical Concepts,"Edward Choi, Mohammad Taha Bahadori, ","Proper representations of medical concepts such as diagnosis, medication, procedure codes and visits from Electronic Health Records (EHR) has broad applications in healthcare analytics. Patient EHR data consists of a sequence of visits over time, where each visit includes multiple medical concepts, e.g., diagnosis, procedure, and medication codes. This hierarchical structure provides two types of relational information, namely sequential order of visits and co-occurrence of the codes within a visit. In this work, we propose Med2Vec, which not only learns the representations for both medical codes and visits from large EHR datasets with over million visits, but also allows us to interpret the learned representations confirmed positively by clinical experts. In the experiments, Med2Vec shows significant improvement in prediction accuracy in clinical applications compared to baselines such as Skip-gram, GloVe, and stacked autoencoder, while providing clinically meaningful interpretation."
kdd,https://dl.acm.org/doi/pdf/10.1145/2939672.2939828,Efficient Processing of Network Proximity Queries via Chebyshev Acceleration,"Mustafa Coskun, Ananth Grama, Mehmet Koyuturk, ","Network proximity is at the heart of a large class of network analytics and information retrieval techniques, including node/ edge rankings, network alignment, and randomwalk based proximity queries, among many others. Owing to its importance, significant effort has been devoted to accelerating iterative processes underlying network proximity computations. These techniques rely on numerical properties of power iterations, as well as structural properties of the networks to reduce the run time of iterative algorithms."
kdd,https://dl.acm.org/doi/pdf/10.1145/2939672.2939860,Latent Space Model for Road Networks to Predict Time-Varying Traffic,"Dingxiong Deng, Cyrus Shahabi, Ugur Demiryurek, Linhong Zhu, ","Real-time traffic prediction from high-fidelity spatiotemporal traffic sensor datasets is an important problem for intelligent transportation systems and sustainability. However, it is challenging due to the complex topological dependencies and high dynamism associated with changing road conditions. In this paper, we propose a Latent Space Model for Road Networks (LSM-RN) to address these challenges holistically. In particular, given a series of road network snapshots, we learn the attributes of vertices in latent spaces which capture both topological and temporal properties. As these latent attributes are time-dependent, they can estimate how traffic patterns form and evolve. In addition, we present an incremental online algorithm which sequentially and adaptively learns the latent attributes from the temporal graph changes. Our framework enables real-time traffic prediction by 1) exploiting real-time sensor readings to adjust/update the existing latent spaces, and 2) training as data arrives and making predictions on-the-fly. By conducting extensive experiments with a large volume of real-world traffic sensor data, we demonstrate the superiority of our framework for real-time traffic prediction on large road networks over competitors as well as baseline graph-based LSM's."
kdd,https://dl.acm.org/doi/pdf/10.1145/2939672.2939835,Learning Cumulatively to Become More Knowledgeable,"Geli Fei, Shuai Wang, Bing Liu, ","In classic supervised learning, a learning algorithm takes a fixed training data of several classes to build a classifier. In this paper, we propose to study a new problem, i.e., building a learning system that learns cumulatively. As time goes by, the system sees and learns more and more classes of data and becomes more and more knowledgeable. We believe that this is similar to human learning. We humans learn continuously, retaining the learned knowledge, identifying and learning new things, and updating the existing knowledge with new experiences. Over time, we cumulate more and more knowledge. A learning system should be able to do the same. As algorithmic learning matures, it is time to tackle this cumulative machine learning (or simply cumulative learning) problem, which is a kind of lifelong machine learning problem. It presents two major challenges. First, the system must be able to detect data from unseen classes in the test set. Classic supervised learning, however, assumes all classes in testing are known or seen at the training time. Second, the system needs to be able to selectively update its models whenever a new class of data arrives without re-training the whole system using the entire past and present training data. This paper proposes a novel approach and system to tackle these challenges. Experimental results on two datasets with learning from 2 classes to up to 100 classes show that the proposed approach is highly promising in terms of both classification accuracy and computational efficiency."
kdd,https://dl.acm.org/doi/pdf/10.1145/2939672.2939867,Squish: Near-Optimal Compression for Archival of Relational Datasets,"Yihan Gao, Aditya Parameswaran, ","Relational datasets are being generated at an alarmingly rapid rate across organizations and industries. Compressing these datasets could significantly reduce storage and archival costs. Traditional compression algorithms, e.g., gzip, are suboptimal for compressing relational datasets since they ignore the table structure and relationships between attributes."
kdd,https://dl.acm.org/doi/pdf/10.1145/2939672.2939851,Fast Component Pursuit for Large-Scale Inverse Covariance Estimation,"Lei Han, Yu Zhang, Tong Zhang, ","The maximum likelihood estimation (MLE) for the Gaussian graphical model, which is also known as the inverse covariance estimation problem, has gained increasing interest recently. Most existing works assume that inverse covariance estimators contain sparse structure and then construct models with the l 1 regularization. In this paper, different from existing works, we study the inverse covariance estimation problem from another perspective by efficiently modeling the low-rank structure in the inverse covariance, which is assumed to be a combination of a low-rank part and a diagonal matrix. One motivation for this assumption is that the low-rank structure is common in many applications including the climate and financial analysis, and another one is that such assumption can reduce the computational complexity when computing its inverse. Specifically, we propose an efficient COmponent Pursuit (COP) method to obtain the low-rank part, where each component can be sparse. For optimization, the COP method greedily learns a rank-one component in each iteration by maximizing the log-likelihood. Moreover, the COP algorithm enjoys several appealing properties including the existence of an efficient solution in each iteration and the theoretical guarantee on the convergence of this greedy approach. Experiments on large-scale synthetic and real-world datasets including thousands of millions variables show that the COP method is faster than the state-of-the-art techniques for the inverse covariance estimation problem when achieving comparable log-likelihood on test data."
kdd,https://dl.acm.org/doi/pdf/10.1145/2939672.2939853,Robust and Effective Metric Learning Using Capped Trace Norm: Metric Learning via Capped Trace Norm,"Zhouyuan Huo, Feiping Nie, Heng Huang, ","Metric learning aims at automatically learning a metric from pair or triplet based constraints in data, and it can be potentially beneficial whenever the notion of metric between instances plays a nontrivial role. In Mahalanobis distance metric learning, distance matrix M is in symmetric positive semi-definite cone, and in order to avoid overfitting and to learn a better Mahalanobis distance from weakly supervised constraints, the low-rank regularization has been often imposed on matrix M to learn the correlations between features and samples. As the approximations of the rank minimization function, the trace norm and Fantope have been utilized to regularize the metric learning objectives and achieve good performance. However, these low-rank regularization models are either not tight enough to approximate rank minimization or time-consuming to tune an optimal rank. In this paper, we introduce a novel metric learning model using the capped trace norm based regularization, which uses a singular value threshold to constraint the metric matrix M as low-rank explicitly such that the rank of matrix M is stable when the large singular values vary. The capped trace norm regularization can also be viewed as the adaptive Fantope regularization. We minimize singular values which are less than threshold value and the rank of M is not necessary to be k, thus our method is more stable and applicable in practice when we do not know the optimal rank of matrix M. We derive an efficient optimization algorithm to solve the proposed new model and the algorithm convergence proof is also provided in this paper. We evaluate our method on a variety of challenging benchmarks, such as LFW and Pubfig datasets. Face verification experiments are performed and results show that our method consistently outperforms the state-of-the-art metric learning algorithms."
kdd,https://dl.acm.org/doi/pdf/10.1145/2939672.2939840,Subjectively Interesting Component Analysis: Data Projections that Contrast with Prior Expectations,"Bo Kang, Jefrey Lijffijt, Raúl Santos-Rodríguez, Tijl De Bie, ","Methods that find insightful low-dimensional projections are essential to effectively explore high-dimensional data. Principal Component Analysis is used pervasively to find low-dimensional projections, not only because it is straightforward to use, but it is also often effective, because the variance in data is often dominated by relevant structure. However, even if the projections highlight real structure in the data, not all structure is interesting to every user. If a user is already aware of, or not interested in the dominant structure, Principal Component Analysis is less effective for finding interesting components. We introduce a new method called Subjectively Interesting Component Analysis (SICA), designed to find data projections that are subjectively interesting, i.e, projections that truly surprise the end-user. It is rooted in information theory and employs an explicit model of a user's prior expectations about the data. The corresponding optimization problem is a simple eigenvalue problem, and the result is a trade-off between explained variance and novelty. We present five case studies on synthetic data, images, time-series, and spatial data, to illustrate how SICA enables users to find (subjectively) interesting projections."
kdd,https://dl.acm.org/doi/pdf/10.1145/2939672.2939838,Causal Clustering for 1-Factor Measurement Models,"Erich Kummerfeld, Joseph Ramsey, ","Many scientific research programs aim to learn the causal structure of real world phenomena. This learning problem is made more difficult when the target of study cannot be directly observed. One strategy commonly used by social scientists is to create measurable ``indicator'' variables that covary with the latent variables of interest. Before leveraging the indicator variables to learn about the latent variables, however, one needs a measurement model of the causal relations between the indicators and their corresponding latents. These measurement models are a special class of Bayesian networks. This paper addresses the problem of reliably inferring measurement models from measured indicators, without prior knowledge of the causal relations or the number of latent variables. We present a provably correct novel algorithm, FindOneFactorClusters (FOFC), for solving this inference problem. Compared to other state of the art algorithms, FOFC is faster, scales to larger sets of indicators, and is more reliable at small sample sizes. We also present the first correctness proofs for this problem that do not assume linearity or acyclicity among the latent variables."
