conference,url,title,authors,abstract
kdd,None,Randomized Feature Engineering as a Fast and Accurate Alternative to Kernel Methods,"Suhang Wang, Charu Aggarwal, Huan Liu, ","Feature engineering has found increasing interest in recent years because of its ability to improve the effectiveness of various machine learning models. Although tailored feature engineering methods have been designed for various domains, there are few that simulate the consistent effectiveness of kernel methods. At the core, the success of kernel methods is achieved by using similarity functions that emphasize local variations in similarity. Unfortunately, this ability comes at the price of the high level of computational resources required and the inflexibility of the representation as it only provides the similarity of two data points instead of vector representations of each data point; while the vector representations can be readily used as input to facilitate various models for different tasks. Furthermore, kernel methods are also highly susceptible to overfitting and noise and it cannot capture the variety of data locality. In this paper, we first analyze the inner working and weaknesses of kernel method, which serves as guidance for designing feature engineering. With the guidance, we explore the use of randomized methods for feature engineering by capturing multi-granular locality of data. This approach has the merit of being time and space efficient for feature construction. Furthermore, the approach is resistant to overfitting and noise because the randomized approach naturally enables fast and robust ensemble methods. Extensive experiments on a number of real world datasets are conducted to show the effectiveness of the approach for various tasks such as clustering, classification and outlier detection."
kdd,None,Human Mobility Synchronization and Trip Purpose Detection with Mixture of Hawkes Processes,"Pengfei Wang, Yanjie Fu, Guannan Liu, Wenqing Hu, Charu Aggarwal, ","While exploring human mobility can benefit many applications such as smart transportation, city planning, and urban economics, there are two key questions that need to be answered: (i) What is the nature of the spatial diffusion of human mobility across regions with different urban functions? (ii) How to spot and trace the trip purposes of human mobility trajectories? To answer these questions, we study large-scale and city-wide taxi trajectories; and furtherly organize them as arrival sequences according to the chronological arrival time. We figure out an important property across different regions from the arrival sequences, namely human mobility synchronization effect, which can be exploited to explain the phenomenon that two regions have similar arrival patterns in particular time periods if they share similar urban functions. In addition, the arrival sequences are mixed by arrival events with distinct trip purposes, which can be revealed by the regional environment of both the origins and destinations. To that end, in this paper, we develop a joint model that integrates Mixture of Hawkes Process (MHP) with a hierarchical topic model to capture the arrival sequences with mixed trip purposes. Essentially, the human mobility synchronization effect is encoded as a synchronization rate in the MHP; while the regional environment is modeled by introducing latent Trip Purpose and POI Topic to generate the Point of Interests (POIs) in the regions. Moreover, we provide an effective inference algorithm for parameter learning. Finally, we conduct intensive experiments on synthetic data and real-world data, and the experimental results have demonstrated the effectiveness of the proposed model."
kdd,None,FORA: Simple and Effective Approximate Single-Source Personalized PageRank,"Sibo Wang, Renchi Yang, Xiaokui Xiao, Zhewei Wei, Yin Yang, ","Given a graph G, a source node s and a target node t, the personalized PageRank (PPR) of t with respect to s is the probability that a random walk starting from s terminates at t. A single-source PPR (SSPPR) query enumerates all nodes in G, and returns the top-k nodes with the highest PPR values with respect to a given source node s. SSPPR has important applications in web search and social networks, e.g., in Twitter's Who-To-Follow recommendation service. However, SSPPR computation is immensely expensive, and at the same time resistant to indexing and materialization. So far, existing solutions either use heuristics, which do not guarantee result quality, or rely on the strong computing power of modern data centers, which is costly."
kdd,None,Large-scale Collaborative Ranking in Near-Linear Time,"Liwei Wu, Cho-Jui Hsieh, James Sharpnack, ","In this paper, we consider the Collaborative Ranking (CR) problem for recommendation systems. Given a set of pairwise preferences between items for each user, collaborative ranking can be used to rank un-rated items for each user, and this ranking can be naturally used for recommendation. It is observed that collaborative ranking algorithms usually achieve better performance since they directly minimize the ranking loss; however, they are rarely used in practice due to the poor scalability. All the existing CR algorithms have time complexity at least O(|Ω|r) per iteration, where r is the target rank and |Ω| is number of pairs which grows quadratically with number of ratings per user. For example, the Netflix data contains totally 20 billion rating pairs, and at this scale all the current algorithms have to work with significant subsampling, resulting in poor prediction on testing data."
kdd,None,HoORaYs: High-order Optimization of Rating Distance for Recommender Systems,"Jingwei Xu, Yuan Yao, Hanghang Tong, Xianping Tao, Jian Lu, ","Latent factor models have become a prevalent method in recommender systems, to predict users' preference on items based on the historical user feedback. Most of the existing methods, explicitly or implicitly, are built upon the first-order rating distance principle, which aims to minimize the difference between the estimated and real ratings. In this paper, we generalize such first-order rating distance principle and propose a new latent factor model (HoORaYs) for recommender systems. The core idea of the proposed method is to explore high-order rating distance, which aims to minimize not only (i) the difference between the estimated and real ratings of the same (user, item) pair (i.e., the first-order rating distance), but also (ii) the difference between the estimated and real rating difference of the same user across different items (i.e., the second-order rating distance). We formulate it as a regularized optimization problem, and propose an effective and scalable algorithm to solve it. Our analysis from the geometry and Bayesian perspectives indicate that by exploring the high-order rating distance, it helps to reduce the variance of the estimator, which in turns leads to better generalization performance (e.g., smaller prediction error). We evaluate the proposed method on four real-world data sets, two with explicit user feedback and the other two with implicit user feedback. Experimental results show that the proposed method consistently outperforms the state-of-the-art methods in terms of the prediction accuracy."
kdd,None,Collaboratively Improving Topic Discovery and Word Embeddings by Coordinating Global and Local Contexts,"Guangxu Xun, Yaliang Li, Jing Gao, Aidong Zhang, ","A text corpus typically contains two types of context information -- global context and local context. Global context carries topical information which can be utilized by topic models to discover topic structures from the text corpus, while local context can train word embeddings to capture semantic regularities reflected in the text corpus. This encourages us to exploit the useful information in both the global and the local context information. In this paper, we propose a unified language model based on matrix factorization techniques which 1) takes the complementary global and local context information into consideration simultaneously, and 2) models topics and learns word embeddings collaboratively. We empirically show that by incorporating both global and local context, this collaborative model can not only significantly improve the performance of topic discovery over the baseline topic models, but also learn better word embeddings than the baseline word embedding models. We also provide qualitative analysis that explains how the cooperation of global and local context information can result in better topic structures and word embeddings."
kdd,None,PPDsparse: A Parallel Primal-Dual Sparse Method for Extreme Classification,"Ian E.H. Yen, Xiangru Huang, Wei Dai, Pradeep Ravikumar, ","Extreme Classification comprises multi-class or multi-label prediction where there is a large number of classes, and is increasingly relevant to many real-world applications such as text and image tagging. In this setting, standard classification methods, with complexity linear in the number of classes, become intractable, while enforcing structural constraints among classes (such as low-rank or tree-structure) to reduce complexity often sacrifices accuracy for efficiency. The recent PD-Sparse method addresses this via an algorithm that is sub-linear in the number of variables, by exploiting primal-dual sparsity inherent in a specific loss function, namely the max-margin loss. In this work, we extend PD-Sparse to be efficiently parallelized in large-scale distributed settings. By introducing separable loss functions, we can scale out the training, with network communication and space efficiency comparable to those in one-versus-all approaches while maintaining an overall complexity sub-linear in the number of classes. On several large-scale benchmarks our proposed method achieves accuracy competitive to the state-of-the-art while reducing the training time from days to tens of minutes compared with existing parallel or sparse methods on a cluster of 100 cores."
kdd,None,Local Higher-Order Graph Clustering,"Hao Yin, Austin R. Benson, Jure Leskovec, David F. Gleich, ","Local graph clustering methods aim to find a cluster of nodes by exploring a small region of the graph. These methods are attractive because they enable targeted clustering around a given seed node and are faster than traditional global graph clustering methods because their runtime does not depend on the size of the input graph. However, current local graph partitioning methods are not designed to account for the higher-order structures crucial to the network, nor can they effectively handle directed networks. Here we introduce a new class of local graph clustering methods that address these issues by incorporating higher-order network information captured by small subgraphs, also called network motifs. We develop the Motif-based Approximate Personalized PageRank (MAPPR) algorithm that finds clusters containing a seed node with minimal \emph{motif conductance}, a generalization of the conductance metric for network motifs. We generalize existing theory to prove the fast running time (independent of the size of the graph) and obtain theoretical guarantees on the cluster quality (in terms of motif conductance). We also develop a theory of node neighborhoods for finding sets that have small motif conductance, and apply these results to the case of finding good seed nodes to use as input to the MAPPR algorithm. Experimental validation on community detection tasks in both synthetic and real-world networks, shows that our new framework MAPPR outperforms the current edge-based personalized PageRank methodology."
kdd,None,Long Short Memory Process: Modeling Growth Dynamics of Microscopic Social Connectivity,"Chengxi Zang, Peng Cui, Christos Faloutsos, Wenwu Zhu, ","How do people make friends dynamically in social networks? What are the temporal patterns for an individual increasing its social connectivity? What are the basic mechanisms governing the formation of these temporal patterns? No matter cyber or physical social systems, their structure and dynamics are mainly driven by the connectivity dynamics of each individual. However, due to the lack of empirical data, little is known about the empirical dynamic patterns of social connectivity at microscopic level, let alone the regularities or models governing these microscopic dynamics."
kdd,None,Weisfeiler-Lehman Neural Machine for Link Prediction,"Muhan Zhang, Yixin Chen, ","In this paper, we propose a next-generation link prediction method, Weisfeiler-Lehman Neural Machine (WLNM), which learns topological features in the form of graph patterns that promote the formation of links. WLNM has unmatched advantages including higher performance than state-of-the-art methods and universal applicability over various kinds of networks. WLNM extracts an enclosing subgraph of each target link and encodes the subgraph as an adjacency matrix. The key novelty of the encoding comes from a fast hashing-based Weisfeiler-Lehman (WL) algorithm that labels the vertices according to their structural roles in the subgraph while preserving the subgraph's intrinsic directionality. After that, a neural network is trained on these adjacency matrices to learn a predictive model. Compared with traditional link prediction methods, WLNM does not assume a particular link formation mechanism (such as common neighbors), but learns this mechanism from the graph itself. We conduct comprehensive experiments to show that WLNM not only outperforms a great number of state-of-the-art link prediction methods, but also consistently performs well across networks with different characteristics."
kdd,None,EmbedJoin: Efficient Edit Similarity Joins via Embeddings,"Haoyu Zhang, Qin Zhang, ","We study the problem of edit similarity joins, where given a set of strings and a threshold value K, we want to output all pairs of strings whose edit distances are at most K. Edit similarity join is a fundamental problem in data cleaning/integration, bioinformatics, collaborative filtering and natural language processing, and has been identified as a primitive operator for database systems. This problem has been studied extensively in the literature. However, we have observed that all the existing algorithms fall short on long strings and large distance thresholds."
kdd,None,TrioVecEvent: Embedding-Based Online Local Event Detection in Geo-Tagged Tweet Streams,"Chao Zhang, Liyuan Liu, Dongming Lei, Quan Yuan, ","Detecting local events (e.g., protest, disaster) at their onsets is an important task for a wide spectrum of applications, ranging from disaster control to crime monitoring and place recommendation. Recent years have witnessed growing interest in leveraging geo-tagged tweet streams for online local event detection. Nevertheless, the accuracies of existing methods still remain unsatisfactory for building reliable local event detection systems. We propose TrioVecEvent, a method that leverages multimodal embeddings to achieve accurate online local event detection. The effectiveness of TrioVecEvent is underpinned by its two-step detection scheme. First, it ensures a high coverage of the underlying local events by dividing the tweets in the query window into coherent geo-topic clusters. To generate quality geo-topic clusters, we capture short-text semantics by learning multimodal embeddings of the location, time, and text, and then perform online clustering with a novel Bayesian mixture model. Second, TrioVecEvent considers the geo-topic clusters as candidate events and extracts a set of features for classifying the candidates. Leveraging the multimodal embeddings as background knowledge, we introduce discriminative features that can well characterize local events, which enables pinpointing true local events from the candidate pool with a small amount of training data. We have used crowdsourcing to evaluate TrioVecEvent, and found that it improves the performance of the state-of-the-art method by a large margin."
kdd,None,Graph Edge Partitioning via Neighborhood Heuristic,"Chenzi Zhang, Fan Wei, Qin Liu, Zhihao Gavin Tang, Zhenguo Li, ","We consider the edge partitioning problem that partitions the edges of an input graph into multiple balanced components, while minimizing the total number of vertices replicated (one vertex might appear in more than one partition). This problem is critical in minimizing communication costs and running time for several large-scale distributed graph computation platforms (e.g., PowerGraph, Spark GraphX). We first prove that this problem is NP-hard, and then present a new partitioning heuristic with polynomial running time. We provide a worst-case upper bound of replication factor for our heuristic on general graphs. To our knowledge, we are the first to provide such bound for edge partitioning algorithms on general graphs. Applying this bound to random power-law graphs greatly improves the previous bounds of expected replication factor. Extensive experiments demonstrated that our partitioning algorithm consistently produces much smaller replication factors on various benchmark data sets than the state-of-the-art. When deployed in the production graph engine, PowerGraph, in average it reduces replication factor, communication, and running time by 54%, 66%, and 21%, respectively."
kdd,None,Randomization or Condensation?: Linear-Cost Matrix Sketching Via Cascaded Compression Sampling,"Kai Zhang, Chuanren Liu, Jie Zhang, Hui Xiong, Eric Xing, Jieping Ye, ","Matrix sketching is aimed at finding compact representations of a matrix while simultaneously preserving most of its properties, which is a fundamental building block in modern scientific computing. Randomized algorithms represent state-of-the-art and have attracted huge interest from the fields of machine learning, data mining, and theoretic computer science. However, it still requires the use of the entire input matrix in producing desired factorizations, which can be a major computational and memory bottleneck in truly large problems. In this paper, we uncover an interesting theoretic connection between matrix low-rank decomposition and lossy signal compression, based on which a cascaded compression sampling framework is devised to approximate an m-by-n matrix in only O(m+n) time and space. Indeed, the proposed method accesses only a small number of matrix rows and columns, which significantly improves the memory footprint. Meanwhile, by sequentially teaming two rounds of approximation procedures and upgrading the sampling strategy from a uniform probability to more sophisticated, encoding-orientated sampling, significant algorithmic boosting is achieved to uncover more granular structures in the data. Empirical results on a wide spectrum of real-world, large-scale matrices show that by taking only linear time and space, the accuracy of our method rivals those state-of-the-art randomized algorithms consuming a quadratic, O(mn), amount of resources."
kdd,None,Tracking the Dynamics in Crowdfunding,"Hongke Zhao, Hefu Zhang, Yong Ge, Qi Liu, Enhong Chen, ","Crowdfunding is an emerging Internet fundraising mechanism by raising monetary contributions from the crowd for projects or ventures. In these platforms, the dynamics, i.e., daily funding amount on campaigns and perks (backing options with rewards), are the most concerned issue for creators, backers and platforms. However, tracking the dynamics in crowdfunding is very challenging and still under-explored. To that end, in this paper, we present a focused study on this important problem. A special goal is to forecast the funding amount for a given campaign and its perks in the future days. Specifically, we formalize the dynamics in crowdfunding as a hierarchical time series, i.e., campaign level and perk level. Specific to each level, we develop a special regression by modeling the decision making process of the crowd (visitors and backing probability) and exploring various factors that impact the decision; on this basis, an enhanced switching regression is proposed at each level to address the heterogeneity of funding sequences. Further, we employ a revision matrix to combine the two-level base forecasts for the final forecasting. We conduct extensive experiments on a real-world crowdfunding data collected from Indiegogo.com. The experimental results clearly demonstrate the effectiveness of our approaches on tracking the dynamics in crowdfunding."
kdd,None,Meta-Graph Based Recommendation Fusion over Heterogeneous Information Networks,"Huan Zhao, Quanming Yao, Jianda Li, Yangqiu Song, Dik Lun Lee, ","Heterogeneous Information Network (HIN) is a natural and general representation of data in modern large commercial recommender systems which involve heterogeneous types of data. HIN based recommenders face two problems: how to represent the high-level semantics of recommendations and how to fuse the heterogeneous information to make recommendations. In this paper, we solve the two problems by first introducing the concept of meta-graph to HIN-based recommendation, and then solving the information fusion problem with a ""matrix factorization (MF) + factorization machine (FM)"" approach. For the similarities generated by each meta-graph, we perform standard MF to generate latent features for both users and items. With different meta-graph based features, we propose to use FM with Group lasso (FMG) to automatically learn from the observed ratings to effectively select useful meta-graph based features. Experimental results on two real-world datasets, Amazon and Yelp, show the effectiveness of our approach compared to state-of-the-art FM and other HIN-based recommendation algorithms."
kdd,None,Coresets for Kernel Regression,"Yan Zheng, Jeff M. Phillips, ","Kernel regression is an essential and ubiquitous tool for non-parametric data analysis, particularly popular among time series and spatial data. However, the central operation which is performed many times, evaluating a kernel on the data set, takes linear time. This is impractical for modern large data sets."
kdd,None,A Local Algorithm for Structure-Preserving Graph Cut,"Dawei Zhou, Si Zhang, Mehmet Yigit Yildirim, Scott Alcorn, ","Nowadays, large-scale graph data is being generated in a variety of real-world applications, from social networks to co-authorship networks, from protein-protein interaction networks to road traffic networks. Many existing works on graph mining focus on the vertices and edges, with the first-order Markov chain as the underlying model. They fail to explore the high-order network structures, which are of key importance in many high impact domains. For example, in bank customer personally identifiable information (PII) networks, the star structures often correspond to a set of synthetic identities; in financial transaction networks, the loop structures may indicate the existence of money laundering. In this paper, we focus on mining user-specified high-order network structures and aim to find a structure-rich subgraph which does not break many such structures by separating the subgraph from the rest."
kdd,None,Anomaly Detection with Robust Deep Autoencoders,"Chong Zhou, Randy C. Paffenroth, ","Deep autoencoders, and other deep neural networks, have demonstrated their effectiveness in discovering non-linear features across many problem domains. However, in many real-world problems, large outliers and pervasive noise are commonplace, and one may not have access to clean training data as required by standard deep denoising autoencoders. Herein, we demonstrate novel extensions to deep autoencoders which not only maintain a deep autoencoders' ability to discover high quality, non-linear features but can also eliminate outliers and noise without access to any clean training data. Our model is inspired by Robust Principal Component Analysis, and we split the input data X into two parts, $X = L_{D} + S$, where $L_{D}$ can be effectively reconstructed by a deep autoencoder and $S$ contains the outliers and noise in the original data X. Since such splitting increases the robustness of standard deep autoencoders, we name our model a ""Robust Deep Autoencoder (RDA)"". Further, we present generalizations of our results to grouped sparsity norms which allow one to distinguish random anomalies from other types of structured corruptions, such as a collection of features being corrupted across many instances or a collection of instances having more corruptions than their fellows. Such ""Group Robust Deep Autoencoders (GRDA)"" give rise to novel anomaly detection approaches whose superior performance we demonstrate on a selection of benchmark problems."
