conference,url,title,authors,abstract
kdd,https://dl.acm.org/doi/pdf/10.1145/3447548.3467082,MPCSL - A Modular Pipeline for Causal Structure Learning,"Johannes Huegle, Christopher Hagedorn, Michael Perscheid, ","The examination of causal structures is crucial for data scientists in a variety of machine learning application scenarios. In recent years, the corresponding interest in methods of causal structure learning has led to a wide spectrum of independent implementations, each having specific accuracy characteristics and introducing implementation-specific overhead in the runtime. Hence, considering a selection of algorithms or different implementations in different programming languages utilizing different hardware setups becomes a tedious manual task with high setup costs. Consequently, a tool that enables to plug in existing methods from different libraries into a single system to compare and evaluate the results is substantial support for data scientists in their research efforts."
kdd,https://dl.acm.org/doi/pdf/10.1145/3447548.3467076,Bootstrapping for Batch Active Sampling,"Heinrich Jiang, Maya R. Gupta, ","The goal of active learning is to select the best examples from an unlabeled pool of data to label to improve a model trained with the addition of these labeled examples. We discuss a real-world use case for batch active sampling that works at larger scales. The standard margin algorithm has repeatedly been shown difficult to beat in practice for the classic active sampling set-up, but for larger batches and candidate pools, we show that margin sampling may not provide enough diversity. We present a simple variant of margin sampling for the batch setting that scores candidate samples by their minimum margin to a set of bootstrapped margins, and explain how this proposal increases diversity in a supervised and efficient way, and why it differs from the usual ensemble methods for active sampling. Experiments on benchmark datasets show that the proposed min-margin sampling consistently works better than margin as the batch size grows, and better than the five other diversity-encouraging active sampling methods we tested. Two real-world case studies illustrate the practical value, and help highlight challenges of applying and deploying batch active sampling."
kdd,https://dl.acm.org/doi/pdf/10.1145/3447548.3467091,Network Experimentation at Scale,"Brian Karrer, Liang Shi, Monica Bhole, Matt Goldman, ","We describe our network experimentation framework, deployed at Facebook, which accounts for interference between experimental units. We document this system, including the design and estimation procedures, and detail insights we have gained from the many experiments that have used this system at scale. In our estimation procedure, we introduce a cluster-based regression adjustment that substantially improves precision for estimating global treatment effects, as well as a procedure to test for interference. With our regression adjustment, we find that imbalanced clusters can better account for interference than balanced clusters without sacrificing accuracy. In addition, we show that logging exposure to a treatment can result in additional variance reduction. Interference is a widely acknowledged issue in online field experiments, yet there is less evidence from real-world experiments demonstrating interference in online settings. We fill this gap by describing two case studies that capture significant network effects and highlight the value of this experimentation framework."
kdd,https://dl.acm.org/doi/pdf/10.1145/3447548.3467201,Diet Planning with Machine Learning: Teacher-forced REINFORCE for Composition Compliance with Nutrition Enhancement,"Changhun Lee, Soohyeok Kim, Chiehyeon Lim, Jayun Kim, Yeji Kim, ","Diet planning is a basic and regular human activity. Previous studies have considered diet planning a combinatorial optimization problem to generate solutions that satisfy a diet's nutritional requirements. However, this approach does not consider the composition of diets, which is critical for diet recipients' to accept and enjoy menus with high nutritional quality. Without this consideration, feasible solutions for diet planning could not be provided in practice. This suggests the necessity of diet planning with machine learning, which extracts implicit composition patterns from real diet data and applies these patterns when generating diets. This work is original research that defines diet planning as a machine learning problem; we describe diets as sequence data and solve a controllable sequence generation problem. Specifically, we develop the Teacher-forced REINFORCE algorithm to connect neural machine translation and reinforcement learning for composition compliance with nutrition enhancement in diet generation. Through a real-world application to diet planning for children, we validated the superiority of our work over the traditional combinatorial optimization and modern machine learning approaches, as well as human (i.e., professional dietitians) performance. In addition, we construct and open the databases of menus and diets to motivate and promote further research and development of diet planning with machine learning. We believe this work with data science will contribute to solving economic and social problems associated with diet planning."
kdd,https://dl.acm.org/doi/pdf/10.1145/3447548.3467126,VisualTextRank: Unsupervised Graph-based Content Extraction for Automating Ad Text to Image Search,"Shaunak Mishra, Mikhail Kuznetsov, Gaurav Srivastava, Maxim Sviridenko, ","Numerous online stock image libraries offer high quality yet copyright free images for use in marketing campaigns. To assist advertisers in navigating such third party libraries, we study the problem of automatically fetching relevant ad images given the ad text (via a short textual query for images). Motivated by our observations in logged data on ad image search queries (given ad text), we formulate a keyword extraction problem, where a keyword extracted from the ad text (or its augmented version) serves as the ad image query. In this context, we propose VisualTextRank: an unsupervised method to (i) augment input ad text using semantically similar ads, and (ii) extract the image query from the augmented ad text. VisualTextRank builds on prior work on graph based context extraction (biased TextRank in particular) by leveraging both the text and image of similar ads for better keyword extraction, and using advertiser category specific biasing with sentence-BERT embeddings. Using data collected from the Verizon Media Native (Yahoo Gemini) ad platform's stock image search feature for onboarding advertisers, we demonstrate the superiority of VisualTextRank compared to competitive keyword extraction baselines (including an 11% accuracy lift over biased TextRank). For the case when the stock image library is restricted to English queries, we show the effectiveness of VisualTextRank on multilingual ads (translated to English) while leveraging semantically similar English ads. Online tests with a simplified version of VisualTextRank led to a 28.7% increase in the usage of stock image search, and a 41.6% increase in the advertiser onboarding rate in the Verizon Media Native ad platform."
kdd,https://dl.acm.org/doi/pdf/10.1145/3447548.3467098,Amazon SageMaker Automatic Model Tuning: Scalable Gradient-Free Optimization,"Valerio Perrone, Huibin Shen, Aida Zolic, Iaroslav Shcherbatyi, ","Tuning complex machine learning systems is challenging. Machine learning typically requires to set hyperparameters, be it regularization, architecture, or optimization parameters, whose tuning is critical to achieve good predictive performance. To democratize access to machine learning systems, it is essential to automate the tuning. This paper presents Amazon SageMaker Automatic Model Tuning (AMT), a fully managed system for gradient-free optimization at scale. AMT finds the best version of a trained machine learning model by repeatedly evaluating it with different hyperparameter configurations. It leverages either random search or Bayesian optimization to choose the hyperparameter values resulting in the best model, as measured by the metric chosen by the user. AMT can be used with built-in algorithms, custom algorithms, and Amazon SageMaker pre-built containers for machine learning frameworks. We discuss the core functionality, system architecture, our design principles, and lessons learned. We also describe more advanced features of AMT, such as automated early stopping and warm-starting, showing in experiments their benefits to users."
kdd,https://dl.acm.org/doi/pdf/10.1145/3447548.3467099,Bootstrapping Recommendations at Chrome Web Store,"Zhen Qin, Honglei Zhuang, Rolf Jagerman, Xinyu Qian, Po Hu, ","Google Chrome, one of the world's most popular web browsers, features an extension framework allowing third-party developers to enhance Chrome's functionality. Chrome extensions are distributed through the Chrome Web Store (CWS), a Google-operated online marketplace. In this paper, we describe how we developed and deployed three recommender systems for discovering relevant extensions in CWS, namely non-personalized recommendations, related extension recommendations, and personalized recommendations. Unlike most existing papers that focus on novel algorithms, this paper focuses on sharing practical experiences when building large-scale recommender systems under various real-world constraints, such as privacy constraints, data sparsity and skewness issues, and product design choices (e.g., user interface). We show how these constraints make standard approaches difficult to succeed in practice. We share success stories that turn negative live metrics to positive ones, including: 1) how we use interpretable neural models to bootstrap the systems, help identifying pipeline issues, and pave the way for more advanced models; 2) a new item-item based algorithm for related recommendations that works under highly skewed data distributions; and 3) how the previous two techniques can help bootstrapping the personalized recommendations, which significantly reduces development cycles and bypasses various real-world difficulties. All the explorations in this work are verified in live traffic on millions of users. We believe that the findings in this paper can help practitioners to build better large-scale recommender systems."
kdd,https://dl.acm.org/doi/pdf/10.1145/3447548.3467172,Lambda Learner: Fast Incremental Learning on Data Streams,"Rohan Ramanath, Konstantin Salomatin, Jeffrey D. Gee, ","One of the most well-established applications of machine learning is in deciding what content to show website visitors. When observation data comes from high-velocity, user-generated data streams, machine learning methods perform a balancing act between model complexity, training time, and computational costs. Furthermore, when model freshness is critical, the training of models becomes time-constrained. Parallelized batch offline training, although horizontally scalable, is often not time-considerate or cost-effective. In this paper, we propose Lambda Learner, a new framework for training models by incremental updates in response to mini-batches from data streams. We show that the resulting model of our framework closely estimates a periodically updated model trained on offline data and outperforms it when model updates are time-sensitive. We provide theoretical proof that the incremental learning updates improve the loss-function over a stale batch model. We present a large-scale deployment on the sponsored content platform for a large social network, serving hundreds of millions of users across different channels (e.g., desktop, mobile). We address challenges and complexities from both algorithms and infrastructure perspectives, illustrate the system details for computation, storage, stream processing training data, and open-source the system."
kdd,https://dl.acm.org/doi/pdf/10.1145/3447548.3467207,Does Air Quality Really Impact COVID-19 Clinical Severity: Coupling NASA Satellite Datasets with Geometric Deep Learning,"Ignacio Segovia Dominguez, Huikyo Lee, Yuzhou Chen, Michael Garay, ","Given that persons with a prior history of respiratory diseases tend to demonstrate more severe illness from COVID-19 and, hence, are at higher risk of serious symptoms, ambient air quality data from NASA's satellite observations might provide a critical insight into which geographical areas may exhibit higher numbers of hospitalizations due to COVID-19, how the expected severity of COVID-19 and associated survival rates may vary across space in the future, and most importantly how given this information, health professionals can distribute vaccines in a more efficient, timely, and fair manner."
kdd,https://dl.acm.org/doi/pdf/10.1145/3447548.3467156,Mondegreen: A Post-Processing Solution to Speech Recognition Error Correction for Voice Search Queries,"Sukhdeep S. Sodhi, Ellie Ka-In Chio, Ambarish Jash, Santiago Ontañón, ","As more and more online search queries come from voice, automatic speech recognition becomes a key component to deliver relevant search results. Errors introduced by automatic speech recognition (ASR) lead to irrelevant search results returned to the user, thus causing user dissatisfaction. In this paper, we introduce an approach, ""Mondegreen"", to correct voice queries in text space without depending on audio signals, which may not always be available due to system constraints or privacy or bandwidth (for example, some ASR systems run on-device) considerations. We focus on voice queries transcribed via several proprietary commercial ASR systems. These queries come from users making internet, or online service search queries. We first present an analysis showing how different the language distribution coming from user voice queries is from that in traditional text corpora used to train off-the-shelf ASR systems. We then demonstrate that Mondegreen can achieve significant improvements in increased user interaction by correcting user voice queries in one of the largest search systems in Google. Finally, we see Mondegreen as complementing existing highly-optimized production ASR systems, which may not be frequently retrained and thus lag behind due to vocabulary drifts."
kdd,https://dl.acm.org/doi/pdf/10.1145/3447548.3467171,Dynamic Social Media Monitoring for Fast-Evolving Online Discussions,"Maya Srikanth, Anqi Liu, Nicholas Adams-Cohen, Jian Cao, ","Tracking and collecting fast-evolving online discussions provides vast data for studying social media usage and its role in people's public lives. However, collecting social media data using a static set of keywords fails to satisfy the growing need to monitor dynamic conversations and to study fast-changing topics. We propose a dynamic keyword search method to maximize the coverage of relevant information in fast-evolving online discussions. The method uses word embedding models to represent the semantic relations between keywords and predictive models to forecast the future trajectory of keywords. We also implement a visual user interface to aid in the decision making process in each round of keyword updates. This allows for both human-assisted tracking and fully-automated data collection. In simulations using historical #MeToo data in 2017, our human-assisted tracking method outperforms the traditional static baseline method significantly, achieving 37.1% improvement in F-1 score in the task of tracking the top trending keywords. We conduct a contemporary case study to cover dynamic conversations about the recent Presidential Inauguration and to test the dynamic data collection system. Our case studies reflect the effectiveness of our process and also points to the potential challenges in future deployment."
kdd,https://dl.acm.org/doi/pdf/10.1145/3447548.3467095,Recommending the Most Effective Intervention to Improve Employment for Job Seekers with Disability,"Ha Xuan Tran, Thuc Duy Le, Jiuyong Li, Lin Liu, Jixue Liu, ","In Disability Employment Services (DES), a growing problem is recommending to disabled job seekers which skill should be upgraded and the best level for upgrading this skill to increase their employment potential most. This problem involves counterfactual reasoning to infer causal effect of factors on employment status to recommend the most effective intervention. Related methods cannot solve our problem adequately since they are developed for non-counterfactual challenges, for binary causal factors, or for randomized trials. In this paper, we present a causality-based method to tackle the problem. The method includes two stages where causal factors of employment status are first detected from data. We then combine a counterfactual reasoning framework with a machine learning approach to build an interpretable model for generating personalized recommendations. Experiments on both synthetic datasets and a real case study from a DES provider show consistent promising performance of improving employability of disabled job seekers. Results from the case study disclose effective factors and their best levels for intervention to increase employability. The most effective intervention varies among job seekers. Our model can separate job seekers by degree of employability increase. This is helpful for DES providers to allocate resources for employment assistance. Moreover, causal interpretability makes our recommendations actionable in DES business practice."
kdd,https://dl.acm.org/doi/pdf/10.1145/3447548.3467119,Clockwork: A Delay-Based Global Scheduling Framework for More Consistent Landing Times in the Data Warehouse,"Martin Valdez-Vivas, Varun Sharma, Nick Stanisha, Shan Li, Luo Mi, ","Recurring batch data pipelines are a staple of the modern enterprise-scale data warehouse. As a data warehouse scales to support more products and services, a growing number of interdependent pipelines running at various cadences can give rise to periodic resource bottlenecks for the cluster. This resource contention results in pipelines starting at unpredictable times each day and consequently variable landing times for the data artifacts they produce. The variability gets compounded by the dependency structure of the workload, and the resulting unpredictability can disrupt the project workstreams which consume this data. We present Clockwork, a delay-based global scheduling framework for data pipelines which improves landing time stability by spreading out tasks throughout the day. Whereas most scheduling algorithms optimize for makespan or average job completion times, Clockwork's execution plan optimizes for stability in task completion times while also targeting predefined pipeline SLOs. We present this new problem formulation and design a list scheduling algorithm based on its analytic properties. We also discuss how we estimate the resource requirements for our recurring pipelines, and the architecture for integrating Clockwork with Dataswarm, Facebook's existing data workflow management service. Online experiments comparing this novel scheduling algorithm and a previously proposed greedy procrastinating heuristic show tasks complete almost an hour earlier on average, while exhibiting lower landing time variance and producing significantly less competition for resources in the cluster."
kdd,https://dl.acm.org/doi/pdf/10.1145/3447548.3467153,Multimodal Emergent Fake News Detection via Meta Neural Process Networks,"Yaqing Wang, Fenglong Ma, Haoyu Wang, Kishlay Jha, Jing Gao, ","Fake news travels at unprecedented speeds, reaches global audiences and puts users and communities at great risk via social media platforms. Deep learning based models show good performance when trained on large amounts of labeled data on events of interest, whereas the performance of models tends to degrade on other events due to domain shift. Therefore, significant challenges are posed for existing detection approaches to detect fake news on emergent events, where large-scale labeled datasets are difficult to obtain. Moreover, adding the knowledge from newly emergent events requires to build a new model from scratch or continue to fine-tune the model, which can be challenging, expensive, and unrealistic for real-world settings. In order to address those challenges, we propose an end-to-end fake news detection framework named MetaFEND, which is able to learn quickly to detect fake news on emergent events with a few verified posts. Specifically, the proposed model integrates meta-learning and neural process methods together to enjoy the benefits of these approaches. In particular, a label embedding module and a hard attention mechanism are proposed to enhance the effectiveness by handling categorical information and trimming irrelevant posts. Extensive experiments are conducted on multimedia datasets collected from Twitter and Weibo. The experimental results show our proposed MetaFEND model can detect fake news on never-seen events effectively and outperform the state-of-the-art methods."
kdd,https://dl.acm.org/doi/pdf/10.1145/3447548.3467087,Session-Aware Query Auto-completion using Extreme Multi-Label Ranking,"Nishant Yadav, Rajat Sen, Daniel N. Hill, Arya Mazumdar, ","Query auto-completion (QAC) is a fundamental feature in search engines where the task is to suggest plausible completions of a prefix typed in the search bar. Previous queries in the user session can provide useful context for the user's intent and can be leveraged to suggest auto-completions that are more relevant while adhering to the user's prefix. Such session-aware QACs can be generated by recent sequence-to-sequence deep learning models; however, these generative approaches often do not meet the stringent latency requirements of responding to each user keystroke. Moreover, these generative approaches pose the risk of showing nonsensical queries. One can pre-compute a relatively small subset of relevant queries for common prefixes and rank them based on the context. However, such an approach fails when no relevant queries for the current context are present in the pre-computed set."
kdd,https://dl.acm.org/doi/pdf/10.1145/3447548.3467093,Learning to Expand Audience via Meta Hybrid Experts and Critics for Recommendation and Advertising,"Yongchun Zhu, Yudan Liu, Ruobing Xie, Fuzhen Zhuang, ","In recommender systems and advertising platforms, marketers always want to deliver products, contents, or advertisements to potential audiences over media channels such as display, video, or social. Given a set of audiences or customers (seed users), the audience expansion technique (look-alike modeling) is a promising solution to identify more potential audiences, who are similar to the seed users and likely to finish the business goal of the target campaign. However, look-alike modeling faces two challenges: (1) In practice, a company could run hundreds of marketing campaigns to promote various contents within completely different categories every day, e.g., sports, politics, society. Thus, it is difficult to utilize a common method to expand audiences for all campaigns. (2) The seed set of a certain campaign could only cover limited users. Therefore, a customized approach based on such a seed set is likely to be overfitting."
