conference,url,title,authors,abstract
kdd,None,The battle for the future of data mining,"Oren Etzioni, ","Deep learning has catapulted to the front page of the New York Times, formed the core of the so-called 'Google brain', and achieved impressive results in vision, speech recognition, and elsewhere. Yet researchers have offered simple conundrums that deep learning doesn't address. For example, consider the sentence: 'The large ball crashed right through the table because it was made of Styrofoam.' What was made of Styrofoam? The large ball? Or the table? The answer is obviously 'the table', but if we change the word 'Styrofoam' to 'steel', the answer is clearly 'the large ball'. To automatically answer this type of question, our computers require an extensive body of knowledge. We believe that text mining can provide the requisite body of knowledge. My talk will describe work at the new Allen Institute for AI towards building the next-generation of text-mining systems."
kdd,None,"Data, predictions, and decisions in support of people and society","Eric Horvitz, ","Deep societal benefits will spring from advances in data availability and in computational procedures for mining insights and inferences from large data sets. I will describe efforts to harness data for making predictions and guiding decisions, touching on work in transportation, healthcare, online services, and interactive systems. I will start with efforts to learn and field predictive models that forecast flows of traffic in greater city regions. Moving from the ground to the air, I will discuss fusing data from aircraft to make inferences about atmospheric conditions and using these results to enhance air transport. I will then focus on experiences with building and fielding predictive models in clinical medicine. I will show how inferences about outcomes and interventions can provide insights and guide decision making. Moving beyond data captured by hospitals, I will discuss the promise of transforming anonymized behavioral data drawn from web services into large-scale sensor networks for public health, including efforts to identify adverse effects of medications and to understand illness in populations. I will conclude by describing how we can use machine learning to leverage the complementarity of human and machine intellect to solve challenging problems in science and society."
kdd,None,A data driven approach to diagnosing and treating disease,"Eric Schadt, ","Throughout the biomedical and life sciences research community, advanced integrative biology algorithms are employed to integrate large scale data across many different high-dimensional datatypes to construct predictive network models of disease. The causal inference approaches we employ for this purpose well complement the types of natural artificial intelligence/machine learning approaches that have become nearly standard in the life and biomedical sciences for building classifiers for a range of problems, from disease classification and subtype stratification, to the identification of responders and non-responders for a given treatment strategy. By building a causal network model that spans multiple scales (from the molecular to the cellular, to the tissue/organ, to the organism and community) we can understand the flow of information and how best to modulate that flow to improve human wellbeing, whether better diagnosing and treating disease or improving overall health(1-4). More specifically, we have constructed predictive network models for Alzheimer's disease, along with other common human diseases such as obesity, diabetes, heart disease, and inflammatory bowel disease, and cancer, and demonstrated a causal network common across all of these diseases(3, 5-10). Not only do we demonstrate that our predictive models uncover important mechanisms of disease and mechanistic connections among different diseases, but that they have led to a natural way to prioritize therapeutic points of intervention and provide optimal molecular phenotypes for high throughput screening. Our application of these models in a number of disease areas has led to the identification of novel genes that are causal for disease and that may serve as efficacious points of therapeutic intervention, as well as to personalized treatment strategies that provide a more quantitative and accurate approach to tailoring treatments to specific forms of disease."
kdd,None,Bugbears or legitimate threats?: (social) scientists' criticisms of machine learning?,"Sendhil Mullainathan, ","Social scientists increasingly criticize the use of machine learning techniques to understand human behavior. Criticisms include: (1) They are atheoretical and hence of limited scientific value; (2) They do not address causality and are hence of limited policy value; and (3) They are uninterpretable and hence of limited generalizability value (outside contexts very narrowly similar to the training dataset). These criticisms, I argue, miss the enormous opportunity offered by ML techniques to fundamentally improve the practice of empirical social science. Yet each criticism does contain a grain of truth and overcoming them will require innovations to existing methodologies. Some of these innovations are being developed today and some are yet to be tackled. I will in this talk sketch (1) what these innovations look like or should look like; (2) why they are needed; and (3) the technical challenges they raise. I will illustrate my points using a set of applications that range from financial markets to social policy problems to computational models of basic psychological processes. This talk describes joint work with Jon Kleinberg and individual projects with Himabindu Lakkaraju, Jure Leskovec, Jens Ludwig, Anuj Shah, Chenhao Tan, Mike Yeomans and Tom Zimmerman."
kdd,None,Prediction of human emergency behavior and their mobility following large-scale disaster,"Xuan Song, Quanshi Zhang, Yoshihide Sekimoto, Ryosuke Shibasaki, ","The frequency and intensity of natural disasters has significantly increased over the past decades and this trend is predicted to continue. Facing these possible and unexpected disasters, accurately predicting human emergency behavior and their mobility will become the critical issue for planning effective humanitarian relief, disaster management, and long-term societal reconstruction. In this paper, we build up a large human mobility database (GPS records of 1.6 million users over one year) and several different datasets to capture and analyze human emergency behavior and their mobility following the Great East Japan Earthquake and Fukushima nuclear accident. Based on our empirical analysis through these data, we find that human behavior and their mobility following large-scale disaster sometimes correlate with their mobility patterns during normal times, and are also highly impacted by their social relationship, intensity of disaster, damage level, government appointed shelters, news reporting, large population flow and etc. On the basis of these findings, we develop a model of human behavior that takes into account these factors for accurately predicting human emergency behavior and their mobility following large-scale disaster. The experimental results and validations demonstrate the efficiency of our behavior model, and suggest that human behavior and their movements during disasters may be significantly more predictable than previously thought."
kdd,None,Inferring user demographics and social strategies in mobile social networks,"Yuxiao Dong, Yang Yang, Jie Tang, Yang Yang, Nitesh V. Chawla, ","Demographics are widely used in marketing to characterize different types of customers. However, in practice, demographic information such as age, gender, and location is usually unavailable due to privacy and other reasons. In this paper, we aim to harness the power of big data to automatically infer users' demographics based on their daily mobile communication patterns. Our study is based on a real-world large mobile network of more than 7,000,000 users and over 1,000,000,000 communication records (CALL and SMS). We discover several interesting social strategies that mobile users frequently use to maintain their social connections. First, young people are very active in broadening their social circles, while seniors tend to keep close but more stable connections. Second, female users put more attention on cross-generation interactions than male users, though interactions between male and female users are frequent. Third, a persistent same-gender triadic pattern over one's lifetime is discovered for the first time, while more complex opposite-gender triadic patterns are only exhibited among young people."
kdd,None,Travel time estimation of a path using sparse trajectories,"Yilun Wang, Yu Zheng, Yexiang Xue, ","In this paper, we propose a citywide and real-time model for estimating the travel time of any path (represented as a sequence of connected road segments) in real time in a city, based on the GPS trajectories of vehicles received in current time slots and over a period of history as well as map data sources. Though this is a strategically important task in many traffic monitoring and routing systems, the problem has not been well solved yet given the following three challenges. The first is the data sparsity problem, i.e., many road segments may not be traveled by any GPS-equipped vehicles in present time slot. In most cases, we cannot find a trajectory exactly traversing a query path either. Second, for the fragment of a path with trajectories, they are multiple ways of using (or combining) the trajectories to estimate the corresponding travel time. Finding an optimal combination is a challenging problem, subject to a tradeoff between the length of a path and the number of trajectories traversing the path (i.e., support). Third, we need to instantly answer users' queries which may occur in any part of a given city. This calls for an efficient, scalable and effective solution that can enable a citywide and real-time travel time estimation. To address these challenges, we model different drivers' travel times on different road segments in different time slots with a three dimension tensor. Combined with geospatial, temporal and historical contexts learned from trajectories and map data, we fill in the tensor's missing values through a context-aware tensor decomposition approach. We then devise and prove an object function to model the aforementioned tradeoff, with which we find the most optimal concatenation of trajectories for an estimate through a dynamic programming solution. In addition, we propose using frequent trajectory patterns (mined from historical trajectories) to scale down the candidates of concatenation and a suffix-tree-based index to manage the trajectories received in the present time slot. We evaluate our method based on extensive experiments, using GPS trajectories generated by more than 32,000 taxis over a period of two months. The results demonstrate the effectiveness, efficiency and scalability of our method beyond baseline approaches."
kdd,None,Modeling human location data with mixtures of kernel densities,"Moshe Lichman, Padhraic Smyth, ","Location-based data is increasingly prevalent with the rapid increase and adoption of mobile devices. In this paper we address the problem of learning spatial density models, focusing specifically on individual-level data. Modeling and predicting a spatial distribution for an individual is a challenging problem given both (a) the typical sparsity of data at the individual level and (b) the heterogeneity of spatial mobility patterns across individuals. We investigate the application of kernel density estimation (KDE) to this problem using a mixture model approach that can interpolate between an individual's data and broader patterns in the population as a whole. The mixture-KDE approach is evaluated on two large geolocation/check-in data sets, from Twitter and Gowalla, with comparisons to non-KDE baselines, using both log-likelihood and detection of simulated identity theft as evaluation metrics. Our experimental results indicate that the mixture-KDE method provides a useful and accurate methodology for capturing and predicting individual-level spatial patterns in the presence of noisy and sparse data."
kdd,None,A cost-effective recommender system for taxi drivers,"Meng Qu, Hengshu Zhu, Junming Liu, Guannan Liu, Hui Xiong, ","The GPS technology and new forms of urban geography have changed the paradigm for mobile services. As such, the abundant availability of GPS traces has enabled new ways of doing taxi business. Indeed, recent efforts have been made on developing mobile recommender systems for taxi drivers using Taxi GPS traces. These systems can recommend a sequence of pick-up points for the purpose of maximizing the probability of identifying a customer with the shortest driving distance. However, in the real world, the income of taxi drivers is strongly correlated with the effective driving hours. In other words, it is more critical for taxi drivers to know the actual driving routes to minimize the driving time before finding a customer. To this end, in this paper, we propose to develop a cost-effective recommender system for taxi drivers. The design goal is to maximize their profits when following the recommended routes for finding passengers. Specifically, we first design a net profit objective function for evaluating the potential profits of the driving routes. Then, we develop a graph representation of road networks by mining the historical taxi GPS traces and provide a Brute-Force strategy to generate optimal driving route for recommendation. However, a critical challenge along this line is the high computational cost of the graph based approach. Therefore, we develop a novel recursion strategy based on the special form of the net profit function for searching optimal candidate routes efficiently. Particularly, instead of recommending a sequence of pick-up points and letting the driver decide how to get to those points, our recommender system is capable of providing an entire driving route, and the drivers are able to find a customer for the largest potential profit by following the recommendations. This makes our recommender system more practical and profitable than other existing recommender systems. Finally, we carry out extensive experiments on a real-world data set collected from the San Francisco Bay area and the experimental results clearly validate the effectiveness of the proposed recommender system."
kdd,None,LUDIA: an aggregate-constrained low-rank reconstruction algorithm to leverage publicly released health data,"Yubin Park, Joydeep Ghosh, ","In the past few years, the government and other agencies have publicly released a prodigious amount of data that can be potentially mined to benefit the society at large. However, data such as health records are typically only provided at aggregated levels (e.g. per State, per Hospital Referral Region, etc.) to protect privacy. Unfortunately aggregation can severely diminish the utility of such data when modeling or analysis is desired at a per-individual basis. So, not surprisingly, despite the increasing abundance of aggregate data, there have been very few successful attempts in exploiting them for individual-level analyses. This paper introduces LUDIA, a novel low-rank approximation algorithm that utilizes aggregation constraints in addition to auxiliary information in order to estimate or ""reconstruct"" the original individual-level values from aggregate data. If the reconstructed data are statistically similar to the original individual-level data, off-the-shelf individual-level models can be readily and reliably applied for subsequent predictive or descriptive analytics. LUDIA is more robust to nonlinear estimates and random effects than other reconstruction algorithms. It solves a Sylvester equation and leverages multi-level (also known as hierarchical or mixed-effect) modeling approaches efficiently. A novel graphical model is also introduced to provide a probabilistic viewpoint of LUDIA. Experimental results using a Texas inpatient dataset show that individual-level data can be reasonably reconstructed from county-, hospital-, and zip code-level aggregate data. Several factors affecting the reconstruction quality are discussed, along with the implications of this work for current aggregation guidelines."
kdd,None,People on drugs: credibility of user statements in health communities,"Subhabrata Mukherjee, Gerhard Weikum, ","Online health communities are a valuable source of information for patients and physicians. However, such user-generated resources are often plagued by inaccuracies and misinformation. In this work we propose a method for automatically establishing the credibility of user-generated medical statements and the trustworthiness of their authors by exploiting linguistic cues and distant supervision from expert sources. To this end we introduce a probabilistic graphical model that jointly learns user trustworthiness, statement credibility, and language objectivity."
kdd,None,Unfolding physiological state: mortality modelling in intensive care units,"Marzyeh Ghassemi, Tristan Naumann, Finale Doshi-Velez, Nicole Brimmer, ","Accurate knowledge of a patient's disease state and trajectory is critical in a clinical setting. Modern electronic healthcare records contain an increasingly large amount of data, and the ability to automatically identify the factors that influence patient outcomes stand to greatly improve the efficiency and quality of care."
kdd,None,Unsupervised learning of disease progression models,"Xiang Wang, David Sontag, Fei Wang, ","Chronic diseases, such as Alzheimer's Disease, Diabetes, and Chronic Obstructive Pulmonary Disease, usually progress slowly over a long period of time, causing increasing burden to the patients, their families, and the healthcare system. A better understanding of their progression is instrumental in early diagnosis and personalized care. Modeling disease progression based on real-world evidence is a very challenging task due to the incompleteness and irregularity of the observations, as well as the heterogeneity of the patient conditions. In this paper, we propose a probabilistic disease progression model that address these challenges. As compared to existing disease progression models, the advantage of our model is three-fold: 1) it learns a continuous-time progression model from discrete-time observations with non-equal intervals; 2) it learns the full progression trajectory from a set of incomplete records that only cover short segments of the progression; 3) it learns a compact set of medical concepts as the bridge between the hidden progression process and the observed medical evidence, which are usually extremely sparse and noisy. We demonstrate the capabilities of our model by applying it to a real-world COPD patient cohort and deriving some interesting clinical insights."
kdd,None,"Good-enough brain model: challenges, algorithms and discoveries in multi-subject experiments","Evangelos E. Papalexakis, Alona Fyshe, Nicholas D. Sidiropoulos, ","Given a simple noun such as {\em apple}, and a question such as ""is it edible?"", what processes take place in the human brain? More specifically, given the stimulus, what are the interactions between (groups of) neurons (also known as functional connectivity) and how can we automatically infer those interactions, given measurements of the brain activity? Furthermore, how does this connectivity differ across different human subjects?"
kdd,None,FUNNEL: automatic mining of spatially coevolving epidemics,"Yasuko Matsubara, Yasushi Sakurai, Willem G. van Panhuis, Christos Faloutsos, ","Given a large collection of epidemiological data consisting of the count of d contagious diseases for l locations of duration n, how can we find patterns, rules and outliers? For example, the Project Tycho provides open access to the count infections for U.S. states from 1888 to 2013, for 56 contagious diseases (e.g., measles, influenza), which include missing values, possible recording errors, sudden spikes (or dives) of infections, etc. So how can we find a combined model, for all these diseases, locations, and time-ticks? In this paper, we present FUNNEL, a unifying analytical model for large scale epidemiological data, as well as a novel fitting algorithm, FUNNELFIT, which solves the above problem. Our method has the following properties: (a) Sense-making: it detects important patterns of epidemics, such as periodicities, the appearance of vaccines, external shock events, and more; (b) Parameter-free: our modeling framework frees the user from providing parameter values; (c) Scalable: FUNNELFIT is carefully designed to be linear on the input size; (d) General: our model is general and practical, which can be applied to various types of epidemics, including computer-virus propagation, as well as human diseases. Extensive experiments on real data demonstrate that FUNNELFIT does indeed discover important properties of epidemics: (P1) disease seasonality, e.g., influenza spikes in January, Lyme disease spikes in July and the absence of yearly periodicity for gonorrhea; (P2) disease reduction effect, e.g., the appearance of vaccines; (P3) local/state-level sensitivity, e.g., many measles cases in NY; (P4) external shock events, e.g., historical flu pandemics; (P5) detect incongruous values, i.e., data reporting errors."
kdd,None,Marble: high-throughput phenotyping from electronic health records via sparse nonnegative tensor factorization,"Joyce C. Ho, Joydeep Ghosh, Jimeng Sun, ","The rapidly increasing availability of electronic health records (EHRs) from multiple heterogeneous sources has spearheaded the adoption of data-driven approaches for improved clinical research, decision making, prognosis, and patient management. Unfortunately, EHR data do not always directly and reliably map to phenotypes, or medical concepts, that clinical researchers need or use. Existing phenotyping approaches typically require labor intensive supervision from medical experts. We propose Marble, a novel sparse non-negative tensor factorization method to derive phenotype candidates with virtually no human supervision. Marble decomposes the observed tensor into two terms, a bias tensor and an interaction tensor. The bias tensor represents the baseline characteristics common amongst the overall population and the interaction tensor defines the phenotypes. We demonstrate the capability of our proposed model on both simulated and patient data from a publicly available clinical database. Our results show that Marble derived phenotypes provide at least a 42.8% reduction in the number of non-zero element and also retains predictive power for classification purposes. Furthermore, the resulting phenotypes and baseline characteristics from real EHR data are consistent with known characteristics of the patient population. Thus it can potentially be used to rapidly characterize, predict, and manage a large number of diseases, thereby promising a novel, data-driven solution that can benefit very large segments of the population."
kdd,None,Scalable noise mining in long-term electrocardiographic time-series to predict death following heart attacks,"Chih-Chun Chia, Zeeshan Syed, ","Cardiac disease is the leading cause of death around the world; with ischemic heart disease alone claiming 7 million lives in 2011. This burden can be attributed, in part, to the absence of biomarkers that can reliably identify high risk patients and match them to treatments that are appropriate for them. In recent clinical studies, we have demonstrated the ability of computation to extract information with substantial prognostic utility that is typically disregarded in time-series data collected from cardiac patients. Of particular interest are subtle variations in long-term electrocardiographic (ECG) data that are usually overlooked as noise but provide a useful assessment of myocardial instability. In multiple clinical cohorts, we have developed the pathophysiological basis for studying probabilistic variations in long-term ECG and demonstrated the ability of this information to effectively risk stratify patients at risk of dying following heart attacks. In this paper, we extend this work and focus on the question of how to reduce its computational complexity for scalable use in large datasets or energy constrained embedded devices. Our basic approach to uncovering pathological structure within the ECG focuses on characterizing beat-to-beat time-warped shape deformations of the ECG using a modified dynamic time-warping (DTW) and Lomb-Scargle periodogram-based algorithm. As part of our efforts to scale this work up, we explore a novel approach to address the quadratic runtime of DTW. We achieve this by developing the idea of adaptive downsampling to reduce the size of the inputs presented to DTW, and describe changes to the dynamic programming problem underlying DTW to exploit adaptively downsampled ECG signals. When evaluated on data from 765 patients in the DISPERSE2-TIMI33 trial, our results show that high morphologic variability is associated with an 8- to 9-fold increased risk of death within 90 days of a heart attack. Moreover, the use of adaptive downsampling with a modified DTW formulation achieves a 7- to almost 20-fold reduction in runtime relative to DTW, without a significant change in biomarker discrimination."
