conference,url,title,authors,abstract
kdd,https://dl.acm.org/doi/pdf/10.1145/3447548.3467325,Quantifying Uncertainty in Deep Spatiotemporal Forecasting,"Dongxia Wu, Liyao Gao, Matteo Chinazzi, Xinyue Xiong, ","Deep learning is gaining increasing popularity for spatiotemporal forecasting. However, prior works have mostly focused on point estimates without quantifying the uncertainty of the predictions. In high stakes domains, being able to generate probabilistic forecasts with confidence intervals is critical to risk assessment and decision making. Hence, a systematic study of uncertainty quantification (UQ) methods for spatiotemporal forecasting is missing in the community. In this paper, we describe two types of spatiotemporal forecasting problems: regular grid-based and graph-based. Then we analyze UQ methods from both the Bayesian and the frequentist point of view, casting in a unified framework via statistical decision theory. Through extensive experiments on real-world road network traffic, epidemics, and air quality forecasting tasks, we reveal the statistical and computational trade-offs for different UQ methods: Bayesian methods are typically more robust in mean prediction, while confidence levels obtained from frequentist methods provide more extensive coverage over data variations. Computationally, quantile regression type methods are cheaper for a single confidence interval but require re-training for different intervals. Sampling based methods generate samples that can form multiple confidence intervals, albeit at a higher computational cost."
kdd,https://dl.acm.org/doi/pdf/10.1145/3447548.3467425,Numerical Formula Recognition from Tables,"Qingping Yang, Yixuan Cao, Hongwei Li, Ping Luo, ","Claims over the numerical relationships among some measures are commonly expressed in tabular forms, and widely exist in the published documents on the Web. This paper introduces the problem of numerical formula recognition from tables, namely recognizing all numerical formulas inside a given table. It can well support many interesting downstream applications, such as numerical error correction in tables, formula recommendation in tables. Here, we emphasize that table is a kind of language that adopts a different linguistic paradigm from natural language. It uses visual grammar like visual layout and visual settings (e.g., indentation, font style) to express the grammatical relationships among the table cells. Understanding tables and recognizing formulas require decoding the visual grammar while simultaneously understanding the textual information. Another challenge is that formulas are complicated in terms of diverse math functions and variable-length of arguments. To address these challenges, we convert this task into a uniform framework, extracting relations of table cell pairs in a table. A two-channel neural network model TaFor is proposed to embed both the textual and visual features for a table cell. Our framework achieves the formula-level F1-score = 0.90 on a real-world dataset of 190179 tables while a retrieval-based method achieves F1-score = 0.72. We also perform extensive experiments to demonstrate the effectiveness of each component in our model, and conduct a case study to discuss the limits of the proposed model. With our published data this study also aims to attract the community's interest in deep semantic understanding over tables."
kdd,https://dl.acm.org/doi/pdf/10.1145/3447548.3467272,Context-aware Outstanding Fact Mining from Knowledge Graphs,"Yueji Yang, Yuchen Li, Panagiotis Karras, Anthony K. H. Tung, ","An Outstanding Fact (OF) is an attribute that makes a target entity stand out from its peers. The mining of OFs has important applications, especially in Computational Journalism, such as news promotion, fact-checking, and news story finding. However, existing approaches to OF mining: (i) disregard the context in which the target entity appears, hence may report facts irrelevant to that context; and (ii) require relational data, which are often unavailable or incomplete in many application domains. In this paper, we introduce the novel problem of mining Context-aware Outstanding Facts (COFs) for a target entity under a given context specified by a context entity. We propose FMiner, a context-aware mining framework that leverages knowledge graphs (KGs) for COF mining. FMiner generates COFs in two steps. First, it discovers top-k relevant relationships between the target and the context entity from a KG. We propose novel optimizations and pruning techniques to expedite this operation, as this process is very expensive on large KGs due to its exponential complexity. Second, for each derived relationship, we find the attributes of the target entity that distinguish it from peer entities that have the same relationship with the context entity, yielding the top-l COFs. As such, the mining process is modeled as a top-(k,l) search problem. Context-awareness is ensured by relying on the relevant relationships with the context entity to derive peer entities for COF extraction. Consequently, FMiner can effectively navigate the search to obtain context-aware OFs by incorporating a context entity. We conduct extensive experiments, including a user study, to validate the efficiency and the effectiveness of FMiner."
kdd,https://dl.acm.org/doi/pdf/10.1145/3447548.3467284,Performance-Adaptive Sampling Strategy Towards Fast and Accurate Graph Neural Networks,"Minji Yoon, Théophile Gervet, Baoxu Shi, Sufeng Niu, Qi He, ","The main challenge of adapting Graph convolutional networks (GCNs) to large-scale graphs is the scalability issue due to the uncontrollable neighborhood expansion in the aggregation stage. Several sampling algorithms have been proposed to limit the neighborhood expansion. However, these algorithms focus on minimizing the variance in sampling to approximate the original aggregation. This leads to two critical problems: 1) low accuracy because the sampling policy is agnostic to the performance of the target task, and 2) vulnerability to noise or adversarial attacks on the graph."
kdd,https://dl.acm.org/doi/pdf/10.1145/3447548.3467294,A Novel Multi-View Clustering Method for Unknown Mapping Relationships Between Cross-View Samples,"Hong Yu, Jia Tang, Guoyin Wang, Xinbo Gao, ","The existing multi-view clustering algorithms require that a sample in a view is completely or partially mapped onto one or more samples in a different corresponding view. However, this requirement could not be satisfied in many practical applications. Fortunately, there is a common cognition that the graph structure formed from each view should be as consistent as possible. Thus, this paper proposes a novel multi-view clustering method for unknown mapping relationships between cross-view samples based on the framework of non-negative matrix factorization, as an attempt to solve this problem. The objective function is designed by effectively building reconstruction error terms, local structural constraint terms, and cross-view mapping loss terms by exploring cross-view relationships. The experimental results show that the proposed method not only performs well to reveal the real mapping relationships between cross-view samples but also outperforms the comparison algorithms on the obtained clustering results."
kdd,https://dl.acm.org/doi/pdf/10.1145/3447548.3467405,Data Poisoning Attacks Against Outcome Interpretations of Predictive Models,"Hengtong Zhang, Jing Gao, Lu Su, ","The past decades have witnessed significant progress towards improving the accuracy of predictions powered by complex machine learning models. Despite much success, the lack of model interpretability prevents the usage of these techniques in life-critical systems such as medical diagnosis and self-driving systems. Recently, the interpretability issue has received much attention, and one critical task is to explain why a predictive model makes a specific decision. We refer to this task as outcome interpretation. Many outcome interpretation methods have been developed to produce human-understandable interpretations by utilizing intermediate results of the machine learning models, such as gradients and model parameters."
kdd,https://dl.acm.org/doi/pdf/10.1145/3447548.3467320,ELITE: Robust Deep Anomaly Detection with Meta Gradient,"Huayi Zhang, Lei Cao, Peter VanNostrand, Samuel Madden, ","Deep Learning techniques have been widely used in detecting anomalies from complex data. Most of these techniques are either unsupervised or semi-supervised because of a lack of a large number of labeled anomalies. However, they typically rely on a clean training data not polluted by anomalies to learn the distribution of the normal data. Otherwise, the learned distribution tends to be distorted and hence ineffective in distinguishing between normal and abnormal data. To solve this problem, we propose a novel approach called ELITE that uses a small number of labeled examples to infer the anomalies hidden in the training samples. It then turns these anomalies into useful signals that help to better detect anomalies from user data. Unlike the classical semi-supervised classification strategy which uses labeled examples as training data, ELITE uses them as validation set. It leverages the gradient of the validation loss to predict if one training sample is abnormal. The intuition is that correctly identifying the hidden anomalies could produce a better deep anomaly model with reduced validation loss. Our experiments on public benchmark datasets show that ELITE achieves up to 30% improvement in ROC AUC comparing to the state-of-the-art, yet robust to polluted training data."
kdd,https://dl.acm.org/doi/pdf/10.1145/3447548.3467197,All Models Are Useful: Bayesian Ensembling for Robust High Resolution COVID-19 Forecasting,"Aniruddha Adiga, Lijing Wang, Benjamin Hurt, Akhil Peddireddy, ","Timely, high-resolution forecasts of infectious disease incidence are useful for policy makers in deciding intervention measures and estimating healthcare resource burden. In this paper, we consider the task of forecasting COVID-19 confirmed cases at the county level for the United States. Although multiple methods have been explored for this task, their performance has varied across space and time due to noisy data and the inherent dynamic nature of the pandemic. We present a forecasting pipeline which incorporates probabilistic forecasts from multiple statistical, machine learning and mechanistic methods through a Bayesian ensembling scheme, and has been operational for nearly 6 months serving local, state and federal policymakers in the United States. While showing that the Bayesian ensemble is at least as good as the individual methods, we also show that each individual method contributes significantly for different spatial regions and time points. We compare our model's performance with other similar models being integrated into CDC-initiated COVID-19 Forecast Hub, and show better performance at longer forecast horizons. Finally, we also describe how such forecasts are used to increase lead time for training mechanistic scenario projections. Our work demonstrates that such a real-time high resolution forecasting pipeline can be developed by integrating multiple methods within a performance-based ensemble to support pandemic response."
kdd,https://dl.acm.org/doi/pdf/10.1145/3447548.3467162,Dynamic Language Models for Continuously Evolving Content,"Spurthi Amba Hombaiah, Tao Chen, Mingyang Zhang, Michael Bendersky, ","The content on the web is in a constant state of flux. New entities,issues, and ideas continuously emerge, while the semantics of the existing conversation topics gradually shift. In recent years, pre-trained language models like BERT greatly improved the state-of-the-art for a large spectrum of content understanding tasks.Therefore, in this paper, we aim to study how these language models can be adapted to better handle continuously evolving web content.In our study, we first analyze the evolution of 2013 - 2019 Twitter data, and unequivocally confirm that a BERT model trained on past tweets would heavily deteriorate when directly applied to data from later years. Then, we investigate two possible sources of the deterioration: the semantic shift of existing tokens and the sub-optimal or failed understanding of new tokens. To this end, we both explore two different vocabulary composition methods, as well as propose three sampling methods which help in efficient incremental training for BERT-like models. Compared to a new model trained from scratch offline, our incremental training (a) reduces the training costs, (b) achieves better performance on evolving content, and (c)is suitable for online deployment. The superiority of our methods is validated using two downstream tasks. We demonstrate significant improvements when incrementally evolving the model from a particular base year, on the task of Country Hashtag Prediction, as well as on the OffensEval 2019 task."
kdd,https://dl.acm.org/doi/pdf/10.1145/3447548.3467198,On Training Sample Memorization: Lessons from Benchmarking Generative Modeling with a Large-scale Competition,"Ching-Yuan Bai, Hsuan-Tien Lin, Colin Raffel, Wendy Chi-wen Kan, ","Many recent developments on generative models for natural images have relied on heuristically-motivated metrics that can be easily gamed by memorizing a small sample from the true distribution or training a model directly to improve the metric. In this work, we critically evaluate the gameability of these metrics by designing and deploying a generative modeling competition. Our competition received over 11000 submitted models. The competitiveness between participants allowed us to investigate both intentional and unintentional memorization in generative modeling. To detect intentional memorization, we propose the ""Memorization-Informed Frechet Inception Distance"" (MiFID) as a new memorization-aware metric and design benchmark procedures to ensure that winning submissions made genuine improvements in perceptual quality. Furthermore, we manually inspect the code for the 1000 top-performing models to understand and label different forms of memorization. Our analysis reveals that unintentional memorization is a serious and common issue in popular generative models. The generated images and our memorization labels of those models as well as code to compute MiFID are released to facilitate future studies on benchmarking generative models."
kdd,https://dl.acm.org/doi/pdf/10.1145/3447548.3467166,TimeSHAP: Explaining Recurrent Models through Sequence Perturbations,"João Bento, Pedro Saleiro, André F. Cruz, Mário A.T. Figueiredo, ","Although recurrent neural networks (RNNs) are state-of-the-art in numerous sequential decision-making tasks, there has been little research on explaining their predictions. In this work, we present TimeSHAP, a model-agnostic recurrent explainer that builds upon KernelSHAP and extends it to the sequential domain. TimeSHAP computes feature-, timestep-, and cell-level attributions. As sequences may be arbitrarily long, we further propose a pruning method that is shown to dramatically decrease both its computational cost and the variance of its attributions. We use TimeSHAP to explain the predictions of a real-world bank account takeover fraud detection RNN model, and draw key insights from its explanations: i) the model identifies important features and events aligned with what fraud analysts consider cues for account takeover; ii) positive predicted sequences can be pruned to only 10% of the original length, as older events have residual attribution values; iii) the most recent input event of positive predictions only contributes on average to 41% of the model's score; iv) notably high attribution to client's age, upheld on higher false positive rates for older clients."
kdd,https://dl.acm.org/doi/pdf/10.1145/3447548.3467092,Extreme Multi-label Learning for Semantic Matching in Product Search,"Wei-Cheng Chang, Daniel Jiang, Hsiang-Fu Yu, Choon Hui Teo, ","We consider the problem of semantic matching in product search: given a customer query, retrieve all semantically related products from a huge catalog of size 100 million, or more. Because of large catalog spaces and real-time latency constraints, semantic matching algorithms not only desire high recall but also need to have low latency. Conventional lexical matching approaches (e.g., Okapi-BM25) exploit inverted indices to achieve fast inference time, but fail to capture behavioral signals between queries and products. In contrast, embedding-based models learn semantic representations from customer behavior data, but the performance is often limited by shallow neural encoders due to latency constraints. Semantic product search can be viewed as an eXtreme Multi-label Classification (XMC) problem, where customer queries are input instances and products are output labels. In this paper, we aim to improve semantic product search by using tree-based XMC models where inference time complexity is logarithmic in the number of products. We consider hierarchical linear models with n-gram features for fast real-time inference. Quantitatively, our method maintains a low latency of 1.25 milliseconds per query and achieves a 65% improvement of Recall@100 (60.9% v.s. 36.8%) over a competing embedding-based DSSM model. Our model is robust to weight pruning with varying thresholds, which can flexibly meet different system requirements for online deployments. Qualitatively, our method can retrieve products that are complementary to existing product search system and add diversity to the match set."
kdd,https://dl.acm.org/doi/pdf/10.1145/3447548.3467122,Web-Scale Generic Object Detection at Microsoft Bing,"Stephen Xi Chen, Saurajit Mukherjee, Unmesh Phadke, Tingting Wang, ","In this paper, we present Generic Object Detection (GenOD), one of the largest object detection systems deployed to a web-scale general visual search engine that can detect over 900 categories for all Microsoft Bing Visual Search queries in near real-time. It acts as a fundamental visual query understanding service that provides object-centric information and shows gains in multiple production scenarios, improving upon domain-specific models. We discuss the challenges of collecting data, training, deploying and updating such a large-scale object detection model with multiple dependencies. We discuss a data collection pipeline that reduces per-bounding box labeling cost by 81.5% and latency by 61.2% while improving on annotation quality. We show that GenOD can improve weighted average precision by over 20% compared to multiple domain-specific models. We also improve the model update agility by nearly 2 times with the proposed disjoint detector training compared to joint fine-tuning. Finally we demonstrate how GenOD benefits visual search applications by significantly improving object-level search relevance by 54.9% and user engagement by 59.9%."
kdd,https://dl.acm.org/doi/pdf/10.1145/3447548.3467163,"Improving Protein Function Annotation via Unsupervised Pre-training: Robustness, Efficiency, and Insights","David Dohan, Andreea Gane, Maxwell L. Bileschi, David Belanger, ","Recent work demonstrated a large ensemble of convolutional neural networks (CNNs) outperforms industry-standard approaches at annotating protein sequences that are far from the training data. These results highlight the potential of deep learning to significantly advance protein sequence annotation, but this particular system is not a practical tool for many biologists because of the computational burden of making predictions using a large ensemble. In this work, we fine-tune a transformer model that is pre-trained on millions of unlabeled natural protein sequences in order to reduce the system's compute burden at prediction time and improve accuracy. By switching from a CNN to the pre-trained transformer, we lift performance from 73.6% to 90.5% using a single model on a challenging clustering-based train-test split, where the ensemble of 59 CNNs achieved 89.0%. Through extensive stratified analysis of model performance, we provide evidence that the new model's predictions are trustworthy, even in cases known to be challenging for prior methods. Finally, we provide a case study of the biological insight enabled by this approach."
kdd,https://dl.acm.org/doi/pdf/10.1145/3447548.3467180,Clustering for Private Interest-based Advertising,"Alessandro Epasto, Andrés Muñoz Medina, Steven Avery, ","We study the problem of designing privacy-enhanced solutions for interest-based advertisement (IBA). IBA is a key component of the online ads ecosystem and provides a better ad experience to users. Indeed, IBA enables advertisers to show users impressions that are relevant to them. Nevertheless, the current way ad tech companies achieve this is by building detailed interest profiles for individual users. In this work we ask whether such fine grained personalization is required, and present mechanisms that achieve competitive performance while giving privacy guarantees to the end users. More precisely we present the first detailed exploration of how to implement Chrome's Federated Learning of Cohorts (FLoC) API. We define the privacy properties required for the API and evaluate multiple hashing and clustering algorithms discussing the trade-offs between utility, privacy, and ease of implementation."
kdd,https://dl.acm.org/doi/pdf/10.1145/3447548.3467080,Training Recommender Systems at Scale: Communication-Efficient Model and Data Parallelism,"Vipul Gupta, Dhruv Choudhary, Peter Tang, Xiaohan Wei, Xing Wang, ","In this paper, we consider hybrid parallelism---a paradigm that employs both Data Parallelism (DP) and Model Parallelism (MP)---to scale distributed training of large recommendation models. We propose a compression framework called Dynamic Communication Thresholding (DCT) for communication-efficient hybrid training. DCT filters the entities to be communicated across the network through a simple hard-thresholding function, allowing only the most relevant information to pass through. For communication efficient DP, DCT compresses the parameter gradients sent to the parameter server during model synchronization. The threshold is updated only once every few thousand iterations to reduce the computational overhead of compression. For communication efficient MP, DCT incorporates a novel technique to compress the activations and gradients sent across the network during the forward and backward propagation, respectively. This is done by identifying and updating only the most relevant neurons of the neural network for each training sample in the data. We evaluate DCT on publicly available natural language processing and recommender models and datasets, as well as recommendation systems used in production at Facebook. DCT reduces communication by at least 100x and 20x during DP and MP, respectively. The algorithm has been deployed in production, and it improves end-to-end training time for a state-of-the-art industrial recommender model by 37%, without any loss in performance."
kdd,https://dl.acm.org/doi/pdf/10.1145/3447548.3467124,Budget Allocation as a Multi-Agent System of Contextual & Continuous Bandits,"Benjamin Han, Carl Arndt, ","Budget allocation for online advertising suffers from multiple complications, including significant delay between the initial ad impression to the call to action as well as cold-start prediction problems for ad campaigns with limited or no historical performance data. To address these issues, we introduce the Contextual Budgeting System (CBS ), a budget allocation framework using a multi-agent system of contextual & continuous Multi-Armed Bandits. Our proposed solution decomposes the problem into a convex optimization problem whose objective is drawn using Thompson Sampling. In order to efficiently deal with context and cold-start, we propose a transfer learning mechanism using supervised learning methods that augment simple parametric models."
kdd,https://dl.acm.org/doi/pdf/10.1145/3447548.3467177,Amazon SageMaker Clarify: Machine Learning Bias Detection and Explainability in the Cloud,"Michaela Hardt, Xiaoguang Chen, Xiaoyi Cheng, Michele Donini, ","Understanding the predictions made by machine learning (ML) models and their potential biases remains a challenging and labor-intensive task that depends on the application, the dataset, and the specific model. We present Amazon SageMaker Clarify, an explainability feature for Amazon SageMaker that launched in December 2020, providing insights into data and ML models by identifying biases and explaining predictions. It is deeply integrated into Amazon SageMaker, a fully managed service that enables data scientists and developers to build, train, and deploy ML models at any scale. Clarify supports bias detection and feature importance computation across the ML lifecycle, during data preparation, model evaluation, and post-deployment monitoring. We outline the desiderata derived from customer input, the modular architecture, and the methodology for bias and explanation computations. Further, we describe the technical challenges encountered and the tradeoffs we had to make. For illustration, we discuss two customer use cases. We present our deployment results including qualitative customer feedback and a quantitative evaluation. Finally, we summarize lessons learned, and discuss best practices for the successful adoption of fairness and explanation tools in practice."
