conference,url,title,authors,abstract
kdd,None,Modeling delayed feedback in display advertising,"Olivier Chapelle, ","In performance display advertising a key metric of a campaign effectiveness is its conversion rate -- the proportion of users who take a predefined action on the advertiser website, such as a purchase. Predicting this conversion rate is thus essential for estimating the value of an impression and can be achieved via machine learning. One difficulty however is that the conversions can take place long after the impression -- up to a month -- and this delayed feedback hinders the conversion modeling. We tackle this issue by introducing an additional model that captures the conversion delay. Intuitively, this probabilistic model helps determining whether a user that has not converted should be treated as a negative sample -- when the elapsed time is larger than the predicted delay -- or should be discarded from the training set -- when it is too early to tell. We provide experimental results on real traffic logs that demonstrate the effectiveness of the proposed model."
kdd,None,Networked bandits with disjoint linear payoffs,"Meng Fang, Dacheng Tao, ","In this paper, we study `networked bandits', a new bandit problem where a set of interrelated arms varies over time and, given the contextual information that selects one arm, invokes other correlated arms. This problem remains under-investigated, in spite of its applicability to many practical problems. For instance, in social networks, an arm can obtain payoffs from both the selected user and its relations since they often share the content through the network. We examine whether it is possible to obtain multiple payoffs from several correlated arms based on the relationships. In particular, we formalize the networked bandit problem and propose an algorithm that considers not only the selected arm, but also the relationships between arms. Our algorithm is `optimism in face of uncertainty' style, in that it decides an arm depending on integrated confidence sets constructed from historical data. We analyze the performance in simulation experiments and on two real-world offline datasets. The experimental results demonstrate our algorithm's effectiveness in the networked bandit setting."
kdd,None,Mining topics in documents: standing on the shoulders of big data,"Zhiyuan Chen, Bing Liu, ","Topic modeling has been widely used to mine topics from documents. However, a key weakness of topic modeling is that it needs a large amount of data (e.g., thousands of documents) to provide reliable statistics to generate coherent topics. However, in practice, many document collections do not have so many documents. Given a small number of documents, the classic topic model LDA generates very poor topics. Even with a large volume of data, unsupervised learning of topic models can still produce unsatisfactory results. In recently years, knowledge-based topic models have been proposed, which ask human users to provide some prior domain knowledge to guide the model to produce better topics. Our research takes a radically different approach. We propose to learn as humans do, i.e., retaining the results learned in the past and using them to help future learning. When faced with a new task, we first mine some reliable (prior) knowledge from the past learning/modeling results and then use it to guide the model inference to generate more coherent topics. This approach is possible because of the big data readily available on the Web. The proposed algorithm mines two forms of knowledge: must-link (meaning that two words should be in the same topic) and cannot-link (meaning that two words should not be in the same topic). It also deals with two problems of the automatically mined knowledge, i.e., wrong knowledge and knowledge transitivity. Experimental results using review documents from 100 product domains show that the proposed approach makes dramatic improvements over state-of-the-art baselines."
kdd,None,Integrating spreadsheet data via accurate and low-effort extraction,"Zhe Chen, Michael Cafarella, ","Spreadsheets contain valuable data on many topics. However, spreadsheets are difficult to integrate with other data sources. Converting spreadsheet data to the relational model would allow data analysts to use relational integration tools. We propose a two-phase semiautomatic system that extracts accurate relational metadata while minimizing user effort. Based on an undirected graphical model, our system enables downstream spreadsheet integration applications. First, the automatic extractor uses hints from spreadsheets' graphical style and recovered metadata to extract the spreadsheet data as accurately as possible. Second, the interactive repair identifies similar regions in distinct spreadsheets scattered across large spreadsheet corpora, allowing a user's single manual repair to be amortized over many possible extraction errors. Our experiments show that a human can obtain the accurate extraction with just 31% of the manual operations required by a standard classification based technique on two real-world datasets."
kdd,None,Sentiment expression conditioned by affective transitions and social forces,"Moritz Sudhof, Andr챕s Gom챕z Emilsson, Andrew L. Maas, Christopher Potts, ","Human emotional states are not independent but rather proceed along systematic paths governed by both internal, cognitive factors and external, social ones. For example, anxiety often transitions to disappointment, which is likely to sink to depression before rising to happiness and relaxation, and these states are conditioned by the states of others in our communities. Modeling these complex dependencies can yield insights into human emotion and support more powerful sentiment technologies."
kdd,None,Entity profiling with varying source reliabilities,"Furong Li, Mong Li Lee, Wynne Hsu, ","The rapid growth of information sources on the Web has intensified the problem of data quality. In particular, the same real world entity may be described by different sources in various ways with overlapping information, and possibly conflicting or even erroneous values. In order to obtain a more complete and accurate picture for a real world entity, we need to collate the data records that refer to the entity, as well as correct any erroneous values. We observe that these two tasks are often tightly coupled: rectifying erroneous values will facilitate data collation, while linking similar records provides us with a clearer view of the data and additional evidence for error correction. In this paper, we present a framework called Comet that interleaves record linkage with error correction, taking into consideration the source reliabilities on various attributes. The proposed framework first utilizes confidence based matching to discriminate records in terms of ambiguity and source reliability. Then it performs adaptive matching to reduce the impact of erroneous values. Experiment results demonstrate that Comet outperforms the state-of-the-art techniques and is able to build complete and accurate profiles for real world entities."
kdd,None,Open question answering over curated and extracted knowledge bases,"Anthony Fader, Luke Zettlemoyer, Oren Etzioni, ","We consider the problem of open-domain question answering (Open QA) over massive knowledge bases (KBs). Existing approaches use either manually curated KBs like Freebase or KBs automatically extracted from unstructured text. In this paper, we present OQA, the first approach to leverage both curated and extracted KBs."
kdd,None,Non-parametric scan statistics for event detection and forecasting in heterogeneous social media graphs,"Feng Chen, Daniel B. Neill, ","Event detection in social media is an important but challenging problem. Most existing approaches are based on burst detection, topic modeling, or clustering techniques, which cannot naturally model the implicit heterogeneous network structure in social media. As a result, only limited information, such as terms and geographic locations, can be used. This paper presents Non-Parametric Heterogeneous Graph Scan (NPHGS), a new approach that considers the entire heterogeneous network for event detection: we first model the network as a ""sensor"" network, in which each node senses its ""neighborhood environment"" and reports an empirical p-value measuring its current level of anomalousness for each time interval (e.g., hour or day). Then, we efficiently maximize a nonparametric scan statistic over connected subgraphs to identify the most anomalous network clusters. Finally, the event represented by each cluster is summarized with information such as type of event, geographical locations, time, and participants. As a case study, we consider two applications using Twitter data, civil unrest event detection and rare disease outbreak detection, and present empirical evaluations illustrating the effectiveness and efficiency of our proposed approach."
kdd,None,Event detection in activity networks,"Polina Rozenshtein, Aris Anagnostopoulos, Aristides Gionis, ","With the fast growth of smart devices and social networks, a lot of computing systems collect data that record different types of activities. An important computational challenge is to analyze these data, extract patterns, and understand activity trends. We consider the problem of mining activity networks to identify interesting events, such as a big concert or a demonstration in a city, or a trending keyword in a user community in a social network."
kdd,None,FEMA: flexible evolutionary multi-faceted analysis for dynamic behavioral pattern discovery,"Meng Jiang, Peng Cui, Fei Wang, Xinran Xu, Wenwu Zhu, Shiqiang Yang, ","Behavioral pattern discovery is increasingly being studied to understand human behavior and the discovered patterns can be used in many real world applications such as web search, recommender system and advertisement targeting. Traditional methods usually consider the behaviors as simple user and item connections, or represent them with a static model. In real world, however, human behaviors are actually complex and dynamic: they include correlations between user and multiple types of objects and also continuously evolve along time. These characteristics cause severe data sparsity and computational complexity problem, which pose great challenge to human behavioral analysis and prediction. In this paper, we propose a Flexible Evolutionary Multi-faceted Analysis (FEMA) framework for both behavior prediction and pattern mining. FEMA utilizes a flexible and dynamic factorization scheme for analyzing human behavioral data sequences, which can incorporate various knowledge embedded in different object domains to alleviate the sparsity problem. We give approximation algorithms for efficiency, where the bound of approximation loss is theoretically proved. We extensively evaluate the proposed method in two real datasets. For the prediction of human behaviors, the proposed FEMA significantly outperforms other state-of-the-art baseline methods by 17.4%. Moreover, FEMA is able to discover quite a number of interesting multi-faceted temporal patterns on human behaviors with good interpretability. More importantly, it can reduce the run time from hours to minutes, which is significant for industry to serve real-time applications."
kdd,None,Profit-maximizing cluster hires,"Behzad Golshan, Theodoros Lappas, Evimaria Terzi, ","Team formation has been long recognized as a natural way to acquire a diverse pool of useful skills, by combining experts with complementary talents. This allows organizations to effectively complete beneficial projects from different domains, while also helping individual experts position themselves and succeed in highly competitive job markets. Here, we assume a collection of projects ensuremath{P}, where each project requires a certain set of skills, and yields a different benefit upon completion. We are further presented with a pool of experts ensuremath{X}, where each expert has his own skillset and compensation demands. Then, we study the problem of hiring a cluster of experts T  X, so that the overall compensation (cost) does not exceed a given budget B, and the total benefit of the projects that this team can collectively cover is maximized. We refer to this as the ClusterHire problem. Our work presents a detailed analysis of the computational complexity and hardness of approximation of the problem, as well as heuristic, yet effective, algorithms for solving it in practice. We demonstrate the efficacy of our approaches through experiments on real datasets of experts, and demonstrate their advantage over intuitive baselines. We also explore additional variants of the fundamental problem formulation, in order to account for constraints and considerations that emerge in realistic cluster-hiring scenarios. All variants considered in this paper have immediate applications in the cluster hiring process, as it emerges in the context of different organizational settings."
kdd,None,On social event organization,"Keqian Li, Wei Lu, Smriti Bhagat, Laks V.S. Lakshmanan, Cong Yu, ","Online platforms, such as Meetup and Plancast, have recently become popular for planning gatherings and event organization. However, there is a surprising lack of studies on how to effectively and efficiently organize social events for a large group of people through such platforms. In this paper, we study the key computational problem involved in organization of social events, to our best knowledge, for the first time."
kdd,None,A bayesian framework for estimating properties of network diffusions,"Varun R. Embar, Rama Kumar Pasumarthi, Indrajit Bhattacharya, ","The analysis of network connections, diffusion processes and cascades requires evaluating properties of the diffusion network. Properties of interest often involve variables that are not explicitly observed in real world diffusions. Connection strengths in the network and diffusion paths of infections over the network are examples of such hidden variables. These hidden variables therefore need to be estimated for these properties to be evaluated. In this paper, we propose and study this novel problem in a Bayesian framework by capturing the posterior distribution of these hidden variables given the observed cascades, and computing the expectation of these properties under this posterior distribution. We identify and characterize interesting network diffusion properties whose expectations can be computed exactly and efficiently, either wholly or in part. For properties that are not `nice' in this sense, we propose a Gibbs Sampling framework for Monte Carlo integration. In detailed experiments using various network diffusion properties over multiple synthetic and real datasets, we demonstrate that the proposed approach is significantly more accurate than a frequentist plug-in baseline. We also propose a map-reduce implementation of our framework and demonstrate that this can analyze cascades with millions of infections in minutes."
kdd,None,Scalable diffusion-aware optimization of network topology,"Elias Boutros Khalil, Bistra Dilkina, Le Song, ","How can we optimize the topology of a networked system to bring a flu under control, propel a video to popularity, or stifle a network malware in its infancy? Previous work on information diffusion has focused on modeling the diffusion dynamics and selecting nodes to maximize/minimize influence. Only a paucity of recent studies have attempted to address the network modification problems, where the goal is to either facilitate desirable spreads or curtail undesirable ones by adding or deleting a small subset of network nodes or edges. In this paper, we focus on the widely studied linear threshold diffusion model, and prove, for the first time, that the network modification problems under this model have supermodular objective functions. This surprising property allows us to design efficient data structures and scalable algorithms with provable approximation guarantees, despite the hardness of the problems in question. Both the time and space complexities of our algorithms are linear in the size of the network, which allows us to experiment with millions of nodes and edges. We show that our algorithms outperform an array of heuristics in terms of their effectiveness in controlling diffusion processes, often beating the next best by a significant margin."
kdd,None,Probabilistic latent network visualization: inferring and embedding diffusion networks,"Takeshi Kurashima, Tomoharu Iwata, Noriko Takaya, Hiroshi Sawada, ","The diffusion of information, rumors, and diseases are assumed to be probabilistic processes over some network structure. An event starts at one node of the network, and then spreads to the edges of the network. In most cases, the underlying network structure that generates the diffusion process is unobserved, and we only observe the times at which each node is altered/influenced by the process. This paper proposes a probabilistic model for inferring the diffusion network, which we call Probabilistic Latent Network Visualization (PLNV); it is based on cascade data, a record of observed times of node influence. An important characteristic of our approach is to infer the network by embedding it into a low-dimensional visualization space. We assume that each node in the network has latent coordinates in the visualization space, and diffusion is more likely to occur between nodes that are placed close together. Our model uses maximum a posteriori estimation to learn the latent coordinates of nodes that best explain the observed cascade data. The latent coordinates of nodes in the visualization space can 1) enable the system to suggest network layouts most suitable for browsing, and 2) lead to high accuracy in inferring the underlying network when analyzing the diffusion process of new or rare information, rumors, and disease."
kdd,None,MMRate: inferring multi-aspect diffusion networks with multi-pattern cascades,"Senzhang Wang, Xia Hu, Philip S. Yu, Zhoujun Li, ","Inferring diffusion networks from traces of cascades has been extensively studied to better understand information diffusion in many domains. A widely used assumption in previous work is that the diffusion network is homogenous and diffusion processes of cascades follow the same pattern. However, in social media, users may have various interests and the connections among them are usually multi-faceted. In addition, different cascades normally diffuse at different speeds and spread to diverse scales, and hence show various diffusion patterns. It is challenging for traditional models to capture the heterogeneous user interactions and diverse patterns of cascades in social media. In this paper, we investigate a novel problem of inferring multi-aspect diffusion networks with multi-pattern cascades. In particular, we study the effects of various diffusion patterns on the information diffusion process by analyzing users' retweeting behavior on a microblogging dataset. By incorporating aspect-level user interactions and various diffusion patterns, a new model for inferring Multi-aspect transmission Rates between users using Multi-pattern cascades (MMRate) is proposed. We also provide an Expectation Maximization algorithm to effectively estimate the parameters. Experimental results on both synthetic and microblogging datasets demonstrate the superior performance of our approach over the state-of-the-art methods in inferring multi-aspect diffusion networks."
kdd,None,Stability of influence maximization,"Xinran He, David Kempe, ","The present article serves as an erratum to our paper of the same title, which was presented and published in the KDD 2014 conference. In that article, we claimed falsely that the objective function defined in Section 1.4 is non-monotone submodular. We are deeply indebted to Debmalya Mandal, Jean Pouget-Abadie and Yaron Singer for bringing to our attention a counter-example to that claim."
kdd,None,Who to follow and why: link prediction with explanations,"Nicola Barbieri, Francesco Bonchi, Giuseppe Manco, ","User recommender systems are a key component in any on-line social networking platform: they help the users growing their network faster, thus driving engagement and loyalty."
kdd,None,Activity-edge centric multi-label classification for mining heterogeneous information networks,"Yang Zhou, Ling Liu, ","Multi-label classification of heterogeneous information networks has received renewed attention in social network analysis. In this paper, we present an activity-edge centric multi-label classification framework for analyzing heterogeneous information networks with three unique features. First, we model a heterogeneous information network in terms of a collaboration graph and multiple associated activity graphs. We introduce a novel concept of vertex-edge homophily in terms of both vertex labels and edge labels and transform a general collaboration graph into an activity-based collaboration multigraph by augmenting its edges with class labels from each activity graph through activity-based edge classification. Second, we utilize the label vicinity to capture the pairwise vertex closeness based on the labeling on the activity-based collaboration multigraph. We incorporate both the structure affinity and the label vicinity into a unified classifier to speed up the classification convergence. Third, we design an iterative learning algorithm, AEClass, to dynamically refine the classification result by continuously adjusting the weights on different activity-based edge classification schemes from multiple activity graphs, while constantly learning the contribution of the structure affinity and the label vicinity in the unified classifier. Extensive evaluation on real datasets demonstrates that AEClass outperforms existing representative methods in terms of both effectiveness and efficiency."
kdd,None,Meta-path based multi-network collective link prediction,"Jiawei Zhang, Philip S. Yu, Zhi-Hua Zhou, ","Online social networks offering various services have become ubiquitous in our daily life. Meanwhile, users nowadays are usually involved in multiple online social networks simultaneously to enjoy specific services provided by different networks. Formally, social networks that share some common users are named as partially aligned networks. In this paper, we want to predict the formation of social links in multiple partially aligned social networks at the same time, which is formally defined as the multi-network link (formation) prediction problem. In multiple partially aligned social networks, users can be extensively correlated with each other by various connections. To categorize these diverse connections among users, 7 ""intra-network social meta paths"" and 4 categories of ""inter-network social meta paths"" are proposed in this paper. These ""social meta paths"" can cover a wide variety of connection information in the network, some of which can be helpful for solving the multi-network link prediction problem but some can be not. To utilize useful connection, a subset of the most informative ""social meta paths"" are picked, the process of which is formally defined as ""social meta path selection"" in this paper. An effective general link formation prediction framework, Mli (Multi-network Link Identifier), is proposed in this paper to solve the multi-network link (formation) prediction problem. Built with heterogenous topological features extracted based on the selected ""social meta paths"" in the multiple partially aligned social networks, Mli can help refine and disambiguate the prediction results reciprocally in all aligned networks. Extensive experiments conducted on real-world partially aligned heterogeneous networks, Foursquare and Twitter, demonstrate that Mli can solve the multi-network link prediction problem very well."
kdd,None,Fast influence-based coarsening for large networks,"Manish Purohit, B. Aditya Prakash, Chanhyun Kang, Yao Zhang, ","Given a social network, can we quickly 'zoom-out' of the graph? Is there a smaller equivalent representation of the graph that preserves its propagation characteristics? Can we group nodes together based on their influence properties? These are important problems with applications to influence analysis, epidemiology and viral marketing applications."
