conference,url,title,authors,abstract
kdd,None,Gradient boosted feature selection,"Zhixiang Xu, Gao Huang, Kilian Q. Weinberger, Alice X. Zheng, ","A feature selection algorithm should ideally satisfy four conditions: reliably extract relevant features; be able to identify non-linear feature interactions; scale linearly with the number of features and dimensions; allow the incorporation of known sparsity structure. In this work we propose a novel feature selection algorithm, Gradient Boosted Feature Selection (GBFS), which satisfies all four of these requirements. The algorithm is flexible, scalable, and surprisingly straight-forward to implement as it is based on a modification of Gradient Boosted Trees. We evaluate GBFS on several real world data sets and show that it matches or outperforms other state of the art feature selection algorithms. Yet it scales to larger data set sizes and naturally allows for domain-specific side information."
kdd,None,Simultaneous feature and feature group selection through hard thresholding,"Shuo Xiang, Tao Yang, Jieping Ye, ","Selecting an informative subset of features has important applications in many data mining tasks especially for high-dimensional data. Recently, simultaneous selection of features and feature groups (a.k.a bi-level selection) becomes increasingly popular since it not only reduces the number of features but also unveils the underlying grouping effect in the data, which is a valuable functionality in many applications such as bioinformatics and web data mining. One major challenge of bi-level selection (or even feature selection only) is that computing a globally optimal solution requires a prohibitive computational cost. To overcome such a challenge, current research mainly falls into two categories. The first one focuses on finding suitable continuous computational surrogates for the discrete functions and this leads to various convex and nonconvex optimization models. Although efficient, convex models usually deliver sub-optimal performance while nonconvex models on the other hand require significantly more computational effort. Another direction is to use greedy algorithms to solve the discrete optimization directly. However, existing algorithms are proposed to handle single-level selection only and it remains challenging to extend these methods to handle bi-level selection. In this paper, we fulfill this gap by introducing an efficient sparse group hard thresholding algorithm. Our main contributions are: (1) we propose a novel bi-level selection model and show that the key combinatorial problem admits a globally optimal solution using dynamic programming; (2) we provide an error bound between our solution and the globally optimal under the RIP (Restricted Isometry Property) theoretical framework. Our experiments on synthetic and real data demonstrate that the proposed algorithm produces encouraging performance while keeping comparable computational efficiency to convex relaxation models."
kdd,None,Safe and efficient screening for sparse support vector machine,"Zheng Zhao, Jun Liu, James Cox, ","Sparse support vector machine (SVM) is a robust predictive model that can effectively remove noise and preserve signals. Like Lasso, it can efficiently learn a solution path based on a set of predefined parameters and therefore provides strong support for model selection. Sparse SVM has been successfully applied in a variety of data mining applications including text mining, bioinformatics, and image processing. The emergence of big-data analysis poses new challenges for model selection with large-scale data that consist of tens of millions samples and features. In this paper, a novel screening technique is proposed to accelerate model selection for l1-regularized l2-SVM and effectively improve its scalability. This technique can precisely identify inactive features in the optimal solution of a l1-regularized l2-SVM model and remove them before training. The technique makes use of the variational inequality and provides a closed-form solution for screening inactive features in different situations. Every feature that is removed by the screening technique is guaranteed to be inactive in the optimal solution. Therefore, when l1-regularized l2-SVM uses the features selected by the technique, it achieves exactly the same result as when it uses the full feature set. Because the technique can remove a large number of inactive features, it can greatly increase the efficiency of model selection for l1-regularized l2-SVM. Experimental results on five high-dimensional benchmark data sets demonstrate the power of the proposed technique."
kdd,None,Factorized sparse learning models with interpretable high order feature interactions,"Sanjay Purushotham, Martin Renqiang Min, C.-C. Jay Kuo, ","Identifying interpretable discriminative high-order feature interactions given limited training data in high dimensions is challenging in both machine learning and data mining. In this paper, we propose a factorization based sparse learning framework termed FHIM for identifying high-order feature interactions in linear and logistic regression models, and study several optimization methods for solving them. Unlike previous sparse learning methods, our model FHIM recovers both the main effects and the interaction terms accurately without imposing tree-structured hierarchical constraints. Furthermore, we show that FHIM has oracle properties when extended to generalized linear regression models with pairwise interactions. Experiments on simulated data show that FHIM outperforms the state-of-the-art sparse lear-ning techniques. Further experiments on our experimentally generated data from patient blood samples using a novel SOMAmer (Slow Off-rate Modified Aptamer) technology show that, FHIM performs blood-based cancer diagnosis and bio-marker discovery for Renal Cell Carcinoma much better than other competing methods, and it identifies interpretable block-wise high-order gene interactions predictive of cancer stages of samples. A literature survey shows that the interactions identified by FHIM play important roles in cancer development."
kdd,None,Parallel gibbs sampling for hierarchical dirichlet processes via gamma processes equivalence,"Dehua Cheng, Yan Liu, ","The hierarchical Dirichlet process (HDP) is an intuitive and elegant technique to model data with latent groups. However, it has not been widely used for practical applications due to the high computational costs associated with inference. In this paper, we propose an effective parallel Gibbs sampling algorithm for HDP by exploring its connections with the gamma-gamma-Poisson process. Specifically, we develop a novel framework that combines bootstrap and Reversible Jump MCMC algorithm to enable parallel variable updates. We also provide theoretical convergence analysis based on Gibbs sampling with asynchronous variable updates. Experiment results on both synthetic datasets and two large-scale text collections show that our algorithm can achieve considerable speedup as well as better inference accuracy for HDP compared with existing parallel sampling algorithms."
kdd,None,Empirical glitch explanations,"Tamraparni Dasu, Ji Meng Loh, Divesh Srivastava, ","Data glitches are unusual observations that do not conform to data quality expectations, be they logical, semantic or statistical. By applying data integrity constraints, potentially large sections of data could be flagged as being noncompliant. Ignoring or repairing significant sections of the data could fundamentally bias the results and conclusions drawn from analyses. In the context of Big Data where large numbers and volumes of feeds from disparate sources are integrated, it is likely that significant portions of seemingly noncompliant data are actually legitimate usable data."
kdd,None,Learning with dual heterogeneity: a nonparametric bayes model,"Hongxia Yang, Jingrui He, ","Traditional data mining techniques are designed to model a single type of heterogeneity, such as multi-task learning for modeling task heterogeneity, multi-view learning for modeling view heterogeneity, etc. Recently, a variety of real applications emerged, which exhibit dual heterogeneity, namely both task heterogeneity and view heterogeneity. Examples include insider threat detection across multiple organizations, web image classification in different domains, etc. Existing methods for addressing such problems typically assume that multiple tasks are equally related and multiple views are equally consistent, which limits their application in complex settings with varying task relatedness and view consistency. In this paper, we advance state-of-the-art techniques by adaptively modeling task relatedness and view consistency via a nonparametric Bayes model: we model task relatedness using normal penalty with sparse covariances, and view consistency using matrix Dirichlet process. Based on this model, we propose the NOBLE algorithm using an efficient Gibbs sampler. Experimental results on multiple real data sets demonstrate the effectiveness of the proposed algorithm."
kdd,None,Online chinese restaurant process,"Chien-Liang Liu, Tsung-Hsun Tsai, Chia-Hoang Lee, ","Processing large volumes of streaming data in near-real-time is becoming increasingly important as the Internet, sensor networks and network traffic grow. Online machine learning is a typical means of dealing with streaming data, since it allows the classification model to learn one instance of data at a time. Although many online learning methods have been developed since the development of the Perceptron algorithm, existing online methods assume that the number of classes is available in advance of classification process. However, this assumption is unrealistic for large scale or streaming data sets. This work proposes an online Chinese restaurant process (CRP) algorithm, which is an online and nonparametric algorithm, to tackle this problem. This work proposes a relaxing function as part of the prior and updates the parameters with the likelihood function in terms of the consistency between the true label information and predicted result. This work presents two Gibbs sampling algorithms to perform posterior inference. In the experiments, the online CRP is applied to three massive data sets, and compared with several online learning and batch learning algorithms. One of the data sets is obtained from Wikipedia, which comprises approximately two million documents. The experimental results reveal that the proposed online CRP performs well and efficiently on massive data sets. Finally, this work proposes two methods to update the hyperparameter $\alpha$ of the online CRP. The first method is based on the posterior distribution of $\alpha$, and the second exploits the property of online learning, namely adapting to change, to adjust $\alpha$ dynamically."
kdd,None,Knowledge vault: a web-scale approach to probabilistic knowledge fusion,"Xin Dong, Evgeniy Gabrilovich, Geremy Heitz, Wilko Horn, Ni Lao, ","Recent years have witnessed a proliferation of large-scale knowledge bases, including Wikipedia, Freebase, YAGO, Microsoft's Satori, and Google's Knowledge Graph. To increase the scale even further, we need to explore automatic methods for constructing knowledge bases. Previous approaches have primarily focused on text-based extraction, which can be very noisy. Here we introduce Knowledge Vault, a Web-scale probabilistic knowledge base that combines extractions from Web content (obtained via analysis of text, tabular data, page structure, and human annotations) with prior knowledge derived from existing knowledge repositories. We employ supervised machine learning methods for fusing these distinct information sources. The Knowledge Vault is substantially bigger than any previously published structured knowledge repository, and features a probabilistic inference system that computes calibrated probabilities of fact correctness. We report the results of multiple studies that explore the relative utility of the different information sources and extraction methods."
kdd,None,Improving the modified nystr철m method using spectral shifting,"Shusen Wang, Chao Zhang, Hui Qian, Zhihua Zhang, ","The Nystrom method is an efficient approach to enabling large-scale kernel methods. The Nystrom method generates a fast approximation to any large-scale symmetric positive semidefinete (SPSD) matrix using only a few columns of the SPSD matrix. However, since the Nystrom approximation is low-rank, when the spectrum of the SPSD matrix decays slowly, the Nystrom approximation is of low accuracy. In this paper, we propose a variant of the Nystrom method called the modified Nystrom by spectral shifting (SS-Nystrom). The SS-Nystrom method works well no matter whether the spectrum of SPSD matrix decays fast or slow. We prove that our SS-Nystrom has a much stronger error bound than the standard and modified Nystrom methods, and that SS-Nystrom can be even more accurate than the truncated SVD of the same scale in some cases. We also devise an algorithm such that the SS-Nystrom approximation can be computed nearly as efficient as the modified Nystrom approximation. Finally, our SS-Nystrom method demonstrates significant improvements over the standard and modified Nystrom methods on several real-world datasets."
kdd,None,Fast flux discriminant for large-scale sparse nonlinear classification,"Wenlin Chen, Yixin Chen, Kilian Q. Weinberger, ","In this paper, we propose a novel supervised learning method, Fast Flux Discriminant (FFD), for large-scale nonlinear classification. Compared with other existing methods, FFD has unmatched advantages, as it attains the efficiency and interpretability of linear models as well as the accuracy of nonlinear models. It is also sparse and naturally handles mixed data types. It works by decomposing the kernel density estimation in the entire feature space into selected low-dimensional subspaces. Since there are many possible subspaces, we propose a submodular optimization framework for subspace selection. The selected subspace predictions are then transformed to new features on which a linear model can be learned. Besides, since the transformed features naturally expect non-negative weights, we only require smooth optimization even with the L1 regularization. Unlike other nonlinear models such as kernel methods, the FFD model is interpretable as it gives importance weights on the original features. Its training and testing are also much faster than traditional kernel models. We carry out extensive empirical studies on real-world datasets and show that the proposed model achieves state-of-the-art classification results with sparsity, interpretability, and exceptional scalability. Our model can be learned in minutes on datasets with millions of samples, for which most existing nonlinear methods will be prohibitively expensive in space and time."
kdd,None,Scalable histograms on large probabilistic data,"Mingwang Tang, Feifei Li, ","Histogram construction is a fundamental problem in data management, and a good histogram supports numerous mining operations. Recent work has extended histograms to probabilistic data. However, constructing histograms for probabilistic data can be extremely expensive, and existing studies suffer from limited scalability. This work designs novel approximation methods to construct scalable histograms on probabilistic data. We show that our methods provide constant approximations compared to the optimal histograms produced by the state-of-the-art in the worst case. We also extend our methods to parallel and distributed settings so that they can run gracefully in a cluster of commodity machines. We introduced novel synopses to reduce communication cost when running our methods in such settings. Extensive experiments on large real data sets have demonstrated the superb scalability and efficiency achieved by our methods, when compared to the state-of-the-art methods. They also achieved excellent approximation quality in practice."
kdd,None,Correlation clustering in MapReduce,"Flavio Chierichetti, Nilesh Dalvi, Ravi Kumar, ","Correlation clustering is a basic primitive in data miner's toolkit with applications ranging from entity matching to social network analysis. The goal in correlation clustering is, given a graph with signed edges, partition the nodes into clusters to minimize the number of disagreements. In this paper we obtain a new algorithm for correlation clustering. Our algorithm is easily implementable in computational models such as MapReduce and streaming, and runs in a small number of rounds. In addition, we show that our algorithm obtains an almost 3-approximation to the optimal correlation clustering. Experiments on huge graphs demonstrate the scalability of our algorithm and its applicability to data mining problems."
kdd,None,Scaling out big data missing value imputations: pythia vs. godzilla,"Christos Anagnostopoulos, Peter Triantafillou, ","Solving the missing-value (MV) problem with small estimation errors in big data environments is a notoriously resource-demanding task. As datasets and their user community continuously grow, the problem can only be exacerbated. Assume that it is possible to have a single machine (`Godzilla'), which can store the massive dataset and support an ever-growing community submitting MV imputation requests. Is it possible to replace Godzilla by employing a large number of cohort machines so that imputations can be performed much faster, engaging cohorts in parallel, each of which accesses much smaller partitions of the original dataset? If so, it would be preferable for obvious performance reasons to access only a subset of all cohorts per imputation. In this case, can we decide swiftly which is the desired subset of cohorts to engage per imputation? But efficiency and scalability is just one key concern! Is it possible to do the above while ensuring comparable or even better than Godzilla's imputation estimation errors? In this paper we derive answers to these fundamentals questions and develop principled methods and a framework which offer large performance speed-ups and better, or comparable, errors to that of Godzilla, independently of which missing-value imputation algorithm is used. Our contributions involve Pythia, a framework and algorithms for providing the answers to the above questions and for engaging the appropriate subset of cohorts per MV imputation request. Pythia functionality rests on two pillars: (i) dataset (partition) signatures, one per cohort, and (ii) similarity notions and algorithms, which can identify the appropriate subset of cohorts to engage. Comprehensive experimentation with real and synthetic datasets showcase our efficiency, scalability, and accuracy claims."
kdd,None,Efficient mini-batch training for stochastic optimization,"Mu Li, Tong Zhang, Yuqiang Chen, Alexander J. Smola, ","Stochastic gradient descent (SGD) is a popular technique for large-scale optimization problems in machine learning. In order to parallelize SGD, minibatch training needs to be employed to reduce the communication cost. However, an increase in minibatch size typically decreases the rate of convergence. This paper introduces a technique based on approximate optimization of a conservatively regularized objective function within each minibatch. We prove that the convergence rate does not decrease with increasing minibatch size. Experiments demonstrate that with suitable implementations of approximate optimization, the resulting algorithm can outperform standard SGD in many scenarios."
kdd,None,Streaming submodular maximization: massive data summarization on the fly,"Ashwinkumar Badanidiyuru, Baharan Mirzasoleiman, Amin Karbasi, ","How can one summarize a massive data set ""on the fly"", i.e., without even having seen it in its entirety? In this paper, we address the problem of extracting representative elements from a large stream of data. I.e., we would like to select a subset of say k data points from the stream that are most representative according to some objective function. Many natural notions of ""representativeness"" satisfy submodularity, an intuitive notion of diminishing returns. Thus, such problems can be reduced to maximizing a submodular set function subject to a cardinality constraint. Classical approaches to submodular maximization require full access to the data set. We develop the first efficient streaming algorithm with constant factor 1/2-琯 approximation guarantee to the optimum solution, requiring only a single pass through the data, and memory independent of data size. In our experiments, we extensively evaluate the effectiveness of our approach on several applications, including training large-scale kernel methods and exemplar-based clustering, on millions of data points. We observe that our streaming method, while achieving practically the same utility value, runs about 100 times faster than previous work."
kdd,None,Distance queries from sampled data: accurate and efficient,"Edith Cohen, ","Distance queries are a basic tool in data analysis. They are used for detection and localization of change for the purpose of anomaly detection, monitoring, or planning. Distance queries are particularly useful when data sets such as measurements, snapshots of a system, content, traffic matrices, and activity logs are collected repeatedly. Random sampling, which can be efficiently performed over streamed or distributed data, is an important tool for scalable data analysis. The sample constitutes an extremely flexible summary, which naturally supports domain queries and scalable estimation of statistics, which can be specified after the sample is generated. The effectiveness of a sample as a summary, however, hinges on the estimators we have."
kdd,None,Improved testing of low rank matrices,"Yi Li, Zhengyu Wang, David P. Woodruff, ","We study the problem of determining if an input matrix A 琯Rm x n can be well-approximated by a low rank matrix. Specifically, we study the problem of quickly estimating the rank or stable rank of A, the latter often providing a more robust measure of the rank. Since we seek significantly sublinear time algorithms, we cast these problems in the property testing framework. In this framework, A either has low rank or stable rank, or is far from having this property. The algorithm should read only a small number of entries or rows of A and decide which case A is in with high probability. If neither case occurs, the output is allowed to be arbitrary. We consider two notions of being far: (1) A requires changing at least an 琯-fraction of its entries, or (2) A requires changing at least an 琯-fraction of its rows. We call the former the ""entry model"" and the latter the ""row model"". We show:"
kdd,None,DeepWalk: online learning of social representations,"Bryan Perozzi, Rami Al-Rfou, Steven Skiena, ","We present DeepWalk, a novel approach for learning latent representations of vertices in a network. These latent representations encode social relations in a continuous vector space, which is easily exploited by statistical models. DeepWalk generalizes recent advancements in language modeling and unsupervised feature learning (or deep learning) from sequences of words to graphs."
kdd,None,"Open-domain quantity queries on web tables: annotation, response, and consensus models","Sunita Sarawagi, Soumen Chakrabarti, ","Over 40% of columns in hundreds of millions of Web tables contain numeric quantities. Tables are a richer source of structured knowledge than free text. We harness Web tables to answer queries whose target is a quantity with natural variation, such as net worth of zuckerburg, battery life of ipad, half life of plutonium, and calories in pizza. Our goal is to respond to such queries with a ranked list of quantity distributions, suitably represented. Apart from the challenges of informal schema and noisy extractions, which have been known since tables were used for non-quantity information extraction, we face additional problems of noisy number formats, as well as unit specifications that are often contextual and ambiguous."
kdd,None,Crowdsourced time-sync video tagging using temporal and personalized topic modeling,"Bin Wu, Erheng Zhong, Ben Tan, Andrew Horner, Qiang Yang, ","Time-sync video tagging aims to automatically generate tags for each video shot. It can improve the user's experience in previewing a video's timeline structure compared to traditional schemes that tag an entire video clip. In this paper, we propose a new application which extracts time-sync video tags by automatically exploiting crowdsourced comments from video websites such as Nico Nico Douga, where videos are commented on by online crowd users in a time-sync manner. The challenge of the proposed application is that users with bias interact with one another frequently and bring noise into the data, while the comments are too sparse to compensate for the noise. Previous techniques are unable to handle this task well as they consider video semantics independently, which may overfit the sparse comments in each shot and thus fail to provide accurate modeling. To resolve these issues, we propose a novel temporal and personalized topic model that jointly considers temporal dependencies between video semantics, users' interaction in commenting, and users' preferences as prior knowledge. Our proposed model shares knowledge across video shots via users to enrich the short comments, and peels off user interaction and user bias to solve the noisy-comment problem. Log-likelihood analyses and user studies on large datasets show that the proposed model outperforms several state-of-the-art baselines in video tagging quality. Case studies also demonstrate our model's capability of extracting tags from the crowdsourced short and noisy comments."
