conference,url,title,authors,abstract
kdd,None,What's Fair?,"Cynthia Dwork, ","Data, algorithms, and systems have biases embedded within them reflecting designers' explicit and implicit choices, historical biases, and societal priorities. They form, literally and inexorably, a codification of values. ""Unfairness"" of algorithms -- for tasks ranging from advertising to recidivism prediction -- has attracted considerable attention in the popular press. The talk will discuss the nascent mathematically rigorous study of fairness in classification and scoring."
kdd,None,The Future of Data Integration,"Renée J. Miller, ","The value of data explodes when it is integrated. In this talk, I present some important innovations in data integration over the last two decades. These include data exchange [1], which provides a foundation for reasoning about the correctness of transformed data, and the use of declarative mappings in integration [2]. I discuss how data mining has been used to facilitate data integration, including constraint discovery [3], mapping discovery [4], and in schema discovery to combat database decay and facilitate integration [5,6]. I present some important new data integration challenges that arise in data science. These include the use of mining for query and visualization recommendation over massive data lakes [7] and data set search, finding datasets of interest at interactive speeds [8]."
kdd,None,"Three Principles of Data Science: Predictability, Stability and Computability","Bin Yu, ","In this talk, I'd like to discuss the intertwining importance and connections of three principles of data science in the title in data-driven decisions."
kdd,None,Foreword to the Applied Data Science: Invited Talks Track at KDD-2017,"Usama M. Fayyad, Evangelos Simoudis, Ashok Srivastava, ","The Applied Data Science (ADS) Invited Talks Track at KDD-2017 is a continuation of what has now become a ""7-year tradition"" at KDD conferences. This is the second year the track operates under the ADS name, an evolution from its origins at KDD-2011 as the ""Industry Practice Expo"". The KDD Conference on Knowledge Discovery and Data Mining (KDD) is the world's first, largest and best conference on Data Science, Data Mining, and Knowledge Discovery. It brings together a healthy mix of academic researchers, industry and government researchers, and practitioners from a wide range of institutions and fields. The primary focus on KDD is on peer-reviewed research contributions and the academic advancement of the field. This is an important goal and in fact the KDD conference is now recognized as the most competitive and prestigious forum for presenting high quality research results. KDD, being fundamentally an applied field, needs the strong representation of applied work of big impact. Over the years of running the conference we observed that our initial speaker-selection approach needed to be re-thought because of the important contributions made to the field outside traditional academic, industrial and government research laboratories. The result of this re-thinking was to create a forum that exposes important contributions to Data Science through Big Data Applications that address strategic problems. We wanted to effectively capture the rising importance of Data Science and Machine Learning especially in the Big Data environment where structured and unstructured data create special challenges, and of course present new opportunities. The goal of the Invited Talks Track is to curate contributions from leaders in our field who have made important contributions through the development of a system, the creation of a new and important business, or the development and market introduction of a product,. Some of these important contributions may never see an academic paper or detailed peer-reviewed paper written about them, yet they are of critical importance to our very applied field. To give you an idea of how rapidly growing this area is, and how this sector of our industry and promises to be highly disruptive across many industries, we cite a couple of articles out of a plethora of such coverage: According to IDC, the global revenues from Big Data and business will grow from $130.1 billion in 2016 to more than $203 billion in 2020, at a compound annual growth rate (CAGR) of 11.7% [1]. Furthermore, to quote from a Forbes article: ""Data monetization"" will become a major source of revenues, as the world will create 180 zettabytes of data (or 180 trillion gigabytes) in 2025, up from less than 10 zettabytes in 2015.? [2]"
kdd,None,More than the Sum of its Parts: Building Domino Data Lab,"Eduardo Ariño de la Rubia, ","Industry has always leveraged cutting edge quantitative research techniques. From finance and insurance, to marketing and manufacturing, efficiencies and advantages have been seized through measurement, prediction, and the generation of insights' but never at this scale. Organizations which previously may have employed one or two data scientists are now scaling the work to dozens if not hundreds of practitioners. Where previously only a handful of organizations could boast that they were leveraging machine learning and statistical models, now it's a rarity to find an untouched industry or player. Organizations are now faced with the challenges of empowering, scaling, and measuring this workforce to sustain the transformation to the prediction economy. In this talk, I will discuss how and why we built the Domino Data Lab platform. I will talk about the challenges we faced technologically, organizationally and culturally when bringing a system of record to data science."
kdd,None,Mining Big Data in NeuroGenetics to Understand Muscular Dystrophy,"Andy Berglund, ","The recent advances in genome sequencing and analyses of the billions of base pairs in genomic data have been a boon for moving forward our understanding of human disease. In this talk I will describe how genome sequencing has dramatically improved our understanding of the most common adult form of muscular dystrophy, which is myotonic dystrophy. Two different genetic mutations cause thousands of changes in the cells and tissues of myotonic dystrophy patients. Genome sequencing has allowed us to precisely determine the degree of changes across patients, correlate these changes to disease symptoms and allow us to determine quickly in cell and animal models the effectiveness of therapeutic strategies for myotonic dystrophy."
kdd,None,Industrial Machine Learning,"Josh Bloom, ","The ongoing digitization of the industrial-scale machines that power and enable human activity is itself a major global transformation. But the real revolution-in efficiencies, in improved and saved lives-will happen as machine learning automation and insights are properly coupled to the complex systems of industrial data. Leveraging a systems view of real-world use cases from aviation to transportation, I contrast the needs and approaches of consumer versus industrial machine learning. Particularly, I focus on three key areas: combining physics-based models to data-driven models, differential privacy and secure ML (including edge-to-cloud strategies), and interpretability of model predictions."
kdd,None,Behavior Informatics to Discover Behavior Insight for Active and Tailored Client Management,"Longbing Cao, ","Behavior is ubiquitous, and behavior intelligence and insight play an important role in data understanding and business problem-solving. Behavior Informatics [1,2] emerges as an important tool for discovering behavior intelligence and behavior insight. As a computational concept, behavior captures the aspects of the demographics of behavioral subjects and objects; social relationships or norms governing the interactions between behaviors of an individual or a group; behavior sequences or networks and their dynamics; and the impact or effect generated by the behaviors undertaken by subjects on objects. Accordingly, a behavior model [2] captures the subject and the object of a behavior or behavior sequence, the activities conducted by its subject on objects, and the relationships between activities; behavior subject, object, activities and relationships are characterized by their respective attributes. As a result, a behavior is represented as a behavior attributes-based vector; and a subject's behaviors at a time period form a vector-based sequence, namely, represented as a behavior attribute vector-based matrix [3]. With such behavior modeling and from the informatics perspective, behavior informatics takes a top-down approach to systematically and deeply represent, model, reason about, and aggregate behaviors [4]; and a bottom-up approach to analyze and learn behavior occurrences, non-occurrences, dynamics, impact, and utility [2]."
kdd,None,It Takes More than Math and Engineering to Hit the Bullseye with Data,"Paritosh Desai, ","Adopting algorithmic decision-making in a large and complex enterprise such as a Fortune 50 retailer like Target takes much more than clean, reliable data and great data mining capabilities. Yet data practitioners too often start with advanced math and fancy algorithms, rather than working hand-in-hand with business partners to identify and understand the biggest business problems. (Then teams should move onto how algorithms can be applied to those problems.) Another key step for data scientists at large organizations: ensuring that their business partners -- the merchants, marketers and supply chain experts -- have a base-line understanding of advanced models as well as the proper analytical support tools. Obtaining widespread buy-in and enthusiasm also requires providing a user-friendly interface for business partners with optionality and flexibility that allows the intelligence to be applied to the many varied issues facing a modern retailer, from personalization to supply chain transformation to decisions on assortment and pricing. This talk will explore effective practices and processes -- the do's and don'ts -- for data scientists to succeed in large, complex organizations like a retailer with 1,800+ stores, major marketing campaigns across multiple channels and a fast growing online business."
kdd,None,Planning and Learning under Uncertainty: Theory and Practice,"Jonathan P. How, ","This talk will describe recent progress on modeling, planning, learning, and control of autonomous systems operating in dynamic environments, with an emphasis on addressing the challenges faced on various timescales. For example, autonomous robotic agents need to plan/execute safe paths and avoid imminent collisions given noisy sensory information (short timescale), learn how to interact with other agents (possibly humans) with intents that are not known (medium timescale), and perform complex cooperative tasks given imperfect models and knowledge of the environment and teammate actions (long timescale). These tasks are often constrained to be done using onboard computation and perception, which can add significant complexity to the system. The talk will highlight several recently developed solutions to these challenges that have been implemented to demonstrate high-speed agile flight of a quadrotor in unknown, cluttered environments, autonomous navigation of a ground vehicle in complex indoor environments alongside pedestrians, and real-time cooperative multiagent planning with an onboard deep learning-based perception system."
kdd,None,Big Data in Climate: Opportunities and Challenges for Machine Learning,"Anuj Karpatne, Vipin Kumar, ","The climate and Earth sciences have recently undergone a rapid transformation from a data-poor to a data-rich environment. In particular, massive amount of data about Earth and its environment is now continuously being generated by a large number of Earth observing satellites as well as physics-based earth system models running on large-scale computational platforms. These massive and information-rich datasets offer huge potential for understanding how the Earth's climate and ecosystem have been changing and how they are being impacted by humans actions. We discuss the challenges involved in analyzing these massive data sets as well as opportunities they present for both advancing machine learning as well as the science of climate change."
kdd,None,Addressing Challenges with Big Data for Media Measurement,"Mainak Mazumdar, ","The digital media and TV - which is increasingly digitized, have amassed and generating enormous amount of data. While extremely useful, the big data generated by these platforms poses unique challenges for Data Scientists working on developing measurement framework and metrics. Most practitioners optimize speed and scale at the expense of accuracy, which is critical for any measurement. And, the trade-off between bias and variance is not in consideration. In this paper, we will demonstrate how Nielsen is combining proprietary ground truth data and methodologies with Big Data to address the accuracy and bias/variance challenges. We argue that high quality ground truth or training set is pre-requisite to deploying Big Data for high quality media measurement. To illustrate the point, we will share how Nielsen is combining its proprietary high quality panels with Set Top Box for TV measurement in the U.S."
kdd,None,Machine Learning Software in Practice: Quo Vadis?,"Szilárd Pafka, ","Due to the hype in our industry in the last couple of years, there is a growing mismatch between software tools machine learning practitioners wish for, what they would truly need for their work, what's available (either commercially or open source) and what tool developers and researchers focus on. In this talk we will give a couple of examples of this mismatch. Several surveys and anecdotal evidence show that most practitioners work most of the time (at least in the modeling phase) with datasets that t in the RAM of a single server, therefore distributed computing tools are very of- ten overkill. Our benchmarks (available on github [1]) of the most widely used open source tools for binary classification (various implementations of algorithms such as linear methods, random forests, gradient boosted trees and neural networks) on such data show over 10x speed and over 10x RAM usage difference between various tools, with ""big data"" tools being the most inefficient. Significant performance gains have been obtained by those tools that incorporate various low-level (close to CPU and memory architecture) optimizations. Nevertheless, we will show that even the best tools show degrading performance on the multi-socket servers featuring a high number of cores, systems that have become widely accessible more recently. Finally, while most of this talk is about performance, we will also argue that machine learning tools that feature high-level easy-to-use APIs provide increasing productivity for practitioners and therefore are preferable."
kdd,None,Designing AI at Scale to Power Everyday Life,"Rajesh Parekh, ","The majority of the experiences and interactions people have on Facebook today are made possible with AI. Well over 1 billion people enjoy unique, personalized experiences on Facebook that are powered by a wealth of AI and machine learning algorithms. AI is an incredibly fast-moving field: engineers and researchers across the company are turning the latest research breakthroughs into tools, platforms, and infrastructure that make it possible for anyone at Facebook to use AI in the experiences and products they build. This talk will look at how Facebook is conducting and applying industry-leading research to help drive advancements in AI disciplines like computer vision, language understanding, speech and video. We will also talk about building an infrastructure that anyone at Facebook can use to easily reuse algorithms in different products, scale to run thousands of simultaneous custom experiments, and give concrete examples of how employees across the company are able to leverage these platforms to build new AI products and services."
kdd,None,Spaceborne Data Enters the Mainstream,"David Potere, ","Thanks to a diverse constellation of Earth observing satellites, humanity is effectively looking everywhere, at everything, all the time. And we've been quietly doing so for a long time. The challenge is that for many years these massive data archives have been stranded from operational, cloud-based, modern data science. That is changing fast. In this session we'll do a rapid primer on satellite imagery as a source of novel data about our Earth and discuss how machine learning is a key force for translating all of this Earth data into real insights. We'll use the global agriculture system as a case in point, highlighting some of potential that a spaceborne perspective brings to this vital sector of the economy. Along the way, we will explore some of the beautiful imagery of our home planet that fuels this new class of insights."
kdd,None,Benchmarks and Process Management in Data Science: Will We Ever Get Over the Mess?,"Usama M. Fayyad, Arno Candel, Eduardo Ariño de la Rubia, Szilárd Pafka, ","This panel aims to address areas that are widely acknowledged to be of critical importance to the success of Data Science projects and to the healthy growth of KDD/Data Science as a field of scientific research. However, despite this acknowledgement of their criticality, these areas receive insufficient attention in the major conferences in the field. Furthermore, there is a lack of actual actions and tools to address these areas in actual practice. These areas are summarized as follows:"
kdd,None,The Future of Artificially Intelligent Assistants,"Muthu Muthukrishnan, Andrew Tomkins, Larry Heck, ","Artificial Intelligence has been present in literature at least since the ancient Greeks. Depictions present a wide range of perspectives of AI ranging from malefic overlords to depressive androids. Perhaps the most common recurring theme is the AI Assistant: C3PO from Star Wars; the Jetson's Rosie the Robot; the benign hyper-efficient Minds of Iain M. Banks's Culture novels; the eerie HAL 9000 of Arthur C. Clarke's 2001: A Space Odyssey. Today, artificially intelligent assistants are actual products in the marketplace, based on startling recent progress in technologies like speaker-independent speech recognition. These products are in their infancy, but are improving rapidly. In this panel, we will address the product and technology landscape, and will ask a series of experts in the field plus the members of the audience to take a stance on what the future of artificially intelligent assistants will look like."
kdd,None,Learning Certifiably Optimal Rule Lists,"Elaine Angelino, Nicholas Larus-Stone, Daniel Alabi, Margo Seltzer, Cynthia Rudin, ","We present the design and implementation of a custom discrete optimization technique for building rule lists over a categorical feature space. Our algorithm provides the optimal solution, with a certificate of optimality. By leveraging algorithmic bounds, efficient data structures, and computational reuse, we achieve several orders of magnitude speedup in time and a massive reduction of memory consumption. We demonstrate that our approach produces optimal rule lists on practical problems in seconds. This framework is a novel alternative to CART and other decision tree methods."
kdd,None,Improved Degree Bounds and Full Spectrum Power Laws in Preferential Attachment Networks,"Chen Avin, Zvi Lotker, Yinon Nahum, David Peleg, ","Consider a random preferential attachment model G(p) for network evolution that allows both node and edge arrivals. Starting with an arbitrary nonempty graph G0, at each time step, there are two possible events: with probability p > 0 a new node arrives and a new edge is added between the new node and an existing node, and with probability 1 - p a new edge is added between two existing nodes. In both cases, the involved existing nodes are chosen at random according to preferential attachment, i.e., with probability proportional to their degree. G(p) is known to generate power law networks, i.e., the fraction of nodes with degree k is proportional to k-β. Here β=(4-p)/(2-p) is in the range (2,3]."
kdd,None,Unsupervised Network Discovery for Brain Imaging Data,"Zilong Bai, Peter Walker, Anna Tschiffely, Fei Wang, Ian Davidson, ","A common problem with spatiotemporal data is how to simplify the data to discover an underlying network that consists of cohesive spatial regions (nodes) and relationships between those regions (edges). This network discovery problem naturally exists in a multitude of domains including climate data (dipoles), astronomical data (gravitational lensing) and the focus of this paper, fMRI scans of human subjects. Whereas previous work requires strong supervision, we propose an unsupervised matrix tri-factorization formulation with complex constraints and spatial regularization. We show that this formulation works well in controlled experiments with synthetic networks and is able to recover the underlying ground-truth network. We then show that for real fMRI data our approach can reproduce well known results in neurology regarding the default mode network in resting-state healthy and Alzheimer affected individuals."
kdd,None,Patient Subtyping via Time-Aware LSTM Networks,"Inci M. Baytas, Cao Xiao, Xi Zhang, Fei Wang, Anil K. Jain, Jiayu Zhou, ","In the study of various diseases, heterogeneity among patients usually leads to different progression patterns and may require different types of therapeutic intervention. Therefore, it is important to study patient subtyping, which is grouping of patients into disease characterizing subtypes. Subtyping from complex patient data is challenging because of the information heterogeneity and temporal dynamics. Long-Short Term Memory (LSTM) has been successfully used in many domains for processing sequential data, and recently applied for analyzing longitudinal patient records. The LSTM units are designed to handle data with constant elapsed times between consecutive elements of a sequence. Given that time lapse between successive elements in patient records can vary from days to months, the design of traditional LSTM may lead to suboptimal performance. In this paper, we propose a novel LSTM unit called Time-Aware LSTM (T-LSTM) to handle irregular time intervals in longitudinal patient records. We learn a subspace decomposition of the cell memory which enables time decay to discount the memory content according to the elapsed time. We propose a patient subtyping model that leverages the proposed T-LSTM in an auto-encoder to learn a powerful single representation for sequential records of patients, which are then used to cluster patients into clinical subtypes. Experiments on synthetic and real world datasets show that the proposed T-LSTM architecture captures the underlying structures in the sequences with time irregularities."
kdd,None,Robust Top-k Multiclass SVM for Visual Category Recognition,"Xiaojun Chang, Yao-Liang Yu, Yi Yang, ","Classification problems with a large number of classes inevitably involve overlapping or similar classes. In such cases it seems reasonable to allow the learning algorithm to make mistakes on similar classes, as long as the true class is still among the top-k (say) predictions. Likewise, in applications such as search engine or ad display, we are allowed to present k predictions at a time and the customer would be satisfied as long as her interested prediction is included. Inspired by the recent work of [15], we propose a very generic, robust multiclass SVM formulation that directly aims at minimizing a weighted and truncated combination of the ordered prediction scores. Our method includes many previous works as special cases. Computationally, using the Jordan decomposition Lemma we show how to rewrite our objective as the difference of two convex functions, based on which we develop an efficient algorithm that allows incorporating many popular regularizers (such as the l2 and l1 norms). We conduct extensive experiments on four real large-scale visual category recognition datasets, and obtain very promising performances."
kdd,None,KATE: K-Competitive Autoencoder for Text,"Yu Chen, Mohammed J. Zaki, ","Autoencoders have been successful in learning meaningful representations from image datasets. However, their performance on text datasets has not been widely studied. Traditional autoencoders tend to learn possibly trivial representations of text documents due to their confoundin properties such as high-dimensionality, sparsity and power-law word distributions. In this paper, we propose a novel k-competitive autoencoder, called KATE, for text documents. Due to the competition between the neurons in the hidden layer, each neuron becomes specialized in recognizing specific data patterns, and overall the model can learn meaningful representations of textual data. A comprehensive set of experiments show that KATE can learn better representations than traditional autoencoders including denoising, contractive, variational, and k-sparse autoencoders. Our model also outperforms deep generative models, probabilistic topic models, and even word representation models (e.g., Word2Vec) in terms of several downstream tasks such as document classification, regression, and retrieval."
