conference,url,title,authors,abstract
kdd,None,GELL: Automatic Extraction of Epidemiological Line Lists from Open Sources,"Saurav Ghosh, Prithwish Chakraborty, Bryan L. Lewis, Maimuna S. Majumder, ","Real-time monitoring and responses to emerging public health threats rely on the availability of timely surveillance data. During the early stages of an epidemic, the ready availability of line lists with detailed tabular information about laboratory-confirmed cases can assist epidemiologists in making reliable inferences and forecasts. Such inferences are crucial to understand the epidemiology of a specific disease early enough to stop or control the outbreak. However, construction of such line lists requires considerable human supervision and therefore, difficult to generate in real-time. In this paper, we motivate Guided Epidemiological Line List (GELL), the first tool for building automated line lists (in near real-time) from open source reports of emerging disease outbreaks. Specifically, we focus on deriving epidemiological characteristics of an emerging disease and the affected population from reports of illness. GELL uses distributed vector representations (ala word2vec) to discover a set of indicators for each line list feature. This discovery of indicators is followed by the use of dependency parsing based techniques for final extraction in tabular form. We evaluate the performance of GELL against a human annotated line list provided by HealthMap corresponding to MERS outbreaks in Saudi Arabia. We demonstrate that GELL extracts line list features with increased accuracy compared to a baseline method. We further show how these automatically extracted line list features can be used for making epidemiological inferences, such as inferring demographics and symptoms-to-hospitalization period of affected individuals."
kdd,None,Google Vizier: A Service for Black-Box Optimization,"Daniel Golovin, Benjamin Solnik, Subhodeep Moitra, Greg Kochanski, ","Any sufficiently complex system acts as a black box when it becomes easier to experiment with than to understand. Hence, black-box optimization has become increasingly important as systems have become more complex. In this paper we describe Google Vizier, a Google-internal service for performing black-box optimization that has become the de facto parameter tuning engine at Google. Google Vizier is used to optimize many of our machine learning models and other systems, and also provides core capabilities to Google's Cloud Machine Learning HyperTune subsystem. We discuss our requirements, infrastructure design, underlying algorithms, and advanced features such as transfer learning and automated early stopping that the service provides."
kdd,None,Predicting Clinical Outcomes Across Changing Electronic Health Record Systems,"Jen J. Gong, Tristan Naumann, Peter Szolovits, John V. Guttag, ","Existing machine learning methods typically assume consistency in how semantically equivalent information is encoded. However, the way information is recorded in databases differs across institutions and over time, often rendering potentially useful data obsolescent. To address this problem, we map database-specific representations of information to a shared set of semantic concepts, thus allowing models to be built from or transition across different databases. We demonstrate our method on machine learning models developed in a healthcare setting. In particular, we evaluate our method using two different intensive care unit (ICU) databases and on two clinically relevant tasks, in-hospital mortality and prolonged length of stay. For both outcomes, a feature representation mapping EHR-specific events to a shared set of clinical concepts yields better results than using EHR-specific events alone."
kdd,None,HinDroid: An Intelligent Android Malware Detection System Based on Structured Heterogeneous Information Network,"Shifu Hou, Yanfang Ye, Yangqiu Song, Melih Abdulhayoglu, ","With explosive growth of Android malware and due to the severity of its damages to smart phone users, the detection of Android malware has become increasingly important in cybersecurity. The increasing sophistication of Android malware calls for new defensive techniques that are capable against novel threats and harder to evade. In this paper, to detect Android malware, instead of using Application Programming Interface (API) calls only, we further analyze the different relationships between them and create higher-level semantics which require more effort for attackers to evade the detection. We represent the Android applications (apps), related APIs, and their rich relationships as a structured heterogeneous information network (HIN). Then we use a meta-path based approach to characterize the semantic relatedness of apps and APIs. We use each meta-path to formulate a similarity measure over Android apps, and aggregate different similarities using multi-kernel learning. Then each meta-path is automatically weighted by the learning algorithm to make predictions. To the best of our knowledge, this is the first work to use structured HIN for Android malware detection. Comprehensive experiments on real sample collections from Comodo Cloud Security Center are conducted to compare various malware detection approaches. Promising experimental results demonstrate that our developed system HinDroid outperforms other alternative Android malware detection techniques."
kdd,None,"Peeking at A/B Tests: Why it matters, and what to do about it","Ramesh Johari, Pete Koomen, Leonid Pekelis, David Walsh, ","This paper reports on novel statistical methodology, which has been deployed by the commercial A/B testing platform Optimizely to communicate experimental results to their customers. Our methodology addresses the issue that traditional p-values and confidence intervals give unreliable inference. This is because users of A/B testing software are known to continuously monitor these measures as the experiment is running. We provide always valid p-values and confidence intervals that are provably robust to this effect. Not only does this make it safe for a user to continuously monitor, but it empowers her to detect true effects more efficiently. This paper provides simulations and numerical studies on Optimizely's data, demonstrating an improvement in detection performance over traditional methods."
kdd,None,PNP: Fast Path Ensemble Method for Movie Design,"Danai Koutra, Abhilash Dighe, Smriti Bhagat, Udi Weinsberg, ","How can we design a product or movie that will attract, for example, the interest of Pennsylvania adolescents or liberal newspaper critics? What should be the genre of that movie and who should be in the cast? In this work, we seek to identify how we can design new movies with features tailored to a specific user population. We formulate the movie design as an optimization problem over the inference of user-feature scores and selection of the features that maximize the number of attracted users. Our approach, PNP, is based on a heterogeneous, tripartite graph of users, movies, and features (e.g. actors, directors, genres), where users rate movies and features contribute to movies. We learn the preferences by leveraging user similarities defined through different types of relations, and show that our method outperforms state-of-the-art approaches, including matrix factorization and other heterogeneous graph-based analysis. We evaluate PNP on publicly available real-world data and show that it is highly scalable and effectively provides movie designs oriented towards different groups of users, including men, women, and adolescents."
kdd,None,Pharmacovigilance via Baseline Regularization with Large-Scale Longitudinal Observational Data,"Zhaobin Kuang, Peggy Peissig, Vitor Santos Costa, Richard Maclin, ","Several prominent public health incidents that occurred at the beginning of this century due to adverse drug events (ADEs) have raised international awareness of governments and industries about pharmacovigilance (PhV), the science and activities to monitor and prevent adverse events caused by pharmaceutical products after they are introduced to the market. A major data source for PhV is large-scale longitudinal observational databases (LODs) such as electronic health records (EHRs) and medical insurance claim databases. Inspired by the Multiple Self-Controlled Case Series (MSCCS) model, arguably the leading method for ADE discovery from LODs, we propose baseline regularization, a regularized generalized linear model that leverages the diverse health profiles available in LODs across different individuals at different times. We apply the proposed method as well as MSCCS to the Marshfield Clinic EHR. Experimental results suggest that incorporating the heterogeneity among different patients and different times help to improve the performance in identifying benchmark ADEs from the Observational Medical Outcomes Partnership ground truth"
kdd,None,FLAP: An End-to-End Event Log Analysis Platform for System Management,"Tao Li, Yexi Jiang, Chunqiu Zeng, Bin Xia, Zheng Liu, Wubai Zhou, ","Many systems, such as distributed operating systems, complex networks, and high throughput web-based applications, are continuously generating large volume of event logs. These logs contain useful information to help system administrators to understand the system running status and to pinpoint the system failures. Generally, due to the scale and complexity of modern systems, the generated logs are beyond the analytic power of human beings. Therefore, it is imperative to develop a comprehensive log analysis system to support effective system management. Although a number of log mining techniques have been proposed to address specific log analysis use cases, few research and industrial efforts have been paid on providing integrated systems with an end-to-end solution to facilitate the log analysis routines."
kdd,None,Cascade Ranking for Operational E-commerce Search,"Shichen Liu, Fei Xiao, Wenwu Ou, Luo Si, ","In the 'Big Data' era, many real-world applications like search involve the ranking problem for a large number of items. It is important to obtain effective ranking results and at the same time obtain the results efficiently in a timely manner for providing good user experience and saving computational costs. Valuable prior research has been conducted for learning to efficiently rank like the cascade ranking (learning) model, which uses a sequence of ranking functions to progressively filter some items and rank the remaining items. However, most existing research of learning to efficiently rank in search is studied in a relatively small computing environments with simulated user queries."
kdd,None,Developing a Comprehensive Framework for Multimodal Feature Extraction,"Quinten McNamara, Alejandro De La Vega, Tal Yarkoni, ","Feature extraction is a critical component of many applied data science workflows. In recent years, rapid advances in artificial intelligence and machine learning have led to an explosion of feature extraction tools and services that allow data scientists to cheaply and effectively annotate their data along a vast array of dimensions--ranging from detecting faces in images to analyzing the sentiment expressed in coherent text. Unfortunately, the proliferation of powerful feature extraction services has been mirrored by a corresponding expansion in the number of distinct interfaces to feature extraction services. In a world where nearly every new service has its own API, documentation, and/or client library, data scientists who need to combine diverse features obtained from multiple sources are often forced to write and maintain ever more elaborate feature extraction pipelines. To address this challenge, we introduce a new open-source framework for comprehensive multimodal feature extraction. Pliers is an open-source Python package that supports standardized annotation of diverse data types (videos, images, audio, and text), and is expressly implemented with both ease-of-use and extensibility in mind. Users can apply a wide range of pre-existing feature extraction tools to their data in just a few lines of Python code, and can also easily add their own custom extractors by writing modular classes. A graph-based API enables rapid development of feature extraction pipelines that output results in a single, standardized format. We describe the package's architecture, detail its advantages over previous feature extraction toolboxes, and use a sample application to a large functional MRI dataset to illustrate how pliers can significantly reduce the time and effort required to construct simple feature extraction workflows while increasing code clarity and maintainability."
kdd,None,Deep Choice Model Using Pointer Networks for Airline Itinerary Prediction,"Alejandro Mottini, Rodrigo Acuna-Agost, ","Travel providers such as airlines and on-line travel agents are becoming more and more interested in understanding how passengers choose among alternative itineraries when searching for flights. This knowledge helps them better display and adapt their offer, taking into account market conditions and customer needs. Some common applications are not only filtering and sorting alternatives, but also changing certain attributes in real-time (e.g., changing the price). In this paper, we concentrate with the problem of modeling air passenger choices of flight itineraries. This problem has historically been tackled using classical Discrete Choice Modelling techniques. Traditional statistical approaches, in particular the Multinomial Logit model (MNL), is widely used in industrial applications due to its simplicity and general good performance. However, MNL models present several shortcomings and assumptions that might not hold in real applications. To overcome these difficulties, we present a new choice model based on Pointer Networks. Given an input sequence, this type of deep neural architecture combines Recurrent Neural Networks with the Attention Mechanism to learn the conditional probability of an output whose values correspond to positions in an input sequence. Therefore, given a sequence of different alternatives presented to a customer, the model can learn to point to the one most likely to be chosen by the customer. The proposed method was evaluated on a real dataset that combines on-line user search logs and airline flight bookings. Experimental results show that the proposed model outperforms the traditional MNL model on several metrics."
kdd,None,Compass: Spatio Temporal Sentiment Analysis of US Election What Twitter Says!,"Debjyoti Paul, Feifei Li, Murali Krishna Teja, Xin Yu, Richie Frost, ","With the widespread growth of various social network tools and platforms, analyzing and understanding societal response and crowd reaction to important and emerging social issues and events through social media data is increasingly an important problem. However, there are numerous challenges towards realizing this goal effectively and efficiently, due to the unstructured and noisy nature of social media data. The large volume of the underlying data also presents a fundamental challenge. Furthermore, in many application scenarios, it is often interesting, and in some cases critical, to discover patterns and trends based on geographical and/or temporal partitions, and keep track of how they will change overtime."
kdd,None,Backpage and Bitcoin: Uncovering Human Traffickers,"Rebecca S. Portnoff, Danny Yuxing Huang, Periwinkle Doerfler, ","Sites for online classified ads selling sex are widely used by human traffickers to support their pernicious business. The sheer quantity of ads makes manual exploration and analysis unscalable. In addition, discerning whether an ad is advertising a trafficked victim or an independent sex worker is a very difficult task. Very little concrete ground truth (i.e., ads definitively known to be posted by a trafficker) exists in this space. In this work, we develop tools and techniques that can be used separately and in conjunction to group sex ads by their true owner (and not the claimed author in the ad). Specifically, we develop a machine learning classifier that uses stylometry to distinguish between ads posted by the same vs. different authors with 90% TPR and 1% FPR. We also design a linking technique that takes advantage of leakages from the Bitcoin mempool, blockchain and sex ad site, to link a subset of sex ads to Bitcoin public wallets and transactions. Finally, we demonstrate via a 4-week proof of concept using Backpage as the sex ad site, how an analyst can use these automated approaches to potentially find human traffickers."
kdd,None,Not All Passes Are Created Equal: Objectively Measuring the Risk and Reward of Passes in Soccer from Tracking Data,"Paul Power, Hector Ruiz, Xinyu Wei, Patrick Lucey, ","In soccer, the most frequent event that occurs is a pass. For a trained eye, there are a myriad of adjectives which could describe this event (e.g., ""majestic pass"", ""conservative"" to ""poor-ball""). However, as these events are needed to be coded live and in real-time (most often by human annotators), the current method of grading passes is restricted to the binary labels 0 (unsuccessful) or 1 (successful). Obviously, this is sub-optimal because the quality of a pass needs to be measured on a continuous spectrum (i.e., 0 to 100%) and not a binary value. Additionally, a pass can be measured across multiple dimensions, namely: i) risk -- the likelihood of executing a pass in a given situation, and ii) reward -- the likelihood of a pass creating a chance. In this paper, we show how we estimate both the risk and reward of a pass across two seasons of tracking data captured from a recent professional soccer league with state-of-the-art performance, then showcase various use cases of our deployed passing system."
kdd,None,MARAS: Signaling Multi-Drug Adverse Reactions,"Xiao Qin, Tabassum Kakar, Susmitha Wunnava, ","There is a growing need for computing-supported methods that facilitate the automated signaling of Adverse Drug Reactions (ADRs) otherwise left undiscovered from the exploding amount of ADR reports filed by patients, medical professionals and drug manufacturers. In this research, we design a Multi-Drug Adverse Reaction Analytics Strategy, called MARAS, to signal severe unknown ADRs triggered by the usage of a combination of drugs, also known as Multi-Drug Adverse Reactions (MDAR). First, MARAS features an efficient signal generation algorithm based on association rule learning that extracts non-spurious MDAR associations. Second, MARAS incorporates contextual information to detect drug combinations that are strongly associated with a set of ADRs. It groups related associations into Contextual Association Clusters (CACs) that then avail contextual information to evaluate the significance of the discovered MDAR Associations. Lastly, we use this contextual significance to rank discoveries by their notion of interestingness to signal the most compelling MDARs. To demonstrate the utility of MARAS, it is compared with state-of-the-art techniques and evaluated via case studies on datasets collected by U.S. Food and Drug Administration Adverse Event Reporting System (FAERS)."
kdd,None,A Practical Exploration System for Search Advertising,"Parikshit Shah, Ming Yang, Sachidanand Alle, Adwait Ratnaparkhi, ","In this paper, we describe an exploration system that was implemented by the search-advertising team of a prominent web-portal to address the cold ads problem. The cold ads problem refers to the situation where, when new ads are injected into the system by advertisers, the system is unable to assign an accurate quality to the ad (in our case, the click probability). As a consequence, the advertiser may suffer from low impression volumes for these cold ads, and the overall system may perform sub-optimally if the click probabilities for new ads are not learnt rapidly. We designed a new exploration system that was adapted to search advertising and the serving constraints of the system. In this paper, we define the problem, discuss the design details of the exploration system, new evaluation criteria, and present the performance metrics that were observed by us."
kdd,None,MOLIERE: Automatic Biomedical Hypothesis Generation System,"Justin Sybrandt, Michael Shtutman, Ilya Safro, ","Hypothesis generation is becoming a crucial time-saving technique which allows biomedical researchers to quickly discover implicit connections between important concepts. Typically, these systems operate on domain-specific fractions of public medical data. MOLIERE, in contrast, utilizes information from over 24.5 million documents and does not limit the document vocabulary. At the heart of our approach lies a multi-modal and multi-relational network of biomedical objects extracted from several heterogeneous datasets from the National Center for Biotechnology Information (NCBI). These objects include but are not limited to scientific papers, keywords, genes, proteins, diseases, and diagnoses. We model hypotheses using Latent Dirichlet Allocation applied on abstracts found near shortest paths discovered within this network. We demonstrate the effectiveness of MOLIERE by performing hypothesis generation on historical data. Our network, implementation, and resulting data are all publicly available for the broad scientific community."
kdd,None,Quick Access: Building a Smart Experience for Google Drive,"Sandeep Tata, Alexandrin Popescul, Marc Najork, Mike Colagrosso, ","Google Drive is a cloud storage and collaboration service used by hundreds of millions of users around the world. Quick Access is a new feature in Google Drive that surfaces the most relevant documents when a user visits the home screen. Our metrics show that users locate their documents in half the time with this feature compared to previous approaches. The development of Quick Access illustrates many general challenges and constraints associated with practical machine learning such as protecting user privacy, working with data services that are not designed with machine learning in mind, and evolving product definitions. We believe that the lessons learned from this experience will be useful to practitioners tackling a wide range of applied machine learning problems."
kdd,None,The Simpler The Better: A Unified Approach to Predicting Original Taxi Demands based on Large-Scale Online Platforms,"Yongxin Tong, Yuqiang Chen, Zimu Zhou, Lei Chen, Jie Wang, ","Taxi-calling apps are gaining increasing popularity for their efficiency in dispatching idle taxis to passengers in need. To precisely balance the supply and the demand of taxis, online taxicab platforms need to predict the Unit Original Taxi Demand (UOTD), which refers to the number of taxi-calling requirements submitted per unit time (e.g., every hour) and per unit region (e.g., each POI). Predicting UOTD is non-trivial for large-scale industrial online taxicab platforms because both accuracy and flexibility are essential. Complex non-linear models such as GBRT and deep learning are generally accurate, yet require labor-intensive model redesign after scenario changes (e.g., extra constraints due to new regulations). To accurately predict UOTD while remaining flexible to scenario changes, we propose LinUOTD, a unified linear regression model with more than 200 million dimensions of features. The simple model structure eliminates the need of repeated model redesign, while the high-dimensional features contribute to accurate UOTD prediction. We further design a series of optimization techniques for efficient model training and updating. Evaluations on two large-scale datasets from an industrial online taxicab platform verify that LinUOTD outperforms popular non-linear models in accuracy. We envision our experiences to adopt simple linear models with high-dimensional features in UOTD prediction as a pilot study and can shed insights upon other industrial large-scale spatio-temporal prediction problems."
kdd,None,DeepSD: Generating High Resolution Climate Change Projections through Single Image Super-Resolution,"Thomas Vandal, Evan Kodra, Sangram Ganguly, Andrew Michaelis, ","The impacts of climate change are felt by most critical systems, such as infrastructure, ecological systems, and power-plants. However, contemporary Earth System Models (ESM) are run at spatial resolutions too coarse for assessing effects this localized. Local scale projections can be obtained using statistical downscaling, a technique which uses historical climate observations to learn a low-resolution to high-resolution mapping. Depending on statistical modeling choices, downscaled projections have been shown to vary significantly terms of accuracy and reliability. The spatio-temporal nature of the climate system motivates the adaptation of super-resolution image processing techniques to statistical downscaling. In our work, we present DeepSD, a generalized stacked super resolution convolutional neural network (SRCNN) framework for statistical downscaling of climate variables. DeepSD augments SRCNN with multi-scale input channels to maximize predictability in statistical downscaling. We provide a comparison with Bias Correction Spatial Disaggregation as well as three Automated-Statistical Downscaling approaches in downscaling daily precipitation from 1 degree (~100km) to 1/8 degrees (~12.5km) over the Continental United States. Furthermore, a framework using the NASA Earth Exchange (NEX) platform is discussed for downscaling more than 20 ESM models with multiple emission scenarios."
