conference,url,title,authors,abstract
kdd,None,Anomaly Detection in Streams with Extreme Value Theory,"Alban Siffer, Pierre-Alain Fouque, Alexandre Termier, Christine Largouet, ","Anomaly detection in time series has attracted considerable attention due to its importance in many real-world applications including intrusion detection, energy management and finance. Most approaches for detecting outliers rely on either manually set thresholds or assumptions on the distribution of data according to Chandola, Banerjee and Kumar."
kdd,None,Relay-Linking Models for Prominence and Obsolescence in Evolving Networks,"Mayank Singh, Rajdeep Sarkar, Pawan Goyal, Animesh Mukherjee, ","The rate at which nodes in evolving social networks acquire links (friends, citations) shows complex temporal dynamics. Preferential attachment and link copying models, while enabling elegant analysis, only capture rich-gets-richer effects, not aging and decline. Recent aging models are complex and heavily parameterized; most involve estimating 1-3 parameters per node. These parameters are intrinsic: they explain decline in terms of events in the past of the same node, and do not explain, using the network, where the linking attention might go instead. We argue that traditional characterization of linking dynamics are insufficient to judge the faithfulness of models. We propose a new temporal sketch of an evolving graph, and introduce several new characterizations of a network's temporal dynamics. Then we propose a new family of frugal aging models with no per-node parameters and only two global parameters. Our model is based on a surprising inversion or undoing of triangle completion, where an old node relays a citation to a younger follower in its immediate vicinity. Despite very few parameters, the new family of models shows remarkably better fit with real data. Before concluding, we analyze temporal signatures for various research communities yielding further insights into their comparative dynamics. To facilitate reproducible research, we shall soon make all the codes and the processed dataset available in the public domain."
kdd,None,PAMAE: Parallel k-Medoids Clustering with High Accuracy and Efficiency,"Hwanjun Song, Jae-Gil Lee, Wook-Shin Han, ","The k-medoids algorithm is one of the best-known clustering algorithms. Despite this, however, it is not as widely used for big data analytics as the k-means algorithm, mainly because of its high computational complexity. Many studies have attempted to solve the efficiency problem of the k-medoids algorithm, but all such studies have improved efficiency at the expense of accuracy. In this paper, we propose a novel parallel k-medoids algorithm, which we call PAMAE, that achieves both high accuracy and high efficiency. We identify two factors---""global search"" and ""entire data""---that are essential to achieving high accuracy, but are also very time-consuming if considered simultaneously. Thus, our key idea is to apply them individually through two phases: parallel seeding and parallel refinement, neither of which is costly. The first phase performs global search over sampled data, and the second phase performs local search over entire data. Our theoretical analysis proves that this serial execution of the two phases leads to an accurate solution that would be achieved by global search over entire data. In order to validate the merit of our approach, we implement PAMAE on Spark as well as Hadoop and conduct extensive experiments using various real-world data sets on 12 Microsoft Azure machines (48 cores). The results show that PAMAE significantly outperforms most of recent parallel algorithms and, at the same time, produces a clustering quality as comparable as the previous most-accurate algorithm. The source code and data are available at https://github.com/jaegil/k-Medoid."
kdd,None,Sparse Compositional Local Metric Learning,"Joseph St.Amand, Jun Huan, ","Mahalanobis distance metric learning becomes an especially challenging problem as the dimension of the feature space p is scaled upwards. The number of parameters to optimize grows with space complexity of order O (p 2), making storage infeasible, interpretability poor, and causing the model to have a high tendency to overfit. Additionally, optimization while maintaining feasibility of the solution becomes prohibitively expensive, requiring a projection onto the positive semi-definite cone after every iteration. In addition to the obvious space and computational challenges, vanilla distance metric learning is unable to model complex and multi-modal trends in the data. Inspired by the recent resurgence of Frank-Wolfe style optimization, we propose a new method for sparse compositional local Mahalanobis distance metric learning. Our proposed technique learns a set of distance metrics which are composed of local and global components. We capture local interactions in the feature space, while ensuring that all metrics share a global component, which may act as a regularizer. We optimize our model using an alternating pairwise Frank-Wolfe style algorithm. This serves a dual purpose, we can control the sparsity of our solution, and altogether avoid any expensive projection operations. Finally, we conduct an empirical evaluation of our method with the current state of the art and present the results on five datasets from varying domains."
kdd,None,End-to-end Learning for Short Text Expansion,"Jian Tang, Yue Wang, Kai Zheng, Qiaozhu Mei, ","Effectively making sense of short texts is a critical task for many real world applications such as search engines, social media services, and recommender systems. The task is particularly challenging as a short text contains very sparse information, often too sparse for a machine learning algorithm to pick up useful signals. A common practice for analyzing short text is to first expand it with external information, which is usually harvested from a large collection of longer texts. In literature, short text expansion has been done with all kinds of heuristics. We propose an end-to-end solution that automatically learns how to expand short text to optimize a given learning task. A novel deep memory network is proposed to automatically find relevant information from a collection of longer documents and reformulate the short text through a gating mechanism. Using short text classification as a demonstrating task, we show that the deep memory network significantly outperforms classical text expansion methods with comprehensive experiments on real world data sets."
kdd,None,Construction of Directed 2K Graphs,"Bálint Tillman, Athina Markopoulou, Carter T. Butts, Minas Gjoka, ","We study the problem of generating synthetic graphs that resemble real-world directed graphs in terms of their degree correlations. In order to capture degree correlation specifically for directed graphs, we define directed 2K (D2K) as those graphs with a given directed degree sequence (DDS) and a given target joint degree and attribute matrix (JDAM). We provide necessary and sufficient conditions for a target D2K to be realizable and we design an efficient algorithm that generates graph realizations with exactly the target D2K. We apply our algorithm to generate synthetic graphs that target real-world directed graphs (such as Twitter), and we demonstrate its benefits compared to state-of-the-art construction algorithms."
kdd,None,Optimized Risk Scores,"Berk Ustun, Cynthia Rudin, ","Risk scores are simple classification models that let users quickly assess risk by adding, subtracting, and multiplying a few small numbers. Such models are widely used in healthcare and criminal justice, but are often built ad hoc. In this paper, we present a principled approach to learn risk scores that are fully optimized for feature selection, integer coefficients, and operational constraints. We formulate the risk score problem as a mixed integer nonlinear program, and present a new cutting plane algorithm to efficiently recover its optimal solution. Our approach can fit optimized risk scores in a way that scales linearly with the sample size of a dataset, provides a proof of optimality, and obeys complex constraints without parameter tuning. We illustrate these benefits through an extensive set of numerical experiments, and an application where we build a customized risk score for ICU seizure prediction."
kdd,None,A Location-Sentiment-Aware Recommender System for Both Home-Town and Out-of-Town Users,"Hao Wang, Yanmei Fu, Qinyong Wang, Hongzhi Yin, ","Spatial item recommendation has become an important means to help people discover interesting locations, especially when people pay a visit to unfamiliar regions. Some current researches are focusing on modelling individual and collective geographical preferences for spatial item recommendation based on users' check-in records, but they fail to explore the phenomenon of user interest drift across geographical regions, i.e., users would show different interests when they travel to different regions. Besides, they ignore the influence of public comments for subsequent users' check-in behaviors. Specifically, it is intuitive that users would refuse to check in to a spatial item whose historical reviews seem negative overall, even though it might fit their interests. Therefore, it is necessary to recommend the right item to the right user at the right location. In this paper, we propose a latent probabilistic generative model called LSARS to mimic the decision-making process of users' check-in activities both in home-town and out-of-town scenarios by adapting to user interest drift and crowd sentiments, which can learn location-aware and sentiment-aware individual interests from the contents of spatial items and user reviews. Due to the sparsity of user activities in out-of-town regions, LSARS is further designed to incorporate the public preferences learned from local users' check-in behaviors. Finally, we deploy LSARS into two practical application scenes: spatial item recommendation and target user discovery. Extensive experiments on two large-scale location-based social networks (LBSNs) datasets show that LSARS achieves better performance than existing state-of-the-art methods."
kdd,None,Adversary Resistant Deep Neural Networks with an Application to Malware Detection,"Qinglong Wang, Wenbo Guo, Kaixuan Zhang, Alexander G. Ororbia, ","Outside the highly publicized victories in the game of Go, there have been numerous successful applications of deep learning in the fields of information retrieval, computer vision, and speech recognition. In cybersecurity, an increasing number of companies have begun exploring the use of deep learning (DL) in a variety of security tasks with malware detection among the more popular. These companies claim that deep neural networks (DNNs) could help turn the tide in the war against malware infection. However, DNNs are vulnerable to adversarial samples, a shortcoming that plagues most, if not all, statistical and machine learning models. Recent research has demonstrated that those with malicious intent can easily circumvent deep learning-powered malware detection by exploiting this weakness."
kdd,None,Multi-Modality Disease Modeling via Collective Deep Matrix Factorization,"Qi Wang, Mengying Sun, Liang Zhan, Paul Thompson, ","Alzheimer's disease (AD), one of the most common causes of dementia, is a severe irreversible neurodegenerative disease that results in loss of mental functions. The transitional stage between the expected cognitive decline of normal aging and AD, mild cognitive impairment (MCI), has been widely regarded as a suitable time for possible therapeutic intervention. The challenging task of MCI detection is therefore of great clinical importance, where the key is to effectively fuse predictive information from multiple heterogeneous data sources collected from the patients. In this paper, we propose a framework to fuse multiple data modalities for predictive modeling using deep matrix factorization, which explores the non-linear interactions among the modalities and exploits such interactions to transfer knowledge and enable high performance prediction. Specifically, the proposed collective deep matrix factorization decomposes all modalities simultaneously to capture non-linear structures of the modalities in a supervised manner, and learns a modality specific component for each modality and a modality invariant component across all modalities. The modality invariant component serves as a compact feature representation of patients that has high predictive power. The modality specific components provide an effective means to explore imaging genetics, yielding insights into how imaging and genotype interact with each other non-linearly in the AD pathology. Extensive empirical studies using various data modalities provided by Alzheimer's Disease Neuroimaging Initiative (ADNI) demonstrate the effectiveness of the proposed method for fusing heterogeneous modalities."
kdd,None,Decomposed Normalized Maximum Likelihood Codelength Criterion for Selecting Hierarchical Latent Variable Models,"Tianyi Wu, Shinya Sugawara, Kenji Yamanishi, ","We propose a new model selection criterion based on the minimum description length principle in a name of the decomposed normalized maximum likelihood criterion. Our criterion can be applied to a large class of hierarchical latent variable models, such as the Naive Bayes models, stochastic block models and latent Dirichlet allocations, for which many conventional information criteria cannot be straightforwardly applied due to irregularity of latent variable models. Our method also has an advantage that it can be exactly evaluated without asymptotic approximation with small time complexity. Our experiments using synthetic and real data demonstrated validity of our method in terms of computational efficiency and model selection accuracy, while our criterion especially dominated the other criteria when sample size is small and when data are noisy."
kdd,None,Structural Event Detection from Log Messages,"Fei Wu, Pranay Anchuri, Zhenhui Li, ","A wide range of modern web applications are only possible because of the composable nature of the web services they are built upon. It is, therefore, often critical to ensure proper functioning of these web services. As often, the server-side of web services is not directly accessible, several log message based analysis have been developed to monitor the status of web services. Existing techniques focus on using clusters of messages (log patterns) to detect important system events. We argue that meaningful system events are often representable by groups of cohesive log messages and the relationships among these groups. We propose a novel method to mine structural events as directed workflow graphs (where nodes represent log patterns, and edges represent relations among patterns). The structural events are inclusive and correspond to interpretable episodes in the system. The problem is non-trivial due to the nature of log data: (i) Individual log messages contain limited information, and (ii) Log messages in a large scale web system are often interleaved even though the log messages from individual components are ordered. As a result, the patterns and relationships mined directly from the messages and their ordering can be erroneous and unreliable in practice. Our solution is based on the observation that meaningful log patterns and relations often form workflow structures that are connected. Our method directly models the overall quality of structural events. Through both qualitative and quantitative experiments on real world datasets, we demonstrate the effectiveness and the expressiveness of our event detection method."
kdd,None,Retrospective Higher-Order Markov Processes for User Trails,"Tao Wu, David F. Gleich, ","Users form information trails as they checkin with a geolocation, rate items, or consume media. A common problem is to predict what a user might do next for the purposes of guidance, recommendation, or prefetching. Markov chains models have been widely used methods to study such sequences of data. First-order Markov chains are easy to estimate, but lack accuracy when history matters. Higher-order Markov chains, in contrast, have too many parameters and suffer from overfitting the training data. Fitting these parameters with regularization and smoothing only offers mild improvements. In this paper we propose the retrospective higher-order Markov process (RHOMP) as a low-parameter model for such sequences. This model is a special case of a higher-order Markov chain where the transitions depend retrospectively on a single history state instead of an arbitrary combination of history states. There are two immediate computational advantages: the number of parameters is linear in the order of the Markov chain and the model can be fit to large state spaces. Furthermore, by providing a specific structure to the higher-order chain, RHOMPs improve the model accuracy by efficiently utilizing history states without risks of overfitting the data. We demonstrate how to estimate a RHOMP from data and we demonstrate the effectiveness of our method on various real application datasets spanning geolocation data, review sequences, and business locations. The RHOMP model uniformly outperforms higher-order Markov chains, Kneser-Ney regularization, and tensor factorizations in terms of prediction accuracy."
kdd,None,Privacy-Preserving Distributed Multi-Task Learning with Asynchronous Updates,"Liyang Xie, Inci M. Baytas, Kaixiang Lin, Jiayu Zhou, ","Many data mining applications involve a set of related learning tasks. Multi-task learning (MTL) is a learning paradigm that improves generalization performance by transferring knowledge among those tasks. MTL has attracted so much attention in the community, and various algorithms have been successfully developed. Recently, distributed MTL has also been studied for related tasks whose data is distributed across different geographical regions. One prominent challenge of the distributed MTL frameworks is to maintain the privacy of the data. The distributed data may contain sensitive and private information such as patients' records and registers of a company. In such cases, distributed MTL frameworks are required to preserve the privacy of the data. In this paper, we propose a novel privacy-preserving distributed MTL framework to address this challenge. A privacy-preserving proximal gradient algorithm, which asynchronously updates models of the learning tasks, is introduced to solve a general class of MTL formulations. The proposed asynchronous approach is robust against network delays and provides a guaranteed differential privacy through carefully designed perturbation. Theoretical guarantees of the proposed algorithm are derived and supported by the extensive experimental results."
kdd,None,"Evaluating U.S. Electoral Representation with a Joint Statistical Model of Congressional Roll-Calls, Legislative Text, and Voter Registration Data","Zhengming Xing, Sunshine Hillygus, Lawrence Carin, ","Extensive information on 3 million randomly sampled United States citizens is used to construct a statistical model of constituent preferences for each U.S. congressional district. This model is linked to the legislative voting record of the legislator from each district, yielding an integrated model for constituency data, legislative roll-call votes, and the text of the legislation. The model is used to examine the extent to which legislators' voting records are aligned with constituent preferences, and the implications of that alignment (or lack thereof) on subsequent election outcomes. The analysis is based on a Bayesian formalism, with fast inference via a stochastic variational Bayesian analysis."
kdd,None,Convex Factorization Machine for Toxicogenomics Prediction,"Makoto Yamada, Wenzhao Lian, Amit Goyal, Jianhui Chen, ","We introduce the convex factorization machine (CFM), which is a convex variant of the widely used Factorization Machines (FMs). Specifically, we employ a linear+quadratic model and regularize the linear term with the ℓ2-regularizer and the quadratic term with the trace norm regularizer. Then, we formulate the CFM optimization as a semidefinite programming problem and propose an efficient optimization procedure with Hazan's algorithm. A key advantage of CFM over existing FMs is that it can find a globally optimal solution, while FMs may get a poor locally optimal solution since the objective function of FMs is non-convex. In addition, the proposed algorithm is simple yet effective and can be implemented easily. Finally, CFM is a general factorization method and can also be used for other factorization problems, including multi-view matrix factorization and tensor completion problems, in various domains including toxicogenomics and bioinformatics. Through synthetic and traditionally used movielens datasets, we first show that the proposed CFM achieves results competitive to FMs. We then show in a toxicogenomics prediction task that CFM predicts the toxic outcomes of a collection of drugs better than a state-of-the-art tensor factorization method."
kdd,None,Distributed Local Outlier Detection in Big Data,"Yizhou Yan, Lei Cao, Caitlin Kulhman, Elke Rundensteiner, ","In this work, we present the first distributed solution for the Local Outlier Factor (LOF) method -- a popular outlier detection technique shown to be very effective for datasets with skewed distributions. As datasets increase radically in size, highly scalable LOF algorithms leveraging modern distributed infrastructures are required. This poses significant challenges due to the complexity of the LOF definition, and a lack of access to the entire dataset at any individual compute machine. Our solution features a distributed LOF pipeline framework, called DLOF. Each stage of the LOF computation is conducted in a fully distributed fashion by leveraging our invariant observation for intermediate value management. Furthermore, we propose a data assignment strategy which ensures that each machine is self-sufficient in all stages of the LOF pipeline, while minimizing the number of data replicas. Based on the convergence property derived from analyzing this strategy in the context of real world datasets, we introduce a number of data-driven optimization strategies. These strategies not only minimize the computation costs within each stage, but also eliminate unnecessary communication costs by aggressively pushing the LOF computation into the early stages of the DLOF pipeline. Our comprehensive experimental study using both real and synthetic datasets confirms the efficiency and scalability of our approach to terabyte level data."
kdd,None,Scalable Top-n Local Outlier Detection,"Yizhou Yan, Lei Cao, Elke A. Rundensteiner, ","Local Outlier Factor (LOF) method that labels all points with their respective LOF scores to indicate their status is known to be very effective for identifying outliers in datasets with a skewed distribution. Since outliers by definition are the absolute minority in a dataset, the concept of Top-N local outlier was proposed to discover the n points with the largest LOF scores. The detection of the Top-N local outliers is prohibitively expensive, since it requires huge number of high complexity k-nearest neighbor (kNN) searches. In this work, we present the first scalable Top-N local outlier detection approach called TOLF. The key innovation of TOLF is a multi-granularity pruning strategy that quickly prunes most points from the set of potential outlier candidates without computing their exact LOF scores or even without conducting any kNN search for them. Our customized density-aware indexing structure not only effectively supports the pruning strategy, but also accelerates the $k$NN search. Our extensive experimental evaluation on OpenStreetMap, SDSS, and TIGER datasets demonstrates the effectiveness of TOLF - up to 35 times faster than the state-of-the-art methods."
kdd,None,Bridging Collaborative Filtering and Semi-Supervised Learning: A Neural Approach for POI Recommendation,"Carl Yang, Lanxiao Bai, Chao Zhang, Quan Yuan, Jiawei Han, ","Recommender system is one of the most popular data mining topics that keep drawing extensive attention from both academia and industry. Among them, POI (point of interest) recommendation is extremely practical but challenging: it greatly benefits both users and businesses in real-world life, but it is hard due to data scarcity and various context. While a number of algorithms attempt to tackle the problem w.r.t. specific data and problem settings, they often fail when the scenarios change. In this work, we propose to devise a general and principled SSL (semi-supervised learning) framework, to alleviate data scarcity via smoothing among neighboring users and POIs, and treat various context by regularizing user preference based on context graphs. To enable such a framework, we develop PACE (Preference And Context Embedding), a deep neural architecture that jointly learns the embeddings of users and POIs to predict both user preference over POIs and various context associated with users and POIs. We show that PACE successfully bridges CF (collaborative filtering) and SSL by generalizing the de facto methods matrix factorization of CF and graph Laplacian regularization of SSL. Extensive experiments on two real location-based social network datasets demonstrate the effectiveness of PACE."
